segment-id,segment-type,segment-speaker,segment-text
scene1,slugline,,TITLE SEQUENCE OVER MUSIC
desc1.0,desc,,"A series of tight CLOSE-UP shots of dancers moving in high energy fast paced sexy choreography. Very provocative. Legs. Arms. Butts. Boas. Sequins. Costumes. High heels. A kaleidoscope of images and colors. END TITLES ON A BLACK SCREEN FADE IN sounds of PEOPLE TALKING -- GLASSES CLINKING -- all the BACKGROUND SOUNDS of a BUSY, HIP NIGHTCLUB. SUDDENLY.. .a loud DRUM ROLL. CAMERA is low, moving through BACKSTAGE, passing CURTAINS and the WINGS, flying out onto a shiny black STAGE awash in light. PUSH IN on FOOTLIGHTS which are now blinding us, blasting into camera as they form the word..."
scene2,slugline,,BURLESQUE
desc2.1,desc,,"DRUM ROLL ends with a CYMBAL CRASH. The SCREEN goes BLACK. Then we hear an opening MUSIC ""INTRO"", a bawdy QUARTET. EXTREME CLOSE UP: RED LUSCIOUS LIPS... speaking directly into CAMERA in a smoky, sultry voice."
utter2.2,utter,TESS,"Once upon a time ...a long, looong time ago... there was a good little girl...and they called her..."
desc2.3,desc,,"REVEAL ...TESS. A stunner with impossibly long lashes, theatrical make-up and a sequined, skin-tight band-aid of a dress. She works the tight stage of the club, toying with the AUDIENCE."
utter2.4,utter,TESS (CONT'D),Burlesque.
desc2.5,desc,,"MUSIC BLARES from a HOT YOUNG BUMPER BAND -- sax, drums, bass -- wearing bowler hats, suspenders and lots of ink. The crowd HOOTS. Lame streamers EXPLODE from the stage."
utter2.6,utter,TESS (CONT'D),Some say she up and died-of neglect. Abandonment. (WHISPER) .old age.
desc2.7,desc,,The club's red booths are about half-full with a hip crowd. Walls cluttered with photos. Celebrities tucked in shadows.
utter2.8,utter,TESS (CONT'D),"But I say...no matter how hard you try, you can't keep a good girl down. And I've got a bevy of 'em."
scene3,slugline,,INT. BACKSTAGE DRESSING ROOM - CONTINUOUS
desc3.9,desc,,"A DOZEN gorgeous, leggy GIRLS fight for the mirror. Miles of skin. Heavy make-up. Lashes. Boobs. Butts. Fishnets. Boas. And SEQUINS. Oceans of them. It's definitely decadent. Completely cabaret."
utter3.10,utter,TESS (O.S.),"Come to think of it, none of them are all that good, which isn't all that bad... SEAN (31), a cute gay guy with an armful of accessories"
desc3.11,desc,,"pushes his way through the girls and in a blur, tightens a corset, tosses a boa, adjusts a garter just so."
utter3.12,utter,TESS (O.S.) (CONT'D),Eight shows a week. Sixteen gorgeous girls. Thirty-two towers of luscious legs...
scene4,slugline,,BACK ON TESS --
desc4.13,desc,,"Behind her, our GIRLS slink onto the stage one by one."
utter4.14,utter,TESS (CONT'D),Say hello to Scarlett. Jesse. Anna. Coco-puff. And Georgie-Girl.
desc4.15,desc,,"The girls gather at the edge of the stage, lit by footlights, moving in place to the beat of the INTRO MUSIC. Hips sway. Fingers snap. Tess weaves playfully between them."
utter4.16,utter,TESS (CONT'D),"All of them the creme-de la creme. (CYMBAL CRASH) De la creme. The girls strike nasty, (but funny) provocative poses, etc..."
utter4.17,utter,TESS (CONT'D),"Each one a bastion of bodacious... (Coco bends over, peers between her legs) Elegance. TWO GIRLS upside down on chairs NAIL aerial splits."
utter4.18,utter,TESS (CONT'D),Not to mention their other... (smacks Coco on the ass) Ass-ets.
desc4.19,desc,,"Coco raises a brow, moves her butt to a LOUD BUMP-AND-GRIND."
utter4.20,utter,TESS (CONT'D),"Welcome to the Burlesque Lounge, dead smack in the center of the Sunset Strip-- did I say ""strip?"" (cat calls from audience) I meant TEASE..."
desc4.21,desc,,"FOOTLIGHTS FLARE, UPLIGHTING THE GIRLS. They shift their weight, hitting the beats with risque moves and hip-thrusts as they MOVE DOWNSTAGE suggestively toward the audience to the MUSIC..."
scene5,slugline,,"EXT. MAIN STREET, GRUNDY, IOWA - NIGHT"
desc5.22,desc,,"A small, grime-streaked steel town, hanging on by the skin of its teeth. Boarded-up storefronts, a run-down A&P. CAMERA MOVES past an old sign: WELCOME TO GRUNDY!!! and lands on a broken neon sign that reads ""DWIG 'S BAR"" It flickers so you can read the name: DWIGHT'S. Then goes back to DWIG."
scene6,slugline,,INT. DWIGHT'S BAR - SAME
desc6.23,desc,,"Chipped paint. Old beer posters. A few pathetic customers. Beer on tap. Pinball standing lonely in the corner. A REGULAR drains his beer, tosses down a quarter and starts to leave. Someone stops short at the table."
utter6.24,utter,ALI,"Uh, excuse me? You forgot something."
desc6.25,desc,,"He turns. Sees: ALI ROSE. One hand holding a bar rag, the other planted on her hip. Ali has a look that's all her own: short shorts, white platform sandals, hair piled up high, more make-up than the rest of Grundy's women combined. She's young -- 22 -- but has a confidence that's got nothing to do with age."
utter6.26,utter,REGULAR,"No, that's your tip."
utter6.27,utter,ALI,"Huh. See, now that's interesting -- you and I must do math completely differently, cause me? I start with the six beers I brought you, add the four spills I cleaned up, the five times I refilled your peanuts, plus the three times you ""accidentally"" touched my ass, then I tack on lying to your wife when she called looking for you, twice, and I come up with a sum that's a hell of a lot more than twenty-five cents."
desc6.28,desc,,"Before the Regular can respond, Ali is joined by LORETTA -- 30's wearing every one of those years hard."
utter6.29,utter,LORETTA,"She's just teasing, Ike. You go on home now, and tell Kay I said hi."
desc6.30,desc,,The Regular leaves. Loretta picks up the quarter.
utter6.31,utter,LORETTA (CONT'D),It's better than nothing.
utter6.32,utter,ALI,Nothin's cheap. A quarter's an insult.
utter6.33,utter,LORETTA,It'll cover half a load down at the Spanky Clean.
utter6.34,utter,ALI,There's only one thing a quarter is good for.
desc6.35,desc,,"Ali takes the quarter and heads to the back of the room, passing a GEEZER who's sitting by himself, drinking alone."
utter6.36,utter,LORETTA,"Oh no, hon, now you know how Dwight feels about that."
utter6.37,utter,ALI,Dwight isn't here.
desc6.38,desc,,Ali stops in front of the rinky-dink karaoke machine.
utter6.39,utter,LORETTA,He could come back any minute.
utter6.40,utter,ALI,Tough. I'm not working here for the tips Loretta.
desc6.41,desc,,"She pops the quarter into the machine and chooses a song. She picks up the microphone and, after a few opening beats, starts singing ETTA JAMES'S ""SOMETHING'S GOT A HOLD ON ME""."
utter6.42,utter,ALI (CONT'D),"OOOOOOOOOH, SOMETIMES I GET A GOOD"
desc6.43,desc,,"FEELING, Y-E-A-H And now we see where the confidence comes from. She's got a voice that's way too big for this town-- the kind that reaches way down inside you and rattles things loose. WE HEAR the same song continue as we INTERCUT with:"
scene7,slugline,,INT. BURLESQUE LOUNGE - ON STAGE - NIGHT
desc7.44,desc,,"The Girls undulate at the footlights as they sing the chorus: BURLESQUE GIRLS YEEEEEEEEAAAAAAAHHHHHH... WE INTERCUT: IN DWIGHT'S BAR, Ali is belting now. Loretta is torn between enjoying listening and watching the door for Dwight."
utter7.45,utter,ALI,"I GET A FEELING THAT I NEVER,"
desc7.46,desc,,"NEVER, NEVER HAD BEFORE, NO, NO ... ON THE BURLESQUE STAGE the Girls belt out a raucous chorus."
scene8,slugline,,BURLESQUE GIRLS
desc8.47,desc,,YEEEEEEEEAAAAAAAHHHHHH... As other ENTERTAINERS appear onstage:
utter8.48,utter,TESS,"The insatiable La Puccini Triplets! Death-defying daredevils Missy and Kitten DeVille! The Countess of contortion, Eva Destruction! And how about a little love for those bad boys of burlesque, our naughty- bawdy bumber band!"
desc8.49,desc,,"THE TATTOOED BAND blares as the troupe kicks in unison IN DWIGHT'S BAR, Ali sings, with a powerful vocal quality reminiscent of Etta James, Sarah Vaughn, Billy Holiday."
utter8.50,utter,ALI,"I JUST WANT TO TELL YOU RIGHT NOW,"
desc8.51,desc,,"THAT, OOOH ... ON THE BURLESQUE STAGE, the GIRLS and the BAND, loud and bawdy. BURLESQUE GIRLS OOOOOOOOOOOHHHHHHH!! IN DWIGHT'S BAR, Ali, letting loose now. Wailing."
desc8.52,desc,,"I BELIEVE, I REALLY DO BELIEVE THAT SOMETHING'S GOT A HOLD ON ME, YEAH. ON THE BURLESQUE STAGE, the BURLESQUE GIRLS move in a line toward the audience, confident, sexy. The BARTENDERS, WAITRESSES and people working at the club sing along. ALL OH ... IT MUST BE LOVE! BARTENDERS BA-DA, BA-DA, BA-DA: IN DWIGHT'S BAR, Ali, letting it rip. The Geezer sips his beer, unmoved."
desc8.53,desc,,"I'VE GOT A FEELING, I FEEL SO STRANGE. EVERYTHING ABOUT ME SEEMS TO HAVE CHANGED, STEP BY STEP, I GOT A BRAND NEW WALK, EVEN SOUND SWEETER WHEN I TALK. I SAID, OH. ON THE BURLESQUE STAGE, The Girls. BURLESQUE GIRLS IN DWIGHT'S BAR, Ali."
desc8.54,desc,,"OOOH. HEY BABY, IT MUST BE LOVE! ON THE BURLESQUE STAGE, The Girls form a line."
scene9,slugline,,BURLESQUE GIRLS
desc9.55,desc,,"YOU KNOW IT MUST BE LOVE. IN DWIGHT'S BAR, Ali sings."
desc9.56,desc,,"YOU KNOW IT WALK LIKE LOVE. IT TALK LIKE LOVE. IN THE MIDDLE OF THE NIGHT, MAKE ME FEEL ALRIGHT: IN THE BURLESQUE LOUNGE, The Girls, Tess, the other Entertainers, Busboys, Waitresses, Bartenders and entire company do a BIG FINISH. ALL BA-DA, BA-DA, BA-DA, BA-DA! IN DWIGHT'S BAR, Ali finishes the song. Loretta CLAPS. The Geezer, unimpressed, gets up and leaves."
utter9.57,utter,LORETTA,People around here wouldn't know talent if it bit 'em in the Danglies. Where you gotta go is Des Moines. They got karaoke bars where you can win a hundred bucks a night.
utter9.58,utter,ALI,"Loretta-- when I get out of this butt-hole of a town, I sure as shit won't be heading for Des Moines."
desc9.59,desc,,"She hops up onto the bar, spins around on her butt, one leg up in the air like a Varga girl, then hops down on the other side then gets back to work."
scene10,slugline,,INT. BURLESQUE LOUNGE - BACKSTAGE - NIGHT
desc10.60,desc,,"The audience is still applauding as the Performers crowd into the backstage area, squeezing past the Puccini Triplets preparing their act. Tess comes off stage and bumrushes Sean."
utter10.61,utter,TESS,Where the hell is Nikki?
utter10.62,utter,SEAN,"Rehab, if there's a God."
desc10.63,desc,,The BACKSTAGE DOOR BURSTS OPEN revealing--
utter10.64,utter,NIKKI,I heard that.
desc10.65,desc,,"Nikki, a stunning, feisty brunette, sashays in--"
utter10.66,utter,TESS,"Jesus, Nikki, you're later than Georgia's period! Where were you?"
utter10.67,utter,NIKKI,"Weave, wax, paws and claws."
desc10.68,desc,,"She drops her bag, quickly peels her clothes off, holds out her arms as Sean slips her corset onto her-- Tess eyes Nikki's body--"
utter10.69,utter,TESS,Hold it right there. Weigh in.
desc10.70,desc,,Nikki unwillingly steps on the scale. Tess shakes her head.
utter10.71,utter,TESS (CONT'D),Put on five pounds or I bump you.
desc10.72,desc,,Nikki protests as Sean double-takes at Georgia -- who FLITS BY with a slightly protruding belly.
scene11,slugline,,EXT. TRAILER PARK - IOWA - NIGHT
desc11.73,desc,,"Ali winds her way through the trailers, carrying a bag of take-out, with a swing in her step -- moving to music playing in her head. She reaches a double-wide, lets herself in."
utter11.74,utter,ALI,Nanna? Got your pot roast here!
scene12,slugline,,INT. ALI'S TRAILER - NIGHT
desc12.75,desc,,"TV noise. She comes in, kicks off her heels."
utter12.76,utter,ALI,"They were out of steak fries, so I got you some of those..."
desc12.77,desc,,"Then she stops in her tracks. Nanna -- 80's, housecoat, oxygen tank -- is slumped in her chair. The TV remote is on the floor. ""ENTERTAINMENT TONIGHT"" is blaring."
utter12.78,utter,ALI (CONT'D),Nanna?
scene13,slugline,,EXT. CEMETERY - IOWA - DAY
desc13.79,desc,,"Loretta and Ali, at the grave with a MINISTER who looks to be about 17. A CEMETERY WORKER is nearby, picking his teeth with a toothpick."
utter13.80,utter,YOUNG MINISTER,"Dear Lord, we gather here today not to mourn, but to celebrate the life of Alison Rose."
utter13.81,utter,ALI,Arlene.
utter13.82,utter,YOUNG MINISTER,What?
utter13.83,utter,ALI,She's Arlene. I'm Alison.
utter13.84,utter,YOUNG MINISTER,"Oh, shit. (then, befuddled) Can I start over?"
desc13.85,desc,,"Ali rolls her eyes. The Minister and the Cemetery worker walk away, leaving Ali and Loretta alone."
utter13.86,utter,LORETTA,"You were real good to her, Ali."
utter13.87,utter,ALI,"No, she was good to me. She rearranges the flowers resting on the plot, fixing it up."
utter13.88,utter,ALI (CONT'D),And she wasn't even my real Nanna.
utter13.89,utter,LORETTA,What...?
utter13.90,utter,ALI,"Foster care. She took me in for the checks. When I turned eighteen, the money stopped coming. She could've kicked me out, but she didn't. (BEAT) (MORE)"
utter13.91,utter,ALI (CONT'D),"She had a lot of pain at the end. Nothing she talked about, but I could tell."
utter13.92,utter,LORETTA,"Well, then I guess this is a blessing. Now she's free. ON ALI, thinking realizing:"
utter13.93,utter,ALI,(talking about herself) Yeah. I guess she is.
scene14,slugline,,INT. ALI'S TRAILER - DAY
desc14.94,desc,,"Nanna's clothes - mostly flowered housedresses -- are folded in paper bags. Her belongings are stacked up in the corner. CLOSE ON ALI'S MATTRESS, as she pulls a WAD OF CASH out from under it. HEAR MUSIC OVER: ""HONEY ROCK."""
scene15,slugline,,INT. BURLESQUE LOUNGE - ON STAGE - NIGHT
desc15.95,desc,,"Nikki leads a GROUP OF GIRLS in a raucous routine to ""HONEY ROCK"". Very Moulin Rouge. BURLESQUE GIRLS HONEY::: In the wings, Tess watches with Sean."
utter15.96,utter,TESS,Girls look good tonight.
utter15.97,utter,SEAN,Amazing what a pink spotlight can do. Hides more cellulite than a burka.
desc15.98,desc,,"GO, HONEY, GO!..'"
scene16,slugline,,INT. ALI'S TRAILER - DAY
desc16.99,desc,,"MOVE IN ON ALI, as she counts the money. Shit. Not enough. Then she looks around the trailer and realizes - tough shit. Stuffs the money in a pocket, then pulls out a suitcase."
scene17,slugline,,INT. BURLESQUE LOUNGE - ON STAGE - NIGHT
desc17.100,desc,,"The Burlesque Girls tease the crowd. BURLESQUE GIRLS GO, HONEY, GO!..'"
scene18,slugline,,INT. ALI'S TRAILER - DAY
desc18.101,desc,,"THE SUITCASE, as Ali throws in her belongings. When it's full, she grabs a stack of records -- Jazz and Soul -- tries to fit them into the suitcase, but it won't close. She picks one: ETTA JAMES. She sticks it in the suitcase and zips it up."
scene19,slugline,,INT. BURLESQUE LOUNGE - NIGHT
desc19.102,desc,,"BURLESQUE GIRLS OH, HONEY!"
scene20,slugline,,INT. ALI'S TRAILER - DAY
desc20.103,desc,,"Ali reaches into a drawer, pulls out a FRAMED PHOTO of A YOUNG WOMAN, 20's, short dress, heavy make-up, holding hands with a 7-year-old girl. Ali slips it into the suitcase pocket. She takes one last look around the trailer."
scene21,slugline,,BURLESQUE GIRLS (O.S.)
desc21.104,desc,,"GO, HONEY, GO!..'"
scene22,slugline,,EXT. GRUNDY MAIN STRIP - DAY
desc22.105,desc,,"CLOSE ON ALI'S WHITE PLATFORMS, strutting down the street."
scene23,slugline,,INT. DWIGHT'S BAR - DAY - MUSIC FADES OUT
desc23.106,desc,,"Ali enters. DWIGHT is at the bar: 50's, beer gut, humorless."
utter23.107,utter,DWIGHT,You're three days late.
utter23.108,utter,ALI,I had a death in the family.
utter23.109,utter,DWIGHT,"And what, people stop drinking cause your grandma died? Get your apron and get to work."
utter23.110,utter,ALI,I'm not here to work. I'm leaving.
utter23.111,utter,LORETTA,You are?
utter23.112,utter,ALI,Yeah. (TO DWIGHT) I just came for my back pay.
utter23.113,utter,DWIGHT,Payday's the end of the month.
utter23.114,utter,ALI,"But, I won't be here then. And you owe me for three weeks."
utter23.115,utter,DWIGHT,I don't owe anyone anything till the end of the month.
desc23.116,desc,,Ali sets down her suitcase and marches over to him.
utter23.117,utter,ALI,"You know what, Dwight? Contrary to what you've been told, there's no law in Grundy that says you have to spend every waking minute being a tight-fisted, cheap-ass prick --"
utter23.118,utter,LORETTA,"(trying to intercede) Ooh, hon, I'm not sure that particular approach is gonna --"
utter23.119,utter,ALI,I've spent three years of my life
utter23.120,utter,DWIGHT,"--And you'll probably spend another three. You want to quit? Good riddance. I'll replace you before you hit the county line, but I sure ain't gonna pay for the privilege."
desc23.121,desc,,"He walks out the back door, slamming it behind him. ANGLE ON: THE CASH REGISTER. Ali opens the drawer, pulls out a wad of cash. Peering out back to make sure Dwight isn't coming in, Ali counts out some money."
utter23.122,utter,LORETTA,What are you doing?
utter23.123,utter,ALI,I'm only taking what he owes me. (THEN) How much was that bike you been wanting for little Keith?
desc23.124,desc,,Ali STUFFS a few TWENTIES into Loretta's apron-- pockets the rest.
utter23.125,utter,LORETTA,Ali-- where are you gonna go?
utter23.126,utter,ALI,"Somewhere I can breathe. Now gimme a hug, I gotta get out of here before he gets back."
desc23.127,desc,,"Loretta hugs her tight, then looks Ali in the eye, concerned."
utter23.128,utter,LORETTA,You can't just head off into the sunset without a plan.
utter23.129,utter,ALI,(RESOLUTE) Watch me.
desc23.130,desc,,"Ali gives her one more hug, then grabs her bag and leaves."
scene24,slugline,,"MUSIC BACK UP: ""HONEY ROCK"" EXT. DOWNTOWN GRUNDY - DAY - CARRY MUSIC"
desc24.131,desc,,Ali takes off down the street. She passes TWO OLDER WOMEN waiting for a bus. A beat as they watch her pass. Then:
utter24.132,utter,OLDER WOMAN,She'll be back.
desc24.133,desc,,"As Ali heads off, we HEAR:"
scene25,slugline,,BURLESQUE GIRLS
desc25.134,desc,,"GO, HONEY, GO!..'"
scene26,slugline,,"INT. GREYHOUND BUS STATION - GRUNDY, IOWA - DAY"
desc26.135,desc,,Ali is at the ticket counter.
utter26.136,utter,ALI,How much to Los Angeles?
utter26.137,utter,TICKET BOOTH GUY,One way or round-trip?
utter26.138,utter,ALI,"You're kidding, right?"
scene27,slugline,,INT. BURLESQUE LOUNGE - ON STAGE - NIGHT - CARRY MUSIC
desc27.139,desc,,"Cabaret chairs as they DROP FROM THE CEILING. The girls CATCH them, SPIN them around, SLAM them down and LAND ON THEM IN VARIOUS LAYOUTS. IN THE WINGS, Tess hands Sean her corset as she slips into a slinky dress. He takes her cigarette holder and grips it between his teeth as he zips her in."
utter27.140,utter,SEAN,They're loving you tonight.
utter27.141,utter,TESS,They're loving you.
utter27.142,utter,SEAN,"Oh, shucks, I just tell myself I'm writing for a big old drag queen."
utter27.143,utter,TESS,Eat me.
desc27.144,desc,,As he heads off with her discarded costume:
utter27.145,utter,SEAN,A big old foul-mouthed drag queen!
desc27.146,desc,,"Tess looks in a mirror. As she makes the necessary adjustments, VINCE SCALI appears. 35, scruffy-handsome."
utter27.147,utter,VINCE,Good show tonight.
desc27.148,desc,,"She glances up, sees him. Gets icy. Goes back to primping."
utter27.149,utter,VINCE (CONT'D),Too bad the club's half-empty.
utter27.150,utter,TESS,Half-full.
utter27.151,utter,VINCE,I got another call from Marcus Gerber.
utter27.152,utter,TESS,And you told him we weren't selling.
utter27.153,utter,VINCE,He wants to raise his offer. I told him we'd hear him out.
desc27.154,desc,,"Tess spins around, looking him in the eye for the first time."
utter27.155,utter,TESS,"Vince, I don't care what the number is; the only way Marcus Gerber will get this club from me is by prying it out of my cold, dead, heavily- jeweled fingers."
desc27.156,desc,,She pivots away and sweeps into the club.
scene28,slugline,,BURLESQUE GIRLS
desc28.157,desc,,"OH, HONEY!!. Big finish, the number on stage ends."
scene29,slugline,,INT. GREYHOUND BUS - NIGHT
desc29.158,desc,,"Ali's on the bus, in a seat by herself. A LITTLE GIRL in front of her is peering over the chair, watching Ali. Ali smiles at her. The Little Girl's mother notices, gets the girl to sit down by tickling her. Ali unzips the pocket on her suitcase, takes out the FRAMED PHOTO of the mom and girl, looks at it. Then she looks out the window and watches America fly by as DAY TURNS TO NIGHT."
scene30,slugline,,EXT. CITY FREEWAY - DAY - THE BUS - SPEEDING BY
desc30.159,desc,,Over which we HEAR someone channel surfing radio static--
scene31,slugline,,INT. BUS - SAME
desc31.160,desc,,"Ali sits with her radio headset, searching stations as..."
utter31.161,utter,RADIO,102.7 KIIS FM. Broadcasting from Hollywood and Vine...
desc31.162,desc,,Ali perks up-- looks out the window as the bus rounds a bend and... THE HOLLYWOOD SIGN comes into view. NEW MUSIC UP:
scene32,slugline,,EXT. STREET - HOLLYWOOD BLVD. DAY - CARRY MUSIC
desc32.163,desc,,"The rush of tourists and traffic. Through a sea of people moving down the crowded sidewalk we FIND ALI as she emerges through the crowd, carrying her bags. Looking around at this exciting city. She SPOTS a SHITTY HOTEL with a sign: ""$49.00 a night."" She looks up at it. Then heads across the street--"
scene33,slugline,,INT. ALI'S HOLLYWOOD HOTEL ROOM - DAY
desc33.164,desc,,"Cramped, dingy carpet, chipped paint. Key in the door. The MIDDLE-EASTERN HOTEL MANAGER -- 40's -- leads Ali in, pointing out the features of the room, speaking fast in an impossibly thick Kurdish accent. Ali nods along, not understanding a word. When he stops:"
utter33.165,utter,ALI,Okay! (THEN) Well. Good luck with that.
desc33.166,desc,,He drops her suitcase on the bed and stands there. Waiting.
utter33.167,utter,ALI (CONT'D),"Oh, hang on."
desc33.168,desc,,She digs into her purse. All she has is twenties. She peels one off and holds it out.
utter33.169,utter,ALI (CONT'D),If I could just get a little --
desc33.170,desc,,"But before she can finish, he pockets it, nods and leaves, closing the door behind him. To the closed door:"
utter33.171,utter,ALI (CONT'D),-- change.
desc33.172,desc,,"She pulls open the blinds, they fall off the wall with a CRASH! Ali stares at them. Then she opens the window. The SOUNDS OF HOLLYWOOD pour in. She digs out her cash, sticks it under the mattress. Then she reconsiders. She removes the money, takes a Ziploc bag full of make-up from her purse, dumps the make-up onto the bed, seals the money up in the Ziploc, and takes it into: THE BATHROOM. She lifts the lid of the back toilet tank and slips the Ziploc of cash under it, catching the bag in the lid as she sets it back down, so it won't fall in. She goes back into the main room to find a CALICO CAT sitting on the window sill. It MEOWS, hops into the room."
utter33.173,utter,ALI (CONT'D),Hey. I thought this was a single.
desc33.174,desc,,The cat curls up next to her. She checks his junk.
utter33.175,utter,ALI (CONT'D),"Typical. First guy I meet is neutered. (THEN) You don't happen to know anyone in the music business, do you?"
scene34,slugline,,"CLOSE ON ""BACKSTAGE WEST"" MAGAZINE,"
desc34.176,desc,,"Ali sips coffee from a paper cup as she reads TRADES and WANT ADS spread over the floor. She refills the lid of the cup, which the cat laps up."
utter34.177,utter,ALI (CONT'D),Singer/Actress... Singer/Songwriter .Singer/Scuba diver? Perfect.
desc34.178,desc,,"ON ANOTHER AD: It says: ""SINGER/WAITRESS WANTED."" MUSIC UP:"
scene35,slugline,,EXT. THEME RESTAURANT - DAY
desc35.179,desc,,"Ali cruises toward the address, dressed in her Iowa best, full of confidence. She rounds a corner and sees: A LONG LINE OF 165 GORGEOUS, IMPECCABLY GROOMED GIRLS. Ali stops in her tracks. Tougher competition than she was expecting. She heads for the back of the line, passing girls doing vocal warm-ups. One girl is belting out a riveting ""SOMEWHERE OVER THE RAINBOW"". Just as Ali gets in line, the door opens and a SKINNY GUY sticks his head out."
utter35.180,utter,SKINNY GUY,"Sorry, ladies, that's all the applications we're taking today."
desc35.181,desc,,"CLOSE ON: an ad: ""DANCERS WANTED. PRETTY GIRLS ONLY."""
scene36,slugline,,INT. ALI'S HOLLYWOOD HOTEL ROOM - MORNING
desc36.182,desc,,"Ali circles the ad, sips coffee. Looks at the cat."
utter36.183,utter,ALI,I can dance.
scene37,slugline,,INT. SEEDY NIGHTCLUB - AFTERNOON
desc37.184,desc,,"Ali breezes in-- SEES ...a bunch of stripper poles, seedy drunk guys in the audience. She PIVOTS, and walks right back out. As she leaves, a DRUNK GUY turns to A SEEDY GUY."
utter37.185,utter,DRUNK GUY,She'll be back.
desc37.186,desc,,"CLOSE ON: A FLYER, BEING SNATCHED OFF A BULLETIN BOARD: ""BACKGROUND SINGERS FOR URBAN GROUP."""
scene38,slugline,,INT. WAITING ROOM - DAY
desc38.187,desc,,"Ali enters, full of energy, as 65 hot LATINA and AFRICAN- AMERICAN girls in butt-baring, hootchie, hip-hop garb, turn in unison and eye her, in her denim shorts and white platforms. Not her crowd. CLOSE ON: A PEN CIRCLES: ""SINGER/DANCERS WANTED FOR TOUR."""
scene39,slugline,,INT. ALI'S HOLLYWOOD HOTEL ROOM - MORNING
desc39.188,desc,,"Ali, eyeing the ad, sips a cup of coffee. Looks at the cat."
scene40,slugline,,EXT. EDGE DANCE STUDIO - DAY
desc40.189,desc,,"Ali, dressed like the girls at the video audition: hootchie, street -- opens the door to find 30 CLASSICAL BUN-TOPPED BALLERINAS stretching, warming up. A Degas painting. They turn in unison and eye her. Again, not her crowd."
scene41,slugline,,EXT. THE CAPITOL RECORDS BUILDING - HOLLYWOOD - DAY
desc41.190,desc,,"Gleaming in the California sunshine. Ali stares up at the glittering shrine to recording. Takes in the whole swirling, crazy scene around her."
scene42,slugline,,EXT. SUNSET STRIP - NIGHT
