segment-id,segment-type,segment-speaker,segment-text
desc62.398,desc,,The lid is off the toilet tank. Her Ziploc of money is gone.
utter62.399,utter,ALI,No!!! God damn it!!!
desc62.400,desc,,"She looks out the window, SEES the ROBBERS running off, disappearing down the street. She kicks the trash can. It flies across the room."
utter62.401,utter,ALI (CONT'D),"Damn it! Damn it, damn it, damn it, damn it, damn it!"
desc62.402,desc,,She sees the cat watching her from behind the bed.
utter62.403,utter,ALI (CONT'D),A lotta help you were.
desc62.404,desc,,"The cat creeps out, slinks around her legs. Ali plunks on the bed."
utter62.405,utter,ALI (CONT'D),Shit.
desc62.406,desc,,"Then she sees, on the floor, the PHOTO she took from Nanna's. She picks it up. The glass has cracked, tearing the picture. She takes the picture out of the broken frame, smooths it out -- then looks around her trashed room. Fighting despair."
scene63,slugline,,EXT. WEST HOLLYWOOD STREET - NIGHT
desc63.407,desc,,"FOLLOW a motorcycle up the street. The DRIVER has a KEYBOARD on his back. He parks, gets off, takes off his helmet. It's Jack. He heads for his apartment, but slows when he sees: ALI, sitting on his steps, her bags at her feet. Head low."
utter63.408,utter,JACK,Ali? What's wrong? You okay?
desc63.409,desc,,"She tries to speak, but can't -- so she just nods."
utter63.410,utter,JACK (CONT'D),"Really? Cause, in my experience-- when you're on someone's doorstep surrounded by everything you own, there's usually a not-so-good story"
utter63.411,utter,ALI I-- WAS--,"And as she expected, as soon as she talks, she starts to cry."
utter63.412,utter,ALI (CONT'D),--RO-0-0-0-OBBED.
utter63.413,utter,JACK,Shit. No way!
utter63.414,utter,ALI,"(halting, gaspy sobs) Came in -- busted the lock-- and stole all my MO-NEY-EY-EY-EY!!!"
desc63.415,desc,,"She sobs--trying to talk, with high-pitched SQUEAKS only heard by birds. Jack winces, trying to follow--"
utter63.416,utter,ALI (CONT'D),(more gaspy sobs) And there's no way I-- sleep there-- with-- like that-- the manager said- - not till Monday-- and I don't-- anyone else-- but then-- so I remembered I had...but it went straight to...so I...
desc63.417,desc,,"She reaches in her pocket, pulls out a card. It's Jack's that he gave her in the club. It has his address on it."
utter63.418,utter,JACK,"Okay. I have no idea what you just said, but come on in here and we'll get it sorted out."
desc63.419,desc,,She looks at him. Wiping her tears. He picks up the heaviest of her bags and leads her to:
scene64,slugline,,INT. JACK'S APARTMENT - NIGHT
desc64.420,desc,,"Tiny one-bedroom. Very ""done."" Floral sofa. Curtains that match the area rug. Candle groupings."
utter64.421,utter,JACK,Have a seat. I'll get us BOTH a drink. Here --
desc64.422,desc,,He hands her his phone. She looks at it.
utter64.423,utter,JACK (CONT'D),"-- call whoever you want, long- distance, whatever--"
utter64.424,utter,ALI,I can't.
utter64.425,utter,JACK,Sure you can. Go ahead.
desc64.426,desc,,Her chin starts quivering all over again.
utter64.427,utter,ALI,I.. .don't ...have anyone.
utter64.428,utter,JACK,What do you mean?
utter64.429,utter,ALI,To call.
utter64.430,utter,JACK,No parents? (she shakes her head) Siblings? Aunts? Uncles? (NO AGAIN) Friends?
utter64.431,utter,ALI,"(THROUGH TEARS) No one! No one, okay? Do I have to spell it out for you? I am -- completely -- alone!"
desc64.432,desc,,Jack susses out the situation.
utter64.433,utter,JACK,(REALIZING) So...you're not here to use my phone.
desc64.434,desc,,She starts to cry again.
utter64.435,utter,JACK (CONT'D),"Okay. Wait. No, stop, stop, stop, it's okay, it's fine. You'll crash here. No problem. Just, please -- no more crying."
desc64.436,desc,,She nods. He grabs a bottle of Tequila and a couple of glasses. Pours them a couple. They both take a drink.
utter64.437,utter,JACK (CONT'D),Better? She nods.
utter64.438,utter,JACK (CONT'D),Okay. Good.
desc64.439,desc,,She wipes her eyes.
utter64.440,utter,ALI,"Just for one night, I swear. Just till it's light outside and I can figure out my next move."
utter64.441,utter,JACK,Deal.
desc64.442,desc,,Then she opens her small bag and the cat strolls out.
utter64.443,utter,JACK (CONT'D),"Whoa, whoa, you didn't say anything about a cat."
utter64.444,utter,ALI,What? You don't like cats?
desc64.445,desc,,It slinks around his leg. He shakes it off.
utter64.446,utter,JACK,I hate cats.
utter64.447,utter,ALI,How can you hate a cat?
utter64.448,utter,JACK,"It's easy, I'll show you. The cat bolts into the bedroom."
utter64.449,utter,JACK (CONT'D),Where's it going? If that thing pees on my bed --
utter64.450,utter,ALI,He goes outside. We just have to open a window. He's very independent.
desc64.451,desc,,"She opens the window. The cat scurries back in, leaps onto the ledge. Ali pets him. Looks at Jack, smiles."
utter64.452,utter,ALI (CONT'D),I don't have a name for him yet.
desc64.453,desc,,It purrs. Jack eyes it warily.
utter64.454,utter,JACK,One night?
utter64.455,utter,ALI,One night.
scene65,slugline,,INT. JACK'S APARTMENT - LATER
desc65.456,desc,,"IN THE LIVING ROOM, the lights are low. Ali's on the couch, under covers, cat at her feet. INTERCUT WITH: THE BEDROOM. Jack at his keyboard, playing from sheet music, learning a song. When he pauses, from the living room:"
utter65.457,utter,ALI,You're good.
utter65.458,utter,JACK,Thanks.
utter65.459,utter,ALI,Why don't you play at the club?
utter65.460,utter,JACK,Make more money bartending.
utter65.461,utter,ALI,You in a band?
utter65.462,utter,JACK,"Was... Guitarist moved to Reno, Drummer went to med school, bassist is in rehab. I'm subbing around town till I regroup. This is for a punk fusion band -- their keyboardist is a flake, so they call me a lot."
utter65.463,utter,ALI,(SARCASTIC) A flaky punk-rock-fusion keyboardist? No way.
desc65.464,desc,,"He smiles. Continues playing. HIGH ANGLE, seeing both of them on either side of a wall. Her listening, him playing. After a few measures:"
utter65.465,utter,ALI (CONT'D),Hey... He stops playing again.
utter65.466,utter,ALI (CONT'D),Why'd you leave Kentucky?
utter65.467,utter,JACK,Why'd you leave Iowa?
utter65.468,utter,ALI,Cause I looked around and realized there wasn't one person whose life I wanted.
utter65.469,utter,JACK,Exactly.
desc65.470,desc,,A beat. Then as he starts playing again:
utter65.471,utter,ALI,Hey Jack?
desc65.472,desc,,He stops again.
utter65.473,utter,ALI (CONT'D),Thank you. I'm really glad I'm not alone tonight.
desc65.474,desc,,He smiles.
utter65.475,utter,JACK,Get some sleep.
desc65.476,desc,,He continues playing. She closes her eyes.
scene66,slugline,,INT. JACK'S APARTMENT - BEDROOM - MORNING
desc66.477,desc,,"Light rain on the window. CLOSE ON: THE CAT'S FACE, staring right into camera. REVERSE ON: Jack, waking up. As his eyes open, the Cat licks him on the mouth."
utter66.478,utter,JACK,Aauuuugggghh.
desc66.479,desc,,"He hurls the cat away and bolts out of bed, disgusted."
scene67,slugline,,INT. JACK'S APARTMENT - LIVING ROOM - NIGHT
desc67.480,desc,,"Jack straggles in, wiping his mouth. The sofa's made up, blankets folded. Ali is making breakfast, her back to him. He can't help but notice she's only wearing a tiny tank top and undies. She hears him clear his throat."
utter67.481,utter,ALI,Morning. Coffee?
utter67.482,utter,JACK,(NODS) Black. Like my soul.
desc67.483,desc,,She pours him a cup. Sees a picture of a BEAUTIFUL GIRL on his fridge.
utter67.484,utter,ALI,She's pretty. Your sister?
utter67.485,utter,JACK,My fiancee. Natalie.
utter67.486,utter,ALI,Fiancee? You're straight?
utter67.487,utter,JACK,Of course I'm straight. You thought I was gay?
utter67.488,utter,ALI,Yes?
utter67.489,utter,JACK,Why?
utter67.490,utter,ALI,"I don't know, the...make-up?"
utter67.491,utter,JACK,It's a look.
utter67.492,utter,ALI,Okay.
utter67.493,utter,JACK,A straight look.
utter67.494,utter,ALI,Okay. (THEN) And the floral couch...?
utter67.495,utter,ALI/JACK,Natalie.
desc67.496,desc,,As Ali realizes she's barely dressed in front of a straight
utter67.497,utter,ALI,I should put on pants.
utter67.498,utter,JACK,Probably.
desc67.499,desc,,"She bolts out to the living room, starts digging through her bag, bent over. She's in the doorway, so from the kitchen, all he can see is her cute little ass sticking out."
utter67.500,utter,ALI,Where is she?
utter67.501,utter,JACK,New York. Doing a play.
utter67.502,utter,ALI,For how long?
utter67.503,utter,JACK,Six more weeks.
desc67.504,desc,,"She can't find pants. She shifts, so now her ass is facing him directly. He tries not to look--"
utter67.505,utter,ALI,"(KEEPS DIGGING) Oh, God, now I feel bad about this."
utter67.506,utter,JACK,For what?
utter67.507,utter,ALI,"I don't know. Now that you're straight and engaged, it feels weird that I came here."
utter67.508,utter,JACK,"Well, you did, and it was fine."
desc67.509,desc,,"Aha! Pants. She pulls them out, starts putting them on. He looks out. Her foot is caught in the pants leg. As she hops around, trying to untangle it--"
utter67.510,utter,JACK (CONT'D),Or at least it will be as soon as
desc67.511,desc,,"you get dressed. She tumbles out of view, thumps against some furniture. She appears in the doorway, pants on, pulling on a sweater. She slips her feet into her shoes."
utter67.512,utter,ALI,Alrighty then-- I'll get outta your hair now...
utter67.513,utter,JACK,"Wait, where're you headed?"
utter67.514,utter,ALI,"Oh, don't worry about me. I've got a plan. (scoops up the cat) Come on, cat."
desc67.515,desc,,She zips the cat into the bag he came in.
utter67.516,utter,JACK,"Hang on, let me at least spot you some cash. I'm a little strapped, but I could --"
utter67.517,utter,ALI,"No, I'm good, if you could just"
desc67.518,desc,,She nods at the door. He opens it for her.
utter67.519,utter,ALI (CONT'D),Thank you. For everything. You are my knight in shining... eyeliner. (MORE)
utter67.520,utter,ALI (CONT'D),(out the door) I'll see you at the club.
utter67.521,utter,JACK,Cool.
desc67.522,desc,,She leaves. He closes the door behind her. Stands there.
scene68,slugline,,EXT. JACK'S APARTMENT - DAY
desc68.523,desc,,"Ali looks at the rain. Then marches out into it, lugging her stuff. Goes about 15 yards in one direction, then stops."
scene69,slugline,,INT. JACK'S APARTMENT - SAME
desc69.524,desc,,"Jack watches her out the window as she marches 15 yards in another direction, then stops. Pondering. She sees a bus stop across the street. She crosses to it and sits."
scene70,slugline,,EXT. BUS STOP - DAY
desc70.525,desc,,"Ali peers down the street for the bus. Jack appears beside her, getting soaked in the rain."
utter70.526,utter,JACK,"So, this plan of yours?"
utter70.527,utter,ALI,.was to sit here at the bus stop and come up with a plan.
utter70.528,utter,JACK,Come back inside.
utter70.529,utter,ALI,"No, Jack, I--"
utter70.530,utter,JACK ALI-- ALI,"I'll figure it out, this is not"
utter70.531,utter,JACK,It's pouring!
utter70.532,utter,ALI,It's only water for chrissakes--
desc70.533,desc,,GOD DAMN IT! GET YOUR ASS BACK IN MY HOUSE! NOW!
utter70.534,utter,ALI,Jack-- you've done enough and--
desc70.535,desc,,In ONE MOVE he SCOOPS HER up as she lets out a WHOOOOP!
utter70.536,utter,ALI (CONT'D),Jack-- No! Stop it!
desc70.537,desc,,He grabs her bags and carries her back across the street--
scene71,slugline,,INT. JACK'S APARTMENT - DAY
desc71.538,desc,,"The DOOR KICKS OPEN-- they ENTER, Jack carrying Ali, dripping wet."
utter71.539,utter,ALI,PLEASE PUT ME DOWN--
desc71.540,desc,,He sets her down--
utter71.541,utter,JACK,"Look, you have nowhere to go, I have a couch. You may as well stay here for a few days."
utter71.542,utter,ALI,You really don't need to do that. I'll be fine --
utter71.543,utter,JACK,You'll be homeless. You always have this much trouble saying yes when someone is trying to help you?
utter71.544,utter,AL I,It's never happened before.
desc71.545,desc,,"The Cat jumps up on the back of a chair, all wet, and SHAKES, splattering them with wet cat smell."
utter71.546,utter,JACK/ALI,Aaaaargh!
desc71.547,desc,,As his PHONE RINGS.
utter71.548,utter,JACK,There's a towel in the bathroom-- dry yourself and that damn cat off.
desc71.549,desc,,Ali collects the cat-- heads for the bathroom. Jack checks his phone. Answers.
utter71.550,utter,JACK (CONT'D),"(INTO PHONE) Hey, baby, how's it going?... Really? That's awesome..."
utter71.551,utter,ALI (O.S.),(CALLING OUT)
desc71.552,desc,,DO YOU HAVE A BLOW DRYER?
utter71.553,utter,JACK,"(INTO PHONE) That...? Just this person from work What? No, she's just a friend, I'm helping her out. Nat, it's nothing."
desc71.554,desc,,"O.S. MUSIC UP: ""BABY YOU'VE GOT WHAT IT TAKES"" by Brook Denton and Dinah Washington over..."
scene72,slugline,,INT. BURLESQUE LOUNGE - ON STAGE - DAY
desc72.555,desc,,"CLOSE ON A HEAVILY MADE-UP GIRL as she screams and drops out of the shot in a flying split. Behind her, a ROW OF DANCERS do the same. Typical, fantastic, old-school can-can. WIDEN to see Tess and Sean, on the floor, auditioning them. The club is brightly lit, none of its evening aura. Scattered around the club are other HOPEFULS in groups, waiting for their turn."
scene73,slugline,,EXT. BURLESQUE LOUNGE - DAY
desc73.556,desc,,"Jack's motorcycle pulls up to the club, with Jack driving, and Ali riding on back."
scene74,slugline,,INT. BURLESQUE LOUNGE - DAY
desc74.557,desc,,"Ali and Jack enter as the auditions are under way. As they set up the bar, Ali watches the stage, intrigued. MONTAGE: the dancers auditioning, in small groups. All shapes, sizes. Ali watching. Finally only a few are left."
utter74.558,utter,TESS,"Okay, front row, thank you very much."
desc74.559,desc,,"They walk off stage, dismissed. Tess turns to Sean."
utter74.560,utter,TESS (CONT'D),What happened to all the great dancers in L.A?
utter74.561,utter,SEAN,"They're busy ""Dancing with the Stars."" (to the waiting dancers) Last group, please."
desc74.562,desc,,"HALF A DOZEN DANCERS move to the stage. Ali watches from behind the bar, thinking. Then, on her face, we see: an idea forming. ON THE FLOOR, Tess and Sean check their clipboards, organizing for this next set. They look up and start in:"
utter74.563,utter,TESS,"All right, ladies, and five, six, seven -- whoa."
desc74.564,desc,,"There, in the back row, is Ali, in her white platform shoes."
utter74.565,utter,TESS (CONT'D),What the hell do you think you're doing?
desc74.566,desc,,Coco and Georgia ENTER-- surprised to see Ali on stage.
utter74.567,utter,ALI,Trying out.
utter74.568,utter,TESS,I don't think so.
utter74.569,utter,ALI,"Tess, I've been singing and dancing my whole life and--"
utter74.570,utter,TESS,The girls here have years of training and experience. This stage is for serious and professional
desc74.571,desc,,DANCERS WHO--
utter74.572,utter,ALI,"(angry, interrupting) Hey_. This is your club and you can be as rude as you want--but don't you dare tell me I'm not serious."
desc74.573,desc,,"Sean's eyebrows reach for the ceiling as Nikki enters, SEES Ali on stage."
utter74.574,utter,ALI (CONT'D),"I may not have been to a professional dance school, but I have a lot of talent and I came to this town to do something with it. And the only reason I've been putting up with all the bullshit ""attitude"" I get from you is cause I want to do it here. (BEAT) For the first time in my life, I don't want to be someplace else. So you're gonna give me MY shot. Right here. Right now."
desc74.575,desc,,"Everyone in the club just stands there. Jaws dropped. Tess just looks at her, blinks, incredulous."
utter74.576,utter,ALI (CONT'D),"One song. You don't like it, I'll quit and do us both a favor. (BEAT) Your call, lady. I know every"
desc74.577,desc,,"Sean, eyes big as saucers, looks from Ali to Tess, then back"
utter74.578,utter,TESS,(DOUBTFUL) You know every number.
utter74.579,utter,ALI,Which one do you wanna see?
desc74.580,desc,,Tess looks at her in disbelief.
utter74.581,utter,ALI (CONT'D),"I said, which one do you wanna see?"
desc74.582,desc,,"Ali just stares at her. Calling her bluff, Tess yells up to DAVE in the sound booth--"
utter74.583,utter,TESS,Tough Lover!
desc74.584,desc,,"Tess plops down in a booth-- crosses her arms indignantly. ON STAGE, the music starts. Ali readies herself, starts to dance. Behind a beat to two. She's got the steps right, but it isn't clicking. She's thinking too hard. No personality. After a few measures, Tess has seen enough."
utter74.585,utter,TESS (CONT'D),"Okay then, next?"
utter74.586,utter,ALI,"Hang on. (to Dave in the booth) Start it again, please?"
desc74.587,desc,,"As Dave resets the music. Ali regroups: takes her hair down and shakes it loose. Nikki ENTERS, SEES Ali on stage--"
utter74.588,utter,NIKKI,(TO GEORGIA) What the hell's going on?
utter74.589,utter,COCO,Shhhh.
desc74.590,desc,,"On stage, Ali takes a beat; inhales, breathing in attitude. Then she looks up at the booth again."
utter74.591,utter,ALI,Anytime.
desc74.592,desc,,"The MUSIC starts in again. And this time, Ali comes alive. She may not have perfect technique or the best extension, but she exudes an ambition and sexuality no one has seen from her before. It's like she becomes a woman before our eyes. She misses a step or two, but who the hell cares? On the floor, Sean gapes, eyes popping. Tess is poker-faced. Coco and Georgia's expressions turn from dubious to respectful. Nikki's eyes narrow. At the bar, Jack freezes, a huge rack of glasses in his arms - - unable to tear his eyes away. As the SONG CLIMAXES, Ali finishes with an alluring toss of her ass, then lands in a sexy layout on a chair, owning the stage. The music ends. A stunned silence. The only sound is Ali's heavy breathing. Then Georgia jumps up, APPLAUDING EFFUSIVELY."
utter74.593,utter,NIKKI,"What are so you happy about, that's your replacement."
utter74.594,utter,GEORGIA,"Yeah, but she's really good."
desc74.595,desc,,Tess and Ali are in a stare down.
utter74.596,utter,TESS,"I want so badly to say something bitchy, but nothing's coming."
utter74.597,utter,SEAN,There's a first.
desc74.598,desc,,"Tess sighs, not wanting to give Ali any props."
utter74.599,utter,TESS,You were off the whole second half.
utter74.600,utter,ALI,"So, I was spot on the first half?"
desc74.601,desc,,"Tess narrows her eyes at Ali. Then looks over at Nikki, Coco and Georgia. Georgia gives an effusive THUMBS UP-- then suddenly becomes overcome by nausea, covers her mouth and RUNS to the bathroom to puke-- Tess rolls her eyes, looks back at Ali."
utter74.602,utter,TESS,"Oh, you're gonna be such a pain in my ass."
desc74.603,desc,,Ali tries hard not to beam--
utter74.604,utter,ALI,"Do I have the job, or not?"
utter74.605,utter,TESS,You're not great. What you are is lucky. Because I need someone tonight.
utter74.606,utter,ALI,And I know all the routines.
desc74.607,desc,,As Tess turns and leaves--
utter74.608,utter,TESS,Even in those shoes that time forgot.
utter74.609,utter,SEAN,Theeeere's bitchy.
desc74.610,desc,,Nikki watches Tess go-- turns and pours herself a shot.
utter74.611,utter,NIKKI,Well-- this totally sucks ass.
desc74.612,desc,,Sean jumps up on the stage.
utter74.613,utter,SEAN,"Congratulations. The last time someone showed Tess balls like that, she married him. (looks Ali over) You look like a checker at a Mal Wart in Wichita. Just tripled your salary. Get a new look."
utter74.614,utter,ALI,"Hey, I happen to like the way I look."
utter74.615,utter,SEAN,Really? That's a fascinating story. And then what happens? (ALL BUSINESS) Backstage in five. (WALKING OFF) Welcome to the family.
desc74.616,desc,,"Ali jumps off the stage, runs to the bar, where Jack is still standing, slack-jawed. She throws her arms around him."
utter74.617,utter,ALI,"Sorry for the short notice, I quit! (plants a big kiss on him) But hey-- with my raise I'll be off your couch in a week."
desc74.618,desc,,"She squeezes him tight-- then heads backstage leaving him standing there, really turned on."
scene75,slugline,,INT. BURLESQUE LOUNGE - BACKSTAGE - DAY
desc75.619,desc,,"Sean swings open A DOOR, revealing a room packed to the gills with costumes: feathers, sequins, fishnets, corsets, jammed up against each other. Sean tosses her clothes in a blur."
utter75.620,utter,SEAN,"First number, second number, third number..."
desc75.621,desc,,"She catches the clothes. He dumps shoes on top of them, holding them up as he tells her what they go with:"
utter75.622,utter,SEAN (CONT'D),With the sequined bustier. With the shorts and garters. With the beaded number. And those -- (points to hers) I never want to see again. (REMEMBERING) Oh! And --
desc75.623,desc,,He hands her a prop GOLD MACHINE GUN.
utter75.624,utter,SEAN (CONT'D),"For ""Miss Otis Regrets"". Just be sure you don't --"
desc75.625,desc,,Ali pulls the trigger. BOOM -- GLITTER SPLATS all over Sean.
utter75.626,utter,SEAN (CONT'D),Pull the trigger.
desc75.627,desc,,"MUSIC UP: ""RICH MAN'S FRUG"". CARRY MUSIC OVER:"
scene76,slugline,,INT. BURLESQUE LOUNGE - ON STAGE - NIGHT
desc76.628,desc,,"The chic audience watches the Girls doing a swingin' sixties shimmy and shake number. CAMERA MOVES ACROSS the girls' faces as drums roll and their heads turn to each drumbeat. The last face to turn is ALI'S. In FULL STAGE MAKE-UP, she looks like a gorgeous classic burlesque dancer. The girls, in 20's revealing bathing suits and stilettos, kick and dance downstage in a line. Ali struggles a little to keep up A WAITER CROSSES FRAME and we WIPE TO: - ANOTHER NIGHT. SAME MUSIC, different costumes. Ali's dancing is improving. WAITRESS CROSSES FRAME and we WIPE TO: - ANOTHER NIGHT. SAME MUSIC, yet another set of costumes. Ali's as good as anyone else up there. AN AUDIENCE MEMBER crosses frame and we WIPE TO: - ANOTHER NIGHT. SAME MUSIC, another set of costumes. Ali knows the steps now, she's not thinking about them. She's all performance, vamping to the audience, selling like crazy. She NAILS a final layout on a chair, it's flawless. Tess and Sean are watching from the wings. They notice the extra whip in Ali's head, the bump in her grind."
utter76.629,utter,SEAN,"Admit it. You like her. It kills you, but you like her."
desc76.630,desc,,"Tess meets his eye, then walks away. The number ends. The girls rush offstage and peel their costumes off."
utter76.631,utter,ALI,"My tits are up around my ears, my thong's about a mile up up ass, this corset is so tight, I haven't breathed since Tuesday and these lashes are thick enough to kick up"
desc76.632,desc,,a stiff wind.
utter76.633,utter,SEAN,"It's fun being a girl, huh?"
utter76.634,utter,ALI,(BIG SMILE) Yeah.
desc76.635,desc,,She hands him the last bits of her costume. FOLLOW Ali as she heads to the dressing room. As she grabs her T-shirt and jeans:
utter76.636,utter,JESSE,"I'm starving, who wants to go grab some pizza before the next show?"
desc76.637,desc,,"A general chorus of ""Yeah?"" and ""I'm in."" FOLLOW Ali to the bathroom as she throws on her clothes and washes off her make-up, humming ""Rich Man's Frug"" to herself. She heads back out to the dressing room to find: EVERYONE IS GONE. She looks around. Feels like an fool. She plunks down in a chair. Drops her bag on the floor. Looks at herself in the mirror. She sees a picture of A CLASSIC BURLESQUE BEAUTY taped to the mirror. Notices her eye make-up -- strong, thick eyeliner. Ali picks up a brush, dips it in eyeliner, and tries to duplicate the look on her own eye. After a first try:"
utter76.638,utter,TESS (O.S.),Your brush is for shit.
desc76.639,desc,,"She turns and sees Tess in the doorway. Tess comes over, takes Ali's brush. Looks at it."
utter76.640,utter,TESS (CONT'D),"Where'd you get this, the 99 cent store?"
desc76.641,desc,,She chucks it in the trash.
utter76.642,utter,ALI,Hey.
utter76.643,utter,TESS,Make-up is like wine. The good stuff costs a fortune but is worth every penny. Where is everyone?
utter76.644,utter,ALI,All the girls went out for pizza.
utter76.645,utter,TESS,Aren't you one of the girls?
utter76.646,utter,ALI,Apparently not.
desc76.647,desc,,"Tess reads her like a book. Knows what went down. She turns to leave, then pauses at the door. Turns back."
utter76.648,utter,TESS,Don't take it personally. Their love's the kind you gotta earn.
desc76.649,desc,,"Ali meets her eyes in the mirror. Then Tess grabs a brush from her own station, tosses it to Ali."
utter76.650,utter,TESS (CONT'D),"Dip it in water first, or you'll never get a clean line. She leaves Ali alone."
scene77,slugline,,INT. JACK'S APARTMENT - BATHROOM - DAY
desc77.651,desc,,"Jack enters in boxers, kicks them off, opens the shower, then freezes."
utter77.652,utter,JACK,ALI!!!
scene78,slugline,,INT. JACK'S APARTMENT - LIVING ROOM - DAY
desc78.653,desc,,Ali is just waking up.
utter78.654,utter,JACK,Your stupid cat peed in the tub!
utter78.655,utter,ALI,"What...? (sees the window closed) You closed the window, what do you expect?"
utter78.656,utter,JACK,"Your cat pees in the house, and it's my_ fault?!"
desc78.657,desc,,Ali scoops the cat up.
utter78.658,utter,ALI,"Awwww. Poor guy, you must have been desperate."
utter78.659,utter,JACK,"Goddamn cat. And you used my towel again. (then, pointed) How's that apartment hunting coming?"
desc78.660,desc,,"He GRABS the newspaper and tosses it in front of her-- she glares at him, then glances at the paper--"
utter78.661,utter,ALI,(EYES WIDENING) A thousand bucks for a studio?
utter78.662,utter,JACK,Can you really put a price on privacy? Freedom? Your own bathroom? With clean towels?
utter78.663,utter,ALI,"Okay, Jack-- I get it--"
desc78.664,desc,,His cell phone rings. As he checks who's calling:
utter78.665,utter,JACK,"Natalie. (then, into phone:) Hey, baby, how are you?"
desc78.666,desc,,"He heads into the bedroom, closes the door. Ali shakes her head, begins to peruse the classifieds."
scene79,slugline,,INT. JACK'S APARTMENT - KITCHEN - DAY
desc79.667,desc,,"Ali, in pajamas, is at the table, combing the classified apartment ads. The cat is beside her."
