segment-id,segment-type,segment-speaker,segment-text
utter79.668,utter,ALI,"Guest studio, Hollywood, $900, with a yard, and -- oh. No pets. (to the cat) Screw them."
desc79.669,desc,,She scans the ads some more. Finds a good one.
utter79.670,utter,ALI (CONT'D),Ooh?
desc79.671,desc,,Jack walks in. Looks like he's got something on his mind.
utter79.672,utter,ALI (CONT'D),I think I found my new place. Where's Pomona?
utter79.673,utter,JACK,"Go to Hell, turn left, it's three miles down on the right."
utter79.674,utter,ALI,Really. How's Beachwood Canyon?
utter79.675,utter,JACK,"Great, if you have a car. (BEAT) Truth is, you should get a car first. This is L.A. You don't exist without a car. Plus, you can't really afford a decent place yet. (THINKING) Tell you what."
utter79.676,utter,JACK (CONT'D),I'm gonna suck it up and let you stay here a little longer. Just throw in a little something for rent.
desc79.677,desc,,"She looks at him, curious."
utter79.678,utter,ALI,"What about the ""God damn"" cat?"
utter79.679,utter,JACK,"Hey, I don't like the cat. And I don't like my towel being wet. I don't like the lack of privacy. But you're in a jam -- and I'm the kind of guy, if a friend's in trouble, I help. It's just who I am."
utter79.680,utter,ALI,(SUSPICIOUS) What did Natalie have to say?
utter79.681,utter,JACK,"Nothing, you know just... hi. She narrows her eyes at him. He concedes."
utter79.682,utter,JACK (CONT'D),"And...her play got extended three more months, so since she has to pay rent there, she can't also keep up her part of the rent here."
utter79.683,utter,ALI,Ah-hah.
utter79.684,utter,JACK,"So if you could stick around and chip in, it would --"
utter79.685,utter,ALI,Save your ass?
utter79.686,utter,JACK,-- help.
desc79.687,desc,,Ali looks down at his shoes.
utter79.688,utter,ALI,"Well, will you look at that? The shoe, on the other foot!"
utter79.689,utter,JACK ALI,"One minute I'm a freeloader with a God damn cat, the next, I'm the only thing standing between you and"
utter79.690,utter,JACK,Just -- yes or no?
utter79.691,utter,ALI,"What's the proposal, exactly?"
desc79.692,desc,,Jack looks at her-- realizes he's screwed.
utter79.693,utter,JACK,"The bedroom, with private bathroom access, for 600 a month, including utilities."
utter79.694,utter,ALI,Closet?
utter79.695,utter,JACK,"Half . Ali picks up the paper, reads an ad."
utter79.696,utter,ALI,"Ooh, look! Hot tub!"
utter79.697,utter,JACK,"Fine. The closet, too."
desc79.698,desc,,She weighs it. Makes him suffer. Then:
utter79.699,utter,ALI,Okay.
utter79.700,utter,JACK,Thank you.
utter79.701,utter,ALI,"(MOCKING HIM) Hey, I'm the kind of girl, if a friend's in trouble, I help. That's just who I am."
desc79.702,desc,,We HEAR an AUDIENCE laugh O.S. as we...
scene80,slugline,,EXT. BURLESQUE LOUNGE - NIGHT
desc80.703,desc,,Small crowd outside.
utter80.704,utter,TESS (O.S.),"So I said to the sailor, I may not be as good as I once was..."
scene81,slugline,,INT. BURLESQUE LOUNGE - NIGHT
desc81.705,desc,,"Through a transparent scrim, the Puccini Triplets perform a sexy harem scene in silhouette, casting larger than life shadows-- Tess walks behind the scrim playfully, in and out of view. The Bumber Band plays off to the side."
utter81.706,utter,TESS,But you can bet your sweet ass I'm better ONCE than I ever was...
desc81.707,desc,,The crowd laughs. Tess points to a woman who isn't laughing.
utter81.708,utter,TESS (CONT'D),"Drink up, sister! You're a tad behind. (to a waiter, re: woman) Be a dear and bring Mommy over there another scotch."
desc81.709,desc,,The crowd chuckles as the Bumper Band kicks in and the harem scene evolves into a sexy tongue-in-cheek silhouetted dance.
scene82,slugline,,INT. BURLESQUE LOUNGE - BACKSTAGE - NIGHT
desc82.710,desc,,Tess comes off stage. Sean bustles up to her.
utter82.711,utter,SEAN,The distributor's holding back the booze unless we cut him a check.
utter82.712,utter,TESS,"Ply him with drinks, send Scarlett over to flirt, and try to finagle him down to a half."
utter82.713,utter,SEAN,How's a third?
desc82.714,desc,,"He produces a check, all filled-out, for her to sign."
utter82.715,utter,TESS,Have I told you lately that I love you?
utter82.716,utter,SEAN,Got any brothers?
desc82.717,desc,,"He bustles off with the check. Scarlett, Coco and Nikki approach the stage wearing leather, strappy Gaultier corsets with gloves and fishnets --post-modern Germanesque -- Nikki is carrying a glass of tequila. Tess eyeballs her--"
utter82.718,utter,TESS,Drinking already?
utter82.719,utter,NIKKI,"Yes, Mommie."
utter82.720,utter,TESS,You're drunk.
utter82.721,utter,NIKKI,No. But I'm working on it.
desc82.722,desc,,Nikki totters a little. Tess looks her over.
utter82.723,utter,TESS,"I'm pulling you from this number. Go home, wring yourself out, and come back tomorrow."
utter82.724,utter,NIKKI,You can't pull me--
desc82.725,desc,,Tess SPOTS Ali heading for the dressing room--
utter82.726,utter,TESS,Ali! Take Nikki's spot.
utter82.727,utter,NIKKI,WHAT?! That bitch can't dance my part!
utter82.728,utter,TESS,Ali-- get dressed NOW!
desc82.729,desc,,Ali looks at Nikki-- who GLARES at her--
utter82.730,utter,ALI,"But, wait-- Tess-- that's always been Nikki's number."
desc82.731,desc,,Tess looks at her-- she's really had it with these girls--
utter82.732,utter,TESS,"But this is MY club, and now it's your number."
desc82.733,desc,,"Ali looks between the two of them, Nikki glaring at her--"
utter82.734,utter,TESS (CONT'D),"Is there a problem? You said you know the whole show. (CHALLENGING HER) You can do anything, right?"
desc82.735,desc,,"Tess just looks at Ali. Nikki stares at Tess, livid, then storms off."
scene83,slugline,,INT. BURLESQUE LOUNGE - SAME
desc83.736,desc,,Marcus ENTERS the club and joins Vince at a table. A LOUD DRUM ROLL. MUSIC UP.
scene84,slugline,,THE STAGE
desc84.737,desc,,"Ali and the other dancers hit the stage and start in on the vampy ""TOUGH LOVER."" AT THE BAR, Jack is busy mixing drinks. He glances at the stage, then DOUBLE-TAKES on Ali, looking crazy gorgeous. She vamps forward with the girls, they rotate singing into the prop mic."
utter84.738,utter,JESSE,(LIP-SYNCHING)
desc84.739,desc,,"WELL, I WANT A LOVER WHO MOVES ME"
utter84.740,utter,COCO,(LIP-SYNCHING)
desc84.741,desc,,WHO SURE KNOWS HOW TO ROCK N ROLL--
utter84.742,utter,ALI,(LIP-SYNCHING)
desc84.743,desc,,I WANT A TOUGH LOVER--
scene85,slugline,,INT. BURLESQUE LOUNGE - SOUND BOOTH - NIGHT
desc85.744,desc,,"DAVE, the sound guy, looks up as Nikki comes in."
utter85.745,utter,NIKKI,Tess needs you. She said it was urgent.
utter85.746,utter,DAVE,I can't leave here now --
utter85.747,utter,NIKKI,"Fine, but don't say I didn't warn you..."
utter85.748,utter,DAVE,"Shit, okay --"
desc85.749,desc,,He checks his sound board -- then bolts from the room. Nikki watches him go LOOKS DOWN onto the STAGE as ALI STEPS to THE MIC--
utter85.750,utter,ALI,(LIP-SYNCHING)
desc85.751,desc,,"WHEN HE KISSES ME I'LL GET A THRILL, AND WHEN HE DO THAT WIGGLE-- Nikki reaches out and FLIPS A SWITCH. THE SOUND DROPS OUT. THE PLAYBACK STOPS. The girls freeze in awkward poses, unsure of what to do. MURMURS in the room as the audience looks around, confused. BACKSTAGE, Tess looks up at the sound booth, sees it's empty. Dave appears at her side."
utter85.752,utter,DAVE,You wanted to see me?
desc85.753,desc,,"ON STAGE -- Ali looks at flustered Tess...the girls...the audience. Panic. On the floor, Nikki watches with satisfaction as she makes her way over to Marcus. Enjoying the train wreck she caused. Then -- in a flash, Ali turns to the audience, and SINGS a'capella from the TOP OF THE SONG."
desc85.754,desc,,OH--OH--OOOOOOOOOOH. She looks around. Silence. Mouths agape. Tess approaches in THE WINGS--
utter85.755,utter,TESS,(to a stage hand) Close the Goddman curtain!
utter85.756,utter,SEAN,Hold on...
desc85.757,desc,,"Ali starts to sing again, her version, slow, and sexy..."
desc85.758,desc,,"WELL I WANT A LOVER TO MOVE ME SO, ROLL... Tess looks at Ali, you could knock her over with a feather. Sean looks at Tess. Scarlett looks at Coco. Jack stares at the stage. Everyone stunned by the sound coming out of this girl. And now the song really takes off! SUDDENLY, one of the BAND BOYS grabs his sax and plays. Ali jumps in, seamless, as the guys on Bass and Drums join in. Ali picks up the choreography. The girls fall in with her."
desc85.759,desc,,"I WANT A TOUGH LOVER, YEAH, YEAH. I NEED A TOUGH LOVER. WHOOO. I WANT A TOUGH LOVER. YEAH-YEAH. TOUGH LOVER. UH-HA... Coco and Scarlett chime in on back-up. Hearing them, Jessie and Anna join in as well. Ali takes off, holding nothing back. The girls feed off her confidence, and soon all of them are hitting the backs of their cabaret chairs, stomping their feet to the music. The girls singing back-up. In his seat, Marcus sits up a little straighter -- suddenly paying more attention. Unable to take his eyes off Ali. The BAND plays along. The BARTENDERS accompany them with hand-claps. All except Jack, who's too spellbound to move."
desc85.760,desc,,"WHEN HE KISSES ME I'LL GET A THRILL AND WHEN HE DO THAT WIGGLE, I WON ' T KEEP STILL ... ON THE FLOOR, Nikki watches, aghast, as the crowd engages like we've never seen them."
desc85.761,desc,,"I WANT A TOUGH LOVER, YEAH, YEAH. I NEED A TOUGH LOVER. WHOOO. I WANT A TOUGH LOVER. YEAH-YEAH. BARTENDERS/GIRLS TOUGH LOVER. UH-HA... The girls come alive, finally able to sing a song they've been faking for so long"
desc85.762,desc,,"THE SEVEN SISTERS GOT NOTHING ON HIM, I 'M TALKING ABOUT A LOVER WHO ' S FAST AS THE WIND. EVER YONE ' LL TALK HOW HE'S GOT ME FIXED, IT AIN'T VOODOO IT'S JUST THAT TWIST."
desc85.763,desc,,"HE'LL BE THE GREATEST LOVER EVER COME TO PASS, DON JUAN AIN'T GOT HALF A CHANCE. HE'LL MAKE ME LAUGH AND HE'LL MAKE ME CRY, HE'LL BE SO TOUGH HE ' LL MAKE VENUS COME ALIVE. HE 'LL DO ANYTHING THAT HE WANTS TO DO, STEP ON JESSIE JAMES' BLUE SUEDE SHOES. ALI/GIRLS I WANT A TOUGH LOVER, YEAH, YEAH. I NEED A TOUGH LOVER. WHOOO. I WANT A TOUGH LOVER. YEAH-YEAH. BARTENDERS/GIRLS TOUGH LOVER. UH-HA::! The room ERUPTS IN APPLAUSE, knowing they caught a once-in-a- lifetime performance. Marcus stands, clapping, whistling. Ali basks in it, jubilant, rapturous. She glances to the wings and sees Sean, clapping and jumping in place. Then she sees Tess beside him, stone-faced."
scene86,slugline,,INT. BURLESQUE LOUNGE - BACKSTAGE - NIGHT
desc86.764,desc,,"The Girls exit the stage in a flurry, everyone congratulating Ali -- a whirlwind of hugs, kisses. Ali reaches Tess."
utter86.765,utter,ALI,"Tess, when the music stopped--"
utter86.766,utter,TESS DAVE,Why didn't you tell me you I have no idea what happened. could blow like that?
utter86.767,utter,ALI (CONT'D),I did.
desc86.768,desc,,Tess spots a TATTOOED BAND GUY in the door.
utter86.769,utter,TESS,Do you boys know all the music?
utter86.770,utter,TATTOOED BAND GUY,"Hell, yeah."
desc86.771,desc,,"Nikki wanders in, drink in hand. Tess looks at them all. Plants her hands on her hips."
utter86.772,utter,TESS,"Okay, then. Tomorrow night, Ali sings lead, everyone else is back- up. Questions?"
desc86.773,desc,,"Ali can't keep from beaming as she shakes her head, no!"
utter86.774,utter,TESS (CONT'D),Good.
desc86.775,desc,,"The Girls file into the dressing room. Tess heads out, past Nikki."
utter86.776,utter,NIKKI,"""People don't come to hear us sing."""
utter86.777,utter,TESS,No. But they'll come to hear her sing. Dry out and maybe you can back her up.
desc86.778,desc,,She leaves. Nikki scowls. Sean grabs Ali.
utter86.779,utter,SEAN,"Bitch, you SANG that damn song!"
desc86.780,desc,,"He heads off to the dressing room, too, leaving Nikki and Ali alone together. Their eyes meet."
utter86.781,utter,NIKKI,One of us has clearly underestimated the other.
desc86.782,desc,,She tosses her glass in the trash and leaves Ali alone.
scene87,slugline,,INT. BURLESQUE LOUNGE - NIGHT
desc87.783,desc,,"Ali trots out from backstage, spots Jack behind the bar. She heads over to him. Before she gets there:"
utter87.784,utter,MARCUS,Where'd you learn to sing like that?
desc87.785,desc,,"She turns. Marcus is there. Handsome, charming and devious as"
utter87.786,utter,ALI,You can't learn to sing like that.
utter87.787,utter,MARCUS,"Well, you're too good to be singing here."
utter87.788,utter,ALI,"I just got into the show and suddenly I'm too good for it? Shrugs, ""but, you are"" then--"
utter87.789,utter,MARCUS,How about a drink?
utter87.790,utter,ALI,Sure. Jack's at the bar. Tell him I sent you. It's on me.
utter87.791,utter,MARCUS,But I hate lines.
desc87.792,desc,,"AT THE BAR - Jack looks up, SEES Ali and Marcus talking. BACK ON MARCUS who looks Ali up and down."
utter87.793,utter,MARCUS (CONT'D),Seriously. You sound even better than you look. Which is saying a lot.
utter87.794,utter,ALI,"Talk about a ""line."""
desc87.795,desc,,"She smiles, amused, and heads away from him, toward the bar. He watches her go. Tess intercepts Ali."
utter87.796,utter,TESS,What did he want?
utter87.797,utter,ALI,Directions to the bar.
desc87.798,desc,,"As Ali heads off. Tess glances back at Marcus, mistrustful."
scene88,slugline,,INT. EMPTY BURLESQUE LOUNGE - NIGHT
desc88.799,desc,,"After hours. The club is closed. Jack, Ali, Coco, Sean and Georgia are sitting around the bar as Jack closes up."
utter88.800,utter,JACK,You blew me away! Who knew you could sing like that?
utter88.801,utter,COCO,Who knew any white chick could sing like that? You channeled that shit.
utter88.802,utter,SEAN,"How the hell do you do that, girl?"
utter88.803,utter,ALI,"I don't know, I can't explain it. It's like -- I start singing, and something starts to move inside me. It's in my hands, my feet, my gut,"
desc88.804,desc,,MY THIGHS She runs her hands over her body as she describes it. Jack watches her -- holy smokes. Sean notices his gaze on her.
utter88.805,utter,ALI (CONT'D),and it just builds and builds till I feel like I'm gonna explode.
utter88.806,utter,GEORGIA,"Trust me, I know what that feels like. I have to pee. Again."
desc88.807,desc,,"She hops off the stool and scurries to the back. Coco stands, to leave. Looks at Ali."
utter88.808,utter,COCO,Wanna grab something to eat?
desc88.809,desc,,Ali looks back at Coco -- validated. Accepted. At last.
utter88.810,utter,ALI,Yeah. Lemme get my bag.
desc88.811,desc,,Ali moves off. Coco goes to get her coat. Sean sees Jack still watching Ali as she walks across the room.
utter88.812,utter,SEAN,"Well, will you look at that."
utter88.813,utter,JACK,What?
utter88.814,utter,SEAN,You looking at that girl the way I looked at you all those years. Only difference: you actually stand a chance with her.
utter88.815,utter,JACK,I have a fiancee.
utter88.816,utter,SEAN,Three thousand miles away.
utter88.817,utter,JACK,We talk every day.
utter88.818,utter,SEAN,"Let me guess what about: her, her and...oh! Her."
desc88.819,desc,,Jack shoots him a glare.
utter88.820,utter,SEAN (CONT'D),"All I'm saying is, this one's beautiful on the inside too. And she won't be on the shelf forever."
desc88.821,desc,,"Ali comes back, ready to go. Feels them stop talking and"
utter88.822,utter,ALI,What?
utter88.823,utter,SEAN,I was just explaining to Jack that even opportunity has a shelf life.
desc88.824,desc,,Jack grabs a trash bag and takes it out back. Sean looks at Ali more closely. He brushes her hair out of her face. Then he holds it off her shoulders and raises that gay eyebrow. - INT. SALON - DAY - Ali sits in front of a mirror while Sean gives the HAIRDRESSER very specific instructions.
scene89,slugline,,"- INT. JACK'S APARTMENT, AT HIS KEYBOARD, Jack plays a high-"
desc89.825,desc,,"energy style piano which runs over a QUICK SEQUENCE: It's the instrumental music to: ""BUT I'M A GOOD GIRL."""
scene90,slugline,,"- INT. BURLESQUE LOUNGE - The Burlesque Girls dance on stage,"
desc90.826,desc,,"performing a high-energy tap dance, coupled with a European slap-dance, with the slapping of each other's bodies and faces integrated with tapping and music. It's very cabaret, but modernized with contemporary STEPPING. CARRY MUSIC: - INT. SALON - LATER - The HAIRDRESSER spins the chair around. Ali's her hair is platinum blonde, with bangs and a Louise Brooks bob that frames her face beautifully. Her smoky eyes pop like never before. Ali studies herself:"
utter90.827,utter,ALI,Where have I been all my life?
scene91,slugline,,- INT. BURLESQUE LOUNGE - NIGHT - CAMERA MOVES OVER THE
desc91.828,desc,,"AUDIENCE, the brass section kicks in giving the piano a BIGGER, BAWDY, SHOW-STOPPING BOISTEROUS SOUND as Ali APPEARS with her new look. Amazing. Like Helmut Newton meets Carnaby St. circa 1965. As she begins this HIGH ENERGY SONG-- Jack is looks up from the bar. Totally blown away."
desc91.829,desc,,"THE DRESS IS BOHAN. THE SHOES ARE JOURDAN. THE BAG NORTH AFRICAN, AND SO IS THE TAN. MY ADDRESS TODAY,"
scene92,slugline,,"FABER ST. HONERE, TOMORROW RIO, THE"
desc92.830,desc,,"CONCORDE THE WAY. MY RING IS BULGARI, IT MAKES THEIR HEADS TWIRL, THEY ALL SAY, 'DARLING, WHAT DID YOU DO FOR THAT PEARL?' WHAT? I AM A GOOD GIRL. NEW YORK 54. CREON, COTE D 'AZUR. L. A. POLO LOUNGE, FOR BREAKFAST FOR SURE. PARIS, LA PLAZA, OR MAYBE THE RITZ. IN LONDON THE PLAYBOY, IN TRUTH IT'S THE PITS. YOU KNOW I HAVE FOUND, THE WORD ' S GONE AROUND. THEY ALL SAY MY FEET NEVER DO TOUCH THE GROUND. WHAT?. I AM A GOOD GIRL. Ali finishes the song to big applause. Takes her bow. Makes her way off the stage and ACROSS the club to... JACK AT THE BAR - he turns to see Ali."
utter92.831,utter,ALI (CONT'D),"Hiya, big boy."
desc92.832,desc,,"She spins herself around on a bar stool, so he can see all angles. Jack likes plenty. Way too much."
utter92.833,utter,ALI (CONT'D),What do you think?
utter92.834,utter,JACK,"(FLUSTERED) It's...I think-you look...I mean, yeah... do you like it?"
desc92.835,desc,,Not the reaction she was looking for.
utter92.836,utter,ALI,Jack. It's okay for you to think I look hot. We're friends for chrissakes. It's not like we're brother and sister.
desc92.837,desc,,"She rolls her eyes, gets up, and heads backstage. Jack watches her go--"
utter92.838,utter,JACK,(TO HIMSELF) No. We certainly are not.
scene93,slugline,,INT. BURLESQUE LOUNGE - BACKSTAGE - NIGHT
desc93.839,desc,,The Burlesque Girls are prepping for the show.
utter93.840,utter,NIKKI,"Why the hell is everyone having a conniption over her? She's just a tacky, pushy girl from a --"
desc93.841,desc,,"Ali -- sexy, sophisticated, gorgeous -- enters."
utter93.842,utter,NIKKI (CONT'D),-- fly-over state.
desc93.843,desc,,"Ali pretends she didn't hear. She sits at her mirror. The girls stare at her, mouths agape. Ali picks up her mascara wand, looks down the mirror at Nikki's reflection."
utter93.844,utter,ALI,(FAUX INNOCENT)
desc93.845,desc,,"What's a fly-over state? Ali takes a deft stroke of her wand over her lashes, then bats them at Nikki. Nikki walks out. Coco smiles with appreciation. Whistles long and low. The girls all laugh."
scene94,slugline,,INT. BURLESQUE LOUNGE - NIGHT
desc94.846,desc,,"Tess glad-hands guests, then spots Vince, waving at her. She starts over, then sees Marcus in the booth with Vince. She turns and walks the other way. Vince catches up to her."
utter94.847,utter,VINCE TESS -- TESS,"Vince, if I were going to sell, I'd have sold to those idiots building that monstrosity across the street. I said no."
utter94.848,utter,VINCE,"Which made Marcus bump his offer up again. It's obscene, what he wants to give us. At least hear him out."
scene95,slugline,,INT. BURLESQUE LOUNGE - TESS'S CLUTTERED OFFICE - NIGHT
desc95.849,desc,,"Tess, at her desk, reads a contract. Marcus and Vince sit across from her, watching."
utter95.850,utter,MARCUS,It's very simple. I buy you out and pay you a million off the top. (motions to Vince) Five hundred grand each.
desc95.851,desc,,"Tess looks up from the contract, squints at Marcus."
utter95.852,utter,TESS,Why do you want this club so badly?
utter95.853,utter,MARCUS,Best view on the Sunset Strip.
utter95.854,utter,VINCE,"Do you know what you could do with that money, Tess?"
utter95.855,utter,TESS,"Do you know what you can do with that money, Vince?"
utter95.856,utter,VINCE,Be reasonable. We're rolling vendors ninety days out.
utter95.857,utter,MARCUS,"The club's not even worth what you paid for it. You've got a second mortgage, you can't get a third."
desc95.858,desc,,"Tess looks at Vince, betrayed."
utter95.859,utter,TESS,Did you also tell him about the tattoo on my ass?
utter95.860,utter,VINCE,"It's business, Tess. Not personal."
utter95.861,utter,TESS,My business. Which I built from the ground up.
utter95.862,utter,MARCUS,You're not gonna get another opportunity like this.
utter95.863,utter,TESS,Exactly.
desc95.864,desc,,"She looks at a photo on her wall: the Burlesque Girls, in all their glory."
utter95.865,utter,TESS (CONT'D),Which is why I'll never let it go.
desc95.866,desc,,"She gets up, opens the door, ushering them out. Marcus shoots Vince an angry look as they head downstairs. IN THE STAIRWELL, Vince reassures Marcus:"
utter95.867,utter,VINCE,Don't worry. The balloon payment's due on the first. She doesn't have the money. She has to sell.
desc95.868,desc,,"IN TESS'S OFFICE, Tess stands in the doorway, having heard. Then she walks back to her desk and sits, dejected. Head in her hands. For the first time ever, looking worried and defeated. Something she'd never show anyone. A beat. Then:"
utter95.869,utter,SEAN,Well. We've had a pretty good run.
desc95.870,desc,,She looks up. Sean is in the doorway.
utter95.871,utter,SEAN (CONT'D),Maybe it's time to just.. .hang it up. Let it go. Call it a day.
desc95.872,desc,,Tess's eyes go steely with determination.
utter95.873,utter,TESS,"No. You cannot say that to me. I can eat these ""sky is falling"" dipshits for breakfast, lunch, and dinner, but not YOU. You cannot be that person. I've scoured dirty flea markets for costumes, stayed up all night sewing till my fingers bled, painted and repainted every goddamn wall of this place myself."
utter95.874,utter,TESS (CONT'D),"I choreographed every step of every number. I've played nursemaid, sister, mother and shrink to every girl who's ever danced here. I've hocked every keepsake I've ever owned to keep this place afloat. Because this club is the last of it's kind, and if it goes away, one day there won't be anything like it- - and THAT would be a tragedy. So you cannot say that to me. Because now someone's gotta believe in me, Goddamnit. And I need that person to be you. So don't you ever let me hear you say that again. I will never let this club go. Never."
desc95.875,desc,,Sean looks at her...a wry smile.
utter95.876,utter,SEAN,There she is. Thought I'd lost you for a minute.
desc95.877,desc,,"Tess just looks at him, and smiles. He grabs a boa, throws it around his neck and exits. When he's gone, Tess's smile fades. IN THE CLUB, the place is empty. Jack is wiping down the bar cleaning up. He starts stacking some chairs in the house as..SEAN CROSSES the floor."
utter95.878,utter,SEAN (CONT'D),"Night, Jack."
utter95.879,utter,JACK,Night.
desc95.880,desc,,"Sean EXITS as Jack carries a stack of chairs to the side of the room, sets them down near the piano. STOPS, grabs a chair for himself and sits down. Begins to play an original song. ACROSS THE ROOM, Ali ENTERS from backstage. Her dance bag over her shoulder. She HEARS the piano, peers around a column, SEES Jack playing. She stays in the shadows and watches as he sings and plays a beautiful song. (TBD) The song ends. Ali applauds slowly. Impressed. Jack looks up, surprised that she is there."
utter95.881,utter,ALI,Beautiful. You write that?
utter95.882,utter,JACK,Just some sentimental crap. Ready?
desc95.883,desc,,She smiles at his modesty. Nods. He crosses to her. Grabs her dance bag and they EXIT together.
scene96,slugline,,INT. JACK'S APARTMENT - LATE AFTERNOON
desc96.884,desc,,"Jack enters, unloading his keyboard from his back. He hears Ali in the bedroom. He quietly moves over to the ajar bedroom door -- peeks in and sees: ALI, in bra and undies. She hums the song he played the night before in the mirror as she gets dressed. ON JACK, watching, mesmerized. His eyes travel her body. She moves out of view. He leans against the wall to try to keep seeing her -- and steps on the CAT. It MEOWS. He flattens against the wall. Ali looks up."
utter96.885,utter,ALI,Jack?
desc96.886,desc,,"Jack zips back to the door, opens it quietly, then SLAMS it."
utter96.887,utter,JACK,Hey! Just got home!
desc96.888,desc,,"Ali grabs a dress from her bed, slips into it."
utter96.889,utter,ALI,In here! Can you zip me up? In a nanosecond-- Jack enters the bedroom.
utter96.890,utter,ALI (CONT'D),Hey. Where you been?
utter96.891,utter,JACK,Rehearsing. I'm playing a late show tonight.
desc96.892,desc,,"As he zips up the back of her dress, he sees the PHOTO propped against the lamp on the bedside table."
utter96.893,utter,JACK (CONT'D),Who is that?
desc96.894,desc,,She picks up the picture. Looks at it.
utter96.895,utter,ALI,Me and my mom on my 7th birthday. She died just a few weeks later.
utter96.896,utter,JACK,She was so young.
utter96.897,utter,ALI,"24. There was so much she never got to do. Sometimes I feel like, if I make the most of my life, part of her will get to live a little more, too."
utter96.898,utter,JACK,Wow. You must miss her.
desc96.899,desc,,She puts the photo down. Turns back to him. They're close.
utter96.900,utter,ALI,"Every single day, something happens I want to tell her about."
utter96.901,utter,JACK,What was today's?
desc96.902,desc,,A beat. Their eyes connect.
utter96.903,utter,ALI,Don't know. Hasn't happened yet.
