segment-id,segment-type,segment-speaker,segment-text
desc96.904,desc,,"They stand there, close to each other. Jack sees a strand of hair caught in the earring. He pulls it away, freeing it. His fingers move through her hair. She closes her eyes, feeling his fingers against her neck. Then she opens her eyes, looks at him. He looks back, unable to look away. Until: His CELL PHONE RINGS. Breaking the mood. He pulls it from his pocket. Checks who's calling. Looks back at Ali."
utter96.905,utter,JACK,I should... it's... Natalie.
desc96.906,desc,,"Ali steps away from him, disappointed. He answers the phone."
utter96.907,utter,JACK (CONT'D),"Hey, babe, how are you?"
desc96.908,desc,,"Ali watches him walk away from her, falling into the conversation with Natalie."
utter96.909,utter,JACK (CONT'D),"Yes, she's still here-What do you want me to do, it's not like you're here helping out, you know..."
desc96.910,desc,,"Ali grabs her bag and jacket, heads for the door. MUSIC UP: An incredibly sexy saxophone which takes us to: FULL CLOSE UP: ALI steps into frame, starts singing."
desc96.911,desc,,A GUY WHAT TAKES HIS TIME... PULL BACK to reveal she's on stage at the club with the BURLESQUE GIRLS. Finger waves and 1920's sexy clothes.
desc96.912,desc,,"I'LL GO FOR ANY TIME. I'M A FAST MOVIN' GAL WHO LIKES THEM SLOW. GOT NO USE FOR FANCY DRIVIN', WANT TO SEE A GUY ARRIVIN' IN LOW. I'D BE SATISFIED TO KNOW A GUY WHAT TAKES HIS TIME... - INT. JACK'S LIVING ROOM - Ali lies on her stomach on the floor perusing a Fashion Magazine. Across the room, Jack sits on the couch, PLAYING HIS KEYBOARD--UNDERSCORING THE SONG. He looks at Ali. Watching her. Without looking up, she takes a pencil, gathers her hair, and puts it up expertly. A few strands fall back onto her neck. Sexy. Ali feels his stare. Looks up at him. Smiles. He smiles back. She goes back to her magazine. ON JACK. Loving that she's there."
scene97,slugline,,"- INT. BURLESQUE LOUNGE - DRESSING ROOM - Ali, the Girls and"
desc97.913,desc,,"Sean getting ready. Georgia bursts into the room, showing off an ENGAGEMENT RING. Everyone jumps up, congratulates her. - INT. BURLESQUE STAGE - The GIRLS and Ali vamp, singing:"
desc97.914,desc,,"A GUY WHAT TAKES HIS TIME, I'D GO FOR ANYTIME. A HASTY JOB REALLY SPOILS A MASTER'S TOUCH ... AT THE BAR, Jack watches as he pours drinks."
scene98,slugline,,- EXT. STREET. AFTERNOON - Ali on the back of Jack's
desc98.915,desc,,"motorcycle, puts her arms around his waist. Jack revs the engine. Weaving through traffic on the Strip. The wind in their hair. Her scarf tears away, lifting into the air... - INT. BURLESQUE STAGE - Ali and Burlesque girls continue..."
desc98.916,desc,,"I DON'T LIKE A BIG COMMOTION, I'M A DEMON FOR SLOW MOTION OR SUCH. WHY SHOULD I DENY, THAT I WOULD DIE, TO KNOW A GUY WHAT TAKES HIS TIME ... - INT. JACK'S LIVING ROOM - Ali, Sean, Tess, Scarlett, Anna, Georgia, DAMON (her fiance), hanging out in the living room, decorated with party gear. The lights dim and Jack and Coco enter with a birthday cake. They set it in front of Ali. Ali looks around at her friends, drinking it in. She locks eyes with Jack -- then closes her eyes and BLOWS. - INT. BURLESQUE STAGE - Ali, still singing her song."
desc98.917,desc,,"I CAN SPOT AN AMATEUR, APPRECIATE A CONNOISSEUR IN HIS TRADE, WHO WOULD QUALIFY, NO ALIBI, TO BE THE GUY, WHO TAKES HIS TIME... PULL BACK to reveal A PACKED HOUSE. The audience goes nuts. Marcus is at his table, clapping, whistling, her biggest fan."
scene99,slugline,,INT. BURLESQUE LOUNGE - AT THE BAR - LATER
desc99.918,desc,,Ali walks up to the bar.
utter99.919,utter,ALI,Hey -- when can you cut out? I'm about to fall asleep standing up.
utter99.920,utter,JACK,"I have that gig, remember? In fact, I gotta head out or I'm gonna be late. (checking his watch) I can maybe swing you home before."
utter99.921,utter,ALI,"No, that's okay, you go. I'll grab a ride with Coco."
desc99.922,desc,,He grabs his jacket from under the bar. As he heads out:
utter99.923,utter,JACK,By the way -- you killed.
utter99.924,utter,ALI,"(looks at him, smiles) Thanks."
desc99.925,desc,,He disappears out the back exit. Ali turns around and finds herself face to face with Marcus.
utter99.926,utter,MARCUS,You ready?
utter99.927,utter,ALI,For what?
utter99.928,utter,MARCUS,I'll drop you off. (BEAT) Coco left five minutes ago.
desc99.929,desc,,She realizes he was listening to her conversation.
utter99.930,utter,ALI,Excuse me?
utter99.931,utter,MARCUS,Sorry-- I was coming to talk to you and caught the end of your conversation.
utter99.932,utter,ALI,(putting on her coat reaching for her bags) Talk to me about...?
utter99.933,utter,MARCUS,Dinner. With me. Gimmie that.
desc99.934,desc,,"He swoops down and GRABS her dance bag and purse, turns and heads out."
utter99.935,utter,MARCUS (CONT'D),(WALKING AWAY) If you ever expect to see this bag alive again... you'll come with me.
utter99.936,utter,ALI,Hey...! Come back here...!
scene100,slugline,,INT. MARCUS'S BENTLEY - NIGHT
desc100.937,desc,,"ON Ali, looking out the window with her arms crossed. WIDEN to REVEAL, she's in car with Marcus, zipping along Sunset."
utter100.938,utter,ALI,Where are you taking me?
utter100.939,utter,MARCUS,I told you-- to dinner.
utter100.940,utter,ALI,Dinner? What about Nikki-- What's up with you and Nikki?
utter100.941,utter,MARCUS,We're friends.
utter100.942,utter,ALI,Where I'm from friends don't chew each other's earlobes.
utter100.943,utter,MARCUS,"Aren't you glad you left? (then, remembering) Oh, damn!"
utter100.944,utter,ALI,What?
utter100.945,utter,MARCUS,I just remembered I have to make a quick appearance at a party.
utter100.946,utter,ALI,You just remembered.
utter100.947,utter,MARCUS,"It's on the way. We'll be quick. Ten minutes, tops. Do you mind?"
utter100.948,utter,ALI,And if I do.
utter100.949,utter,MARCUS,Then you've been kidnapped.
desc100.950,desc,,He turns off Sunset and heads up into the hills.
scene101,slugline,,EXT. MODERN HOUSE - HOLLYWOOD HILLS - NIGHT
desc101.951,desc,,Sprawling 60's modern. Walls of glass. Jetliner views. Valets running around out front.
scene102,slugline,,INT. MODERN HOUSE - HOLLYWOOD HILLS - NIGHT
desc102.952,desc,,"Fabulous party underway. Packed with glitterati. Music blares, caterers weave through the hip crowd. Marcus leads Ali in and guides her through the crowd."
utter102.953,utter,ALI,Wow. Nice house.
utter102.954,utter,PARTY GUEST,"Hey, Marcus --"
utter102.955,utter,MARCUS,"Hey, how you doing?"
desc102.956,desc,,He shakes the guy's hand and moves on through the party. Someone else calls out to him.
utter102.957,utter,ANOTHER GUEST,Marcus!
utter102.958,utter,MARCUS,"Hey, let me get a drink, I'll be"
scene103,slugline,,BACK --
desc103.959,desc,,"Marcus pulls Ali in the opposite direction, avoiding another GROUP trying to greet him. He grabs two wine glasses off a tray, gives one to Ali, then pushes through a door into:"
scene104,slugline,,INT. MODERN HOUSE - KITCHEN - NIGHT
desc104.960,desc,,"Bustling, food and booze everywhere. Marcus spots several trays of hors d'oeuvres. He picks up two of them."
utter104.961,utter,ALI,Marcus -- you can't just take that.
desc104.962,desc,,"He hands her one tray, sticks a bottle of wine in one pocket, throws an opener in another."
utter104.963,utter,ALI,They're gonna throw us out of here.
utter104.964,utter,MARCUS,"Not if we sneak out first, come on."
desc104.965,desc,,He kicks open a back door.
scene105,slugline,,EXT. MODERN HOUSE - BACK YARD - NIGHT
desc105.966,desc,,"A sky full of stars, hovering over an expansive back yard. Music from the party drifts out. Marcus looks around, up --"
utter105.967,utter,MARCUS,Up there.
desc105.968,desc,,He starts up some steps to an outdoor gazebo. Ali follows. They pass AN INCREDIBLY WELL-DRESSED COUPLE coming down.
utter105.969,utter,GUY,"Hey, Marcus --"
utter105.970,utter,MARCUS,"Hey, Guys. Greg, Marla, this is Ali."
desc105.971,desc,,They exchange hellos. Ali notices:
utter105.972,utter,ALI,Ooh. Killer shoes.
utter105.973,utter,MARLA,Aren't they? Louboutins.
utter105.974,utter,GREG,"(TO MARCUS) Great party, as always."
utter105.975,utter,MARCUS,Glad you could come.
desc105.976,desc,,"Ali stares at Marcus. He smiles, takes her hand, keeps leading her up the stairs."
utter105.977,utter,AL I,You had to make an appearance at your own party?
utter105.978,utter,MARCUS,"Would've been rude not to, right? You'd like those guys. Greg's the entertainment editor at the Times, and Marla's a designer."
desc105.979,desc,,"Ali glances back at Marla again, locks in on her shoes."
utter105.980,utter,AL I,I'm gonna dream about those shoes.
utter105.981,utter,MARCUS,Thousand dollars a pop.
utter105.982,utter,AL I,Jesus. Who can afford that?
utter105.983,utter,MARCUS,I can.
utter105.984,utter,ALI,"Hey, I saw them first."
desc105.985,desc,,"He laughs as they reach the top of the stairs and a BREATHTAKING PANORAMIC VIEW OF THE ENTIRE CITY is revealed. Ali pauses, taking in the glittering, massive view of L.A."
utter105.986,utter,ALI (CONT'D),Whoa. L.A. looks one hell of a lot prettier from up here.
utter105.987,utter,MARCUS,It should. That view cost me three times what the house did. (POINTING) See that strip mall down there?
utter105.988,utter,ALI,You own that too?
utter105.989,utter,MARCUS,No. I own everything above it.
utter105.990,utter,ALI,There is nothing above it.
utter105.991,utter,MARCUS,Exactly.
utter105.992,utter,ALI,You own...air?
utter105.993,utter,MARCUS,Air rights. The guy who owns the strip mall was having money issues and almost had to sell. Whoever he sold to would have put in a huge tower. So I bought the air rights. Now no one can ever build above one story.
utter105.994,utter,ALI,Aren't you the sly puss.
utter105.995,utter,MARCUS,Mall guy gets to keep his property. I get to keep the second best view in L.A.
utter105.996,utter,ALI,What's the first?
desc105.997,desc,,He gazes at her. She rolls her eyes.
utter105.998,utter,ALI (CONT'D),How many girls have you used that on?
utter105.999,utter,MARCUS,None who ever called me on it.
desc105.1000,desc,,He smiles. Looks at her. Then...
utter105.1001,utter,MARCUS (CONT'D),"What do you want, Ali? In life. Girl like you, gives up everything, gets on a bus heading for total uncertainty-- she's got a dream. I want to know what it is."
utter105.1002,utter,ALI,Why?
utter105.1003,utter,MARCUS,Because you're talented enough to get whatever you want. And I'm smart enough to help make it happen. So? What do you want?
desc105.1004,desc,,A beat. She thinks about it. Looks him in the eye.
utter105.1005,utter,ALI,I want to be the best singer I can be. I want to give as much joy as I get when I perform. And I want to die knowing I made the most of every opportunity life gave me.
utter105.1006,utter,MARCUS,That's ...so beautiful.
utter105.1007,utter,AL I,There wasn't a dry eye in the house when I said it at the Grundy County Junior Miss Talent Show.
desc105.1008,desc,,His eyes narrow.
utter105.1009,utter,MARCUS,Why do you women always take advantage of nice boys?
utter105.1010,utter,ALI,"Oh, please. You are SO not a nice boy."
desc105.1011,desc,,He clinks her glass. Smiles at her. Devilish and sexy.
scene106,slugline,,INT. MARCUS'S HOUSE - WEE HOURS - NIGHT
desc106.1012,desc,,"Party's over. Lights low. Ali walks through the almost- empty house, passes a COUPLE making out on a couch, a GUY who holds out a joint. She motions ""no thanks"", heads into the: LIVING ROOM, where Marcus is asleep on a Bertolli chair, drink in hand. An OLDER GUY is playing the piano quietly. Ali takes the drink from Marcus's hand, sets it on the table. She hears the pianist start a new song: (TBD). She smiles. Goes over to him."
utter106.1013,utter,ALI,"Ooh, I love this song."
desc106.1014,desc,,"The Piano Player scoots to make room. She sits beside him. He starts humming along. She does too. Then he sings a line. She sings one back. And they fall in together. Not vamping, not performing. Just feeling the beauty of the music in the middle of the night."
scene107,slugline,,INT. JACK'S APARTMENT - NIGHT - CARRY MUSIC
desc107.1015,desc,,"Jack quietly lets himself in. He sets his keyboard down, then sees the bedroom door cracked, the light on."
utter107.1016,utter,JACK,Ali?
desc107.1017,desc,,"He looks in. Empty. He checks the clock: 4:45. He hears a ""meow"", and sees the cat. He picks it up, turns out the light, and leaves the room."
scene108,slugline,,INT. BURLESQUE LOUNGE - BACKSTAGE - NIGHT
desc108.1018,desc,,"Sean, Coco, Nikki, Jesse, and the rest of the girls in early stages of getting ready. Ali enters."
utter108.1019,utter,COCO,Someone has a package!
desc108.1020,desc,,"Ali sees A GIFT BOX at her station. She reads the card: ""You saw them first."" She opens the box and sees the Louboutins."
utter108.1021,utter,JESSE,Ooh. Faboo.
desc108.1022,desc,,Nikki picks one up -- checking their authenticity.
utter108.1023,utter,NIKKI,Who's the sucker?
desc108.1024,desc,,All eyes turn to Ali. She's saved by Tess entering.
utter108.1025,utter,TESS,"Coco-puff, shake a leg, you're on in five, Georgie-Girl, Ali-Cat -- move, move, move --"
desc108.1026,desc,,Tess exits.
utter108.1027,utter,ALI,Ahh. My Nanna used to call me her Ali-Cat.
utter108.1028,utter,SEAN,Yet another fascinating story.
utter108.1029,utter,NIKKI,Why doesn't Tess have a nickname for me?
utter108.1030,utter,COCO,"Oh, she does."
desc108.1031,desc,,A knowing look amongst the girls.
utter108.1032,utter,NIKKI,She never uses it.
utter108.1033,utter,SEAN,Sure she does.
utter108.1034,utter,NIKKI,When?
utter108.1035,utter,SEAN,Just after you leave the room.
desc108.1036,desc,,"Nikki gives him the finger and walks out. A beat. Then: GIRLS TOGETHER Coke-whore. They crack up. CUE MUSIC: ""STRANGE THINGS HAPPENING"""
scene109,slugline,,INT. BURLESQUE LOUNGE - ON STAGE - NIGHT
desc109.1037,desc,,"Ali and the Burlesque Girls vamp forward and perform ""STRANGE THINGS HAPPENING"", a decadent, rockin' dance/singing number. Scantily-clad girls pose and dance on chairs with images projected onto them -- a rock fantasy with burlesque moves (like Bob Fosse's ""All That Jazz"")"
utter109.1038,utter,ALI,WELL I STAY OUT LATE AT NIGHT. I
desc109.1039,desc,,DON'T TREAT MY BABY RIGHT. THERE'S STRANGE THINGS HAPPENING EVERY
scene110,slugline,,DAY...
desc110.1040,desc,,"MUSIC CONTINUES OVER: - INT. JACK'S APARTMENT - Jack, playing his keyboards. Ali comes in, wearing the Louboutins."
utter110.1041,utter,JACK,You were out late last night.
utter110.1042,utter,ALI,I got a ride home with that guy-- Marcus-- we went to a party. It was fun.
utter110.1043,utter,JACK,Marcus the Asshole?
utter110.1044,utter,ALI,Yeah. Turns out he's not so bad.
desc110.1045,desc,,"She heads past him, toward the kitchen. He notices:"
utter110.1046,utter,JACK,New shoes?
scene111,slugline,,- INT. BURLESQUE LOUNGE - ON STAGE - NIGHT
desc111.1047,desc,,"Ali, singing. Marcus in the audience, watching her."
desc111.1048,desc,,"THE LOVE THAT YOU REFUSE, SOME OTHER GUY CAN USE, STRANGE THINGS ARE HAPPENING EVERY DAY ..."
scene112,slugline,,- INT. BURLESQUE LOUNGE - NIGHT
desc112.1049,desc,,Ali performing. Marcus watching from his table. With him is GREG (from the party). Jack watches from the bar.
desc112.1050,desc,,"All the Bartenders sing, except Jack, who keeps his eyes on Marcus."
utter112.1051,utter,BARTENDERS,EVERY DAY!
desc112.1052,desc,,EVERY DAY.' THERE ' S STRANGE THINGS HAPPENING EVERY DAY ...
scene113,slugline,,- INT. JACK'S APARTMENT - DAY
desc113.1053,desc,,"Ali getting dressed to go out. She's wearing the Louboutins, crossing back and forth in front of Jack, who's on the sofa."
utter113.1054,utter,JACK,"There's only one reason a man buys a woman shoes, you know."
utter113.1055,utter,ALI,So what if I'm getting a little male attention.
utter113.1056,utter,JACK,You get a lot more than a little.
utter113.1057,utter,ALI,Not from anyone who matters.
utter113.1058,utter,JACK,(CLEARLY IRRITATED) I just think that you should be careful.
desc113.1059,desc,,Ali stops in front of him. Hands on her hips.
utter113.1060,utter,AL I,"And I just think that -- if you really feel the need to tell a girl what she should and shouldn't do, you should pick up the phone and call your fiancee."
scene114,slugline,,- INT. BURLESQUE LOUNGE - NIGHT
desc114.1061,desc,,Ali continues to sing.
utter114.1062,utter,ALI (CONT'D),"WELL, I'D NEVER MISS MY WATER,"
desc114.1063,desc,,"UNTIL MY WELL RUNS DRY... AT THEIR TABLE, Greg leans into Marcus and whispers something, impressed. Marcus nods back: ""Told you."""
desc114.1064,desc,,STRANGE THINGS HAPPENING EVERY DAY.
scene115,slugline,,- EXT. HOLLYWOOD HILLS - NIGHT
desc115.1065,desc,,"Marcus drives Ali up the windy roads, into the hills. They're talking animatedly."
desc115.1066,desc,,".THEY WON'T BE SATISFIED, 'TIL THEY SEE TEARDROPS IN MY EYES ..."
scene116,slugline,,- INT. JACK'S APARTMENT - NIGHT
desc116.1067,desc,,"Jack staring at a note: ""Jack: going out, see you tom'w. - A"""
desc116.1068,desc,,STRANGE THINGS ARE HAPPENING EVERY DAY.
scene117,slugline,,- INT. BURLESQUE STAGE - NIGHT
desc117.1069,desc,,"Ali moves in sync with the Girls. Tess watches from the wings, pleased."
desc117.1070,desc,,"STRANGE THINGS ARE HAPPENING EVERY DAY, OOH EVERY DAY!"
utter117.1071,utter,BARTENDERS,EVERY DAY!
desc117.1072,desc,,EVERY DAY. THERE ' S STRANGE THINGS HAPPENING EVERY DAY ...
scene118,slugline,,- INT. FABULOUS PARTY - NIGHT
desc118.1073,desc,,"Marcus leads Ali through a party, introducing her to everyone, making sure she knows people and is known by them."
desc118.1074,desc,,"WELL YOU THOUGHT I WAS A FOOL, BUT I GOT NEWS FOR YOU ... STRANGE THINGS ARE HAPPENING EVERY DAY."
scene119,slugline,,- INT. BURLESQUE LOUNGE - NIGHT
desc119.1075,desc,,"Nikki watches from the wings, seething, as Marcus delights in Ali's performance."
desc119.1076,desc,,I THINK I FOUND SOMEONE NEW ...
scene120,slugline,,- INT. JACK'S APARTMENT - NIGHT
desc120.1077,desc,,"Wee hours. Ali comes in, shuts the door as quietly as she can, then tiptoes past Jack, asleep on the couch."
desc120.1078,desc,,After she passes... Jack's eyes open.
scene121,slugline,,- INT. BURLESQUE LOUNGE - NIGHT
desc121.1079,desc,,"Ali, owning the stage and the room."
desc121.1080,desc,,STRANGE THINGS ARE HAPPENING EVERY
scene122,slugline,,DAY ... YEAAAAAHHH: STRANGE THINGS
desc122.1081,desc,,"ARE HAPPENING!! HAPPENING .1 The SONG ENDS in a flourish. There's a CAMERA FLASH! FREEZE FRAME on the image: ALI, belting onstage, with the Burlesque Girls striking a pose behind her. WIDEN to see it's a photo on the front page of the L.A. TIMES Calendar section. The headline: ""BURLESQUE HAS A VOICE:""."
scene123,slugline,,INT. JACK'S APARTMENT - MORNING
desc123.1082,desc,,"Jack, sleepy, in boxers, stares at the newspaper, bewildered."
utter123.1083,utter,JACK,Hey. Have you seen this?
utter123.1084,utter,ALI,What?
desc123.1085,desc,,"Ali wanders out of the bathroom, brushing her teeth. He shows her the paper. She SCREAMS."
scene124,slugline,,INT. BURLESQUE LOUNGE - BACKSTAGE - AFTERNOON
desc124.1086,desc,,The Burlesque Girls (minus Ali) crowd around the paper.
utter124.1087,utter,NIKKI,That's bullshit.
utter124.1088,utter,SCARLETT,No. That's major.
utter124.1089,utter,NIKKI,(pointing to photo) Look again. The only thing major is the size of your ass.
desc124.1090,desc,,"Nikki walks off-- Scarlett pick up the paper, looks closer-- Ali enters, dance bag over her shoulder, running late. The Burlesque Girls and Sean all APPLAUD (except Nikki) Ali smiles. Embarrassed. She curtsies sarcastically. Coco points to a BOUQUET OF ROSES at Ali's station."
utter124.1091,utter,COCO,"From Monsieur Louboutin, I presume."
desc124.1092,desc,,"Ali reads the card: ""To the best view in L.A. - M"". Sean shoves her down in her seat, pulls her coat off."
utter124.1093,utter,SEAN,"Shake your tail, Alicat, you still got a show to do."
scene125,slugline,,EXT. THE BURLESQUE LOUNGE - NIGHT
desc125.1094,desc,,A PACKED LINE of chattering hipsters snakes down the block.
scene126,slugline,,"MUSIC UP: ""JUNGLE FEVER"" BY THE CHAKACHAS. (REVAMPED BERLIN MUSIC) INT. BURLESQUE LOUNGE - ON STAGE - NIGHT"
desc126.1095,desc,,"Daredevils Missy and Kitten DeVille, in striped stockings, corsets, and tons of cleavage, swing on a trapeze over the audience. Playing the comedy, grabbing each other in all the right places. Classic Burlesque, unusually bawdy. Equally suggestive, funny, and skillful. Tess, all dolled-up, weaves through the tables, greeting, welcoming, reveling in the crowd. FIND Ali as she strides over to Marcus's booth. He stands, hands her a glass of champagne."
utter126.1096,utter,MARCUS,To the girl of the hour.
utter126.1097,utter,ALI,I'm starting to think you'll go to any length.
utter126.1098,utter,MARCUS,(INNOCENTLY) I just made a call to Greg at the Times.
utter126.1099,utter,ALI,Well-- I appreciate the kudos. (re: crowded room)
desc126.1100,desc,,And Tess appreciates the business.
utter126.1101,utter,MARCUS,This has NOTHING to do with Tess. This is about you. And me.
utter126.1102,utter,ALI,You are so full of it.
desc126.1103,desc,,He laughs-- takes her arm--
utter126.1104,utter,MARCUS,I've got another friend I want you to meet.
desc126.1105,desc,,"She sees HAROLD SAINT sitting in the booth. He's in his 60's, still dressing like Robert Evans in his heyday."
utter126.1106,utter,MARCUS (CONT'D),"Ali Rose, Harold Saint."
utter126.1107,utter,ALI,(SHOCKED) Harold Saint? Shut up. You worked with Etta James.
utter126.1108,utter,HAROLD,"Her, she chewed me up and spat me out, that one. But with her voice, I forgive her everything. (THEN) You got a set of pipes on you, too, little girl. I like your sound."
utter126.1109,utter,ALI,Thank you. (SMILES) I like yours.
utter126.1110,utter,HAROLD,You ever recorded?
utter126.1111,utter,ALI,Not yet.
utter126.1112,utter,HAROLD,We should do something about that.
desc126.1113,desc,,He stands. Turns to Marcus.
utter126.1114,utter,HAROLD (CONT'D),"See you round, kiddo."
desc126.1115,desc,,"He points his finger, gun-style, which would seem cheesy, but he's old school, so instead it's weirdly cool. He leaves."
utter126.1116,utter,ALI,Holy shit. Harold Saint.
desc126.1117,desc,,"AT THE BAR, Jack watches Ali and Marcus talking excitedly. Not liking what he sees. Sean breezes by, grabs a drink."
utter126.1118,utter,SEAN,"You snooze, you lose, pretty boy."
scene127,slugline,,INT. BURLESQUE LOUNGE - BACKSTAGE - NIGHT
desc127.1119,desc,,"Sean grips the drink in his teeth as he bustles through the backstage, gathering costumes. He passes Tess going the other way."
utter127.1120,utter,TESS,Can you believe this crowd?
desc127.1121,desc,,He dumps the costumes in her arms.
utter127.1122,utter,SEAN,'bout time. These poor babies are begging for your glue-gun.
desc127.1123,desc,,"Tess walks off with the armful of clothes, so happy, humming to herself, passes her OFFICE-- OPENS the door to SEE-- VINCE is sitting at her desk. He flinches at the sight of her-"
utter127.1124,utter,TESS,Can you believe the crowd out there? Never thought I'd see-
desc127.1125,desc,,"She stops in her tracks, spotting Vince's PANTS on the FLOOR, and a TRAIL OF WOMEN'S CLOTHES to... THE NEW COCKTAIL WAITRESS, peering out, half-dressed, from behind the curtains--"
utter127.1126,utter,TESS (CONT'D),(DISGUSTED) In my god damn office?
desc127.1127,desc,,She shakes her head-- GRABS HER PURSE-- and walks out.
scene128,slugline,,EXT. BURLESQUE LOUNGE - PARKING LOT - NIGHT
desc128.1128,desc,,"Tess, pissed off, carries the damaged costumes out to her car. Nikki is behind her, following her out."
utter128.1129,utter,NIKKI,Tess. We need to talk.
desc128.1130,desc,,"Tess rolls her eyes, doesn't slow."
utter128.1131,utter,TESS,"Not now, Nikki."
utter128.1132,utter,NIKKI,"Yes, now. I've been here since the beginning. We built this club together. And then some girl shows up out of nowhere-- who hasn't even paid her dues--"
utter128.1133,utter,TESS,I'll get her to write a check tomorrow.
utter128.1134,utter,NIKKI,And suddenly it's her show?
utter128.1135,utter,TESS,"No, it's not her show. It's my show. But people want to hear her sing. She's bringing them in off the streets. You better believe I'm building a show around her!"
utter128.1136,utter,NIKKI,"I can sing too! And you know it. But you don't give a shit. You always say this is a dance troupe, now suddenly it's not?"
utter128.1137,utter,TESS NIKKI-- NIKKI,And you expect me to dance behind a girl who struts in with a new pair of shoes she got for sleeping with Marcus Gerber?
utter128.1138,utter,TESS,"(unlocking her car) Nikki, you're wasted. Go home."
utter128.1139,utter,NIKKI,I won't be upstaged by some slut with mutant lungs!
desc128.1140,desc,,"Tess hurls the costumes in the trunk of her car, furious."
utter128.1141,utter,TESS,"So don't be! Leave! If you don't want to be a part of what's happening here, then I don't want you around."
utter128.1142,utter,NIKKI,(AGHASST) You'd destroy our friendship and break up the group over some girl you barely know?
utter128.1143,utter,TESS,"Since when do you care about friendship? Or this group? You're a trainwreck, Nikki! You put tequila on your breakfast cereal! I'm struggling to survive here, and you show up too drunk to dance! You call that loyalty?"
desc128.1144,desc,,Nikki just looks at her--
utter128.1145,utter,NIKKI,"Okay, then. I quit!"
desc128.1146,desc,,Nikki stomps off. Tess sighs --
desc128.1147,desc,,NIKKI-- WAIT--
utter128.1148,utter,NIKKI,"Marcus says you're losing the club anyway! (MOCKING HER) ""They don't come to hear us sing"" (MORE)"
utter128.1149,utter,NIKKI (CONT'D),(SOTTO) Stupid bitch.
desc128.1150,desc,,Nikki flips her off and keeps walking. Then turns once more:
utter128.1151,utter,NIKKI (CONT'D),By the way: I slept with Vince the day after your honeymoon.
