segment-id,segment-type,segment-speaker,segment-text
desc48.544,desc,,"Maggie raps on the glass of his office and cheerfully holds up a bag of Take-Out. He waves at her, still immersed in his conversation."
scene49,slugline,,INT. QUEENS LOFT - LATER
desc49.545,desc,,"Chinese food cartons going in the garbage. Maggie is cleaning up the remains of take-out as John flops onto the couch, seemingly exhausted. Maggie sits down at the end of the couch."
utter49.546,utter,MAGGIE,So how was the meeting at Parallel Press?
utter49.547,utter,JOHN,I had to push it to Thursday. Georgette was having one of her crises. I couldn't get her off the phone.
utter49.548,utter,MAGGIE,What happened?
utter49.549,utter,JOHN,She got offers from two different UK publishers for her new book and she couldn't decide.
utter49.550,utter,MAGGIE,Wow. She doesn't have anyone else to talk to about something like this except her ex-husband? Especially since her new book is all about our affair and how it ruined her life?
utter49.551,utter,JOHN,I'm sorry I messed up your day.
utter49.552,utter,MAGGIE,Not just my day. Komiko -- my student. She's a fragile person... and I had a meeting set up to discuss her meeting with the toy company. But I had to cancel that meeting because you had a meeting. And then you don't even go to the meeting with the publisher because you were talking Georgette out of her tree! Why does nobody ever talk me out of my tree?!
utter49.553,utter,JOHN,(with affection) Because you're never up a tree. (MORE)
utter49.554,utter,JOHN (CONT'D),"And if you were, you would find your way back down all by yourself."
utter49.555,utter,MAGGIE,"Am I so, so capable that I don't deserve any attention, is that it? Like, the squeaky wheel gets the grease, and the cactus never gets watered?"
desc49.556,desc,,"Attempting to defuse her, John takes off one of Maggie's socks and starts giving her a foot rub."
utter49.557,utter,MAGGIE (CONT'D),"You have to start thinking of yourself as indispensable, John."
utter49.558,utter,JOHN,"(removing the other long knee sock) But I'm not. I'm totally dispensable. On a practical level, you'd be fine without me."
utter49.559,utter,MAGGIE,"Do you realize that Paul faked the ankle thing today just so you would pick him up from school, and then you didn't even show."
utter49.560,utter,JOHN,What do you mean?
utter49.561,utter,MAGGIE,He ran on it when I asked him to go check on Justine. He forgot.
utter49.562,utter,JOHN,That's weird.
utter49.563,utter,MAGGIE,"No. It's not weird. You want to know why? Because his mother is in Reykjavik right now, studying the maternal techniques of the Icelandic. He needs his father's attention. So do I. A beat."
utter49.564,utter,JOHN,Let's go away for a couple days when Georgette gets back. Just the two of us.
desc49.565,desc,,"Maggie sighs, looks at him. She doesn't really want to go away just the two of them at this moment."
utter49.566,utter,MAGGIE,I'm going to start pouting more.
utter49.567,utter,JOHN,(relieved at this levity) Georgette'll give you a tutorial. She's good at that.
desc49.568,desc,,"Close on Maggie. She smiles a sad, tired, alienated smile."
scene50,slugline,,EXT- UNION SQUARE PRODUCE MARKET - DAY
desc50.569,desc,,"Maggie walking beside Lily, who is pushing the stroller."
utter50.570,utter,MAGGIE,Who did you sit with at snack? Alison. (OS) Maggie?
utter50.571,utter,LILY,GUY
desc50.572,desc,,"Maggie turns as the camera pans to see Guy, the pickle entrepreneur, near-father of her child, king of his booth."
utter50.573,utter,MAGGIE,"Oh hi! Hi, Guy! I haven't seen you for so long..."
utter50.574,utter,MAGGIE (CONT'D),(to Lily) This is my friend Guy.
desc50.575,desc,,"Guy comes out of his booth and kneels before Lily, gazing at the little girl with something like reverence."
utter50.576,utter,GUY MAGGIE,"(blank at first, then copping on to his assumption) ? ... Oh, no -- this is Lily. I got married. I should have told you. I met my husband around the same time you gave me the...sample."
desc50.577,desc,,An awkward moment.
utter50.578,utter,MAGGIE (CONT'D),How are you?
utter50.579,utter,GUY,"Intense. I just found out Whole Foods is going to be carrying my pickles nationally. We have to expand production, post-haste!"
utter50.580,utter,MAGGIE,That's amazing.
utter50.581,utter,GUY,I'm manning the stall to get away from the chaos at the factory.
utter50.582,utter,MAGGIE,(a sudden impulse) Oh! Do you still have those Bavarian pickles?
utter50.583,utter,GUY,Sure do. Our most popular pickle.
utter50.584,utter,MAGGIE,Can I buy a large jar please?
utter50.585,utter,LILY,When are we gonna eat the pickles?
utter50.586,utter,MAGGIE,(to Lily) Let's go get some pickles. GUY One large Bavarian.
desc50.587,desc,,He goes back to the booth and hands Maggie a huge jar of pickles.
utter50.588,utter,MAGGIE,That's the biggest jar of pickles I've ever seen. How much do I owe you?
utter50.589,utter,GUY,(glum) Wedding present.
utter50.590,utter,MAGGIE,Thank you. Bye!
desc50.591,desc,,Maggie picks up Lily and puts the jar of pickles in the stroller. Guy watches them go. He and Lily wave to one another. As Maggie and Lily walk off:
utter50.592,utter,MAGGIE (CONT'D),"Oh, wiglet. I'm so glad you're you!"
scene51,slugline,,INT. QUEENS LOFT - KITCHEN- LATE AFTERNOON
desc51.593,desc,,"Hear John's dot matrix printer OS. Maggie is at the kitchen table, the huge jar of Guy's pickles before her. She reaches in and takes out a pickle, chomps down. Yum. John walks in and hands her the latest pages from his manuscript. She takes them with an air of resignation."
utter51.594,utter,MAGGIE,(touching the paper) Wow. Still warm.
desc51.595,desc,,Maggie starts reading as John goes into the bedroom. He speaks through the open hatch.
utter51.596,utter,JOHN,Georgette cancelled her trip.
desc51.597,desc,,"Maggie nods, reading."
utter51.598,utter,JOHN (CONT'D),So she's gonna want the kids next week after all.
desc51.599,desc,,Maggie is still reading. She stops.
utter51.600,utter,MAGGIE,"I'm Mrs. Jeffries, aren't I? ...?"
utter51.601,utter,JOHN MAGGIE,"I'm the colorless, efficient postal worker that you fell in love with because she makes your life so much easier."
utter51.602,utter,JOHN,(put out) I came up with Mrs. Jeffries before we even met.
utter51.603,utter,MAGGIE,"Yeah, well, you turned me into her then."
desc51.604,desc,,"He makes a helpless, fed up gesture."
utter51.605,utter,MAGGIE (CONT'D),At least I don't have a moustache -yet.
scene52,slugline,,INT. QUEENS LOFT BEDROOM - MORNING
desc52.606,desc,,Maggie and John read in bed. Maggie reads a newspaper; John reads the Paris Review. Maggie smiles at something in the paper.
utter52.607,utter,MAGGIE,Do you want to hear your horoscope? No.
utter52.608,utter,JOHN,(immersed)
desc52.609,desc,,"Close on Maggie as she looks at him, a terrible thought going through her head."
utter52.610,utter,MAGGIE (O.S.),I'm terrified that I'm falling out of love with him. Really out of love.
scene53,slugline,,EXT. BROOKLYN STREET - NIGHT
desc53.611,desc,,"Wide shot: Maggie is walking Lily in the stroller. Beside her walks Tony, who pushes Max, now six. Max is reading a thick book by the light of a tiny clamp light."
utter53.612,utter,TONY,Felicia and I fall in and out of love pretty much every week. You can't be so idealistic.
utter53.613,utter,MAGGIE,I wanted to help him become a fiction writer... and now all he does is write. The novel is like five hundred pages long and I don't even think it's half done.
utter53.614,utter,TONY,Have you read it all?
utter53.615,utter,MAGGIE,Most of it.
utter53.616,utter,TONY,Still like it?
utter53.617,utter,MAGGIE,It's getting more and more... complicated. Is it possible to be too smart to be a novelist?
utter53.618,utter,TONY,I haven't heard of that.
utter53.619,utter,MAGGIE,Do you think I have something wrong with me?
utter53.620,utter,TONY,Wrong with you?
utter53.621,utter,MAGGIE,"Yeah, like I have a condition. Where I always fall out of love. Maybe."
desc53.622,desc,,"Maggie stops, and whacks Tony in the arm."
utter53.623,utter,MAGGIE,Shut up! Really? Yes! No!
utter53.624,utter,TONY MAGGIE,You seriously think I have a condition?!
utter53.625,utter,TONY,"No! I don't know. Maybe. No. No, you don't. Maybe you haven't met the right guy yet. Ask Felicia. Don't ask me. I'm not the right guy."
desc53.626,desc,,They keep walking. Maggie looks down at Max reading in his stroller.
utter53.627,utter,MAGGIE,Does he ever walk?
utter53.628,utter,TONY,(as if this explains it) He's gotta finish that book by Friday. 'Does he ever walk'. He's captain of the soccer team.
utter53.629,utter,MAGGIE,"What is it, stroller soccer?"
utter53.630,utter,TONY,You're hilarious.
scene54,slugline,,EXT. LOWER FIFTH AVENUE - DAY
desc54.631,desc,,"We see the arch of Washington Square Park, pedestrians passing."
utter54.632,utter,GEORGETTE,(OS) I will be honest with you.
scene55,slugline,,INT. BOOK STORE - DUSK
desc55.633,desc,,Georgette is reading from her book to a healthy crowd.
utter55.634,utter,GEORGETTE,"This book was born from pain. My husband, whom I am not ashamed to say I loved with all my heart, though we had a difficult relationship, had an affair with a younger woman, left me, and started a new family."
desc55.635,desc,,"As Georgette is baring her soul, Maggie and Felicia walk in at the back of the room. Hearing the text, Maggie immediately hides behind a book case and they both grab glasses of wine, peeking out to watch. Georgette has not noticed them."
utter55.636,utter,GEORGETTE (CONT'D),And what I gleaned from this exquisite torture are the thoughts which this act of betrayal to me as a woman provoked in me as an anthropologist. I must ask myself: is the contemporary obsession with exclusive possession ruining our chances of marital happiness?
scene56,slugline,,INT. BOOKSTORE - DAY
desc56.637,desc,,"The reading is over. People mill about, talking. Georgette is at the bar getting a glass of champagne when she spots Maggie, who is talking to Felicia."
utter56.638,utter,Maggie?,Yes!
utter56.639,utter,GEORGETTE,MAGGIE
desc56.640,desc,,Felicia sidles off to the other side of the room.
utter56.641,utter,GEORGETTE,I recognized you from a picture on Justine's phone.
utter56.642,utter,MAGGIE,"Oh. Yeah, I -- I wanted to hear your reading, it was really..."
desc56.643,desc,,Maggie can't find a word to describe it. Georgette looks at her intently.
utter56.644,utter,GEORGETTE,"I want to thank you. For taking such good care of the children, while I have been gone. I know it's been a burden. I appreciate it."
utter56.645,utter,MAGGIE,You're -- you're welcome. They're wonderful kids.
utter56.646,utter,GEORGETTE,We should get together some time. I feel I have been rather childish about this. I have to face the fact that we are raising them together... the three of us. Georgette has an imperious seductiveness which is impossible to resist.
utter56.647,utter,MAGGIE,Oh yes. Yes. I would love to.
utter56.648,utter,GEORGETTE,Call me some time. It's easy to get my number!
desc56.649,desc,,"Maggie is left standing there, besotted and shocked. She moves to the end of the signing line, beside Felicia, who has bought a copy of ""Bring Back the Geisha""."
utter56.650,utter,MAGGIE,You bought a book?
utter56.651,utter,FELICIA,I couldn't resist.
utter56.652,utter,MAGGIE,Do we need to get it signed?
utter56.653,utter,FELICIA,I think we do.
utter56.654,utter,MAGGIE,"Georgette is fascinating. She's vulnerable, and powerful, and warm, and charming all at once... Now I get why he was so obsessed with her."
utter56.655,utter,FELICIA,"I don't think 'easy to live with' is on that list, though."
utter56.656,utter,MAGGIE,"I like her. I actually like her! I'm such a blockhead. I always thought I was rescuing John from this monstrous egomaniac so he could finally write his book, and that I knew better how to run his life -- I was going to fix everything. (MORE)"
utter56.657,utter,MAGGIE (CONT'D),"But he's totally self-absorbed while I do every single practical thing and make the money. And on top of that, I... if it weren't for Lily I'd say I'd made a terrible mistake."
utter56.658,utter,FELICIA,"(joking--with a glance at Georgette, signing books) Too bad you can't just give him back to his ex-wife."
desc56.659,desc,,Maggie looks over at Georgette with a laugh. But we move in closer and closer on her face until... she's not smiling anymore. She's thinking.
scene57,slugline,,INT. QUEENS LOFT DINING AREA - NIGHT
desc57.660,desc,,"John is sucking the grease off his fingers. Maggie stares at him, no longer charmed by his barbarous eating habits. The kids are speaking Danish."
utter57.661,utter,JUSTINE,(in Danish) I hate brussels sprouts.
utter57.662,utter,PAUL,(in Danish) They're a little hard.
desc57.663,desc,,"Maggie looks over at the kids, totally alienated from her own life."
scene58,slugline,,EXT. QUEENS QUAKER MEETING HOUSE - DAY
desc58.664,desc,,"Maggie walks along a Korea Town street, and into the gate of the 17th century Quaker meeting house. A battered sign reads, ""Quaker Meeting. All Welcome."""
scene59,slugline,,INT. QUEENS QUAKER MEETING HOUSE - DAY
desc59.665,desc,,"High wide shot: the meeting house is empty, but for Maggie, who sits on a wooden bench. We move in closer as she waits for inspiration, some clue as to what to do about her existence. At the end of the push in, she looks up: she's got it."
scene60,slugline,,EXT. GEORGETTE'S BUILDING - DAY Maggie parks outside Georgette's elegant Harlem brownstone.
desc60.666,desc,,"Justine and Paul get out of the van, Justine lugging a stuffed duffel bag."
utter60.667,utter,JUSTINE,So now it suits the captors for the little prisoners to be moved.
utter60.668,utter,PAUL,Aren't you excited to see Mama?
utter60.669,utter,JUSTINE,"Of course I'm excited to see Mama. I'm just sick of never knowing which house any of my stuff is in. I can't wait to be a grown up, so I can have kids and push them around."
desc60.670,desc,,"Maggie, not hearing this, stands on the street scrutinizing the parking sign. Paul and Justine watch her, speaking Danish, their secret language."
utter60.671,utter,JUSTINE (CONT'D),(in Danish w subtitles) Sometimes I wonder if she is a little dim-witted. What is she doing?
utter60.672,utter,PAUL,(in Danish) She's nice.
utter60.673,utter,JUSTINE,(in Danish) You're like a dog. You love whoever feeds you.
utter60.674,utter,PAUL,(in Danish) No I don't!
utter60.675,utter,JUSTINE,"(in English, to Maggie) Is there a problem?"
utter60.676,utter,MAGGIE,I just can't believe I actually found a legal parking space right outside your mom's building.
utter60.677,utter,JUSTINE,You're coming inside?
utter60.678,utter,MAGGIE,Just to say hi.
scene61,slugline,,INT. GEORGETTE'S APARTMENT - KITCHEN - DAY
desc61.679,desc,,Georgette opens her door.
utter61.680,utter,GEORGETTE,"Hi! Hi--oh, hello, Maggie."
utter61.681,utter,MAGGIE,John had a meeting so he asked me to-Come in.
desc61.682,desc,,The kids remove their shoes and greet their mother with great affection. Maggie watches this as she removes her penny loafers. Justine is very tender with her mother. Another person.
utter61.683,utter,GEORGETTE (CONT'D),"(to the kids) I made you a nice snack and you are allowed to watch one single episode of something ghastly while eating it. But no fighting about what it is, Paul. Justine gets to choose."
utter61.684,utter,GEORGETTE (CONT'D),The snacks are already in the den.
desc61.685,desc,,"They run up the stairs. Georgette turns to Maggie, who is standing in her socks. Her demeanor is chillier than it was at the book store."
utter61.686,utter,GEORGETTE (CONT'D),I was about to make some coffee? Or tea?
utter61.687,utter,MAGGIE,Coffee would be great. Thank you.
desc61.688,desc,,Maggie follows Georgette toward the kitchen. The living room is a symphony in taupe. Large photographs of Geishas from the 1920's now dominate the walls.
utter61.689,utter,MAGGIE (CONT'D),Your place is really nice.
scene62,slugline,,Columbia housing! INT. GEORGETTE'S KITCHEN - DAY
desc62.690,desc,,Georgette puts brewed coffee in a blender and holds a stick of butter.
utter62.691,utter,GEORGETTE,I put butter in mine. It nullifies afternoon sugar cravings. Great.
scene63,slugline,,MAGGIE
desc63.692,desc,,Plop goes the butter. Georgette throws the blender into high gear as Maggie backs out.
scene64,slugline,,INT. GEORGETTE'S LIVINGROOM - DAY
desc64.693,desc,,"While Georgette blends the butter next door, Maggie walks through the room, drawn to a beautiful black and white image of a younger John holding Justine. Maggie doesn't notice Georgette coming up behind her."
utter64.694,utter,GEORGETTE,"That's a lovely photo, don't you think?"
utter64.695,utter,MAGGIE,(startled by her) Yes. Thanks.
desc64.696,desc,,"She sips the buttered coffee --ack! Georgette sips hers while maintaining eye contact with Maggie. A sort of ""O.K. Corral"" moment."
utter64.697,utter,MAGGIE(CONT'D),It's good to finally meet you.
utter64.698,utter,GEORGETTE,I won't pretend it doesn't cost me something. Of course.
utter64.699,utter,MAGGIE GEORGETTE,I'm not into fakery.
utter64.700,utter,MAGGIE,Me neither.
utter64.701,utter,GEORGETTE,"I detest the role of the spurned wife, I won't play it-MAGGIE You're not. Am I not?"
utter64.702,utter,GEORGETTE MAGGIE,You still -- have such a deep connection to John.
desc64.703,desc,,Georgette invites Maggie to sit down.
utter64.704,utter,GEORGETTE,"We have managed to remain friends, it's true..."
desc64.705,desc,,Georgette is looking at Maggie with surprise and a little suspicion.
utter64.706,utter,MAGGIE,"I mean, your phone calls..."
utter64.707,utter,GEORGETTE,Do you disapprove of them? No--
utter64.708,utter,MAGGIE GEORGETTE,"The marriage has dissolved, but we are still parenting together."
utter64.709,utter,MAGGIE,"Well, I mean, it's more than just parenting, you guys are on the phone several times a day. Don't get me wrong, I think it's great. So...I..."
desc64.710,desc,,"Georgette is looking at her carefully. Maggie's cheeks are going hot, her heart is speeding up."
utter64.711,utter,GEORGETTE MAGGIE,"Well, it's obvious you're still in love with him."
desc64.712,desc,,"A moment of silence, of disbelief."
utter64.713,utter,GEORGETTE,What the hell are you playing at?
desc64.714,desc,,Maggie decides to jump off the cliff.
utter64.715,utter,MAGGIE,"John and I are in trouble. And I don't think he realizes how badly in trouble we are. Or he doesn't want to know. And then, when I saw you at the reading...I realized-that there might be an opportunity, an opening... somehow...to get the two of you... back together."
utter64.716,utter,GEORGETTE,I see. I see...
desc64.717,desc,,Maggie nods hopefully.
utter64.718,utter,GEORGETTE (CONT'D),"So you're tired of your little affair. You are all done with it. And now you want to make sure you don't feel guilty, so you're going to manipulate us all into some absurd happy ending!"
desc64.719,desc,,"Georgette stands, looking down at Maggie, who is shrinking by the second."
utter64.720,utter,GEORGETTE (CONT'D),"I have met a lot of control freaks in my life, in fact I even thought I was one -- but you make me look like an amateur."
utter64.721,utter,MAGGIE,I didn't mean to insult you.
utter64.722,utter,GEORGETTE,"Have the decency to leave him and face the fact that you poisoned my life, and my children's lives, and probably John's life with your own selfishness. That's your burden. You earned it."
utter64.723,utter,MAGGIE,Excuse me. Wait a minute. If you had such a perfect marriage why was John miserable? You neglected him. You used him. You didn't respect his talent!
utter64.724,utter,GEORGETTE,"If I am so awful, what the hell are you doing here trying to get him back together with me?"
utter64.725,utter,MAGGIE,"I just think that actually, even though I do think you were pretty self-absorbed and extremely needy, he needs it -- it actually kept John in balance. Taking care of you made him think about someone other than himself."
utter64.726,utter,GEORGETTE,Leave. Leave. Leave. What?
utter64.727,utter,MAGGIE GEORGETTE,Leave my apartment.
utter64.728,utter,MAGGIE,Oh! You want me to leave. Okay. I'm leaving.
desc64.729,desc,,Maggie gets out as fast as she possibly can.
scene65,slugline,,EXT. GEORGETTE'S BROWNSTONE- DAY
desc65.730,desc,,"The door shuts behind Maggie. She's shaken, her shoes in her hand. Looks over at her van. There's a parking ticket wedged under the wiper."
scene66,slugline,,INT. TONY & FELICIA'S APARTMENT - LATE AFTERNOON
desc66.731,desc,,It's already dark out. Maggie is lying on the couch as Tony shuttles in and out of the room cleaning up.
utter66.732,utter,MAGGIE,I have never been so humiliated in my life. I'm in such deep oatmeal.
desc66.733,desc,,What was I thinking?
utter66.734,utter,TONY,Maybe you had a psychotic episode.
utter66.735,utter,MAGGIE,But it's a really good idea!
desc66.736,desc,,Tony emerges from the hallway looking rumpled and disgruntled.
utter66.737,utter,TONY,"Life doesn't work that way, you dufus. You can't stuff what's already happened back in the box. God I really think you need help."
utter66.738,utter,MAGGIE,Why are you being so hostile?
utter66.739,utter,TONY,Because this pisses me off! The whole thing pisses me off. Why?
utter66.740,utter,MAGGIE TONY,"Why can't you just leave your husband, like any normal human being?"
utter66.741,utter,MAGGIE,Because it would be such a waste.
utter66.742,utter,TONY,"A waste! You're such a hall monitor. It's not a waste. He's not a paper product. Love is messy, okay? It's illogical and wasteful and it's messy. And it leaves these loose threads sticking out all over the place. But you! You like things neat and tidy and ethical."
utter66.743,utter,TONY (CONT'D),But you messed that up the minute you got with a married man.
utter66.744,utter,MAGGIE,You're not being my friend right now.
utter66.745,utter,TONY,Oh yes I am. I am being your friend. This is being your friend. I'm being honest with you. Good intentions. You're all about good intentions. Little Miss Quaker Two Shoes is gonna do the right thing. But you always somehow screw it up.
utter66.746,utter,MAGGIE,(actually wounded now) Screw you.
utter66.747,utter,TONY,"Yeah, screw me. Fine."
desc66.748,desc,,"She stands up and starts putting on her coat as Tony tidies up the living room, muttering to himself. She is on her way to the door when she stops, filled up with emotion. She cries, suddenly, hard, and sits down helplessly. Tony notices and kneels beside her."
utter66.749,utter,TONY (CONT'D),Hey. Maggie. Hey. I'm sorry.
desc66.750,desc,,"Maggie sits, sobbing."
utter66.751,utter,TONY (CONT'D),"(gently) What about Lily, huh? Fathers are a good thing too."
desc66.752,desc,,He wipes away a tear from her cheek.
utter66.753,utter,MAGGIE,"(through her tears) I know that, I know that. But... I'm just as afraid of her growing up inside a dead marriage as growing up without her dad in the same house. Kids can tell when"
desc66.754,desc,,people are pretending.
utter66.755,utter,TONY,"I don't know, Maggie. It's a tough one."
desc66.756,desc,,She sits still for a long moment. That earnest little face. Trying to figure out the right thing to do again. Click. She's decided. She wipes her tears.
utter66.757,utter,MAGGIE,"Okay. Okay, okay, okay, okay."
scene67,slugline,,INT. QUEENS LOFT - JOHN'S STUDY - NIGHT
desc67.758,desc,,Maggie is sitting in John's Central American hammock as he writes furiously. She looks at peace.
utter67.759,utter,MAGGIE,Yes please.
utter67.760,utter,JOHN,Yes please what.
utter67.761,utter,MAGGIE,"Yes please let's do something, just us. If the offer's still good."
desc67.762,desc,,"He looks up at her, uncertain, but game."
utter67.763,utter,JOHN,What do you have in mind?
utter67.764,utter,MAGGIE,I don't know. Maybe a local adventure.
scene68,slugline,,EXT. CHINATOWN - DAY
desc68.765,desc,,Traffic and lights strung up. A busy Chinatown street.
scene69,slugline,,INT. CHINESE RESTAURANT/HOTEL- DAY
desc69.766,desc,,John walks in with Maggie. The restaurant is empty but for two waiters setting up tables. A young Chinese Woman looks at them quizzically from behind a high desk with a large CASH ONLY sign displayed. He approaches the woman behind the counter. Maggie hangs back. He's speaking very low.
utter69.767,utter,JOHN,Hi. My name is Johnny Harding. I was hoping to speak to Wang. Is he downstairs?
desc69.768,desc,,"The young woman looks doubtful, but eventually she walks up to one of the waiters and whispers in his ear. Maggie makes a move to join John but John tells her to stay where she is. The waiter walks up to John with an impassive expression. John puts his hand on his chest."
desc69.769,desc,,Johnny Harding. The waiter nods. John gestures to Maggie to follow. They both follow the man down a set of stairs.
scene70,slugline,,INT. CHINESE RESTAURANT KITCHEN - DAY
desc70.770,desc,,"Maggie and John follow the waiter through the kitchen. A cook is making dumplings with lightning speed. Maggie looks at him, totally confused."
scene71,slugline,,INT. ILLEGAL GAMBLING DEN - DAY
desc71.771,desc,,"Maggie and John emerge in a room furnished only with gambling tables and a TV on the wall playing a Chinese soap opera. Chinese men and a few women are playing Mahjong, poker, and blackjack. Everyone seems to be smoking. There are only a handful of non-Chinese players. The gamblers look up at these two new outsiders as they walk by."
utter71.772,utter,JOHN,(to Maggie) My dad used to take me to the owner's old place.
desc71.773,desc,,"The waiter leads them to a black jack table where he confers briefly with an older man, and then turns. John hands the waiter a role of bills, enough to be in the game. John and Maggie sit down. A hostess places two tea cups full of clear liquid on the blackjack table and the older man starts dealing. Maggie takes a sip of the liquid in the teacup and does a double take."
utter71.774,utter,MAGGIE,What's in this?
utter71.775,utter,JOHN,"Just drink it, ok?"
