segment-id,segment-type,segment-speaker,segment-text
utter18.273,utter,MAGGIE (CONT'D),"You want some tea? Or...I guess that's his wine, or...I have whiskey. It's a little early."
utter18.274,utter,JOHN,We could make a hot whiskey. Do you have some honey and lemon?
desc18.275,desc,,Maggie looks into the fridge.
utter18.276,utter,MAGGIE,I have half a lemon. And... honey.
utter18.277,utter,JOHN,I'll make it for you.
desc18.278,desc,,Maggie walks to her closet and puts away her coat.
utter18.279,utter,MAGGIE,"Okay, great."
utter18.280,utter,JOHN,(os) You're clearly a reader.
utter18.281,utter,MAGGIE,Actually most of these books are his.
desc18.282,desc,,Maggie looks in the mirror for a moment.
scene19,slugline,,INT. MAGGIE'S SUBLET - AFTERNOON
desc19.283,desc,,Close on a pair of glass mugs filled with hot whiskey.
utter19.284,utter,JOHN,Hot whiskey.
utter19.285,utter,MAGGIE,"Oh, thank you."
desc19.286,desc,,She takes a sip.
utter19.287,utter,MAGGIE (CONT'D),Oh it's so good.
desc19.288,desc,,Medium wide: they sit in silence for a moment.
utter19.289,utter,JOHN,So. Tell me. I'm curious about you.
desc19.290,desc,,Maggie looks up at him.
utter19.291,utter,MAGGIE,What about me? What aspect of me?
utter19.292,utter,JOHN,Every aspect.
utter19.293,utter,MAGGIE,I don't know where to start.
utter19.294,utter,JOHN,How about the beginning?
desc19.295,desc,,"He stands, takes off his jacket."
utter19.296,utter,JOHN (CONT'D) MAGGIE,"Oh, I know."
desc19.297,desc,,John sits down again.
utter19.298,utter,MAGGIE (CONT'D),"(drinks) Well, I had a... kind of unusual start. ...?"
utter19.299,utter,JOHN MAGGIE,"My parents were married fairly young and they never had kids. They were academics at the University of Wisconsin. Then eventually they got divorced, my Dad moved away... but then later, years later, they ran into each other at a party. And they... they got together that night. And that's how I was conceived. On the bed with all the coats. My mom always says that it's because I needed to be born."
utter19.300,utter,JOHN,"I love that idea. That our unborn children are the real gods, dictating the fates of us poor, clueless mortals. Did they...they got together after that?"
utter19.301,utter,MAGGIE,"No. My mother raised me on her own in Madison. She was a professor of nineteenth century British poetry. She wasn't very practical. So I ended up doing all the day-to-day stuff. I was organizing the bills by the time I was twelve. She came from a Quaker family... so she used to take me to Quaker meetings with her. I still go, sometimes. A Quaker."
utter19.302,utter,JOHN MAGGIE,"We had a nice life. And then when I was sixteen, she died. Saying it still shocks Maggie, and tears glimmer in her eyes. ..."
utter19.303,utter,JOHN MAGGIE,(matter of fact) So I moved in with my Dad in Philly.
desc19.304,desc,,Maggie is surprised to feel that she's crying.
utter19.305,utter,JOHN,How was that?
utter19.306,utter,MAGGIE,Um... cordial. And quiet.
utter19.307,utter,JOHN,Sounds lonely. Yes.
desc19.308,desc,,He finds her so touching.
utter19.309,utter,JOHN,I grew up in a house... where nobody ever stopped yelling at each other.
utter19.310,utter,MAGGIE,"(recovering, laughing) Heaven!"
utter19.311,utter,JOHN MAGGIE,(trying to be positive) My dad is a kind man. And he made the best of it. We both did. A moment. The atmosphere has changed.
utter19.312,utter,MAGGIE (CONT'D),So what about you? Tell me about you. Background-wise.
utter19.313,utter,JOHN,My father worked at a blackjack table in Atlantic City. But it's a really long story. And I have to get back to my dysfunction.
desc19.314,desc,,He stands back up. Puts on his coat. Looks down at her sitting on the couch.
utter19.315,utter,JOHN (CONT'D),I believe it. What?
utter19.316,utter,MAGGIE JOHN,That you had to be born.
desc19.317,desc,,"He rushes out the door. As it shuts, the 'reading, writing, falling in love' montage (improvised dialogue) begins:"
scene20,slugline,,INT. MAGGIE'S SUBLET - DAY
desc20.318,desc,,Maggie reads John's book. This image is intercut with:
scene21,slugline,,& GEORGETTE'S APARTMENT - DAY OR NIGHT
desc21.319,desc,,John writing at his dining room table. (We hear his voice
utter21.320,utter,JOHN (V.O.),"Martin Neem dreamed the same thing every night, but he could never remember what it was. His wife, Talia, slept like a stone. Talia was a small woman. (MORE)"
utter21.321,utter,JOHN (V.O.) (CONT'D),"A small, beautiful woman with hair like a river of snakes and the temper of an angry mink."
scene22,slugline,,INT. NEW SCHOOL - BRIDGE HALLWAY - DAY
desc22.322,desc,,"John is walking away from us; Maggie toward us. They meet in the middle of the hallway, greet each other, then John turns and goes off with Maggie, toward camera. He can't resist talking about the new chapter she just read."
scene23,slugline,,EXT. SKATING RINK-DAY
desc23.323,desc,,Maggie skating.
scene24,slugline,,EXT. WASHINGTON SQUARE PARK - DAY
desc24.324,desc,,"John and Maggie discuss his book on their bench in Washington Square Park, eating dosai."
scene25,slugline,,EXT. NEW SCHOOL - COURTYARD - DAY New School courtyard (seen from above on the round bench we
desc25.325,desc,,"saw earlier): Maggie and John, still talking about the text:"
utter25.326,utter,JOHN,Do you think this is overwritten?
utter25.327,utter,MAGGIE,(OS) I think John's book is a novella.
scene26,slugline,,INT. FELICIA AND TONY'S APARTMENT - DAY C22
desc26.328,desc,,"Maggie, looking a little tired, but lovely in a tweed skirt and sweater, is eating a carrot as Tony tries to assemble a piece of IKEA furniture."
utter26.329,utter,MAGGIE,It's short and very strange. It might even be an allegory. I like everything I've read. He's asking me for suggestions.
utter26.330,utter,TONY,Oh? What does his wife think about that?
utter26.331,utter,MAGGIE,"She doesn't know about it. To be honest, I don't think she pays much attention to what he does. She's very self-absorbed. She might even be a narcissist."
utter26.332,utter,TONY,Of course she is.
utter26.333,utter,MAGGIE,Why of course? He's basically a psychiatric nurse. He can't write his novel under those conditions -I think their marriage fell apart after the second child was born. And now he's trapped in it.
utter26.334,utter,TONY,That's what he's telling you.
utter26.335,utter,MAGGIE,Why would he lie?
utter26.336,utter,TONY,To get in your pants!
scene27,slugline,,INT. MAGGIE'S SUBLET - LATE AFTERNOON
desc27.337,desc,,"It's March twenty-third. Guy is taking off his jacket. Maggie looks to see if the pockets are bulging. He reaches into a large pocket and produces a small, mashed bouquet."
utter27.338,utter,MAGGIE,Oh! Thank you.
desc27.339,desc,,"She puts the flowers in a glass, then turns expectantly."
utter27.340,utter,MAGGIE (CONT'D),Did you... bring it?
utter27.341,utter,GUY,Oh! Fuck... I'm sorry.
utter27.342,utter,MAGGIE,That's why I gave you the little... container?
utter27.343,utter,GUY,Where's your bathroom?
desc27.344,desc,,Guy looks around the room.
utter27.345,utter,GUY,So what do I deposit my genetic
desc27.346,desc,,gold mine into? Maggie rushes over to her cupboard and takes out a little plastic jar like the first one she gave him.
utter27.347,utter,MAGGIE,(handing it to him) It's sterile.
desc27.348,desc,,"Guy holds it between his thumb and forefinger. He takes a step to the bathroom, then turns back."
utter27.349,utter,GUY,"Listen. I feel it behooves me, to, ah, offer to do this the old fashioned way. Given the extreme state of your beauty and my totally free afternoon."
desc27.350,desc,,A moment as the absolute awkwardness of this offer sinks in.
utter27.351,utter,MAGGIE,"No...no thank you, Guy. I just think that would be too complicated."
utter27.352,utter,GUY,"No sweat, just being polite."
utter27.353,utter,MAGGIE,Should I go out for a while?
utter27.354,utter,GUY,"Nah, just read something. I'll be back in a jiff with the jizz."
desc27.355,desc,,He marches to the bathroom.
utter27.356,utter,Guy?,Hm?
utter27.357,utter,MAGGIE,GUY
utter27.358,utter,MAGGIE,Why didn't you end up becoming a mathematician?
utter27.359,utter,GUY,"I liked math because it was beautiful, that's all. I never wanted to be a mathematician."
utter27.360,utter,MAGGIE,(encouraged) Really? You think math is beautiful?
utter27.361,utter,GUY,"I don't think. I know. Anyone who has touched even a hem of that garment knows it's beautiful. For me, the hem was enough. I couldn't have taken the frustration."
utter27.362,utter,MAGGIE,What do you mean?
utter27.363,utter,GUY,Of never seeing the whole thing. Of
desc27.364,desc,,always just getting little glimpses
desc27.365,desc,,"Embarrassed by his own candor, Guy turns and shuts the door to the bathroom, leaving Maggie bemused and oddly charmed by this unique character. Hearing the water run in the bathroom, she turns some Ska music up high on the iPod as a sound buffer. She is so happy, she does a solitary dance. After a few beats, Guy appears with the plastic jar Maggie gave him, a little cloudy something at the bottom. He watches her dance for a moment. We can see how much he likes her. Seeing him, Maggie stops dancing, embarrassed."
utter27.366,utter,MAGGIE,Wow. Swift.
desc27.367,desc,,"She tries to take the jar, but Guy swoops it away from her and washes it off in the kitchen sink, then swaddles it in a tea towel like a newborn."
utter27.368,utter,GUY,"Of course when there's an actual lady involved, it's a different story. I made you extra...just in case you spill some."
desc27.369,desc,,"He hands her the bundle gently, as if it were already a baby."
utter27.370,utter,MAGGIE,"Thank you, Guy. This is really great."
desc27.371,desc,,"Super. He just stands there. Now what? He fishes his phone out of his pocket and turns the lens on himself, Maggie, and the container, which he gets her to hold up. Maggie is embarrassed and confused. Selfie."
scene28,slugline,,INT. MAGGIE'S SUBLET - BATHROOM - NIGHT
desc28.372,desc,,"Insert close up: Maggie, wearing blue surgical gloves, fills a plastic syringe with Guy's sperm."
scene29,slugline,,INT. MAGGIE'S SUBLET - BATHROOM - LATER
desc29.373,desc,,"Maggie has a thermometer in her mouth, syringe in one hand. She takes out the thermometer, reads her temperature, then punches the number into her phone. A voice calls out of the phone: ""you have a: seventy-one percent chance of being fertile right now"". The phone rings. Maggie puts it on speaker phone."
scene30,slugline,,INT. TONY AND FELICIA'S KITCHEN - INTERCUT
utter30.374,utter,TONY,Did you do it yet?
utter30.375,utter,MAGGIE,My apps are giving me contradictory information. Maybe I should wait.
utter30.376,utter,TONY,I would wait. For like five years.
utter30.377,utter,MAGGIE,Let me talk to Felicia.
desc30.378,desc,,Felicia takes the phone.
utter30.379,utter,FELICIA,Don't listen to him. He's losing his mind.
utter30.380,utter,MAGGIE,"(OS) Yeah, he seems a little on edge."
utter30.381,utter,FELICIA,You think so? He's driving me crazy with theories of mental illness in Guy Childers' family.
utter30.382,utter,TONY,"(in BG, grating parmesan) I met his mother once. She had a face like a hatchet and she never stopped sighing. And she DRANK."
utter30.383,utter,FELICIA,Tony just loves you too much. He wants to keep you for himself.
utter30.384,utter,MAGGIE,What are you talking about? You know that's not true.
utter30.385,utter,FELICIA,"He doesn't want you to move on to the next step in your life because then he, too, might actually have to grow up."
utter30.386,utter,TONY,(from back of the kitchen) Will you shut the fuck up?
desc30.387,desc,,"Felicia smiles, giving Tony a semi-jovial middle finger."
utter30.388,utter,MAGGIE,(thermometer in her mouth) How high does your temperature have to be?
utter30.389,utter,FELICIA (O.S.),I think just slightly elevated.
utter30.390,utter,TONY (O.S.),Are you talking about the temperature? (MORE) TONY (O.S.) (CONT'D) (yelling) A hundred and one! It has to be a hundred and one degrees!
utter30.391,utter,FELICIA,(to Tony) When was the last time you ovulated?
utter30.392,utter,TONY,I read about it.
desc30.393,desc,,"Back at Maggie's apartment, the camera leaves Maggie, begins to move through Maggie's living room, toward the buzzer, like a curious animal with a will of its own."
utter30.394,utter,FELICIA,"(OS) You know it doesn't usually work the first time anyway... My girl friend, Odette..."
utter30.395,utter,TONY,(OS) Odette? That woman is nuts!
utter30.396,utter,FELICIA,(OS) You just hate her cause she's a performance artist.
desc30.397,desc,,"Close on the buzzer, which buzzes, LOUD."
utter30.398,utter,MAGGIE,"(OS) Wait! Hold on. Wait! The doorbell goes off again, for a really long time. Someone"
utter30.399,utter,MAGGIE (CONT'D),"(to Felicia, OS) Bye!"
scene31,slugline,,INT. TONY AND FELICIA'S APARTMENT. NIGHT.
desc31.400,desc,,Tony is still grating parmesan.
utter31.401,utter,TONY,"You had her speak at Max's class, and she said the words ""MY VAGINA"" three times."
scene32,slugline,,INT. MAGGIE'S SUBLET - NIGHT
desc32.402,desc,,"Maggie is wiggling along the floor on her back, pelvis up wearing surgical gloves and her night gown. The buzzer rings again."
utter32.403,utter,MAGGIE,I'm coming!
utter32.404,utter,FELICIA,(OS) Maggie have you done it yet?
utter32.405,utter,TONY,(OS) Have you done it?
desc32.406,desc,,"Finally Maggie reaches the door, reaches up with one leg, and answers the buzzer with her toe."
utter32.407,utter,MAGGIE,(yelling) Hello!? (os) It's John.
desc32.408,desc,,"Reflexively, she jumps to her feet, looks down. Oh, shoot!"
utter32.409,utter,MAGGIE MAGGIE (CONT'D),Wait a minute! I just need a minute!
desc32.410,desc,,Maggie runs into the bathroom.
scene33,slugline,,INT. MAGGIE'S SUBLET - BATHROOM - NIGHT
desc33.411,desc,,Jump Cut: Maggie takes a quick shower -- see her from outside the shower reaching for the soap with a surgical-gloved hand.
scene34,slugline,,EXT. MAGGIE'S BUILDING - NIGHT
desc34.412,desc,,John waiting. He looks like a man about to go into the ring.
scene35,slugline,,INT. BATHROOM - NIGHT
desc35.413,desc,,"Maggie pulls on another nearly identical night gown, but this one has sleeves."
scene36,slugline,,INT. MAGGIE'S SUBLET - NIGHT
desc36.414,desc,,"Maggie streaks into the kitchen holding the jar with the remains of the sperm in it, sticks it in the freezer. Back to the buzzer with paper towels and sterilizing spray, she mops up the mess. At last, having tidied up all evidence, she presses the buzzer."
utter36.415,utter,MAGGIE,John? Are you still there? Yeah?
desc36.416,desc,,Maggie buzzes him in.
scene37,slugline,,INT./EXT. MAGGIE'S BUILDING - VESTIBULE - NIGHT
desc37.417,desc,,John comes through the metal gate and approaches the front door.
scene38,slugline,,INT. MAGGIE'S SUBLET - NIGHT
desc38.418,desc,,"He comes in. He's very tense, seems upset. They talk in the doorway."
utter38.419,utter,MAGGIE,Are you okay?
utter38.420,utter,JOHN,I got locked out. Georgette is in Pennsylvania with the kids...
utter38.421,utter,MAGGIE,Oh! Do you want to stay on the couch?
desc38.422,desc,,John looks at the couch.
utter38.423,utter,JOHN,Not really.
desc38.424,desc,,"He walks in. Sits on the couch. Maggie, thrown by his presence, starts making conversation."
utter38.425,utter,MAGGIE,"So I'm on chapter five. Now I think Mrs. Jeffries is my favorite character. She's so pallid and reliable but he finds her so attractive, in spite of her moustache. I just wonder... What?"
utter38.426,utter,JOHN MAGGIE,If maybe the wife's behavior is getting a little... large?
utter38.427,utter,JOHN,"You should come over to my house. That book is like a documentary. No, I'm sure you're right. I'm sure I'm exaggerating her behavior."
desc38.428,desc,,His face is filled with distress. He gets up and paces.
utter38.429,utter,MAGGIE,"No it's really funny! I don't want you to change it. Maybe it's more about, like how much of it you do."
utter38.430,utter,I-JOHN,"Ah, fuck it!"
desc38.431,desc,,He suddenly falls to his knees at Maggie's feet and clings to the hem of her long night gown. Maggie is astonished. John looks up at her.
utter38.432,utter,JOHN (CONT'D),I'm in love with you. ...
utter38.433,utter,MAGGIE JOHN,I'm genuinely locked out of my apartment. But I'm also in love with you. (MORE)
utter38.434,utter,MAGGIE (CONT'D),And I don't want to be married to Georgette anymore. And please could I stay in your bed?
desc38.435,desc,,"She doesn't say anything, doesn't move. It is only now really hitting her how she feels about this man. She is finally admitting it to herself. He unbuttons the lowest button of her long night gown. She looks down at him, desire blooming. Another button. Another. All the way up, until we glimpse her naked breasts between the crack in the cloth. They are face to face. He whispers."
utter38.436,utter,JOHN,I don't want you to have a baby with the pickle man. ...
utter38.437,utter,MAGGIE JOHN,I want you to have a baby with me...
desc38.438,desc,,She wants him terribly but she just has to be honest.
utter38.439,utter,MAGGIE,I need to tell you something. I...tried already.
utter38.440,utter,JOHN MAGGIE,Recently...
utter38.441,utter,JOHN,What happened?
utter38.442,utter,MAGGIE,It didn't work! It didn't work. I just had to tell you because...
utter38.443,utter,JOHN,Because why?
utter38.444,utter,MAGGIE,Because I love you. I'm in love with you.
desc38.445,desc,,"They look at one another, and they kiss. They move onto the bed. Maggie looks up at John with open, frank sexuality. She has never felt this way before. He leans down to kiss her. There is a flare of light from the bedside lamp which obscures the image."
scene39,slugline,,EXT. QUEENS - DAY
desc39.446,desc,,"Buttery sunlight flares in the lens. Gradually through the flare we see Maggie from behind carrying her 2 1/2 year old daughter, Lily, on her hip. A long dolly shot: She walks to the mailbox at the end of the street and lets Lily mail a bill. Then they walk back and we see them from the front. Bliss."
scene40,slugline,,EXT. QUEENS LOFT - DAY
desc40.447,desc,,"Maggie carries Lily to their storefront loft, opens the big metal door..."
scene41,slugline,,INT. QUEENS LOFT - DAY
desc41.448,desc,,"John types in his glassed-in office. ""Dancing in the Dark"" by Bruce Springsteen is blasting. Maggie walks in with Lily on her hip and turns down the music after a panicked moment of looking for the ipad. Lily stomps in and jumps up and down. Daddy!"
desc41.449,desc,,Lily goes off to play. John comes out of his office.
utter41.450,utter,JOHN,You turned down my song.
utter41.451,utter,MAGGIE,It was very loud.
utter41.452,utter,JOHN,That's the point.
utter41.453,utter,MAGGIE,"I'm sorry, shall I turn it up again?"
utter41.454,utter,JOHN,"You really are from Wisconsin, arent't you?"
desc41.455,desc,,They kiss.
scene42,slugline,,INT. QUEENS LOFT - LATER
desc42.456,desc,,The three of them are eating soup. Happy.
utter42.457,utter,MAGGIE,"Can you watch her for an hour, I"
desc42.458,desc,,have a conference call.
utter42.459,utter,JOHN,"Ah-- I was going to keep writing, but sure."
desc42.460,desc,,Maggie stands and hands Lily over to John.
utter42.461,utter,JOHN (CONT'D),"Come on, girl, let's make a big mess."
utter42.462,utter,LILY,Can I bring Froggy?
utter42.463,utter,JOHN,Sure. Bring Froggy.
desc42.464,desc,,Lily clutches a little plastic green frog as John carries her into the kitchen. They begin to play.
scene43,slugline,,INT. QUEENS LOFT - MAGGIE'S WORK SPACE - DAY
desc43.465,desc,,Maggie is on her call.
utter43.466,utter,MAGGIE,Yes. The last time we spoke you wanted to do something with skateboarding and architecture. Is that still what you're thinking?
utter43.467,utter,HIGGS (O.S.),"Absolutely. I want to be a fragile little human, scaling some big architectural monolith -- asserting my value even as I glide along the"
desc43.468,desc,,surface of some priceless
utter43.469,utter,MAGGIE,"(dreamy, searching) Right. Like... skateboarding down the ramp of the Guggenheim..."
desc43.470,desc,,A phone rings OS.
utter43.471,utter,HIGGS (O.S.),Yeah! Exactly! That's perfect.
utter43.472,utter,MAGGIE,I didn't mean the actual
utter43.473,utter,Guggenheim.,Why not?
desc43.474,desc,,From across the loft Maggie hears:
utter43.475,utter,MAGGIE,Excuse me a minute. (hitting 'mute') John?!
desc43.476,desc,,No answer. Maggie gets up and walks toward the bathroom.
utter43.477,utter,LILY,Froggy is drowning! JOHN?!
utter43.478,utter,MAGGIE LILY,"Froggy is drowning, Mommeeee!!!!"
desc43.479,desc,,John is on the phone. He looks toward the bathroom.
utter43.480,utter,JOHN,(to Lily) Hold on a second...
utter43.481,utter,MAGGIE,(into phone) Sorry about this but I have another urgent call. I'll be right back on.
desc43.482,desc,,Maggie rushes to the bathroom.
scene44,slugline,,INT. QUEENS LOFT - BATHROOM - DAY
desc44.483,desc,,"Lily is screaming, looking into the toilet. Maggie walks in."
desc44.484,desc,,"Froggy fell in, and then he was hungry. Maggie looks into the toilet. There is a box of Koala Crisps in the toilet, along with half the box of cereal."
utter44.485,utter,MAGGIE,"Wow, Lily. This is a big mess."
utter44.486,utter,JOHN,(OS talking into the phone) I could send you the next couple chapters...
utter44.487,utter,MAGGIE,Where is Froggy?
utter44.488,utter,LILY,Under there.
utter44.489,utter,MAGGIE,Don't worry. We're gonna save him!
desc44.490,desc,,She retrieves the frog from the toilet and puts him in the sink.
utter44.491,utter,LILY,"Can I wash him, Mommy?"
utter44.492,utter,MAGGIE,"Yeah, let's wash him. Don't touch him yet..."
utter44.493,utter,LILY,I wanna wash him...
utter44.494,utter,MAGGIE,"See, we saved him!"
desc44.495,desc,,Lily peers over the side of the sink as Maggie washes the frog in hot water. Her little cheeks are tear stained.
utter44.496,utter,LILY,(whispering) Sorry Froggy.
desc44.497,desc,,"Remembering her call, Maggie un-mutes the phone."
desc44.498,desc,,No one there. Great. John ends his call. He looks happy. They meet outside the bathroom.
scene45,slugline,,INT. QUEENS LOFT KITCHEN - DAY
utter45.499,utter,JOHN,Did you take care of Froggy?
utter45.500,utter,MAGGIE,"(keeping up her good humor) Yeah, but why didn't you?"
utter45.501,utter,JOHN,That guy from Parallel Press called.
utter45.502,utter,MAGGIE,"Oh great, what did he say?"
utter45.503,utter,JOHN,He wants to meet me at four.
utter45.504,utter,MAGGIE,But you were taking Lily this afternoon because I have a meeting with a student?
utter45.505,utter,JOHN,"Oh, shit. Sorry."
utter45.506,utter,MAGGIE,Maybe I can push it.
desc45.507,desc,,John is hopeful.
utter45.508,utter,MAGGIE (CONT'D),But who is going to pick up Paul and Justine?
utter45.509,utter,JOHN,"Oh, fuck. All right."
desc45.510,desc,,He starts for the phone.
utter45.511,utter,MAGGIE,No--It's okay -- I'll reschedule my meeting.
utter45.512,utter,JOHN,You don't mind? No. Really? Yes.
utter45.513,utter,MAGGIE JOHN,MAGGIE JOHN
desc45.514,desc,,She goes back into the bathroom. John makes for his study. The phone rings again. John turns and answers.
utter45.515,utter,JOHN (CONT'D),"Hello...he what??... All right, hang on."
desc45.516,desc,,"John turns to Maggie, who is still in her rubber gloves."
utter45.517,utter,JOHN (CONT'D),Paul twisted his ankle in eurythmics. You're gonna have to leave now.
desc45.518,desc,,Close on Maggie as she digests this.
scene46,slugline,,EXT. DANISH-AMERICAN SCHOOL - DAY
desc46.519,desc,,"This is a nice private school for Danes, nestled in a townhouse. Maggie, Lily on her hip, emerges from the school, opening the heavy door for Paul, who is now nine. He is on crutches and looks very sorry for himself."
utter46.520,utter,PAUL,Where's Dad?
utter46.521,utter,MAGGIE,"He's in a meeting sweetie, but crutches! Wow. Does it hurt a lot?"
desc46.522,desc,,Paul is upset.
utter46.523,utter,MAGGIE (CONT'D),We have a while before Justine gets out.
desc46.524,desc,,"Maggie helps the kids into the car, walks to the driver's side and loads in the crutches."
scene47,slugline,,INT. MINIVAN / DANISH-AMERICAN SCHOOL - DAY
desc47.525,desc,,Paul and Lily are laughing hysterically in the back seat. They are making a great deal of noise. Maggie has her eyes shut. The phone rings. Maggie has to answer this one.
utter47.526,utter,MAGGIE,Hello? Oh thank you so much for
desc47.527,desc,,calling me back. Excuse me-Maggie puts her hand over the phone and talks to Paul in the back seat.
utter47.528,utter,MAGGIE (CONT'D),Paul can you check what's taking Justine so long?
desc47.529,desc,,"Paul hurries out of the car. As he enters the school, Maggie notices that he has forgotten his crutches and is running on his hurt foot."
utter47.530,utter,MAGGIE (CONT'D),"Thanks for holding. I was hoping to schedule a meeting, we have a grad student -- A student at the New School, Komiko Krauss, just patented a toy we'd love to have a chance to present --Yes. The doll. Yes. Oh great. Ten on Wednesday is fine. Thank you. Bye!"
desc47.531,desc,,As Maggie talks we see Justine helping Paul walk out of the school. He has remembered his injury and is hopping on one leg. Justine Gets in.
utter47.532,utter,Hi!,Hi.
utter47.533,utter,MAGGIE (CONT'D),JUSTINE
utter47.534,utter,MAGGIE,Got caught up in the locker room?
utter47.535,utter,JUSTINE,(quiet) I couldn't find my shoes.
utter47.536,utter,MAGGIE,"Well, we're all here now!"
utter47.537,utter,JUSTINE,What's for dinner?
utter47.538,utter,MAGGIE,Good question. I'll pick something up. Daddy's at a meeting.
utter47.539,utter,JUSTINE,When's Mom coming home?
utter47.540,utter,MAGGIE,I don't know. But I bet there's a plan!
desc47.541,desc,,The van drives off.
scene48,slugline,,INT. QUEENS LOFT - JOHN'S STUDY NIGHT
desc48.542,desc,,John is on the corded phone with Georgette.
utter48.543,utter,JOHN,"Georgette. The advance is only five thousand more, so why would you not go to the house with the better editor? You keep talking in circles. Munroe is the better editor for this book... For all the reasons we've been talking about!"
