segment-id,segment-type,segment-speaker,segment-text
utter101.1051,utter,GEORGETTE,Ask Justine.
utter101.1052,utter,PAUL (OS),She's busy. (pause) Mom?
desc101.1053,desc,,John jumps off the bed.
utter101.1054,utter,JOHN,"(whispering, cinching his belt) This is ridiculous. I have to go."
utter101.1055,utter,GEORGETTE,Where will you stay?
utter101.1056,utter,JOHN,I don't know. I'll just call some friends--try to avoid a hotel. We've got to give them time to adjust.
desc101.1057,desc,,"They kiss. She slips out the door. John waits till she is gone a while, just stands there stock-still."
utter101.1058,utter,GEORGETTE,"(os) All right, Paul, here I come to cut up your apple!"
scene102,slugline,,EXT. GEORGETTE'S HOUSE - NIGHT
desc102.1059,desc,,"John making calls, leaving a few messages with various friends he could stay with for the night. Jump cuts as he leaves messages. Then, finally:"
utter102.1060,utter,JOHN,"Felicia! Thank God you're home...ah, not so good."
scene103,slugline,,INT. TONY AND FELICIA'S APARTMENT - NIGHT
desc103.1061,desc,,Felicia and John have been talking for a while. Felicia is knitting.
utter103.1062,utter,JOHN,So she already told you guys? She called you?
utter103.1063,utter,FELICIA,"She called me. I don't know about Tony, he's been out all day."
utter103.1064,utter,JOHN,What'd she say? Is she going to be okay?
utter103.1065,utter,FELICIA,"You know Maggie. She's been taking care of herself all her life. I mean, she's emotional-JOHN This whole thing feels so unreal."
utter103.1066,utter,FELICIA,I know. I think it's better to be honest. When you can.
utter103.1067,utter,JOHN,I'm just so surprised!
utter103.1068,utter,FELICIA,"I know. I mean, I can imagine."
desc103.1069,desc,,"A fumbling at the lock. Singing. It's Tony, in a rumpled suit. Three sheets to the wind."
utter103.1070,utter,TONY,John! Aren't you in Canada?
utter103.1071,utter,FELICIA,No. He's here.
desc103.1072,desc,,Tony looks at Felicia. She glares at him to keep silent.
utter103.1073,utter,JOHN,So you won your case?
utter103.1074,utter,TONY,We trounced them.
utter103.1075,utter,JOHN,What was it about?
utter103.1076,utter,TONY,Tainted pudding. A lawsuit?
utter103.1077,utter,JOHN TONY,"What else? Lawsuits keep my wife in post-modern choreography, and me in self-loathing. A good deal all round."
utter103.1078,utter,FELICIA,If you're going to be in that kind of mood you should just go to bed.
desc103.1079,desc,,Tony is fumbling around in a kitchen cabinet.
utter103.1080,utter,TONY,"I'm craving one little nip of that vanilla whiskey you so lovingly gave me for Christmas, Fi."
utter103.1081,utter,FELICIA,Looks like you've had enough of something.
desc103.1082,desc,,Tony holds up a bottle. Talks to John.
utter103.1083,utter,TONY,This stuff is like liquid crack. Have some?
utter103.1084,utter,JOHN,Just a finger. Thanks.
desc103.1085,desc,,Tony sits down and grimaces in pain.
utter103.1086,utter,TONY FELICIA,What is it?
utter103.1087,utter,TONY,I sat on my balls.
utter103.1088,utter,FELICIA,I think you should have your balls hemmed. Like that actor -- what's his name?
utter103.1089,utter,JOHN,Are you serious?
utter103.1090,utter,FELICIA,"Apparently it's just a few stitches, and -- boop! A ball lift."
utter103.1091,utter,TONY,(adjusting his seat) So. John. Any news?
desc103.1092,desc,,"John looks at Felicia, wondering how much Tony knows."
utter103.1093,utter,JOHN,You haven't spoken to Maggie?
utter103.1094,utter,TONY,I've been knee-deep in pudding all day.
utter103.1095,utter,FELICIA,John and Maggie are...
utter103.1096,utter,JOHN FELICIA,He and Georgette...
utter103.1097,utter,TONY,"(unthinking, drunk) You mean it worked?!"
utter103.1098,utter,JOHN,What worked?
utter103.1099,utter,TONY,"(a desperate attempt to recover) Who said that drinks are like tits - one is too few, three too many?"
utter103.1100,utter,JOHN,What worked? What are you talking about?
utter103.1101,utter,TONY,"(looking sick, pushes his drink away) I'm not really much of a drinker."
utter103.1102,utter,FELICIA,No. You're not.
desc103.1103,desc,,John sits immobile as the terrible logic accrues in him.
utter103.1104,utter,JOHN,"So this is what Georgette kept almost telling me. Oh, Jesus."
desc103.1105,desc,,Tony and Felicia go into a frenzy of lame denial.
utter103.1106,utter,FELICIA,She might have been trying to tell
utter103.1107,utter,you-JOHN,You guys set me up? No! No!
scene104,slugline,,EXT. QUEENS LOFT - DAWN
desc104.1108,desc,,The elevated train snakes across the tracks above the store front.
scene105,slugline,,INT. QUEENS LOFT - BEDROOM--DAWN
desc105.1109,desc,,"John walks into the room and turns on the light, starts taking his clothes out of the drawers. Maggie wakes up. John?"
utter105.1110,utter,MAGGIE JOHN,Was it a test? ...
utter105.1111,utter,MAGGIE JOHN,"To see if I really was in love with Georgette, as you apparently suspected?"
desc105.1112,desc,,A pause. Maggie feels a little frightened.
utter105.1113,utter,JOHN (CONT'D),You happy now?
utter105.1114,utter,MAGGIE,Happy isn't the right word.
utter105.1115,utter,JOHN,I don't even know what to say. I'm speechless.
utter105.1116,utter,MAGGIE,"We were going to break up. I had a feeling you were still in love with Georgette. And you were, as it turns out."
utter105.1117,utter,JOHN,What about Lily? My daughter. Where does she fit into this plan of yours?
utter105.1118,utter,MAGGIE,"If we're going to break up it's -better to do it soon, for her sake. So that's all she remembers."
desc105.1119,desc,,John flips.
utter105.1120,utter,JOHN,"But I didn't want to break up! Because, among other things, I was committed to you and we had a child together."
utter105.1121,utter,MAGGIE,Not because you wanted to be with me.
utter105.1122,utter,JOHN,"(on a wave of his own thoughts--packing all the while) So this is the fate you've picked out for me -- to just ricochet around the tri-state area, ruining one family after another? I don't accept that. I didn't choose this. I can't believe I let you make me feel so -- so guilty about betraying you and wrecking our marriage, when you masterminded this whole thing, manipulated me into falling for my ex-wife, colluded with her to get me invited to that conference, to make me into some absurd patsy, a pawn in your revolting little narrative. Well guess what? Your puppet is cutting his strings. You can both fuck yourselves."
utter105.1123,utter,MAGGIE,You and Georgette never really stopped being together the whole time we were married. What?
utter105.1124,utter,JOHN MAGGIE,"I mean, you thought it was over, but it never really was. This is the proof, isn't it. It's what you wanted. Be honest."
utter105.1125,utter,JOHN,"I think the question really is what do you want? What do you want, Maggie Hardin?"
utter105.1126,utter,MAGGIE,I want to live honestly.
utter105.1127,utter,JOHN,Well you're not off to a very good start.
utter105.1128,utter,MAGGIE,I don't want a marriage that's a lie. I don't want to tiptoe around our disconnection anymore. You deserve to be with someone who really -- gives herself over to you. I did what I thought was right.
utter105.1129,utter,JOHN,You're very ethical.
utter105.1130,utter,MAGGIE,You're the one who slept with someone else.
utter105.1131,utter,JOHN,(laughing in spite of himself) Are you fucking kidding me? John zips up his bag.
utter105.1132,utter,JOHN (CONT'D),"By the way, just out of curiosity -did you ever love me?"
utter105.1133,utter,MAGGIE,Of course I did.
utter105.1134,utter,JOHN,That's nice.
utter105.1135,utter,MAGGIE,Where are you going?
utter105.1136,utter,JOHN,I have no idea.
utter105.1137,utter,MAGGIE,What about the kids?
utter105.1138,utter,JOHN,"You and Georgette seem to be such good teammates, strategize with her."
desc105.1139,desc,,He leaves. Maggie stares at the door he's walked out of.
scene106,slugline,,INT. LILY'S ROOM - DAY
desc106.1140,desc,,Maggie walks Lily's room and lies on the bed. Lily stirs and looks over the railing of her bed. What Mama? LILY
utter106.1141,utter,MAGGIE,Oh wiglet. I did something really stupid. To fix something else I did that turned out wrong. And I thought it was going to end up wonderful. But I made a big mess.
utter106.1142,utter,LILY,"(finally, something she can relate to) You made a mess?"
desc106.1143,desc,,Maggie recovers somewhat. Laughs through her tears.
utter106.1144,utter,MAGGIE,Yes. But I don't know how to clean it up.
utter106.1145,utter,LILY,(lying down again) Use a sponge. Just forget about it.
desc106.1146,desc,,Maggie can't help smiling.
scene107,slugline,,EXT. MINIVAN / QUEENS STREETS - AFTERNOON
desc107.1147,desc,,Maggie is driving with Lily in the back.
scene108,slugline,,INT. GEORGETTE'S KITCHEN - DAY
desc108.1148,desc,,Maggie walks in. Georgette is at the table.
utter108.1149,utter,MAGGIE,He found out. How?
utter108.1150,utter,GEORGETTE MAGGIE,Tony. My best friend. He was drunk. It slipped out.
desc108.1151,desc,,Georgette sits down and takes this in.
utter108.1152,utter,GEORGETTE,It was inevitable. I almost told him myself several times.
utter108.1153,utter,MAGGIE,The tragic flaw in my plan.
utter108.1154,utter,GEORGETTE,Where is he?
utter108.1155,utter,MAGGIE,I don't know. I think he's just really sick of both of us. Mostly me.
desc108.1156,desc,,A moment of silence.
utter108.1157,utter,MAGGIE (CONT'D),Georgette. I don't know what to say.
desc108.1158,desc,,"Georgette looks at her, deeply."
utter108.1159,utter,GEORGETTE,"You're a funny person. There is something very... pure about you and -- a little bit stupid. Or, no, it's... a kind of innocence. You're so -- unconscious. Yet. I can't help it, I like you. I don't blame you. I just shouldn't have allowed him back in my life. I had decided against it, even in Canada. I wasn't even going to let it happen. It was the snow. It was the cozy, cozy snow. Der Wassa Huchlich. We just... fell for each other again. I wanted my husband back."
utter108.1160,utter,MAGGIE,I don't think you have to lose him.
utter108.1161,utter,GEORGETTE,"(with a flash of anger) You know what? If he does call you, tell him to screw off. (MORE)"
utter108.1162,utter,GEORGETTE (CONT'D),Tell him from me.(Seeing Justine enter) Hello darling!
utter108.1163,utter,MAGGIE,How about if I take all the kids for a few days.
utter108.1164,utter,GEORGETTE,Stop it. Stop trying to take care of everybody.
utter108.1165,utter,MAGGIE,"It's fine. They won't mind, they're used to me, right Justine?"
utter108.1166,utter,JUSTINE,Could you please just tell me what's going on?
desc108.1167,desc,,Both women look at the child. She stares back at them solemnly.
utter108.1168,utter,MAGGIE,Your Dad and I had a big fight and he's taking some time.
utter108.1169,utter,JUSTINE,(to Georgette) Are you and him getting back together?
utter108.1170,utter,GEORGETTE,It's a complex situation. Justine: a disturbing thought is forming.
utter108.1171,utter,GEORGETTE (CONT'D),Are you sad? No. Angry?
utter108.1172,utter,JUSTINE,MAGGIE
desc108.1173,desc,,Justine looks at the women for a beat.
utter108.1174,utter,JUSTINE,"You guys really have no idea what you're doing, do you?"
desc108.1175,desc,,Maggie and Georgette stand unable to answer.
utter108.1176,utter,JUSTINE (CONT'D),"I mean, there is no plan, is there?"
scene109,slugline,,INT/EXT. MINIVAN / QUEENS STREETS - AFTERNOON
desc109.1177,desc,,"Maggie is driving Georgette, Justine, Paul, and Lily back to QUEENS. She looks dolefully at Georgette in the passenger seat. Georgette is staring, catatonic. Now Maggie will be taking care of her, too."
scene110,slugline,,INT. QUEENS LOFT - JUSTINE'S ROOM / KITCHEN - NEXT DAY
desc110.1178,desc,,School time! Maggie tiptoes down the hall and peeks into Justine's room and sees Georgette asleep on an air mattress clutching John's manuscript.
utter110.1179,utter,MAGGIE,(whispering) Justine did you find your charger?
utter110.1180,utter,JUSTINE,(whispering) Yes.
desc110.1181,desc,,Justine exits her room as:
utter110.1182,utter,PAUL,(yelling from kitchen) Where is my science book?! Sshshsh!
scene111,slugline,,MAGGIE
desc111.1183,desc,,"Maggie runs into kitchen, picks up Lily and puts her on her hip. Packing snacks, book bags, pencil cases, her own brief case, making oatmeal... the kitchen is a mess. Georgette stalks into the room carrying John's manuscript."
utter111.1184,utter,MAGGIE (CONT'D),Did you sleep?
utter111.1185,utter,GEORGETTE,Maybe two hours.
utter111.1186,utter,MAGGIE,Go back to bed.
utter111.1187,utter,GEORGETTE,"I'll help, then go back later."
utter111.1188,utter,MAGGIE,It's okay. Really.
utter111.1189,utter,GEORGETTE,I want to help.
desc111.1190,desc,,"Georgette, determined to help, squints to see the print on the dish washing liquid, then shrugs and puts some in the dishwasher, turns it on, then sits on the couch and starts reading again. She's almost done."
utter111.1191,utter,MAGGIE,(to Justine) What about your basketball uniform? I washed it-Oh no.
utter111.1192,utter,JUSTINE MAGGIE,"It's okay, it's all folded, just -here -- it's almost quarter after, we're gonna be late if -PAUL I can't find any socks."
utter111.1193,utter,MAGGIE,Just take some out of the laundry basket.
utter111.1194,utter,PAUL,(yelling from the other room) They're dirty!
utter111.1195,utter,MAGGIE,"Wear them anyway, it's fine. (to Justine) You have your pencil case?"
desc111.1196,desc,,Maggie grabs a canvas shopping bag and stuffs the gear into
utter111.1197,utter,MAGGIE (CONT'D),Okay let's go!
desc111.1198,desc,,Paul is looking at something. Maggie...?
desc111.1199,desc,,Maggie turns. There are suds foaming out of the dishwasher. A lot of suds. Maggie runs toward the suds and dives in to save the day.
scene112,slugline,,EXT. MINIVAN / QUEENS STREETS - DAY
desc112.1200,desc,,"Maggie, a few residual suds in her hair, shepherds everyone into the car and leaves. Lily shouts out numbers."
scene113,slugline,,INT. QUEENS LOFT - DAY
desc113.1201,desc,,"Georgette finishes the book, closes it, contemplates it furiously. She then gets up, takes a metal trash can, puts it on the coffee table, and lights the first page of the manuscript. It goes up in flames."
scene114,slugline,,EXT. QUEENS STREET - DAY
desc114.1202,desc,,Maggie's van chugs along on the way in to Manhattan.
scene115,slugline,,EXT. NEW SCHOOL - DAY
desc115.1203,desc,,Maggie runs into the building.
scene116,slugline,,INT. QUEENS LOFT - DAY
desc116.1204,desc,,Georgette sets another page of John's manuscript alight. A merry fire leaps up. Georgette watches it burn.
scene117,slugline,,EXT. NEW SCHOOL - AFTERNOON
desc117.1205,desc,,Maggie runs out of work at the end of the day. Still late.
scene118,slugline,,INT. QUEENS LOFT - AFTERNOON
desc118.1206,desc,,"Maggie walks in, breathless, overwrought, Lily on one hip, groceries on the other."
utter118.1207,utter,LILY,Twenny five - twenny seven! Fitty two!
desc118.1208,desc,,Justine and Paul tumble in behind her. Georgette is showered and dressed. She seems more collected.
scene119,slugline,,MAGGIE
desc119.1209,desc,,Georgette takes the bag of groceries. Maggie puts Lily down and Lily runs to her corner to play. Maggie sniffs.
utter119.1210,utter,MAGGIE (CONT'D),Is something burning? No.
utter119.1211,utter,GEORGETTE MAGGIE,I'm thinking steamed carrots and pork chops.
utter119.1212,utter,GEORGETTE,I'll make apple sauce.
desc119.1213,desc,,Georgette peels an apple.
utter119.1214,utter,GEORGETTE (CONT'D),Thank God it's Friday.
utter119.1215,utter,MAGGIE,"I think if we take them all skating tomorrow, then you go to the movie"
desc119.1216,desc,,with Justine. It'll scare Paul.
utter119.1217,utter,PAUL,No it won't!
utter119.1218,utter,GEORGETTE,Yes it will.
utter119.1219,utter,JUSTINE,It's rated PG-13 Paul. You can only handle G.
utter119.1220,utter,PAUL,That's not fair.
utter119.1221,utter,JUSTINE,I'm not having you crawling in my bed for the next month.
utter119.1222,utter,MAGGIE,(to Paul) I can take you and Lily to something else. Let's look at what's playing.
utter119.1223,utter,PAUL,"Is ""Ice Maiden Adorable"" still playing?"
utter119.1224,utter,MAGGIE,You really want to see that again? Yes!
desc119.1225,desc,,Justine makes a retching face as she gets a snack from the fridge.
utter119.1226,utter,GEORGETTE,We can't do that to Maggie. That's not fair.
utter119.1227,utter,MAGGIE,"I don't care, I'll take a nap."
desc119.1228,desc,,Maggie has started chopping carrots.
scene120,slugline,,MAGGIE (CONT'D)
desc120.1229,desc,,Maggie's nicked her finger and sucks the tip.
utter120.1230,utter,GEORGETTE,Maggie. Sit down. Where are the band-aids?
desc120.1231,desc,,"Maggie points to a shelf, sits. Georgette gets her a band-aid and puts it on Maggie's trembling finger. Maggie is panicking."
utter120.1232,utter,MAGGIE,(to Georgette) Have you heard from John?
utter120.1233,utter,JUSTINE,I did. He sold his car and bought a motorcycle. And he's taking us to the Giants on Sunday.
utter120.1234,utter,GEORGETTE,Oh for God's sake.
utter120.1235,utter,MAGGIE,Where is he living?
utter120.1236,utter,JUSTINE,I'll ask him when we're in the stands.
desc120.1237,desc,,"Georgette turns to Maggie, who is on the verge of a panic attack. She can't breathe well and she's almost in tears."
utter120.1238,utter,GEORGETTE,Justine can you take Paul in to watch TV?
desc120.1239,desc,,Justine and Paul go.
utter120.1240,utter,GEORGETTE (CONT'D),What is it?
utter120.1241,utter,MAGGIE,"I'm sure if you see each other-GEORGETTE No more matchmaking ideas. No more ideas, period. You've had your thinking license revoked."
utter120.1242,utter,MAGGIE,"I'll never get involved with anyone else's fate again -- not even my own. I'll become a completely passive, non-interventional -Buddhist. I just feel like you guys were so close to-GEORGETTE You have to let this go, Maggie."
desc120.1243,desc,,"This story has its own momentum,"
utter120.1244,utter,MAGGIE,"I'm so sorry. I thought I was going to do something really grand, like a coup... I'm so sick of being me."
utter120.1245,utter,GEORGETTE,You should really try the tapping.
utter120.1246,utter,MAGGIE,What tapping?
utter120.1247,utter,GEORGETTE,"I went to a workshop on biofeedback. It's amazing. What you do is, you figure out the essential thing you want to change, and you make a sort of dictum. Like, for you, ""I am not controlling,"" maybe. Or whatever you want to change."
utter120.1248,utter,MAGGIE,'I am not controlling' is good.
desc120.1249,desc,,"And you tap like this-Georgette taps herself on the top of the head, between the eyebrows, under her nose, on her chin, her temple, behind the ear, and on the wrist, and Maggie imitates her, repeating after her, emotion building in her still and brimming over as she taps."
utter120.1250,utter,GEORGETTE (CONT'D),I am not controlling. (tap tap tap)
utter120.1251,utter,MAGGIE,I am not controlling. (tap tap tap)
utter120.1252,utter,GEORGETTE,(tapping) I leave people to their own fate.
utter120.1253,utter,MAGGIE,(tapping) I leave people to their own fate. Etc...
scene121,slugline,,EXT. QUEENS STREET - DAY
desc121.1254,desc,,Georgette marches toward camera with great determination.
scene122,slugline,,EXT. CAFE - DAY
desc122.1255,desc,,Establishing shot.
scene123,slugline,,INT. CAFE - DAY
desc123.1256,desc,,"Georgette waits, a coffee beside her. John sets his helmet on the table."
utter123.1257,utter,JOHN,So why did you want to see me?
desc123.1258,desc,,He sits. They glare at each other.
utter123.1259,utter,GEORGETTE,I wanted to return your book.
desc123.1260,desc,,She takes a plastic baggie filled with ashes from her purse and puts it in front of him.
utter123.1261,utter,JOHN,Where shall I scatter these?
utter123.1262,utter,GEORGETTE,Anywhere is fine.
utter123.1263,utter,JOHN,"I can't believe you burned my fucking book, on top of everything else."
utter123.1264,utter,GEORGETTE,I burned a copy of your book.
utter123.1265,utter,JOHN,You probably didn't even read it.
utter123.1266,utter,GEORGETTE,Of course I read it. That's why I burned it! You cannibalized our marriage to write that story.
utter123.1267,utter,JOHN,You didn't even bother to fictionalize us in yours.
utter123.1268,utter,GEORGETTE,I don't write fiction!
utter123.1269,utter,JOHN,"You think you painted a precise portrait of us in ""Bring Back the Geisha?"" I can't believe you're making me feel bad about the sins of my unpublished novel -- are we just going to gloss over your actual lies and manipulation?"
utter123.1270,utter,GEORGETTE,I'm not a liar! You know I never lie. I lied now... I manipulated... I debased myself morally -because... I loved you so terribly much. Maybe you could be flattered.
desc123.1271,desc,,This reaches him a little. He knows what it costs her.
utter123.1272,utter,JOHN,"If you love me so much, why not just -- tell me?"
utter123.1273,utter,GEORGETTE,You were married.
utter123.1274,utter,JOHN,"Oh, Georgette."
utter123.1275,utter,GEORGETTE,So you won't take any responsibility for the state of your life? You're just a victim of our plot?
utter123.1276,utter,JOHN,I'm not a victim. I'm just a man who has fucked his life up and is now trying to find an airbnb to live in.
utter123.1277,utter,GEORGETTE,There is nothing more to say in that case.
desc123.1278,desc,,"She starts putting on her coat; he makes ready to go. It's over. Then, she stops. She's making one more tactical military maneuver to conquer him:"
utter123.1279,utter,GEORGETTE (CONT'D),The reason your novel doesn't work is: You put too much weight on the allegory. You're trying to use fiction to prove a thesis. The text is crying out for passages of pure economic theory. Narrative blended with theory is your specialty. Make it into a John Harding book and it could be a phenomenon.
utter123.1280,utter,JOHN,You really think so?
utter123.1281,utter,GEORGETTE,"I know it John. You just have to accept it'll probably be published by Yale University Press, not Scribner's. Mark my words: you'll be shortlisted for a Bateson Prize. You might even get one."
desc123.1282,desc,,He stares at her.
utter123.1283,utter,JOHN,Fuck. You did it again. What?
utter123.1284,utter,GEORGETTE JOHN,You know me better than I know me.
utter123.1285,utter,GEORGETTE,Sometimes I wish I didn't.
desc123.1286,desc,,He really sees her. The air is charged.
utter123.1287,utter,JOHN,You look very beautiful in that light.
utter123.1288,utter,GEORGETTE,I'll seek out these lighting conditions whenever possible in that case.
utter123.1289,utter,JOHN,You do that.
desc123.1290,desc,,"He moves toward her. And then, they kiss, ravenously..."
scene124,slugline,,INT. QUEENS LOFT - BEDROOM - DAWN
desc124.1291,desc,,"Maggie wakes up from an unremembered dream, filled with a glorious intuition. Lily sleeps beside her."
scene125,slugline,,INT. QUEENS LOFT - BEDROOM - DAY
desc125.1292,desc,,Maggie is dressing Lily. They talk and laugh.
scene126,slugline,,EXT. PROSPECT PARK - ICE RINK
desc126.1293,desc,,Maggie and Lily skate on the ice.
scene127,slugline,,INT. QUEENS LOFT - BATHROOM - DAY
desc127.1294,desc,,Lily and Maggie brush their teeth in their pyjamas.
scene128,slugline,,INT. QUEENS LOFT - BEDROOM - DAY
desc128.1295,desc,,Another day. Maggie and Lily play on the floor.
scene129,slugline,,INT. QUEENS LOFT KITCHEN - DAY
desc129.1296,desc,,Maggie and Lily eat their eggs. A sense of contentment. Absolute love.
scene130,slugline,,EXT - PROSPECT PARK - ICE RINK - DAY
desc130.1297,desc,,"Three weeks later. One shot: Lily is skating between Maggie and John, each holding a little hand. She is wearing a pin that says ""I'm Three!"" on it. Maggie and John hand Lily to a skating instructor, flanked by Justine. The instructor escorts Lily to a clutch of little girls on skates. LITTLE GIRLS Happy Birthday, Lily! This is Lily's third birthday party. It's a skating party. The skating instructor calls out cheerful commands. We follow John as he skates over to Georgette, who is holding onto the railing for dear life. She loses her balance. John catches her."
utter130.1298,utter,JOHN,Winter sports aren't really your strong suit.
utter130.1299,utter,GEORGETTE,It's not fair! On skates I'm not able to defend myself.
utter130.1300,utter,JOHN,"I'm keeping you on ice for the rest of your life, in that case."
desc130.1301,desc,,"He pushes her on the ice as she screams in fear and joy. In the stands, Tony, Felicia, and Max watch this tender scene. Tony is lacing up Max's skates. Maggie skates up to them and leans on the barrier."
utter130.1302,utter,TONY,(referring to Georgette
utter130.1303,utter,and John),Has it ever occurred to you that this might have all happened anyway? Even if you hadn't played Titania and sprinkled fairy dust in everyone's eyes?
utter130.1304,utter,MAGGIE,Of course it's occurred to me.
utter130.1305,utter,FELICIA,"You'll never know if it was you, or the Hand of Destiny."
utter130.1306,utter,MAGGIE,I've decided to embrace the mystery of the universe and stop bossing everyone around so much.
utter130.1307,utter,MAX,"Good luck with that, bossy pants."
desc130.1308,desc,,"Max walks off, toward the ice. Maggie stares after him."
utter130.1309,utter,MAGGIE,He's been listening to us this whole time?
desc130.1310,desc,,Max is already walking to the skating rink.
utter130.1311,utter,TONY,One day he's going to write a book about us all. And we are not going to look good.
desc130.1312,desc,,Max skates off--he's a demon skater. Felicia watches Lily skate by in the gaggle of little girls.
utter130.1313,utter,LILY,"(shouting, to Justine) ...fifty-two a hundred!, fiftythree a hundred!, fifty-four..."
utter130.1314,utter,FELICIA,What kind of three year old loves numbers that much?
utter130.1315,utter,TONY,Was John good at math? Because you certainly weren't.
utter130.1316,utter,MAGGIE,I'm not sure...
