segment-id,segment-type,segment-speaker,segment-text
desc0.0,desc,,MAGGIE'S PLAN
desc0.1,desc,,Based on a story by Karen Rinaldi
scene1,slugline,,EXT. GREENWICH VILLAGE STREET - DAY
desc1.2,desc,,"MAGGIE: We see the back of her blonde head. It's a beautiful winter day. Now we see her from across the street. We see her feet making determined strides. This is a young woman who knows where she is going. Wide shot: A blind man is tentatively making ready to cross the street. Among the handful of pedestrians about to cross, Maggie is the only one to notice, and helps the man across."
scene2,slugline,,EXT. PRODUCE MARKET - DAY
desc2.3,desc,,"TONY, Maggie's best friend, looks a little like Art Garfunkel as a young man: fluffy hair, glasses, dressed in a suit jacket and baggy chinos. He's pushing a stroller with a reading, fluffy-haired, bespectacled four year old boy in it, wearing a t-shirt with ""IMAGINE THERE'S NO FRACKING"" written on the front. This boy is too big to be in a stroller, and too young to be reading. Maggie rushes to them."
utter2.4,utter,MAGGIE,Sorry! Sorry I'm late... Hi! Hi Max!
desc2.5,desc,,She snuffles the little boy's neck.
utter2.6,utter,MAGGIE (CONT'D),You still have one little corner of baby smell. Right (sniff) there.
desc2.7,desc,,Max giggles and pushes her away so he can get back to his reading. Maggie straightens up.
utter2.8,utter,MAGGIE (CONT'D),"Ach, I need a baby!"
desc2.9,desc,,She bites her fist.
utter2.10,utter,TONY,You need a baby? You're such an impatient little fuss-budget.
utter2.11,utter,MAGGIE,I just don't see why I should wait.
utter2.12,utter,TONY,"For a father, perhaps?"
utter2.13,utter,MAGGIE,Let's face it. I've never been in a serious relationship that lasted longer than six months.
utter2.14,utter,TONY,(paying) We were together for two years.
desc2.15,desc,,They walk.
utter2.16,utter,MAGGIE,In college. And we made each other miserable for the rest of the time.
utter2.17,utter,TONY,I admit it. We were miserable. But we were also happy. Yeah.
desc2.18,desc,,They reach a stand of homemade jams. Tony picks one up.
utter2.19,utter,TONY,"Just so you know. I have little sperm tucked away in a facility uptown, if you're in a pinch."
utter2.20,utter,MAGGIE,What?! Why? I thought Felicia didn't want any more kids.
utter2.21,utter,TONY,Felicia does not want any more kids. I froze it in case I ever meet anybody nice.
utter2.22,utter,MAGGIE,"No, you didn't."
utter2.23,utter,TONY,"I didn't. But I might, you know, save it, like 'mad money'-style?"
desc2.24,desc,,"Maggie has something to tell Tony, and she wants to get it"
utter2.25,utter,MAGGIE,"(rushing this part) Do you remember Guy Childers, from college?"
desc2.26,desc,,A moment as Tony searches for the name in his mind.
utter2.27,utter,TONY,Wasn't he the Guy...he's a pickle salesman?
utter2.28,utter,MAGGIE,"He's a pickle entrepreneur. And-he's agreed to make a donation, so I can inseminate myself."
utter2.29,utter,TONY,But he has no sense of personal space!
utter2.30,utter,MAGGIE,"So what? He was a math major. Anyway, I'm not marrying him, I'm borrowing his genes."
utter2.31,utter,TONY,But not his personality I hope. Guy Childers...?
utter2.32,utter,MAGGIE,(shrugs) Everybody has something a little wrong with them. You think everybody's honest who fills out those questionnaires at the sperm bank?
utter2.33,utter,TONY,I can't believe you've been cooking this up all this time and you didn't even tell me.
utter2.34,utter,MAGGIE,I knew that you'd yell at me.
utter2.35,utter,TONY,I'm not yelling at you! Isn't this sort of thing for women who are like forty-nine and desperate?
utter2.36,utter,MAGGIE,"I don't want it to be a last resort, I want it to be a choice. (MORE)"
utter2.37,utter,MAGGIE (CONT'D),"Because I'm ready be a mother, and I don't believe I'll find a man who I can stay in love with-- or who can stay in love with me-- for more than six months. I'm just facing the truth about myself."
desc2.38,desc,,"Tony is morose at this news, but he accepts it."
utter2.39,utter,TONY,So when's the insemination? Are we gonna have a party?
utter2.40,utter,MAGGIE,In four months.
desc2.41,desc,,As they walk away from camera:
utter2.42,utter,TONY,Do I have bad breath?
desc2.43,desc,,He breaths into the air near her mouth. She sniffs. No. Do I?
desc2.44,desc,,She breathes into his mouth.
desc2.45,desc,,And they walk off. Good friends; unusual friends...
scene3,slugline,,INT. GUY CHILDERS' BROOKLYN PICKLE FACTORY - DAY
desc3.46,desc,,"Hipsters in hats and Mexican technicians are creating pickles in huge vats. GUY is walking Maggie through aisle after aisle of pickles. Guy is wearing a Peruvian hat with flaps, shorts, and clogs."
utter3.47,utter,GUY,"I started production in my apartment three years ago. Now I have twelve employees, and I just got an order from Whole Foods. If that works out we're taking off. But I'm still very hands on. Every pickle has my stamp of approval on it."
desc3.48,desc,,He withdraws a pickle from a vat.
utter3.49,utter,GUY (CONT'D),"Here, try this one."
utter3.50,utter,MAGGIE,I love this!
desc3.51,desc,,That's the Bavarian. Classic.
utter3.52,utter,MAGGIE,This is the best pickle I've ever had.
desc3.53,desc,,"Guy looks at her, beaming."
scene4,slugline,,INT. FRONT DESK - DAY
desc4.54,desc,,Guy and Maggie are at the front desk of Brooklyn Brine. Guy takes off his gloves as Maggie notices a pair of hockey skates hanging from a coat stand. You skate?
utter4.55,utter,MAGGIE GUY,Every Sunday. I grew up on the ice.
utter4.56,utter,MAGGIE,Oh right. You were on the ice hockey team. Yeah.
utter4.57,utter,GUY MAGGIE,I used to skate a lot when I was little. A moment of awkwardness.
utter4.58,utter,GUY,"So, regarding our plan. Here... is my bill of health."
desc4.59,desc,,"With an air of pride, he spreads his blood test results across the desk."
utter4.60,utter,GUY (CONT'D) MAGGIE,(scanning the results) That's great.
utter4.61,utter,MAGGIE (CONT'D),Oh! I have for you:
desc4.62,desc,,"Maggie takes an empty plastic specimen jar out of her purse. Ah. He takes it and looks into it, as if for an answer."
utter4.63,utter,MAGGIE,"You need to keep it warm, when you...so just put it next to your body underneath your shirt...and you can come right over. Okay..."
desc4.64,desc,,Guy places the jar on the desk. They look at it together.
utter4.65,utter,GUY (CONT'D),So when do you want to do this?
utter4.66,utter,MAGGIE,March...twenty third?
desc4.67,desc,,Guy thinks about his schedule. No conflicts come to mind.
utter4.68,utter,MAGGIE (CONT'D),I just want to build up some more savings.
desc4.69,desc,,"Guy pulls out a stool for Maggie solicitously, in anticipation, perhaps, of her pregnancy."
utter4.70,utter,GUY,That's smart.
utter4.71,utter,MAGGIE,"I have insurance and everything. So, I guess the question is, how much involvement do you want? I was going to suggest none, but I'm open to negotiation."
desc4.72,desc,,A beat as Guy digests this.
utter4.73,utter,GUY,"None is...so cool. It kind of takes the pressure off, doesn't it?"
desc4.74,desc,,"He takes a seat and leans back against the refrigerator, beside a large circulating fan."
utter4.75,utter,GUY (CONT'D),"I can just relax, and build my empire."
desc4.76,desc,,"The fan blows Guy's STD bloodtest result paper across his desk; they both move to stop it, and their fingers touch."
scene5,slugline,,INT. MAGGIE'S BUILDING - DAY
desc5.77,desc,,"Close up of a mailbox being opened with a key. Maggie draws out two identical white envelopes. Puzzled, she opens one, then the other."
scene6,slugline,,EXT. MAGGIE'S SUBLET - DAY
desc6.78,desc,,Maggie walks outside.
scene7,slugline,,INT./EXT. NEW SCHOOL - DAY
desc7.79,desc,,Maggie enters the big glass doors.
scene8,slugline,,INT. NEW SCHOOL - BURSAR'S OFFICE - DAY
desc8.80,desc,,A large woman with close-cropped hair and a neck brace sits behind the desk with the air of a sage.
utter8.81,utter,MAGGIE,Hi Beverly. I got two checks this month. Not that I'm complaining.
utter8.82,utter,BEVERLY,You sure they're not for two different payments?
utter8.83,utter,MAGGIE,I would love to think that... but they have the same date on them and I was paid last month.
utter8.84,utter,JOHN,Excuse me...
desc8.85,desc,,"The camera pans right to include a shambolic, sleep-deprived, edgy man."
utter8.86,utter,JOHN (CONT'D),I couldn't help but overhear this young woman got two checks. And I don't have any.
desc8.87,desc,,"Beverly looks up at him, displeased at this complication."
utter8.88,utter,BEVERLY,What's your name?
utter8.89,utter,JOHN,John Harding.
utter8.90,utter,MAGGIE,"Oh well my name is Johanna Hardin, I mean my name is Maggie... but on the check it's Johanna Margaret Hardin. So maybe there was a mixup. Beverly is on the computer. She looks a little put out. She hates this kind of thing."
utter8.91,utter,BEVERLY,Yep. And it's gonna take a minute to figure this out.
utter8.92,utter,JOHN,It would be great if it could be resolved soon.
desc8.93,desc,,Beverly looks up at him with her final answer.
utter8.94,utter,BEVERLY,We'll get back to you.
scene9,slugline,,INT. NEW SCHOOL - BRIDGE HALLWAY - DAY
desc9.95,desc,,Maggie and John walk down the hallway.
utter9.96,utter,JOHN,"Damn. That woman could guard hell, if Cerberus ever needs to go to the vet."
utter9.97,utter,MAGGIE,Everyone's scared of Beverly. What do you teach?
utter9.98,utter,JOHN,"Ficto-critical Perspectives in Family Dynamics, and Masks in the Modern Family, Victorian Times to the present day."
utter9.99,utter,MAGGIE,Psychology department?
utter9.100,utter,JOHN,Anthropology.
utter9.101,utter,MAGGIE,(scrutinizing him) I don't know any anthropologists.
utter9.102,utter,JOHN,What about you?
utter9.103,utter,MAGGIE,I'm the Director of Business Development and Outreach for the art and design students.
utter9.104,utter,JOHN,What's that?
utter9.105,utter,MAGGIE,I help graduate students strategize for success in the art and design world. Sort of a bridge between art and commerce. I help them sell their souls. And eat.
utter9.106,utter,JOHN,Are you old enough to do that job?
utter9.107,utter,MAGGIE,I have a master's degree in arts management.
desc9.108,desc,,"They exit frame as the camera, with a will of its own, pans down to look through the glass wall at the courtyard below, and a round metal bench with a phallic center."
utter9.109,utter,JOHN,(os) Good to know. See you later.
utter9.110,utter,MAGGIE,(os) Good luck with getting paid!
scene10,slugline,,INT. NEW SCHOOL - CAFETERIA - DAY
desc10.111,desc,,"Several days later, Maggie is in line with FELICIA, Tony's wife. Felicia is wearing a t-shirt with ""What would Jesus Buy?"" Written on it. She and Felicia are mid-conversation when John calls out. The camera pans over to him."
utter10.112,utter,JOHN,Felicia -- when is that -- that Pike fellowship meeting?
utter10.113,utter,FELICIA,Thursday at seven.
utter10.114,utter,JOHN,"(sighing) Great, thanks. The women sit."
utter10.115,utter,MAGGIE,That's so funny that you know John Harding.
utter10.116,utter,FELICIA,(eating her soup) We're on a committee together. He's a real panty melter. Why?
utter10.117,utter,MAGGIE,"No, we just -- had a check mix-up recently -- because of our names-Hardin/Harding."
utter10.118,utter,FELICIA,"He's one of the bad-boys of Fictocritical Anthropology. Apparently, he was a big deal in Chicago. And now he just does adjunct work here, but they're really salivating for him to teach full-time."
utter10.119,utter,MAGGIE,Why won't he?
utter10.120,utter,FELICIA,I don't know. I think it has something to do with his wife. She's some kind of monster apparently.
utter10.121,utter,MAGGIE,Where did you hear this?
utter10.122,utter,FELICIA,"(shrugging) Around. She's got tenure at Columbia. Georgette Norgaard. The words 'Glacial' and 'Terrifying' have been bandied about. Then again I've heard myself described as a psychotic bitch, but I think I'm actually pretty nice, so... you can't believe everything you hear."
desc10.123,desc,,Maggie is distracted by John's voice.
utter10.124,utter,JOHN,"-if you say 'she was, like, terrified', it's nothing compared to saying' she was terrified'. ""Like"" is a language condom. Trust me."
desc10.125,desc,,"Maggie looks back at John, now a far more mysterious character."
utter10.126,utter,FELICIA,(searching in her salad) Where the fuck is my chicken?
scene11,slugline,,EXT. WASHINGTON SQUARE PARK - FOUNTAIN - DAY
desc11.127,desc,,"John is nursing a coffee, sitting on a bench, reading the paper, when he notices Maggie, who is circling the fountain with vigorous, calisthenic strides. He watches her circle a couple times. Calls out:"
utter11.128,utter,JOHN,"Hey, Hardin? Oh, hi!"
utter11.129,utter,MAGGIE JOHN,What are you doing?
utter11.130,utter,MAGGIE,I'm taking a little constitutional before my next meeting.
desc11.131,desc,,John gets up and walks over to her.
utter11.132,utter,MAGGIE (CONT'D),Did you get paid yet?
utter11.133,utter,JOHN MAGGIE,You're kidding.
utter11.134,utter,JOHN,Beverly tells me the check is coming any day now.
desc11.135,desc,,Maggie and John walk past a man in a fancy suit kneeling to scoop up his dog's turd.
utter11.136,utter,JOHN (CONT'D),I knew this Masai from Tanzania. He was here to run in the Marathon. He took everything in New York City in complete stride. Nothing fazed him until he saw a grown man following
desc11.137,desc,,"his dog, picking up its shit. He started laughing so hard, he wept."
utter11.138,utter,MAGGIE,"I guess that-- custom-- would be strange, like, out of context."
utter11.139,utter,Whoops!,What?
utter11.140,utter,JOHN MAGGIE,I overheard part of your conversation. About 'like' being a - language prophylactic. He's trying to remember saying that.
utter11.141,utter,MAGGIE (CONT'D),"What is ficto-critical anthropology, anyway?"
utter11.142,utter,JOHN,"It's a way of writing about anthropology that blends ethnographic observation, story telling and, like, theory."
desc11.143,desc,,A beat. Two smiles.
utter11.144,utter,JOHN (CONT'D),"Do we have to walk in a circle, or are we allowed walk around the park?"
utter11.145,utter,MAGGIE,We're allowed.
desc11.146,desc,,They begin to meander.
utter11.147,utter,MAGGIE (CONT'D),(curious about him) It's so hard to find a full-time position.
utter11.148,utter,JOHN,"When my wife, Georgette, was offered a tenured position at Columbia, I decided to put off a job search, just teach a few classes and finally try to write this novel I've had in my head for years."
desc11.149,desc,,They pass two bomb squad-looking men sharing a joke.
utter11.150,utter,MAGGIE,"(intrigued) So, are you getting a lot of work done, on your novel?"
utter11.151,utter,JOHN,"They say every relationship has a gardener, and a rose. Georgette is definitely the rose."
utter11.152,utter,MAGGIE,And you're the gardener.
utter11.153,utter,JOHN,And I don't have a green thumb.
utter11.154,utter,MAGGIE,Maybe you're a rose in disguise.
utter11.155,utter,JOHN,It would be a very good disguise.
desc11.156,desc,,They walk along for a moment.
utter11.157,utter,JOHN (CONT'D),She's wonderful. It's just she's kind of destroying my life.
desc11.158,desc,,"Maggie isn't sure how to respond to this remark, dropped as a kind of aside as John ambles along."
utter11.159,utter,MAGGIE JOHN,"No, no. It's just been a bad week. (looking up at the sky) It's turning into a beautiful day."
desc11.160,desc,,They come to a man performing Shakespearean soliloquies for
utter11.161,utter,ACTOR,"Content with Hermia? No! I do repent/The tedious minutes I with her have spent. Not Hermia, but Helena I love./Who would not change a raven for a dove?"
desc11.162,desc,,John gives him a dollar.
utter11.163,utter,ACTOR (CONT'D),"Thanks, man."
scene12,slugline,,EXT. WASHINGTON SQUARE PARK - BENCH - MINUTES LATER
desc12.164,desc,,A few minutes later. They have cupcakes and are sitting on the same bench John was on earlier. They are midconversation.
utter12.165,utter,JOHN,We have two of those. Best part of my life. Who's your guy?
utter12.166,utter,MAGGIE,"No guy. Actually, the man I've asked to be the father is named Guy, coincidentally. John tears a bite off."
utter12.167,utter,MAGGIE (CONT'D),(laughing) You eat like Mr. Fox! ...
utter12.168,utter,JOHN MAGGIE,There was a Roald Dahl book? And then it was a movie-JOHN Oh yeah. My kids loved that movie.
desc12.169,desc,,Maggie looks at her watch.
utter12.170,utter,JOHN (CONT'D),"I really like what you're doing, though--having a baby by yourself. Not that it won't be hard, because it's gonna be fucking hard. But, I admire your courage. And I love babies."
utter12.171,utter,MAGGIE,I just don't like leaving my destiny...
utter12.172,utter,JOHN,To destiny? Right.
desc12.173,desc,,"The Shakespearean actor from the park walks by them, still in his ruff. He is with another man who is silent, furious."
utter12.174,utter,ACTOR,(tearful) But where will I go?
desc12.175,desc,,The other man shrugs. The Actor runs after his lover.
utter12.176,utter,ACTOR (CONT'D),You can't just kick me out of our house...
utter12.177,utter,JOHN,(to Maggie) I have a question for you. Yes?
utter12.178,utter,MAGGIE JOHN,Would you consider reading a chapter of my novel? Sure.
utter12.179,utter,MAGGIE JOHN,"I know that's weird. I really want the first reader to be like...You know how you said you're a bridge between art and commerce? Well, I need a bridge."
utter12.180,utter,MAGGIE,Perfect. Give it to me. I'll read it.
desc12.181,desc,,John reaches into his backpack and pulls out about fifty pages of a novel.
utter12.182,utter,JOHN,You really will? I really would appreciate it.
desc12.183,desc,,Maggie takes it.
utter12.184,utter,MAGGIE,I don't mind at all.
desc12.185,desc,,She looks at her watch.
utter12.186,utter,MAGGIE (CONT'D),I gotta go. Shoot.
desc12.187,desc,,John looks at his watch.
utter12.188,utter,JOHN,(panicked) Oh shit! Shit! Shit! I gotta go. I gotta go!
desc12.189,desc,,He grabs his bag and runs off.
utter12.190,utter,JOHN,I'll see you later. Thank you!
utter12.191,utter,MAGGIE,"(baffled, calling after him) Okay, Bye!"
scene13,slugline,,INT. COLLEGE AUDITORIUM - STAGE - DAY
desc13.192,desc,,John rushes to the wings and into a big close up as he looks out at the stage with trepidation.
utter13.193,utter,JOHN,(under his breath) Fuck.
utter13.194,utter,KLIEGLER,(os) What do you make of the use of masks in the Occupy movement?
desc13.195,desc,,"High shot: see John stride onto the stage. GEORGETTE, John's beautiful Danish wife, and a moderator, KLIEGLER, have started this panel on MASKS IN POLITICS without him. His seat is rudely empty. As John does his walk of shame across the stage, Georgette speaks in a clipped Danish accent."
utter13.196,utter,GEORGETTE,The masked revolutionary is a
desc13.197,desc,,direct inversion of the face of the
desc13.198,desc,,"As John passes, Georgette gives him an extremely dirty look."
utter13.199,utter,JOHN,(into the mic) Sorry I'm late.
desc13.200,desc,,"Laughter, because he's so damn charismatic. Georgette isn't laughing."
utter13.201,utter,KLIEGLER,"(holding up John's book) John Harding, author of many books, most recently, ""Rituals of Commodity Fetishism at the Tail End of the Empire"". Applause. He's popular."
utter13.202,utter,KLIEGLER (CONT'D),"So John, of course we have been discussing the Occupy movement-GEORGETTE I can't help mentioning the irony that Warner Brothers owns the copyright on the V for Vendetta mask that became the face of the Occupy movement."
utter13.203,utter,JOHN,"Like it or not, in this country, the most potent, totemic symbols are cinematic or television-based; so it only makes sense that a radical, popular movement would try to subvert them."
utter13.204,utter,GEORGETTE,"Nevertheless, the reality of Occupy is to be found within the capitalist narrative, as a kind of subplot."
utter13.205,utter,JOHN,"This sweeping cynicism of yours-GEORGETTE If by sweeping cynicism you mean not living in a dream, then shoot me now."
utter13.206,utter,KLIEGLER,Maybe the way we-JOHN Nobody ever thinks a revolution is going to happen until three days after it's happened. This was a leaderless movement. It wasn't going to happen on a schedule. This was a genuine populist uprising.
utter13.207,utter,KLIEGLER,Yes! Because-GEORGETTE Absolutely. But to return to the use of masks in politics. I am more interested in the possibility of
desc13.208,desc,,"anonymity and group affiliation -the ""I am Spartacus"" maneuver -which has been the primary tactical explanation of the use of masks among various 20th and 21st century"
desc13.209,desc,,"As her speech wears on, we see John wilting like a daisy in a sauna. He radiates resentment and defeat."
scene14,slugline,,INT. JOHN AND GEORGETTE'S APARTMENT - EVENING
desc14.210,desc,,"Close up of Georgette's manicured hand, texting. We go wide to reveal a family dinner. John is standing, serving Georgette pasta."
utter14.211,utter,JOHN,"You don't need to help, but could you please put that down?"
utter14.212,utter,GEORGETTE,(texting) One moment.
desc14.213,desc,,She puts the phone down.
scene15,slugline,,GEORGETTE (CONT'D)
desc15.214,desc,,"John sits. JUSTINE, 13, in a school uniform, sits beside her dreamy brother, PAUL, 7."
utter15.215,utter,JUSTINE,I don't get why you say the same thing in the concluding paragraph
desc15.216,desc,,as you do in the opening paragraph.
utter15.217,utter,GEORGETTE,You're repeating your thesis but in a more developed form.
utter15.218,utter,JUSTINE,What's the point of that?
utter15.219,utter,GEORGETTE,By the time you get to the conclusion you've proven your thesis.
utter15.220,utter,JUSTINE,So it's basically just gloating.
utter15.221,utter,JOHN,"(amused) It is a form of gloating, yes."
utter15.222,utter,GEORGETTE,(To John:) They have fleas in Paul's class again.
utter15.223,utter,JOHN,They don't have fleas. They have lice.
utter15.224,utter,GEORGETTE,"Okay, lice."
utter15.225,utter,JOHN,(to Paul) Let me check your head.
desc15.226,desc,,Paul walks over to John. John checks his head.
utter15.227,utter,JOHN (CONT'D),You don't have lice.
desc15.228,desc,,Georgette catches Justine texting.
utter15.229,utter,GEORGETTE,No texting at the table.
utter15.230,utter,JOHN,I wonder where she gets it.
utter15.231,utter,GEORGETTE,I use my phone for work.
utter15.232,utter,JOHN,Sometimes I'd like to smash it with a hammer. Ha-ha.
scene16,slugline,,GEORGETTE
desc16.233,desc,,Georgette's phone rings. She is dying to answer. The kids both watch their mother restrain herself as John fumes. The phone rings out as Justine speaks.
utter16.234,utter,JUSTINE,Way to go Mom. Salad?
desc16.235,desc,,"As Georgette serves, her phone pings: a text! She glances at the text and sucks in air, shocked."
utter16.236,utter,JOHN,What is it?
utter16.237,utter,GEORGETTE,(flushed with excitement) They've asked me to chair the department at Columbia!
utter16.238,utter,JOHN,Congratulations. That's great.
utter16.239,utter,GEORGETTE,It'd be a huge time commitment.
utter16.240,utter,JOHN,"Still, it's a high-class problem."
utter16.241,utter,GEORGETTE,When will I ever get my writing done? I've promised to deliver that book by December.
desc16.242,desc,,Georgette checks her reddening breast bone.
utter16.243,utter,GEORGETTE (CONT'D),Come on. You'll get a big bump in
utter16.244,utter,salary-GEORGETTE (CONT'D),Look -- I'm already breaking out in a rash!
utter16.245,utter,JOHN,I've got an idea. Why don't you call Caleb back and discuss it. I have to.
utter16.246,utter,GEORGETTE JOHN,"Justine, you want to text your friend."
desc16.247,desc,,"Justine nods, mystified by this change in policy."
utter16.248,utter,JOHN (CONT'D),"Paul, you want to play Ninja Revinja on your iPad? Go."
desc16.249,desc,,Paul jumps up to get the iPad. John pulls out a flip phone.
utter16.250,utter,JOHN (CONT'D),I myself even have a minor text I would like to respond to. We can skip the pretence of having a closeknit family dinner. (looking down at his phone) And we can return to the bullshit later.
desc16.251,desc,,"Justine texts. Georgette is on the phone. Close on his text from Maggie: ""finished the first chapter!"""
utter16.252,utter,GEORGETTE,(os) What is it?
scene17,slugline,,EXT. WASHINGTON SQUARE PARK BENCH - DAY
desc17.253,desc,,Close on John's manuscript.
utter17.254,utter,MAGGIE,The tone is so unusual - sort of screwball-surreal. Is that right?
utter17.255,utter,JOHN,That sounds right. Screwballsurreal. That's it exactly!
desc17.256,desc,,"They are both freezing, huddled on their bench."
utter17.257,utter,MAGGIE,And oh my God the characters! Martin Neems the colorless postal worker in 1950's Connecticut and he's married to this crazy Brazilian woman who keeps breaking out in rashes! It's hilarious.
utter17.258,utter,JOHN,(drinking in her praise) Really? Really?
utter17.259,utter,MAGGIE,"Oh, and the description of the musical collection!"
utter17.260,utter,JOHN,"Oh, yeah, his records you mean?"
utter17.261,utter,MAGGIE,"Yes. Oh, that is so great."
utter17.262,utter,JOHN,"It's funny, right?"
utter17.263,utter,MAGGIE,"Oh, it's great. I'm sorry. I am very, very cold. I feel like I'm welded to the bench. Is it okay if we go get some coffee?"
desc17.264,desc,,"The camera moves left, to a westward path, as if it knows what's going to happen next."
utter17.265,utter,MAGGIE (CONT'D),"(os) Actually, my apartment is like three blocks from here. I just need to get another sweater. I'm deathly"
desc17.266,desc,,cold. They walk into shot and walk down the path through the frigid wind.
utter17.267,utter,JOHN,I cannot tell you how much I appreciate you doing this.
utter17.268,utter,MAGGIE,Oh it was so much fun to read.
utter17.269,utter,JOHN,Really? Did you think the boil was gross or funny?
scene18,slugline,,INT. MAGGIE'S SUBLET - AFTERNOON
desc18.270,desc,,"Maggie and John enter, gasping with cold. The tiny living room is absolutely crammed with books."
utter18.271,utter,MAGGIE,I sublet from a poet.
desc18.272,desc,,John looks around him at this charming apartment.
