segment-id,segment-type,segment-speaker,segment-text
desc115.954,desc,,"The victorious army of actors bursts into the brothel, FENNYMAN at their head. He owns the brothel. The place is already crowded with WHORES and CUSTOMERS. It's a party."
utter115.955,utter,FENNYMAN,(shouts) A famous victory! Kegs and legs. Open and on the house! Oh what happy hour! (and grabbing a RADDLED WHORE) Poxy Pol! You keep yourself to yourself I'll not have you infecting my investment!
utter115.956,utter,VIOLA AS THOMAS,(looking around guardedly. To WILL) Is this a tavern?
utter115.957,utter,WILL,It is also a tavern.
desc115.958,desc,,WILL sits her down in THE COMPANY and takes the chair next to her A PRETTY WHORE immediately sits on WILL's knee and kisses him.
utter115.959,utter,PRETTY WHORE,I remember you! The poet!
desc115.960,desc,,VIOLA furiously pulls the PRETTY WHORE off WILL'S lap.
utter115.961,utter,PRETTY WHORE,"One at a time, one at a time!"
utter115.962,utter,SECOND WHORE,"(to VIOLA) Oh, he's a pretty one! Tell me your story while I tickle your fancy!"
utter115.963,utter,VIOLA AS THOMAS,"Oh!--it's--it's--oh, it's a house of ill-repute!"
utter115.964,utter,WILL,"It is, Thomas, but of good reputation. Come, there is no harm in a drink."
desc115.965,desc,,Glasses are shoved into their hands. Everyone has a glass. Except RALPH.
utter115.966,utter,RALPH,(declining the glass) Never when I'm working!
desc115.967,desc,,The PRETTY WHORE has turned her attention to SAM. SAM looks uncomfortable.
utter115.968,utter,PRETTY WHORE,"Never tried it? Never? (groping him) I think you are ready, Sam!"
desc115.969,desc,,FENNYMAN shouts a toast.
utter115.970,utter,FENNYMAN,(raising his glass) You are welcome to my best house! Here's to the Admiral's Men!
desc115.971,desc,,Everybody drinks. VIOLA drinks too. She decides to. She decides to enjoy it. She bangs down her glass.
utter115.972,utter,VIOLA AS THOMAS,(shouts) The Admiral's Men!
desc115.973,desc,,WILL toasts with her. He sees that she feels one of THE COMPANY.
scene116,slugline,,EXT. STREET. NIGHT.
desc116.974,desc,,A figure is running desperately through the streets. He comes into the square and runs towards the Rose.
scene117,slugline,,EXT. BROTHEL. NIGHT.
desc117.975,desc,,Half THE COMPANY are singing. NOL and a WHORE are tumbling down the stairs together. He is without his trousers. An awful lot of drink has gone down.
utter117.976,utter,SAM,(to the PRETTIEST WHORE) I... quite liked it.
desc117.977,desc,,"VIOLA, bright eyed, is banging her glass on the table in time to a song which is being drunkenly delivered by a barbershop quartet of actors. FENNYMAN reels into VIOLA."
utter117.978,utter,FENNYMAN,Master Kent! You have not dipped your wick?
utter117.979,utter,VIOLA AS THOMAS,(baffled) My wick?
utter117.980,utter,WILL,"(saving her) Mr. Fennyman, because you love the theatre you must have a part in my play. I am writing an Apothecary, a small but vital role."
utter117.981,utter,FENNYMAN,"(embracing WILL) By heaven, I thank you! I will be your Apothecary!"
desc117.982,desc,,"In his general enthusiasm, he embraces the next man, who is RALPH, stone cold sober."
utter117.983,utter,FENNYMAN,I am to be in your play.
utter117.984,utter,WHORE,(to RALPH) And what is this play about?
utter117.985,utter,RALPH,"Well, there's this Nurse."
desc117.986,desc,,"FENNYMAN, beside himself, shouts for silence, announcing --"
utter117.987,utter,FENNYMAN,Mr. Shakespeare has given me the part of the Apothecary!
utter117.988,utter,HENSLOWE,"The Apothecary? Will, what is the story? Where is the shipwreck? How does the comedy end?"
utter117.989,utter,WILL,"By God, I wish I knew."
utter117.990,utter,HENSLOWE,"By God, Will, if you do not, who does? Let us have pirates, clowns, and a happy ending, or we will send you back to Stratford to your wife!"
desc117.991,desc,,"That goes down every well with the entire COMPANY... except for VIOLA and WILL. He looks at her, helplessly, then makes as if to say something. VIOLA ducks away from him and blunders blindly out of the street door, in tears. VIOLA passes PETER who is coming in from the street. WILL, attempting to follow VIOLA, is grabbed round the shoulders by PETER... who, we now see, is in a highly emotional state. WILL tries to fight him off but PETER has the strength of the news he brings."
utter117.992,utter,PETER,(shouts) Will! Mr. Henslowe! Gentlemen all!
desc117.993,desc,,He brings the room to silence.
utter117.994,utter,PETER,A black day for us all! There is news come up river from Deptford.
desc117.995,desc,,Marlowe is dead. There are general gasps and cries for information.
utter117.996,utter,PETER,Stabbed! Stabbed to death in a tavern at Deptford!
desc117.997,desc,,No one is more affected than WILL. This second blow is worse than the first. He stands horror-stricken.
utter117.998,utter,WILL,Oh... what have I done?
utter117.999,utter,ALLEYN,(standing up) He was the first man among us. A great light has gone out.
scene118,slugline,,EXT. BROTHEL. NIGHT.
desc118.1000,desc,,WILL comes staggering out into the street.
utter118.1001,utter,WILL,"It was I who killed him! God forgive me, God forgive me!"
desc118.1002,desc,,"He falls into a stagnant puddle, a deep gutter of water and garbage. He gets up and staggers on."
scene119,slugline,,EXT. CHURCH TOWER. NIGHT.
desc119.1003,desc,,A church tower looms up in the night sky.
scene120,slugline,,INT. CHURCH. NIGHT.
desc120.1004,desc,,"This is where WILL has come. The church is empty, but for the demented, grieving figure of SHAKESPEARE, kneeling, praying, weeping, banging his head, in his private purgatory, dimly lit by tallow candles, gazed upon by effigies of the dead and images of his Redeemer. He is wet, bedraggled, weeds and leaves in his hair."
scene121,slugline,,EXT. DE LESSEPSES' HOUSE. DAY.
desc121.1005,desc,,"A lovely sunny morning. The church bells are ringing. VIOLA and the NURSE, mounted, approach. VIOLA rides sidesaddle on a beautiful horse, and is followed, rather like Quixote by Sancho, by the NURSE on a less impressive animal. Riding in the opposite direction, is WESSEX. And what a happy day it is. He sings and hums to himself merrily. Here is a man who has heard wonderful news. He sees VIOLA and greets her merrily."
utter121.1006,utter,WESSEX,"You look sad, my lady! Let me take you riding."
utter121.1007,utter,VIOLA,"It is not my riding day, my lord."
utter121.1008,utter,WESSEX,"Bless me, I thought it was a horse."
utter121.1009,utter,VIOLA,I am going to church.
utter121.1010,utter,WESSEX,(recomposing his features to solemnity) I understand of course. It is to be expected.
utter121.1011,utter,VIOLA,It is to be expected on a Sunday.
utter121.1012,utter,WESSEX,And on a day of mourning. I never met the fellow but once at your house.
utter121.1013,utter,VIOLA,"(cannot take this in) Mourning? Who is dead, my lord?"
utter121.1014,utter,WESSEX,"Oh! Dear God, I did not think it would be me to tell you. A great loss to playwriting, and to dancing."
desc121.1015,desc,,VIOLA almost faints. The NURSE steadies her.
utter121.1016,utter,VIOLA,(faintly) He is dead?
utter121.1017,utter,WESSEX,"(cheerfully solemn) Killed last night, in a tavern! Come, then, we'll say a prayer for his soul."
desc121.1018,desc,,VIOLA gives a silent cry. The NURSE is speaking to her in distress.
utter121.1019,utter,NURSE,My lady... my lady... now is the time to show your breeding.
scene122,slugline,,INT. CHURCH. DAY.
desc122.1020,desc,,"The NURSE is holding VIOLA up as they enter the church. VIOLA seems catatonic. The NURSE lowers her onto a seat and sits down next to her. As they sit, the CHOIR enters singing. WESSEX, who is sitting in the next pew, looks about him with interest. He hasn't been in a church for years. What he sees turns him to jelly. He sees WILL SHAKESPEARE. ANGLE on WILL. WILL is a spectral, bedraggled figure, backlit by a great shaft of light, he would look like a ghost at the best of times, and this is the worst. Bleeding from where he has banged his head, bedraggled and ravaged by the night, he stands in a side chapel staring at WESSEX. WESSEX gasps and sweats, and sees WILL raise a quivering accusatory finger at him. WESSEX cracks. He starts to mumble."
utter122.1021,utter,WESSEX,"Oh, spare me, dear ghost, spare me for the love of Christ!"
desc122.1022,desc,,"Now VIOLA sees WILL. She is still paralysed, and seems at first unable to take him in. She watches with detachment as WESSEX starts to back out of the church, finally running in terror."
utter122.1023,utter,WESSEX,(screaming) Spare me!
desc122.1024,desc,,"The CHOIR continues to sing, but the scream brings VIOLA to her senses and she runs to a side door where WILL is leaving."
scene123,slugline,,EXT. CHURCH. DAY.
desc123.1025,desc,,"Outside, VIOLA sees WILL, staggering away from the church. She calls his name."
utter123.1026,utter,VIOLA,Will!
desc123.1027,desc,,He does not answer. She runs after him.
utter123.1028,utter,VIOLA,"Oh, my love, I thought you were dead!"
desc123.1029,desc,,She claps him to her. They hold each other for a moment then WILL pulls back.
utter123.1030,utter,WILL,It is worse. I have killed a man.
scene124,slugline,,EXT. MEADOW. DAY.
desc124.1031,desc,,"VIOLA'S horse grazes. WILL lies on his back, still sobered and full of guilt. VIOLA sits on the grass among the buttercups and looks down at him. VIOLA is plaiting a finger-ring from stems of grass. She has not yet revealed her feelings."
utter124.1032,utter,WILL,Marlowe's touch was in my Titus Andronicus and my Henry VI was a house built on his foundations.
utter124.1033,utter,VIOLA,You never spoke so well of him.
utter124.1034,utter,WILL,He was not dead before. I would exchange all my plays to come for all of his that will never come.
utter124.1035,utter,VIOLA,You lie.
desc124.1036,desc,,WILL turns to look at her.
utter124.1037,utter,VIOLA,You lie in your meadow as you lied in my bed.
utter124.1038,utter,WILL,"My love is no lie. I have a wife, yes, and I cannot marry the daughter of Sir Robert de Lesseps. It needed no wife come from Stratford to tell you that. And yet you let me come to your bed."
utter124.1039,utter,VIOLA,"Calf love. I loved the writer, and gave up the prize for a sonnet."
utter124.1040,utter,WILL,I was the more deceived.
utter124.1041,utter,VOILA,Yes -- you were deceived. For I never loved you till now.
utter124.1042,utter,WILL,Now?
utter124.1043,utter,VIOLA,"(declaring herself) I love you, Will, beyond poetry."
utter124.1044,utter,WILL,"Oh, my love. (he kisses her) You ran from me before."
utter124.1045,utter,VIOLA,"You were not dead before. When I thought you dead, I did not care about all the plays that will never come, only that I would never see your face. I saw our end, and it will come."
utter124.1046,utter,WILL,You cannot marry Wessex!
utter124.1047,utter,VIOLA,If not Wessex the Queen will know the cause and there will be no more Will Shakespeare.
desc124.1048,desc,,"They kiss again, passionately."
utter124.1049,utter,WILL,No... no.
utter124.1050,utter,VIOLA,"(through his kisses) But I will go to Wessex as a widow from these vows, as solemn as they are unsanctified."
desc124.1051,desc,,And as their desperate kisses turn into lovemaking we cut
scene125,slugline,,INT. THE ROSE THEATRE. STAGE/AUDITORIUM. DAY.
desc125.1052,desc,,"He is on the stage of the Rose. The entire COMPANY is assembled, HENSLOWE and FENNYMAN included, holding pages of manuscript, which they are sharing together, examining the separated pages, passing pages to each other, etc. WILL's mood is intense and focused."
utter125.1053,utter,WILL,But the Friar who married Romeo and Juliet...
utter125.1054,utter,ACTOR (EDWARD),Is that me. Will?
utter125.1055,utter,WILL,"You, Edward. The Friar who married them gives Juliet a potion to drink. It is a secret potion. It makes her seeming dead. She is placed in the tomb of the Capulets. She will awake to life and love when Romeo comes to her side again."
desc125.1056,desc,,THE COMPANY murmurs approval.
utter125.1057,utter,WILL,"I have not said all. By malign fate, the message goes astray which would"
desc125.1058,desc,,tell Romeo of the Friar's plan. He
desc125.1059,desc,,thus he goes to the Apothecary.
utter125.1060,utter,FENNYMAN,That's me.
desc125.1061,desc,,And buys a deadly poison. He enters the tomb to say farewell to Juliet who lies there cold as death. He drinks the poison. He dies by her side. And then she wakes and sees him dead. HENSLOWE is fascinated and appalled. And so Juliet takes his dagger and kills herself. Pause. WILL is staring at VIOLA.
utter125.1062,utter,HENSLOWE,"Well, that will have them rolling in the aisles."
utter125.1063,utter,FENNYMAN,"Sad and wonderful! I have a blue velvet cap which will do well, I have seen apothecary with a cap just so."
utter125.1064,utter,ALLEYN,(to WILL) Yes... it will serve. But there's a scene missing between marriage and death.
desc125.1065,desc,,"WILL is still staring at VIOLA. Aware, suddenly, of the others watching, she breaks his gaze and drops her head. WILL looks at NED."
scene126,slugline,,INT. DE LESSEPSES' HOUSE. VIOLA'S BEDROOM. EVENING.
desc126.1066,desc,,"WILL and VIOLA. VIOLA dressed as THOMAS. He has a present for her -- a neatly written manuscript of his play, on sheets folded to octavo size."
utter126.1067,utter,WILL,"The play. All written out for you. I had the clerk at Bridewell do it, he has a good fist for lettering."
desc126.1068,desc,,"She wants to accept the present with joy, but something in his mood restrains her. There's a new scene. He turns the pages and shows her."
utter126.1069,utter,VIOLA,Will you read it for me?
utter126.1070,utter,WILL,"(he knows it) ""Wilt thou be gone? It is not yet near day It was the nightingale and not the lark That pierced the fearful hollow of thine ear. Nightly she sings on yon pomegranate tree. Believe me, love, it was the nightingale."""
utter126.1071,utter,VIOLA,"(reading) ""It was the lark, the herald of the morn, No nightingale. Look, love, what envious streaks Do lace the severing clouds in yonder east. Night's candles are burnt out, and jocund day Stands tiptoe on the misty mountain tops. I must be gone and live, or stay and die."""
desc126.1072,desc,,"The words of the scene become WILL's and VIOLA's, their way of saying the farewells they cannot utter."
utter126.1073,utter,WILL,"""Yon light is not daylight, I know it, I. It is some meteor that the sun exhales To be to thee this night a torchbearer..."""
scene127,slugline,,INT. THE ROSE THEATRE. BACKSTAGE. DAY.
desc127.1074,desc,,"""THOMAS."" Somewhere behind and up above the stage, in a deserted corner among rigging, bits of scenery, etc., they speak the lines and we hardly know ourselves whether it is rehearsal or lovemaking. But after a few moments it is definitely lovemaking. Their clothes start coming away, their words interrupted by kisses."
desc127.1075,desc,,"""...thou need'st not to be gone."""
utter127.1076,utter,VIOLA,"""I have more care to stay than will to go. Come death, and welcome. Juliet wills it so. How is't my soul? Let's talk. It is not day."""
desc127.1077,desc,,"By now, her loosened bosom-bandage has been pulled away and WILL passionately embraces her nakedness. And into this heaving composition comes a little white mouse, unseen my them, climbing through a knot hole in the planking behind VIOLA'S head. An adjacent knot hole reveals a human eye and we do not need to be told it is JOHN WEBSTER's. WEBSTER takes his eye away from the peephole, and frowns, thinking it out."
scene128,slugline,,EXT. ALLEWAY. DAY.
desc128.1078,desc,,TILNEY puts a coin in WEBSTER's hand.
utter128.1079,utter,TILNEY,"You will go far, I fear."
utter128.1080,utter,WEBSTER,I hope we work together again.
desc128.1081,desc,,Tilney walks away.
scene129,slugline,,EXT. THE ROSE THEATRE. DAY.
desc129.1082,desc,,"A man is pacing up and down, in a sort of agony. He is muttering. He is glancing at a sheet of paper. He is FENNYMAN rehearsing the important role of the Apothecary, for which he has a special voice."
utter129.1083,utter,FENNYMAN,"""Such mortal drugs I have but Mantua's law Is death to any he that utters them."" Then him. Then me."
utter129.1084,utter,FENNYMAN,"""Put this in any liquid thing you will And..."""
desc129.1085,desc,,He has dried up. He curses -- the terror and despair.
utter129.1086,utter,FENNYMAN,"""Such mortal drugs I have..."" What is it? What is it?"
desc129.1087,desc,,He is so wrapped up in all this that he simply does not notice when WESSEX rides up to the main entrance dismounts and walks inside.
scene130,slugline,,INT. THE ROSE THEATRE. STAGE/AUDITORIUM. DAY.
desc130.1088,desc,,"Among the audience are HENSLOWE, a few actors... and JOHN WEBSTER... who sees WESSEX and jumps up and goes to him."
utter130.1089,utter,WEBSTER,My lord!
utter130.1090,utter,WESSEX,(shouts) Shakespeare!
desc130.1091,desc,,Everything stops.
utter130.1092,utter,WESSEX,"You upstart inky pup! Now I will show you your place, which is in hell!"
utter130.1093,utter,WILL,You are on my ground.
utter130.1094,utter,WESSEX,"(drawing his sword) By God, I'll fight the lot of you."
desc130.1095,desc,,WILL draws his sword.
utter130.1096,utter,WILL,I am more than enough.
desc130.1097,desc,,"VIOLA reacts. She almost gives herself away. But the fight has started. WESSEX slashes at WILL. WILL knows how to fight. He parries and thrusts. WESSEX is surprised. The fight goes fast and furious around the stage, until WILL thrusts accurately at WESSEX'S chest... and would have killed him but for the button on his sword-point. WESSEX grapples with him, and now it becomes a parody of the Hamlet duel; WESSEX'S unbuttoned sword falls to the ground, WILL puts his foot on it, tosses WESSEX his own safe sword, picks up Wessex's sword and continues the fight until he has WESSEX at his mercy. WILL has fought with a passionate rage that has everybody staring at him. Now the look in his eyes is merciless."
utter130.1098,utter,WILL,Absent friends! (to the assembly) This is the murderer of Kit Marlowe!
desc130.1099,desc,,NED ALLEYN comes forward looking worried and dubious.
utter130.1100,utter,ALLEYN,Will!
utter130.1101,utter,WESSEX,I rejoiced at his death because I thought it was yours. That is all I know of Marlowe.
utter130.1102,utter,ALLEYN,"It's true, Will... it was a tavern brawl... Marlowe attacked, and got his own knife in the eye. A quarrel about the bill."
utter130.1103,utter,HENSLOWE,"The bill! Oh, vanity, vanity!"
utter130.1104,utter,ALLEYN,"Not the billing, the bill!"
desc130.1105,desc,,"WILL steps back, and sinks to his knees. His relief could not be greater."
utter130.1106,utter,WILL,"(to the heavens) Oh God, I am free of it!"
desc130.1107,desc,,WESSEX gets to his feet. TILNEY enters the auditorium from the public entrance.
utter130.1108,utter,WESSEX,Close it!
utter130.1109,utter,TILNEY,My Lord Wessex!
utter130.1110,utter,WESSEX,"(foaming) Close it! Take it down stone by stone! I want it ploughed into the ground, and sown with quick lime!"
desc130.1111,desc,,WESSEX storms out past the bewildered TILNEY.
utter130.1112,utter,HENSLOWE,"Mr. Tilney, what is this?"
utter130.1113,utter,TILNEY,Sedition and indecency!
utter130.1114,utter,HENSLOWE,What?!
utter130.1115,utter,WEBSTER,"Master of the Revels, sir, over here, sir."
utter130.1116,utter,TILNEY,"(to WEBSTER) Where, boy?"
utter130.1117,utter,WEBSTER,(points) I saw her bubbies!
utter130.1118,utter,TILNEY,(shocked and gratified) A woman on the stage? A woman?
utter130.1119,utter,WEBSTER,I swear it!
desc130.1120,desc,,THE COMPANY of actors are dumbstruck. None more than VIOLA.
utter130.1121,utter,TILNEY,"So, Henslowe! I say this theatre is closed! On the authority of the powers invested in my by the court -- I close this theatre!"
utter130.1122,utter,HENSLOWE,Why so?
utter130.1123,utter,TILNEY,(triumphantly) For lewdness and unshamefacedness! For displaying a female on the public stage!
desc130.1124,desc,,"TILNEY is unstoppable. He jumps on the stage... and seizes SAM GOSSE. Before WEBSTER or anyone can intervene, TILNEY pulls up his skirt, ignoring SAM's rather gutteral yell of protest and pulls down SAM's drawers. TILNEY's face is a study. So is everybody else's. WEBSTER rolls his eyes (oh, these stupid grown-ups!) and deftly throws one of his mice onto ""ROMEO's"" hair. VIOLA gives a shrill scream, the startled mouse descends her neck via VIOLA's ear, and seeks an entry into her collar. By which time VIOLA has gone berserk and torn off her wig. Her hair is pinned up but there is no question her gender. WILL is paralysed. VIOLA gives him a look of terrible despair and apology."
utter130.1125,utter,WEBSTER,(pointing at SAM) Not him. (pointing at VIOLA) Her!
utter130.1126,utter,HENSLOWE,He's a woman!
desc130.1127,desc,,"By now the scene is playing to a crowded theatre, or so it seems."
utter130.1128,utter,TILNEY,That's who I meant! This theatre is closed! Notice will be posted!
desc130.1129,desc,,"SAM has picked himself up, and his drawers."
utter130.1130,utter,HENSLOWE,"(to NED) Ned, I swear I knew nothing of this!"
utter130.1131,utter,VIOLA,(hoping to protect WILL) Nobody knew!
utter130.1132,utter,WEBSTER,(pointing at WILL) He did! I saw him kissing her bubbies!
desc130.1133,desc,,"Everybody looks at WILL, who stares at VIOLA, helpless."
utter130.1134,utter,TILNEY,"Closed! Closed, mark you, Henslowe!"
desc130.1135,desc,,TILNEY turns on his heel and leaves in triumph. THE COMPANY is still polaxed.
utter130.1136,utter,HENSLOWE,(in despair) It is over.
utter130.1137,utter,VIOLA,"I am so sorry, Mr. Henslowe. I wanted to be an actor. (she turns to WILL) I am sorry, Will."
desc130.1138,desc,,"WILL shakes his head. This cannot be the end. VIOLA walks away, leaving by the public entrance. They all let her go, watching her silently. As she passes WABASH"
utter130.1139,utter,WABASH,Y-y-y-you w-w-w-were w-w-w-w- wonderful.
utter130.1140,utter,VIOLA,Thank you.
desc130.1141,desc,,"As she is leaving, WILL comes to life. He starts off towards her... but his progress is halted by a sock to the jaw from NED ALLEYN. WILL falls down in the dust. FENNYMAN enters, still bent over his sheet of paper, mumbling his precious lines. When he reaches the groundlings yard, he finds to his surprise the whole COMPANY is standing about in attitudes of despair or worse. FENNYMAN looks around."
utter130.1142,utter,FENNYMAN,Everything all right?
scene131,slugline,,EXT. THE ROSE THEATRE. EVENING.
desc131.1143,desc,,The closure notice is nailed to the door.
scene132,slugline,,INT. DE LESSEPSES' HOUSE. VIOLA'S BEDROOM. NIGHT.
desc132.1144,desc,,"VIOLA, in her nightdress, is reading by candlelight. She is reading her private manuscript of Romeo and Juliet... and rereading. Next to her is a tray of covered dishes. The NURSE enters and looks at her sympathetically. She lifts the tray. She realises it is heavy. She puts it down and raises the covers and sees that VIOLA has eaten nothing. She looks at VIOLA's tears, but there is nothing to be said."
scene133,slugline,,INT. TAVERN. DAY.
desc133.1145,desc,,"They are all there -- the ADMIRAL'S MEN, including WILL and HENSLOWE, drowning their sorrows. Everyone is drunk. FENNYMAN is also there, taking the disaster somewhat selfishly."
utter133.1146,utter,FENNYMAN,(muttering) I would have been good... I would have been great.
desc133.1147,desc,,He hands a flask to RALPH who is in a similar mood.
utter133.1148,utter,RALPH,So would I. We both would.
desc133.1149,desc,,"RALPH contemplates the flask, and, since he's not working, takes a swig. A moment later, he keels over, rigid as a pole. The street door crashes open. BURBAGE enters. Behind him enter a solid wedge of the CHAMBERLAIN'S MEN, sober-faced, several with black eyes and bandages round their heads."
utter133.1150,utter,FENNYMAN,(shouts) Lambert!
desc133.1151,desc,,"LAMBERT, FENNYMAN'S henchman and killer, puts down his tankard and comes forward, casually kicking chairs and tables out of his way."
utter133.1152,utter,FENNYMAN,Kill him!
desc133.1153,desc,,"LAMBERT reaches up to the wall over the bar and takes down once of the ceremonial weapons hanging there -- a battle- axe. But BURBAGE has flintlock pistol stuck into his sash. BURBAGE draws and the pistol roars, shooting flame, LAMBERT curses, drops the axe, nurses his wounded hand. BURBAGE puts the pistol back into his sash. NED ALLEYN is half-drunk at a table. He staggers to his feet. He faces BURBAGE."
utter133.1154,utter,ALLEYN,"Well, Burbage -- you never did know when your scene was over."
utter133.1155,utter,BURBAGE,"That can wait. The Master of the Revels despises us for vagrants, tinkers, and peddlers of bombast. But my father, James Burbage, had the first licence to make a company of players from Her Majesty, and he drew from poets the literature of the age. Their fame will be our fame. So let them all know, we are men of parts. We are a brotherhood, and we will be a profession. Will Shakespeare has a play. I have a theatre. The Curtain is yours."
scene134,slugline,,EXT. THE CURTAIN THEATRE. DAY.
desc134.1156,desc,,"A strong wind is blowing through the trees. A BOY with a paste-pot and a bundle of flyers, is having trouble pasting a flyer on the wall of the building. A gust of wind scatters the bundle and sends a couple of dozen flyers flying into the sky. The BOY with the paste-pot runs around, trying to recover those he can. We look at the poster. It says: BY PERMISSION OF"
utter134.1157,utter,HUGH FENNYMAN PRODUCTION,OF
desc134.1158,desc,,MR. HENSLOWE'S PRESENTATION THE ADMIRAL'S MEN IN PERFORMANCE THE EXCELLENT AND LAMENTABLE TRAGEDY
utter134.1159,utter,ROMEO AND JULIET,With Mr. Fennyman as the Apothecary.
desc134.1160,desc,,"WILL comes out of the theatre, and passes the poster. He walks on without looking at it. A voice calls after him:"
utter134.1161,utter,HENSLOWE,Will!
desc134.1162,desc,,WILL does not turn to look at him.
utter134.1163,utter,HENSLOWE,We'll be needing a Romeo.
desc134.1164,desc,,WILL carries on walking.
