segment-id,segment-type,segment-speaker,segment-text
desc48.483,desc,,We suspect he is lying but WILL has turned away.
utter48.484,utter,WILL,"Master Henslowe, you have your actors."
desc48.485,desc,,"He leaves, passing by the humbled FENNYMAN."
utter48.486,utter,FENNYMAN,"I saw his Tamburlaine, you know. Wonderful."
utter48.487,utter,WILL,"Yes, I saw it."
utter48.488,utter,FENNYMAN,"Of course, it was mighty writing. There is no one like Marlowe."
desc48.489,desc,,WILL is used to it. He goes.
scene49,slugline,,EXT. RIVERBANK. DAY.
desc49.490,desc,,"WILL arrives in a hurry at the wharfside, and looks vainly in the direction of the DE LESSEPSES' house: no THOMAS."
scene50,slugline,,EXT. THE ROSE THEATRE. STAGE DOOR. DAY.
desc50.491,desc,,"WILL looks down the alley: no THOMAS. He turns away. The URCHIN, the short-lived Ethel, is sitting in the alley."
utter50.492,utter,WILL,"Better fortune, boy."
utter50.493,utter,URCHIN,"(shrugs) I was in a play. They cut my head off in Titus Andronicus. When I write plays, they will be like Titus."
utter50.494,utter,WILL,(pleased) You admire it?
desc50.495,desc,,The URCHIN nods grimly.
utter50.496,utter,URCHIN,I like it when they cut heads off. And the daughter mutilated with knives.
utter50.497,utter,WILL,Oh. What is your name?
utter50.498,utter,URCHIN,"John Webster. Here, kitty, kitty."
desc50.499,desc,,Because a stray cat is nearby. The cat shows an interest. The URCHIN passes a white mouse to the cat and watches the result with sober interest.
utter50.500,utter,URCHIN,Plenty of blood. That is the only writing.
desc50.501,desc,,"WILL backs away, unnerved by the boy."
utter50.502,utter,URCHIN,"Wait, you'll see the cat bites his head off."
utter50.503,utter,WILL,I have to get back.
scene51,slugline,,INT. THE ROSE THEATRE. STAGE/AUDITORIUM. DAY.
desc51.504,desc,,On stage... the actors carry their parts.
utter51.505,utter,NOL AS BENVOLIO,"""See where he comes. So please you step aside; I'll know his grievance or be much denied."""
utter51.506,utter,MONTAGUE,"""I would thou wert so happy by thy stay To hear true shrift. Come, madam, let's away."""
desc51.507,desc,,"Onstage ""MONTAGUE"" and ""LADY MONTAGUE"" make their exit. Offstage, WILL appears next to HENSLOWE."
utter51.508,utter,WILL,Cut round him for now.
utter51.509,utter,HENSLOWE,(not understanding) What? Who?
utter51.510,utter,Romeo. HENSLOWE,The one who came with your letter?
utter51.511,utter,WILL,What?
utter51.512,utter,NOL AS BENVOLIO (O.S.),"""Good morrow, cousin."""
desc51.513,desc,,"""Is the day so young?"" The voice is THOMAS's. WILL turns back to the stage and sees him. Today THOMAS has a wig as well as his small mustache."
utter51.514,utter,NOL AS BENVOLIO,"""But new struck nine."""
utter51.515,utter,VIOLA AS ROMEO,"""Ay me, sad hours seem long. Was that my father that went hence so fast?"""
utter51.516,utter,NOL AS BENVOLIO,"It was. What sadness lengthens Romeo's hours?"""
utter51.517,utter,VIOLA AS ROMEO,"""Not having that which, having, makes them short."""
utter51.518,utter,WILL,Good.
utter51.519,utter,NOL AS BENVOLIO,"""In love?"""
desc51.520,desc,,"""Out."""
desc51.521,desc,,"""Of love?"""
utter51.522,utter,VIOLA AS ROMEO,"""Out of her favour where I am in love."""
utter51.523,utter,WILL,"(interrupting) No, no, no... Don't spend it all at once!"
desc51.524,desc,,The rehearsal stops.
utter51.525,utter,VIOLA AS THOMAS,"Yes, sir."
utter51.526,utter,WILL,Do you understand me?
utter51.527,utter,VIOLA AS THOMAS,"No, sir."
utter51.528,utter,WILL,He is speaking about a baggage we never even meet! What will be left in your purse when he meets his Juliet?
utter51.529,utter,HENSLOWE,Juliet? You mean Ethel.
utter51.530,utter,WILL,"(rounding on him) God's teeth, am I to suffer this constant stream of interruption?! (to THOMAS) What will you do in Act Two when he"
desc51.531,desc,,meets the love of his life?
utter51.532,utter,VIOLA AS THOMAS,"(timidly -- looking through his few sheets of paper) I am very sorry, sir, I have not seen Act Two."
utter51.533,utter,WILL,Of course you have not! I have not written it!
desc51.534,desc,,"Alone in the auditorium, FENNYMAN looks and listens, fascinated. So this is theatre!"
utter51.535,utter,WILL,Go once more!
desc51.536,desc,,"NED ALLEYN comes out of the wings, frowning over his manuscript."
utter51.537,utter,ALLEYN,Will... Where is Mercutio?
utter51.538,utter,WILL,"(tapping his forehead) Locked safe in here. I leave the scene in your safe keeping, Ned, I have a sonnet to write."
desc51.539,desc,,WILL moves back into the wings where HENSLOWE is looking anxious.
utter51.540,utter,HENSLOWE,A sonnet? You mean a play.
desc51.541,desc,,"WILL moves on, ignoring him. As he goes, we see that VIOLA is love-struck by him, a riot in the heart."
scene52,slugline,,INT. DE LESSEPSES' HOUSE. STAIRCASE. DAY.
desc52.542,desc,,"VIOLA still dressed as THOMAS, sonnet in hand, runs up the stairs to her room. From the other end of the house WESSEX can be heard ranting."
scene53,slugline,,INT. DE LESSEPSES' HOUSE. HALL. NIGHT.
desc53.543,desc,,LORD WESSEX is being kept waiting. The NURSE is bearing the brunt of his impatience.
utter53.544,utter,WESSEX,Two hours at prayer!
utter53.545,utter,NURSE,"Lady Viola is pious, my lord."
utter53.546,utter,WESSEX,"Piety is for Sunday! And two hours at prayer is not piety, it is self- importance!"
utter53.547,utter,NURSE,"It would be better that you return tomorrow, my lord."
utter53.548,utter,WESSEX,It would be better that you tell her to get off her knees and show some civility to her six-day lord and master.
desc53.549,desc,,"VIOLA opens the door. She has changed hurriedly -- too hurriedly: the effect of her glorious hair falling to her bare shoulders is spoiled by her mustache. Fortunately, the NURSE spots her before WESSEX does and by coming forward to greet her, the NURSE manages to shield Viola from view, communicate the problem, and announce WESSEX'S presence, so that by the time the NURSE has passed by VIOLA and let herself out of the room, the moustache has disappeared."
utter53.550,utter,WESSEX,My lady VIOLA.
utter53.551,utter,VIOLA,Lord Wessex. You have been waiting.
utter53.552,utter,WESSEX,"I am aware of it, but it is beauty's privilege."
utter53.553,utter,VIOLA,"You flatter, my lord."
utter53.554,utter,WESSEX,"No. I have spoken to the Queen. (pause) Her majesty's consent is requisite when a Wessex takes a wife, and once gained, her consent is her command."
utter53.555,utter,VIOLA,"Do you intend to marry, my lord?"
utter53.556,utter,WESSEX,Your father should keep you better informed. He has bought me for you. He returns from his estates to see us married two weeks from Saturday. (pause) You are allowed to show your pleasure.
utter53.557,utter,VIOLA,"I do not love you, my lord."
utter53.558,utter,WESSEX,"How your mind hops about! Your father was a shopkeeper, your children will bear arms, and I will recover my fortune. That is the only matter under discussion today. You will like Virginia."
utter53.559,utter,VIOLA,Virginia?!
utter53.560,utter,WESSEX,"Why, yes! My fortune lies in my plantations. The tobacco weed. I need four thousand pounds to fit out a ship and put my investments to work -- I fancy tobacco has a future. We will not stay there long, three or four years..."
utter53.561,utter,VIOLA,But why me?
utter53.562,utter,WESSEX,"It was your eyes. No, your lips."
desc53.563,desc,,"He kisses her with more passion than ceremony. VIOLA recoils, and slaps him."
utter53.564,utter,WESSEX,Will you defy your father and your Queen?
utter53.565,utter,VIOLA,The Queen has consented?
utter53.566,utter,WESSEX,"She wants to inspect you. At Greenwich, come Sunday. Be submissive, modest, grateful and brief."
utter53.567,utter,VIOLA,"(forced to submit) I will do my duty, my lord."
scene54,slugline,,INT. DE LESSEPSES' HOUSE. VIOLA'S BEDROOM. NIGHT.
desc54.568,desc,,"She is writing to WILL. His letter-poem is on her table. We can read part of it. ""Shall I compare thee to a summer's day..."" Now we see what VIOLA is writing. INSERT: ""Master Will, poet dearest to my heart, I beseech you, banish me from yours -- I am to marry Lord Wessex -- a daughter's duty..."" She sheds a romantic, unhappy tear."
scene55,slugline,,INT. THE ROSE THEATRE. STAGE. DAY.
desc55.569,desc,,"SAM is now ""JULIET."" The play has evidently reached Act I Scene 5. We are witnessing the meeting of ""ROMEO"" and ""JULIET"" in a simplified version of the changing-partners dance we saw at VIOLA'S house. NED ALLEYN is in charge."
utter55.570,utter,ALLEYN,"Gentlemen upstage, ladies downstage!"
desc55.571,desc,,The dance goes wrong. It is THOMAS'S fault.
utter55.572,utter,ALLEYN,"(furious) Gentlemen upstage! Ladies downstage! Are you a lady, Mr. Kent?"
desc55.573,desc,,"THOMAS mutters a blushing apology. WILL arrives the bystanders, clutching fresh pages. He gives these to PETER. NED ALLEYN sees him and comes over to start an argument."
utter55.574,utter,WILL,(preempting) You did not like the speech?
utter55.575,utter,ALLEYN,"The speech is excellent. (he does the first line impressively) ""Oh, then I see Queen Mab hath been with you!"" Excellent and a good length. But then he disappears for the length of a bible."
desc55.576,desc,,WILL points significantly at the pages he has given PETER.
utter55.577,utter,WILL,"There you have his duel, a skirmish of words and swords such as I never wrote, nor anyone. He dies with such passion and poetry as your ever heard: ""a plague on both your houses!"""
desc55.578,desc,,NED nods satisfied and turns back to work. Then he turns back.
utter55.579,utter,ALLEYN,He dies?
desc55.580,desc,,But the author has escaped.
scene56,slugline,,INT. THE ROSE THEATRE. WRITER'S CORNER. DAY.
desc56.581,desc,,"Up aloft, WILL has a Writer's Corner where he settle down to work. We see his private superstition: he spins round in a circle, rubs his hands together, and spits on the floor. That done, he picks up his pen."
scene57,slugline,,EXT. STREET. NIGHT.
desc57.582,desc,,"WILL is charging down a narrow alley, and bumps into BURBAGE who is emerging from the door of a tavern."
utter57.583,utter,BURBAGE,Will!
desc57.584,desc,,WILL is in too much of a hurry to stop. BURBAGE calls after him.
utter57.585,utter,BURBAGE,And where are my pages...
desc57.586,desc,,WILL hurries on.
scene58,slugline,,EXT. RIVERBANK. DUSK.
desc58.587,desc,,"VIOLA as THOMAS is being rowed across the river. From behind, in the direction of Bankside, ""he"" hears shouting."
utter58.588,utter,WILL (O.S.),(shouting) Did you give her my letter?
desc58.589,desc,,"VIOLA as THOMAS turns to see WILL some way behind, following in another boat. She takes a letter from her coat and holds it aloft."
utter58.590,utter,VIOLA AS THOMAS,(calling) And this for you.
scene59,slugline,,EXT. THE RIVER. VIOLA'S BOAT. NIGHT.
desc59.591,desc,,WILL has climbed aboard VIOLA'S boat and is tearing open the letter. What he reads causes him great pain. He collapses into the stern seat next to VIOLA.
utter59.592,utter,WILL,"Oh, Thomas! She has cut my strings! I am unmanned, unmended, and unmade,"
desc59.593,desc,,like a puppet in a box.
utter59.594,utter,BOATMAN,"Writer, is he?"
desc59.595,desc,,WILL turns on him savagely.
utter59.596,utter,WILL,Row your boat.
scene60,slugline,,EXT. THE RIVER. VIOLA'S BOAT. NIGHT.
desc60.597,desc,,"WILL turns back to VIOLA. They have their conversation intimately, disregarding the lack of intimacy. The BOATMAN is hardly an arm's length away, but they ignore him."
utter60.598,utter,WILL,She tells me to keep away. She is to marry Lord Wessex. What should I do?
utter60.599,utter,VIOLA AS THOMAS,"If you love her, you must do what"
desc60.600,desc,,she asks.
utter60.601,utter,WILL,And break her heart and mine?
utter60.602,utter,VIOLA AS THOMAS,It is only ours you can know.
utter60.603,utter,WILL,"She loves me, Thomas!"
utter60.604,utter,VIOLA AS THOMAS,Does she say so?
utter60.605,utter,WILL,No. And yet she does where the ink has run with tears. Was she weeping when she gave you this?
utter60.606,utter,VIOLA AS THOMAS,I... Her letter came to me by the nurse.
utter60.607,utter,WILL,Your aunt?
utter60.608,utter,VIOLA AS THOMAS,"(catching up) Yes, my aunt. But perhaps she wept a little. Tell me how you love her, Will."
utter60.609,utter,WILL,Like a sickness and its cure together.
utter60.610,utter,VIOLA AS THOMAS,"Yes, like rain and sun, like cold and heat. (collecting herself) Is your lady beautiful? Since I came to visit from the country, I have not seen her close. Tell me, is she beautiful?"
utter60.611,utter,WILL,"Oh, if I could write the beauty of her eyes! I was born to look in them and know myself."
desc60.612,desc,,"He is looking into VIOLA'S eyes. She holds his look, but WILL belies his words."
utter60.613,utter,VIOLA AS THOMAS,And her lips?
utter60.614,utter,WILL,"Oh, Thomas, her lips! The early morning rose would wither on the branch, if it could feel envy!"
utter60.615,utter,VIOLA AS THOMAS,And her voice? Like lark song?
utter60.616,utter,WILL,Deeper. Softer. None of your twittering larks! I would banish nightingales from her garden before
desc60.617,desc,,they interrupt her song.
utter60.618,utter,VIOLA AS THOMAS,She sings too?
utter60.619,utter,WILL,"Constantly. Without doubt. And plays the lute, she has a natural ear. And her bosom -- did I mention her bosom?"
utter60.620,utter,VIOLA AS THOMAS,(glinting) What of her bosom?
utter60.621,utter,WILL,"Oh Thomas, a pair of pippins! As round and rare as golden apples!"
utter60.622,utter,VIOLA AS THOMAS,"I think the lady is wise to keep your love at a distance. For what lady could live up to it close to, when her eyes and lips and voice may be no more beautiful than mine? Besides, can a lady born to wealth and noble marriage love happily with a Bankside poet and player?"
utter60.623,utter,WILL,"(fervently) Yes, by God! Love knows nothing of rank or riverbank! It will spark between a queen and the poor vagabond who plays the king, and their love should be minded by each, for love denied blights the soul we owe to God! So tell my lady, William Shakespeare waits for her in the garden!"
utter60.624,utter,VIOLA AS THOMAS,But what of Lord Wessex?
utter60.625,utter,WILL,"For one kiss, I would defy a thousand Wessexes!"
desc60.626,desc,,The boat scrapes on the jetty of the DE LESSEPSES' house. The bump throws THOMAS into WILL'S arms. He holds her round the shoulders. His words have almost unmasked her. The closeness does the rest. She kisses him on the mouth and jumps out of the boat.
utter60.627,utter,VIOLA,"Oh, Will!"
desc60.628,desc,,She throws a coin to the BOATMAN and runs towards the house.
utter60.629,utter,BOATMAN,"Thank you, my lady!"
utter60.630,utter,WILL,(stunned) Lady?
utter60.631,utter,BOATMAN,Viola De Lesseps. Known her since she was this high. Wouldn't deceive a child.
desc60.632,desc,,WILL gets out of the boat.
utter60.633,utter,BOATMAN,"(reaching under his seat) Strangely enough, I'm a bit of a writer myself."
desc60.634,desc,,The BOATMAN produces his memoirs in manuscript.
utter60.635,utter,BOATMAN,"It wouldn't take you long to read it, I expect you know all the booksellers..."
desc60.636,desc,,But WILL has gone.
scene61,slugline,,EXT. DE LESSEPSES' GARDEN. NIGHT.
desc61.637,desc,,WILL drops over the wall into the garden and without hesitation starts climbing up to her balcony.
scene62,slugline,,INT. DE LESSEPSES' HOUSE. VIOLA'S BEDROOM. NIGHT.
desc62.638,desc,,"WILL comes in through the window, just as VIOLA enters by the door. They stare at each other across the room."
utter62.639,utter,WILL,Can you love a fool?
utter62.640,utter,VIOLA,Can you love a player?
desc62.641,desc,,They run together and fall into a passionate kiss.
utter62.642,utter,WILL,(springs back) Wait! You are still a maid and perhaps as mistook in me as I was mistook in Thomas Kent.
utter62.643,utter,VIOLA,Answer me only this: are you the author of the plays of William Shakespeare?
utter62.644,utter,WILL,I am.
utter62.645,utter,VIOLA,Then kiss me again for I am not mistook.
desc62.646,desc,,"They run together and fall into a passionate kiss. VIOLA fumbles with his clothing, he with hers."
utter62.647,utter,VIOLA,I do not know how to undress a man.
desc62.648,desc,,"It is strange to me, too."
scene63,slugline,,INT. DE LESSEPSES' HOUSE. OUTSIDE VIOLA'S BEDROOM. NIGHT.
desc63.649,desc,,"The NURSE has come to listen. She puts her ear against the door. Because she hears muffled voices, she looks startled."
scene64,slugline,,INT. DE LESSEPSES' HOUSE. VIOLA'S BEDROOM. NIGHT.
desc64.650,desc,,"WILL is half-naked. VIOLA is down to her petticoat, and chemise. The petticoat comes away. WILL flings it aside. He takes off her chemise. He is startled to find that she is tightly bandaged round the bosom. WILL finds the loose end and spins her naked."
scene65,slugline,,INT. DE LESSEPSES' HOUSE. OUTSIDE VIOLA'S BEDROOM. NIGHT.
desc65.651,desc,,"The NURSE, drags a chair -- a rocker -- outside the bedroom door, and takes up her position. She sits down, keeping guard. Pretty soon there comes the regular creak of VIOLA'S bed. The NURSE fans herself furiously with her little lacy fan. She crosses herself. A CHAMBERMAID comes along the gallery outside the bedroom door. She is dusting her way along. The CHAMBERMAID becomes aware of the regular creaking. She pauses. The NURSE begins to rock in her chair, keeping time with the creaking from within. The CHAMBERMAID stares at the NURSE. The NURSE stares at the CHAMBERMAID."
utter65.652,utter,NURSE,"Go to, go to."
scene66,slugline,,INT. DE LESSEPSES' HOUSE. VIOLA'S BEDROOM. NIGHT
desc66.653,desc,,"WILL and VIOLA have finished making love, and lie in each other's arms."
utter66.654,utter,VIOLA,I would not have thought it. There is something better than a play.
utter66.655,utter,WILL,There is.
utter66.656,utter,VIOLA,Even your play.
utter66.657,utter,WILL,(frowns) Oh.
utter66.658,utter,VIOLA,And that was only my first try.
utter66.659,utter,WILL,Well perhaps better than my first. (he kisses her again)
scene67,slugline,,EXT. DE LESSEPSES' HOUSE. DAWN.
desc67.660,desc,,Dawn is breaking. The sun lacing the severing clouds with envious streaks.
scene68,slugline,,INT. DE LESSEPSES' HOUSE. OUTSIDE VIOLA'S BEDROOM. DAWN
desc68.661,desc,,The NURSE has fallen asleep in her rocking chair.
scene69,slugline,,INT. DE LESSEPSES' HOUSE. VIOLA'S BEDROOM. DAWN.
desc69.662,desc,,"A rooster crows at some distance. VIOLA and WILL are in bed. She stirs drowsily. VIOLA, coming awake, speaks his name and he kisses her."
utter69.663,utter,VIOLA,Will.
desc69.664,desc,,Then he starts to get out of bed.
utter69.665,utter,VIOLA,You would not leave me?
desc69.666,desc,,I must. Look... how pale the window.
utter69.667,utter,VIOLA,(pulling him down) Moonlight!
utter69.668,utter,WILL,"No, the morning rooster woke me."
utter69.669,utter,VIOLA,It was the owl... come to bed.
desc69.670,desc,,She is winning. She kisses him and pulls the bedclothes around them.
utter69.671,utter,WILL,"(giving in) Oh, let Henslowe wait."
utter69.672,utter,VIOLA,"(pausing, pushing him away) Mr. Henslowe?"
utter69.673,utter,WILL,(persisting) Let him be damned for his pages!
utter69.674,utter,VIOLA,"Oh... no, no!"
utter69.675,utter,WILL,(kissing her) There is time. It is still dark.
utter69.676,utter,VIOLA,It is broad day! (the rooster crows again) The rooster tells us so!
utter69.677,utter,WILL,"It was the owl. Believe me, love, it was the owl."
desc69.678,desc,,He kisses her and starts to make love to her again. VIOLA gives him a shove which pushes him onto the floor. She sits up and pulls on her gown.
utter69.679,utter,VIOLA,You would leave us players without a scene to read today?!
desc69.680,desc,,There's a knock at the door.
scene70,slugline,,INT. DE LESSEPSES' HOUSE. CORRIDOR OUTSIDE VIOLA'S BEDROOM/VIOLA'S BEDROOM. DAWN.
desc70.681,desc,,The NURSE is knocking. VIOLA comes to the door.
utter70.682,utter,NURSE,"My lady, the house is stirring, it is a new day."
desc70.683,desc,,VIOLA looks beautified by the hours that have passed.
utter70.684,utter,VIOLA,It is a new world!
scene71,slugline,,INT. THE ROSE THEATRE. STAGE/AUDITORIUM. DAY.
desc71.685,desc,,"The cut is to the middle of a rehearsal. We are coming up to the moment when ""ROMEO"" and ""JULIET"" kiss for the first time (Act I Scene V) NED ALLEYN is in charge but WILL is watching. His life has turned perfect."
utter71.686,utter,VIOLA AS ROMEO,"""...Have not saints lips, and holy palmers too?"""
utter71.687,utter,SAM AS JULIET,"""Ay pilgrim, lips that they must use in prayer."""
utter71.688,utter,VIOLA AS ROMEO,"""Oh then, dear saint, let lips do"
desc71.689,desc,,"what hands to: They pray: grant thou,"
desc71.690,desc,,WILL is in her eye-line. Her eyes flash an intimate secret look to him.
utter71.691,utter,SAM AS JULIET,"""Saints do not move, though grant for prayer's sake."""
desc71.692,desc,,And VIOLA misses her cue as a result.
utter71.693,utter,SAM,(prompting her) It's you.
utter71.694,utter,ALLEYN,(roars) Suffering cats!
desc71.695,desc,,VIOLA guiltily picks up her line.
utter71.696,utter,VIOLA AS ROMEO,"""Then move not, while my prayer's effect I take."""
desc71.697,desc,,"In character, VIOLA kisses SAM, demurely, but apparently not demurely enough for WILL, who gives a twitch."
utter71.698,utter,VIOLA AS ROMEO,"""Thus from my lips, by thine, my sin is purg'd."""
utter71.699,utter,SAM AS JULIET,"""Then have my lips the sin that they have took."""
utter71.700,utter,VIOLA AS ROMEO,"""Sin from my lips? Oh trespass sweetly urg'd. Give me my sin again."""
desc71.701,desc,,"VIOLA kisses SAM again. WILL gives a major twitch, which in fact catapults his body onto the stage. Everybody looks at him in surprise."
utter71.702,utter,WILL,Yes... yes... er... not quite right... it is more... let me --
utter71.703,utter,(as JULIET),"""Then have my lips the sin that they have took."""
utter71.704,utter,VIOLA AS ROMEO,"Sin from my lips? Oh trespass sweetly urg'd. Give me my sin again."""
desc71.705,desc,,"VIOLA kisses WILL. They lose themselves for a fraction of a moment. As VIOLA withdraws her lips, WILL's lips are going for it again."
utter71.706,utter,VIOLA AS ROMEO,"""You kiss by the book."""
utter71.707,utter,ALLEYN,"(to Will, sarcastically) Well! It was lucky you were here! Why do not I write the rest of your play while you --"
utter71.708,utter,WILL,"(apologising, retreating) Yes, yes... continue. Now the Nurse. Where is Ralph?"
desc71.709,desc,,RALPH has been ready and waiting.
utter71.710,utter,RALPH AS NURSE,"""Madam, your mother craves a word with you."""
utter71.711,utter,VIOLA AS ROMEO,"""What is her mother?"""
utter71.712,utter,RALPH AS NURSE,"""Marry bachelor, Her mother is the lady of the house..."""
desc71.713,desc,,WILL has retreated to:
scene72,slugline,,INT. THE ROSE THEATRE. BACKSTAGE. DAY.
desc72.714,desc,,He is behind the curtain now.
utter72.715,utter,RALPH AS NURSE (O.S.),"""...And a good lady, and wise and virtuous. I nurse her daughter that you talk'd withal..."""
desc72.716,desc,,"During RALPH'S lines (which are continuous) WILL stands in the shadow behind the curtain, alone, agitated."
scene73,slugline,,INT. THE ROSE THEATRE. STAGE. DAY.
utter73.717,utter,RALPH AS NURSE,"""I tell you, he that can lay hold of her. (he makes the money sign) Shall have the chinks."""
utter73.718,utter,VIOLA AS ROMEO,"""Is she a Capulet"" Oh dear account. My life is my foe's debt."""
desc73.719,desc,,"NOL, AS ""BENVOLIO,"" at a party, carrying a goblet, tipsy, enters the scene."
utter73.720,utter,NOL AS BENVOLIO,"(to ROMEO) ""Away, be gone, the sport is at best."""
desc73.721,desc,,"VIOLA, about to make her exit, has her hand holding the curtain at the gap."
scene74,slugline,,INT. THE ROSE THEATRE. BEHIND THE CURTAIN. DAY.
desc74.722,desc,,WILL is kissing her hand.
scene75,slugline,,INT. THE ROSE THEATRE. STAGE. DAY.
utter75.723,utter,VIOLA AS ROMEO,"""Ay, so I fear; the more is my unrest."""
scene76,slugline,,INT. THE ROSE THEATRE. BEHIND THE CURTAIN. DAY.
desc76.724,desc,,"VIOLA comes through the curtain. WILL and VIOLA kiss, dangerously -- they are in a narrow space, hidden from the general backstage area."
utter76.725,utter,SAM AS JULIET (O.S.),"""Come hither nurse. What is yond gentleman?"""
utter76.726,utter,VIOLA,(to Will) Oh let it be night!
scene77,slugline,,INT. THE ROSE THEATRE. STAGE. DAY.
desc77.727,desc,,"""I know not."""
utter77.728,utter,SAM AS JULIET,"""Go ask his name -- If he be married, My grave is like to be my wedding bed."""
scene78,slugline,,INT. THE ROSE THEATRE. BEHIND THE CURTAIN. DAY.
desc78.729,desc,,"""JULIET'S"" line hits WILL between the eyes. WILL pulls away."
utter78.730,utter,VIOLA,"Oh, do not go."
utter78.731,utter,WILL,I must. I must.
scene79,slugline,,INT. THE ROSE THEATRE. BACKSTAGE. DAY.
desc79.732,desc,,"As WILL races up the ladder to his writer's corner, the rehearsal can be heard continuing. RALPH AS NURSE (O.S.) ""His name is Romeo, and a Montague,"
utter79.733,utter,ALLEYN (O.S.),(roaring from the audience) Terrible!
scene80,slugline,,INT. THE ROSE THEATRE. WRITER'S CORNER. DAY.
desc80.734,desc,,"WILL arrives at the top of the building in his writer's corner. He spins around once in a circle, rubs his hands together and spits on the floor. His manuscript is all over the table. We take a peak at the lines he has already written. INSERT MANUSCRIPT: ""But soft, what light through yonder window breaks? It is the east and Juliet is the sun."" VIOLA'S VOICE OVER speaks the line."
utter80.735,utter,VIOLA (V.O.),"""But soft, what light through yonder window breaks? It is the east and Juliet is the sun!"""
scene81,slugline,,INT. DE LESSEPSES' HOUSE. VIOLA'S BEDROOM. EVENING.
utter81.736,utter,VIOLA,"(reading) ""Arise fair sun and kill the envious moon Who is already sick and pale with grief That thou her maid art far more fair than she..."""
desc81.737,desc,,"VIOLA is in bed, reading the lines from the manuscript page. WILL is in bed with her, reading with her."
utter81.738,utter,VIOLA,"Oh, Will!"
