segment-id,segment-type,segment-speaker,segment-text
utter81.739,utter,WILL,"Yes, some of it is speakable."
desc81.740,desc,,"She has to speak through WILL's kisses, he is nibbling at her neck and shoulders and she has to bat him away with the pages."
utter81.741,utter,VIOLA,"(reading) ""It is my lady, O it is my love! O that she knew she were!"""
scene82,slugline,,INT. THE ROSE THEATRE. STAGE. DAY.
desc82.742,desc,,"VIOLA continues the speech, edge-to-edge, now in rehearsal, with SAM as ""JULIET"" sighing on the balcony above her."
utter82.743,utter,VIOLA AS ROMEO,"""The brightness of her cheek would shame those stars As daylight doth a lamp. Her eyes in heaven Would through the airy region stream so bright That birds would sing and think it were not night. See how she leans her cheek upon her hand. O that I were a glove upon that hand, That I might touch that cheek."""
utter82.744,utter,SAM AS JULIET,"(above) ""Ay me."""
utter82.745,utter,VIOLA AS ROMEO,"""She speaks. Oh speak again bright angel..."""
desc82.746,desc,,CUT between the STAGE and VIOLA'S BED.
scene83,slugline,,INT. DE LESSEPSES' HOUSE. VIOLA'S BEDROOM. EVENING.
utter83.747,utter,WILL,"(reading through VIOLA'S kisses) ""Oh Romeo, Romeo, wherefore art thou Romeo? Deny thy father and refuse thy name."""
scene84,slugline,,INT. THE ROSE THEATRE. STAGE. DAY
utter84.748,utter,SAM AS JULIET,"""Or if thou wilt not, be but sworn my love And I'll no longer be a Capulet."""
utter84.749,utter,VIOLA AS ROMEO,"(below) ""Shall I hear more or shall I speak at this?"""
scene85,slugline,,INT. DE LESSEPSES' HOUSE. VIOLA'S BEDROOM. NIGHT.
desc85.750,desc,,WILL and VIOLA in bed.
utter85.751,utter,WILL,"""What man art thou that thus bescreen'd in night So stumblest on my counsel?"""
scene86,slugline,,INT. THE ROSE THEATRE. STAGE/AUDITORIUM. NIGHT.
desc86.752,desc,,It's become late and the rehearsal is continuing by torchlight.
utter86.753,utter,VIOLA AS ROMEO,"""...By a name I know not how to tell thee who I am: My name, dear saint, is hateful to myself Because it is an enemy to thee..."""
desc86.754,desc,,"We see that a group of the other actors have drifted ""out front,"" drawn by the scene. FENNYMAN is there entranced. Clearly, this stuff is a cut above the normal."
scene87,slugline,,INT. DE LESSEPSES' HOUSE. VIOLA'S BEDROOM. NIGHT
desc87.755,desc,,"WILL, undressed, strides around the room, feeding ""JULIET's"" lines to VIOLA in bed."
utter87.756,utter,WILL,"""The orchard walls are high and hard to climb, And the place death, considering who thou art, If any of my kinsmen find thee here. If they do see thee, they will murder thee."""
scene88,slugline,,INT. THE ROSE THEATRE. STAGE. NIGHT.
utter88.757,utter,VIOLA AS ROMEO,"""Alack, there lies more peril in thine eye, Than twenty of their swords! Look thou but sweet, And I am proof against their enmity."""
utter88.758,utter,SAM AS JULIET,I would not for the world!
utter88.759,utter,VIOLA AS ROMEO,"I have night's cloak to hide me from their eyes; And but thou love me, let them find me here."
scene89,slugline,,INT. DE LESSEPSES' HOUSE. VIOLA'S BEDROOM. NIGHT.
desc89.760,desc,,"WILL and VIOLA are both out of bed, halfway though dressing. Still rehearsing."
utter89.761,utter,WILL,"""Good night, good night. As sweet repose and rest Come to thy heart as that within my breast. O wilt thou leave me so unsatisfied?"""
utter89.762,utter,VIOLA,That's my line!
utter89.763,utter,WILL,"Oh, but it is mine too!"
scene90,slugline,,INT. THE ROSE THEATRE. STAGE. NIGHT.
desc90.764,desc,,"""O wilt thou leave me so unsatisfied?"""
utter90.765,utter,SAM AS JULIET,"""What satisfaction can'st thou have tonight?"""
utter90.766,utter,VIOLA AS ROMEO,"""The exchange of thy love's faithful vow for mine."""
scene91,slugline,,INT. DE LESSEPSES' HOUSE. VIOLA'S BEDROOM. NIGHT.
desc91.767,desc,,"WILL and VIOLA are back on the bed, kissing and making love."
utter91.768,utter,WILL,"""My bounty is as boundless as the sea, My love as deep --"
utter91.769,utter,VIOLA AND WILL,"(continuing the speech with him) ...the more I give to thee The more I have, for both are infinite."""
desc91.770,desc,,Outside the NURSE is knocking on the door and calling.
scene92,slugline,,INT. THE ROSE THEATRE. STAGE. DAY.
desc92.771,desc,,"""I hear some noise within. Dear love,"
desc92.772,desc,,"RALPH, the Nurse, call's ""JULIET!"" off stage."
scene93,slugline,,INT. DE LESSEPSES' HOUSE. VIOLA'S BEDROOM. NIGHT
utter93.773,utter,VIOLA,"(calling to the NURSE who is outside) Anon, good Nurse."
scene94,slugline,,INT. DE LESSEPSES' HOUSE. OUTSIDE VIOLA'S BEDROOM. NIGHT.
desc94.774,desc,,The NURSE listens at the door.
scene95,slugline,,INT. THE ROSE THEATRE. STAGE. DAY.
utter95.775,utter,SAM AS JULIET,"""Anon, good Nurse -- Sweet Montague be true."""
scene96,slugline,,INT. DE LESSEPSES' HOUSE. VIOLA'S BEDROOM. NIGHT.
utter96.776,utter,WILL,"""Stay but a little, I will come again."""
desc96.777,desc,,"VIOLA slaps him playfully for his vulgarity, and then kisses him."
scene97,slugline,,INT. THE ROSE THEATRE. STAGE. DAY.
utter97.778,utter,SAM AS JULIET,"""Stay but a little, I will come again."""
desc97.779,desc,,SAM leaves the balcony through the curtain.
desc97.780,desc,,"""Oh blessed blessed night."""
scene98,slugline,,INT. DE LESSEPSES' HOUSE. VIOLA'S BEDROOM. NIGHT.
desc98.781,desc,,It is night. They have just made love. Suddenly it is very still.
utter98.782,utter,VIOLA,"(almost to herself) ""I am feared, Being in night, all this but a dream, Too flattering- sweet to be substantial."""
scene99,slugline,,INT. THE ROSE THEATRE. BACKSTAGE. DAY.
desc99.783,desc,,"Onstage, the scene continues. Backstage NED ALLEYN is working his way upstairs. He passes by RALPH (the Nurse) who has a couple of words ""of,"" as it were, in ""JULIET's"" chamber."
utter99.784,utter,SAM AS JULIET (O.S.),"""...All my fortunes at thy foot I'll lay, And follow thee my lord throughout the world."""
utter99.785,utter,RALPH AS NURSE,"""Madam!"""
utter99.786,utter,SAM AS JULIET (O.S.),"""I come, anon... But if thou meanest not well, I do beseech thee --"""
utter99.787,utter,RALPH AS NURSE,"""Madam!"""
utter99.788,utter,SAM AS JULIET (O.S.),"By and by I come to cease thy strife and leave me to my grief. A thousand times good night!"""
desc99.789,desc,,SAM exits (i.e. enters to us) through the curtain.
utter99.790,utter,SAM,"(to NED) I cannot move in this dress! And it makes me look like a pig! I have no neck in this pig dress! (and then hearing his cue from ""ROMEO"") Oh, she's off again! She says she's going and then she doesn't."
scene100,slugline,,INT. THE ROSE THEATRE. WRITER'S CORNER. DAY.
desc100.791,desc,,"NED is arriving. WILL is busy writing. PETER is there, holding the pages WILL has completed, and waiting for WILL to finish his page. PETER is reading his pages. WILL sees NED arrive. He gives his page to PETER."
utter100.792,utter,WILL,(to PETER) How is it?
utter100.793,utter,PETER,(shrugs) It's all right.
desc100.794,desc,,"Typical!, says WILL'S face. Peter departs, leaving the field to NED. WILL braces himself."
utter100.795,utter,WILL,Ned... I know... I know --
utter100.796,utter,ALLEYN,It's good.
utter100.797,utter,WILL,Oh.
utter100.798,utter,ALLEYN,The title won't do. Ah.
utter100.799,utter,ALLEYN,"Romeo and Juliet -- just a suggestion. Thank you, Ned."
desc100.800,desc,,"The whole exchange is in ironic code, between old soldiers. NED nods curtly and turns to descend."
utter100.801,utter,WILL,You are a gentleman.
utter100.802,utter,ALLEYN,And you are a Warwickshire shit-house.
scene101,slugline,,INT. THE ROSE THEATRE. STAGE/AUDITORIUM. DAY.
desc101.803,desc,,"PETER is just handing the pages HENSLOWE in the auditorium. HENSLOWE has acquired a performing dog. The dog does somersaults tirelessly. As PETER hands over the pages, he shakes his head."
utter101.804,utter,HENSLOWE,"(in disbelief) You mean, no dog of any kind?"
desc101.805,desc,,"FENNYMAN, the born-again theatre groupie shushes HENSLOWE and looks daggers at him."
utter101.806,utter,PETER,"(to HENSLOWE) The Friar married them in secret, then Ned gets into a fight with one"
desc101.807,desc,,"of the Capulets, Romeo tries to stop"
desc101.808,desc,,"in Mercutio's way, so Tybalt kills"
utter101.809,utter,Verona. HENSLOWE,(much relieved) That must be when he goes on the voyage and gets shipwrecked on the island of the Pirate King.
desc101.810,desc,,"FENNYMAN can't hear it. He storms over. Kicks the dog, roars at HENSLOWE."
utter101.811,utter,FENNYMAN,Cease your prattling! Get out! (to the stage where the action has paused) A thousand apologies!
utter101.812,utter,SAM AS JULIET,"""Good night, good night. Parting is such sweet sorrow That I shall say"
desc101.813,desc,,"good night till it be morrow."""
scene102,slugline,,INT. DE LESSEPSES' HOUSE. VIOLA'S BEDROOM. MORNING.
desc102.814,desc,,"A sunbeam wakes the lovers. Sunday morning. Church bells. VIOLA wakes with a start. Something is bothering her, she can't think what. WILL calms her."
utter102.815,utter,WILL,Sunday... it is Sunday.
desc102.816,desc,,He brings her back down to the pillow.
utter102.817,utter,WILL,I found something in my sleep. The Friar who married them will take up their destinies.
utter102.818,utter,VIOLA,"Oh, but it will end well for love?"
utter102.819,utter,WILL,"In heaven, perhaps. It is not a comedy I am writing now. A broad river divides my lovers -- family, duty, fate -- as unchangeable as nature."
utter102.820,utter,VIOLA,"(sobered) Yes, this is not life, Will. This is a stolen season."
desc102.821,desc,,Suddenly there is a great racket heard from downstairs... a man shouting.
utter102.822,utter,WESSEX (O.S.),Not ready? Where is she?
utter102.823,utter,NURSE (O.S.),"Be patient, my lord, she is dressing."
utter102.824,utter,WESSEX (O.S.),Will you ask Her Majesty to be patient?!
desc102.825,desc,,VIOLA remembers. She jumps up and gives a cry.
utter102.826,utter,VIOLA,Sunday! Greenwich!
scene103,slugline,,INT. DE LESSEPSES' HOUSE. OUTSIDE VIOLA'S BEDROOM. MORNING.
desc103.827,desc,,The NURSE is barring the stairs to WESSEX.
utter103.828,utter,WESSEX,"Now, pay attention, Nursy. The Queen, Gloriana Regina, God's Chosen Vessel, the Radiant One, who shines her light on us, is at Greenwich today, and prepared, during the evening's festivities, to bestow her gracious favour on my choice of wife -- and if we're late for lunch, the old boot will not forgive. So you get you to my lady's chamber and produce her with or without her undergarments."
scene104,slugline,,INT. DE LESSEPSES' HOUSE. VIOLA'S BEDROOM. MORNING.
desc104.829,desc,,"VIOLA has her dress on and is putting on her shoes. WILL, in his underwear is in mid-argument."
utter104.830,utter,WILL,You cannot! Not for the Queen herself!
utter104.831,utter,VIOLA,What will you have me do? Marry you instead?
utter104.832,utter,WILL,"(brought up short) To be the wife of a poor player? Can I wish that for Lady Viola, except in my dreams? And yet I would, if I were free to follow my desire in the harsh light of day."
utter104.833,utter,VIOLA,"(tartly) You follow your desire freely enough in the night. So, if that is all, to Greenwich I go."
utter104.834,utter,WILL,Then I will go with you.
utter104.835,utter,VIOLA,"You cannot, Wessex will kill you!"
utter104.836,utter,WILL,I know how to fight!
utter104.837,utter,VIOLA,"(now fixing her hair) Stage fighting! (turn to him) Oh, Will! As Thomas Kent my heart belongs to you but as Viola the river divides us, and I will marry Wessex a week from Saturday."
scene105,slugline,,INT. DE LESSEPSES' HOUSE. OUTSIDE VIOLA'S BEDROOM DOWNSTAIRS
desc105.838,desc,,HALL. MORNING.
utter105.839,utter,WESSEX,"(ranting) By heaven, I will drag her down, by the Queen's command."
desc105.840,desc,,And is cut off short as VIOLA'S door opens at the top of the stairs.
utter105.841,utter,VIOLA,"Good morning, my lord!"
utter105.842,utter,WESSEX,"(impressed by her appearance) Ah! My lady! The tide waits for no man, but I swear it would wait for you!"
desc105.843,desc,,VIOLA comes down the stairs. Behind her WILL appears gowned and bonneted. He has also assumed a country accent.
utter105.844,utter,WILL,"Here we come at last, my lord!"
utter105.845,utter,WESSEX,(taken aback) Are you bringing your laundry woman?
utter105.846,utter,WILL,"Her chaperone. My lady's country cousin. (arriving with a curtsey) My, but you be a handsome gallant, just as she said! You may call me Miss Wilhelmina!"
utter105.847,utter,WESSEX,"On a more fortuitous occasion, perhaps."
utter105.848,utter,WILL,"Oh, my lord, you will not shake me off, she never needed me more, I sear by your breeches!"
scene106,slugline,,EXT. GREENWICH PALACE. NIGHT.
desc106.849,desc,,"Fireworks explode in the evening sky over Greenwich, a royal palace, crowded now with noble guests."
scene107,slugline,,EXT. GREENWICH PALACE. TERRACE. NIGHT.
desc107.850,desc,,"The way these royal routs work is that guest mill about, chatting, bowing and generally behaving gallantly, while QUEEN ELIZABETH creates a vortex around her as she passes through the throng, occasionally honouring somebody with a couple of words, until she arrives thankfully at the best chair... where she establishes a headquarters. Her current LORD IN WAITING ferries the lucky few forward to a brief audience with the QUEEN, each giving way to the next. VIOLA and WESSEX are, respectively, dipping and bowing as they are greeted by people who know them... WILL, in close attendance, joins in gratuitously, bowing until VIOLA nudges him and reminds him to curtsey instead. The QUEEN'S LORD IN WAITING plucks WESSEX'S sleeve."
utter107.851,utter,WESSEX,(to him) Now?
utter107.852,utter,LORD IN WAITING,Now.
utter107.853,utter,WESSEX,(to Viola) The Queen asks for you. Answer well.
desc107.854,desc,,The LORD IN WAITING ushers VIOLA through the crowd. WILL starts to follow. WESSEX takes him by the arm.
utter107.855,utter,WESSEX,Is there a man?
utter107.856,utter,WILL,"A man, my lord?"
utter107.857,utter,WESSEX,"(impatiently) There was a man, poet -- a theatre poet, I heard -- does he come to the house? A theatre poet?"
utter107.858,utter,WESSEX,"An insolent penny-a-page rogue, Marlowe, he said, Christopher Marlowe -- has he been to the house?"
utter107.859,utter,WILL,"Marlowe? Oh yes, he is the one, lovely waistcoat, shame about the poetry."
utter107.860,utter,WESSEX,(venomously) That dog!
desc107.861,desc,,ANGLE on the QUEEN. The LORD IN WAITING has presented VIOLA. VIOLA speaks from a frozen curtsey.
utter107.862,utter,VIOLA,Your Majesty.
utter107.863,utter,QUEEN,"Stand up straight, girl."
desc107.864,desc,,VIOLA straightens. The QUEEN examines her.
utter107.865,utter,QUEEN,"I have seen you. You are the one who comes to all the plays -- at Whitehall, at Richmond."
utter107.866,utter,VIOLA,(agreeing) Your Majesty.
utter107.867,utter,QUEEN,What do you love so much?
utter107.868,utter,VIOLA,Your Majesty?
utter107.869,utter,QUEEN,Speak out! I know who I am. Do you love stories of kings and queens? Feats of arms? Or is it courtly love?
utter107.870,utter,VIOLA,I love theatre. To have stories acted for me by a company of fellows is indeed --
utter107.871,utter,QUEEN,"(interrupting) They are not acted for you, they are acted for me."
desc107.872,desc,,"VIOLA remains silent, in apology. ANGLE on WILL. He is watching and listening. He has never seen the QUEEN so close. He is fascinated."
utter107.873,utter,QUEEN,And--?
utter107.874,utter,VIOLA,And I love poetry above all.
utter107.875,utter,QUEEN,Above Lord Wessex?
desc107.876,desc,,She looks over VIOLA'S shoulder and VIOLA realises WESSEX has moved up behind her. WESSEX bows.
utter107.877,utter,QUEEN,(To WESSEX) My Lord... when you cannot find your wife you had better look for her at the playhouse.
desc107.878,desc,,The COURTIERS titter at her pleasantry.
utter107.879,utter,QUEEN,"But playwrights teach nothing about love, they make it pretty, they make it comical, or they make it lust. They cannot make it true."
utter107.880,utter,VIOLA,"(blurts) Oh, but they can!"
desc107.881,desc,,She has forgotten herself. The COURTIERS gasp. The QUEEN considers her. WESSEX looks furious. WILL is touched.
utter107.882,utter,VIOLA,"I mean... Your Majesty, they do not, they have not, but I believe there is one who can --"
utter107.883,utter,WESSEX,Lady Viola is... young in the world. Your Majesty is wise in it. Nature and truth are the very enemies of playacting. I'll wager my fortune.
utter107.884,utter,QUEEN,I thought you were here because you had none.
desc107.885,desc,,Titters again. WESSEX could kill somebody.
utter107.886,utter,QUEEN,"(by way of dismissing him) Well, no one will take your wager, it seems."
desc107.887,desc,,Shock and horror. QUEEN ELIZABETH is the only person amused.
utter107.888,utter,QUEEN,"Fifty pounds! A very worthy sum on a very worthy question. Can a play show us the very truth and nature of love? I bear witness to the wager, and will be the judge of it as occasion arises. (which wins a scatter of applause. She gathers her skirts and stands) I have not seen anything to settle it yet. (she moves away, everybody bowing and scraping) So... the fireworks will be soothing after the excitements of Lady Viola's audience. (and now she is next to WESSEX who is bowing low. Intimately to him) Have her then, but you are a lordly fool. She has been plucked since I saw her last, and not by you. It takes a woman to know it."
desc107.889,desc,,"The QUEEN passes by, and as WESSEX comes vertical again, we see his face a mask of furious realisation."
utter107.890,utter,WESSEX,(to himself) Marlowe!
scene108,slugline,,INT. BURBAGE'S HOUSE. ENTRANCE. DAY.
desc108.891,desc,,"CHRISTOPHER MARLOWE shuts the door behind him. Above him, the ceiling creaks to the rhythm of copulation. He has a sheaf of manuscript pages in his hand. He goes to the stairs."
utter108.892,utter,MARLOWE,Burbage!
desc108.893,desc,,The creaking stops.
utter108.894,utter,BURBAGE'S VOICE,Who's there?
scene109,slugline,,INT. BURBAGE'S HOUSE. STAIRS. DAY.
desc109.895,desc,,MARLOWE ascends.
utter109.896,utter,MARLOWE,Marlowe.
utter109.897,utter,BURBAGE'S VOICE,Kit!
scene110,slugline,,INT. BURBAGE'S HOUSE. BEDROOM. DAY.
desc110.898,desc,,"MARLOWE enters, ignoring the situation on the bed where ROSALINE is astride BURBAGE."
utter110.899,utter,MARLOWE,You are playing my Faustus this afternoon. Don't spend yourself in sport.
utter110.900,utter,ROSALINE,(working hard) This afternoon! We'll still be here this afternoon.
utter110.901,utter,BURBAGE,"What do you want, Kit?"
utter110.902,utter,MARLOWE,My Massacre at Paris is complete.
utter110.903,utter,BURBAGE,You have the last act?
utter110.904,utter,MARLOWE,You have the money?
utter110.905,utter,BURBAGE,Tomorrow.
utter110.906,utter,MARLOWE,(leaving) Then tomorrow you will have the pages.
utter110.907,utter,BURBAGE,Wait! (to ROSALINE) Will you desist!
utter110.908,utter,MARLOWE,Twenty pounds on delivery.
utter110.909,utter,BURBAGE,"What is money to me like us? Besides, if I need a play, I have another waiting, a comedy by Shakespeare."
utter110.910,utter,MARLOWE,Romeo? He gave it to Henslowe.
utter110.911,utter,BURBAGE,Never!
utter110.912,utter,MARLOWE,"Well, I am to Deptford now, I leave my respects, Miss Rosaline."
utter110.913,utter,BURBAGE,I gave Shakespeare two sovereigns for Romeo!
utter110.914,utter,MARLOWE,(leaving) You did. But Ned Alleyn and the Admiral's Men have the playing of it as the Rose.
utter110.915,utter,BURBAGE,Treachery!
desc110.916,desc,,"BURBAGE rouses himself violently, throwing ROSALINE off the bed. The glass bracelet is flung from her wrist. It breaks on the floor, releasing a strip of paper. BURBAGE picks it up. What he reads on it does not please him: it is WILL'S signature."
utter110.917,utter,BURBAGE,Traitor and thief!
scene111,slugline,,EXT. STREETS. DAY.
desc111.918,desc,,BURBAGE and a solid wedge of the CHAMBERLAIN'S MEND are cleaving a path through the crowds. Their faces are grim.
scene112,slugline,,INT. THE ROSE THEATRE. STAGE/AUDITORIUM/UNDER THE STAGE.
desc112.919,desc,,"DAY. We are in Act III Scene I. NED ALLEYN as ""MERCUTIO"" and NOL as ""BENVOLIO"", and two ""MONTAGUE"" sidekicks are in occupation of the stage, when the ""CAPULETS"" swagger in, four of them headed by JAMES HEMMINGS as ""TYBALT."""
utter112.920,utter,NOL AS BENVOLIO,"""By my head, here comes the Capulets."""
utter112.921,utter,ALLEYN AS MERCUTIO,"""By my heel, I care not."""
utter112.922,utter,JAMES HEMMINGS AS TYBALT,"""Follow me close, for I will speak to them. (With bombast to ""MERCUTIO"") Gentlemen, good e'en: a word with one of you."""
desc112.923,desc,,NED comes out of character.
utter112.924,utter,ALLEYN,Are you going to do it like that?
desc112.925,desc,,And before the humbled actor can reply NED continues.
utter112.926,utter,ALLEYN (AS MECUTIO),"And but one word with one of us? Couple it with something, make it a word and a blow."
desc112.927,desc,,"But suddenly six more men and a dog invade the stage, ready to fight. BURBAGE and the CHAMBERLAIN'S MEN have arrived to avenge BURBAGE'S honour with swords, clubs, and a bucket (containing pig swill)."
utter112.928,utter,BURBAGE,Where is that thieving hack who can't keep his pen in his own ink pot!?
desc112.929,desc,,WILL has already leapt up onto the stage.
utter112.930,utter,WILL,What is this rabble?!
desc112.931,desc,,"BURBAGE aims a blow at WILL, who ducks and grabs a stave from the nearest actor, and parries the blow. He swings at BURBAGE, a CHAMBERLAIN'S MAN swings at WILL, THOMAS cries out, someone else slashes the stage hangings bringing down the drapes, and in a moment the ADMIRAL'S MEN and the CHAMBERLAIN'S MEN, using their much rehearsed skills, are brawling with weapons and fist, using everything short of unbuttoned rapiers. CRAB, the dog, is yapping and snapping at any legs he can reach. HENSLOWE, a little slow to catch up on the situation, checks the page in his hand. FENNYMAN, much slower to catch up, watches enthralled."
utter112.932,utter,FENNYMAN,"(to HENSLOWE) Wonderful, wonderful! And a dog!"
desc112.933,desc,,"But now HENSLOWE has worked out that these actors don't belong, nor does the scene. He enters the fray, but his interest is protecting his property. Big burly RALPH is using a couple of unlit torches as weapons; he breaks one of them over an enemy's back and HENSLOWE turns on RALPH"
utter112.934,utter,HENSLOWE,Not with my props!
desc112.935,desc,,"VIOLA is doing well enough, tripping up an enemy with a well- judged stave, and then using it to deflect a blow aimed at WILL."
utter112.936,utter,VIOLA,Will! What?
desc112.937,desc,,A literary feud. Quite normal. Then he is smashed over the head. He falls off the stage taking VIOLA with him. Under the stage is a space (known as Hell) and WILL shoves VIOLA into this space.
utter112.938,utter,WILL,Stay hid!
desc112.939,desc,,"He gets back onto the stage, where the goings on are worthy of the Four Musketeers and Robin Hood combined, with SAM GOSSE, dressed as ""JULIET,"" fighting with the best of them. There is a stack of cushions, stored for the expensive seats, and as the stack is knocked over, NED ALLEYN and others grab cushions to use as shields. Soon cushions are being ripped, and the air is full of flying feathers. The trap door in the stage opens, VIOLA'S head pops up. She looks around and, surrounded by milling legs and floating feathers, a boot catches her sideways and half knocks her wig off. In danger of having her cover blown, she ducks down again, leaving the trap open just nicely for Will to plummet down it."
scene113,slugline,,INT. THE ROSE THEATRE. UNDER THE STAGE. DAY.
utter113.940,utter,WILL,I dreamed last night of a shipwreck. You were cast ashore in a far country.
desc113.941,desc,,They embrace and kiss. In a moment they are in a world of their own.
scene114,slugline,,INT. THE ROSE THEATRE. UNDER THE STAGE. DAY.
desc114.942,desc,,"The battle rages. FENNYMAN, alone now in the auditorium, continues to watch entranced. It's the greatest show he's ever seen. HENSLOWE is desperately trying to rescue odd props that have been seconded to the fight. Someone picks up a tree that is to be used in Romeo. HENSLOWE yells."
utter114.943,utter,HENSLOWE,We need that for the balcony scene!
desc114.944,desc,,"FENNYMAN notices this, and it rings a distant bell. He looks around the realises that some of these faces are unfamiliar. The tree comes crashing down on RALPH'S head. FENNYMAN looks at HENSLOWE."
utter114.945,utter,HENSLOWE,(in despair) My poor Rose!
desc114.946,desc,,"He collapses on to a broken bench. FENNYMAN comes over to him, grabs the script pages from his pocket, and consults them to confirm what he has now begun to suspect: that this scene is not in them."
utter114.947,utter,FENNYMAN,(horrified) My investment! LAMBERT!!!
desc114.948,desc,,"LAMBERT has been sleeping peacefully through this, but wakes to his master's call."
utter114.949,utter,FENNYMAN,(points at the fray) Vengeance!
desc114.950,desc,,HENSLOWE attempts to intervene.
utter114.951,utter,HENSLOWE,"I want no more trouble, Mr. Fennyman. As I explained to you, the theatre business --"
utter114.952,utter,FENNYMAN,"Henslowe, you pound of tripe, in my business I would be out of business if I had your courage, so don't tell me about business."
desc114.953,desc,,"And he delivers a telling blow to a passing CHAMBERLAIN'S MAN, who wheels off the stage. LAMBERT meanwhile is making short work of the rest of the opposition, receiving help with the thorny business of identification from SAM. Stray members of the CHAMBERLAIN'S MEN are running from the theatre, as BURBAGE, fighting a heroic last stand, is tipped backwards by FENNYMAN off the stage and into a bucket of swill. A PAUSE. Then NED starts applauding. The others, weary from fighting, start applauding too, from all levels of the theatre. FENNYMAN looks around, starting to beam, as a din of encores and bravos engulf him. A star!"
scene115,slugline,,INT. BROTHEL. NIGHT.
