segment-id,segment-type,segment-speaker,segment-text
desc75.392,desc,,"Hugo and Isabelle watch. The Automaton's hand moves slightly. Just a twitch. Hugo gasps. Hugo and Isabelle lean forward, wide-eyed with wonder. The miniature hand begins, very cautiously, to move. Hugo and Isabelle hold their breath. The Automaton dips the pen into the ink and begins to write. It draws a small line. The hand moves. Another small line. The hand moves. Another small line. Hugo and Isabelle lean closer. The Automaton continues to move. Dip the pen. Draw a line. Move. Draw a line. Dip the pen. Move. Draw a line. But it is meaningless. A series of scratches and lines without order. Nothing. Hugo stares. His heart sinking. Then the Automaton stops. Hugo is devastated."
utter75.393,utter,HUGO What an idiot,fix it--
desc75.394,desc,,Thinking I could
utter75.395,utter,ISABELLE Hugo-HUGO,It's broken. It'll always be broken!
desc75.396,desc,,"He flings himself to his bed. Anguish beyond tears. She doesn't know what to do. She goes to him, Trying to comfort, Hugo"
utter75.397,utter,ISABELLE,You can still-HUGO
desc75.398,desc,,You don't understand. I thought if
desc75.399,desc,,"He buries his head in his hands. A long beat. Then she notices something, The Automaton is moving again."
desc75.400,desc,,"Hugo *** Hugo, look at this! He glances up."
utter75.401,utter,ISABELLE,It's not done!~ not done!
desc75.402,desc,,They rush back to the Automaton. It is moving more quickly now. All the gears and wheels spinning perfectly. Draw-move-ink-draw-move. Hugo realizes:
desc75.403,desc,,It's not writing *** It's drawing!
desc75.404,desc,,"Faster and faster. A blur of ink. Lines forming together. Shading and cross-hatching. Draw-move-draw-move-ink-draw-moved.raw. An image begins to emerge. We don't see it entirely. We see bits and pieces. Something familiar about it, Hugo and Isabelle stare. Finally the Automaton stops. It waits. Pen poised. Hugo and Isabelle exchange a glance. And we finally see the image in full. ** And recognize it instantly *** A TRIP TO THE MOON. The round face of the man in the moon. Rocket protruding from his right eye. Hugo's father's favorite movie. The very image he told Hugo about. Hugo is trembling. Suddenly-The Automaton starts moving again--! Hugo and Isabelle jump-The Automaton dips the pen and moves its hand into position. And signs the drawing: ""Georges Melies."" A flourish under the signature and then the Automaton is"
utter75.405,utter,ISABELLE,"""Georges Melies"" *** That's Papa Georges' name! Why did your father's machine sign Papa Georges' name?*"
desc75.406,desc,,I don't know ***
utter75.407,utter,ISABELLE,And why does my key fit it?
desc75.408,desc,,Hugo shakes his head. He ju_st looks at the Automaton. He smiles.
desc75.409,desc,,He turns to her. HUGO
desc75.410,desc,,Now we have to figure it out. She is delighted. A mystery!
scene76,slugline,,EXT. APARTMENT BUILDING - EVENING
desc76.411,desc,,"The sun is sinking. Hugo and Isabelle approach the apartment building. Hugo, who has watched it so often from outside, hesitates at going in."
desc76.412,desc,,They enter.
scene77,slugline,,INT. APARTMENT - EVENING
desc77.413,desc,,"Impoverished gentility. A few small rooms. Neatly kept. Old furniture. Fading wallpaper. MAMA JEJINNE, Georges' wife, is sewing in a corner. She wears heavy reading glasses. She is a tall, handsome older woman. Isabelle and Hugo enter. MAMA JEANNE Isabelle *** ?"
utter77.414,utter,ISABELLE,"(kisses her) Mama Jeanne, we have to talk to you"
desc77.415,desc,,*.* This is Hugo Cabret.
desc77.416,desc,,The boy who's been working for Papa
utter77.417,utter,HUGO,"Yes, ma'am."
utter77.418,utter,MAMA JEANNE,Very good manners for a thief.
utter77.419,utter,HUGO,I'm not a thief.
desc77.420,desc,,"Jeanne co,nsiders him coolly over her glasses. Removes them."
utter77.421,utter,MAMA JEANNE,"What's going on, Isabelle?"
utter77.422,utter,ISABELLE,"(excited) Oh, well, it's a terribly long story, filled with circumlocutions! It all began several weeks ago when I was **."
desc77.423,desc,,Hugo stops her:
desc77.424,desc,,He pulls something from inside his coat. A piece of paper. Folded over. He hands it to Mama Jeanne. She unfolds it. It is the picture the Automaton drew. The image from A TRIP TO THE MOON. She stares down at it. A complex range of emotions pass over her features *** shook * . * nostalgia * * * sadness When she looks up at them there are tears in her eyes. Isabelle is struck by the sight.
utter77.425,utter,MAMA JEANNE,Children *** What have you done?
utter77.426,utter,ISABELLE,Maroa Jeanne *** ?
desc77.427,desc,,Mama Jeanne dries her eyes with a little handkerchief. Isabelle finds there are tears in her eyes as well. Hugo sees Isabelle's tears. Feels awful. MAMA JEANNE Where did you get it?
utter77.428,utter,HUGO,"You'll call me a liar. No, child."
utter77.429,utter,MAMA JEANNE HUGO,A mechanical man drew it. MAMA JEANNE
desc77.430,desc,,You have the mechanical man?
utter77.431,utter,HUGO,My father found him in a museum. No one wanted him. We fixed him.
utter77.432,utter,ISABELLE,You know about him?
utter77.433,utter,MAMA JEANNE,Oh yes *** But it needed (She realizes. Looks at Isabelle.) My key.
desc77.434,desc,,Isabelle removes the key.
utter77.435,utter,MAMA JEANNE,The key I gave you ***
desc77.436,desc,,"A beat as it all sinks in. Then she stands, She*hands the drawing back to Hugo."
utter77.437,utter,MAMA JEANNE,"Please, take it away. We can't dredge up the past now. And whatever happens, don't let Papa"
desc77.438,desc,,Georges see it.
utter77.439,utter,HUGO,Please tell us what's going on?!
desc77.440,desc,,She begins to lead Hugo to the door.
utter77.441,utter,MAMA JEANNE,It's no business of yours.
utter77.442,utter,HUGO,It is. My father fixed the
desc77.443,desc,,mechanical man.
utter77.444,utter,ISABELLE,Hugo's father is dead.
utter77.445,utter,MAMA JEANNE,I am sorry to hear it. But you must forget all this.
desc77.446,desc,,Hugo stops. Holds his ground.
utter77.447,utter,HUGO,"We worked hard to fix it, my father and me, and *** I just want to know what it means *** It has to mean something!"
desc77.448,desc,,"A beat. Mama Jeanne looks at him. Moved by his passion and need, She looks at him seriously. Speaks with great compassion. MAMA JEANNE"
desc77.449,desc,,They hear someone climbing up the stairs to the apartment.
utter77.450,utter,ISABELLE,It's Papa Georges!
utter77.451,utter,MAMA JEANNE,He can't know you're here. This way ***
desc77.452,desc,,She quickly leads them through the apartment to the master
scene78,slugline,,bedroom *** APARTMENT -- MASTER BEDROOM - EVENING
desc78.453,desc,,Marna Jeanne hurries them in:
utter78.454,utter,MAMA JEANNE,Just keep quiet. I'll find a way to get him out of the apartment. Not a
desc78.455,desc,,noise from either of you. She inadvertently glances toward a large armoire. Hugo and Isabelle both notice. Then she quickly goes. Shutting the door. A long beat. Hugo and Isabelle look at each other. They hear the muffled sounds of Mama Jeanne and Georges talking in another room. Whispers:
desc78.456,desc,,She looked over at the armoire.
utter78.457,utter,ISABELLE,I know.
desc78.458,desc,,There must be something in it.
utter78.459,utter,ISABELLE,I already searched it when I was looking for your notebook.
desc78.460,desc,,Search it again!
utter78.461,utter,ISABELLE,Don't tell me what.to do!
desc78.462,desc,,"She pulls a bobby pin from her pocket and begins picking the lock to the armoire. Hugo, meanwhile, goes to the door. Peeks through the keyhole. Through the keyhole: Georges and Jeanne are across the apartment, in the kitchen. She is pouring coffee. She steals a nervous glance to the bedroom door. Isabelle finishes picking the lock. Click. They search through the armoire. Clothes. Sheets. No clues. No treasure. Nothing. Hugo steps back, studies the tall armoire. He notices something: A decorative panel at the very top of the armoire has two thin parallel cracks in it. HUGO Look!"
utter78.463,utter,ISABELLE,We have to investigate!
desc78.464,desc,,He carries a chair to the armoire.
utter78.465,utter,ISABELLE,"Let me, I'm taller."
desc78.466,desc,,"She climbs up on the chair and examines the decorative panel. She has to stand on her tiptoes to reach it. He makes a gesture for her to knock on it. She does so. It sounds hollow. They are both excited. She carefully grips the edges of the decorative panel. She pulls. She pulls again. The panel comes off in her hands! Revealing *** A hidden compartment at the top of the armoirel A large box is inside the compartment. Isabelle hands down the panel to Hugo. Then she begins .to pull the box out. But it is heavy. She struggles a bit. He holds the chair steady. She almost has the box out now .** But it is ungainly, she was unprepared for the weight, and she is still balancing on her tiptoes *** As she pulls the box out *** She loses her balance *** The chair lurches *** She almost falls *.* But miraculously gets her balance *.. Shoots a relieved glance down to Hugo .*. Then a leg of the chair SNAPS--! She falls-She shrieks-Hugo catches her-The box falls-CRASHES to the floor-SMASHING open-Sending up a cyclone of paper-Hundreds of pieces of paper of every shape and size scatter across the floor and fly through the air--"
scene79,slugline,,i
desc79.467,desc,,"Hugo and Isabelle are surrounded by a tornado of paper, it swirls around them-On the paper-Wonderful drawings. Fanciful and imaginative. Dragons and devils. Spaceships and submarines. Fairies and fish. Elaborate landscapes of fantasy *** One of the drawings seems to slow as it whirls past Hugo *** The man in the moon, a rocket protruding from his right eye *.* The swirling papers finally descend to earth *.* Revealing *** Georges. standing in the doorway. Mama Jeanne behind him. Georges looks at the carpet of drawings spread out before him."
utter79.468,utter,-GEORGES,(whispers) Back .** back from the dead *.*
desc79.469,desc,,His quiet anguish gives way to anger-He wades into the drawings-Grabbing handfuls-Tearing them up-Shredding them violently-Flinging them away-Mama Jeanne grabs him:
desc79.470,desc,,"Stop it, Georges! Stop! This is your work!"
desc79.471,desc,,MY work?! MY work?! -- Who am I? A penniless merchant! A broken windup
desc79.472,desc,,He spins on Hugo in fury:
utter79.473,utter,GEORGES,I trusted you -- and this is how
desc79.474,desc,,"you thank me?! You cruel -- cruel-suddenly he can't speak-Something's wrong -- he gulps for air-Mama Jeanne sits him on the bed. He is exhausted, gasping for breath. His sad eyes gaze over the chaos of drawings. Tears come. He whispers."
utter79.475,utter,GEORGES,"An empty box, an old rocket, a lost monster *** nothing, nothing, nothing ***"
utter79.476,utter,MAMA JEANNE,"I'm sorry, Georges *** I'm so sorry ..."
desc79.477,desc,,Isabelle takes Hugo's arm and gently pulls him out. He glances back. Sees Mama Jeanne tenderly holding her disconsolate husband. Hugo is haunted by the poignant image.
scene80,slugline,,EXT. APARTMENT - NIGHT
desc80.478,desc,,Night. Street lamps illuminate the scene. Isabelle is at the front door. A beat.
utter80.479,utter,ISABELLE,I should go back.
utter80.480,utter,HUGO,Okay.
desc80.481,desc,,A beat.
utter80.482,utter,ISABELLE,I've never seen them cry before.
desc80.483,desc,,Hugo takes her hand. A comforting gesture of friendship. She acknowledges it. A faint smile. She closes the door. Hugo walks down the street. He stops under the street lamp for a moment. Gazing back up
scene81,slugline,,"at the apartment,"
desc81.484,desc,,And we fade to ***
scene82,slugline,,INT. TRAIN STATION -- GRAND HALL - DAY
desc82.485,desc,,"Hugo walks through the Grand Hall, deep in thought. He notices Monsieur Frick, the newspaper vendor, walking in front of him. Monsieur Frick goes to Madame Emilie's cafe. Her dachshund growls at him. Monsieur Frick reaches into his coat and -- with the panache of a magician -- voilal -- pulls a sausage from his coat. The dachshund is intrigued. It accepts the peace offering. Tail wagging. Hugo is happy for Monsieur Frick. But then Monsieur Frick dares to approach Madame Emilie. The dachshund attacks. Monsieur Frick retreats. Hugo continues on."
scene83,slugline,,INT. TRAIN STATION -- BOOKSTORE - DAY
desc83.486,desc,,Hugo summons his nerve. Goes to Monsieur Labisse at the counter. Monsieur Labisse regards him with his usual suspicion.
utter83.487,utter,HUGO,"Good morning, Monsieur Labisse. Do you have books about the movies?"
utter83.488,utter,MONSIEUR LABISSE,I might ***
utter83.489,utter,HUGO,What about the very first movies? My father saw a movie when he was little that he always remembered. It had a rocket going into the eye of the man in the moon. Do you have something about that movie?
utter83.490,utter,MONSIEUR LABISSE,Why would you need such a book?
utter83.491,utter,HUGO,I want to learn.
desc83.492,desc,,The simplicity and honesty of Hugo's answer strikes Monsieur Labisse. He considers Hugo more thoughtfully.
utter83.493,utter,MONSIEUR LABISSE,That book about magic *** I saw you. You were going to steal it but you changed your mind. Why?
utter83.494,utter,HUGO,You're Isabelle's friend. I couldn't.
desc83.495,desc,,"Hmm **. A book about movies, you"
desc83.496,desc,,"Please, sir. It's very important. MONSIEUR LABISSE Suppose we could take a quick look. In a back corner of the shop. Hugo and Monsieur Labisse are surrounded by books. They are searching diligently through many dusty volumes."
utter83.497,utter,HUGO,I feel like Isabelle. What?
desc83.498,desc,,MONSIEUR LABISSE
utter83.499,utter,HUGO,Surrounded by all these books. MONSIEUR LABISSE Mmm. She does love to read *** But then she's had a lot of suffering in her life.
desc83.500,desc,,Hugo looks at him. Doesn't quite understand.
utter83.501,utter,MONSIEUR LABISSE,"(explains) Books can be a wonderful escape, when you're unhappy."
desc83.502,desc,,Hugo wonders if Monsieur Labisse is unhappy. Monsieur Labisse flips through a final title.
desc83.503,desc,,I don't appear to have anything
desc83.504,desc,,might try the Film Academy library.
desc83.505,desc,,Hugo is about to go. Stops.
utter83.506,utter,HUGO,"If you ask me, this shop is a"
desc83.507,desc,,He goes. Monsieur Labisse smiles. A little less unhappy.
scene84,slugline,,EXT. FILM ACADEMY BUILDING - DAY
desc84.508,desc,,A wide
scene85,slugline,,boulevard.
desc85.509,desc,,Fine motorcars. Magisterial buildings. A part of Paris we have not seen before. Wealth and privilege. Hugo looks particularly small standing in front of the most
scene86,slugline,,august building on the street: The French Film Academy.
desc86.510,desc,,"Two great stone lions flank the entrance. The lions gaze balefully at Hugo, as if annoyed at his presumption. Hugo summons his courage and enters ***"
scene87,slugline,,INT. FILM ACADEMY -- LOBBY - DAY
desc87.511,desc,,Hugo's heels click as he crosses an enormous marble void to a reception desk. The BECEPTIONIST -- a stern dragon of a woman -- watches his approach as balefully as the lions outside. He finally reaches her.
desc87.512,desc,,"Excuse me, Madame-He stops -- shocked to find his voice echoing in the massive chamber -- contin~es more quietly:"
utter87.513,utter,HUGO,"Excuse me, I would like to use the library."
desc87.514,desc,,She looks him up and down.
utter87.515,utter,RECEPTIONIST,No. No?
utter87.516,utter,HUGO RECEPTIONIST,You're too small and too dirty. Goodbye.
desc87.517,desc,,She returns to her paperwork. Hugo stands for a moment. st~rts to go. Stops. Returns to her.
utter87.518,utter,HUGO,I thought the library was open to
desc87.519,desc,,all Frenchmen.
utter87.520,utter,RECEPTIONIST,Not small and dirty ones.
utter87.521,utter,HUGO,In that case *** (clears his throat nervously) I would like to see your superior.
desc87.522,desc,,"She looks at him. Daggers. Then, a familiar voice:"
utter87.523,utter,ETIENNE,Hugo? Is that you?
desc87.524,desc,,"Etienne approaches from another room, carrying some books."
utter87.525,utter,HUGO Etienne! RECEPTIONIST,You know this filthy child?!
utter87.526,utter,ETIENNE,"Of course, this is my friend Hugo."
utter87.527,utter,RECEPTIONIST,Then he's your responsibility! I want nothing more to do with the dreadful little Jacobinl Hmmph!
desc87.528,desc,,"She returns to her paperwork. Etienne, amused, leads Hugo away."
scene88,slugline,,INT. FILM ACADEMY -- LIBRARY - DAY
desc88.529,desc,,Hugo and Etienne move through a lovely library. Two stories. Shining brass fixtures and rich wooden shelves. Neats rows of books.
utter88.530,utter,HUGO,I'm sorry about your job in the theatre.
utter88.531,utter,ETIENNE,"It worked out well, actually. When I was fired I had just started classes here and""they were able to give me a job here in the library *** I'm studying to be a cameraman."
desc88.532,desc,,Hugo glances at Etienne's eye patch. Etienne smiles as he leads Hugo up a spiral staircases to the second level:
utter88.533,utter,ETIENNE,Having an eye patch actually makes it easier to look through a camera - I don't have to close one eye like everyone else.
desc88.534,desc,,"Now on the second level, Etienne takes Hugo to a shelf and pulls out a book."
utter88.535,utter,ETIENNE,"I think this might be what you're looking for *** One of my teachers wrote it, Rene Tabard *** That's him down there ***"
desc88.536,desc,,Hugo glances down to the first level * .!3Jllm TABARD is a formidable presence. Stern and uncompromising. He marches through the library. The students part like the Red Sea before Moses. He leaves a wake of stares and trembling. Etienne leads Hugo to a library table. Hands him the book.
utter88.537,utter,ETIENNE,I'll be down at the desk if you need me.
desc88.538,desc,,"Etienne goes down to the first floor, where he mans the circulation desk. Hugo looks at the book. THE INVENTION OF DREAMS: THE STORY OF THE FIRST MOVIES by Rene Tabard. Hugo runs his hands over the cover. This could be it. The answer to his quest. He opens the book. Begins to read."
desc88.539,desc,,"""In 1895, one of the very first films ever ii<hown was called A TRAIN ARRIVES IN THE STATION, which showed nothing more than a train coming into a station *** "" We see the little film of the train steaming into the station"
scene89,slugline,,HUGO (V.O.)
desc89.540,desc,,"""But when the train came speeding toward the screen, the audience"
desc89.541,desc,,Hugo smiles.
desc89.542,desc,,No one had ever seen anything like it before. He turns the page *** And we go with him ***
scene90,slugline,,Into the book * **
desc90.543,desc,,Flickering images from the very first movies *** Fragile fragments of life captured forever *** A stream of factory workers leaving work *** Two Edison technicians dancing *** Skyscrapers in New York *** London street scene *** a boxing match* *** a.Paris park *** men playing cards *** HUGO (V .o.) . uWhat began as a sideshow novelty soon grew into something more as
desc90.544,desc,,"quaint real life images *** Edison's THE KISS , , * THE Gru;AT TRAIN ROBBERY * , * THE CABINET OF DR, CALIGARI , ** INTOLERANCE *** Buster Keaton , ** Louise Brooks .** William S. Hart **. Doug Fairbanks *** DeMille *** Jean Renoir ***"
scene91,slugline,,A TRIP TO THE MOON.
desc91.545,desc,,The man in the moon with a rocket protruding from his eye. Hugo stares.
scene92,slugline,,INT. FILM ACADEMY -- LIBRARY - DAY
desc92.546,desc,,We see Hugo talking intently to Etienne and the imposing Professor Rene Tabard at the circulation desk. Hugo is trying to convince them of something. They are skeptical.
desc92.547,desc,,"""The filmmaker Georges Melies was"
scene93,slugline,,"INT, FILM ACADEMY -- LOBBY - DAY"
desc93.548,desc,,"We see Hugo walking past the dragon Receptionist, the book under his arm."
utter93.549,utter,HUGO (V.O.),"""Melies is widely credited with inventing many of the film tricks that *changed the face of movies forever. He was the father of cinema fantasy .** """
scene94,slugline,,INT. TRAIN STATION -- GRAND HALL - AFTERNOON
desc94.550,desc,,We see Hugo moving through the crowded station.
desc94.551,desc,,"""A TRIP TO THE MOON, Melies most famous film, followed a group of explorers as they went to the moon, battled moon creatures, and"
scene95,slugline,,INT. TRAIN STATION -- TOY BOOTH - AFTERNOON
desc95.552,desc,,"We see Hugo, from hiding, getting Isabelle's attention. Georges is sitting sullenly at the counter. He looks grey, sickly."
utter95.553,utter,HUGO (V.O.),"""If one day far in the future, mankind is truly able to fly to the moon, we will have Georges Melies and the movies to thank for helping us understand that if our dreams are big enough, anything is possible *** """
desc95.554,desc,,Isabelle sneaks away from the Toy Booth to join Hugo.
scene96,slugline,,INT. TRAIN STATION -- SECRET APARTMENT - AFTERNOON
desc96.555,desc,,"Hugo concludes, reading aloud to Isabelle:"
utter96.556,utter,HUGO,"""The great pioneer of early cinema, Georges Melies, died sometime after the Great War, and many, if not all, of his films are lost."""
desc96.557,desc,,He shuts the book.
desc96.558,desc,,Hugo nods.
utter96.559,utter,ISABELLE,Papa Georges made movies? *** He won't even let me gg to the movies!
utter96.560,utter,HUGO,I wonder why he stopped? And why do they think he's dead?
utter96.561,utter,ISABELLE,And how did he end up here?
desc96.562,desc,,They look at each other. More mysteries.
scene97,slugline,,INT. TRAIN STATION -- TUNNELS - AFTERNOON
desc97.563,desc,,Hugo leads Isabelle through the tunnels. He carries his bucket of tools. Time to wind the clocks.
utter97.564,utter,HUGO,"I told Etienne all about Papa Georges, then he introduced me to his teacher, who wrote the book."
utter97.565,utter,ISABELLE,What happened?
utter97.566,utter,HUGO,They didn't believe me *** Stay up
desc97.567,desc,,"here. He takes a few tools, opens the hatch and climbs down the rickety ladder into ***"
scene98,slugline,,INT. TRAIN STATION -- HANGING CLOCK - AFTERNOON
desc98.568,desc,,"The large clock suspended from the ceiling of the Grand Hall. Clock dials surround Hugo on all four sides. He checks his pocket watch, then uses a little screwdriver to tinker with one of the clocks. Isabelle stays above, pokes her head down:"
utter98.569,utter,ISABELLE,They thought you were lying?
utter98.570,utter,HUGO,"Or that I made a mistake. I told them about the Automaton and everything but they still didn't believe me, so I *.* well ***"
desc98.571,desc,,He hesitates *.
utter98.572,utter,ISABELLE,What did you do?
utter98.573,utter,HUGO,I invited them to come to your
utter98.574,utter,apartment.,You what?!
scene99,slugline,,ISABELLE
desc99.575,desc,,Just then-Through one of the clock faces-Hugo sees the Station Inspector! Approaching. Stopping. Standing directly below the clock! Hugo urgently gestures up to her to be quiet: HUGO
desc99.576,desc,,"He points down. She sees the Station Inspector. A long beat. Hugo doesn't bare breathe. The Station Inspector just stands there, looking over the terminal. The clock ticks over to 6:00 pm *** The minute hand clicks straight up *** Knocking Hugo's little screwdriver away *** It falls *** Hugo grabs for it *** Isabelle watches in horror *** Hugo misses *** The screwdriver falls .** It hits the bottom of the clock with a resounding .** CLINK! The Station Inspector looks up."
utter99.577,utter,STATION INSPECTOR,Monsieur Claude? Are you up there? Monsieur Claude?
desc99.578,desc,,"Hugo looks up to Isabelle in panic. What should he do?! She mimes grabbing her throat: act like you have laryngitis. Hugo puts on a deep, scratchy voice:"
utter99.579,utter,HUGO,(deep voice) Monsieur?
utter99.580,utter,STATION INSPECTOR,Is all well up there?
utter99.581,utter,HUGO,"(deep voice) Yes, sir."
utter99.582,utter,STATION INSPECTOR,"You're not *** drinking, are you?"
utter99.583,utter,HUGO,"(deep voice) No, sir *.* I have a sore throat."
utter99.584,utter,STATION INSPECTOR,"Hmm. Well, be sure to check the clock on platform seven. By my calculation it is three minutes fast * * * I will not have time running amok in !!lY station."
utter99.585,utter,HUGO,"(deep voice-) Right away, sir."
desc99.586,desc,,The Station Inspector goes. Hugo looks up at Isabelle. That was close!
scene100,slugline,,INT. TRAIN STATION -- TUNNELS - EVENING
desc100.587,desc,,Hugo and Isabelle continue through the tunnels.
utter100.588,utter,ISABELLE,But why did you invite them to our apartment?
utter100.589,utter,HUGO,It was the only way! They didn't believe me *** Professor Tabard wants to meet your godfather for himself.
utter100.590,utter,ISABELLE,Mama Jeanne will never allow it.
utter100.591,utter,HUGO,Then we can't tell her.
utter100.592,utter,ISABELLE,"Hugo, this is a very bad idea *** When are they supposed to come? Tomorrow."
desc100.593,desc,,"She stops, shocked. He quickly escapes, climbing up the ladder to the narrow passage that overlooks the platform. She follows ***"
scene101,slugline,,INT. TRAIN STATION -- PLATFORM CLOCK - EVENING
desc101.594,desc,,"Hugo kneels to wind the clock, which is at foot level. Isabelle sits next to him."
utter101.595,utter,ISABELLE,Tomorrow?
utter101.596,utter,HUGO,It's the only way we'll find out everything **. (MORE)
utter101.597,utter,HUGO (CONT.DJ,Papa Georges will see that there are people who remember him. How can that be wrong?
utter101.598,utter,ISABELLE,(hesitant) I don't know ***
utter101.599,utter,HUGO,"Please, Isabelle *** I have to know what this is all about."
desc101.600,desc,,She nods. He works on the clock. Through the clock face she notices Monsieur Rouleau putting away his brushes for the day. His Surrealist painting is coming along well. She sees a passing WEl\LTHY COUPLE commenting unfavorably on his painting. Monsieur Rouleau ignores them with dignity.
utter101.601,utter,ISABELLE,Poor Monsieur Rouleau *** He works so hard. People just don't understand.
utter101.602,utter,HUGO,"He keeps at it though, He's got a real * * * purpose."
utter101.603,utter,ISABELLE,What do you mean?
