segment-id,segment-type,segment-speaker,segment-text
utter101.604,utter,HUGO,(points) Could you hand me that?
desc101.605,desc,,"She hands him a tool from the bucket. She flops over on her back, looking up at him as he continues to work on the clock:"
utter101.606,utter,HUGO,"I mean * * * Did you ever notice that all machines are made for some reason? They make you laugh; like Papa Georges toys, or they tell time, like the clocks *** Maybe that's why broken machines always make me sad, because they can't do what they're meant to do."
desc101.607,desc,,"She looks up at him. From hei perspective, he is beautifully framed by the intricate clockwork."
utter101.608,utter,HUGO,Maybe it's the same with people. If
desc101.609,desc,,you lose your purpose *** it's like
utter101.610,utter,ISABELLE,Like Papa Georges.
utter101.611,utter,HUGO,"Maybe * , * And maybe we can fix him."
desc101.612,desc,,He continues to work on the clock. A beat as she watches him.
utter101.613,utter,ISABELLE,Is that your purpose? . What?
utter101.614,utter,HUGO ISABELLE,That. Fixing things.
utter101.615,utter,HUGO,I don't know. It's what my father did.
utter101.616,utter,ISABELLE,Then what's lllY purpose?
utter101.617,utter,HUGO,I don't know.
desc101.618,desc,,"A long beat as she thinks about it, It seems to make her sad."
utter101.619,utter,ISABELLE,Maybe if I had known my parents I would know.
desc101.620,desc,,A beat.
utter101.621,utter,ISABELLE,"The people I read about in books, they always have a purpose *** But maybe I don't,"
desc101.622,desc,,"She gazes out over the terminal, a little lost. He looks at her. A beat."
utter101.623,utter,HUGO,Come with me.
scene102,slugline,,INT. TRAIN STATION -- CLOCK TOWER - EVENING
desc102.624,desc,,"The enormous clock. The majestic view of Paris. Again, vaguely unreal. Like an exquisite toy model. The lights of the city are twinkling on. It is magical. The whole city seems to move and flow like an elegant, perfect machine. Hugo and Isabelle look over the city."
utter102.625,utter,HUGO,"Right after my father died, I would come up here a lot *** I would imagine that the whole world was one big machine. Machines never have any extra parts, you know. They always have the exact number they need. So I figured if the entire world was a big machine I couldn't be an extra part, I had to be here for some. reason *.* And that means you have to be here for some reason, too."
desc102.626,desc,,"She is touched. Paris sparkles below. Like it is made of stars. The only sound is the steady, rhythmic pulse of the clock's machinery. She gently takes his hand. They are silhouetted before the glowing city."
scene103,slugline,,INT. TRAIN STATION TOY BOOTH - EVENING
desc103.627,desc,,Georges is closing up the shop. His movement are slow and leaden. Hugo and Isabelle are hiding around a corner:
utter103.628,utter,HUGO,I'll bring them at seven o'clock
desc103.629,desc,,tomorrow night. Don't say anything.
utter103.630,utter,ISABELLE,Are you .SSYJ;Q about this?
desc103.631,desc,,Not really *** But I think it's the only way *.*
utter103.632,utter,ISABELLE,To fix him.
desc103.633,desc,,He nods. A beat.
desc103.634,desc,,She gives him a quick kiss on the cheek. He is shocked. Then she runs to Georges at the Toy Booth. Hugo slips away.
scene104,slugline,,"INT, TRAIN STATION -- TUNNELS - EVENING"
desc104.635,desc,,Hugo watches from behind a clock face. He sees Georges and Isabelle leaving the station.
scene105,slugline,,INT. TRAIN STATION -- SECRET APARTMENT - NIGHT
desc105.636,desc,,Candles are burning. Hugo is getting ready for bed. Carefully winding his big pocket watch. Hanging it on its special hook by the bed. He looks at the Automaton.
utter105.637,utter,HUGO,Will it work?
desc105.638,desc,,The Automaton looks back at him. Hugo blows out the candle and settles into bed. He is nervous about tomorrow. Can't sleep. The Automaton watches him. We hear the steady tick watch. ... tick **. tick of Hugo's pocket The image melts to ***
scene106,slugline,,"INT,/EXT. SURREALIST NIGHTMARE - DAY/NIGHT"
desc106.639,desc,,"*.* tick *** tick *** tick *** We are inside Monsieur Rouleau's Surrealist painting. There is nothing vague or fuzzy about this nightmare. It has the crystal-clear clarity of Magritte. The crisp, bold colors of Michael Powell. Hugo moves through the landscape of Monsieur Rouleau's painting. His anxiety manifests itself. Images from Hugo's life combine to torment him: He sees his Father in the distance. A tender and supportive figure. Hugo moves toward him happily, Then-The pillar of fire from the museum. Engulfing his Father. Terrible. Hugo tries to get to him, Can't. The distance is suddenly too far. The world has expanded. The raging pillar of fire swirls into dreadful, grey falling ashes. Which then swirl into falling snow."
scene107,slugline,,The graveyard outside Georges' house.
desc107.640,desc,,Hugo is alone. Snow falling on him. He looks up at the Melies family through the windows of their
scene108,slugline,,apartment across the street.
desc108.641,desc,,"But then we see he is not alone. The two stone lions from outside the Film Academy are stalking Hugo. They move with the wonderful jerkiness of early STOP-MOTION ANIMATION, like early Ray Harryhausen. Hugo turns. The lions snarl. Hugo backs up. One of the lions leaps! Jaws opening wide! Devouring Hugo-Devouring us-Darkness."
scene109,slugline,,The darkness of the tunnels.
desc109.642,desc,,"Hugo moves through the station tunnels, but they are distorted and endless. An insane maze with insane angles and impossible perspectives, Like Escher, Like THE CABINET OF DR, CALIGARI. There is no up. There is no down. Hugo will spend the rest of his life lost in these mad tunnels. He finds he is not entirely alone. As he weaves through the maze he sees some familiar faces .*. Madame Emilie's little dachshund runs past *** Monsieur Labisse moves down a passage, reading aloud *** Monsieur Frick dances with Madame Emilie on the ceiling *.* Down another passage, Monsieur Rouleau paints flames on one of the walls *** Down a different passage, the Automaton does card tricks, They are all trapped in this endless labyrinth of tunnels. Then Isabelle appears to offer guidance. Hugo smiles, goes to her. She offers her hand. He takes it. He looks up at her face. But it is not her! It is Georges. Ferocious and angry. Then it is Uncle Claude. Cruel and drunken. Then it is the Station Inspector. Imperious and threatening. Then-Hugo is suddenly alone. Back in his apartment. He sits up on the edge of his bed. The nightmare is over. Tick *** tick *** tick *** He hears the comforting sound of his pocket watch. But something is wrong. He glances over. The pocket watch isn't hanging from its hook anymore. He listens intently *** Tick *** tick *** tick The sounds appears to be coming from ***"
desc109.643,desc,,"He pulls his shirt aside to reveal-His guts are a ticking, spinning clockwork-He bolts up-He is a machine! An Automaton! And the apartment around him is now an ENORMOUS MACHINE. Loud and horrible. He is utterly surrounded. POUNDING pistons. GRINDING gears. SPINNING wheels. Then Hugo's face-Starts to melt away-Beginning to be replaced by the impassive features of the"
scene110,slugline,,"Automaton-INT, TRAIN STATION -- SECRET APARTMENT - NIGHT"
desc110.644,desc,,--Hugo jerks awake. Panting for air. He gets out of bed. Lights a candle. Sits. He won't sleep anymore tonight.
scene111,slugline,,EXT. HOUSEBOAT -- SEINE - MORNING
desc111.645,desc,,"Two young BOHEMIANS, living on a dilapidated houseboat on the Seine. The Young Man writes a poem, mouthing the lines . to himself. The Young Woman lazily dangles a fishing line into the river and smokes a pipe. Very Gertrude stein. Her lines catches. Ah, breakfast. She reels her catch in *** it's heavy she lazily peeks over the side of the boat *** and.sees *** Uncle Claude!"
scene112,slugline,,i
desc112.646,desc,,His lifeless face staring up! She screams. People on the banks come running.
scene113,slugline,,EXT. APARTMENT BUILDING - NIGHT
desc113.647,desc,,Hugo waits nervously outside Georges' building. He checks his big pocket watch. It is just after 7:00. Etienne and Rene Tabard approach. Etienne carries something in a large wooden box.
desc113.648,desc,,Good evening.
utter113.649,utter,HUGO,"This way, sir."
desc113.650,desc,,He leads them into the building.
scene114,slugline,,INT. APARTMENT* - NIGHT
desc114.651,desc,,"Isabelle is pretending to read. Mama Jeanne is across the room, sewing. Georges is nowhere to be seen. There is a knock at the door. Isabelle gives .a little yelp and jumps up:"
utter114.652,utter,ISABELLE,I'll get itl
desc114.653,desc,,"Jeanne removes her heavy glasses, curious, as Isabelle hurries to the door and opens it."
utter114.654,utter,ISABELLE,"Oh, what a surprise! Come in, come in ..*"
desc114.655,desc,,"Hugo, Etienne and Rene Tabard enter."
utter114.656,utter,MAMA JEANNE,"(stands) What is the meaning of this, . Isabelle?"
utter114.657,utter,ISABELLE,"Please don't be mad, Mama Jeanne. MAMA JEANNE"
desc114.658,desc,,That young man is not welcome here * * . Who are these people?
utter114.659,utter,HUGO,We found out who Papa Georges is.
desc114.660,desc,,A beat as she stares at them.
utter114.661,utter,ISABELLE,"Please, Mama Jeanne. They want to"
desc114.662,desc,,help. They love Papa Georges'
desc114.663,desc,,"The imposing Rene Tabard steps forward, polite and formal."
utter114.664,utter,TABARD,"I deeply apologize, Madame. we thought you were expecting us. We will leave immediately and return upon your request."
utter114.665,utter,MAMA JEANNE,"Please, keep your voices down, my husband is sleeping. He hasn't been well *** I *** I wish my goddaughter had told me about your visit. I'm afraid you will not be invited back."
utter114.666,utter,ISABELLE,Don't make them leave ***
utter114.667,utter,TABARD,"I don't want to impose on you, Madame Melies, but if this is to be the only time we meet, please let me express to you the profound debt of gratitude I owe your husband."
desc114.668,desc,,She looks at him.
utter114.669,utter,TABARD,When I was boy I saw all his films. They inspired me .** Your husband gave me a great gift. And he is a very great artist.
desc114.670,desc,,She is touched.
utter114.671,utter,MAMA JEANNE,"I am pleased that you remember my husband's films with such fondness, but he's become so fragile .** It only hurts him to remember the past. I don't want him hurt."
utter114.672,utter,TABARD,"(bows) Then we will take our leave, Madame"
desc114.673,desc,,*** Goodbye.
utter114.674,utter,ETIENNE,"Goodbye, Madame Melies, and I hope you'll forgive me for saying, you are as lovely now as you were in the movies."
desc114.675,desc,,Hugo and Isabelle are stunned.
utter114.676,utter,ISABELLE,Mama Jeanne.i.?
utter114.677,utter,HUGO,You were in the movies?
utter114.678,utter,ETIENNE,She appeared in almost all of his films.
utter114.679,utter,ISABELLE,"You were an actress?! That was a long time ago, children. Another life *** I was another person."
utter114.680,utter,ETIENNE,Would you like to meet her again?
desc114.681,desc,,"Mama Jeanne looks at him, curious."
utter114.682,utter,ETIENNE,We have a film. MAMA JEANNE
desc114.683,desc,,One of Georges' films *** ?
utter114.684,utter,ETIENNE,MAMA JEANNE
desc114.685,desc,,But that's not possible *** They're all gone... .
utter114.686,utter,ETIENNE,We found one *** Forgotten in the
scene115,slugline,,basement of the Film Academy
desc115.687,desc,,Hugo and Isabelle implore Mama Jeanne:
utter115.688,utter,HUGO,"Oh, please ***"
utter115.689,utter,ISABELLE,"Please, Mama Jeanne ***"
desc115.690,desc,,"Mama Jeanne glances quickly to.the closed bedroom door. Be quick with it. Etienne and Rene Tabard open the wooden box. It contains a portable movie projector. They set it up, plug it in, and thread a film, as:"
utter115.691,utter,ISABELLE,An actress! A cinema actress! It's
desc115.692,desc,,so romantic!
utter115.693,utter,MAMA JEANNE,(smiles) It wasn't like that. We weren't movie stars like they have now .*. But we did have fun. (MORE)
utter115.694,utter,MAMA JEANNE (CONT'D},"(a certain twinkle in her eye) . The studio where we made the movies was like a giant greenhouse, a building all made of glass. When the sun shone through the glass, it was like a palace in a fairy story ***"
desc115.695,desc,,Hugo and Isabelle are entranced. Etienne and Tabard have finished. The projector is ready to go. Facing a blank wall.
utter115.696,utter,ETIENNE,Madame Melies? She nods.
desc115.697,desc,,Etienne turns on the projector. Flickering white light.
scene116,slugline,,i
desc116.698,desc,,"We see selections from the fantastical Georges Melies film, giving us a sense of this delightful movie. For Mama Jeanne the emotion is overwhelming. Like seeing the past come to life'. Her eyes fill with tears. The wizard-like Astronomers argue in the great hall. The rocket is constructed in a busy workshop. The huge cannon is tested. Then it is time for the rocket to be launched. Pretty girls line up and usher the five voyagers into the rocket, During this sequence one particular girl is featured. She is in the foreground. Tall and lovely."
utter116.699,utter,ISABELLE,Mama Jeanne *** it's you!
desc116.700,desc,,"The great cannon is fired, Then the famous sequence. We zoom toward the moon. The face of the man in the moon appears. The rocket hits him in the right eye! He reacts. The rocket*lands on the moon. Once we reach the moon, the movie is in color. Lovely and diffused. Pale pastels. HUGO It's color! MAMA JEANNE We tinted the film *** Painted it by hand. The voyagers move around the lunar surface. The earth rises over the horizon. The voyagers sleep. Fantasy images of comets shooting past, stars, planets, constellations. Then it snows and the voyagers go into a crater. Inside the moon, a weird landscape. Bizarre Moon Creatures appear. The voyagers battle them. The Moon Creatures disappear magically in puffs of smoke. They are chased across the surface of the moon. The voyagers escape into the rocket. It is pulled off the"
scene117,slugline,,edge of the moon.
desc117.701,desc,,The rocket soars back to earth. It splashes into the ocean and goes underwater. An enchanting bottom-of-the-sea setting. The rocket is finally towed back to shore. The movie ends. The film tail flips around. The white light flickers * .A beat. Mama Jeanne is drying her eyes. Isabelle takes her hand.
utter117.702,utter,ISABELLE,You were so beautiful.
desc117.703,desc,,"A voice, from behind them:"
utter117.704,utter,"GEORGES (O.S,)",She is.
desc117.705,desc,,They turn. Georges is standing in the doorway. He has seen it all.
utter117.706,utter,GEORGES,I would recognize the sound of a movie projector anywhere.
desc117.707,desc,,"Mama Jeanne goes to him and holds him closely. She helps him to sit. He is emotionally drained. Fragile. He finally looks up at Hugo, anger growing in his eyes."
utter117.708,utter,GEORGES,This is your doing.
utter117.709,utter,HUGO GEORGES,Why would you do this to me?
utter117.710,utter,HUGO,I didn't mean to-GEORGES Why do you want to hurt me?!
utter117.711,utter,ISABELLE,He was only trying to help--!
utter117.712,utter,ETIENNE Monsieur-GEORGES,"All of you, get out of here! I want no part of this madness! (snaps at Hugo) And you -- once and for all leave me in peace! I never want to see your face again!"
utter117.713,utter,MAMA JEANNE,Stop it!
desc117.714,desc,,"Her sharp, firm words silence everyone. she looks at Georges deeply."
utter117.715,utter,MAMA JEANNE,"Georges *** You've tried to forget the past for so long, and that's brought you nothing but unhappiness *.* Maybe it's time to remember.*"
desc117.716,desc,,She takes his hands in hers.
utter117.717,utter,MAMA JEANNE,I remember the man I fell in love with *** The man I chose to spend ll\Y life with *** He's still there. I don't want to lose him forever. A long moment between them.
desc117.718,desc,,"Georges kisses her hands. He turns, studies Hugo."
utter117.719,utter,GEORGES,You want to know?
utter117.720,utter,HUGO,Yes.
desc117.721,desc,,beat.
utter117.722,utter,GEORGES,I loved to fix
desc117.723,desc,,The color drains from the scene as Georges remembers *.*
scene118,slugline,,". INT, FLASHBACK -- MAGIC THEATRE - NIGHT"
desc118.724,desc,,"Like Hugo's flashback earlier, Georges' story has the quality of a SILENT FILM. Luminous black-and-white. Simple images. Flickering gaslight. We see YOUNG GEORGES, 20's, on stage, He is a Magician. YOUNG JEANNE is his assistant. They do a magic trick."
utter118.725,utter,"GEORGES (V, 0.)","I started out as a professional magician, and Mama Jeanne was my assistant. We were very successful, I must say. We even had our own theatre ***"
scene119,slugline,,INT. FLASHBACK -- THEATRE/BACKSTAGE - NIGHT
desc119.726,desc,,Young Georges is tinkering with something mechanical we don't see.
utter119.727,utter,GEORGES (V .o.),But I was always tinkering with machines. Couldn't help myself. I had my own workshop at the theatre where I could invent new illusions *** Once I even built a working
desc119.728,desc,,We now see that Young Georges has been working on the
scene120,slugline,,EXT. FLASHBACK -- CIRCUS GROUNDS - NIGHT
desc120.729,desc,,Young Georges and Young Jeanne enjoy a night at a traveling circus. They move past sideshow tents.
utter120.730,utter,GEORGES (V.O.),"Then one night, Mama Jeanne and I went to visit a traveling circus. We were walking past the sideshow tents when I noticed something ***"
scene121,slugline,,Something strange and wonderful ***
desc121.731,desc,,"In the distance, Young Georges sees bright light flickering magically from one of the sideshow tents. The light draws him like a moth to a flame ***"
scene122,slugline,,INT. FLASHBACK -- SIDESHOW TENT - NIGHT
desc122.732,desc,,Young Georges and Young Jeanne are in the sideshow tent. Watching a very early movie. Both are transported.
utter122.733,utter,GEORGES (V .O.),The Lumiere brothers had invented the movies. I immediately fell in love with their invention. I had to be a part of it. It was like a new kind of magic ***
scene123,slugline,,INT. FLASHBACK -- THEATRE/BACKSTAGE - DAY
desc123.734,desc,,Young Georges uses spare pieces from the Automaton to make a movie camera. It is a beautiful and elaborate creation.
utter123.735,utter,"GEORGES (V.O,)","I asked the Lumiere brothers* to sell me a camera, but they refused. You see they were convinced the movies were only a gimmick, a passing fad, and didn't want me to waste my money! *** So I built my own camera using leftover pieces"
scene124,slugline,,EXT. FLASHBACK -- STUDIO - DAY
desc124.736,desc,,"In the country, outside Paris. Young Georges and Young Jeanne pose proudly in front of their new stup.io as a photographer exposes a picture. The studio is an absolutely astounding sight. A great greenhouse-like collection of glass rooms. A soaring castle of glass."
utter124.737,utter,"GEORGES (V.O,)",We risked everything *** We sold the theatre and everything he had so we could build our* own movie studio *** It was like an enchanted
scene125,slugline,,"castle, a palace made of glass *** INT. FLASHBACK -- STUDIO - DAY"
desc125.738,desc,,"A whirlwind! Filming one of Georges' movies. A chaos of wildly dressed performers, fantastic sets, explosive special effects, technicians, filmmakers. In the background we see flats and set pieces from other Melies movies: moons, suns, dragons, great fish, castles. Young Georges is everywhere at once. Racing from the camera to the set and back again. Acting. Directing. Young Jeanne tries to keep order."
utter125.739,utter,GEORGES (V.O.),"And so the great adventure began! I wrote, designed, directed and acted in hundreds of movies. Magic tricks and illusion became my specialty; the world of imagination *** My beautiful wife was my muse, my star, and we couldn't have been happier ***"
desc125.740,desc,,An el.aborate pyrotechnic effect on the set. Flame and smoke. Everyone enjoys it.
utter125.741,utter,GEORGES (V.O.),"Whenever we had visitors I would say, ""If you ever wondered where your dreams come from, just look around. This is where they are made."" We thought it would never end. How could it?"
desc125.742,desc,,SUDDENLY-More pyrotechnics but different now -- the EXPLOSION OF BOMBS -- flashes of light -- trenches and barbed wire -- the horribl.e rattle of machine guns -- iconic images of the First World War-Taking us to **.
scene126,slugline,,EXT. FLASHBACK -- STREET - DAY
desc126.743,desc,,"Rain. Sodden fl.ags. Georges, older now, watches a line of French soldiers march off to war. Like tragic toy soldiers."
utter126.744,utter,GEORGES (V .o.),"But then the war came, and youth and hope were at an end *** The worl.d had no time for magic tricks and movie shows ***"
scene127,slugline,,INT. FLASHBACK -- MOVIE THEATRE - DAY
desc127.745,desc,,Georges stands at the rear of a theatre. one of his fanciful movies is playing. Many veteran soldiers are in the audience. Smoking. Making out with girlfriends. Bored.
utter127.746,utter,GEORGES (V.O.),"The returning soldiers, having seen so much of reality, were bored by my films *** Tastes had changed, but I had not changed with them ***"
scene128,slugline,,INT./EXT. FLASHBACK STUDIO - DAY/NIGHT TIME LAPSE *** the beautiful greenhouse studio building
desc128.747,desc,,decays *** the windows crack and break *.* weeds spring up *** the gorgeous set pieces rot *.. the roof falls *.. rain splashes in *** the studio is boarded up and abandoned .**
utter128.748,utter,GEORGES (V.O.),No one wanted my movies anymore. Eventually I couldn't pay the actors or keep the business running. My investments came to nothing *** And so my enchanted castle fell to ruin ** Everything was lost ***
scene129,slugline,,EXT. FLASHBACK STUDIO - NIGHT
desc129.749,desc,,"Georges stands in the ruins of his studio. A great bonfire is roaring. We see a huge painted version of the famous moon face from A TRIP TO THE MOON burning. Georges, in anguish, is tossing costumes into the pyre."
utter129.750,utter,"GEORGES (V,O.)","One night, in bitter despair, I burned all my old sets and costumes *** I was forced to sell my movies to a company that melted them down"
desc129.751,desc,,into chemicals used to make shoe
scene130,slugline,,heels ***
desc130.752,desc,,"A sudden flare from the bonfire-Transforms to-A reel of old movie film -- bursting into flames, blazing -then melting-The liquid is poured into a mold -- a shoe heel emerges from the mold -- it is nailed onto a shoe-The shoe walks past ***"
scene131,slugline,,INT. FLASHBACK - TRAIN STATION -- TOY BOOTH - DAY
desc131.753,desc,,"Georges is in the Toy Booth. It looks much the same, only newer. It is like a prison."
utter131.754,utter,GEORGES (V.O.),With the little money I made from selling my films I bought the toy booth .*. And there I have remained *.* And there I have endured.
desc131.755,desc,,Georges sits at the counter. He stares out. Lost. Dead. The color gradually returns *** And Georges' face ages to now **. we return to *.*
scene132,slugline,,INT. APARTMENT - NIGHT
desc132.756,desc,,*** Georges's face. He concludes the story:
utter132.757,utter,GEORGES,The only thing I couldn't bring myself to destroy was the Automaton. I gave it to a museum. But they never put it on display *** And now the museum itself has burned *** It's all gone now.
desc132.758,desc,,Hugo and Isabelle exchange a glance.
utter132.759,utter,GEORGES,"Is that the story you want to hear, Hugo? *** I'm sorry I couldn't give you a happy ending. I think you deserve one."
utter132.760,utter,HUGO,The story's not over yet.
desc132.761,desc,,He stands. Excited.
utter132.762,utter,HUGO,I'll be right back!
desc132.763,desc,,He shares a secret smile with Isabelle and then runs out. Georges is mystified.
scene133,slugline,,"EXT, STREETS - NIGHT"
desc133.764,desc,,Hugo races through the streets.
scene134,slugline,,INT. TRAIN STATION -- GRAND HALL - NIGHT
desc134.765,desc,,"Meanwhile, the train station is bustling. Monsieur Frick is walking through the Grand Hall. He carries a large picnic basket and has a rather crafty expression. He approaches Madame Emilie's cafe. Madame Emilie is pleased to see him. Her dachshund is not. It begins to growl menacingly. This time, however, Monsieur Frick is not deterred. He approaches bravely. The dachshund growls more. About to attack. Then .** Monsieur Frick reaches into the picnic basket *.* And removes *** Another little dachshund. with a pink ribbon around its neck. Madame Emilie's dachshund is instantly smitten. The two dogs nuzzle affectionately."
scene135,slugline,,i
desc135.766,desc,,"Monsieur Frick, the conquering hero, steps forward boldly, takes Madame Emilie's hand and kisses it. She blushes. Just then, Hugo appears. He is moving quickly toward one of the air vents just past"
scene136,slugline,,the cafe.
desc136.767,desc,,"But he ducks to the side when the Station Inspector approaches the cafe. Hugo, hidden nearby, overhears:"
utter136.768,utter,STATION INSPECTOR,There bas been *** a disturbing
desc136.769,desc,,development.
utter136.770,utter,MONSIEUR FRICK,What is it?
utter136.771,utter,STATION INSPECTOR,"The man who winds the clocks, Monsieur Claude, has been found dead."
desc136.772,desc,,"Madame Emilie gasps. Hugo stiffens, listens intently."
utter136.773,utter,STATION INSPECTOR,They found his body in the seine. He's been down *there for months it seems.
utter136.774,utter,MADAME EMILIE,"Oh dear, oh dear."
desc136.775,desc,,"Meanwhile, the two dachshunds are sniffing around. They wander over to where Hugo is hiding. He tries desperately to shoo them away."
utter136.776,utter,STATION INSPECTOR,I can't say I'm surprised he ended up falling into the river. He was an awful old drunkard. Time and again I had to warn him about it. These are the wages of sin.
utter136.777,utter,MONSIEUR FRIC:K,"But if Monsieur Claude has been dead for months ** ,"
utter136.778,utter,STATION INSPECTOR,Yes .** ?
