segment-id,segment-type,segment-speaker,segment-text
desc0.0,desc,,Based on the novel by
scene1,slugline,,INT. TRAIN STATION -- GRAND HALL - DAY
desc1.1,desc,,"From far above it looks like a great clockwork. We are looking down on the Grand Hall of the Paris Train Station. It is crowded. People bustle back and forth. Like the gears and wheels of a clock. A precise, beautiful machine. We float down ***"
scene2,slugline,,Under the great iron girders ***
desc2.2,desc,,Moving through the station ***
scene3,slugline,,Past kiosks and shops ***
desc3.3,desc,,Weaving among commuters *** We stop at a clock set into the station wall. Behind the ironwork dial we see a face peering out. HUGO CABRET looks at us. He is a serious-looking boy of around 12. Long hair. It is 1931.
scene4,slugline,,"INT, TRAIN STATION -- TUNNELS - DAY"
desc4.4,desc,,"Hugo turns away from the dial and moves through the tunnels behind the clock. A serpentine maze of passageways. Behind the walls. Hugo's secret worid. He moves quickly up and down spiral staircases *** ducking through tiny openings *** swerving in and out of dark passages *** up and down, back and forth *** Like an elaborate game of Chutes and Ladders. He finally stops. Peers through another clock dial into a different part of the station. He sees ....."
scene5,slugline,,A TOY BOOTH.
desc5.5,desc,,"Bedraggled and struggling. A counter filled with windup toys, dolls and little games. GEORGES, a grim old man with a white goatee, sits at the counter of the booth. Hugo watches. ISABELLE appears from inside the booth and talks to the old man. She has a book under her arm. She is a lively, imaginative girl about Hugo's age. She has a charming Louise Brooks haircut. Isabelle argues a bit with Georges. He snaps at her. Upset, she hurries off. Hugo watches her go. Then he turns his gaze to the toys on the counter. He sees the old man aimlessly wind a TOY MOUSE. It skitters across the counter. The old man crosses his arms. falls asleep. Hugo stares at the toy mouse. Then he moves. He skitters through a series of passages and opens an air vent. He carefully climbs out, into the station .**"
scene6,slugline,,INT. TRAIN STATION -- TOY BOOTH - DAY
desc6.6,desc,,Hugo creeps to the Toy Booth. The toy mouse is there on the counter. Georges still appears to be asleep. Hugo stops. Waits. Looks around. Carefully reaches for the toy mouse-But--
scene7,slugline,,3.
desc7.7,desc,,Georges' eyes snap open--! He grabs Hugo--! Hugo drops the toy mouse-It falls and breaks-Hugo struggles. Georges holds him firm.
desc7.8,desc,,"Got you at last, my little thief. Quick, empty your pockets!"
utter7.9,utter,HUGO,You're hurting me!
utter7.10,utter,GEORGES,Empty your pockets or I'll call the Station Inspector! Do as I sayl
desc7.11,desc,,The threat of the Station Inspector terrifies Hugo. He quickly empties his pockets. Dozens of objects. Screws. Nails. Bits of metal and glass. Tiny pieces of clockworks. Cogs and wheels.
utter7.12,utter,GEORGES,And the other one.
utter7.13,utter,HUGO,There's nothing in it!
utter7.14,utter,GEORGES,Then turn it inside out. Or should I get the Inspector? (Starts to call) Where's the Station Inspector?!
desc7.15,desc,,Hugo empties his last pocket. Reluctantly giving up a precious object:
scene8,slugline,,An old cardboard NOTEBOOK.
desc8.16,desc,,"Georges flips through it quickly-He sees words, pictures, engineering diagrams, schematics, clockwork drawings-Then he suddenly stops flipping-shocked-It is like he has seen a ghost-- He stares at a page of the notebook-A drawing of a mechanical man with clockwork innards. An elegant and complex mechanism. But it is the face of the mechanical man that transfixes. Strangely passive and yet expressing a sort of sadness. Or wisdom. It is a haunting face. Georges thumbs through a few pages of the notebook. It is like an old FLIPBOOK. The mechanical man's face changes perspective as the pages flip past. Like primitive animation. Georges stops. Slowly closes the notebook."
utter8.17,utter,GEORGES,(whispers) Ghosts ***
desc8.18,desc,,He turns to Hugo. Sadness turning to rage.
utter8.19,utter,GEORGES,Did you draw these pictures?! (no response) DID YOU DRAW THESE PICTURES?!
desc8.20,desc,,Hugo tries to pull away. Georges' grip is iron.
utter8.21,utter,GEORGES,Where did you steal this?!
utter8.22,utter,HUGO,I didn't steal it!
utter8.23,utter,GEORGES,"A thief and a liar, Georges releases Hugo."
utter8.24,utter,GEORGES,Get out of my sight.
utter8.25,utter,HUGO,Give me my notebook!
utter8.26,utter,GEORGES,"It is no longer :lQill: notebook, it is !!!Y notebook and I'll do with it what I want. Maybe I'll just burn it."
utter8.27,utter,HUGO,No!
utter8.28,utter,GEORGES,Then tell me who did the drawings.
desc8.29,desc,,Hugo glares at him. Says nothing. Georges suddenly SLAMS his fist down on the counter. All the toys jump.
utter8.30,utter,GEORGES,"Get out of here, you little thief!"
desc8.31,desc,,Hugo turns and races away.
scene9,slugline,,INT. 'TRAIN STATION -- TUNNELS - DAY fl
desc9.32,desc,,Hugo is back in the tunnels. He weaves through them quickly. Catches his breath. He is fighting tears. He continues on more slowly. Comes to an iron door and enters ***
scene10,slugline,,"INT, TRAIN STATION -- SECRET APARTMENT - DAY"
desc10.33,desc,,"It is like stepping into the heart of a mechanical toy. Wheels and gears hang everywhere. There are rows of jars filled with cogs, screws and bits of toys. Tools. Scavenged furniture. Hugo's home and makeshift workshop. He sits on a battered old trunk for a moment. Disheartened. Dries his eyes. He pulls out a large POCKET WATCH. Looks at it. Takes a deep breath, Time to go to work. He picks up a bucket of heavy tools and goes."
scene11,slugline,,INT. TRAIN STATION -- TUNNELS - DAY
desc11.34,desc,,Huge moves through the tunnels. Stops behind a large clock. He can see the station through the clock face. He checks the time on his pocket watch. Then he uses tools from the bucket to wind the clock's mechanism. Then he continues on. Slithers into a narrow passage ***
scene12,slugline,,INT. TRAIN STATION NARROW PASSAGE - DAY
desc12.35,desc,,Hugo crawls on his belly through the cramped passage and uses tiny tools to wind a very small clock that overlooks an
scene13,slugline,,office ***
desc13.36,desc,,"It is a forbidding office. Small desk. Grey walls. A cell in the corner. The STATION INSPECTOR enters. Hugo freezes. The Station Inspector is a hulking man in a bottle-green coat. He is a frightening figure, Without humor. Without warmth. A creature of ice. Hugo holds his breath. The Station Inspector gets something from his desk and goes. Hugo allows himself a breath. He quickly slithers out."
scene14,slugline,,INT. TRAIN STATION -- TUNNELS - DAY
desc14.37,desc,,"Hugo continues on, Opens a hatch and climbs down a rickety ladder *.*"
scene15,slugline,,INT. TRAIN STATION -- HANGING CLOCK - DAY
desc15.38,desc,,"He climbs down into a large clock that is susoended from the ceiling of the Grand Hall. Clock dials and intricate works surround him on all four sides. While he winds all four clockworks, he looks out into the"
scene16,slugline,,station ***
desc16.39,desc,,"MADAME EMILIE is a shy older woman who runs a small cafe. She has a little dachshund. MONSIEUR FRICK is a shy older gentleman who runs a newspaper kiosk across from the cafe. * Hugo watches them aa he works. Monsieur Frick summons up his nerve. Timidly approaches her. Bows rather formally. She ia delighted. He tries to pet the dachshund. The dog snaps at him. Madame Emilie is mortified. Monsieur Frick retreats. Hugo climbs up, out of the clock ***"
scene17,slugline,,INT. TRAIN STATION -- TUNNELS - DAY
desc17.40,desc,,Hugo continues on. Climbs a ladder to wind a clock that overlooks a platform *.*
scene18,slugline,,INT. TRAIN STATION PLATFORM CLOCK - DAY
desc18.41,desc,,"Hugo moves along a narrow passage above a station platform. He must kneel to wind this clock, which is at his foot level. Through the clock he sees *** MONSIEUR ROULEAU is a flamboyant young artist. He is painting at an easel. He is a Surrealist. His painting is wildly abstract. Some SUBURBAN COMMUTERS stop to look. They ridicule the painting. Monsieur Rouleau tries to ignore them. Hugo feels bad for him. Hugo completes winding the clock and goes ***"
scene19,slugline,,INT. TRAIN STATION -- TOWER STAIRS - DAY
desc19.42,desc,,Hugo climbs and climbs and climbs. His bucket of tools is heavy. An endless staircase inside a high tower.
scene20,slugline,,INT. TRAIN STATION -- CLOCK TOWER - DAY
desc20.43,desc,,"Hugo emerges at the very top of the station. An enormous clock. The motors and gears of the mechanism are huge, bigger than he is. Hugo puts a crank into the works and uses all his strength to turn it. It is like something out of METROPOLIS. And beyond the clock *.* Paris. A panoramic view. Somewhat unreal. Like an exquisite toy model. Exhausted, Hugo finally completes winding the clock. He takes a moment to look over the majestic city. And we fade to ***"
scene21,slugline,,INT. TRAIN STATION -- TOY BOOTH - EVENING
desc21.44,desc,,"The Grand Hall is almost empty. Georges, in his hat and coat, is closing up the shop. Pulling down a heavy grate. Hugo stands silently behind him,"
utter21.45,utter,GEORGES,"(not turning) I know you're there ** , What's your name, boy?"
utter21.46,utter,HUGO Hugo Hugo Cabret.,"GEORGES Stay away from me, Hugo Cabret, or I'll drag you to the Station Inspector's office and he'll lock you up in his little cell and you'll never get out and you'll never go to school and you'll never get married and have children of your own to take things that don't belong to them."
desc21.47,desc,,Georges completes locking the gate and goes. Hugo follows. They walk through the echoing station.
utter21.48,utter,HUGO,Give me back my notebook.
utter21.49,utter,GEORGES,I am going home to burn your notebook.
desc21.50,desc,,"Georges sweeps through the doors, leaving the station. Hugo stops at the doors, hesitates for a moment. He is extremely uncomfortable at the idea of leaving the station. It has become his whole world. Everything beyond is threatening. But his need now is great. He steels himself, takes a breath and pushes through the doors, following Georges."
scene22,slugline,,EXT. STREETS - EVENING
desc22.51,desc,,"Georges walks through the dark streets of Paris. Hugo follows. It is the spirit of the great city we see, not the real thing. Shapes and silhouettes of buildings. Architectural details. Sounds. Illusion. Like a lovingly crafted 1930's movie set."
utter22.52,utter,HUGO,You can't burn my notebook.
utter22.53,utter,GEORGES,And who's to stop me?
desc22.54,desc,,"Hugo wasn't prepared for leaving the station. It's cold. He has no winter coat. He pulls his clothes tightly around him. Georges walks on. Hugo follows. A little closer. Georges walks under a street lamp. Hugo follows. A little closer still. Later *** Georges walks over a bridge. Hugo follows. A little closer still. Later *** Georges moves through a sinister alley. Hugo, scared, is walking right next to him now. Georges ignores him. Snow begins to fall."
scene23,slugline,,EXT. GRAVEYARD - NIGHT
desc23.55,desc,,Georges and Hugo walk through a graveyard.
scene24,slugline,,i
desc24.56,desc,,Twisted trees. The shape of tombstones. Like Lean's GREAT EXPECTATIONS. snow continues to fall.
scene25,slugline,,EXT. APARTMENT BUILDING - NIGHT
desc25.57,desc,,"Georges walks to a decrepit apartment building. Right across from the graveyard. Shabby part of town. The old man stops and unlocks the chipped front door with a large key. Hugo waits. Georges enters the building and, without a glance, slams the door shut behind him. Hugo stands there. Snow falls. Hugo steps back, studies the building. He sees Georges enter an upper floor apartment. Sees a handsome older woman -- his wife -- greet him. They disappear from view. Huge scans the other windows. He sees Isabelle, the girl from the Toy Booth, in another room of the apartment. She is reading by the window. Hugo watches her. Snow collects on his head. He finally tosses a pebble up at the window. Isabelle looks down. Sees him. She stares at him quizzically. He motions for her to come down. She is intrigued. He motions. Begs. Please. Isabelle smiles. She loves nothing more than an adventure. She disappears from the window."
scene26,slugline,,EXT. GRAVEYARD - NIGHT
desc26.58,desc,,Hugo stands shivering. Isabelle runs to him.
utter26.59,utter,ISABELLE,Who are you?
utter26.60,utter,HUGO,Your grandfather stole my notebook. I need to get it back before he
desc26.61,desc,,burns it.
utter26.62,utter,ISABELLE,"Papa Georges isn't my grandfather and he isn't a thief! He told me all about you, young gentleman. You're nothing but a *** a reprobate!"
desc26.63,desc,,She is delighted with the word. He doesn't understand.
utter26.64,utter,HUGO,Can you help me get inside?
utter26.65,utter,ISABELLE,No. You have to go.
utter26.66,utter,HUGO Not without my notebook-ISABELLE,Why do you need it so badly?
utter26.67,utter,HUGO,(hesitates) I can't tell you.
utter26.68,utter,ISABELLE,Is it a secret?!
utter26.69,utter,HUGO,Yes.
utter26.70,utter,ISABELLE,Good! I love secrets! Tell me this instant!
utter26.71,utter,HUGO ISABELLE,If you won't tell me you have to go.
utter26.72,utter,HUGO Not without-ISABELLE,I'll get in trouble. Just go home!
desc26.73,desc,,He won't budge.
utter26.74,utter,ISABELLE,All right! I'll make sure he doesn't burn your notebook.
desc26.75,desc,,He looks at her.
utter26.76,utter,ISABELLE,Trust me.
desc26.77,desc,,He looks at her. He nods. He runs off. She watches him go. What a strange boy. She smiles.
scene27,slugline,,INT. TRAIN STATION -- SECRET APARTMENT - NIGHT
desc27.78,desc,,"Hugo enters. Still cold. He strikes a match. Lights a few candles. A golden glow fills the strange chamber. Hugo takes out his pocket watch and hangs it on a special hook by the bed. Then he moves to a corner *.* There is something covered in an old sheet .** He pulls off the sheet to reveal *** The AUTOMATON. amazing mechanical man. A couple feet tall. Exposed gears and levers. Clockworks and springs. In a state of disrepair. We recognize the strange, haunting face from the drawings in Hugo's notebook. The Automaton sits at a little desk. Pen poised to write something. Hugo stares at the passive face of the Automaton. And remembers."
utter27.79,utter,HUGO (V.O.),What is it **. ?
desc27.80,desc,,HUGO'S FATHER (V.O.)
desc27.81,desc,,The color fades as we go six months back in time *.*
scene28,slugline,,INT. FLASHBACK -- CABRET APARTMENT - NIGHT
desc28.82,desc,,"The memory has the quality of a SILENT FILM. Black-and-white. Simple images. The flickering, glowing luminescence of early movies. Hugo and his FATHER live in a poor, cramped garret, Big skylight. Paris beyond. An enormous full moon beyond that. The Automaton -- now in much worse condition, battered and"
desc28.83,desc,,sits before Hugo and his Father.
utter28.84,utter,HUGO HUGO'S FATHER,I found him abandoned in the attic of the museum.
utter28.85,utter,HUGO,What does he do?
utter28.86,utter,HUGO'S FATHER,"(tinkering with it) He's a windup figure, like a music box **. This is the most complicated one I've ever seen by far. You see? This one can write."
utter28.87,utter,HUGO,(transfixed) Who built him?
utter28.88,utter,HUGO'S FATHER,I would think a magician.
utter28.89,utter,HUGO,A magician!
utter28.90,utter,HUGO'S FATHER,That's right. Magicians used machines like this when I was a boy. No one could figure out how they danced or walked or sang. But the secret was always in the clockwork.
utter28.91,utter,HUGO,can we fix it?!
utter28.92,utter,HUGO'S FATHER,"Oh, I don't know, Hugo, it's awfully rusted and finding the"
desc28.93,desc,,parts would be *** He sees Hugo's disappointment.
utter28.94,utter,HUGO'S FATHER,"Of course we can fix it! We're clock makers, aren't we! *** But only when I've gotten through all my work at the shop and at the museum, you understand?"
desc28.95,desc,,Hugo hugs him. His father smiles. The Automaton seems to watch them.
scene29,slugline,,INT. FLASHBACK -- CLOCK SHOP - DAY
desc29.96,desc,,"Music. Hugo sweeps up as his father works fixing clocks. The small shop is a jumble of clocks, watches, gears, movements, springs, dials."
scene30,slugline,,"INT. FLASHBACK MUSEUM, - EVENING"
desc30.97,desc,,Music. Hugo's father winds and oils clocks in an old museum filled with Victorian curiosities.
scene31,slugline,,INT. FLASHBACK -- CABRET APARTMENT - NIGHT
desc31.98,desc,,"Music. Hugo and his father work on the Automaton together. They huddle at the workbench. Hugo's father patiently teaches him. Hugo learns eagerly. Hugo's father stops to make a note. We realize he is writing in the notebook, the one Georges"
scene32,slugline,,EXT. FLASHBACK -- SCHOOLYARD - DAY
desc32.99,desc,,Music. Hugo tells his friends about the amazing Automaton. Imitating it.
scene33,slugline,,"INT, FLASHBACK -- CABRET APARTMENT - NIGHT"
desc33.100,desc,,Music. The automaton is coming along very well. Hugo's father watches proudly as Hugo works on it alone.
scene34,slugline,,INT. FLASHBACK -- MUSEUM - NIGHT
desc34.101,desc,,Music. Hugo's father is working on a stubborn clock at the museum. Then *** The music stops *** Hugo's father slowly turns .** curious *** He moves to a stairway .** Looks down *** He sees *** A PILLAR OF FLAME. Raging up at him.
scene35,slugline,,INT. FLASHBACK -- CABRET APARTMENT - NIGHT
desc35.102,desc,,It is very late. Hugo is working on the Automaton. The door opens. He turns.
desc35.103,desc,,I fixed the gears in the-But it is not his father. It is his UNCLE CLAUDE. Unshaven. Greasy. crude. Huge. HUGO Uncle Claude *.* ?
utter35.104,utter,UNCLE CLAUDE,"There was a fire. Your,father's dead. Pack your things quickly. You're coming with me."
desc35.105,desc,,Hugo stares.
scene36,slugline,,EXT. FLASHBACK -- STREETS - NIGHT
desc36.106,desc,,"Hugo lugs the heavy Automaton, covered in a sheet, as he follows Uncle Claude through the empty streets. Hugo struggles to keep up with Uncle Claude's huge gait."
utter36.107,utter,UNCLE CLAUDE,You'll be my apprentice. You'll live with me and I'll show you how to take care of the clocks. (Takes a swig from a flask) I'm getting too old to be climbing through them tunnels.
desc36.108,desc,,"They turn a corner, And ahead of them ***"
scene37,slugline,,The Train Station. INT. FLASHBACK -- TRAIN STATION -- APARTMENT - NIGHT
desc37.109,desc,,"Uncle Claude and Hugo enter the secret apartment. It is filthy and rank, Dickensian. Hugo sets down the Automaton. Looks around;"
utter37.110,utter,UNCLE CLAUDE,"They built these apartments for the people who ran the station, years ago. Everyone's forgotten about them. You can sleep in the corner."
desc37.111,desc,,Uncle Claude plops down. Drinks.
utter37.112,utter,UNCLE CLAUDE,Get some sleep. We start work at
utter37.113,utter,HUGO,What about school?
utter37.114,utter,UNCLE CLAUDE,You're finished with school. There won't be time for that once you're in the walls *** You should thank me.
desc37.115,desc,,Uncle Claude clears his throat. Takes a drink. Looks away. Hugo carries the Automaton to his corner._ He sits. Dazed. Absolutely forlorn. Then he pulls the sheet off the Automaton. He looks into the Automaton's face. His only friend. They sit together.
scene38,slugline,,EXT. FLASHBACK -- GRAVEYARD - DAY
desc38.116,desc,,Funeral tableau. Hugo and Uncle Claude at the grave site. Uncle Claude drinks from his flask. Hugo bows his head. Tears beginning to fall. Color gradually returns as we leave the past and return to **.
scene39,slugline,,INT. TRAIN STATION APARTMENT - NIGHT
desc39.117,desc,,"Hugo sits, looking at the Automaton. Hugo is sobbing. We fade to ***"
scene40,slugline,,INT. TRAIN STATION -- GRAND HALL - MORNING
desc40.118,desc,,Hugo peers out from behind an air vent. Waiting. Watching. Madame Emilie is opening her little cafe. Her dachshund hovers protectively. Monsieur Frick approaches cautiously. Bows gallantly and offers her a newspaper from his kiosk. Madame Emilie is charmed. The dachshund attacks this time! It chases Monsieur Frick. Madame Emilie follows in horror. Hugo seizes his opportunity-He scrambles quickly from the air vent-- Races to the cafe-Grabs a croissant and bottle of milk-Runs off-Disappearing into the crowd of morning commuters.
scene41,slugline,,INT. TRAIN STATION GRAND HALL - MORNING
desc41.119,desc,,"Hugo moves through the grown up world, eating the croissant. No one notices him. He sees the imposing station Inspector in his bottle-green coat approaching! Hugo moves next to a woman. Falls into step. Acts like her son. She doesn't notice. The station Inspector passes. Hugo continues on."
scene42,slugline,,INT. TRAIN STATION -- TOY BOOTH - MORNING
desc42.120,desc,,Georges is opening the Toy Booth. Hugo stands silently behind him.
utter42.121,utter,GEORGES,I thought I might see you today.
utter42.122,utter,HUGO,I need my notebook.
utter42.123,utter,GEORGES,Why do you need it so badly?
utter42.124,utter,HUGO,To help me *** fix something. What?
desc42.125,desc,,Hugo doesn't answer. Georges hands Hugo a handkerchief tied up into a bundle. Hugo unties it. Ashes. It is filled with ashes. Burned paper. Hugo looks at the ashes. Horror and disbelief. Tears sting his eyes. He can't breath. The ashes fall *** Cascade and swirl delicately down *** Over Hugo's shoes *** To the floor. Hugo looks up at Georges. He is shocked to see there are tears in ~enrges' eyes as well.
utter42.126,utter,GEORGES,Go away *** Please just go away.
desc42.127,desc,,"Hugo wipes his eyes with his dirty, ashen hands, leaving long black smudges on his face. He backs away. Then he turns and runs off. Tears flowing freely now. He races around a corner and-INT. TRAIN STATION -- GRAND HALL"
scene43,slugline,,- MORNING
desc43.128,desc,,"--Bang! He runs right into Isabelle. She was hiding, waiting for him."
utter43.129,utter,ISABELLE,Hey! Sorry
utter43.130,utter,HUGO ISABELLE,I saw. Are you crying?
utter43.131,utter,HUGO,No!
utter43.132,utter,ISABELLE,Hold still.
desc43.133,desc,,She uses her handkerchief to dry his eyes and clean his face
utter43.134,utter,ISABELLE,There's nothing wrong with crying.
desc43.135,desc,,Sidney Carton cries. And Heathcliff
utter43.136,utter,HUGO,(grabs handkerchief) I can do. it!
utter43.137,utter,ISABELLE,I have to talk to you. It's terribly important. But not here. We're too *** exposeg.
desc43.138,desc,,She dramatically grabs his hand and pulls him off.
scene44,slugline,,INT; TRAIN STATION -- GRAND HALL - MORNING
desc44.139,desc,,Hugo continues to clean his face as they move through a different part of the station. She is carrying a book. HUGO Where are we going?
utter44.140,utter,ISABELLE,Only to the most wonderful place on earth! Neverland and oz and Treasure Island all wrapped up into
desc44.141,desc,,They are approaching Monsieur Rouleau. He is at work on his Surrealist painting.
utter44.142,utter,ISABELLE,"Good morning, Monsieur Rouleau."
utter44.143,utter,MONSIEUR ROULEAU,Morning.
desc44.144,desc,,She stops and looks at the abstract painting.
utter44.145,utter,ISABELLE,"Oh, it's coming along marvelously!"
utter44.146,utter,HUGO,What is it?
utter44.147,utter,MONSIEUR ROULEAU,It's the station *** How I see it anyway *** Do you like it?
desc44.148,desc,,Hugo looks at the painting. Takes it seriously. Isabelle appreciates this.
utter44.149,utter,HUGO,"You know, I think I do *** Yes, I like it very much."
desc44.150,desc,,Monsieur Rouleau is pleased.
utter44.151,utter,ISABELLE,"We have to go *** Well done, Monsieur Rouleau!"
desc44.152,desc,,Hugo and Isabelle go.
utter44.153,utter,IS.!>.BELLE,He's a Surrealist.
utter44.154,utter,HUGO ISABELLE,That's a kind of painter'. HUGO
desc44.155,desc,,I know what a Surrealist is. I'm not an idiot.
utter44.156,utter,ISABELLE,"Ah, here we are! Ahead of them ***"
scene45,slugline,,Her secret realm *** Wonderland and Oz and Treasure Island
desc45.157,desc,,all wrapped up into one *** A used bookstore. They enter.
scene46,slugline,,INT. TRAIN STATION BOOKSTORE - MORNING
desc46.158,desc,,"A little bell jangles when they enter. MONSIEUR LABISSE, the shop owner, peers from over a stack of dusty books. He is a slight, sad sort of man. He brightens when he sees Isabelle. But he is extremely suspicious of Hugo."
utter46.159,utter,ISABELLE,"Good morning, Monsieur Labisse, may"
desc46.160,desc,,"I present Monsieur Hugo Cabret, a"
utter46.161,utter,MONSIEUR Ll\BISSE,(bows) Monsieur Cabret. HUGO
utter46.162,utter,ISABELLE,(handing him book) Thank you for this. I think I'm halfway in love with David . Copperfield *** Photography?
utter46.163,utter,MONSIEUR LABISSE,(points)
desc46.164,desc,,"Back corner left, top shelf."
utter46.165,utter,ISABELLE,Thank you.
desc46.166,desc,,Monsieur Labisse watches them go. Hugo's dirty clothes and long hair convince him he must be a shoplifter -- or worse. Isabelle leads Hugo deeper into the store.
scene47,slugline,,fl
desc47.167,desc,,It is a world of books. stacked in every direction. To the ceiling. Rivers of books. Mountains of books. Gloriously cluttered.
desc47.168,desc,,"Listen, what's so important?"
utter47.169,utter,ISABELLE,"Papa Georges ,still has your notebook. He didn't burn it. That was all a trick."
utter47.170,utter,HUGO,Why?
desc47.171,desc,,She climbs a ladder in search of a book:
desc47.172,desc,,I don't know. The notebook made him
desc47.173,desc,,think he was crying. Hugo thinks about this. How strange.
utter47.174,utter,HUGO,It's a mystery.
utter47.175,utter,ISABELLE,I know!
utter47.176,utter,HUGO,Why are you helping me?
utter47.177,utter,ISABELLE,"Because this might be an adventure! I've never had one, outside of books."
desc47.178,desc,,She grabs a book. Comes back down the ladder.
utter47.179,utter,ISABELLE,I think we should be very ***
desc47.180,desc,,clandestine.
utter47.181,utter,HUGO ISABELLE,"By the way, my name's Isabelle. HUGO"
desc47.182,desc,,Hello.
