segment-id,segment-type,segment-speaker,segment-text
utter47.183,utter,ISABELLE,Do you want a book? Monsieur Labisse lets me borrow them. I could get one for you. No.
utter47.184,utter,HUGO ISABELLE,(horrified) Don't you like books?!
utter47.185,utter,HUGO,"No, I do .** My father and~ used to read Jules Verne together *.*"
desc47.186,desc,,He stops. She senses his strong emotion. Respects it. They move to Monsieur Labisse at the front counter.
utter47.187,utter,ISABELLE,(re: book) May I?
utter47.188,utter,MONSIEUR LABISSE,"Of course. Good day, Isabelle."
desc47.189,desc,,Monsieur Labisse watches Hugo with suspicion as they leave the shop.
scene48,slugline,,INT. TRAIN STATION -- GRAND HALL - MORNING
desc48.190,desc,,They move through the bustling station.
desc48.191,desc,,How do I get my notebook back?
utter48.192,utter,ISABELLE,I think you should stand up to him. He'll respect that.
utter48.193,utter,HUGO,All right.
utter48.194,utter,ISABELLE,Don't tell him we talked. I'll help you if I can *.* Be steadfast!
desc48.195,desc,,She disappears into the crowd. He watches her go. Be steadfast? What a peculiar girl.
scene49,slugline,,INT. TRAIN STATION TOY BOOTH - DAY
desc49.196,desc,,Georges is sitting at the counter. Evenly staring at something. He aimlessly cuts and re-cuts a deck of cards with one hand as he stares. Hugo stands there on the other side of the counter. Staring back at him. Steadfast. It is like a showdown. Finally:
utter49.197,utter,HUGO,I don't believe you burned my notebook.
utter49.198,utter,GEORGES,"You don't? *.* Well, maybe I did and maybe I didn't. You'll never know, will you?"
desc49.199,desc,,Hugo holds his ground.
utter49.200,utter,GEORGES,Shall I call the Station Inspector?
desc49.201,desc,,Hugo holds his ground.
utter49.202,utter,GEORGES,Go *** away.
desc49.203,desc,,"Hugo holds his ground. Georges glares at him. Hugo glares back. A long beat. Gunfighters. Neither blinks. Georges slowly reaches under the counter *.* He pulls something out *** Something covered in a handkerchief *** He sets it on the counter *** With the panache of a magician, he pulls off the handkerchief to reveal *** The toy mouse that Hugo broke earlier. Fix it."
desc49.204,desc,,Hugo looks at him.
utter49.205,utter,GEORGES,"I said, fix it."
utter49.206,utter,HUGO,I need my tools.
desc49.207,desc,,"Georges pulls out a canister of tiny screwdrivers, pliers, files and hammers."
utter49.208,utter,GEORGES,I know you've been stealing parts from the shop *** Might as we11*use my tools.
desc49.209,desc,,Hugo looks at the broken toy mouse. Then at Georges.
desc49.210,desc,,"If I fix it, do I get my notebook?"
utter49.211,utter,GEORGES,We'll see.
desc49.212,desc,,A challenge. Hugo starts to work. He uses the tiny tools
desc49.213,desc,,Georges watches. Hugo fixes the spring *** fits the key *** hammers the
desc49.214,desc,,"Finally he sets the toy mouse down on the counter. Georges looks at it. He winds it. The toy mouse skitters playfully across the counter. Georges is impressed, tries not to show it."
utter49.215,utter,HUGO,Give me my notebook.
utter49.216,utter,GEORGES,You've got a bit of talent. But you'll have to prove there's more to you than being a thief *.* You can earn your notebook. How?
utter49.217,utter,HUGO GEORGES,"Come to the booth everyday. I'll decide how long you must work for each item you stole, and it will be up to me to decide when you have earned your notebook, if ever."
desc49.218,desc,,I already have a job *.
utter49.219,utter,GEORGES,"Thief is not a job, boy."
utter49.220,utter,HUGO,"I have another job, but I'll come when I can."
utter49.221,utter,GEORGES,You begin tomorrow. Go away.
utter49.222,utter,HUGO,I'll begin now.
desc49.223,desc,,"Hugo bravely goes into the booth and gets a broom. Starts sweeping up. Georges watches him. Across the station, a little DANCE BAND is starting up at Madame Emilie's cafe. A few couples dance."
scene50,slugline,,An afternoon tea dance.
desc50.224,desc,,"A lovely, bygone image. couples dancing under the massive iron ribs of the great train station. The music echoes throughout the Grand Hall. The music from the band takes us to ***"
scene51,slugline,,INT./EXT. - MONTAGE - DAY/NIGHT Dance band music as .**
desc51.225,desc,,"*** Hugo moves through the tunnels. Winds a clock * *** Hugo works at the Toy Booth. Across the booth, Georges does a card trick. Hugo watches the trick closely. Georges notices * *** Isabelle and Hugo walk through the bookstore, chatting. Monsieur Labisse watches Hugo with suspicion * *** Hugo ducks around a corner, avoiding the Station Inspector. Hugo labors to wind the big clock in the tower. Georges teaches Hugo how to do a card trick. Hugo demonstrates the card trick to the Automaton. * *. Hugo watches from behind a clock face as Georges and"
scene52,slugline,,Isabelle leave the station one night *
desc52.226,desc,,"*.. Hugo stands hidden in the graveyard, watching Georges' family through the windows of their apartment. We pause for a moment at ***"
scene53,slugline,,INT. TRAIN STATION -- SECRET APARTMENT - NIGHT
desc53.227,desc,,"Hugo is with the Automaton. Looking at it sadly. Without the notebook, Hugo isn't sure how to proceed. A beat. Hugo stares at the inner workings of the Automaton *** Then *** Something seems to shift in Hugo's head *** something makes sense *** he filafil!. it now *** gears line up *** a beautiful clarity begins to emerge *** Hugo picks up a screwdriver, begins to tinker. Then to work in earnest. Without the notebook. The Automaton seems pleased. The dance band music continues and we are back to ***"
scene54,slugline,,INT./EXT. - MONTAGE - DAY/NIGHT Dance band music as ***
desc54.228,desc,,"*** Hugo repairs a broken toy in the booth. Isabelle is there, chatting to him * *** Hugo works hard on the Automaton. It is coming along well. Almost fully repaired * *** Hugo climbs down into the hanging clock to wind it * *** Georges watches Hugo demonstrate a card trick to a customer. He hides a smile * **. Hugo steals food. *** Hugo works on the Automaton, making new clothes for its We now see that there is a hole for a HEART-SHAPED KEY in the back * *** Isabelle and Hugo playfully dance to the band at the cafe with other couples * *** Georges watches them dance. Content * *** The band dance ends the song with a flourish. Hugo bows to Isabelle. She laughs. The montage ends."
scene55,slugline,,INT. TRAIN STATION -- GRAND HALL - DAY
desc55.229,desc,,"Hugo is waiting for Isabelle outside the book shop. He sees the Station Inspector approaching, cutting through the crowd. Hugo ducks around a corner and watches nervously. But the Station Inspector has another quarry today. A young STREET KID, around Hugo's age, is loitering near another shop. The Station Inspector stalks him and then sweeps down like a bird of prey. He grabs the street Kid brutally. Shakes him."
utter55.230,utter,STATION INSPECTOR,Where are you parents?! Answer me!
utter55.231,utter,STREET KID,(terrified) Got none.
desc55.232,desc,,"Without another word, the Station Inspector drags him away. Hugo darts into an air vent."
scene56,slugline,,INT. TRAIN STATION -- NARROW PASSAGE - DAY
desc56.233,desc,,"Hugo is in the cramped passage that overlooks the Station Inspector's office, peering through the clock face. The street Kid is in the tiny, awful cell. He is sobbing. The Station Inspector is on the phone:"
utter56.234,utter,STATION INSPECTOR,"(on phone) yes, another one. (MORE)"
scene57,slugline,,STATION INSPECTOR (CONT'D)
scene58,slugline,,INT. TRAIN STATION -- TUNNELS - DAY
desc58.235,desc,,"Hugo watches through a clock face. He.sees the station Inspector dragging the Street Kid through the doors of the station and throwing him into a police truck. The truck roars off. The station Inspector comes back inside. He stands, imperious, looking over his domain. Hugo sinks back and disappears into the darkness of the tunnels."
scene59,slugline,,INT. * TRAIN STATION -- GRAND HALL - DAY
desc59.236,desc,,Isabelle is now waiting for Hugo outside the book shop. He hurries to her.
utter59.237,utter,fl ISABELLE,You're late!
utter59.238,utter,HUGO,Sorry.. I * * * never mind.
desc59.239,desc,,"He goes into the shop quickly, not wanting to be exposed to the dreadful Station Inspector. she follows."
scene60,slugline,,INT. TRAIN STATION -- BOOKSTORE - DAY
desc60.240,desc,,Hugo and Isabelle move through the bookstore.
utter60.241,utter,ISABELLE,*** I'm still looking for your notebook. I have to be very circumspect. She loves the word.
utter60.242,utter,HUGO,You better not look inside.
utter60.243,utter,ISABELLE,If I find it I should be able to look inside.
utter60.244,utter,HUGO,Then don't look for it!
utter60.245,utter,ISABELLE,I'm trying to help. Why are you being so mean?
desc60.246,desc,,To Hugo she suddenly looks very grown up. She is disappointed in him. His heart sinks.
desc60.247,desc,,Promise me you won't open it.
desc60.248,desc,,"The bell on the door jangles. ETIENNE, a young man with sweet face and a patch on his right eye, enters. Etienne!"
utter60.249,utter,ISABELLE ETIENNE,"Hello, Isabelle."
utter60.250,utter,ISABELLE,"Etienne, this is my friend Hugo"
utter60.251,utter,Cabret.,"Hugo is pleased with the ""friend.""'"
utter60.252,utter,Sir. ETIENNE,(shaking hands)
utter60.253,utter,HUGO ISABELLE,Etienne works at the movie theatre near my home. He sneaks me in because Papa Georges won't let me see any movies.
utter60.254,utter,HUGO,Why not?
utter60.255,utter,ISABELLE,I don't know -- it's a mystery!
utter60.256,utter,ETIENNE,I always take pity on people who love the movies. I can't help it.
utter60.257,utter,HUGO,My father always took me to the movies for my birthday.
desc60.258,desc,,Hugo is surprised he suddenly spoke about his father. He does
utter60.259,utter,ETIENNE,Come.by on Saturday and I'll sneak you in. We're having a silent film festival. They're so wonderful. (He disappears deeper into the shop) Like forgotten dreams *** Hugo and Isabelle are alone.
desc60.260,desc,,"The moment settles, They wander through the aisles of books in silence."
utter60.261,utter,ISABELLE,Is your father dead?
utter60.262,utter,HUGO,I don't want to talk about it.
desc60.263,desc,,"A beat. She takes his hand for a quick moment, then releases it. A gesture of support. Friendship."
utter60.264,utter,ISABELLE,I have to go.
desc60.265,desc,,Promise you won't look in the-ISABELLE
desc60.266,desc,,"(she calls to Etienne) Goodbye, Etienne. See you on She goes. Hugo roams for a bit. Looking at the teetering piles of books, Thinking about his father. He wanders deep into the back of the shop. A shaft of light cuts across the store from a skylight. The light illuminates the spine of a* book. The book catches his eye. He goes to it. A PRACTICAL MANUAL OF CARD MAGIC AND ILLUSIONS, Hugo is excited. He loves magic. He pulls the book out and thumbs through it. Like a FLIPBOOK again. Pages flip past magically. Lil:e primitive animation. We see wonderful period illustrations, Magic tricks. Card illusions. Rabbits from hats. Disappearing women. Hugo is transfixed. He must have this book. He looks around. No one is watching. He tucks it into his coat. Is about to walk out. But then he sees sad Monsieur Labisse sitting at the counter. He is Isabelle's friend. Hugo doesn't want to steal from him. He removes the book from his coat. He is walking back to return the book when he pa?ses Etienne. Etienne is reading, perched high on a stool like the Caterpillar from ALICE IN WONDERLAND."
utter60.267,utter,ETIENNE,What do you have there?
desc60.268,desc,,"Hugo shows him,"
utter60.269,utter,ETIENNE,Magic *** Do you know what's under my eye patch? Hrrunmm.
utter60.270,utter,HUGO,(unsure) Your eye?
utter60.271,utter,ETIENNE,"No, I lost my eye when I was a kid playing with fireworks. A Portuguese Rocket flew into it * . HUGO"
desc60.272,desc,,Oh.
utter60.273,utter,ETIENNE,"So, do you want to know what's under my eye patch?"
utter60.274,utter,HUGO,Okay.
desc60.275,desc,,Etienne reaches beneath his eye patch and pulls out a coin. Hands it to Hugo.
utter60.276,utter,ETIENNE,The only magic trick I know. Go buy the book.
desc60.277,desc,,Hugo looks at him. Smiles.
scene61,slugline,,f1
desc61.278,desc,,Hugo goes to buy the book.
scene62,slugline,,INT. TRAIN STATION -- SECRET APARTMENT - NIGHT
desc62.279,desc,,",The magic book is open on a table. Pieces of loose paper with Hugo's notes are scattered around the book: drawings of trick mechanics; sketches of illusions; etc. Across the room, Hugo is at work on the Automaton. It looks finished. Polished, cleaned, beautiful and ready."
desc62.280,desc,,Hugo studies the distinctive heart-shaped keyhole in the back of the figure. He tries a bit of bent metal. It doesn't fit. He adds it to a collection of scavenged items he has tried. Nothing fits. He faces the Automaton.
desc62.281,desc,,Where is it *** ? Where's the key *** ? The Automaton looks at him. Hugo sighs. A beat. He smiles to the Automaton.
desc62.282,desc,,think I have another friend. He goes. The Automaton watches. Seems pleased.
scene63,slugline,,EXT. MOVIE THEATRE - DAY
desc63.283,desc,,"Again, the suggestion of Paris. A movie theatre facade. An Art Deco marquee. A green neon sign. Hugo approaches the theatre. Looks for Isabelle. Doesn't see her. Goes down an alley next to the theatre ***"
scene64,slugline,,"EXT, ALLEY NEXT TO THEATRE - DAY"
desc64.284,desc,,Hugo moves down the alley. He passes. a series of fading movie posters that line the alley *** Chaplin *** Keaton *** Lon Chaney *** Isabelle is waiting by a side door. HUGO Where's Etienne?
utter64.285,utter,ISABELLE,He's not here. The Manager told me. He got fired for sneaking kids in. Isn't that appalling?
desc64.286,desc,,"She turns to the door and begins to pick the lock with a bobby pin. He. watches, amazed."
utter64.287,utter,HUGO,How did you learn to do that?
utter64.288,utter,ISABELLE,Books.
desc64.289,desc,,Click. She opens the door and peeks in. Gives him a nod. They sneak in.
scene65,slugline,,INT. MOVIE THEATRE - DAY
desc65.290,desc,,"The flickering light above. The glowing screen. Iridescent. ' at the back. Hugo and Isabelle sneak into seats The Disney cartoon A CLOCK STORE is playing, Hugo's eyes go wide. The magic of motion pictures. The whimsically animated clocks on the screen remind Hugo of his father's shop and his own secret workshop. Isabelle laughs. He enjoys the sound of her laughter, He laughs as well. The light flickers above them. Time passes *** The famous Harold Lloyd film SAFETY LAST is now playing. Hugo is wrapped up in the movie. Can barely watch. Can barely breathe. Harold Lloyd is climbing dangerously around the outside of the skyscraper. Acrobatic stunts still hair-raising after all these years. He grabs the big clock face. It springs open--!"
scene66,slugline,,3B.
desc66.291,desc,,Hugo grabs Isabelle's arm in horror-Isabelle looks at him. Amused. Harold Lloyd clings to the hands of the clock and then continues to climb around the building. Then *** From the darkness behind Hugo and Isabelle *** Two huge white hands slowly descend *** Like the Frankenstein Monster's mitts **. Grabbing them on the shoulder *** They jump! The THEATRE MANAGER looms over them.
utter66.292,utter,THEATRE MANAGER,How did you two rats get in here?!
scene67,slugline,,EXT. MOVIE THEATRE - DAY
desc67.293,desc,,The Manager dumps them outside.
utter67.294,utter,THEATRE MANAGER,And I better not see you in here again!
desc67.295,desc,,He closes the doors. Hugo and Isabelle laugh and run off.
scene68,slugline,,EXT. BANK OF THE SEINE - DAY
desc68.296,desc,,"It is chilly. Fog. Hugo and Isabelle walk home along the Seine. The silhouette of bridges. The sound of lapping water. The shape of boats moving past. Radio music from a houseboat. Hugo tightrope walks along the edge of the bank, like Harold Lloyd on a ledge from SAFETY LAST."
utter68.297,utter,HUGO,Why doesn't Papa Georges let you go to the movies?
utter68.298,utter,ISABELLE,I don't know. He never said. I bet my parents would have let me. I'm sure they were very artistic.
desc68.299,desc,,What happened to them?
utter68.300,utter,ISABELLE,"They died when I was a baby. Papa Georges and Mama Jeanne are my godparents, so they took me in. They're very nice about most everything, except the movies."
utter68.301,utter,HUGO,My father took me to the movies all the time. We saw Tom Mix and Lon Chaney. But Douglas Fairbanks was my favorite.
desc68.302,desc,,"Hugo sword fights along the bank for a moment. A beat as they walk,"
utter68.303,utter,ISABELLE,What was he like?
desc68.304,desc,,He loved the movies **. Ever since
desc68.305,desc,,room and on a white screen he saw a rocket fly into the eye of the man
desc68.306,desc,,He smiles.
desc68.307,desc,,He said it was like seeing his dreams in the middle of the day. A beat as they walk.
utter68.308,utter,ISABELLE,You miss him a lot *** Does your mother tell you about him? Hugo doesn't answer.
desc68.309,desc,,She understands. A beat as they walk.
utter68.310,utter,ISABELLE,Who looks after you?
utter68.311,utter,HUGO,My uncle was supposed to *** But he started going away a lot. Drinking. * staying out all night *** One day
desc68.312,desc,,he didn't come back.
utter68.313,utter,ISABELLE,So you're all alone?
desc68.314,desc,,Not completely. A beat as they walk. She stops. Hugo
utter68.315,utter,ISABELLE,Where do you live?
desc68.316,desc,,"He stops, Looks at her. Should he tell her? Should he trust her?"
desc68.317,desc,,He points. There.
desc68.318,desc,,She looks *** Across the river ***
scene69,slugline,,The Train Station. INT ** TRAIN STATION -- GRAND HALL - DAY
desc69.319,desc,,Hugo and Isabelle move through the crowd. She is incredulous.
utter69.320,utter,HUGO,My uncle taught me how to run
desc69.321,desc,,the clocks.
utter69.322,utter,HUGO (CONT'D),"So I just keep on doing it Maybe he'll come back one day, but I doubt it."
utter69.323,utter,ISABELLE,"But * , * Aren't you afraid someone will find out?"
utter69.324,utter,HUGO,Not as long as the clocks keep on working and no one sees me.
utter69.325,utter,ISABELLE,What do you do for money?
utter69.326,utter,HUGO,Don't need any.
desc69.327,desc,,A beat as they walk.
utter69.328,utter,ISABELLE,can I see it?
utter69.329,utter,HUGO,What?
utter69.330,utter,ISABELLE,"Where you live! In the walls,"
utter69.331,utter,HUGO,Maybe.
utter69.332,utter,ISABELLE,Maybe?
desc69.333,desc,,"Hugo suddenly sees, *."
scene70,slugline,,The station Inspector ***
desc70.334,desc,,Walking right toward them ***
desc70.335,desc,,Act natural.
utter70.336,utter,ISABELLE,HUGO
desc70.337,desc,,Just keep walking. Act natural.
utter70.338,utter,ISABELLE,(perplexed) How am I acting now?
desc70.339,desc,,"Then she sees the Station Inspector. She understands. They put on an elaborate show of ""acting natural"" as they walk toward the Station Inspector. They pass him. A sigh of relief. The Station Inspector stops. Turns."
utter70.340,utter,STATION INSPECTOR,Hey! You two.
desc70.341,desc,,Hugo and Isabelle freeze.
utter70.342,utter,STATION INSPECTOR,come ..* here.
desc70.343,desc,,"Hugo is about to bolt. Isabelle sees it in his eyes. With a look, she cautions him against it. She will handle this another way. She drags him back to the Station Inspector. Puts on her sweetest face:"
utter70.344,utter,ISABELLE,"Good day, Monsieur!"
utter70.345,utter,STATION INSPECTOR,(icy) Where are your parents?
utter70.346,utter,ISABELLE,"I work with my Papa Georges at the Toy Booth, surely you've seen me there. And this is my cousin from the country, Hugo. (Whispers) You'll have to forgive him, he's a little simple-minded. Doltish, really. Poor thing."
desc70.347,desc,,The Station Inspector leans in. Peers closely at Hugo. Hugo gives him a simple-minded look.
utter70.348,utter,STATION INSPECTOR,"Go on then *** But remember, in !!!Y terminal children are not permitted to run amok . * * Not ever."
desc70.349,desc,,He gives them a last chilling glare and goes. Hugo looks at Isabelle. HUGO
utter70.350,utter,Doltish? ISABELLE,It worked didn't it?
desc70.351,desc,,They continue on.
utter70.352,utter,ISABELLE,Now since I just saved your life how about letting me see your covert lair?
utter70.353,utter,HUGO,My what?
utter70.354,utter,ISABELLE,Where you live in the walls! HUGO I can't understand what you're saying half the time.
utter70.355,utter,ISABELLE,That's because I am so gigantically literate.
utter70.356,utter,HUGO,"I'll tell you what *** I'll let you see my Hcovert lair"" if you do one thing ***"
utter70.357,utter,ISABELLE,What's that?
desc70.358,desc,,You have to ***
utter70.359,utter,ISABELLE,Yes *** ?
desc70.360,desc,,Catch~! And he is off like a shot-Isabelle laughs and pursues-A wild chase through the station. It is nice to see Hugo enjoying himself. His usually sober face is smiling. Bis serious personality gives way to simple play. He's just a kid now. Having fun with his friend. Hugo tears through the station *** Past the cafe *.* Leaping over Madame Emilie's yapping dachshund *** Down a ramp ***
scene71,slugline,,Up a stairway ***
desc71.361,desc,,"Careening around Monsieur Rouleau's easel *** Ripping around corners *** Barreling through the terminal *** Isabelle follows. Laughing. This is all from a child's perspective. We cut past towering adults. Weaving in and out. Diving under platform gates. Scrambling over benches. And at top speed. Sliding and skidding wildly on the polished floors. Carefree. Then Hugo diverts down a long stairway leading to one of the platforms. He leaps and bounds down the stairs. Three at a time. Isabelle follows gamely, bouncing down after him ***"
scene72,slugline,,INT. TRAIN STATION -- PLATFORM - DAY
desc72.362,desc,,"Hugo and* Isabelle race down the platform. An enormous train is just pulling in. Clouds of steam. Scores of passengers emerge swiftly from the train. A great crowd. Too many. Hugo and Isabelle are unexpectedly caught in the mob of passengers. The passengers are hurrying. Late. In a rush. Too many big people pushing them back and forth, crowding them, jostling them. Isabelle trips! She falls. Amidst the pounding crush of feet. Scary. Hugo turns. His face."
desc72.363,desc,,"He pushes back. Reaches for her. His hand stretches out. She takes his hand. Her face. He pulls her up to safety. The crowd thins out around them. But he is staring at something, amazed. In the action, a necklace has emerged from her collar. A key on a piece of string. A distinctive heart-shaped key."
desc72.364,desc,,Where did you get that?!
utter72.365,utter,ISABELLE,None of your business.
desc72.366,desc,,She tucks the key away. * HUGO I need it.
utter72.367,utter,ISABELLE,HUGO
desc72.368,desc,,I just need it.
utter72.369,utter,ISABELLE,Not unless you tell me why.
desc72.370,desc,,He looks at her. A long beat. He nods.
scene73,slugline,,INT. TRAIN STATION -- TUNNELS - DAY
desc73.371,desc,,Hugo leads her through the tunnels.
desc73.372,desc,,This is marvelous! **. I feel like Jean Valjean!
utter73.373,utter,HUGO,I used to imagine I was the Phantom
desc73.374,desc,,of the Opera. Like in the movie. He leads her through the iron door to ***
scene74,slugline,,INT. * TRAIN STATION -- SECRET 1'.PARTMENT - DAY
desc74.375,desc,,Hugo lights some candles. She takes the apartment in. The cramped quarters. The chaos of tools and machine parts hanging everywhere.
utter74.376,utter,ISABELLE,This is such a boy place.
desc74.377,desc,,Hugo pulls a sheet off the Automaton. She is instantly captivated by the wonderful machine.
utter74.378,utter,ISABELLE,What is it?
utter74.379,utter,HUGO,It's an automaton * * * My father was fixing it before he died.
utter74.380,utter,ISABELLE,Why would my key fit your father's machine? .-** That doesn't make any sense.
desc74.381,desc,,They look at the Automaton for a moment.
desc74.382,desc,,He looks sad.
desc74.383,desc,,I think he's just waiting.
utter74.384,utter,ISABELLE,For what?
desc74.385,desc,,To work again. To do what he's supposed to do.
utter74.386,utter,ISABELLE,What happens when you wind him up?
desc74.387,desc,,"I don't know. She takes off her necklace. Hands it to him, He fills the Automaton's little inkwell with ink. He puts a fresh piece of paper on the little writing desk. It's ready. Hugo pauses."
utter74.388,utter,ISABELLE,What's the matter?
desc74.389,desc,,I know it's silly but *** I think
utter74.390,utter,ISABELLE,Do you want me to go?
desc74.391,desc,,"He shakes his head. A beat. Then he carefully inserts the key. And winds the Automaton. Steps back. The world hangs in suspense. Nothing happens. He looks at her. She doesn't know what to say. He looks back at the Automaton. Nothing. INSIDE the Automaton's body: Things begins to move *** A cascade of perfect movements, with hundreds of brilliantly calibrated actions ..* A spring connects to a series of gears *** The gears extend down to the base of the figure and turn brass disks *** Two little hammers come down and trail along the edges of the disks *** The little hammers translate motion back up through a series of rods *** The rods silently turn other intricate mechanisms in the figure's shoulder and neck ** , The shoulder gears move *** Engaging the elbow *** Setting off a chain reaction of movements down to the Wrist ... The hand."
scene75,slugline,,OUTSIDE again:
