segment-id,segment-type,segment-speaker,segment-text
utter133.819,utter,ALLISON,And she stole a letter that Sam wrote me. I have to do something.
desc133.820,desc,,Graham gets up from the couch.
utter133.821,utter,GRAHAM,Get rid of her.
scene134,slugline,,ALLISON'S APARTMENT - LIVING ROOM - INTERIOR NIGHT
desc134.822,desc,,"Hedra is still kneeling on the floor, with her ear close to the air vent, listening to the conversation between Allison and Graham. GRAHAM (voice over from the air vent) Call the police if you have to. If she steals thing you have to get her out of the place. We hear steps. Hedra looks up at the ceiling, and then slowly stands up."
scene135,slugline,,GRAHAM'S APARTMENT - LIVING ROOM - INTERIOR NIGHT
desc135.823,desc,,Graham is pouring something we don't see in a glass.
utter135.824,utter,ALLISON,You're right. I'll tell her tonight.
desc135.825,desc,,"Allison gets up from the couch, with her cup in her hand."
utter135.826,utter,ALLISON,"I can't just throw her out on the street. I mean, she obviously needs help."
utter135.827,utter,GRAHAM,"She is a lunatic, Allie. She's got to go. Do it tonight."
scene136,slugline,,GRAHAM'S APARTMENT - CORRIDOR - INTERIOR NIGHT
desc136.828,desc,,Close-up on the front door. The door slowly opens and a hand covered by a black glove comes through the opening of the door. We hear the conversation going on between Graham and Allison.
utter136.829,utter,ALLISON (voice over),It's just that I feel responsible for her somehow. I'm the only one she has. Someone like her parent.
scene137,slugline,,GRAHAM'S APARTMENT - LIVING ROOM - INTERIOR NIGHT
desc137.830,desc,,Back to Graham and Allison.
utter137.831,utter,GRAHAM,"Allie, either she's gone by Saturday, or I go to the police, okay ?"
desc137.832,desc,,Allison laughs.
utter137.833,utter,ALLISON,That was very impressive.
utter137.834,utter,GRAHAM,I can be butch when I have to. I got it from my mother.
scene138,slugline,,GRAHAM'S APARTMENT - CORRIDOR - INTERIOR NIGHT
desc138.835,desc,,The room is very dark and only lit by the street lights through the window. A shadow moving in the dark. We hear the conversation coming from the living room.
utter138.836,utter,GRAHAM (voice over),"Look, if you worry about her, I've got a friend who's a shrink. Maybe he can help her."
desc138.837,desc,,"The shadow moves away from the dark corner where she was hiding : it is Hedra, who starts walking cautiously in the room."
utter138.838,utter,ALLISON (voice over),"Oh God ! Maybe after I talk to her, she just leaves."
utter138.839,utter,GRAHAM (voice over),Do you want to sleep here tonight ?
utter138.840,utter,ALLISON (voice over),"Oh, don't tempt me. No, I just needed to talk it out."
scene139,slugline,,GRAHAM'S APARTMENT - LIVING ROOM - INTERIOR NIGHT
desc139.841,desc,,Allison and Graham are both standing in the middle of the room.
utter139.842,utter,ALLISON,Thanks.
desc139.843,desc,,She walks to a table to pick up her purse.
scene140,slugline,,GRAHAM'S APARTMENT - CORRIDOR - INTERIOR NIGHT
desc140.844,desc,,"Sensing that Allison is going to leave, Hedra walks back into a dark corner to hide herself."
utter140.845,utter,ALLISON (voice over),She's not going to chase me out of my own place.
desc140.846,desc,,GRAHAM (voice over) When's Sam coming back ?
scene141,slugline,,GRAHAM'S APARTMENT - LIVING ROOM - INTERIOR NIGHT
desc141.847,desc,,Graham is carrying his cat in his arms.
utter141.848,utter,ALLISON,"Oh, tomorrow."
desc141.849,desc,,Allison picks up her purse and they start walking towards the front door.
scene142,slugline,,GRAHAM'S APARTMENT - CORRIDOR - INTERIOR NIGHT
desc142.850,desc,,"They walk along the corridor, Graham still with his cat in his arms."
utter142.851,utter,GRAHAM,That's good.
utter142.852,utter,ALLISON,Yeah.
utter142.853,utter,GRAHAM,"Oh, this is a little embarrassing, but since we're letting our hair down... Those old air vents between our apartments carry sound. It's a weird acoustic thing."
desc142.854,desc,,They've stopped walking.
utter142.855,utter,ALLISON,Oh... What do you hear ?
desc142.856,desc,,"He does not answer but he makes a face and then laughs, which is a good answer to Allison's question. She puts her head down in her hand, feeling a bit embarrassed."
utter142.857,utter,ALLISON,"Oh, no ! Oh no ! I'm... I'm sorry."
utter142.858,utter,GRAHAM,Big deal. I am sorry. I should've mentioned it sooner.
utter142.859,utter,ALLISON,I'm so sorry.
utter142.860,utter,GRAHAM,You're sure you want to go down there ?
utter142.861,utter,ALLISON,Yeah. She's my problem. I'll handle it.
desc142.862,desc,,She starts walking again towards the front door. Graham follows her. Allison opens the door.
utter142.863,utter,ALLISON,Thank you for the tea. I'll see you tomorrow.
utter142.864,utter,GRAHAM,Okay.
desc142.865,desc,,"Allison goes out and Graham closes the door behind her, and then locks it."
scene143,slugline,,ALLISON'S BUILDING - MAIN STAIRCASE - INTERIOR NIGHT
desc143.866,desc,,High angle shot of the staircase. Allison is walking down the stairs.
scene144,slugline,,ALLISON'S APARTMENT - FRONT HALL - INTERIOR NIGHT
desc144.867,desc,,"The apartment is all dark. The front door opens and Allison walks in, and closes the door behind her."
utter144.868,utter,ALLISON,Hedy ?
desc144.869,desc,,She puts her keys on the shelf by the door.
utter144.870,utter,ALLISON,Hedy ?
desc144.871,desc,,"She walks around the hall, looking in all the rooms."
utter144.872,utter,ALLISON,Hedy ?
desc144.873,desc,,"We hear a little noise, and we see Allison turning her head. Close up on a mirror-covered door opening slowly. At that very moment, we, the spectators, do think we are still in Allison's apartment. But actually, we are in :"
scene145,slugline,,GRAHAM'S APARTMENT - CORRIDOR - INTERIOR NIGHT
desc145.874,desc,,The door opens slowly with a light squeaking noise. We hear Graham's voice talking on the telephone in the next room.
utter145.875,utter,GRAHAM (voice over),"This is serious, it's a lot more serious than I thought. No, I know you can't diagnose over the phone."
desc145.876,desc,,"The camera moves away from the door, then looks into the living- room, where Graham is sitting in the dark, only lit by the street lights coming through the window, and talking in the telephone."
utter145.877,utter,GRAHAM,"I don't know. I don't even know what hyper-vigilant is. No, I've never met the woman. She could be infantile or paranoid, whatever. I don't know..."
scene146,slugline,,ALLISON'S APARTMENT - ALLISON'S BEDROOM - INTERIOR NIGHT
desc146.878,desc,,"Close-up on the air-vent. We see Allison's hands sticking pieces of large adhesive tape on the air-vent. We hear the faint voice of Graham still talking on the telephone, but we don't understand the words. Larger shot of Allison sitting on her bed and sticking the pieces of tape on the air-vent."
scene147,slugline,,GRAHAM'S APARTMENT - LIVING ROOM - INTERIOR NIGHT
desc147.879,desc,,Graham is still talking on the phone.
utter147.880,utter,GRAHAM,"I tell you what, let me go downstairs. If I call you from there, will you talk to my friend ? She can tell you better than I can. Right, okay."
desc147.881,desc,,"We hear some noise in the background, and Graham turns his head towards the noise. Quick reverse angle shot on the corridor seen from the living-room door. It looks empty and quiet. Back to Graham on the phone."
utter147.882,utter,GRAHAM,"Thanks. So... so, all right... so, so you might hear from us. Love to Jack. And you're not charging me for this."
desc147.883,desc,,"He puts the telephone down on his set on the table, turns his head again in the direction where he heard the strange noise, and gets up. He thinks it may be the cat and calls her with a soft gentle voice."
utter147.884,utter,GRAHAM,Carmen...
desc147.885,desc,,He gets out of the room into the corridor.
scene148,slugline,,GRAHAM'S APARTMENT - CORRIDOR - INTERIOR NIGHT
desc148.886,desc,,"Graham makes little noises with his lips to attract the cat. He suddenly hears the wooden floor squeak behind him. He turns his head. We see Hedra coming out of a room and walking towards the front door. Since we see only the back of her head, she can easily be mistaken for Allison."
utter148.887,utter,GRAHAM,Allie !
desc148.888,desc,,She doesn't turn her head and just wave her hand.
utter148.889,utter,HEDRA,Goodnight.
desc148.890,desc,,"She has almost reached the front door, when Graham realizes that something is queer about the girl's attitude."
utter148.891,utter,GRAHAM,Hedy ?
desc148.892,desc,,"She turns around. She seems very panicky suddenly. She starts fumbling with the locks of the door, and drops the safety bar on the floor."
utter148.893,utter,HEDRA,I'm sorry...
utter148.894,utter,GRAHAM,"Wait... hey, wait, it's okay. Take it easy. Take it... We just want to get you some help."
desc148.895,desc,,"Hedra is kneeling down, fumbling with the fallen safety bar."
utter148.896,utter,HEDRA,"No, Please... Please... I didn't do anything wrong."
desc148.897,desc,,Graham is walking slowly towards her.
utter148.898,utter,GRAHAM,"Okay, take it easy."
utter148.899,utter,HEDRA,"I'm sorry, I didn't do anything."
utter148.900,utter,GRAHAM,No problem.
desc148.901,desc,,"Hedra suddenly stands up with the safety bar held firmly in both hands. She strikes Graham first in the stomach, then, as he doubles up with pain, she strikes him again on the shoulder. Graham falls on the floor, and she gives him a final blow on the head, leaving him unconscious on the floor."
scene149,slugline,,ALLISON'S APARTMENT - LIVING ROOM - INTERIOR NIGHT
desc149.902,desc,,"Allison is standing by the desk, talking on the telephone and holding the telephone set with her other hand. We hear a beep."
utter149.903,utter,ALLISON,"Hello, Mr. Besch, you don't know me, my name is Allison Jones. I think my room-mate Hedra is your daughter. Ellen. I'm not sure, really. She's... She's been under a lot of stress lately... And... Well... Huh... Huh... God... I really, really would not get into this on the answering machine. Could you please give me a call ? Or her ? I'm sure you have the phone number. It's 2-1-2-5-5-5-9-8-1-4."
scene150,slugline,,ALLISON'S APARTMENT - FRONT HALL - INTERIOR NIGHT
desc150.904,desc,,"The front door opens, and Hedra comes in. ALLISON (voice over, still talking on the telephone) I'll really appreciate, I'll really. Don't say I called."
scene151,slugline,,ALLISON'S APARTMENT - LIVING ROOM - INTERIOR NIGHT
desc151.905,desc,,"Allison, still on the phone, turns her head towards the front hall."
utter151.906,utter,ALLISON,"Oh, thank you."
desc151.907,desc,,She puts the phone down.
scene152,slugline,,ALLISON'S APARTMENT - FRONT HALL - INTERIOR NIGHT
desc152.908,desc,,Hedra closes the front door and walks slowly across the hall ALLISON (voice over)
desc152.909,desc,,Hedra enters the bathroom and closes the door behind her.
scene153,slugline,,ALLISON'S APARTMENT - LIVING ROOM - INTERIOR NIGHT
desc153.910,desc,,"Allison is standing near the window, apparently not knowing exactly what to do next."
scene154,slugline,,ALLISON'S APARTMENT - BATHROOM - INTERIOR NIGHT
desc154.911,desc,,Hedra is sitting naked under the shower. She is playing with a jewel ring and humming softly some musical tune. We hear several knocks on the door. Hedra doesn't react at all. ALLISON (voice over)
desc154.912,desc,,Hedra answers without moving her head.
utter154.913,utter,HEDRA,What ?
desc154.914,desc,,"Apparently, Hedra has not spoken loud enough above the noise of the shower, because Allison knocks again on the door."
utter154.915,utter,ALLISON (voice over),"Hedy, are you all right ?"
utter154.916,utter,HEDRA,I can't hear you.
desc154.917,desc,,"She has spoken with a very soft voice, and apparently Allison hasn't heard her, because she opens the door, and walks slowly towards the shower"
utter154.918,utter,ALLISON,"It's okay, it's just I was starting to worry. You've been in here so long. I'm making some tea. Do you want some tea ? Camomile."
desc154.919,desc,,Hedra turns slowly her head towards Allison and smiles.
utter154.920,utter,HEDRA,Yeah... that'd be great.
desc154.921,desc,,"She turns the shower off, and stands up. She picks up a towel. Allison turns her head, apparently feeling embarrassed to see her naked. Close up on the basin, full of water, and where Hedra's clothes are soaking. The water is red with what looks like blood."
utter154.922,utter,HEDRA (voice over),I'm not feeling really well.
desc154.923,desc,,"Hedra, wrapped in a large bath towel, has noticed that Allison has been looking at the blood in the basin."
utter154.924,utter,HEDRA,Mine always comes when I'm wearing something nice.
desc154.925,desc,,"She walks slowly across the bathroom. When she passes near the basin, she notices that a small part of her clothes are not inside the basin, and she moves it back inside."
scene155,slugline,,ALLISON'S APARTMENT - FRONT HALL - INTERIOR NIGHT
desc155.926,desc,,"Still wrapped into the bath towel, Hedra walks slowly out of the bathroom, followed by Allison."
utter155.927,utter,ALLISON,Are you crampy ? Sometimes tea helps. Something warm. We could talk.
desc155.928,desc,,"Hedra has reached her room's door, and she turns around."
utter155.929,utter,HEDRA,About what ?
desc155.930,desc,,Hedra walks into her room followed by Allison.
utter155.931,utter,ALLISON,About Sam and I wanting this place for ourselves...
scene156,slugline,,ALLISON'S APARTMENT - HEDRA'S BEDROOM - INTERIOR NIGHT
desc156.932,desc,,Hedra has not switched the light on in the room. The room is just lit by the street light coming through the window.
utter156.933,utter,ALLISON,...It's just crazy keeping two places like this.
desc156.934,desc,,"Hedra sits on the bed. She is wearing a night shirt and a large sweater over the night shirt. (NOTE - This could be considered as a continuity goof. Apparently, Hedra has been able to change from the bath towel to the night shirt and sweater in less than a second !)"
utter156.935,utter,HEDRA,"Well... Well, I... I thought you wanted a long engagement so you could make sure you can trust him again."
utter156.936,utter,ALLISON,"Well, frankly, I think that's my business. I'm sorry, but it is."
desc156.937,desc,,Hedra cracks her knuckles.
utter156.938,utter,HEDRA,"Huh-huh... It's me, isn't it ? I'll change, Allie. I can change."
utter156.939,utter,ALLISON,"No, that's not it at all. You've been a good room-mate. It's just... This is the man I'm going to marry. I want us to start our lives together."
utter156.940,utter,HEDRA,"Well... He will cheat on you again, that's a promise. And when he does, don't come running to me, okay ? Cause... I've had it with you. You're so fucking weak !"
desc156.941,desc,,"Suddenly, she has a very menacing face. Allison, still standing up, looks down at her with a very hard stare. Hedra, seeing that stare, calms down and laughs."
utter156.942,utter,HEDRA,I'm sorry. I'm so sorry.
desc156.943,desc,,"The phone rings, but Allison, who is still looking down at Hedra with her very hard stare, doesn't move. Hedra turns her head in the direction of the phone."
utter156.944,utter,HEDRA,Allie ?
desc156.945,desc,,Hedra now has a very sweet look on her face. She gets up and out of the room.
scene157,slugline,,ALLISON'S APARTMENT - FRONT HALL - INTERIOR NIGHT
desc157.946,desc,,Hedra picks up the phone from the little table in the hall.
utter157.947,utter,HEDRA,Hello ?
desc157.948,desc,,Allison enters the room from Hedra's bedroom.
utter157.949,utter,ALLISON,Is it Sam ?
desc157.950,desc,,We hear a male voice over the phone. We quickly understand it's Hedra's father.
utter157.951,utter,HEDRA'S FATHER (voice over on the telephone),"Ellen, is that you ? Talk to me, or your mother. Honey, we miss you. We want you to come home."
utter157.952,utter,HEDRA (with a deep menacing voice),Don't call here again.
utter157.953,utter,HEDRA'S FATHER (voice over on the telephone),"Ellen, listen. We'll stop sending the cheques if you don't come. I promise, no doctors this time. Just come."
desc157.954,desc,,"Hedra puts the telephone down. She doesn't move for a couple of seconds, then looks at Allison, trying to look more casual than she actually is. She has a little nervous laugh."
utter157.955,utter,HEDRA,Obscene phone call. New York !
desc157.956,desc,,The phone rings again. Hedra picks up the receiver and slams it on the table. Then she presses on a button on the telephone set to cut off the communication.
utter157.957,utter,HEDRA,"Find someone else, jerk !"
desc157.958,desc,,Allison walks to the telephone table.
utter157.959,utter,ALLISON,I'm expecting a call from Sam. He might be coming in tonight.
utter157.960,utter,HEDRA,"Just for a little while, okay. Sam will call back if it's busy."
desc157.961,desc,,Hedra hugs Allison.
utter157.962,utter,HEDRA,"I'm sorry, Allie."
desc157.963,desc,,"She moves away from Allison, looking falsely casual."
utter157.964,utter,HEDRA,"It's no big deal. I'll find some other place. You know, I just... I don't want you making a mistake."
utter157.965,utter,ALLISON,"I understand. Hey, we'll still be friends. We'll keep in touch."
utter157.966,utter,HEDRA,Sure.
desc157.967,desc,,"Allison walks away to her room. Hedra picks up the telephone set from the little table, without putting the receiver back on its hook. We hear several short beeps coming from the telephone. With one nervous movement, Hedra tears the cord off the wall socket. Then she walks slowly into her room."
scene158,slugline,,ALLISON'S APARTMENT - HEDRA'S BEDROOM - INTERIOR NIGHT
desc158.968,desc,,"A little later. Hedra is lying in her bed, writing something in a notebook. She is humming a song. Her other hand is resting on the telephone set on the bed. The phone rings. Hedra picks it up immediately, not to let it ring more than once."
utter158.969,utter,HEDRA (whispering),Hello ?
desc158.970,desc,,SAM (voice over on the phone)
utter158.971,utter,HEDRA,"No, it's Hedy."
scene159,slugline,,HOTEL ATHERTON - A BEDROOM - INTERIOR NIGHT
desc159.972,desc,,"Sam is lying on the bed, still dressed in his suit and necktie. He is talking on the telephone."
utter159.973,utter,HEDRA (voice over on the phone),Where are you ? Where are you ?
utter159.974,utter,SAM,Oh... I just got in from the airport. Is she asleep ?
utter159.975,utter,HEDRA (voice over on the phone),Yeah...
scene160,slugline,,ALLISON'S APARTMENT - HEDRA'S BEDROOM - INTERIOR NIGHT
desc160.976,desc,,Hedra gives a quick look at the clock on the night table.
utter160.977,utter,HEDRA,It's after two. Do you want me to wake her ?
utter160.978,utter,SAM (voice over on the phone),"No, tell her to surprise me."
scene161,slugline,,HOTEL ATHERTON - A BEDROOM - INTERIOR NIGHT
desc161.979,desc,,HEDRA (voice over on the phone)
utter161.980,utter,SAM,Okay.
utter161.981,utter,HEDRA (voice over on the phone),"Okay, I'll tell her."
utter161.982,utter,SAM,"Goodnight, honey."
scene162,slugline,,ALLISON'S APARTMENT - HEDRA'S BEDROOM - INTERIOR NIGHT
utter162.983,utter,HEDRA,"Goodnight, Sam. Sleep well."
desc162.984,desc,,She slowly puts the phone down and plays a little with it.
scene163,slugline,,HOTEL ATHERTON - MAIN ENTRANCE - EXTERIOR NIGHT
desc163.985,desc,,"Close up on a pair of female legs and feet with stiletto heels shoes. The heels clicks on the sidewalk, and we see the figure of a woman walking away from us, and towards the entrance of the hotel. No one else is in the streets at this time of the night. The woman is wearing a grey raincoat. The woman enters the hotel."
scene164,slugline,,HOTEL ATHERTON - A BEDROOM - INTERIOR NIGHT
desc164.986,desc,,"Sam is sleeping, covered by the sheet up to his waist, and apparently naked underneath. The door opens slowly. The woman in the grey raincoat enters the room. We have already guessed she is Hedra. She closes the door and puts the key on the night table. She remains motionless for a couple of seconds, looking at Sam, then she slowly starts to take the raincoat off. She is completely naked under the raincoat. She slides under the sheet of the bed, close to Sam. Sam moans in his sleep. He turns slowly towards Hedra, who starts kissing him on the chest. SAM (sleepy voice) Allie, Allie... what are you doing ? Hedra goes down Sam's body, still kissing him. When she gets between his legs, even if the room is very dark, we understand she is performing oral sex on him. Sam moans with pleasure."
utter164.987,utter,SAM,Oh... Oh... Jesus !... Oh... Gee...
desc164.988,desc,,"Suddenly, Sam realizes that something may be wrong. He gives an anxious look at Hedra."
utter164.989,utter,SAM,Allie ?
desc164.990,desc,,Hedra raises her head from Sam's private parts.
utter164.991,utter,HEDRA,"No, not Allie."
desc164.992,desc,,"She resumes what she was doing. Sam would like to push her away, but he is so close to his climax that he can't do it. He has his orgasm, with Hedra not moving away from between his legs. She only raises her head when she is sure it is over. She gives him a light kiss on the pubis and smiles. Then she moves up in the bed, her head finally resting near Sam's one. Sam is breathing very hard. Hedra strokes him on the chest, and kisses his cheek. Then she gets up and off the bed, and puts her raincoat back on. She picks up a half-full glass on a table and drinks from it, what looks like beer. Then she eats something from a plate on the same table. Sam breathes normally again and moves slowly on the bed. He lies on his side, facing away from Hedra."
utter164.993,utter,HEDRA,Hey !
desc164.994,desc,,"With the glass still in her hand, she walks to the bed"
utter164.995,utter,HEDRA,"Hey, sleepy guy."
desc164.996,desc,,"She puts the glass on the night table, and kneels on the bed. She start stroking Sam's shoulder."
utter164.997,utter,HEDRA,I knew it.
utter164.998,utter,SAM,Knew what ?
utter164.999,utter,HEDRA,I told her. Guys like you don't change. You can't be faithful. And now she'll know.
desc164.1000,desc,,"While talking, she keeps on stroking his face. Sam doesn't react to her caress."
utter164.1001,utter,SAM,She'll know what ?
desc164.1002,desc,,He switches on the light on the night-table. He then turn around to face her.
utter164.1003,utter,SAM,"That you came up here and pretended to be her ? My God, what is this hair ? What is this supposed to mean ? You're in her clothes. You're wearing her perfume! For Christ- sake !"
desc164.1004,desc,,"He jumps out of the bed, and starts putting his clothes on. Hedra remains seated on the bed, drinking her glass."
utter164.1005,utter,HEDRA,"You knew it was me. Come on ! You knew and you didn't care. Well, I think she should know that."
utter164.1006,utter,SAM,"You think she's going to thank you for that news, do you ?"
utter164.1007,utter,HEDRA,"Well, I don't expect you to understand her friendship."
desc164.1008,desc,,"She puts her glass on the night table, and gathers her shoes to put them back on her feet."
utter164.1009,utter,SAM,"She can't... she can't stand you, for Christ-sake !"
utter164.1010,utter,HEDRA,That's not true.
utter164.1011,utter,SAM,"Oh, bullshit !"
utter164.1012,utter,HEDRA,Huh-huh.
desc164.1013,desc,,She shakes her head <<no>>.
utter164.1014,utter,SAM,You're too needy. You're always cleaning. You're constantly in her face.
utter164.1015,utter,HEDRA,She needs me. Who was there for her when her boss almost raped her ?
utter164.1016,utter,SAM,What ?
utter164.1017,utter,HEDRA,Could you care of her ? You were off on a business trip or screwing someone.
utter164.1018,utter,SAM,She never said a word to me about that.
desc164.1019,desc,,"After his pants, Sam has put his shirt back on. Hedra gets up from the bed where she was still sitting."
utter164.1020,utter,HEDRA,"That's right, she told me."
desc164.1021,desc,,She sits back on the bed.
utter164.1022,utter,HEDRA,So... don't try and make me think that we're not close. We lean on each other and we... we protect each other. We're best friends.
utter164.1023,utter,SAM,"You're nuts, you know that ? Yes... I think you're out of your skull, that's right."
utter164.1024,utter,HEDRA,"Yeah, well, sticks and stones..."
desc164.1025,desc,,He comes near the bed and bends down to pick up something. Hedra rushes on him.
utter164.1026,utter,HEDRA,Sam !
desc164.1027,desc,,He pushes her away from him.
utter164.1028,utter,SAM,Don't touch me ! She sits back on the bed.
utter164.1029,utter,HEDRA,"I'm sorry. I'm sorry. Look, I know you want to save face. I won't tell her, okay ? Just... Just pick up the phone and call her and tell her you're going back to your ex-wife, or something. And I won't say a word, okay ?"
utter164.1030,utter,SAM,"Yeah... Well, you won't have to say a word, sweetheart, because I'm going to tell her myself."
desc164.1031,desc,,He walks to the night-table and picks up the telephone. She throws one of her shoes towards him. The shoe hits the wall just above his head.
utter164.1032,utter,HEDRA (yelling),No !
desc164.1033,desc,,"He rushes towards her, ready to hit her."
utter164.1034,utter,SAM,Fucking bitch !
desc164.1035,desc,,"But, before he reaches her, she strikes him very hard in the face with her other shoe. The stiletto heel of the shoe enters his left eye, and, behind the eye, certainly enters his skull and his brain, because, instantly after the blow, Sam falls heavily on his back on the floor, where he remains motionless and unconscious. With her bare foot, Hedra touches his cheek."
utter164.1036,utter,HEDRA (softly),Hey !... Hey !
scene165,slugline,,HOTEL ATHERTON - LOBBY - INTERIOR NIGHT
desc165.1037,desc,,"Close up on Hedra's feet walking on the rug. She's wearing both of her stiletto heels shoes. Hedra goes down some steps and reaches the hotel reception desk. The same hotel clerk, that we saw earlier in the film, when Sam and Allison came together into the hotel, is talking on the phone. He is talking in a soft voice, so we can't understand exactly what he's saying. But, when Hedra walks in front of his desk, he puts his hand on the receiver microphone, and says, in a louder voice :"
