segment-id,segment-type,segment-speaker,segment-text
utter165.1038,utter,HOTEL CLERK,"Goodnight, Miss Jones."
desc165.1039,desc,,"Without turning her head, Hedra waves her hand."
utter165.1040,utter,HEDRA,Goodnight.
scene166,slugline,,ALLISON'S APARTMENT - ALLISON'S BEDROOM - INTERIOR DAY
desc166.1041,desc,,Close up on the clock on the night table : it says 06:22. Allison slowly wakes up to some noise in the apartment.
scene167,slugline,,ALLISON'S APARTMENT - FRONT HALL - INTERIOR DAY
desc167.1042,desc,,"Allison comes out of her bedroom, wearing a long sleeveless pink night shirt. She seems to be naked underneath. She walks around the room, looking in every room which door is open."
utter167.1043,utter,ALLISON,Hedy ?... Hedy ?
desc167.1044,desc,,"She eventually finds her in the living room, vigorously cleaning the mantlepiece. Hedra is wearing a long plain gray dress and red rubber gloves. Allison remains at the door of the room."
utter167.1045,utter,ALLISON,Hedy ?
desc167.1046,desc,,"Hedra looks up at Allison, but doesn't stop her cleaning."
utter167.1047,utter,HEDRA,"Oh, hi ! I hope I didn't wake you. I got an early start."
utter167.1048,utter,ALLISON,"No, Hedy, I didn't mean for you to move out today."
desc167.1049,desc,,Hedra looks around the room.
utter167.1050,utter,HEDRA,"Oh, there, I think that's it."
desc167.1051,desc,,She goes out of the room into the hall.
utter167.1052,utter,HEDRA,I hope you don't mind. I'm storing some of my stuff in the cage downstairs.
desc167.1053,desc,,"She resumes her vigorous cleaning in the hall, starting with the small shelf by the front door."
utter167.1054,utter,HEDRA,"That way, I won't have to bother... You see what I mean... You know... I mean..."
desc167.1055,desc,,Allison has come near Hedra.
utter167.1056,utter,ALLISON,"Sure, that's fine. Look, I'm really sorry it didn't work out."
desc167.1057,desc,,"Hedra has stacked <<her stuff>> near the front door. She picks them up : a red suitcase, a cardboard box and a large paper bag. She has taken her rubber gloves off and keeps them in one hand."
utter167.1058,utter,HEDRA,"Well, I'd better get this stuff out of here."
desc167.1059,desc,,Allison walks to the door.
utter167.1060,utter,ALLISON,I'll help.
desc167.1061,desc,,She opens the door.
utter167.1062,utter,ALLISON,We can have breakfast when you get back.
desc167.1063,desc,,"Hedra walks out of the apartment. Allison closes the door, but remains behind it, lost in her thoughts."
scene168,slugline,,ALLISON'S BUILDING - BASEMENT - INTERIOR DAY
desc168.1064,desc,,"Hedra is rapidly walking along a corridor, carrying <<her stuff>>."
scene169,slugline,,ALLISON'S BUILDING - INCINERATOR ROOM - INTERIOR DAY
desc169.1065,desc,,"Close up on the open red suitcase. Inside, all the clothes that makes Hedra look like Allison. Hedra takes the clothes out of the suitcase and puts them into the open incinerator. Then she sprays some lighter fluid over the clothes. Close up on Hedra's hands striking a match on the side of a matchbox. She throws the match into the incinerator, and long flames immediately start on the clothes."
scene170,slugline,,ALLISON'S APARTMENT - KITCHEN - INTERIOR DAY
desc170.1066,desc,,"Allison is fixing breakfast. She has cut some fruits into small pieces and she puts them in the bowl of the blender. We hear some music from the TV in the background. Allison walks to a cupboard on the wall to pick up a spices jar. The door leading to the living room is open, and the TV is on. Allison gives a quick look at the TV, on her way back from the cupboard to the kitchen working bench. Allison puts a bit of spices from the jar into the blender, closes the lid and starts the blender. MALE TV REPORTER (voice over from the TV set) And now, Morning News-break... The rest of the words of the TV reporter are lost, covered by the noise from the blender. But the voice of a female reporter, being slightly louder, can be heard over the blender noise FEMALE TV REPORTER (voice over from the TV set) Police found the body of a man brutally murdered early this morning. Allison shuts the blender off, and walks to the open door to watch TV."
scene171,slugline,,ALLISON'S APARTMENT - LIVING ROOM - INTERIOR DAY
desc171.1067,desc,,"Close up on the TV screen, showing the reporter, standing, with her microphone in hand, near the entrance of the Atherton Hotel. FEMALE TV REPORTER (voice over from the TV set) Identification of the victim, a white male of around 30 years of age is pending notification of next of kin. Reverse angle shot of Allison, standing in the doorway and peeling a banana. FEMALE TV REPORTER (voice over from the TV set) A witness I spoke to just right here said... Reverse angle shot on the TV. FEMALE TV REPORTER (voice over from the TV set) ...he heard the sound of a struggle emanating from room Reverse angle shot on Allison. FEMALE TV REPORTER (voice over from the TV set)"
desc171.1068,desc,,Allison suddenly realizes that the room number is Sam's one. She rushes to the telephone set on the wall near the refrigerator.
scene172,slugline,,ALLISON'S APARTMENT - KITCHEN - INTERIOR DAY
desc172.1069,desc,,Allison dials very nervously a number on the phone.
scene173,slugline,,HOTEL CLERK (voice over from the phone) Atherton Hotel.
utter173.1070,utter,ALLISON,"Sam Rawson's room, please, room 6-12.."
scene174,slugline,,HOTEL CLERK (voice over on the phone)
desc174.1071,desc,,"She doesn't even wait for the end of the sentence, and drops the phone, letting the receiver hang on its cord. She rushes out of the kitchen."
scene175,slugline,,ALLISON'S BUILDING - INCINERATOR ROOM - INTERIOR DAY
desc175.1072,desc,,"Hedra is leaving the room, carrying <<her stuff>>. Behind her, the incinerator door is wide open, and we see a bright fire inside."
scene176,slugline,,ALLISON'S BUILDING - BASEMENT - INTERIOR DAY
desc176.1073,desc,,"Across the corridor from the incinerator room, Hedra reaches Allison's private <<cage>>. She drops <<her stuff>> and opens the padlock."
scene177,slugline,,ALLISON'S APARTMENT - BATHROOM - INTERIOR DAY
desc177.1074,desc,,Allison is bending over the toilet bowl and vomiting.
scene178,slugline,,ALLISON'S BUILDING - BASEMENT - INTERIOR DAY
desc178.1075,desc,,"In the <<cage>>, Hedra takes a boot out of the cardboard box. Then she takes a sock out of the boot, and delicately, takes a black hand gun out of the boot. She puts the gun in the paper back, above some clothes."
scene179,slugline,,ALLISON'S APARTMENT - BATHROOM - INTERIOR DAY
desc179.1076,desc,,"Allison is still vomiting in the toilet bowl. She slowly raises her head from the toilet bowl, trying to catch her breath. She sees Hedra's pair of stiletto heel shoes. Underneath one of the heels, there are some traces of blood on the tile floor of the bathroom. Kneeling on the floor, Allison takes the shoe to look at it more closely. Then she screams and throws it away, knocking the other shoe down on the floor. She is still kneeling on the floor, crying, when the door opens and Hedra enters the room. Allison raises her head to look at Hedra."
utter179.1077,utter,HEDRA,Allie ?
desc179.1078,desc,,"Hedra sees the stiletto heel shoe behind the toilet bowl, where it has been knocked away."
utter179.1079,utter,HEDRA,What are you doing down there ?
desc179.1080,desc,,"Allison remains kneeling on the floor, just supporting herself on her arms."
utter179.1081,utter,ALLISON,Oh... I just suddenly felt sick. It was the funniest thing. I hope I'm not pregnant.
desc179.1082,desc,,Hedra walks towards Allison to help her stand up.
utter179.1083,utter,HEDRA,Let me help you.
desc179.1084,desc,,Allison stands up.
utter179.1085,utter,ALLISON,"Oh, that's all right, I'm fine."
utter179.1086,utter,HEDRA,I'll get some water.
desc179.1087,desc,,"Hedra walks to the basin, but wraps her hand in the bottom of her dress before touching the water tap. Allison walks out of the room."
utter179.1088,utter,HEDRA,Wait !
desc179.1089,desc,,"Allison stops at the door, and turns around toward Hedra. Close-up on the mirror above the basin, showing Hedra and Allison standing next to each other."
utter179.1090,utter,HEDRA,Drink some.
desc179.1091,desc,,Allison takes the tooth glass and drinks. Hedra strokes her shoulder.
utter179.1092,utter,HEDRA,Okay ?
desc179.1093,desc,,Allison puts the glass down and shakes her head <<Yes>>. Hedra strokes the back of her head.
utter179.1094,utter,HEDRA,Feeling better ?
utter179.1095,utter,ALLISON,Yeah. I can go out for a while. I feel much better now.
scene180,slugline,,ALLISON'S APARTMENT - FRONT HALL - INTERIOR DAY
desc180.1096,desc,,"Allison walks out of the bathroom, followed by Hedra."
utter180.1097,utter,HEDRA,I thought you said breakfast ?
desc180.1098,desc,,"Allison has reached the front door, and she starts unlocking the door."
utter180.1099,utter,ALLISON,"Oh, it's in the blender. I've got to go out."
desc180.1100,desc,,Hedra looks at Allison thin sleeveless night shirt and smiles.
utter180.1101,utter,HEDRA,Dressed like that?
utter180.1102,utter,ALLISON,I'm out. I'm just going to go upstairs and see Graham. He called while you were out.
desc180.1103,desc,,Hedra looks at Allison with a very strange expression on her face. She can see the tears on Allison's face.
utter180.1104,utter,HEDRA,"Well, still, if you're not feeling well, you should wear more than that."
utter180.1105,utter,ALLISON,Maybe you're right.
desc180.1106,desc,,She walks away to her room. Hedra puts her hand on her face.
utter180.1107,utter,HEDRA,Oh...
scene181,slugline,,ALLISON'S APARTMENT - ALLISON'S BEDROOM - INTERIOR DAY
desc181.1108,desc,,"Allison enters her room coming from the hall. HEDRA (voice over from the hall) Leave the door open so we can talk. Allison grabs a pair of pants and puts them on. Hedra enters slowly in the room, carrying the large paper bag where she has put the gun. Allison takes her night shirt off. She is now naked from the waist up. But she grabs a sweater and puts it on."
utter181.1109,utter,HEDRA,You know why I think you're sick ?
desc181.1110,desc,,"While talking, Hedra slowly slides her hand into the paper bag, takes a pair of black gloves out of the bag and puts the bag down on the floor."
utter181.1111,utter,HEDRA,You're upset about Sam.
desc181.1112,desc,,"Slowly, Hedra puts the black gloves on her hands."
utter181.1113,utter,HEDRA,"You know Sam's dead, don't you ?"
desc181.1114,desc,,Allison turns around to face Hedra.
utter181.1115,utter,HEDRA,"Yeah, we don't have much time."
desc181.1116,desc,,She picks up the bag and walks to a chest of drawers. She puts the bag on the floor and opens the top drawer.
utter181.1117,utter,ALLISON (crying),"You didn't... you didn't do it, Hedy, did you ?"
desc181.1118,desc,,Hedra is taking white pantie and bra from the drawer
utter181.1119,utter,ALLISON (crying),You couldn't have him !
desc181.1120,desc,,"She falls down, sitting on the floor and crying."
utter181.1121,utter,ALLISON,Why ?... Why ?
utter181.1122,utter,HEDRA,"Allie, he came in my mouth. Then he tried to beat the shit out of me because I wanted to tell you."
desc181.1123,desc,,"She slams the drawer shut, and opens another one."
utter181.1124,utter,HEDRA,"You know, it was an accident. But he deserved it."
desc181.1125,desc,,She claps her hands.
utter181.1126,utter,HEDRA,"Okay, come on. The police will be here soon."
desc181.1127,desc,,Allison doesn't move and remains seated on the floor.
utter181.1128,utter,ALLISON,"But... but you shouldn't run. That'll only make it worse. I know you weren't yourself when you did this, Hedy."
desc181.1129,desc,,Hedra laughs.
utter181.1130,utter,HEDRA,I know. I was you.
desc181.1131,desc,,"She points her gloved finger to Allison, and then looks at herself in the mirror."
utter181.1132,utter,HEDRA,Who is this Hedy anyway ?
desc181.1133,desc,,"She turns around, and walks away from the mirror towards Allison."
utter181.1134,utter,HEDRA,"No one's seen her. She's not on the lease. There's not even a fingerprint of hers here. I've been cleaning like crazy. You have to come with me, Allie, or they'd put you away."
utter181.1135,utter,ALLISON,"Hedy, it'll never work. Besides ... people have seen you. We just can't tell. We'll go to a lawyer or a doctor and they'll explain it to the police, or something."
desc181.1136,desc,,"Hedra, who is now very upset, knocks everything, that was on top of the chest of drawer, with a long sweeping movement, down on the floor."
utter181.1137,utter,HEDRA,No.
desc181.1138,desc,,She bends down and takes the gun out of the paper bag.
utter181.1139,utter,HEDRA,Why are you making me do this ?
desc181.1140,desc,,She snaps a cartridge into the chamber of the gun.
utter181.1141,utter,HEDRA,"We're friends, Allie. You could be in a lot of trouble without me. But I'm not going to leave you."
desc181.1142,desc,,"She walks to Allison and kneels on the floor besides her, pointing the gun to her head"
utter181.1143,utter,HEDRA,"That wouldn't be right. I won't leave you. Okay, let's go. Up ! Up ! Up !"
desc181.1144,desc,,She slaps her face.
scene182,slugline,,ALLISON'S BUILDING - LANDING HALL OUTSIDE ALLISON'S APARTMENT - INTERIOR DAY
desc182.1145,desc,,Hedra leads Allison along the hall. She is carrying her paper bag in one hand and the gun in the other hand. She still has her gloves on. Allison is carrying a small plastic case.
utter182.1146,utter,HEDRA,Go ! Go-go-go !
desc182.1147,desc,,"They reach the elevator and Allison is ready to press the call button, but Hedra moves her away towards the staircase."
utter182.1148,utter,HEDRA,"No-no, up to Graham's. Come on. No-no, he's already involved."
scene183,slugline,,ALLISON'S BUILDING - MAIN STAIRCASE - INTERIOR DAY
desc183.1149,desc,,They climb the stairs. Hedra is pushing Allison with her gun.
scene184,slugline,,ALLISON'S BUILDING - LANDING HALL OUTSIDE GRAHAM'S APARTMENT - INTERIOR DAY
desc184.1150,desc,,"They reach Graham's front door. Allison rings the bell, waits a couple of seconds and turns around."
utter184.1151,utter,ALLISON,Nobody's home.
desc184.1152,desc,,Hedra takes some keys out of her bag and gives them to Allison with the gloved hand that is still holding the gun.
utter184.1153,utter,HEDRA,"Use these. Come on, come on, hurry up. Go !"
desc184.1154,desc,,Allison takes the keys and unlocks the door.
utter184.1155,utter,ALLISON,He must be sleeping. We were up late last night.
desc184.1156,desc,,"Hedra seems very nervous. While Allison is unlocking the door, she keeps looking around her and pressing Allison's back with her gun. Allison opens the door, and enters the apartment, followed by Hedra."
utter184.1157,utter,ALLISON,Graham ?
utter184.1158,utter,HEDRA,He can't hear you.
desc184.1159,desc,,Hedra closes the door behind them.
scene185,slugline,,ALLISON'S BUILDING - EXTERIOR DAY
desc185.1160,desc,,"Low angle shot of the building, taken from street level."
scene186,slugline,,GRAHAM'S APARTMENT - CORRIDOR - INTERIOR DAY
utter186.1161,utter,HEDRA (voice over),Wait till you see me.
desc186.1162,desc,,"Hedra comes out of the bathroom, with a dark towel on her head. The cat crosses the corridor and enters the bathroom. Hedra puts her towel down : her hair, instead of being red like Allison's, is now dark brown."
utter186.1163,utter,HEDRA,"Your color was beautiful, but I can't go around looking like you any more, can I ?"
desc186.1164,desc,,She smiles.
scene187,slugline,,GRAHAM'S APARTMENT - LIVING ROOM - INTERIOR DAY
desc187.1165,desc,,Hedra enters the living-room.
utter187.1166,utter,HEDRA,"Okay now, Allie, don't laugh."
desc187.1167,desc,,"She walks in front of the window, and makes a couple of dance steps."
utter187.1168,utter,HEDRA,Ta-dah !
desc187.1169,desc,,"Reverse angle shot on Allison, tied up in an armchair with duct tape. Each one of Allison's arms is tied on each armrest of the armchair. Her legs are tied on the legs of the armchair, and her chest is tied on the back of the armchair. There is also a piece of tape across her face to keep her mouth shut. Hedra laughs and turns the TV set on. The screen shows a documentary about African fauna. Hedra turns the volume slightly up."
utter187.1170,utter,HEDRA,How's that ? Good ?
desc187.1171,desc,,"She puts the remote control on the armrest of the armchair, within easy reach of Allison's right hand. Allison doesn't move at all."
utter187.1172,utter,HEDRA,22 and 24 are the movie channels. I've got to cash a pay cheque. So I'll only be gone an hour. I know how you hate to be alone. Okay... Are you good and comfortable ? All right.
desc187.1173,desc,,"She walks away from the armchair, takes the towel off her neck and down on the back of a chair. She takes her purse."
utter187.1174,utter,HEDRA,"So, well... When I get back, we'll do your hair, too. Okay ? Be good. Bye."
desc187.1175,desc,,"She gets out of the room. Allison moves for the first time : she turns her head around, then looks back at the TV screen. Reverse angle shot. On the TV screen, close up of a lion yawning. Reverse angle shot. Allison looks at the remote control on the armrest. Close up on the remote control. Almost at the top of the remote control, we see the two volume control buttons : up and down. And under those buttons, we see the two channel control buttons. Close up on Allison's face looking at the remote control. Close up on Allison's right hand moving the remote control on the armrest, to get the volume control buttons within reach of her forefinger. She presses the up button. On the TV screen, we see the volume bar graph going up on the picture of a crocodile. And the volume of the music goes up too. Allison looks at the remote control again. Close up on Allison's forefinger pressing one of the channel control buttons. On the screen, we see a different channel : a comic movie. A couple is having dinner in a restaurant and the waiter pours the water bucket on the man. Another channel. A woman is sleeping. A telephone rings. Reverse angle shot on Allison pressing the channel control buttons. We hear a male voice for a couple of second, then Allison changes the channel again. The TV screen seen from behind Allison's hand dialing on the remote control. There is a cartoon on the screen. Then another channel showing the concert of a rock music band. Close up on Allison's face looking at the screen and then at the remote control in her hand. Reverse angle shot on the TV set. The volume bar graph is going up again until it reaches the end of the graph. The volume of the sound of the rock music is very high."
scene188,slugline,,ALLISON'S BUILDING - LANDING HALL OUTSIDE GRAHAM'S APARTMENT - INTERIOR DAY
desc188.1176,desc,,We hear the rock music very loudly in the empty hall. The front door of apartment 1206 opens slowly. A man with glasses on his nose peeks into the hall. He seems very annoyed by the noise.
scene189,slugline,,BANK OFFICE - HALL - INTERIOR DAY
desc189.1177,desc,,"Close up on the hand of Hedra writing <<Ellen Besch>> on the back of a cheque on the cashier's counter. In front of her, we see the hands of the cashier girl on the other side of the glass partition."
scene190,slugline,,CASHIER GIRL (voice over)
desc190.1178,desc,,"What's the part this time ? Larger view of the bank office hall. Hedra is standing in front of the cashier's desk. We see the cashier girl through the partition glass. Behind Hedra, a man is waiting for his turn, reading a newspaper."
utter190.1179,utter,HEDRA,Excuse me ?
desc190.1180,desc,,"Through the opening at the bottom of the partition, she gives her cheque to the girl. Closer shot. Now we are on the cashier's side of the partition, and we see Hedra's face through the glass."
utter190.1181,utter,CASHIER GIRL,"You're an actress, right ? You're never the same person twice."
desc190.1182,desc,,"Reverse angle shot. We are now on Hedra's side of the partition, and we see the cashier girl through the glass : she is a blonde girl about the same age as Hedra. She puts her finger on her own hair."
utter190.1183,utter,CASHIER GIRL,I like it. I just thought the other was more you.
desc190.1184,desc,,Reverse angle shot. Cashier's side.
utter190.1185,utter,HEDRA,"Well, maybe next time I'll try blonde."
desc190.1186,desc,,Reverse angle shot. Hedra's side. The cashier girl smiles.
utter190.1187,utter,CASHIER GIRL,Really ? I'm flattered. Thanks.
desc190.1188,desc,,"A male bank clerk, sitting at a desk behind the cashier girl, stands up and walks to the partition glass."
utter190.1189,utter,BANK CLERK,Miss Besch ?
utter190.1190,utter,HEDRA,Yes ?
utter190.1191,utter,BANK CLERK,A man's been calling here. Says he's your father.
desc190.1192,desc,,Reverse angle shot. Cashier's side. Hedra seems worried by what the man is saying. BANK CLERK (voice over)
desc190.1193,desc,,Hedra runs away from the counter. BANK CLERK (voice over) Miss Besch !
scene191,slugline,,GRAHAM'S APARTMENT - LIVING ROOM - INTERIOR DAY
desc191.1194,desc,,"On the TV set, the rock band is still playing with the sound volume very loud. Reverse angle shot on Allison, trying to free herself from the armchair where she is tied up. But the duct tape is strong enough and her jerky movements don't bring any result."
scene192,slugline,,ALLISON'S BUILDING - LANDING HALL OUTSIDE GRAHAM'S APARTMENT - INTERIOR DAY
desc192.1195,desc,,"Outside Graham's apartment. We hear the loud rock music very clearly. The building manager is standing by the door, with the neighbor from apartment 1206 behind him. The neighbor has his glasses hanging around his neck on a string. The building manager rings the bell. Then he bangs on the door with his fist."
utter192.1196,utter,BUILDING MANAGER,Hey !
scene193,slugline,,GRAHAM'S APARTMENT - LIVING ROOM - INTERIOR DAY
desc193.1197,desc,,Allison turns her head towards the front door and try to speak through the tape stuck on her mouth.
utter193.1198,utter,ALLISON,Mmmm !
desc193.1199,desc,,"She starts moving again to free herself from the armchair, but she doesn't succeed. The bell rings again. Allison turns her heard towards the front door."
scene194,slugline,,A BUSY STREET IN NEW-YORK - EXTERIOR DAY
desc194.1200,desc,,"Hedra is walking very fast on the sidewalk. She passes a fruit shop and bumps into a pedestrian girl, but doesn't stop to apologize."
scene195,slugline,,THE PEDESTRIAN GIRL
desc195.1201,desc,,Hedra keeps on walking very fast. She seems worried.
scene196,slugline,,ALLISON'S BUILDING - LANDING HALL OUTSIDE GRAHAM'S APARTMENT - INTERIOR DAY
desc196.1202,desc,,The manager has a key ring with many keys in his hand. He is sorting them trying to find the right key to the apartment.
scene197,slugline,,ALLISON'S BUILDING - MAIN LOBBY - INTERIOR DAY
desc197.1203,desc,,"Hedra is crossing the lobby, walking very fast. She reaches the elevator and presses the call button."
scene198,slugline,,GRAHAM'S APARTMENT - LIVING ROOM - INTERIOR DAY
desc198.1204,desc,,"On the TV screen, a video clip with loud rock music behind. Reverse angle shot on Allison, still trying to free herself from the armchair."
scene199,slugline,,ALLISON'S BUILDING - LANDING HALL OUTSIDE GRAHAM'S APARTMENT - INTERIOR DAY
desc199.1205,desc,,Close up on the manager's hand putting the key in the keyhole.
scene200,slugline,,GRAHAM'S APARTMENT - LIVING ROOM - INTERIOR DAY
desc200.1206,desc,,"Allison hears the key moving in the keyhole and turns her head towards the front door. Close up on the video clip : a man is running, apparently chased by men armed with spears."
scene201,slugline,,ALLISON'S BUILDING - LANDING HALL OUTSIDE GRAHAM'S APARTMENT - INTERIOR DAY
desc201.1207,desc,,Hedra just came out of the elevator and is closing the inner door of the cabin. She turns the corner of the hall and suddenly sees the manager and the neighbor near Graham's door. She runs towards them and yells.
utter201.1208,utter,HEDRA,Oh !
desc201.1209,desc,,"The apartment door is wide open, but, when they see Hedra, the two men don't enter the apartment. The neighbor goes back into his own apartment, but the manager remains just outside the apartment."
utter201.1210,utter,BUILDING MANAGER,You live here ?
desc201.1211,desc,,"Hedra closes the door to talk to the manager, but she doesn't lock it."
utter201.1212,utter,HEDRA,"No, no, I'm just watching the place for the week-end like that. It's on a timer. Huh... Huh... I'm sorry."
utter201.1213,utter,BUILDING MANAGER,I have to register a complaint.
utter201.1214,utter,HEDRA,"Please, I'll turn it off. I will."
desc201.1215,desc,,She enters the apartment and closes the door shut behind her.
scene202,slugline,,GRAHAM'S APARTMENT - LIVING ROOM - INTERIOR DAY
desc202.1216,desc,,"Allison turns her head towards the front door. Hedra enters the room, walking very fast. She drops her purse on a chair and walks to the TV set. She switches it off. Then she walks slowly towards Allison, with a quite menacing face. She gives Allison a very hard slap in the face. She kneels down in front of her, and shakes her shoulders a couple of times. Then she stops but remains kneeling on the floor, while she's talking to her."
utter202.1217,utter,HEDRA,"How could you do that ? Everything I've done, I've done for you. Don't you understand that ? People you hated, I hated."
desc202.1218,desc,,She stands up.
utter202.1219,utter,HEDRA,People like you don't care.
desc202.1220,desc,,She knocks a large metal vase down on the floor.
utter202.1221,utter,HEDRA,"Just like that stupid girl in Tampa. She called my parents, too. Told them all my secrets."
desc202.1222,desc,,She comes behind Allison and pulls her hair to tilt her head back.
utter202.1223,utter,HEDRA,"You want to put me away, huh ?"
desc202.1224,desc,,She releases Allison's hair.
utter202.1225,utter,HEDRA,"I can't... I can't keep making excuses for you, Allie. I can't... I can't... I can't... I can't... I can't..."
desc202.1226,desc,,She walks out of the room. She is crying.
utter202.1227,utter,HEDRA,Oh God !... Oh God !... Ohhh !
