segment-id,segment-type,segment-speaker,segment-text
desc82.647,desc,,VICTORIA walks away and steps behind her desk.
utter82.648,utter,VICTORIA,You may go.
desc82.649,desc,,"LADY ELY bows and walks out. VICTORIA stares at the desk a moment, then picks up her pen and tries to work. She cannot."
scene83,slugline,,"INT. WINDSOR CASTLE, BROWN'S QUARTERS - DAY"
desc83.650,desc,,"BROWN sits on the edge of the bed in only his undergarments. His face, arms, legs and fingers are livid with bruises, but he sits there, stiff-backed and gritting his teeth, while ARCHIE crouches in front of him, tending to his wounds."
utter83.651,utter,BROWN,And she sent no word down?
utter83.652,utter,ARCHIE,They said you were drunk. (beat) Why don't you tell her the truth?
utter83.653,utter,BROWN,She'll think it's her fault for keeping me.
desc83.654,desc,,ARCHIE completes one of the dressings when BROWN suddenly reaches back and starts trying to put on his shirt.
utter83.655,utter,ARCHIE,What are you doing?!
utter83.656,utter,BROWN,I'm getting dressed.
utter83.657,utter,ARCHIE,"You've got three broken ribs, man!"
utter83.658,utter,BROWN,I've got my duties to attend to.
utter83.659,utter,ARCHIE,Don't be an idiot! You're in no fit state to go anywhere.
utter83.660,utter,BROWN,She'll be worried about me.
utter83.661,utter,ARCHIE,She'll get over it.
utter83.662,utter,BROWN,"I can't let her down now, Archie."
utter83.663,utter,ARCHIE,"And when was the last time she put herself out for you? Look, John, whatever she says to you now, in the end you're still a servant."
utter83.664,utter,BROWN,"Oh, I'm much more than that."
utter83.665,utter,ARCHIE,"Aye, she may say that to you, but the woman can say what she wants."
utter83.666,utter,BROWN,You watch your tongue.
utter83.667,utter,ARCHIE,"Come on, man, I'm telling you what you already know."
utter83.668,utter,BROWN,You know nothing about her!
utter83.669,utter,ARCHIE,"When are you gonna see it, John? She doesn't give a damn about you."
desc83.670,desc,,"BROWN lunges for the bedside drawer and pulls out a card showing a coy picture of a pretty woman. He holds it up, eyes blazing."
utter83.671,utter,BROWN,From the Queen!
desc83.672,desc,,He reads out the inscription.
utter83.673,utter,BROWN (CONT'D),"My lips may give a message better of Christmas love than e'en this letter. (beat) To my best friend, J.B. from his best friend, V.R. (he thrusts it in his brother's face) Best friend!"
utter83.674,utter,ARCHIE,Aye.
utter83.675,utter,BROWN,She means it.
desc83.676,desc,,ARCHIE stares at him.
utter83.677,utter,ARCHIE,"She'll drop you. When she's done with you, she'll drop you."
utter83.678,utter,BROWN,Get out. (beat) Out!
desc83.679,desc,,ARCHIE steps back but BROWN roars at him.
utter83.680,utter,BROWN (CONT'D),OUT!!
desc83.681,desc,,ARCHIE steps outside and BROWN is left alone.
scene84,slugline,,"INT. WINDSOR CASTLE, QUEEN'S SITTING ROOM - DAY"
desc84.682,desc,,The next day. VICTORIA sits at her desk. PONSONBY hands her letters to sign.
utter84.683,utter,PONSONBY,... to be followed by a visit from Lady Bridport. She is keen to secure a place for her niece as Maid of Honor.
desc84.684,desc,,VICTORIA signs the last letter and sits back.
utter84.685,utter,VICTORIA,I am tired.
desc84.686,desc,,PONSONBY coughs.
utter84.687,utter,PONSONBY,There is one other matter.
utter84.688,utter,VICTORIA,What is it?
utter84.689,utter,PONSONBY,"I have a letter, ma'am."
utter84.690,utter,VICTORIA,From whom?
utter84.691,utter,PONSONBY,From Princess Helena and other members of your family.
utter84.692,utter,VICTORIA,(stiffening defensively) My family is quite capable of communicating with the Queen in person.
desc84.693,desc,,"PONSONBY does not reply. Finally, VICTORIA is obliged to ask."
utter84.694,utter,VICTORIA (CONT'D),What do they want?
utter84.695,utter,PONSONBY,They are demanding the dismissal of John Brown on grounds of drunkeness.
desc84.696,desc,,"VICTORIA stares through the window, expressionless."
scene85,slugline,,"INT. WINDSOR CASTLE, CHAPEL - DAY"
desc85.697,desc,,"VICTORIA walks through the ornate chapel, nervously fingering her handkerchief. Waiting for her, smiling softly, is the Dean of Windsor, DEAN WELLSELLY."
utter85.698,utter,DEAN WELLSELLY,"You wished to see me, ma'am?"
desc85.699,desc,,"She holds his eyes for a moment, then nods."
scene86,slugline,,"INT. WINDSOR CASTLE, CHAPEL - DAY"
desc86.700,desc,,"A few minutes later, VICTORIA and DEAN WELLSELLY are seated in a corner of the chapel, talking softly. She cannot bring herself to look at him and so does not notice how carefully he is watching her throughout the interview. This is incredibly hard for her to say, but she struggles to be as honest as possible."
utter86.701,utter,VICTORIA,"My husband tried always to make me think more subtly. Of course he taught me so much and I can never repay my debt to him, or the love I feel, even now. But, in truth, I think I am someone who can only feel things while they are alive to me. For that reason, I know I do not have a subtle mind. I know that. But I work hard and I try to do my duty. (she hesitates; she is struggling now) However, I have noticed of late that my feelings of grief are not so strong and -- that I find myself leaning more upon the comfort of living friends. (beat) Friends close to me now."
desc86.702,desc,,"She stops herself. She is crying. DEAN WELLSELLY watches her a moment, then speaks close, choosing his words carefully."
utter86.703,utter,DEAN WELLSELLY,"Your Majesty, a settled resignation is more lasting proof of affection than active grief. If the good Lord sees fit to bring one into contact with congenial fellow beings, one should not analyze one's reaction too deeply. To allow oneself to be comforted by someone else need not imply any disloyalty to the memory of the loved one."
desc86.704,desc,,"Silence. VICTORIA stares into the long, dark chapel. Gradually, as she takes in the tone of his remarks, her disappointment turns to anger."
scene87,slugline,,"INT. WINDSOR CASTLE, QUEEN'S SITTING ROOM - DAY"
desc87.705,desc,,"The next day, VICTORIA stands at the far window and her back to the room. Lined up against the wall are BERTIE and his siblings."
utter87.706,utter,VICTORIA,Sir Henry.
desc87.707,desc,,PONSONBY steps forward.
utter87.708,utter,PONSONBY,Ma'am?
utter87.709,utter,VICTORIA,"Please tell the Princess, and other signatories to this letter, that the Queen will not be dictated to, or made to alter, in any way, what she has found to answer for her comfort. (beat) Do I make myself clear?"
utter87.710,utter,PONSONBY,Ma'am.
desc87.711,desc,,A beat.
utter87.712,utter,VICTORIA,You may go.
desc87.713,desc,,They all file out.
scene88,slugline,,EXT. THE GROUNDS OF WINDSOR CASTLE - DAY A few days later.
desc88.714,desc,,"BROWN and VICTORIA are riding on horseback. Although better than he was, BROWN'S face is still badly bruised. They turn a corner banked by trees. BROWN is watching the QUEEN closely. She stops."
utter88.715,utter,VICTORIA,I would like to get down.
desc88.716,desc,,"Without a word, BROWN dismounts and helps her off her horse."
utter88.717,utter,VICTORIA (CONT'D),John?
utter88.718,utter,BROWN,"Yes, ma'am?"
utter88.719,utter,VICTORIA,I was told you were in a fight.
utter88.720,utter,BROWN,"Yes, ma'am."
utter88.721,utter,VICTORIA,Has someone seen to those bruises?
utter88.722,utter,BROWN,"Yes, ma'am."
desc88.723,desc,,A beat.
utter88.724,utter,BROWN (CONT'D),Ma'am?
utter88.725,utter,VICTORIA,Yes?
utter88.726,utter,BROWN,"Having considered my position here at court, I have come to the conclusion that it is in the best interest of Your Majesty that I should resign."
utter88.727,utter,VICTORIA,I do not accept.
desc88.728,desc,,A beat.
utter88.729,utter,BROWN,I had foreseen that you would not. But Your Majesty should understand -- that my mind will not be changed in this. I leave for Deeside --
utter88.730,utter,VICTORIA,"(cutting in) The Queen forbids it. (beat) I cannot allow it because I cannot live without you. Without you, I cannot find the strength to be who I must be. Please."
desc88.731,desc,,"She takes his hand to her mouth and kisses it gently, then looks at him, utterly helpless."
utter88.732,utter,VICTORIA (CONT'D),Promise me you won't let them send me back.
desc88.733,desc,,A long silence. BROWN holds her hand tight.
utter88.734,utter,BROWN,I promise.
scene89,slugline,,EXT. LOWLANDS - DAY A few weeks later.
desc89.735,desc,,A tiny horse-drawn carriage creeps across a huge Highland landscape.
utter89.736,utter,DISRAELI (V.O.),"Yesterday, Gladstone talked for three hours on the Irish Church Bill ... I am as guilty as the rest of underestimating his reforming zeal. Tory days may be numbered, but I fancy there yet remains one last hope of deliverance. Wheresoever the blame lies, we must now close ranks and defend Mrs Brown's England. As for my interminable journey to the land of Calvin, oatcakes and sulphur ..."
scene90,slugline,,EXT. BALMORAL CASTLE - DAY
desc90.737,desc,,DISRAELI hurries through the pouring rain.
utter90.738,utter,DISRAELI (O.S.),... no Prime Minister made greater sacrifice than attempting to run the country six hundred miles north of civilization.
desc90.739,desc,,"Reaching the castle, he hurries inside and the great doors bang behind him."
scene91,slugline,,"INT. BALMORAL CASTLE, QUEEN'S DRAWING ROOM - DAY The next day."
desc91.740,desc,,"QUEEN VICTORIA is playing the piano like she walks, with great vim and vigor. The tune is some quaint Scottish ballad which she belts out in her clear strong voice, almost drowning out PRINCE ARTHUR, PRINCE LOUISE and PRINCE LEOPOLD who are meant to be accompanying her. They stand in a nervous semi-circle, fumbling their harmonies. Ignoring them completely, VICTORIA bobs up her head with a quizzical smile to make sure she is being appreciated. DISRAELI and the rest of the HOUSEHOLD stand a few yards off, smiling rigidly. DISRAELI, the consummate politician to his inch-high insteps, out-smiles the lot of them. This man is in raptures of delight. And the more liquid his smiles, the happier he makes VICTORIA. He beams, she belts, until her children are drowned out completely. And then, with characteristic suddenness, VICTORIA stops playing and launches into one of her tirades. The HOUSEHOLD wobbles in shock like children on a switch-back, but DISRAELI glides smoothly from delight to sober concern."
utter91.741,utter,VICTORIA,"How dare the Irish break with the Anglicans? If Albert were alive today he would never allow the Crown to give up Church patronage. No, the Irish must be told, very firmly, to stay exactly where they are. It is the thin edge of the wedge, Mr Disraeli. Next, you will be telling me that the Crown no longer governs this nation."
desc91.742,desc,,A beat. A nervous silence in the Household.
utter91.743,utter,DISRAELI,"Your Majesty remains at the very epicenter of governance. As for your people, look no further than the sales of your Highland Journals to see in what affection the nation holds their Queen. (beat) You sell even more copies than Mr Dickens."
utter91.744,utter,VICTORIA,"But I lack your prose, Mr Disraeli."
desc91.745,desc,,"VICTORIA gives him a tiny smile. DISRAELI acknowledges it, then steers the conversation back."
utter91.746,utter,DISRAELI,Of course I understand your concern. You miss your people. (a pause) And they miss you.
desc91.747,desc,,VICTORIA registers a slight flicker of defensiveness at the implied criticism.
utter91.748,utter,VICTORIA,Then they may read about me.
utter91.749,utter,DISRAELI,"Indeed, and for that they are eternally grateful."
utter91.750,utter,VICTORIA,Is that not enough?
utter91.751,utter,DISRAELI,In so many ways ... and yet it is your presence they crave. A figurehead.
desc91.752,desc,,VICTORIA has the measure of him.
utter91.753,utter,VICTORIA,"I never thought to be bullied by you, Mr Disraeli. You, I thought, understood a widow's grief."
utter91.754,utter,DISRAELI,"Forgive me, ma'am, I cannot speak for the nation, only for myself. As Prime Minister I confess I miss your presence, but that is only an expression of my own selfish desires and I should not burden you with it."
desc91.755,desc,,"The Household waits. Has he clawed himself back? VICTORIA acknowledges his apology. Her voice drops and she talks directly to DISRAELI, straight from the heart."
utter91.756,utter,VICTORIA,I stay here because I am happy. (beat) Is that such a terrible crime?
utter91.757,utter,DISRAELI,"No, ma'am."
desc91.758,desc,,At this moment the far door opens and BROWN walks in.
utter91.759,utter,BROWN,Time for your walk.
desc91.760,desc,,"Without a word, VICTORIA rises from her chair and starts following him out. As they pass DISRAELI, she stops."
utter91.761,utter,VICTORIA,This is my good John Brown.
utter91.762,utter,DISRAELI,(taking him in) Yes.
utter91.763,utter,VICTORIA,I have asked him to show you a little of Highland life while you are with us at Balmoral.
desc91.764,desc,,BROWN measures DISRAELI suspiciously.
utter91.765,utter,BROWN,What brings you here?
utter91.766,utter,DISRAELI,A man can refuse only so many invitations from his Queen. It was remiss of me not to come earlier.
desc91.767,desc,,VICTORIA smiles. BROWN stares.
utter91.768,utter,BROWN,What do you know about the Highlands?
utter91.769,utter,DISRAELI,I am a blank sheet.
utter91.770,utter,BROWN,Do you hunt?
utter91.771,utter,DISRAELI,Occasionally.
utter91.772,utter,BROWN,Dare say you can be taught.
utter91.773,utter,DISRAELI,"To shoot perhaps, but not to kill."
utter91.774,utter,BROWN,"If you hunt, you kill."
desc91.775,desc,,DISRAELI counters effortlessly.
utter91.776,utter,DISRAELI,"Well then, I'll do my best."
scene92,slugline,,"EXT. HIGHLANDS, GLEN GELDER - DAY"
desc92.777,desc,,"Staying close to the ground we develop through a series of shots showing the other highlands -- sheet rain against heather and gorse, rivulets of water slashing through mud, crude pathways sliding in wind and all ball-breakingly cold. Coming up the hill, we begin to make out a hunting party. The sound first. Like a small army, crashing their way up the winding path. GHILLIES urging on their horses and dogs, guns and equipment jangling off pony-hacks an then the tall figure of JOHN BROWN striding out in front. Making no concession to anyone, he force-marches them up the hill, eyes on the hunt ahead. Behind them trot the men on horseback -- DISRAELI, PONSONBY, BERTIE and other GENTLEMEN, each led by GHILLIES and ATTENDANTS, among them ARCHIE. Suddenly, BROWN stops and raises a hand. The party halts. He listens for a second. Satisfied that he has found his quarry, he brings his hand down and the party of gentlemen dismount as quietly as they can. As he waits, BROWN winces slightly from the pain in his side. He pulls a flask of whiskey from his sporran and drinks. All the time, DISRAELI keeps his eyes on BROWN."
scene93,slugline,,"EXT. HIGHLANDS, GLEN GELDER - DAY"
desc93.778,desc,,"The stalking. Everyone is now fanned out along the hillside, a ghillie to each gentleman, slowly and silently moving up the hill. DISRAELI stalks with BROWN, panting hard to keep up, eyes on his man, trying to make no sound. Suddenly, BROWN stops. Very slowly he rises. DISRAELI rides alongside and sees ... A huge stag staring majestically across the hillside. Keeping his movements smooth and slow, BROWN brings up his rifle, cocks it and offers DISRAELI the kill. With a deferential gesture of the hands, DISRAELI declines. BROWN stares at him a split-second, raises the rifle to his shoulder and fires."
scene94,slugline,,"EXT. HIGHLANDS, GLEN GELDER - DAY"
desc94.779,desc,,"The kill. A rapid montage of guns firing, as we cut to ..."
scene95,slugline,,INT. BALMORAL CASTLE - DAY
desc95.780,desc,,"BROWN sweeps in from the hunt, DISRAELI dripping at his side."
utter95.781,utter,BROWN,"(demonstrating with his rifle) Always remember, you keep it tight to your shoulder, you absorb the kick. Aim for the head. Then imagine it's Gladstone."
utter95.782,utter,DISRAELI,(smiling) Quite.
desc95.783,desc,,"BROWN pulls out his flask and offers some to DISRAELI, who declines. He watches BROWN take a long swig."
scene96,slugline,,"INT. BALMORAL CASTLE, UPPER SERVANT'S TABLE - NIGHT That night."
desc96.784,desc,,"BROWN is standing at his place, drinking steadily. He has a sheet of paper and a pen and is ticking off a list. Lined up in front of him, trying desperately not to laugh, are five or six UPPER SERVANTS including the pretty ASSISTANT DRESSER and BERTIE'S VALET. They each step up, one at a time, to make their report."
utter96.785,utter,BROWN,"(ticking as he goes) ... Back doors, West Wing."
utter96.786,utter,UPPER SERVANT 1,"Checked and locked, sir."
desc96.787,desc,,"Side doors, East Wing."
utter96.788,utter,ASSISTANT DRESSER,"Checked and locked, sir."
utter96.789,utter,BROWN,"Louder, girl!"
utter96.790,utter,ASSISTANT DRESSER,"(creasing up) Checked and locked, sir."
utter96.791,utter,BROWN,Kitchen and lower house.
utter96.792,utter,BERTIE'S VALET,"Checked and locked, sir."
utter96.793,utter,BROWN,Back and upper corridors.
utter96.794,utter,UPPER SERVANT 2,"Checked and locked, sir."
utter96.795,utter,BROWN,Front door. (beat) Checked and locked.
desc96.796,desc,,"Folding up the paper, BROWN downs his glass of whiskey and sits. On his nod, dinner is served by UNDER SERVANTS amid a clatter of cutlery and chat. ARCHIE looks across at his brother but BROWN is hunched over his plate, pecking at his food. Someone titters and ARCHIE looks up. BERTIE'S VALET coughs. BROWN slowly lifts his head. His eyes have the slightly unfocused look of too much drink. It is clear to ARCHIE that he is about to be sent-up."
utter96.797,utter,BERTIE'S VALET,"(with a smug smile) Did you see any Irish assassins today, Mr Brown?"
desc96.798,desc,,Brown doesn't react.
utter96.799,utter,BERTIE'S VALET (CONT'D),We heard the dogs were Fenian sympathizers.
desc96.800,desc,,Brown drinks.
scene97,slugline,,BERTIE'S VALET (CONT'D)
desc97.801,desc,,Everyone bursts out laughing. Brown slams down his glass.
utter97.802,utter,BROWN,There's not a soul here cares about that wee woman's safety except me! She'd die in a ditch if I wasn't there to look out for her --
desc97.803,desc,,"He stops. ARCHIE has come across to his brother's chair and pulls gently on his arm. BROWN stares at the SERVANTS. Everyone is about to burst out laughing. Keeping his dignity, he pushes back his chair and lets ARCHIE lead him away. As BROWN reaches the double doors, the laughter hits him in the back like a wave. ARCHIE holds him steady."
scene98,slugline,,"INT. BALMORAL CASTLE, BROWN'S QUARTERS - NIGHT"
desc98.804,desc,,"BROWN is lying on a grubby bed. ARCHIE is looking around the untidy room. For the first time, he notices a thick manuscript on the table. BROWN follows his eyes."
utter98.805,utter,ARCHIE,What's this?
utter98.806,utter,BROWN,It's a diary.
utter98.807,utter,ARCHIE,Be careful who sees it.
utter98.808,utter,BROWN,What do you take me for?
desc98.809,desc,,ARCHIE turns back to BROWN.
utter98.810,utter,ARCHIE,You should have someone look after you.
utter98.811,utter,BROWN,I'm all right. I just need to rest up a wee bit. (feeling everything spin) The room ... You don't have to stay.
desc98.812,desc,,BROWN shuts his eyes and starts to drift. ARCHIE watches over him.
utter98.813,utter,ARCHIE,The place is a mess.
utter98.814,utter,BROWN,I can't move to tidy.
utter98.815,utter,ARCHIE,It's what the maids are for.
utter98.816,utter,BROWN,I'm not having some prattler going through my things.
desc98.817,desc,,A beat.
utter98.818,utter,ARCHIE,"Won't you give yourself a rest, John? She's other people to look out for her."
utter98.819,utter,BROWN,"She needs me, Archie. She canna do without me, she said it to my face. (his hands come up to cover his eyes) How can I stop now?"
scene99,slugline,,"INT. BALMORAL CASTLE, SERVANT'S CORRIDOR - DAY Dawn the next morning."
desc99.820,desc,,BROWN is scrambling into his jacket as he hurries down the stairs.
scene100,slugline,,EXT. BALMORAL CASTLE - DAY
desc100.821,desc,,"BROWN crashes out of a side-door -- just fully dressed -- to be met by the smiling figure of DISRAELI. He is got up in smart walking boots, plus-fours and a tweed jacket."
utter100.822,utter,BROWN,You sent for me.
utter100.823,utter,DISRAELI,I've been called back to London. My last day. I thought I might take a walk on Lochnagar.
desc100.824,desc,,BROWN stares straight back.
scene101,slugline,,EXT. LOCHNAGER - DAY
desc101.825,desc,,"An hour later, BROWN leads DISRAELI up the hill. BROWN has his head down, on with the job. DISRAELI slows to a halt."
utter101.826,utter,DISRAELI,"Princes and Lords are but the breath of kings, An honest man's the noblest work of God. (beat) You must miss such magnificent views."
utter101.827,utter,BROWN,I don't think about it.
desc101.828,desc,,They reach the top and continue along the high ground. DISRAELI glances at BROWN and notices the limp.
utter101.829,utter,DISRAELI,"Forgive me, I've called you out and you should have been resting."
utter101.830,utter,BROWN,I'm fine.
utter101.831,utter,DISRAELI,You're injured.
utter101.832,utter,BROWN,It's nothing.
utter101.833,utter,DISRAELI,"Still, someone must attend you. Your wife should not have let you out."
utter101.834,utter,BROWN,I'm not married.
utter101.835,utter,DISRAELI,(deadpan) Oh.
utter101.836,utter,BROWN,This is the top.
desc101.837,desc,,"DISRAELI admires the view for a moment, then continues."
utter101.838,utter,DISRAELI,"I confess, I sometimes feel as if I am not married myself, I see my wife so little. But I'm forgetting the rewards."
desc101.839,desc,,He looks across. BROWN keeps staring ahead.
utter101.840,utter,DISRAELI (CONT'D),The look on their faces when one walks into the room. Still gives one a ridiculous thrill.
utter101.841,utter,BROWN,I wouldn't know.
utter101.842,utter,DISRAELI,Surely --
utter101.843,utter,BROWN,"(interrupts) What I do, I do for my Queen."
utter101.844,utter,DISRAELI,Was there never ambition?
utter101.845,utter,BROWN,"(beat) Maybe, once."
utter101.846,utter,DISRAELI,Then I envy yo.
utter101.847,utter,BROWN,Why?
utter101.848,utter,DISRAELI,"To have achieved one's ambition, or to have reconciled oneself to its limits, is a lifetime's work."
utter101.849,utter,BROWN,I do what I do.
utter101.850,utter,DISRAELI,For Her Majesty.
utter101.851,utter,BROWN,Aye.
utter101.852,utter,DISRAELI,But yourself? (beat) What about John Brown?
utter101.853,utter,BROWN,I said. (beat) I serve the Queen.
utter101.854,utter,DISRAELI,No other aspiration?
desc101.855,desc,,BROWN stares for a long moment. Finally he speaks.
utter101.856,utter,BROWN,To see her safe.
desc101.857,desc,,DISRAELI steps a little closer.
utter101.858,utter,DISRAELI,You will not be unaware of the threat now posed by Republicanism.
utter101.859,utter,BROWN,Why do you think I keep her here?
utter101.860,utter,DISRAELI,"Ah, but therein lies the paradox. It is her very isolation that encourages the malcontents. The longer she is away, the stronger they become; and who, honestly, can promise security against that? However many doors you lock, someone will always get in. Even here."
desc101.861,desc,,"BROWN watches him, eyes alert."
utter101.862,utter,BROWN,So...?
utter101.863,utter,DISRAELI,"The truth is, the Queen would be safer doing her duty and returning south to her public. John Bull loves her and John Bull is her best defense."
utter101.864,utter,BROWN,Her mind is set. She won't change now.
utter101.865,utter,DISRAELI,"She trusts you, John."
desc101.866,desc,,"DISRAELI is right on his shoulder now, like his own voice."
utter101.867,utter,BROWN,They don't see it.
utter101.868,utter,DISRAELI,See what?
utter101.869,utter,BROWN,"The threat. (beat) I tell them, but they don't see it."
utter101.870,utter,DISRAELI,They aren't as watchful as you.
utter101.871,utter,BROWN,Too busy looking after themselves.
utter101.872,utter,DISRAELI,The greasy pole.
utter101.873,utter,BROWN,No loyalty.
utter101.874,utter,DISRAELI,No love.
desc101.875,desc,,Silence. For a moment BROWN seems unaware that someone else has said that.
utter101.876,utter,BROWN,I promised to protect her from people like you.
utter101.877,utter,DISRAELI,"For once in my life, I am not the issue."
utter101.878,utter,BROWN,She'll never understand it.
utter101.879,utter,DISRAELI,"In time, she will."
utter101.880,utter,BROWN,She'll think I betrayed her.
utter101.881,utter,DISRAELI,But others will know that you acted for the greater good.
desc101.882,desc,,BROWN stares off into the distance.
scene102,slugline,,EXT. LOCH MUICK - DAY The next day.
desc102.883,desc,,"BROWN is rowing VICTORIA across the loch. The EQUERRIES wait on the shore. VICTORIA trails her hand in the water, frowning at the surface. BROWN concentrates on the oars, slipping them carefully through the water."
utter102.884,utter,VICTORIA,I received a letter today from Mr Disraeli. Parliament is calling for my return to public duties. (beat) Why won't they let us be?
desc102.885,desc,,BROWN does not answer.
utter102.886,utter,VICTORIA (CONT'D),"He insists that the country expects me to preside over the opening of the new session. I refuse to offer sustenance to enable his weakening grip. Besides, you know how much I should hate it. It frightens me."
desc102.887,desc,,She notices that BROWN has said nothing.
utter102.888,utter,VICTORIA (CONT'D),John?
desc102.889,desc,,BROWN does not look at her. Finally:
utter102.890,utter,BROWN,We can't always have what we wish.
desc102.891,desc,,VICTORIA stares at him.
scene103,slugline,,"INT. BALMORAL CASTLE, QUEEN'S DRAWING ROOM - DAY Later that day."
desc103.892,desc,,"VICTORIA and BROWN are in the middle of a blazing row in front of the entire Household, including PONSONBY, JENNER and LADY ELY."
utter103.893,utter,VICTORIA,Duty?! You talk about duty?!
utter103.894,utter,BROWN,"If duty and safety are served by the same end then, aye, I do."
