segment-id,segment-type,segment-speaker,segment-text
desc52.400,desc,,"Across the room, STANLEY spots BERTIE amid a crowd of acolytes."
utter52.401,utter,STANLEY,I see the Prince of Wales is here.
utter52.402,utter,DISRAELI,I hope he got his mother's permission.
desc52.403,desc,,"STANLEY smiles faintly. DISRAELI homes in on a punter and raises his hand, already working the room."
utter52.404,utter,DISRAELI (CONT'D),Lord Salisbury!
scene53,slugline,,"INT. A SOCIETY PARTY, LONDON - DAY"
desc53.405,desc,,The society party is hotting up. STANLEY is deep in conversation with three SOCIETY LADIES.
utter53.406,utter,SOCIETY LADY 1,(ridiculously pleased with herself) Why is the Queen penny-wise and pound foolish? Because she looks after the Browns and lets the sovereigns take care of themselves!
desc53.407,desc,,"A peal of naughty laughter. Unseen, DISRAELI steps up."
utter53.408,utter,DISRAELI,And in your opinion? Is she foolish?
desc53.409,desc,,The SOCIETY LADY stares blankly back.
utter53.410,utter,SOCIETY LADY 1,"Well I ... well, I mean to say, it's hardly right, is it?"
utter53.411,utter,DISRAELI,What?
utter53.412,utter,SOCIETY LADY 1,"Well, the Queen and -- (appalled whisper) Mr Brown."
desc53.413,desc,,"DISRAELI stares at her steadily, already thinking ahead."
utter53.414,utter,DISRAELI,La superstition met le monde entier en flammes.
utter53.415,utter,SOCIETY LADY 2,(thick as shit) I beg your pardon?
utter53.416,utter,DISRAELI,(changing tack) Has anybody seen this ... Mr Brown?
utter53.417,utter,STANLEY,"He is her personal servant, I believe."
utter53.418,utter,SOCIETY LADY 1,(knowingly) Follows her wherever she goes.
utter53.419,utter,DISRAELI,He would hardly make a very good personal assistant if he did not.
scene54,slugline,,"INT. ESTATE COTTAGE, BALMORAL - DAY"
desc54.420,desc,,"BROWN stands by a wall, smiling to himself at the sight of QUEEN VICTORIA struggling to help lay the table while MRS GRANT nervously prattles on."
utter54.421,utter,MRS GRANT,"... it's not my best china. I mean, it is my best china now, but the family set got stolen last summer."
utter54.422,utter,VICTORIA,"Oh, I'm so sorry ..."
utter54.423,utter,MRS GRANT,Of course it was no-one on the Estate. More likely one of the lads from Braemar. Or further even. (beat) I'll fetch the salt.
desc54.424,desc,,MRS GRANT scurries away. VICTORIA immediately holds up the spoons to BROWN with a questioning look -- above or beside the plate? He nods her to the top and she quickly carries on.
scene55,slugline,,"INT. A SOCIETY PARTY, LONDON - DAY"
desc55.425,desc,,DISRAELI and MARY ANNE stand with BERTIE and his ACOLYTES.
utter55.426,utter,BERTIE,Mr Disraeli. Ma'am.
utter55.427,utter,DISRAELI,Your Royal Highness. What a pleasure to see you here.
utter55.428,utter,BERTIE,Have you met Mr Lyle? He's in sugar...?
utter55.429,utter,DISRAELI,I don't think I've had that pleasure.
desc55.430,desc,,DISRAELI shakes hands with the fat sugar tycoon who wobbles with drink. MARY ANNE engages him in conversation while BERTIE turns DISRAELI aside.
utter55.431,utter,BERTIE,No doubt you've heard the rumors.
utter55.432,utter,DISRAELI,"I take no account of gossip, Your Highness."
utter55.433,utter,BERTIE,My concern is for the reputation of the Monarchy.
utter55.434,utter,DISRAELI,Of course.
utter55.435,utter,BERTIE,I fear the influence he has on her. The man's word is not to be credited. He is an arriviste of the very lowest water. (beat) She's having a bust cast of him. In Nero Marquino marble.
utter55.436,utter,DISRAELI,I see.
utter55.437,utter,BERTIE,"I would talk to her myself, but she won't listen to me. She must be persuaded, by someone she respects, to abandon this ridiculous favoritism"
desc55.438,desc,,before a situation develops.
utter55.439,utter,DISRAELI,A situation?
utter55.440,utter,BERTIE,I don't imagine you frequent the Republican Clubs. But the fact that neither you nor I are members should not blind us to the significance of their existence. (beat) The Tory Party has always been our party.
utter55.441,utter,DISRAELI,I'm flattered you think so.
utter55.442,utter,BERTIE,"I tell you, if we don't stick together on this, you could find yourself First President's Opposition. (murdering it) Du Royaum Uni."
utter55.443,utter,DISRAELI,Quite.
desc55.444,desc,,A beat.
utter55.445,utter,BERTIE,I don't think we can overstate the seriousness of this.
desc55.446,desc,,"DISRAELI nods and BERTIE walks swiftly back to his party. The moment he's gone, STANLEY steps up to DISRAELI's side."
utter55.447,utter,STANLEY,What did he want?
utter55.448,utter,DISRAELI,To know when he'll be king.
scene56,slugline,,"INT. ESTATE COTTAGE, BALMORAL - DAY"
desc56.449,desc,,"VICTORIA, BROWN and the GRANTS are eating around a large table. Like a wife watching her husband, VICTORIA beams proudly at BROWN as he tells a story."
utter56.450,utter,BROWN,"... so Grant here and myself are riding over Lochnagar and the rain's pouring down in sheets and all we're thinking about is getting home for a drink, when through the gloom Grant spots a couple of poachers. He gives me a shout and we chase them down towards the loch until Grant has your men up against the stacks and he's shouting and cursing at them, ""Why are you poaching on Royal land?!"" And one"
desc56.451,desc,,"of the little fellas looks up at him and says, ""coz we've come up in the world."" For a split second, both the GRANTS look petrified, then BROWN and VICTORIA explode into laughter and the GRANTS relax. Suddenly the GRANTS are helpless with laughter too. Beginning with VICTORIA's glass, BROWN pours out liberal quantities of whiskey all round."
scene57,slugline,,EXT. BALMORAL CASTLE - DUSK
desc57.452,desc,,"Later that night, the courtyard is packed with a gaggle of worried HOUSEHOLDERS holding lamps. Through the light, BROWN and VICTORIA clatter into the courtyard on the horse and trap. DOCTOR JENNER breaks through the crowd in a state of high excitement."
utter57.453,utter,JENNER,Your Majesty! Thank goodness you're safe! I'll have a bath prepared immediately. I recommend Macdonald's African Embrocation --
utter57.454,utter,BROWN,"(cutting in) Ah, pipe down, man. The woman's fine."
utter57.455,utter,VICTORIA,We stayed a little longer than expected with Mr and Mrs Grant. It was most agreeable.
utter57.456,utter,PONSONBY,We were expecting you to return by six.
utter57.457,utter,VICTORIA,And now I am back.
desc57.458,desc,,BROWN cannot resist one more little dig.
utter57.459,utter,BROWN,We took a nip of whiskey.
utter57.460,utter,VICTORIA,To keep out the cold.
utter57.461,utter,BROWN,Aye.
desc57.462,desc,,"VICTORIA smiles and BROWN lifts her off the trap. Before walking in she turns and, in front of everyone, says..."
utter57.463,utter,VICTORIA,"Thank you, John."
desc57.464,desc,,"BROWN bows and the QUEEN walks on. As she straightens up, he finds PONSONBY and DOCTOR JENNER staring back at him in utter disbelief at what she has just said. He turns and leads the horse back to the stables."
utter57.465,utter,JENNER,(under his breath) She's drunk.
desc57.466,desc,,PONSONBY doesn't answer. He is watching BROWN very closely.
utter57.467,utter,JENNER (CONT'D),"A distinct flushing around the cheeks. She was drunk, I tell you."
utter57.468,utter,PONSONBY,"No, she wasn't."
desc57.469,desc,,Silence. JENNER turns to look at PONSONBY.
utter57.470,utter,JENNER,Surely not ...
desc57.471,desc,,PONSONBY's face is set hard.
utter57.472,utter,PONSONBY,Don't even think about it.
scene58,slugline,,"INT. BALMORAL CASTLE, BALLROOM - NIGHT"
desc58.473,desc,,"A crush of kilted GHILLIES as we slam into the height of the annual Ghillie's Ball. The whole court is reeling through the dance; all of them beholding the extraordinary spectacle of QUEEN VICTORIA and JOHN BROWN dancing together in the middle of the hall. PONSONBY and JENNER stand by the wall, watching. Close-up on PONSONBY'S face as JENNER mutters darkly."
utter58.474,utter,JENNER,Pandora's Box ...
desc58.475,desc,,"With a slam of feet the reel ends, the GHILLIES roar and BROWN and VICTORIA stand smiling at each other in silence. A King and his Queen."
scene59,slugline,,"INT. BALMORAL CASTLE, BALLROOM - NIGHT Later that night."
desc59.476,desc,,"We find BROWN, slouched on the ground, dead-drunk and snoring loudly."
scene60,slugline,,EXT. LOCHNAGER - DAY
desc60.477,desc,,"A few days later, four JOURNALISTS are scrabbling up a stony path, armed with telescopes."
scene61,slugline,,EXT. LOCHNAGER - DAY
desc61.478,desc,,"A large ROYAL PARTY is making its way smoothly and quietly up the mountain. BROWN is on horseback, leading VICTORIA on a dapple-grey."
scene62,slugline,,EXT. LOCHNAGER - DAY
desc62.479,desc,,The JOURNALISTS rattle up the hill.
scene63,slugline,,EXT. LOCHNAGER - DAY
desc63.480,desc,,BROWN and VICTORIA start pulling ahead of the main party.
scene64,slugline,,EXT. LOCHNAGER - DAY
desc64.481,desc,,"The JOURNALISTS scramble up to some gorse bushes, dump themselves down and start setting up the telescopes."
scene65,slugline,,EXT. LOCHNAGER - DAY
desc65.482,desc,,"BROWN and VICTORIA near the summit when BROWN suddenly stops. He stiffens and turns to face the wind, as if catching a scent. VICTORIA frowns."
utter65.483,utter,VICTORIA,"What is it, John? (beat) John?"
utter65.484,utter,BROWN,I heard something.
desc65.485,desc,,BROWN's eyes fix on some distant gorse bushes.
utter65.486,utter,BROWN (CONT'D),I won't be long.
desc65.487,desc,,He dismounts and races off.
scene66,slugline,,EXT. LOCHNAGER - DAY
desc66.488,desc,,The JOURNALISTS are peering through their telescopes.
utter66.489,utter,JOURNALIST 1,Where did he get to? I've lost him?
desc66.490,desc,,"Below them, BROWN races across the riverbank and undergrowth, unseen."
utter66.491,utter,JOURNALIST 2,I don't know if there's much worth writing about.
utter66.492,utter,JOURNALIST 1,Hard to tell.
desc66.493,desc,,BROWN rears up above them and stops.
utter66.494,utter,BROWN,This close enough for you? Go on! On your way! You filthy scavengers!
desc66.495,desc,,"The JOURNALISTS scramble to their feet and start legging it down the hill, while BROWN roars furiously, hurling their bags after them."
utter66.496,utter,BROWN (CONT'D),"You leave her alone, do you hear?!"
desc66.497,desc,,The JOURNALISTS vanish below the hillside.
scene67,slugline,,"INT. BALMORAL CASTLE, UPPER SERVANT'S TABLE - NIGHT That night."
desc67.498,desc,,"BROWN is standing at the head of the table, yelling at the UPPER SERVANTS, irrespective of ARCHIE or anyone."
utter67.499,utter,BROWN,"If I catch the miserable by-blow who told those men where she'd be, then I'll hang his balls to dry on Jock Wemyss, so I will!!"
desc67.500,desc,,"ARCHIE glances up at BERTIE'S VALET. He is staring down at the table, teeth gritted, fists clenched. BROWN rounds on them all again."
utter67.501,utter,BROWN (CONT'D),"What happens to John Brown is his business, but the Queen's security will never be compromised!"
utter67.502,utter,BERTIE'S VALET,We --
utter67.503,utter,BROWN,You'll talk when I'm finished!
desc67.504,desc,,BERTIE'S VALET stares at him in astonishment. BROWN turns back to the table.
utter67.505,utter,BROWN (CONT'D),"That kind of disloyalty will not be tolerated in this house, is that clear? (beat, yelling) I said, is that clear?!"
desc67.506,desc,,There is a general mutter of assent. BROWN turns and storms out as ARCHIE gets up to follow.
scene68,slugline,,"INT. BALMORAL CASTLE, HENRY PONSONBY'S ROOMS - DAY"
desc68.507,desc,,"A few days later, PONSONBY is sitting at his desk, hands to his hips, listening quietly as DOCTOR JENNER reads from his copy of Punch."
utter68.508,utter,JENNER,"""Court Circular, Balmoral."" (beat) ""On Tuesday, Mr John Brown enjoyed a display of sheep-dipping by local farmers. On Wednesday, he attended a seance where he was pleased to listen"
scene69,slugline,,to a recital of Auld Lang Syne by Mr
scene70,slugline,,"INT. BALMORAL CASTLE, LOWER CORRIDOR - DAY"
desc70.509,desc,,BROWN crashes through a door holding a copy of the same journal.
utter70.510,utter,JENNER (O.S.),"""... On Thursday, Mr John Brown walked on the slopes, accompanied by family and friend ..."""
scene71,slugline,,"INT. BALMORAL CASTLE, CORRIDOR - DAY"
desc71.511,desc,,BROWN storms up to PONSONBY's door.
utter71.512,utter,JENNER (O.S.),Mr Brown retired early.
scene72,slugline,,"INT. BALMORAL CASTLE, HENRY PONSONBY'S ROOMS - DAY"
desc72.513,desc,,"BROWN bursts in on PONSONBY and JENNER, slamming down his copy of Punch on the desk. He is furious but controlled."
utter72.514,utter,BROWN,"If I find out that you had anything to do with this, I will have you sacked."
utter72.515,utter,PONSONBY,I believe that decision rests with Her Majesty.
utter72.516,utter,BROWN,Don't think I can't persuade her.
utter72.517,utter,PONSONBY,I don't doubt that the Queen was highly amused. She has always had a very healthy sense of humor.
utter72.518,utter,BROWN,This is a slur on her good name.
utter72.519,utter,PONSONBY,"In as much as the article is about yourself, I think you must now accept that the public has a right to its interest in you."
utter72.520,utter,BROWN,Nobody has any rights over me.
utter72.521,utter,PONSONBY,"We are all of us subject to forces beyond our control, Mr Brown, even you."
desc72.522,desc,,BROWN stares at him in silence. A beat.
utter72.523,utter,BROWN,You'll regret saying that.
scene73,slugline,,INT. THE HOUSES OF PARLIAMENT - DAY
desc73.524,desc,,Chaos. The Tories are losing the vote as both sides of the house stand and shout at each other while the SPEAKER rises in his chair.
utter73.525,utter,SPEAKER (O.S.),Order! Order! ORDER!
desc73.526,desc,,A buzzing silence settles as the house sits for the vote. The COUNTERS approach the chair.
utter73.527,utter,SPEAKER (CONT'D),Result of the vote to the first reading of the Bill to Disestablish the Irish Church.
desc73.528,desc,,A murmur of excitement from the LIBERALS.
utter73.529,utter,SPEAKER (CONT'D),Order!
desc73.530,desc,,A beat.
utter73.531,utter,COUNTER,"Ayes to the right, three hundred and thirty, noes to the left, two hundred and sixty-five..."
desc73.532,desc,,"By the time he reaches ""sixty-five"" his voice is drowned in cheers from the Liberal benches. DISRAELI and the rest of the front bench sit in stony silence. Somewhere on the Liberal back benches, a wild-eyed maverick, DILKE, rises to his feet shouting:"
utter73.533,utter,DILKE,"Mr Speaker, I table a motion in furtherance of the Bill to Disestablish the Monarchy!"
desc73.534,desc,,A roar from the irate TORIES and chaos reigns again.
utter73.535,utter,SPEAKER,Order! Order!! ORDER!!!
scene74,slugline,,"INT. THE HOUSES OF PARLIAMENT, LOBBY CORRIDOR - NIGHT"
desc74.536,desc,,An hour later the house is empty except for a few straggling MPs hurrying home. An exhausted DISRAELI stands in the corridor with STANLEY.
utter74.537,utter,DISRAELI,We're going to lose.
utter74.538,utter,STANLEY,You can't know that for sure.
utter74.539,utter,DISRAELI,Gladstone's got his party facing the same way for the first time in years. We need help. (long beat) Where is the old girl?
utter74.540,utter,STANLEY,Who?
utter74.541,utter,DISRAELI,Mrs Brown.
utter74.542,utter,STANLEY,It's questionable whether there's any advantage to be had from that direction. She's never been less popular.
utter74.543,utter,DISRAELI,"In the press, perhaps. (holding up Punch) But she's sold more copies of her Highland Journal in three months than Punch will ever sell in a year. Time to wheel her out."
utter74.544,utter,STANLEY,She's refusing to leave Balmoral.
utter74.545,utter,DISRAELI,What's her excuse this time?
utter74.546,utter,STANLEY,"The Princess Louisa is too ill to move. Frankly, the Queen's rather upset at the recent spate of bad publicity. (beat) You're smiling."
utter74.547,utter,DISRAELI,"I was trying to imagine ""rather upset."""
desc74.548,desc,,"The elderly prelate, DEAN WELLSELLY, hurries in through the lobby doors. DISRAELI puts on a welcoming smile."
utter74.549,utter,DEAN WELLSELLY,"Forgive me, gentlemen. I'm late."
utter74.550,utter,DISRAELI,"Not at all, Dean. Good of you to spare the time."
utter74.551,utter,DEAN WELLSELLY,I came as quickly as I could.
utter74.552,utter,DISRAELI,"You've seen the latest cartoon in Punch, I take it?"
utter74.553,utter,DEAN WELLSELLY,(completely lost) I beg your pardon?
desc74.554,desc,,DISRAELI opens the copy of Punch and hands it to Dean Wellselly. The Dean clears his throat and starts to read.
utter74.555,utter,DISRAELI,(as Wellselly reads) One of our madder brethren in the house was calling for disestablishment of the monarchy.
desc74.556,desc,,"Dean Wellselly looks up from the article, horrified."
utter74.557,utter,DEAN WELLSELLY,Good Lord.
utter74.558,utter,STANLEY,(playing the soft glove) I'm sure it won't come to that.
utter74.559,utter,DISRAELI,"(the hard glove) No. But it has now become a matter for our consciences. (beat) I was just telling Stanley how vital it is that the nation should feel the visible influence of the Sovereign. As a reminder that Parliament, indeed my own ministry, depends on the will of the Queen."
desc74.560,desc,,"DEAN WELLSELLY nods his head gravely. Over his shoulder, STANLEY is gaping at DISRAELI's silky distortion of the party political maneuver into a moral imperative."
utter74.561,utter,DEAN WELLSELLY,"I couldn't agree with you more, but I am only Dean of Windsor. I don't understand what ..."
desc74.562,desc,,DISRAELI interrupts.
utter74.563,utter,DISRAELI,We hear from Balmoral that Mr Brown is interesting Her Majesty in some of the forms of worship associated with ... low-church Presbyterian.
desc74.564,desc,,Silence. DEAN WELLSELLY'S face is a picture of unrestrained horror. Low-church. Presbyterian.
utter74.565,utter,DEAN WELLSELLY,What can we do?
utter74.566,utter,DISRAELI,"Oh, several things."
scene75,slugline,,"INT. BALMORAL CASTLE, QUEEN'S DRAWING ROOM - DAY Some days later."
desc75.567,desc,,"Queen VICTORIA sits at her desk while Henry PONSONBY stands in front of her, holding a copy of The Times."
utter75.568,utter,VICTORIA,Read it.
utter75.569,utter,PONSONBY,Again?
utter75.570,utter,VICTORIA,Read it!
desc75.571,desc,,PONSONBY coughs once and begins again.
utter75.572,utter,PONSONBY,"""The Times wishes to join the rest of Her Majesty's loyal subjects in expressing its deep joy at the news that the Queen is soon to come out of"
desc75.573,desc,,"her mourning."" VICTORIA glowers at him."
utter75.574,utter,VICTORIA,Who told them that?
utter75.575,utter,PONSONBY,I have no idea.
utter75.576,utter,VICTORIA,Why not?
utter75.577,utter,PONSONBY,"I -- forgive me, ma'am, I am no wiser than yourself."
desc75.578,desc,,"Suddenly, VICTORIA's temper goes and she shouts at him."
utter75.579,utter,VICTORIA,"No-one should think themselves wiser than me! (beat) It is not for any of the Queen's subjects to presume to tell Her Majesty when and where She should come out of mourning. It is the Queen's sorrow that keeps her secluded! It is Her overwhelming amount of work and responsibility, work which She feels will soon wear her out entirely!"
utter75.580,utter,PONSONBY,Your Majesty --
utter75.581,utter,VICTORIA,"(cutting right through him) Is it not enough that She is uncheered and unguided that she should also have to suffer these malicious rumors?! (a pause, more quietly) I am not a fool. (beat) I know there are those in the establishment too afraid to attack me and so they attack my dearest friends. Sometimes -- I feel that Brown is all I have left of Albert. (beat) And now they attack Brown too."
desc75.582,desc,,"She looks up, eyes blazing."
utter75.583,utter,VICTORIA (CONT'D),I will not give him up to them.
scene76,slugline,,"INT. BALMORAL CASTLE, ROOM ADJOINING DRAWING ROOM - DAY"
desc76.584,desc,,"BROWN is guarding the door to the drawing room while the balding BERTIE muscles up, eye ball to eye ball."
utter76.585,utter,BERTIE,I wish to see my mother.
utter76.586,utter,BROWN,She's busy.
utter76.587,utter,BERTIE,Convey her a message.
utter76.588,utter,BROWN,She's away to Windsor tomorrow. Talk to her there.
utter76.589,utter,BERTIE,Tell her the Prince of Wales wishes to speak with her urgently about matters concerning the press.
utter76.590,utter,BROWN,Are you deaf as well as stupid?
desc76.591,desc,,A split-second. BERTIE gapes at him.
utter76.592,utter,BERTIE,What did you say?
utter76.593,utter,BROWN,"I said, are you deaf as well as stupid?"
utter76.594,utter,BERTIE,"Do you know who you address, sir?"
utter76.595,utter,BROWN,Whom you address.
utter76.596,utter,BERTIE,The future King!
desc76.597,desc,,A beat.
utter76.598,utter,BROWN,"Well, everyone's entitled to their opinion."
utter76.599,utter,BERTIE,Out of my way!
desc76.600,desc,,"Foolishly, BERTIE tries to barge his way past. Suddenly BROWN loses it completely. He grabs the Prince of Wales by the shoulders and pins him back, shouting right into his face."
utter76.601,utter,BROWN,"LEAVE US ALONE, WHY DON'T YOU!!"
desc76.602,desc,,"For a split-second, BROWN's eyes flicker as he senses he has gone too far. A look of pure venom in BERTIE'S face, then ..."
scene77,slugline,,"EXT. WINDSOR CASTLE, QUADRANGLE - NIGHT Weeks later."
desc77.603,desc,,"In a roar of hooves and wheels, the Royal Carriage sweeps into the huge quadrangle. JOHN BROWN stands rigid on the box, glowering at all the world."
scene78,slugline,,"CAPTION: ""WINDSOR"" INT. WINDSOR CASTLE, SERVANT'S CORRIDOR - NIGHT"
desc78.604,desc,,"A pair of doors open out onto a torchlit driveway as a mass of SERVANTS rush in and out, ferrying bags an trunks. BROWN marches in, still charged-up from the strain of the journey's watchfulness. He spots an UNDER-PORTER snatching a break."
utter78.605,utter,BROWN,You! What's your business here?!
utter78.606,utter,UNDER-PORTER,"(jumping to) Under-porter, sir."
utter78.607,utter,BROWN,"Well, don't stand where you shouldn't!"
desc78.608,desc,,The UNDER-PORTER scrambles up the stairs. A few SERVANTS exchange looks. BROWN seems more determined than ever to exert his control.
scene79,slugline,,"EXT. WINDSOR CASTLE, STABLES - NIGHT That night."
desc79.609,desc,,"Carrying an old storm lamp high over his head, BROWN walks towards the stables."
scene80,slugline,,EXT. THE GROUNDS OF WINDSOR CASTLE - DAY The next day.
desc80.610,desc,,"BROWN is on horseback, riding with VICTORIA through the grounds. He is still jumpy, eyes flicking left and right, searching for intruders. They are being followed at a distance by two EQUERRIES on horseback. VICTORIA frowns peevishly."
utter80.611,utter,VICTORIA,Must they always follow us?
utter80.612,utter,BROWN,I ordered it. It's for your own safety.
utter80.613,utter,VICTORIA,"Dear me, you'll be telling me to watch what I eat next."
desc80.614,desc,,BROWN doesn't react. A beat.
utter80.615,utter,VICTORIA (CONT'D),"Am I not safe enough with you, John?"
utter80.616,utter,BROWN,Aye. (looking away) But there are Fenians reported on the mainland.
utter80.617,utter,VICTORIA,"(tutting irritably) The threat from the Irish is greatly exaggerated, I'm sure."
utter80.618,utter,BROWN,(snapping back) I'll decide when it's exaggerated.
desc80.619,desc,,"BROWN chucks his horse on, bringing a firm halt to the conversation. A beat. He pulls up suddenly, staring at the shadows in the copse."
utter80.620,utter,VICTORIA,"Is anything the matter, John? (beat) John?"
desc80.621,desc,,He stares for along moment and then lets it go.
utter80.622,utter,BROWN,Nothing's the matter.
scene81,slugline,,"INT. WINDSOR CASTLE, STABLES - NIGHT"
desc81.623,desc,,"BROWN marches down the line of horse boxes. A stable-lad, BARNEY, is feeding the horses. He looks twitchy."
utter81.624,utter,BROWN,"Hey, Barney."
utter81.625,utter,BARNEY,"Mr Brown, sir --"
utter81.626,utter,BROWN,"It's cold out there tonight, Barney."
desc81.627,desc,,"Reaching his pony, BROWN stops and smiles. The animal lifts its face to him and he softly strokes his muzzle."
utter81.628,utter,BROWN (CONT'D),"Yeah, there's a good girl. (to Barney) Have you had a look at this hoof? She was limping badly. I think there might be a stone in it."
utter81.629,utter,BARNEY,"Yeah, yeah, I did."
utter81.630,utter,BROWN,Good man. And is she all right?
utter81.631,utter,BARNEY,Yeah.
utter81.632,utter,BROWN,"Good. She's a good girl. Aren't you? Yeah, she's a lovely girl. And you know the Queen's riding tomorrow?"
utter81.633,utter,BARNEY,Yeah.
utter81.634,utter,BROWN,"(beat) Are you all right, Barney?"
desc81.635,desc,,"BARNEY twitches again and BROWN realizes too late. The split-second he turns, he sees THREE MEN."
utter81.636,utter,BROWN (CONT'D),"Oh, aye..."
desc81.637,desc,,"The MEN pile onto him and he collapses under their weight. As he falls, BROWN manages to yank himself round, bang up a fist and fling the others off him. But the FIRST MAN is up again, twisting an arm round his neck and tugging him back. The others grapple his arms down, but BROWN is incredibly strong. Even now, grunting and scrabbling, he makes them fight to force him back. BARNEY stands transfixed in horror. Dumping BROWN against the wall, the men step back and start kicking the shit out of him. BROWN curls into a ball, jaw locked, hands over his head. Not a sound. Finally, they back off, panting hard. The FIRST MAN pulls out a bottle of whiskey, yanks back BROWN's head and forces whiskey down his throat. It spills over his face and dribbles down his neck."
scene82,slugline,,"INT. WINDSOR CASTLE, QUEEN'S SITTING ROOM - DAY The next day."
desc82.638,desc,,VICTORIA is standing at the windows. The door opens and LADY ELY walks in.
utter82.639,utter,VICTORIA,Well?
utter82.640,utter,LADY ELY,Mr Brown is unable to attend today.
utter82.641,utter,VICTORIA,Why?
utter82.642,utter,LADY ELY,"I believe he is unwell, ma'am."
utter82.643,utter,VICTORIA,Unwell?
utter82.644,utter,LADY ELY,I understand he was in a fight.
utter82.645,utter,VICTORIA,Has he been hurt?
utter82.646,utter,LADY ELY,"I believe not, ma'am. I understand -- he'd had rather too much to drink."
