segment-id,segment-type,segment-speaker,segment-text
scene32,slugline,,"INT. OSBORNE HOUSE, STABLES - DAY"
desc32.184,desc,,"A few minutes later, BROWN is in the process of stabling his horse. Suddenly he turns. VICTORIA is standing at the far end of the stable with her entourage."
utter32.185,utter,VICTORIA,Mr Brown.
utter32.186,utter,BROWN,"Yes, ma'am."
utter32.187,utter,VICTORIA,You have been told repeatedly not to stand in the courtyard unless requested to do so.
utter32.188,utter,BROWN,"Yes, ma'am."
utter32.189,utter,VICTORIA,Then why do you persist in doing it?
utter32.190,utter,BROWN,"Because I think Her Majesty is wrong. If ever there was a poor soul who needed fresh air, it is her."
desc32.191,desc,,A beat.
utter32.192,utter,VICTORIA,The Queen will ride out if and when she chooses.
utter32.193,utter,BROWN,And I intend to be there when she's
desc32.194,desc,,Silence. The two of them stare at each other.
scene33,slugline,,"EXT. OSBORNE HOUSE, THE GROUNDS - DAY"
desc33.195,desc,,"The next day, high and wide over the stunningly manicured landscape. Long lawns, wind-cropped copses and in the distance, the glittering sea."
scene34,slugline,,"EXT. OSBORNE HOUSE, THE GROUNDS - DAY"
desc34.196,desc,,VICTORIA sits side-saddle on a horse. BROWN leads her in silence.
scene35,slugline,,EXT. CLIFFTOP - DAY
desc35.197,desc,,VICTORIA looks up.
utter35.198,utter,VICTORIA,Prince Albert was going to build a bench here. He thought it one of the best views in Osborne.
utter35.199,utter,BROWN,"It's a fine spot, ma'am."
utter35.200,utter,VICTORIA,"He thought so, yes."
desc35.201,desc,,She stares ahead.
utter35.202,utter,VICTORIA (CONT'D),"In everything I do and everything I say, I try to think, as much as possible, what he would do, or say, if he were here now. My Private Secretary wishes me to return to public duties--"
desc35.203,desc,,"She stops abruptly, but BROWN cuts in."
utter35.204,utter,BROWN,"If Prince Albert were here today, he'd tell him a thing or two."
utter35.205,utter,VICTORIA,Sir Henry is not alone. They all wish it. (beat) The same people who refused to grant my husband the title of King because he was deemed of insufficient rank--
desc35.206,desc,,"She stops again, cutting quickly back to small-talk."
utter35.207,utter,VICTORIA (CONT'D),"It is a fine spot for a bench, is it not?"
utter35.208,utter,BROWN,"Aye, ma'am."
utter35.209,utter,VICTORIA,Yes.
desc35.210,desc,,A pause.
utter35.211,utter,VICTORIA (CONT'D),I have some letters in the saddle bag. I wish to read them.
desc35.212,desc,,"BROWN walks up to her side, opens the saddle bag and hands her a bundle of letters held together with ribbon."
utter35.213,utter,VICTORIA (CONT'D),I cannot read them like that.
desc35.214,desc,,BROWN undoes the ribbon and tries again. VICTORIA cuts in.
utter35.215,utter,VICTORIA (CONT'D),You will hand them to me as I require.
desc35.216,desc,,BROWN takes off the top letter and hands it to her.
scene36,slugline,,"INT. OSBORNE HOUSE, UPPER SERVANT'S TABLE - NIGHT"
desc36.217,desc,,"The clatter and crush of the Upper Servant's table as UPPER SERVANTS sit themselves down to dinner while UNDER SERVANTS prepare to serve soup. ARCHIE comes in and sits himself somewhere in the middle next to an empty seat. A moment later, BROWN strides in. But instead of sitting at the place beside his brother, he goes straight to the head of the table and plonks himself down. Slowly, the clatter dies away as the whole room stops and stares at him in silence. BROWN fixes them with a look. An elderly butler steps into the room and stares in amazement at BROWN. A smooth young man, BERTIE'S VALET, hurries up to intercede."
desc36.218,desc,,"Mr. Carter, the Head Butler, sits"
utter36.219,utter,BROWN,Not now he doesn't. This is my place.
utter36.220,utter,BERTIE'S VALET,By whose authority?
utter36.221,utter,BROWN,My own.
desc36.222,desc,,A little frisson of oh-my-gawdness. BERTIE'S VALET stares icily at him.
utter36.223,utter,BERTIE'S VALET,The order of seating at the Upper
desc36.224,desc,,Servant's table is arranged personally
utter36.225,utter,BROWN,"That's a tautology lad. (unable to stop himself seriously explaining it) If you say the Queen arranges something, you've no need to say she's done it personally. That's understood."
desc36.226,desc,,"But as far as BERTIE'S VALET is concerned, it isn't. He stares down in mute fury, then snaps his fingers at one of the under servants, who rushes over. There is a hurried exchange of whispers before the under servant rushes out. Unperturbed, BROWN brings out his flask and pours himself a substantial draft of whiskey. He turns to the pretty assistant dresser, sitting to his right."
utter36.227,utter,BROWN (CONT'D),Are you dresser to Her Majesty?
desc36.228,desc,,She blinks nervously at him.
utter36.229,utter,ASSISTANT DRESSER,"Assistant, sir, yes."
desc36.230,desc,,BROWN tucks into his soup. Everyone watches and waits.
utter36.231,utter,BROWN,What's your name?
utter36.232,utter,ASSISTANT DRESSER,"Mary Taylor, sir."
utter36.233,utter,BROWN,"Have I seen you up in Balmoral, Mary?"
utter36.234,utter,ASSISTANT DRESSER,I hope to go up next year.
utter36.235,utter,BROWN,"You wouldn't happen to know what the Queen's reading for recreation, would you, Mary?"
desc36.236,desc,,The assistant dresser thinks for a moment.
utter36.237,utter,ASSISTANT DRESSER,"Lord Tennyson, sir?"
desc36.238,desc,,"BROWN nods. All conversation stops as the under servant bursts back in. She halts at the door, looking blankly from Bertie's valet to the elderly butler. A beat. The old man stiffens and makes his way to the middle of the table. BROWN looks up from his soup."
utter36.239,utter,BROWN,Am I the only one eating?
desc36.240,desc,,"With a clatter of spoons, everyone obediently eats."
scene37,slugline,,"INT. OSBORNE HOUSE, DRAWING ROOM - DAY"
desc37.241,desc,,"A few days later. A morning ""drawing room."" Standing round the unlit fireplace are DOCTOR JENNER, LADY ELY, LADY CHURCHILL, the two LADIES IN WAITING and PRINCESS ALEXANDRA. All are dressed against the icy wind that whistles through the open window where VICTORIA sits knitting busily while BERTIE stands beside her, coat buttoned up to the collar. PONSONBY has stationed himself opposite, beside a desk piled high with red dispatch boxes. He runs through the daily itinerary."
utter37.242,utter,PONSONBY,"Lord Clarendon arrives, by invitation, at eleven o'clock, followed at twelve by a picnic in the grounds to celebrate Princess Alice's birthday. Dispatches, as usual, at two. (finishes, then coughs) The Chancellor writes to say that, by happy coincidence, he will be in Cowes for the weekend. He asks if Your Majesty might grant him an audience."
utter37.243,utter,VICTORIA,Why?
utter37.244,utter,PONSONBY,"He thought, perhaps, Your Majesty might wish to be informed of the latest developments in government."
utter37.245,utter,VICTORIA,No. I shall be out walking.
desc37.246,desc,,"A beat. BERTIE watches closely now. PONSONBY coughs again, nervous."
utter37.247,utter,PONSONBY,Then perhaps Your Majesty might consider it opportune if the Prince of Wales were to meet him on your behalf?
desc37.248,desc,,VICTORIA stiffens. She speaks without turning.
utter37.249,utter,VICTORIA,On no account.
desc37.250,desc,,"PONSONBY gives up. Politely, but firmly, BERTIE takes up the reins."
utter37.251,utter,BERTIE,"Mama, I really do think it's time we made ourselves a little more ... available."
desc37.252,desc,,VICTORIA carries on knitting.
utter37.253,utter,BERTIE (CONT'D),I think we must accept our position in the country is not entirely unrelated to the continued absence of the Monarchy from public life. (silence) I thought perhaps we might consider a small gesture of some kind?
desc37.254,desc,,VICTORIA looks up sharply.
utter37.255,utter,VICTORIA,Gesture?
utter37.256,utter,BERTIE,"I thought, a dinner for our ambassadors perhaps?"
utter37.257,utter,VICTORIA,"(cutting in firmly) No dinners, Bertie. (beat) Why are you dressed for outdoors?"
utter37.258,utter,BERTIE,It's so infernally cold in here.
utter37.259,utter,VICTORIA,"Cold is good-- (calling across) Is that not so, Dr. Jenner?!"
utter37.260,utter,JENNER,"I'm sorry, ma'am?"
utter37.261,utter,VICTORIA,Cold is good!
utter37.262,utter,JENNER,"Excellent, ma'am, excellent. (trying his hand) But perhaps if her Majesty were to consider accompanying her new-found physical vigor with the benefits of mental activity..."
utter37.263,utter,VICTORIA,(becoming very agitated) Why am I being lectured in this way?!
utter37.264,utter,JENNER,"Forgive me, Your Majesty. In no way did I wish to suggest--"
utter37.265,utter,VICTORIA,(cutting across him) I will not tolerate anybody lecturing me about the responsibility of the monarchy....
utter37.266,utter,BERTIE,Mother....
utter37.267,utter,VICTORIA,... Least of all my son. It was his irresponsibility that drove my husband to his grave.
desc37.268,desc,,"An appalled silence. With great dignity, BERTIE absorbs the shock of the insult and quietly steers the conversation in another direction."
utter37.269,utter,BERTIE,"If it is inconvenient to Her Majesty, then perhaps she might consider allowing the Prince of Wales to host--"
utter37.270,utter,VICTORIA,I do believe they send so many boxes to taunt me. Doctor Jenner writes to them to say that my nerves are in an extremely fragile state and yet they continue to hound me with box after box after box after box after box!
desc37.271,desc,,"Silence. VICTORIA has crossed to the window and stares out at the view. Having recovered her composure, she turns to address them all."
utter37.272,utter,VICTORIA (CONT'D),I wish to take the Princesses for a swim.
desc37.273,desc,,"For a moment, nobody believes what they have heard. She continues."
utter37.274,utter,VICTORIA (CONT'D),"The turns I have been taking in the grounds have proved most beneficial to me, and Brown thinks that salt water will do me good."
desc37.275,desc,,Bertie stares at her in silence while PONSONBY and DOCTOR JENNER exchange a worried look.
scene38,slugline,,"EXT. PRIVATE BEACH, ISLE OF WIGHT - DAY"
desc38.276,desc,,"The doors of the Royal bathing-machine swing open and Queen VICTORIA, in a voluminous swim-dress, sails out like a duck into the freezing sea. As she does so, the doors of the other machines open and Princess Helena and Princess Louise follow her in. Dignity does not allow them to shout out, but their expressions of constipated agony are a picture. VICTORIA begins swimming around in a vigorous little circle."
utter38.277,utter,VICTORIA,"Don't potter, children. Swim."
desc38.278,desc,,Hold for a moment on the princesses' miserable faces.
scene39,slugline,,"EXT. OSBORNE HOUSE - DAY Half an hour later, PONSONBY, DOCTOR JENNER, LADY ELY and"
desc39.279,desc,,two FOOTMEN watch as BROWN helps VICTORIA up some steps and onto her horse. He glances at the stiff line of householders and mutters curtly to himself.
utter39.280,utter,BROWN,You could buy that lot for garden ornaments and still see change from ten guineas.
desc39.281,desc,,"The household do not hear this, but QUEEN VICTORIA has overheard and tries to suppress a smile. As she settles into the saddle, her foot comes loose. BROWN fastens it into the stirrups."
utter39.282,utter,BROWN (CONT'D),"Lift your foot, woman."
desc39.283,desc,,"Everyone hears this. VICTORIA obeys. Taking the reins, he then walks the QUEEN out of the courtyard. As they vanish from site, we hear..."
utter39.284,utter,DISRAELI (O.S.),This nation is fortunate in so much as it is not governed by force...
scene40,slugline,,INT. THE HOUSES OF PARLIAMENT - DAY
desc40.285,desc,,"The speech continues as we follow the progress of a Tomahawk cartoon doing the rounds of the Tory back benches from knee to knee. It is entitled, ""Where is Britannia?"" and shows an empty throne draped with the Royal cloak."
utter40.286,utter,DISRAELI (O.S.),"... but by a chain of traditions that have been cherished from generation to generation, because in them -- in our traditions -- are embodied all the laws which have enabled us to create the greatest empire of modern times..."
desc40.287,desc,,"During the above, the cartoon reaches the front benches and lands on the knees of the young, earnest STANLEY. As he frowns at the picture in front of him, DISRAELI winds up."
utter40.288,utter,DISRAELI (CONT'D),"... but, even though we have amassed great capital and even though we have established an industry with no parallel in the world, yet all these mighty creations are as nothing compared to the invisible customs that shape our lives. To those honorable gentlemen of the opposition who seek to destroy the essential elements of this country, I say let them remember: England cannot begin again."
desc40.289,desc,,"During this peroration, we see DISRAELI for the first time. He is handsome, obviously Jewish and wire thin, like Dickens on Slimfast. He dresses almost dandyishly but speaks with startling vigor; a combination of brilliance and cheek that is his key. To cheers from his back benchers, he sits. As he looks up, he catches the eye of his opposite on the Liberal benches. GLADSTONE is different in almost every respect; dour, dogged, heavy-set and tall. They stare levelly for a second, then DISRAELI flashes a brilliant smile. STANLEY plops the cartoon on his lap."
utter40.290,utter,STANLEY,Have you seen this?
scene41,slugline,,"INT. THE HOUSES OF PARLIAMENT, LOBBY CORRIDOR - DAY"
desc41.291,desc,,"A few minutes later, DISRAELI and STANLEY are strolling down the busy lobby corridor. Throughout their talk, Tory back-benchers bustle up to pat their hero on the back and offer their congratulations."
utter41.292,utter,STANLEY,Should we take it seriously?
utter41.293,utter,DISRAELI,The cartoon or Her Majesty's absenteeism?
utter41.294,utter,STANLEY,"Well, both."
utter41.295,utter,DISRAELI,"The question is, do we need her?"
utter41.296,utter,STANLEY,"Surely, you're not suggesting we dispense--"
utter41.297,utter,DISRAELI,"My dear Stanley, a Prime Minister with only a handful of friends must respect public opinion."
desc41.298,desc,,The pass GLADSTONE in a huddle of cohorts.
utter41.299,utter,DISRAELI (CONT'D),"Gossip counts. Lord Aberdeen was right. This country is not governed by wisdom but by talk. (beat) Granted, it wouldn't take much to winkle the old girl out of mourning, but if public opinion is against her, then it doesn't do to appear too close."
utter41.300,utter,STANLEY,So?
utter41.301,utter,DISRAELI,We'll see which way the wind blows.
desc41.302,desc,,DISRAELI sweeps through a prattle of back-benchers.
scene42,slugline,,"EXT. PUBLIC BEACH, ISLE OF WIGHT - DAY"
desc42.303,desc,,BROWN and ARCHIE crash into the water. It is freezing. BROWN braces himself against the icy shallows by bellowing Burns at the sea.
utter42.304,utter,BROWN,"My heart's in the Highlands, my heart is not here! My heart's in the Highlands a-chasing the deer! Chasing the wild deer and following the roe! My heart's in the Highlands wherever I go!"
desc42.305,desc,,"ARCHIE is so creased up with laughing, he almost drowns."
scene43,slugline,,"EXT. PUBLIC BEACH, ISLE OF WIGHT - DAY"
desc43.306,desc,,"A few minutes later, BROWN and ARCHIE hurry back up the cold beach to rub themselves dry. BROWN is very energized."
utter43.307,utter,BROWN,"One box of biscuits, one box of drop tablets, one box of pralines, sixteen chocolate sponges. It's the same order every week, but does anybody bother to check it? Now she has to travel all the way to Balmoral without the few luxuries she actually enjoys."
utter43.308,utter,ARCHIE,So? Someone'll send it on ahead.
utter43.309,utter,BROWN,"Aye, but will they?"
utter43.310,utter,ARCHIE,"John, it's not your problem what she eats."
utter43.311,utter,BROWN,"The woman's surrounded by fools! (beat) She has to be packed and ready to leave by seven thirty tomorrow morning. Knowing that lot, they'll still be dressing her at eight."
desc43.312,desc,,BROWN takes a nip of whiskey and offers some to his brother.
utter43.313,utter,ARCHIE,She's got an army of people to get her up and out.
utter43.314,utter,BROWN,But I'm the only one she trusts.
desc43.315,desc,,ARCHIE stares at him. A beat.
utter43.316,utter,ARCHIE,"She'll blow hot and cold on you, John, she always does. You want to be careful."
utter43.317,utter,BROWN,I'm on ninety pounds a year plus seventy pounds for a pile of tartan I'd be wearing anyway. That's as much as a Page of the Back Stairs gets and that job's only for toffs. (raising his hip flask triumphantly at the sea) I'm Her Majesty's Highland Servant! Indoors and Out. There's no stopping me now.
scene44,slugline,,EXT. BALMORAL CASTLE - NIGHT A few days later. The clatter of carriage and horse as the ROYAL PARTY
desc44.318,desc,,thunders through gathering dark toward Balmoral Castle.
scene45,slugline,,"CAPTION: ""BALMORAL"" EXT. BALMORAL CASTLE - TWILIGHT"
desc45.319,desc,,"A mass of torches encircle the ROYAL PARTY as kilted GHILLIES and STAFF swarm round the carriage, opening doors and clambering off boxes while a regiment of PIPERS play them in. Amid this swarm of activity, we glimpse BROWN opening the door to a smiling VICTORIA as she climbs down, followed by PRINCESS HELENA and PRINCESS LOUISE. Emerging from another carriage come BERTIE and PRINCESS ALEXANDRA, staring grim faced at the castle. HENRY PONSONBY and DOCTOR JENNER alight from their carriage as PONSONBY slips on his gloves and pinches his nose at the pain of remembrance."
utter45.320,utter,PONSONBY,"Oh God, not the pipes!"
scene46,slugline,,EXT. LOCHNAGER - DAY The next day.
desc46.321,desc,,"High over the vast, bleak mountains of Lochnager and Loch Muick. VICTORIA and BROWN are riding fast towards the top. Reaching the summit, VICTORIA points excitedly at the far horizon."
utter46.322,utter,VICTORIA,What are those?
utter46.323,utter,BROWN,What?
utter46.324,utter,VICTORIA,"Those, over there, there."
utter46.325,utter,BROWN,(horse chestnut trees...) Craobhan-geanmchno-fhiadhaich.
utter46.326,utter,VICTORIA,(beat) Craobhan-geanmchno... (bursts out laughing) How can I possibly say that with a straight face?!
desc46.327,desc,,BROWN lets it go and they ride on.
utter46.328,utter,VICTORIA (CONT'D),"I am thinking of publishing my ""Highland Journals."""
utter46.329,utter,BROWN,Are they worth reading?
utter46.330,utter,VICTORIA,(beat) I am told so.
utter46.331,utter,BROWN,Who by?
utter46.332,utter,VICTORIA,Sir Henry Ponsonby tells me they are charming.
utter46.333,utter,BROWN,What does he know about the Highlands?
utter46.334,utter,VICTORIA,He has been attending at Balmoral for many years.
utter46.335,utter,BROWN,That doesn't make him an expert.
utter46.336,utter,VICTORIA,"His remarks were directed at the quality of the writing, not its subject."
utter46.337,utter,BROWN,"I don't groom a horse to have it admired by others, I groom it because it needs grooming."
utter46.338,utter,VICTORIA,(curtly) I do not do it for others. But Ponsonby thinks they are good.
utter46.339,utter,BROWN,"Just say what you have to say, woman. What other people think shouldn't matter to you."
utter46.340,utter,VICTORIA,(snapping) Of course I shall say what I have to say. I always do.
desc46.341,desc,,The stare at each other until BROWN kicks his horse on.
utter46.342,utter,BROWN,"Aye, well, if all you want is a good opinion then he'd be sure to oblige you."
utter46.343,utter,VICTORIA,"(riding alongside) What Mr Ponsonby was appreciating was their literary merit, a skill not intimately associated with the knowledge of grooming. (beat) Literary appreciation does not begin and end with Tennyson."
desc46.344,desc,,BROWN lowers his head.
utter46.345,utter,VICTORIA (CONT'D),(in a softer tone) I mention you in them.
desc46.346,desc,,BROWN says nothing.
utter46.347,utter,VICTORIA (CONT'D),"In particular, the occasion when Albert was alive; the Royal Carriage overturned during a storm and you demonstrated such loyal service in returning the Queen and the Princesses safely to Balmoral."
desc46.348,desc,,"Taking a sprig of heather from her brooch, VICTORIA holds it out to him. A beat."
utter46.349,utter,VICTORIA (CONT'D),For friendship.
scene47,slugline,,INT. BALMORAL CASTLE - DAY
desc47.350,desc,,"A few days later, PONSONBY, DOCTOR JENNER and BROWN stand at the chamber-desk, talking over the Queen's itinerary."
utter47.351,utter,BROWN,(briskly) She'll be away on Friday between eight o'clock and six in the evening to visit the Grants in Glasalt. If she's to make the journey there and back in the day she's to have no distractions the night before. She'll take a light supper alone in her private drawing room and retire early.
utter47.352,utter,PONSONBY,She'll need to sign dispatches before she retires.
utter47.353,utter,BROWN,That can wait till the weekend.
utter47.354,utter,PONSONBY,There are important papers from --
utter47.355,utter,BROWN,It can wait. Anything else?
utter47.356,utter,JENNER,Are you sure Her Majesty is up to such a long journey? She has only just recovered from a severe head cold.
utter47.357,utter,BROWN,"If I thought she wasn't up to it, I wouldn't let her go, would I?"
desc47.358,desc,,"BROWN snaps together his papers and walks out, leaving PONSONBY and DOCTOR JENNER standing lamely at the table."
scene48,slugline,,EXT. BALMORAL CASTLE - DAY
desc48.359,desc,,"The next morning. The ROYAL FAMILY are picnicking in the grounds. VICTORIA walks along a path accompanied on one side by BROWN, on the other by BERTIE. BERTIE is in mid-plea."
utter48.360,utter,BERTIE,Surely it is for the gentlemen to decide when to stop...
utter48.361,utter,VICTORIA,"It is a disgusting habit, Bertie. It should be discouraged."
utter48.362,utter,BERTIE,"Yes, but isn't midnight a little excessive?"
utter48.363,utter,VICTORIA,It is quite late enough.
utter48.364,utter,BERTIE,"But mama, the room was built expressly for that purpose. It has been a smoking-room by tradition ever since father --"
utter48.365,utter,VICTORIA,(cutting in angrily) Brown's responsibilities are onerous enough already. He has far too much to do without having to stay up all night waiting for you to go to bed. The smoking-room will be closed and the lights put out at twelve o'clock.
utter48.366,utter,BERTIE,Mama...
utter48.367,utter,VICTORIA,And that is my last word on the matter.
utter48.368,utter,BERTIE,"Well, I'm sorry, but I really do think it's too much that the gentlemen of the house should be dictated to by a servant."
utter48.369,utter,BROWN,It's the Queen's decision.
utter48.370,utter,BERTIE,I beg your pardon? (to VICTORIA) Mama...?
desc48.371,desc,,"Before Bertie can continue, BROWN steps right into his face."
utter48.372,utter,BROWN,I think you should go now. (beat) You've tired your mother enough.
desc48.373,desc,,"BERTIE stares back, too stunned to speak. He glances at his mother, but VICTORIA looks off into the distance as if she has not heard. BERTIE turns and storms away."
scene49,slugline,,"INT. ESTATE COTTAGE, BALMORAL - DAY"
desc49.374,desc,,"JOHN BROWN is standing in the doorway of a small cottage watching, with amused detachment, as a middle-aged couple, MR and MRS GRANT, race about their tiny living room, trying desperately to make it presentable for the Queen's sudden visit. They fling open the windows, slosh water on the fire, tidy up their two grubby BOYS, plump up the cushions, dump knitting under the sofa and try to smarten themselves up, all in the space of a few seconds."
utter49.375,utter,BROWN,There's really no need for this.
utter49.376,utter,MRS GRANT,"I'll not have her seeing it like it is! (beat) I know she means well, but I wish she'd warn us she was coming."
utter49.377,utter,BROWN,"She thinks if she warned you, you'd go pouring water on the fire and stuffing the knitting under the sofa."
utter49.378,utter,MR GRANT,"Aye, well, you can't stop a wife being house-proud."
desc49.379,desc,,MRS GRANT surveys the room critically.
utter49.380,utter,MRS GRANT,All right. (beat) Show her in.
scene50,slugline,,"EXT. ESTATE COTTAGE, BALMORAL - DAY"
desc50.381,desc,,VICTORIA sits on a horse and trap. BROWN steps out and helps her down.
utter50.382,utter,BROWN,They're ready now.
utter50.383,utter,VICTORIA,"I hope they didn't go to any trouble, John."
utter50.384,utter,BROWN,"Ah, well..."
scene51,slugline,,"INT. ESTATE COTTAGE, BALMORAL - DAY"
desc51.385,desc,,"VICTORIA steps in to be greeted by all four GRANTS in one military row, smoke still steaming off the fire. BROWN stands behind her, barely able to contain himself. But for VICTORIA, it is all she's ever known and so she takes it as perfectly normal."
utter51.386,utter,VICTORIA,Mr Grant. How good it is to see you.
utter51.387,utter,MR GRANT,(bowing deeply) Your Majesty.
utter51.388,utter,VICTORIA,Mrs Grant. How is your knee? Has the pain eased a little?
utter51.389,utter,MRS GRANT,"(bobbing in terror) Oh not so bad, ma'am."
utter51.390,utter,VICTORIA,Good. Oh and here are Douglas and John. Haven't you grown?
utter51.391,utter,MRS GRANT,"(still bobbing away) Growing all the time, ma'am."
desc51.392,desc,,MR GRANT remembers himself and gestures VICTORIA towards a chair.
utter51.393,utter,MR GRANT,"Will you sit, ma'am?"
desc51.394,desc,,"From his place by the wall, BROWN notices how easily she smiles as she is led to the chair. She points to a picture on the wall and her good humour is infectious."
utter51.395,utter,VICTORIA,"I know that! That's Cairn Lochan. We picnicked there once, did we not, John?"
scene52,slugline,,"INT. A SOCIETY PARTY, LONDON - DAY"
desc52.396,desc,,"A few days later, a party of ARISTOCRATS, MINISTERS, DIPLOMATS, ESCORTS, BUSINESSMAN and WHORES. Into this brouhaha come DISRAELI, his elderly wife MARY ANNE and the young STANLEY. It is all eyes and nods here. Everyone knows everyone."
utter52.397,utter,DISRAELI,"Ah, the greasy pole."
utter52.398,utter,MARY ANNE,"Don't be facetious, dear. Remember your position."
utter52.399,utter,DISRAELI,It's my position I'm thinking of.
