segment-id,segment-type,segment-speaker,segment-text
scene28,slugline,,EXT: SHOPPING CENTER - MORNING
desc28.223,desc,,The Minions climb down the fire escape and onto the sidewalk. Kevin asks a passing MAN for directions. Bello!
utter28.224,utter,KEVIN,Orlando?
desc28.225,desc,,"He keeps walking, with no response. Ugh."
utter28.226,utter,KEVIN (CONT'D),Blumock.
desc28.227,desc,,Stuart notices a yellow fire hydrant...and begins hitting on it.
utter28.228,utter,STUART,"Oh! Hello, papaguena! comme le papaya."
desc28.229,desc,,"A BABY in a STROLLER goes past Bob and Kevin. The Baby COMPLETELY UNDERSTANDS HIM. He babbles back. return it. It's a serious conversation that we don't understand a word of, except for ""Orlando."" They The Baby gives directions and POINTS off into the distance. Ah!"
utter28.230,utter,BOB,"Okay, thank you, baby! Bye bye!"
desc28.231,desc,,"BABY IN STROLLER The Baby resumes teething on a toy truck, happy to have given the information. Kevin POINTS in the same direction."
utter28.232,utter,KEVIN,Callo to ORLANDO!
desc28.233,desc,,They drag a protesting Stuart away from the fire hydrant and proceed down the street.
desc28.234,desc,,"They continue to walk, with Stuart sulking behind. MINIONS"
scene29,slugline,,INT: BROOKLYN BRIDGE - DAY
desc29.235,desc,,"The Minions walk over the BROOKLYN BRIDGE, away from New York City."
scene30,slugline,,EXT: ROAD - DAY
desc30.236,desc,,"The Minions sit at the side of the road, exhausted. look discouraged. Across the street, a HIPPIE hitchhikes. They Kevin observes him."
utter30.237,utter,KEVIN,"Hey, Stuart, comma le."
desc30.238,desc,,Stuart and Bob look on as a HIPPIE BUS picks up the hitchhiker.
utter30.239,utter,HIPPIE,"Oh yeah, far out! brother."
desc30.240,desc,,"Love is the way, Kevin, now understanding how to hitchhike, raises his thumb, but Stuart pushes him out of the way."
utter30.241,utter,STUART,"No, no, Kevin. Me me do it. Speta."
desc30.242,desc,,"Stuart approaches the side of the road with his thumb raised. A semi-truck passes right by, knocking Stuart off his feet. Kevin and Bob LAUGH at him."
utter30.243,utter,KEVIN,"(imitates Stuart) No, no, no. Me do it. Me do it. Speta. Che le blumock. He tries again, frustrated. Stopa!"
utter30.244,utter,STUART,Stopa! Stopa!
desc30.245,desc,,"An ELDERLY WOMAN slowly drives by humming along to ""Ride of the Valkyries,"" ignoring the Minions. The Hippie's hitchhiking paper sign blows into Stuart's face. He hands it to Kevin. Here."
utter30.246,utter,STUART (CONT'D),Tu le do it. Makaro!
desc30.247,desc,,MINIONS
desc30.248,desc,,"He then proceeds to sit on a rock, which he throws in frustration. The rock slides out from beneath him. He SCREAMS, annoyed. Kevin shrugs. KEVIN Stuart le bisetto. He writes the word ""Orlando"" on the sheet of paper. Another CAR is coming. Kevin walks to the center of the road and holds the ""ORLANDO"" paper above his head. The car approaches, no indication of stopping, but Kevin stands his ground. Bob SCREAMS as the car, a family station wagon with suitcases piled on the top, stops right in front of Kevin, inches away. Scary silhouettes come through the dust. The station wagon door opens, revealing an intimidatinglooking husband and wife in the front seat. The woman pets a CAT, which she holds in her lap. WALTER, the father, a conservatively-dressed suburban type, glares at the Minions. MADGE, Walter's wife, is June Cleaver-meets-kill-you-with-acleaver. She slices an APPLE with a SCARY KNIFE. And then a SMILE breaks out on Madge's face."
utter30.249,utter,MADGE,"Oh, Walter, look! These adorable little freaks are headed to Orlando too!"
utter30.250,utter,WALTER,"Yeah, I see that!"
desc30.251,desc,,"Hey, Walter Jr.! WALTER JR. is a massive adolescent hulk. window excitedly."
utter30.252,utter,WALTER JR.,What's happenin'? Tina!
desc30.253,desc,,TINA is the teenage daughter.
desc30.254,desc,,He rolls down the MINIONS Binky!
desc30.255,desc,,Walter helps BINKY wave to the Minions.
utter30.256,utter,WALTER (CONT'D),Whaddya say we give these fellas a ride? Yaaay!
utter30.257,utter,NELSON FAMILY,New friends!
utter30.258,utter,WALTER,All aboard the Nelson Express!
utter30.259,utter,WALTER JR.,(pointing to Stuart) You--one eye! You're sittin' next to me!
utter30.260,utter,STUART,"Uh, that's oka--KEVIN"
desc30.261,desc,,Kevin grabs Stuart and pushes him into the car.
scene31,slugline,,INT: NELSON FAMILY STATION WAGON
desc31.262,desc,,They all Kevin and Stuart are crammed in the backseat with the kids. Walter Jr.'s gigantic stature is really making them cramped. Bob is in the front with Walter and Madge.
utter31.263,utter,MADGE,Glad we came along before some weirdos picked you up!
desc31.264,desc,,Madge GIGGLES. She holds up an apple slice.
utter31.265,utter,MADGE (CONT'D),Who wants apple slices? Oooooh!
desc31.266,desc,,Bob takes one.
utter31.267,utter,BOB,Oooooooh!
utter31.268,utter,BL Draft MADGE,"Oh, you too. Growing...uhhh...boylike...creatures need their strength."
desc31.269,desc,,"Stuart sees Walter Jr. staring at the apple slice, licking his lips. He holds it up, as if to say ""you want it?"""
desc31.270,desc,,Walter Jr. GULPS IT. He SLAPS Stuart on the back.
utter31.271,utter,WALTER JR. (CONT'D),THANKS MAN!
desc31.272,desc,,Walter pulls the car over.
utter31.273,utter,WALTER,"Alrighty, who needs to stretch their legs?"
utter31.274,utter,WALTER JR.,Yeah! Ooh! Ooh! (squeal)
utter31.275,utter,TINA,"Yes, me, me, me!"
desc31.276,desc,,"Walter takes out a GUN, pulls down a ski mask. Madge, Walter Jr., and Tina take out GUNS and put on SKI MASKS."
utter31.277,utter,MADGE,"You guys wait here, we'll be right back."
utter31.278,utter,WALTER,"Okay Nelsons, let's do this!"
desc31.279,desc,,"The Nelsons exit the car. The Cat, still sitting on the front seat, and also wearing a ski mask, MEOWS."
utter31.280,utter,KEVIN,Uhh...potakino?
desc31.281,desc,,Stuart shrugs. REVEAL that the car is sitting in front of a BANK. MINIONS
desc31.282,desc,,"And we IMMEDIATELY hear MUCH YELLING AND SCREAMING coming from inside the bank. BANK ALARM. The Nelsons RUN OUT OF THE BANK, clutching bags of money..."
utter31.283,utter,WALTER,"Go, go, go!"
desc31.284,desc,,They get in the car. Take off the masks.
utter31.285,utter,WALTER (CONT'D),"Okey-dokey, on the road again!"
desc31.286,desc,,"They take off, speeding down the road. BEHIND THEM, SIRENS BLARING! COP CARS PULL UP"
utter31.287,utter,TINA,"Dad, we got company! It's because I tripped the alarm, I stink!"
utter31.288,utter,WALTER,"Hey, we ALL make mistakes, sugar plum. TINA Ugh!"
utter31.289,utter,WALTER,You're still learning.
desc31.290,desc,,Walter leans out the window and begins to FIRE PAINT-BALLS at the POLICE CARS' WINDSHIELDS. Huh!
utter31.291,utter,COPS,What?
utter31.292,utter,MADGE,"Your father's right, Tina-RELOAD!"
desc31.293,desc,,"He tosses his gun to Madge, who reloads for him."
utter31.294,utter,MADGE,He wasn't this good at being evil overnight.
utter31.295,utter,WALTER BL Draft MADGE,Your time's coming!
desc31.296,desc,,"Walter HUMS joyfully as he fires, but then his weapon gives"
utter31.297,utter,WALTER,It's jammed!
desc31.298,desc,,A police car rams the back of the station wagon. Ow!
scene32,slugline,,WALTER (CONT'D)
desc32.299,desc,,"Walter struggles to keep control of the car. When the windshield wipers on the police car wipe away the paint, the cops see that the Nelsons' station wagon has turned 180 degrees and is facing their car. Huh?"
scene33,slugline,,COP
desc33.300,desc,,"Walter REVERSES down the street at an alarming speed. Kevin grabs a TINY PISTOL. Stuart grabs a HUGE MISSILE BLASTER. They begin to fight over the weapons. WALTER HITS a bump in the road, turning the car in the right direction... Stuart accidentally FIRES a MISSILE at a TELEPHONE POLE! It falls, starting a chain reaction which knocks down a row of poles and ultimately, a WATER TOWER, blocking the COP'S PATH and causing a pile-up!"
utter33.301,utter,WALTER,"Okay, who did that?"
desc33.302,desc,,Kevin pushes the weapon over to Stuart and blames him.
utter33.303,utter,KEVIN,"C'est Stuart! But, but--"
utter33.304,utter,STUART WALTER,"That was great! Heh, heh."
utter33.305,utter,STUART,Thank you.
desc33.306,desc,,Kevin and Stuart begin to fight over the weapon once again. MINIONS
utter33.307,utter,MADGE,"Say, fellas...can we get personal for just a second? Why ARE you going to Orlando?"
desc33.308,desc,,"Kevin and Stuart look at each other, unsure of what to say."
utter33.309,utter,STUART,Uh...topalino arrabiata?
utter33.310,utter,WALTER,"Come on, you can tell us. You're going to Villain Con, aren't ya? The Minions smile sheepishly."
utter33.311,utter,STUART,"Si, Villain Con!"
utter33.312,utter,BOB,(sings) Villain Con!
utter33.313,utter,MADGE,"Wow, so many bad guys in the car, what fun!"
utter33.314,utter,WALTER,"I knew it! I knew you were villains, didn't I, honey? What a small world! Hope we're not in rival gangs!"
desc33.315,desc,,Binky takes out a GRENADE and pulls the pin. Binky!
utter33.316,utter,WALTER (CONT'D),"Joke! Heh, babies, huh?"
desc33.317,desc,,Walter hurls the grenade out the window and it EXPLODES in the background.
scene34,slugline,,INT: MINION CAVE - NIGHT
desc34.318,desc,,Several Cheerleader Minions are rooting for a lifeless soccer game. One minion kicks the ball toward the net. The goalie unenthusiastically reacts several moments after the ball has already scored.
utter34.319,utter,MINIONS,(half-heartedly) Yaaaaay.
utter34.320,utter,MINIONS,Hey!
utter34.321,utter,BL Draft DAVE THE MINION (O.S.),Big Boss! Les finto les boss!
desc34.322,desc,,"The Minions head over to the cave entrance, where they begin to BOW DOWN to an unseen giant creature, revealed to be a YETI. Dave quiets the Minions so their new leader can speak. Ssssh!"
utter34.323,utter,DAVE THE MINION (CONT'D),Le boss le parla! Blah!
desc34.324,desc,,The Minions CHEER!
scene35,slugline,,INT: NELSON FAMILY STATION WAGON - DAY
desc35.325,desc,,"The Nelson family drives in Central Florida. Walter Jr. sleeps peacefully, holding a wide awake Stuart like teddy bear. Drool DRIPS out of his mouth. Stuart tries to BLOW it away from him. Kevin, sitting next to Tina, sees her paging through a VILLAIN-CON INTERNATIONAL guidebook."
utter35.326,utter,TINA,"When we get to Orlando, I'm gonna get all my favorite villains to sign my magazine! Dumo the Sumo--KEVIN Ooh, c'est le Boss?"
utter35.327,utter,TINA,"Oh Kevin, you don't wanna work for him, he ate his last henchmen."
desc35.328,desc,,She turns the page.
utter35.329,utter,TINA (CONT'D),Frankie Fish-Lips! He lives in the Ocean. Le boss?
utter35.330,utter,KEVIN TINA,Uhhh...can you breathe underwater?
utter35.331,utter,KEVIN,(thinks) So-so.
utter35.332,utter,BL Draft TINA,Look at HER---
desc35.333,desc,,"She unfolds the magazine's CENTERFOLD revealing SCARLET OVERKILL, a stunning woman clad in all-red, holding a crossbow and standing atop a pile of other villains."
utter35.334,utter,TINA (CONT'D),"Scarlet Overkill, the coolest super villain, like, EVER! She started out as your average little girl,"
desc35.335,desc,,"braces, pigtails...BUT by the time"
desc35.336,desc,,Kevin is intrigued.
utter35.337,utter,KEVIN,Ahh...Scarlet Popapeil.
utter35.338,utter,WALTER,Here we are! Beautiful Orlando!
utter35.339,utter,TINA,"Yeah, we're here!"
scene36,slugline,,"EXT: ORLANDO, FLORIDA - DAY"
utter36.340,utter,Orlando!,But nothing is there yet.
desc36.341,desc,,Just loooots of swamp land. A sign says:
utter36.342,utter,ORLANDO,(COMING SOON!) (singing) Orlandoooo!
desc36.343,desc,,"The Nelsons pull up to a RUN-DOWN SHACK that says BAIT SHOP. 545 is painted on the side. Walter rolls down the window. There is a small mic, like he's ordering fast food at a drive-thru. There is even a menu board of different worms and fish. MINIONS"
utter36.344,utter,BL Draft WALTER,"(to car) Hey gang, watch this. CREEPY VOICE (V.O.) Welcome to Billy Bob's Bait Shop. How can I help you?"
utter36.345,utter,WALTER,"(into intercom) Yeah, hi, uh...""we're here for uh, so much fun it's a crime."""
desc36.346,desc,,"A bell on the speaker box DINGS. Suddenly, the SHACK SPLITS OPEN, and a car-sized METAL TUBE telescopes out into air, and then SLAMS TOWARDS THE GROUND... ...completely covering the Nelson Wagon. The tube RETRACTS BACK INTO THE GROUND, taking the Nelson Wagon with it. The shack FLIPS BACK TOGETHER as if nothing happened. We PAN DOWN through the ground..."
scene37,slugline,,INT: UNDERGROUND CONVENTION CENTER - ENTRANCE - DAY
desc37.347,desc,,The tube drops the Nelson Wagon onto a platform. the platform towards VILLAIN CON!
scene38,slugline,,INT: NELSON FAMILY STATION WAGON - DAY
desc38.348,desc,,"Everyone is REALLY excited! The Minions look to each other, ecstatic. STUART Villain Con! La Villain Con!"
scene39,slugline,,INT: UNDERGROUND VILLAIN CONVENTION CENTER - PARKING
desc39.349,desc,,"The Nelson Wagon parks among the other villains' cars. Their license plate reads, ""LUV2ROB."" Big armored villains get out of their big armored vehicles. The Minions and Nelsons get out. MINIONS"
utter39.350,utter,WALTER,"Alright, here we go! Well, this is it. I wanna tell ya, and I really-I mean this--I really appreciate what you did back there with the cops. Really--TINA Dad! It's FRANKIE FISH-LIPS! I can smell him from heeeeeeeere! Junior!"
utter39.351,utter,WALTER,Get my camera!
utter39.352,utter,MADGE,"Good luck in there, boys. I hope you find what you're looking for."
desc39.353,desc,,Madge WIPES a smudge from Binky's face.
scene40,slugline,,MINIONS
desc40.354,desc,,Kevin imitates Madge and wipes a smudge off Bob's face. GIGGLES.
desc40.355,desc,,The Minions turn towards the GIANT BUILDING.
utter40.356,utter,STUART,Yupaki mala Villain Con! Ha ha!
utter40.357,utter,MINIONS,Yeah! Villain Con!
scene41,slugline,,INT: UNDERGROUND VILLAIN CONVENTION CENTER - DAY
desc41.358,desc,,The Villain Con in all its glory!
desc41.359,desc,,"Weapons everywhere they look: antique, modern, futuristic. A Banner reads: ""WELCOME TO VILLAIN CON 1968."" The Minions split up to cover more ground. Bob gets in a line of hopefuls who wait to meet with a HENCHMAN PLACEMENT SPECIALIST. He is currently interviewing a lizard."
utter41.360,utter,HENCHMAN PLACEMENT SPECIALIST,Any evil talents?
desc41.361,desc,,"The Lizard BREATHES FIRE on the guy, toasting him."
scene42,slugline,,HENCHMAN PLACEMENT SPECIALIST (CONT'D)
desc42.362,desc,,Bob walks up to a FEMALE HENCHMAN PLACEMENT SPECIALIST. FEMALE HENCHMAN PLACEMENT SPECIALIST
desc42.363,desc,,"Bob nods, holds up his stuffed bear, Tim, and makes him dance."
utter42.364,utter,Bello! BOB,La la la...eh?
utter42.365,utter,FEMALE HENCHMAN PLACEMENT SPECIALIST,That's not evil OR a talent.
desc42.366,desc,,"Bob takes a piece of paper and some scissors, creates an EVIL FACE for Tim and makes him ROAR. The Henchman Placement Specialist is unimpressed."
desc42.367,desc,,"Later BOB, clutching a business card, is talking to a scientist, PROFESSOR FLUX. Flux has all sorts of gizmos and gadgets his table."
utter42.368,utter,PROFESSOR FLUX,"I'm sorry, but I'm not looking for any more servants. For I, Professor Flux, have invented THE"
scene43,slugline,,WORLD'S FIRST TIME MACHINE!
desc43.369,desc,,"There are many, many identical Professor Fluxes helping move Flux's stuff. One of them walks up to the Flux talking to Bob, and PUSHES him out of the way."
utter43.370,utter,ANOTHER PROFESSOR FLUX,"Every time I visit the future, I bring my future self back to help me! Yet another Professor pops out of the time machine. Hello!"
desc43.371,desc,,FUTURE PROFESSOR FLUX A few Professor Fluxes are moving a GIANT MACHINE.
utter43.372,utter,PROFESSOR FLUX,"Eh, move that over THERE, Professor"
desc43.373,desc,,Flux from two weeks from now! MINIONS
utter43.374,utter,BL Draft ANOTHER PROFESSOR FLUX,"(to Bob) As you can see, I don't need any"
desc43.375,desc,,"help--Future Professor Fluxes accidentally hit the original with the giant machine, breaking his neck and KILLING HIM."
utter43.376,utter,FUTURE PROFESSOR FLUX,"Oh, way to go, guys! We killed the original."
desc43.377,desc,,They all SCREAM and all the other Professor Fluxes disappear. Please!!
scene44,slugline,,ANOTHER PROFESSOR FLUX
desc44.378,desc,,"Bob walks away, confused. Meanwhile, Kevin is walking through the crowd when he sees A LARGE, RED STATUE of a WOMAN illuminated by a SPOTLIGHT looming over the crowd. He hears A VOICE coming from the statue area. HIGHLIGHT REEL ANNOUNCER (V.O.) Villain-Con Presents Our Key-Note Speaker... Kevin walks over. He looks up and sees... HIGHLIGHT REEL ANNOUNCER (V.O.)"
desc44.379,desc,,Kevin can barely contain his excitement. Stuart and Bob... He runs up to
utter44.380,utter,KEVIN,Hey! Buddies! Ma puta la Scarlet Popapiel! Komay! Komay!
desc44.381,desc,,"The Minions follow, trying to get to the convention hall."
scene45,slugline,,INT: UNDERGROUND VILLAIN CONVENTION CENTER - HALL - DAY
desc45.382,desc,,The giant hall is jam-packed with evil-doers. LARGE SPOTLIGHTS FLASH. It's like the beginning of the world's BIGGEST concert.
utter45.383,utter,BL Draft ANNOUNCER (V.O.),Are you reeeeeeeeady...
desc45.384,desc,,The Minions are getting EXCITED.
utter45.385,utter,ANNOUNCER (V.O.),...for Scarlet Overkill!
desc45.386,desc,,The SILHOUETTE of a woman appears behind a large screen. SCARLET OVERKILL (INTO MIC)
desc45.387,desc,,The crowd goes CRAZY! crowd. We see the Nelsons CHEERING in the BOOM! SCARLET OVERKILL herself ROCKETS OUT from behind the screen using an extremely stylish art-deco JET-DRESS. She LAUGHS. MINIONS
desc45.388,desc,,CROWD
desc45.389,desc,,"She lands on the stage, as the jet-dress retracts. The Minions are excited. She looks calmly at the ROARING CROWD. SCARLET OVERKILL (INTO MIC)"
desc45.390,desc,,A MAN DRESSED AS SCARLET CHEERS in the audience. MAN DRESSED AS SCARLET
utter45.391,utter,SCARLET OVERKILL,Look at all those faces out there. We are all so DIFFERENT. But we
desc45.392,desc,,"have one thing in common--FRANKIE FISH-LIPS, a SEA CREATURE gets up."
utter45.393,utter,FRANKIE FISH-LIPS,We were born with flippers? (looks around) (MORE)
utter45.394,utter,MINIONS,No?
utter45.395,utter,BL Draft FRANKIE FISH-LIPS (CONT'D),Just me? 'kay. (sits back down)
utter45.396,utter,SCARLET OVERKILL,(clears throat) We have BIG dreams. And we will do ANYTHING to make them come true. Have any of you ever dreamt of working for the greatest super villain of all time? The crowd CHEERS!
utter45.397,utter,SCARLET OVERKILL (CONT'D),"Well, what if I were to tell you that I am looking for NEW henchmen? The crowd goes NUTS!"
desc45.398,desc,,The Minions can barely contain their excitement!
utter45.399,utter,SCARLET OVERKILL (CONT'D),I truly believe somewhere out there is a villain with the potential to serve greatness! And it could be ANY of you! Kevin is hanging on her every word.
utter45.400,utter,SCARLET OVERKILL (CONT'D),"Although let's not kid ourselves, truly the only men for this job are Kevin and his Minions! Ten times the evil in half the package! I am just in awe! Let's hear it for Kevin, he saved his tribe! The TRIBE appears onstage, chanting Kevin's name!"
desc45.401,desc,,"We see that Kevin is daydreaming all of this. Stuart tries to snap him out of it. Finally, he PUNCHES him."
utter45.402,utter,STUART SCARLET OVERKILL,So...how should we do this? Hmmm...oh!
desc45.403,desc,,She HOLDS OUT HER HAND. In it is a tiny RED DIAMOND.
utter45.404,utter,BL Draft,"SCARLET OVERKILL (INTO MIC) (CONT'D) Just take it from my hand and you've got the job. No big deal, it's almost too simple. Quiet beat."
utter45.405,utter,SCARLET OVERKILL (CONT'D),"Oh come on, don't be afraid. Just take the stone and get that job. Come on!"
desc45.406,desc,,The Minions go to get up... ...and MORE VILLAINS RUSH THE STAGE.
utter45.407,utter,BIG GOON,That job is mine!
desc45.408,desc,,The BIG GOON gets onstage and begins to fight Scarlet.
utter45.409,utter,SCARLET OVERKILL,Now go easy on me...
desc45.410,desc,,She GRABS HIM by his nostrils.
scene46,slugline,,SCARLET OVERKILL (CONT'D)
desc46.411,desc,,Scarlet PUMMELS him.
utter46.412,utter,SCARLET OVERKILL (CONT'D),Love the costume.
desc46.413,desc,,"She finally TOSSES him, sending him flying back. The Minions, frightened, RUN in the other direction as more and more villains flood the stage. The Minions are pushed toward the stage among the chaos. SO COOL!! RUSHING VILLAINS The Minions are KNOCKED to the stage in the flow. Bob's teddy bear, Tim, is knocked out of his hands. We see Bob CHASING him as he is kicked around the stage. Scarlet continues to pummel the villains effortlessly. She practically juggles the ruby as the villains leap for it. Kevin and Stuart are about to leave the stage, but they see Bob still chasing around Tim. She continues to defeat the villains. MINIONS"
utter46.414,utter,BL Draft SCARLET OVERKILL,Is no one good enough?!
desc46.415,desc,,"She pummels several more villains. The BROADSWORD VILLAIN CHARGES Scarlet. She stops his blade with her heels and proceeds to kick it into the air. The sword FALLS to the stage, and she uses it to SMACK MAD DOG MCCRACKEN, a SCOTTISH VILLAIN, off the stage. We see the ruby, Tim, and villains FLYING all over the place. All the villains CONVERGE on Scarlet at the same time. You can't even SEE Scarlet as the villains PILE ON. But one by one, they go FLYING BACK, FLYING UP IN THE AIR, are chopped, kicked, kneed... Scarlet WIPES HER BROW."
utter46.416,utter,SCARLET OVERKILL (CONT'D),Ugh! Didn't my speech inspire anyone to rise up and prove themselves worthy? All these villains and yet I still have the...bear. Stuffed bear. Why am I holding a bear?
desc46.417,desc,,She then realizes that she is holding Tim in her hand instead of the ruby. The audience is STUNNED.
utter46.418,utter,SCARLET OVERKILL (CONT'D),Who has the ruby?
desc46.419,desc,,"Bob, still on the stage, sits up. He COUGHS UP THE RUBY! Scarlet sizes them up, she can't believe it. she accepts them wholeheartedly."
utter46.420,utter,SCARLET OVERKILL (CONT'D),"Wow, who who...ARE you, my knights in shining denim?"
utter46.421,utter,KEVIN,"Me le Kevin, la c'est Stuart... Yo!"
utter46.422,utter,STUART KEVIN,Et la le Bob. Minions!
desc46.423,desc,,"A BEAT, before MINIONS"
utter46.424,utter,BL Draft SCARLET OVERKILL,"(to Minions only) That...was INCREDIBLE. (to crowd) Behold! The last creatures you'd expect to win the day have emerged victorious! Everyone, meet my new henchmen, the Minions!"
desc46.425,desc,,"The remaining crowd starts CHEERING. crowd, applaud."
scene47,slugline,,"The Nelsons, in the"
desc47.426,desc,,Walter turns to a GRIM REAPER villain next to him.
utter47.427,utter,WALTER,"Hey hey, I know those guys! I gave'em a ride here! Woooo!"
desc47.428,desc,,"In his excitement, Walter shakes the Grim Reaper so hard he COLLAPSES and FALLS APART."
scene48,slugline,,EXT: UNDERGROUND VILLAIN CONVENTION CENTER - PARKING - DAY 31
desc48.429,desc,,"Scarlet puts on a pair of cool sunglasses and steers the Scarlet Jet up, up into the sky."
utter48.430,utter,SCARLET OVERKILL,"Buckle up, boys..."
desc48.431,desc,,"The Minions, sitting behind her, each in their own row, do."
utter48.432,utter,SCARLET OVERKILL (CONT'D),"...next stop, England!"
scene49,slugline,,INT: SCARLET JET - DAY
desc49.433,desc,,"The Scarlet Jet soars through the sky as Stuart sips a martini, Bob sticks his head out the window like a dog, and Kevin makes a phone call. The dial tone BEEPS..."
scene50,slugline,,INT: MINION CAVE - DAY
desc50.434,desc,,"The Minions are trying their best to entertain the Yetis. HUGE song and dance number to ""Make 'Em Laugh."" They dance around in a choreographed dance routine, ice skating, falling through the ice, etc. A phone RINGS. Minion Dave answers it. Kevin's on the other line. MINIONS"
utter50.435,utter,BL Draft DAVE THE MINION,"Bello? Hey, Kevin! Eh? Le Boss? In England? Nah! Ou le finto le boss! Speta."
desc50.436,desc,,Dave holds the phone to the crowd so Kevin can hear them
desc50.437,desc,,"A Minion blows into a TUBA. The reverb causes a HUGE icicle to fall ON TOP OF THE YETI CHIEF, KILLING HIM! The other Yetis look to the Minions."
utter50.438,utter,DAVE THE MINION (CONT'D),"Uh, bello Kevin, tu le dissay England? The Yetis look furious."
desc50.439,desc,,They GROWL.
utter50.440,utter,DAVE THE MINION (CONT'D),Scarlet Popapiel? Ah.
scene51,slugline,,EXT: MINION CAVE - DAY
desc51.441,desc,,"The Minions RUN FOR IT! but the Minions run on. Yetis in hot pursuit. They stop,"
scene52,slugline,,INT: SCARLET JET - DAY
desc52.442,desc,,Kevin hears a dial tone.
utter52.443,utter,Bello? KEVIN,Bello? Que pasa?
scene53,slugline,,EXT: SKY - DAY
desc53.444,desc,,"The Scarlet Jet SOARS over LONDON, ENGLAND in its 1960's glory. The highest building we can see is CASTLE SCARLET, an awesome castle built on a hill. MINIONS The jet parks in a hangar at the base. MINIONS"
scene54,slugline,,INT: CASTLE SCARLET - HANGAR - DAY
desc54.445,desc,,The Minions are taken aback by the size of the hangar. Whoa... Scarlet helps Bob off the Scarlet Jet's ladder.
utter54.446,utter,SCARLET OVERKILL,"Here we go! There. By the way, I"
desc54.447,desc,,"really like your bear. She notices her husband, Herb. Herb!"
utter54.448,utter,SCARLET OVERKILL (CONT'D),My baby!
desc54.449,desc,,"HERB OVERKILL, a cool hipster in a suit, sits casually in a CHAIR that lowers down into the room. Scarlet walks over to him and HUGS him."
utter54.450,utter,HERB OVERKILL,You know I am! How'd it go? you evil? SO evil!
desc54.451,desc,,Were SCARLET OVERKILL
utter54.452,utter,HERB OVERKILL,"Oh, a little bird dropped this off today..."
desc54.453,desc,,He hands her a greeting card with a little bird on it. The bird's heart pops out on a spring when Scarlet opens the card.
utter54.454,utter,HERB OVERKILL (CONT'D),"(whispering) I missed you. H. It's me, I'm the H. Also there was no bird. Also me."
utter54.455,utter,SCARLET OVERKILL,"Herb, seriously, I wanna dig up that William Shakespeare so he can see what true writing is. I love it."
