segment-id,segment-type,segment-speaker,segment-text
desc96.667,desc,,Scarlet is talking to reporters.
utter96.668,utter,SCARLET OVERKILL,"I don't have time to answer any questions, I just want to thank the Minions, for going above and beyond the call of duty. You are three tiny, golden pill-shaped miracle workers, and you have stolen not just England, but my heart."
desc96.669,desc,,She HUGS them. The Minions look touched.
utter96.670,utter,KEVIN,"Shana tova, le buddies? Scarlet continues to smile for the cameras. Pardon me?"
desc96.671,desc,,"Kevin takes out his wallet, shows her a huge fold-out collection of pictures of his buddies. She looks at it. La triba!"
utter96.672,utter,KEVIN SCARLET OVERKILL,"WOW, so many! Good for you. Well, you'll all get what you deserve!"
desc96.673,desc,,The Minions are EXCITED!
scene97,slugline,,This is it!
desc97.674,desc,,"They follow her, and begin singing THE MONKEES' THEME, made more Minion-centric. She leads them through numerous rooms, still singing. walk through the kitchen, bathroom, etc. They"
scene98,slugline,,INT: BUCKINGHAM PALACE - DUNGEON - DAY
desc98.675,desc,,"She leads them down a stairwell. singing... The Minions walk down, They arrive at a door at the bottom of a stairwell, confused."
utter98.676,utter,SCARLET OVERKILL,"Go ahead, go ahead!"
desc98.677,desc,,They enter the room. She SLAMS the door. Blumock. Looks in on them from the window. KEVIN They see where they are: AN OLD FASHIONED DUNGEON. Skeletons. Cobwebs. Cells drip dirty water. AND TORTURE DEVICES. Lots and lots of Torture Devices.
utter98.678,utter,SCARLET OVERKILL,"I don't want you to take this the wrong way, but I hate you. I thought I could get over what you did, but I feel so betrayed. I think, yes, I think we're gonna have to break up. And it's not you...oh wait, hold on. It is you. It's 100% you. No, no!"
desc98.679,desc,,MINIONS
utter98.680,utter,SCARLET OVERKILL,"So get comfortable, Minions. Get real, real comfortable. Because this is where you're going to spend the rest of your worthless little lives."
desc98.681,desc,,She leaves.
scene99,slugline,,INT: BUCKINGHAM PALACE - DUNGEON - CONTINUOUS
utter99.682,utter,HERB OVERKILL (O.S.),"Alright, let's do this! The Minions know that voice."
desc99.683,desc,,"They turn around: REVEAL: It's Herb, wearing an executioner mask. striped suit. And his pin-"
utter99.684,utter,KEVIN,Moca le Herb!
utter99.685,utter,HERB OVERKILL,"Who's this handsome Herb fella? No, my name is...Blerb, I'm a, a dungeon master. PREPARE FOR TORTURE, WHICH I DO!"
desc99.686,desc,,HARD CUT: The Minions are on a STRETCHING RACK. frightened. Herb STANDS BEFORE a WHEEL.
utter99.687,utter,HERB OVERKILL (CONT'D),"Alright, are we comfy? DOESN'T MATTER, THIS IS TORTURE!"
desc99.688,desc,,"He SPINS the WHEEL before him, the Minions stretch... ...and are surprisingly OKAY!"
utter99.689,utter,HERB OVERKILL (CONT'D),"(to himself) Wow, harder than I thought. Next machine!"
utter99.690,utter,HARD CUT: HERB OVERKILL (CONT'D),"Uh, welcome to Hang-Town, population: YOU! Kevin is in a noose."
desc99.691,desc,,"Herb PULLS A CORD... The floor gives out below Kevin. he's completely fine. Bob, excitedly, goes next! However, due to his shape, He's fine!"
desc99.692,desc,,"Finally, Stuart LEAPS THROUGH and does some IMPRESSIVE CIRQUE DE SOLEIL type moves via the dangling noose."
utter99.693,utter,HERB OVERKILL (CONT'D),"Guys, cut it out! This is really unprofessional!"
desc99.694,desc,,"The Minions are playing with the equipment, having a great time. Herb tries to stop them."
utter99.695,utter,HERB OVERKILL (CONT'D),"There's no laughing in the dungeon! I wanna see tears, and I wanna hear"
desc99.696,desc,,screams or I am gonna get-(notices an old-fashioned
utter99.697,utter,torture device),Wait. Oooh! I've got a groovy idea!
desc99.698,desc,,He takes a photograph of it. HARD CUT: Herb is in a stockade.
utter99.699,utter,HERB OVERKILL (CONT'D),Look at this!
desc99.700,desc,,"He pretends he's dead as Kevin takes a picture. We see a bunch of pictures taken by the Minions during the torture. Having the time of their lives with Herb. The Minions and Herb leaf through the pictures, laughing, share good times. Herb takes a selfie as he holds a spear behind his head, making it look like it's gone through his skull. SCARLET OVERKILL (OVER INTERCOM)"
utter99.701,utter,HERB OVERKILL,"Well, I hope you learned your lesson for today. Si si!"
utter99.702,utter,MINIONS,Buena!
utter99.703,utter,HERB OVERKILL,"And by the way: (pulls off mask) It was, me, Herb, the WHOLE TIME!"
desc99.704,desc,,He leaves.
desc99.705,desc,,And then comes back.
utter99.706,utter,HERB OVERKILL (CONT'D),I don't even KNOW anyone named Blerb!
desc99.707,desc,,"He leaves again. The Minions run for the door, but it SHUTS."
scene100,slugline,,INT: BUCKINGHAM PALACE - DAY
desc100.708,desc,,Scarlet is getting her hair done by the very chic FABRICE.
utter100.709,utter,SCARLET OVERKILL,I am HOURS AWAY from becoming the Queen of England! I know!
utter100.710,utter,FABRICE,It's a gas!
utter100.711,utter,SCARLET OVERKILL,I will FINALLY get my crown! Yeah...
utter100.712,utter,FABRICE SCARLET OVERKILL,It's all I've ever wanted! I'm going to be so happy!
desc100.713,desc,,"Scarlet is looking in a mirror, getting ready for the coronation."
utter100.714,utter,SCARLET OVERKILL (CONT'D),"But...let me ask you something,"
utter100.715,utter,Fabrice.,(points to hair) Does THAT--She holds up a CRAYON DRAWING that she did of herself as a young girl.
utter100.716,utter,SCARLET OVERKILL (CONT'D),(holds up picture) ---look like THIS to you?
utter100.717,utter,FABRICE,"Mmmhmm. Mrs. Overkill, the hair in that picture, it's just two wavy lines."
utter100.718,utter,SCARLET OVERKILL,"Oh, so what, now you're an art critic? Oh, but--"
utter100.719,utter,FABRICE SCARLET OVERKILL,I drew that when I was five years old! (angry) Get out of my sight!
desc100.720,desc,,"Missiles EXTEND FROM HER DRESS, she FIRES THEM at Fabrice... ...knocking him out of the castle. Herb walks in, looks out the hole in the wall caused by Fabrice."
utter100.721,utter,HERB OVERKILL,Bye Fabrice. (to Scarlet) I liked him. He was fun. So what do you think of the dress?
utter100.722,utter,SCARLET OVERKILL,"Oh, it's so beautiful. SO fashion"
desc100.723,desc,,forward. So Valentino.
utter100.724,utter,HERB OVERKILL,"Gave it a sweetheart neckline because you're my sweetheart. The high collar and cinched waist reflect a simpler, more violent"
desc100.725,desc,,time. The material is a blend of taffeta and high density body
desc100.726,desc,,"And that glow, that's nuclear."
utter100.727,utter,SCARLET OVERKILL,"Nice...Just one more thing to do. Gotta look good for the public, uggh. Do you mind?"
desc100.728,desc,,Herb pulls tight on her corset.
utter100.729,utter,SCARLET OVERKILL,"Little tighter, sweetie. (pulled tighter) Come on, I can take it. (pulled tighter) Little tighter. Tighter. (pulled tighter) Must...have...tiny waist."
desc100.730,desc,,A BUTLER walks in on the scene holding a tray of coffee.
desc100.731,desc,,The Butler awkwardly backs out of the room.
scene101,slugline,,INT: DUNGEON - CONTINUOUS
desc101.732,desc,,Kevin notices a SEWER GRATE! grating.
desc101.733,desc,,Kevin and Stuart pull off the
utter101.734,utter,BOB,Me helpa!
desc101.735,desc,,"They toss it onto Bob, who can barely support it. La sartod!"
utter101.736,utter,KEVIN,BOB Helpa me!
scene102,slugline,,INT: SEWERS OF LONDON - DAY
desc102.737,desc,,"Kevin, Stuart and Bob make their way through the sewer, trying to make it to Scarlet. Bob PETS a RAT. They climb up a ladder, out of the sewer..."
scene103,slugline,,INT: FUNERAL HOME - DAY
desc103.738,desc,,The Minions PUSH THROUGH FLOORBOARDS... ...and see they have made it into a funeral home...where a funeral is going on. Family members gather around a coffin.
desc103.739,desc,,Uh se para...una otra. Kevin and Stuart leave...
scene104,slugline,,INT: SEWERS OF LONDON - DAY
desc104.740,desc,,"Kevin and Stuart walk on...but where's Bob? He drops down the ladder, clutching a FUNERAL WREATH. MINIONS"
utter104.741,utter,BL Draft BOB,Para la Scarlet!
desc104.742,desc,,"Kevin thinks for a moment. He pulls out a pen and crosses out ""FOR YOUR LOSS"" and adds ""SCARLET."" A BUMBLEBEE flies into the wreath. Bob doesn't notice. beckons the rat to come along with them. He The Minions climb up another ladder."
scene105,slugline,,EXT: ABBEY ROAD - DAY
desc105.743,desc,,"They POP UP beneath a sewer cover. They are in the ABBEY ROAD crosswalk, peeking out beneath the lid. We see the legs of THE BEATLES step on top of the Minions as they walk across the street."
scene106,slugline,,EXT: STREETS OF LONDON - DAY
desc106.744,desc,,"Scarlet's carriage and caravan heads down the street. The MAN DRESSED AS SCARLET from Villain Con pushes through the crowd and shouts to Scarlet. MAN DRESSED AS SCARLET I love you, Scarlet!"
utter106.745,utter,SCARLET OVERKILL,"(to crowd) Queen wave, queen wave! Queen waving!"
scene107,slugline,,INT: WESTMINSTER ABBEY - DAY
desc107.746,desc,,Villains rise as Scarlet walks into the sprawling main room. Thousands of candles. Huge chandeliers. Scarlet proceeds down the center aisle with Herb.
desc107.747,desc,,"I'm so SO excited, this is PERFECT! Everyone looks so nice... She GRABS Tina Nelson's face and SHAKES it."
utter107.748,utter,SCARLET OVERKILL (CONT'D),"Oh, you are just adorable. Oh yes!"
desc107.749,desc,,MINIONS
utter107.750,utter,BL Draft SCARLET OVERKILL,"And that MUSIC, oh, who IS that organist? She is good, right? She looks like an Edna? (to organist) Edna! You are very good!"
desc107.751,desc,,"The Elderly Lady Organist gives her the thumbs up. They approach the ARCHBISHOP, flanked by MOBSTERS on either side."
utter107.752,utter,HERB OVERKILL,"(to Archbishop) Thanks for doing this, padre. fan."
desc107.753,desc,,"Scarlet, in her exuberance, SQUEEZES HIS FACE."
utter107.754,utter,SCARLET OVERKILL,"Come here, let me squeeze you! Ooh! You are so squishy!"
scene108,slugline,,EXT: WESTMINSTER ABBEY - SEWER GRATE - EVENING
desc108.755,desc,,The Minions lift up a manhole cover and see that they are right in front of Westminster Abbey. Bob is still carrying the rat.
utter108.756,utter,KEVIN,"Go, go, go!"
desc108.757,desc,,They run up to the door of the Abbey. They try to open it. It's locked. Stuart RAMS his head against the wood.
utter108.758,utter,STUART,"Ouch, ouch..."
desc108.759,desc,,Kevin decides to try another way. Bob tries to take the rat.
utter108.760,utter,KEVIN,"Le poochy, sayonara!"
desc108.761,desc,,Kevin motions the rat can't come any further. at Bob. Bob looks at the rat. The rat looks
utter108.762,utter,BOB,"Ciao, le poochy."
desc108.763,desc,,"He then begins to sing ""Auld Lang Syne"" as a goodbye song to the Rat (aka ""Poochy""). MINIONS"
desc108.764,desc,,Kevin YANKS HIM OFF-SCREEN.
utter108.765,utter,KEVIN,"(sighs, annoyed) Bob...komay! Stuart!"
utter108.766,utter,STUART,"(dazed) Si, si..."
scene109,slugline,,EXT: WESTMINSTER ABBEY - CONTINUOUS
desc109.767,desc,,The Minions begin to scale the wall of the Abbey. to a Pigeon nesting on a ledge. Bob WAVES They make it to the roof. Kevin looks inside...
utter109.768,utter,KEVIN,"Okay, la comme."
utter109.769,utter,ARCHBISHOP (O.S.),Will you to your power cause law and justice...
desc109.770,desc,,"The Bee from the wreath flies around Stuart's head. He swats at it. Then it lands on Bob's forehead. Stuart SMACKS Bob in the forehead, and Bob begins to CRY. Stuart APOLOGIZES. But then the Bee lands on Bob again. Stuart HITS him again, causing a SLAP-FIGHT. But then the bee begins to chase after both of them! They run away and JUMP INTO THE CHARGE... ...landing on a CHANDELIER. They begin to run in circles away from the bee on the chandelier, causing it to UNSCREW from the ceiling."
utter109.771,utter,KEVIN,"No, no, no..."
desc109.772,desc,,Kevin looks and sees Scarlet and Herb right beneath the chandelier.
utter109.773,utter,ARCHBISHOP (O.S.),"Do you Scarlet Overkill, solemnly promise..."
desc109.774,desc,,"Stuart and Bob SWITCH directions as they run away from the bee, causing the chandelier to screw back into place. Se bona!"
utter109.775,utter,KEVIN,Yeah!
desc109.776,desc,,MINIONS
desc109.777,desc,,But then they change directions again. Nooo!
scene110,slugline,,KEVIN (CONT'D)
desc110.778,desc,,"Kevin makes his way over to the chandelier on a support wire. He SLAPS the bee away. Bob and Stuart are exhausted. They lay on the chandelier, which stops spinning. Kevin, still holding onto the support wire, REACHES for Stuart and Bob. They grab his hand, but Bob's foot GETS STUCK on the chandelier. It begins to teeter. Below, the crown is about to be placed on Scarlet's head. She GIGGLES with excitement as the Archbishop holds the crown."
utter110.779,utter,ARCHBISHOP,"I proclaim thee, Scarlet Overkill, the Queen of England!"
desc110.780,desc,,The Archbishop is about to put the crown on Scarlet's head. She's ecstatic! We've never seen a human being SMILE THIS BIG! But then... Scarlet notices the chandelier falling toward her. But she also sees Kevin and the Minions dangling above. KEVIN!!
scene111,slugline,,SCARLET OVERKILL
desc111.781,desc,,"The chandelier finally UNSCREWS completely, PLUMMETING to the ground. Kevin manages to grab Stuart and Bob before it falls. The chandelier SLAMS DOWN on Scarlet. Hard."
utter111.782,utter,HERB OVERKILL,"(crying) Scarlet! Scarlet, my queen! (to villains) Somebody help me!"
desc111.783,desc,,"The Villains rush toward Herb. The Minions quietly slide down the curtain, getting them to ground level. They run into the crowd. A few villains try to pull up the chandelier."
utter111.784,utter,HERB OVERKILL (CONT'D),"(crying) Come on, come on...lift on two! ONE--TWO!! ONE--TWO!! ONE--TWO!!"
desc111.785,desc,,"They're almost at the door...when they hear a LOUD CRASH. Scarlet's dress ACTIVATES. She SHOOTS UP and TOSSES THE CHANDELIER into the air. She hovers above the crowd. Bruised. Harried. Chest heaving, ENRAGED. Scarlet!"
utter111.786,utter,HERB OVERKILL (CONT'D),You're okay!
desc111.787,desc,,"She puts up her hand, points with a shaking finger. HE."
utter111.788,utter,SCARLET OVERKILL,TRIED. TO. KILL ME.
utter111.789,utter,KEVIN SCARLET OVERKILL,Villains! This is no longer a coronation.
desc111.790,desc,,She DRAMATICALLY and FURIOUSLY POINTS at the Minions!
desc111.791,desc,,It is an EXECUTION! GET THEM! The Villains begin to CHASE after the Minions through the
scene112,slugline,,hallways of the Abbey.
desc112.792,desc,,"The Nelsons stand by, watching in horror."
utter112.793,utter,WALTER,"Whoa, nelly! Run, fellas, run!"
scene113,slugline,,EXT: STREETS OF LONDON - NIGHT
desc113.794,desc,,"The Minions CRASH through stained glass windows, run for it. A beat later... The Villains burst through the building in HOT PURSUIT, taking out the ENTIRE FRONT OF THE BUILDING. The Minions run for it... The villains are gaining on the Minions. A grenade is hurled. Then the Villain who threw the grenade is hurled. He ROLLS right past the Minions. The Minions HIDE in a telephone booth. But it's occupied by a HOCKEY MASK VILLAIN, who chases them away. MINIONS"
desc113.795,desc,,"A COWBOY VILLAIN tries to lasso the Minions, but ends up tripping some of the villains. Then a HUGE DRILLING TANK drills its way through the ground. A SOVIET VILLAIN steps out of the vehicle with an AXE. Stuart and Bob run away."
utter113.796,utter,SOVIET VILLAIN,You're mine! Stuart!
utter113.797,utter,KEVIN,Bob!
desc113.798,desc,,"Kevin RUNS in the opposite direction. Stuart and Bob are chased by a CLOWN VILLAIN on a UNICYCLE. He pulls up next to them, juggling grenades. He drops the grenades on the ground. They EXPLODE. Stuart turns a corner but runs into the STOMACH of the Sumo Villain. Huh? Hey!"
utter113.799,utter,SUMO VILLAIN,I got one!
desc113.800,desc,,"The Broadsword Villain reaches for Kevin, but misses. Kevin RUNS around a light pole. The Broadsword Villain RAISES his sword, hitting the Soviet Villain. He then SWINGS at the light pole. He misses Kevin, and the light from the pole FALLS onto Broadsword Villain's head. Bob continues to run, and CLIMBS over a wall. He hides behind the wall, thinking he's safe. FRANKIE FISH-LIPS EMERGES from a puddle of water, looking sad and helpless. Bob PATS his head. But then Fish Lips GRABS Bob, pulling him underwater. Kevin continues to run, calling for Stuart and Bob. they're nowhere to be found. We PAN DOWN, BENEATH THE GROUND...to see the Minion tribe arriving in the London Underground Station. They step off the train and march through the platform."
utter113.801,utter,TRAIN STATION ANNOUNCER,(repeating) Mind the gap.
utter113.802,utter,MINIONS,Mind the gap! Mind the gap! Mind the gap!
desc113.803,desc,,One Minion SCREAMS in a CHILD's face.
utter113.804,utter,MINION ON PLATFORM,Mind the gap!!! (V.O.)
scene114,slugline,,EXT: STREETS OF LONDON - NIGHT
desc114.805,desc,,"Kevin keeps running. He sees a dirty pub with the blinds pulled, but the lights on. This is THE PIG'S SPLEEN. He runs in."
scene115,slugline,,INT: THE PIG'S SPLEEN - NIGHT
desc115.806,desc,,"Kevin runs in. Breathing heavily, he ducks down as the VILLAINS OUTSIDE pass. He sighs, tries to catch his breath. The crowd inside is raucously LAUGHING and PARTYING."
utter115.807,utter,THE QUEEN (O.S.),"Hahaha! Oh, what about this one? Hahaha! Why did the Queen go to"
desc115.808,desc,,the Dentist? To get her teeth
desc115.809,desc,,"Much laughter. That voice sounds familiar. Kevin looks: It's the Queen, standing at the bar! La Queena!"
utter115.810,utter,KEVIN BAR PATRON,"Tell us another one, Lizzy!"
utter115.811,utter,KEVIN,Uh...bello...
desc115.812,desc,,The Queen turns and sees Kevin.
utter115.813,utter,THE QUEEN,"Oh. It's you. Everyone, this is one of the little fellows who stole the monarchy from me. And how's that working out for you?"
desc115.814,desc,,Kevin starts telling the Queen about the trouble they're in.
utter115.815,utter,THE QUEEN (CONT'D),"Oh yes yes, I saw what was going on on the telly. Telly?"
desc115.816,desc,,Kevin sees the TV behind the bar is showing footage outside of WESTMINSTER ABBEY. BRITISH NEWS REPORTER (ON TV) What was meant to be the coronation
desc115.817,desc,,"terribly wrong, as--Scarlet KICKS HIM out of the way. SCARLET OVERKILL (ON TV)"
desc115.818,desc,,She holds up a TIED UP Stuart and Bob!
utter115.819,utter,Bello!,Bob!
desc115.820,desc,,BOB (ON TV)
utter115.821,utter,KEVIN,Stuart?
desc115.822,desc,,"Behind Scarlet, the tribe of Minions start filing out of the London Underground."
utter115.823,utter,SCARLET OVERKILL (ON TV),"Oh my goodness! Which one shall I kill first? Little Bob? Stuart? Bob? Stuart? Hmm? I will do it, Kevin, if you are not back here by DAWN!"
desc115.824,desc,,"Scarlet KICKS THE CAMERA OVER, as the screen CUTS TO STATIC. Oh my!"
scene116,slugline,,THE QUEEN
desc116.825,desc,,"Kevin looks at the TV, scared..."
utter116.826,utter,KEVIN,No! Les buddies!
desc116.827,desc,,"He STORMS OUT of the pub, pushing patrons out of the way."
scene117,slugline,,EXT: CASTLE SCARLET - LATER
desc117.828,desc,,Villains patrol the streets around Castle Scarlet. Kevin sneaks down the alley ways...
desc117.829,desc,,...narrowly avoiding them as he heads onto the castle grounds. But unbeknownst to Kevin... The Sumo Villain spots him. He turns to the other villains.
utter117.830,utter,SUMO VILLAIN,Ha ha ha...there he IS!
scene118,slugline,,INT: CASTLE SCARLET - TROPHY ROOM - NIGHT
desc118.831,desc,,A vent is kicked open from the inside. Kevin crawls out.
scene119,slugline,,INT: CASTLE SCARLET - HERB'S LABORATORY - NIGHT
desc119.832,desc,,"Kevin enters, steps over a laser security beam, b-lines for some weapons."
scene120,slugline,,EXT: CASTLE SCARLET - NIGHT
desc120.833,desc,,The Sumo leads the charge.
scene121,slugline,,INT: CASTLE SCARLET - HERB'S LABORATORY - NIGHT
desc121.834,desc,,Kevin loads up the lava lamp gun. Grabs a phaser. dynamite. Some knives. A rocket backpack. He looks in the mirror.
utter121.835,utter,88,Some
desc121.836,desc,,Pretty cool.
utter121.837,utter,KEVIN,"(to reflection) Whooda man? He looks particularly buff. But then his reflection changes angles, causing him to look short and fat."
utter121.838,utter,KEVIN (CONT'D),(disappointed)
desc121.839,desc,,But then he hears the villains at the door!
scene122,slugline,,EXT: CASTLE SCARLET - NIGHT
desc122.840,desc,,The Villains are using SUMO as a battering ram to take down the door! Harder!
utter122.841,utter,SUMO VILLAIN,It's just my head!
desc122.842,desc,,They manage to BREAK DOWN THE DOOR!
scene123,slugline,,INT: CASTLE SCARLET - HERB'S LABORATORY - NIGHT
desc123.843,desc,,"The villains are coming! Kevin is panicking! He takes off his gear and accidentally TRIPS into Herb's Ultimate Weapon! Closes the door... ...his butt BUMPS into some buttons, the Weapon LIGHTS UP. Startled, he bumps into a button labeled ""DO NOT PUSH THIS BUTTON."" Then into a switch marked ""DO NOT FLIP THIS SWITCH."" Then he accidentally pulls a lever marked ""DO NOT PULL THIS LEVER."" Nothing happens. He BREATHES a SIGH of relief. But that triggers an opening marked ""DO NOT BLOW INTO THIS HOLE."" Ultimate Weapon Initiated. Activation in 3...2...1... The Villains are RUSHING towards Herb's lab! They BURST IN! They're running RIGHT FOR THE POWERS BOOTH! They RAISE THEIR WEAPONS, ready to SMASH KEVIN and THE ULTIMATE WEAPON--WHOOOOSH! His shadow GROWS over the Villains... ...and KEEPS GROWING."
scene124,slugline,,EXT: CASTLE SCARLET - NIGHT
desc124.844,desc,,"The walls CRACK. Break APART. Towers TOPPLE! Villains SPILL OUT OF EVERY CRACK, DOOR, and WINDOW! Something is PUSHING THEM OUT! SOMETHING BIG! A GIANT GLOVED HAND shoots out the top window. Another GIANT GLOVED HAND PUNCHES THROUGH THE OTHER SIDE of the castle! GIANT FEET BREAK OUT FROM THE BOTTOM, lift the CASTLE off its foundation! The castle CRACKS like an eggshell, breaks off, revealing... GIANT MEGA 30 STORY KEVIN! Bello! The Villains RUN FOR IT!"
scene125,slugline,,EXT: CASTLE SCARLET - MORNING
desc125.845,desc,,Kevin looks out over the city.
desc125.846,desc,,He means BUSINESS.
utter125.847,utter,KEVIN,LES BUDDIES.
scene126,slugline,,EXT: GIANT PILE OF DYNAMITE - DAY
desc126.848,desc,,Stuart and Bob are tied to every piece of TNT that could be found in England in under five minutes. It's a lot. Scarlet knows people.
utter126.849,utter,SCARLET OVERKILL,"This is IT, boys. Things do NOT look good for you."
desc126.850,desc,,She holds up Tim. Oh.
utter126.851,utter,SCARLET OVERKILL (CONT'D),And I'm KEEPING the bear.
desc126.852,desc,,TIM!!! BOB
utter126.853,utter,SCARLET OVERKILL,"You're not gonna need him where YOU'RE going. (whispers, ""between you and me"") Heaven."
scene127,slugline,,EXT: STREETS OF LONDON - CONTINUOUS
desc127.854,desc,,"Kevin WALKS DOWN THE STREET. Fierce look of determination on his face. Kevin SHOOS away some birds, which fly right past his face. But then... ...THUCK! He stops in his tracks. REVEAL: he is stuck between buildings. tries to wedge himself out. He is TOO BIG. He continues to the next building..."
scene128,slugline,,EXT: GIANT PILE OF DYNAMITE - MORNING
desc128.855,desc,,Scarlet and Herb LIGHT the fuse.
desc128.856,desc,,"""Bye bye, say bye bye, Bob."
utter128.857,utter,STUART,Ay yay yay yay...
scene129,slugline,,EXT: STREETS OF LONDON - CONTINUOUS
desc129.858,desc,,"Kevin SQUEEZES between buildings, past an office where several typists are working. They barely notice the giant Minion walking past the window. A WOMAN applying lipstick SMEARS it across her face when she sees giant Kevin. Kevin is trying to make his way through heavy traffic. He's still having trouble squeezing his way between buildings."
scene130,slugline,,EXT: GIANT PILE OF DYNAMITE - CONTINUOUS
desc130.859,desc,,"Scarlet and Herb run away from the dynamite, LAUGHING."
scene131,slugline,,EXT: GIANT PILE OF DYNAMITE - DAY
desc131.860,desc,,"Stuart and Bob watch helplessly as the fuse is about to REACH THE EXPLOSIVES! Scarlet and Herb watch from a nearby alleyway, LAUGHING... Kevin GRABS THEM just in time! Scarlet looks up at him, in annoyed awe."
desc131.861,desc,,"Wait, What? How did he...?"
desc131.862,desc,,"But the chain of dynamite is COMING AT STUART AND BOB fast! Scarlet's dress enters ATTACK MODE. It begins growing, transforming... TURBINES pop out the back allowing for flight. All sorts of WEAPONS pop out from ALL SIDES! The dynamite continues to go off...but then a GUSH OF WATER puts out the wick! Is Kevin peeing on it? Sure looks that way... ...but NO, he's using water from a FIRE HYDRANT! He screws the hydrant back in place."
utter131.863,utter,STUART & BOB,Whoo-hooo! (looks over Kevin's shoulder) KEVIN! LABATO!
desc131.864,desc,,Kevin turns... ...to see Scarlet FLYING RIGHT AT HIM! on either side of her dress! LAVA CANNONS pop out
utter131.865,utter,SCARLET OVERKILL,"So, that's your plan? Make yourself a BIGGER TARGET?"
desc131.866,desc,,She unleashes the lava at Kevin!
scene132,slugline,,INT: TEA ROOM - CONTINUOUS
desc132.867,desc,,"Meanwhile, the Minion tribe is inside a TEA ROOM. Giant Kevin RUN PAST and they run out the door. They see"
scene133,slugline,,EXT: STREETS OF LONDON - SAME
desc133.868,desc,,"Scarlet CHARGES Kevin, knocking Stuart and Bob out of his hand! He catches them just in time. She CHARGES HIM AGAIN, knocking him to the ground! and Bob spill out onto the pavement."
utter133.869,utter,Stuart SCARLET OVERKILL (CONT'D),"And SO HELP ME, I never want to see another one of your goofy, bug-eyed"
desc133.870,desc,,faces EVER AGAIN! Scarlet!
utter133.871,utter,MINIONS,Scarlet!
desc133.872,desc,,Scarlet looks down... ...and sees THE MINION TRIBE MARCHING down the street towards her. VERY EXCITED!
utter133.873,utter,SCARLET OVERKILL,Oh you gotta be kidding me!
desc133.874,desc,,She AIMS her guns at the Minion tribe. IT! The Minions RUN FOR
utter133.875,utter,SCARLET OVERKILL (CONT'D),Oh no you don't!
