segment-id,segment-type,segment-speaker,segment-text
desc0.0,desc,,Universal/ Illumination Entertainment
scene1,slugline,,"Santa Monica, CA 90404"
desc1.1,desc,,"THIS MATERIAL IS THE PROPERTY OF ILLUMINATION ENTERTAINMENT AND IS INTENDED AND RESTRICTED SOLELY FOR ILLUMINATION PERSONNEL. DISTRIBUTION OR DISCLOSURE OF THIS MATERIAL TO UNAUTHORIZED PERSONS IS PROHIBITED. THE SALE, DISPLAY, COPYING OR REPRODUCTION OF THIS MATERIAL FOR ANY REASON IN ANY FORM, INCLUDING BUT NOT LIMITED TO DIGITAL OR NEW MEDIA, IS ALSO PROHIBITED."
scene2,slugline,,INT: MICROSCOPIC VIEW
desc2.2,desc,,"The beginning of all there is. We follow simple AMOEBAS floating about. They are shapeless single-celled organisms which bob to and fro. Suddenly, a BIGGER AMOEBA begins to PUSH AROUND the smaller amoebas, asserting its dominance. Three tiny YELLOW (MINION) AMOEBAS observe, but then an EVEN BIGGER AMOEBA gobbles up the smaller one. The tiny Minion amoebas follow the carnivorous one off-screen. As bigger and more EVIL CREATURES present themselves, the Minion Amoebas start following THEM. Yes, ever since the beginning of time, Minions just wanted to serve the most wicked master. We FOLLOW THE MINION AMOEBAS through time, as they slowly evolve, growing eyes, arms, etc. Their masters evolve as well. Eventually they begin following EVIL FISH, and then an EVIL AMPHIBIAN. As the Evil Amphibian swims to the surface, the three Minions are joined by HUNDREDS of OTHER MINIONS, as they happily follow their new master out of the water. TITLE CARD: MINIONS"
scene3,slugline,,EXT: PREHISTORIC BEACH - DAY
desc3.3,desc,,"Naked MINIONS, covered only in seaweed, follow the Evil Amphibian onto the shore."
utter3.4,utter,NARRATOR (V.O.),"Minions. Minions have been on this planet far longer than we have. They go by many names...Dave, Carl...Paul...Mike... One naked Minion notices that he has no seaweed and grabs two starfish from the water, which he places strategically on his chest."
utter3.5,utter,NARRATOR (V.O.),"...oh, that one is Norbert. an idiot. He's"
desc3.6,desc,,The Minions walk on.
utter3.7,utter,NARRATOR (V.O.),"They're all different, but they all share the same goal."
desc3.8,desc,,A giant T-REX smashes the Evil Amphibian.
utter3.9,utter,NARRATOR (V.O.),To serve the most despicable master they could find.
desc3.10,desc,,"A Minion points to the T-Rex, excited--EXCITED MINION The T-Rex ROARS."
scene4,slugline,,EXT: PREHISTORIC PLAINS - LATER
desc4.11,desc,,"The T-Rex walks along, followed by a group of Minions. Numerous Minions ride on top of him, scratching his back and scrubbing his head."
utter4.12,utter,NARRATOR (V.O),"Making their master happy was the tribe's very reason for existence. That's not to say that they didn't have OTHER passions.... Two Minions notice bananas growing on a bush. Oh, hey!"
utter4.13,utter,MINION 1,Looka! C'est un banono!
desc4.14,desc,,One tries to pull a banana from beneath a large boulder. finally pulls it out and holds it above his head triumphantly.
utter4.15,utter,MINION 2,C'est la banana! Ha ha!
desc4.16,desc,,The boulder then rolls down a steep hill toward the T-Rex.
utter4.17,utter,NARRATOR (V.O.),"Finding a boss was easy. But KEEPING a boss, therein lies the rub."
desc4.18,desc,,"The boulder hits the T-Rex and sends him rolling down the hill, balancing on the boulder with his hind legs. The Minions follow him frantically. Boss!"
utter4.19,utter,MINIONS,Boss! Big boss!
desc4.20,desc,,MINIONS
desc4.21,desc,,"The T-Rex dodges tree branches as he heads toward the edge of a cliff, which launches into a volcano. He manages to stop at the very edge. Three Minions look down after him, wanting to help, but are accidentally pushed forward when the others arrive. They roll down toward the T-Rex. Two are stopped by rocks, but the last one stops just short of the boulder. As he sits up, he accidentally knocks his head against the boulder, which sends the T-Rex plummeting into the volcano. The Minions begin to CRY. One SLAPS the Minion who caused the boulder to fall."
utter4.22,utter,NARRATOR (V.O.),"Nope, it wasn't easy for these guys. BUT they never gave up."
desc4.23,desc,,THE IMAGE DISSOLVES into a CAVE PAINTING depicting the TRex's plunge into the volcano.
utter4.24,utter,NARRATOR (V.O.),"With the emergence of the Stone Age, came the rise of a new species..."
desc4.25,desc,,"We then see the arrival of MAN (caveman, to be exact) in the cave paintings."
scene5,slugline,,EXT: VALLEY - DAY
desc5.26,desc,,A MONKEY uses a rock to hammer the ground. approaches him and tries to eat the rock. A CAVEMAN
utter5.27,utter,NARRATOR (V.O.),"Man was VERY DIFFERENT from the dinosaur. He was shorter, hairier, and way, way smarter."
desc5.28,desc,,The Monkey SCREECHES and the Caveman PUNCHES him offscreen. The Minions CHEER and follow the Caveman.
utter5.29,utter,NARRATOR (V.O.),The Minions took an instant liking to man...
desc5.30,desc,,A BEAR charges the Caveman.
utter5.31,utter,NARRATOR (V.O.),...and helped him best they could...
desc5.32,desc,,The Caveman goes to GRAB A BIG HUNK OF WOOD on the ground. It will make a great club! But...
utter5.33,utter,MINIONS,"No, no!"
utter5.34,utter,BL Draft MINION (O.S.),Te--la pinata!
desc5.35,desc,,"The Caveman TURNS... ...the Minion hands him a FLY SWATTER. The Caveman looks to the Minions, confused. They assure him that it's okay. He hits the bear with the fly swatter. Poor man. fragile."
utter5.36,utter,NARRATOR (V.O.),So trusting. So
desc5.37,desc,,The Bear attacks the Caveman while the Minions watch in horror. They nonchalantly back away offscreen.
utter5.38,utter,NARRATOR (V.O.),"So, so delicious. Minions carved among the humans. Sure enough, there are"
utter5.39,utter,NARRATOR (V.O.),Their quest for a boss put the Minions front and center for some of civilization's most historic moments.
scene6,slugline,,EXT: PYRAMIDS - DAY
desc6.40,desc,,A cool PHARAOH is standing atop a GIANT PLATFORM at the dedication of a NEW PYRAMID!
utter6.41,utter,PHAROAH,Raa kaba ank! Anubis! Hi-yah!
desc6.42,desc,,"The Pharaoh proudly SNAPS HIS WHIP before HUNDREDS OF FOLLOWERS ON THE GROUND. He SNAPS his whip, they CHEER!"
utter6.43,utter,NARRATOR (V.O.),Ancient Egypt held great promise...
desc6.44,desc,,Minion construction workers stand nearby. One of the Minions christens the pyramid like a new ship. We PULL BACK TO REVEAL the pyramid has been built upside-down and is precariously balancing on what is supposed to be the top. The pyramid tips over onto the Pharaoh and the Pharaoh's Followers. SPLAT! All dead.
utter6.45,utter,NARRATOR (V.O.),...but it didn't last long.
desc6.46,desc,,A Minion looks at blueprints of the pyramid. He realizes he had them upside-down. He turns them right-side up. The other Minion slaps him in the back of the head.
scene7,slugline,,INT: CASTLE DRACULA - MORNING
desc7.47,desc,,"The Minions tip-toe into DRACULA's bedroom, where he is asleep in his coffin."
utter7.48,utter,NARRATOR (V.O.),The Dark Ages were actually fun times. Their new master had a tendency to party all night and sleep all day.
desc7.49,desc,,"The Minions pull open his coffin, waking him up..."
utter7.50,utter,DRACULA,Ratch-ooturi? ...to see all The Minions have converged to celebrate his 357th birthday! They have a banner and a cake with candles and everything!
desc7.51,desc,,"They YANK OPEN THE CURTAINS, letting the sun in, as they CHEER. Dracula SCREAMS and the sun INSTANTLY turns him to a statue of dust."
utter7.52,utter,NARRATOR (V.O.),"But eventually, the party was over."
desc7.53,desc,,"A Minion nervously blows out the candle, also blowing the dust statue of Dracula away onto another Minion, who SNEEZES."
scene8,slugline,,EXT: BATTLEFIELD - DAY
desc8.54,desc,,NAPOLEON stands next to a cannon and raises his sword.
utter8.55,utter,NARRATOR (V.O.),They bounced from one evil boss to another... But they never seemed to find their perfect fit. Feu!
desc8.56,desc,,"One of the Minions lights the cannon while another stands on top of it. The Minion on the cannon steps forward when shouting an order, and the cannon tilts downward, aiming at Napoleon. It FIRES, blasting him off-screen. MINIONS"
scene9,slugline,,EXT: HILLSIDE - DAY
desc9.57,desc,,"The Minions RUN FOR IT, stampeding over the snowy hills away from the French Army."
utter9.58,utter,NARRATOR (V.O.),"One particular employer took their failure very, very badly. A group of soldiers charges the Minions."
desc9.59,desc,,The Minions disappear into the distance.
utter9.60,utter,NARRATOR (V.O.),The Minions had no other choice but to keep moving.
desc9.61,desc,,The Minions approach a CAVE.
utter9.62,utter,NARRATOR (V.O.),"And then, when all hope seemed lost..."
scene10,slugline,,INT: CAVE - DAY
desc10.63,desc,,The Minions walk into the cave and look out at the large amount of space they have.
utter10.64,utter,NARRATOR (V.O.),...they found sanctuary. The Minions...were safe.
desc10.65,desc,,"The Minions CHEER and run into the cave. A choir of Minions enthusiastically sings a Minion version of ""We Wish You A Merry Christmas."""
scene11,slugline,,TIME LAPSE:
desc11.66,desc,,"We see Minions rolling giant snowballs, standing in line for ice cream cones and throwing snow at each other."
utter11.67,utter,NARRATOR (V.O.),"Years passed, as the Minions forged their own civilization. They truly made a life for themselves."
desc11.68,desc,,"More Minions throw snowballs at each other as their UNDERGROUND VILLAGE builds up behind them. As time goes on, we see their snowball fight become lethargic and boring."
utter11.69,utter,NARRATOR (V.O.),But something just wasn't right.
desc11.70,desc,,MINIONS
desc11.71,desc,,"A depressed Minion lies on a psychiatric couch, explaining his woes to another Minion in a chair. Behind him is a HUGE LINE of other Minions."
utter11.72,utter,NARRATOR (V.O.),"They felt empty inside. Without a master, they had no purpose. They became aimless, and depressed."
desc11.73,desc,,"A Minion plays ping-pong with his buddy, but his friend is SO DEPRESSED he lets the ball bounce off his head. The Minions' version of ""We Wish You A Merry Christmas"" is now more sad. Several Minions even burst into tears."
utter11.74,utter,NARRATOR (V.O.),"If this continued any longer, the Minions would perish."
desc11.75,desc,,"The Minions walk through their village, depressed. Minion stands on a ledge, watching. A single"
utter11.76,utter,NARRATOR (V.O.),"But all was NOT lost, for ONE MINION had a plan. His name was...Kevin."
desc11.77,desc,,"Kevin climbs onto a platform in the cave. He is pacing back and forth, practicing his speech. Kevin looks down at index cards with his speech."
utter11.78,utter,NARRATOR (V.O.),"He was EXCITED to share his idea with the tribe. He'd been preparing for days, weeks, months...but now he was ready!"
desc11.79,desc,,"The Minions start lumbering toward him. THIS IS IT. ...but Kevin fumbles his cards. He goes to pick them up, sighs. They're all out of order. He makes up his mind to go ahead with it and defiantly tosses them to the side. Kevin gives his speech. Points up, to the cave entrance. DRAMATICALLY DECLARES HIS INTENTIONS!"
desc11.80,desc,,Kevin would leave the cave--The Minions GASP. He MINIONS
utter11.81,utter,BL Draft NARRATOR (V.O.),"Go back to the outside world, and HE WOULD NOT return until he had found HIS TRIBE THE BIGGEST, BADDEST VILLAIN TO SERVE!"
utter11.82,utter,KEVIN,(arms out) KIDAY COME ME?!?!
utter11.83,utter,NARRATOR (V.O.),"But he needed help. The Minions are dead silent, except for one Minion. runt of a creature named BOB. Me coming!"
utter11.84,utter,A tiny BOB NARRATOR (V.O.),"Bob was eager to go, but Kevin thought he was just not strong enough for the dangerous journey ahead. Uh... no."
utter11.85,utter,KEVIN,Una otra Minion?
desc11.86,desc,,"Bob continues to JUMP UP AND DOWN, increasingly more excited. The Minions look sheepish. Me!"
desc11.87,desc,,No one wants to go.
utter11.88,utter,BOB,Chosa me!
desc11.89,desc,,"A Minion in the crowd raises a UKULELE. They PART WAYS, revealing: STUART. A one-eyed Minion who is fast asleep and snoring. Another Minion holds up his ukulele."
utter11.90,utter,NARRATOR (V.O.),"Luckily, someone stepped up..."
desc11.91,desc,,"Stuart groggily wakes up and waves to the crowd, confused. The other Minions CHEER. Kevin summons Stuart, who approaches the platform, ukelele in hand. Stuart happily accepts the attention from the other Minions, even though he's not sure why. Me?"
utter11.92,utter,STUART,"Thank you, heh, thank you..."
desc11.93,desc,,MINIONS
utter11.94,utter,BL Draft NARRATOR (V.O.),"Truth be told, Stuart had NO IDEA what he was chosen for..."
desc11.95,desc,,"He passes by Bob, annoyed he was overlooked."
utter11.96,utter,BOB,Porque le!?
utter11.97,utter,NARRATOR (V.O.),...but was thrilled it made people cheer for him.
desc11.98,desc,,Stuart yells to the crowd from the platform.
utter11.99,utter,STUART,"Thank you, la tota!"
scene12,slugline,,Thank you!
desc12.100,desc,,Stuart wants to take advantage of this and starts to play his ukulele. Kevin pushes him out of the way. Una otra?
desc12.101,desc,,"Bob continues to jump up and down. He picks up a block of ice and holds it above his head. He FARTS. The ground collapses under the weight, and the block pins him beneath the ice."
utter12.102,utter,KEVIN (CONT'D),"Uhhh, okay...no otra?"
desc12.103,desc,,Bob peeks out from beneath the rock and pleads to be chosen.
utter12.104,utter,Kevin!,Kevin!
utter12.105,utter,BOB,Kevin! Me!
utter12.106,utter,"Choosa me, KEVIN",(unwillingly) Ugh...komay.
desc12.107,desc,,Bob eagerly runs to the platform.
utter12.108,utter,NARRATOR (V.O.),"Eventually Bob's energy and enthusiasm, but mostly lack of other volunteers, changed Kevin's mind. Kumbaya!"
desc12.109,desc,,"KEVIN, BOB, & STUART"
scene13,slugline,,INT: MINION CAVE - LATER
desc13.110,desc,,"Kevin, Stuart and Bob leave, the Minions wave and cheer. Smiling for the first time in a while."
utter13.111,utter,NARRATOR (V.O.),The tribe said their farewells. Kevin had given them something they hadn't had in a very long time...hope.
desc13.112,desc,,Bob hugs Minions good-bye.
utter13.113,utter,KEVIN (O.S.),"Tu le komay? Si, si..."
desc13.114,desc,,"He catches up to Kevin and Stuart, looking behind and waving."
utter13.115,utter,BOB (CONT'D),"(nervously) Bye, bye..."
scene14,slugline,,EXT: CAVE - DAY
desc14.116,desc,,They exit the cave and look in the distance where their future awaits.
utter14.117,utter,NARRATOR (V.O.),"Kevin felt pride, he was going to be the one to save his tribe... Stuart felt hungry, mostly, he was going to be the one to eat this banana."
desc14.118,desc,,Stuart pulls out a banana and examines it.
desc14.119,desc,,Bob walks up next
desc14.120,desc,,"Bob looks out at the frozen, desolate plains ahead of them. Oh..."
utter14.121,utter,BOB NARRATOR (V.O.),...Bob was frightened of the journey ahead.
desc14.122,desc,,"Kevin picks up on this, puts his hand on Bob's shoulder. comforts him and explains the importance of their quest. He"
utter14.123,utter,KEVIN,Finto le boss.
desc14.124,desc,,Bob composes himself and SIGHS.
utter14.125,utter,BOB,"Okay, okay. La kita le big boss!"
utter14.126,utter,KEVIN,"Ahaha, le Bob! Komay."
desc14.127,desc,,Kevin takes Bob's hand and they set out into the snowy landscape.
utter14.128,utter,NARRATOR (V.O.),And they were off. Off to find their new boss!
desc14.129,desc,,"The three Minions walk off in the distance, Stuart leading the way, Bob and Kevin close behind. The Minions traipse along in the snow, across mountains and through forests. Kevin carries a tired Bob for part of the journey. Later, when Bob wakes up he's full of energy and runs all around. They wander through some high grass and ultimately make it to the ocean."
scene15,slugline,,EXT: OPEN SEA - DAY A canoe on the high seas.
desc15.130,desc,,"exhausted. The Minions paddle. Stuart stops, Bob's stomach GROWLS. Le bito?"
utter15.131,utter,KEVIN BOB,(pointing to mouth) Ma toca. STUART Polano la ma toca...
desc15.132,desc,,A very tired and hungry Stuart looks at Kevin and Bob.
utter15.133,utter,MINIONS,Huh?
utter15.134,utter,BL Draft STUART (CONT'D),Banana?
desc15.135,desc,,POV - STUART: He sees them as TWO BANANAS. Stuart?
utter15.136,utter,BANANA KEVIN,Makalino?
utter15.137,utter,STUART,Banana...banana!!
desc15.138,desc,,"Stuart LEAPS ON KEVIN, starts to lick him. They SLAP-FIGHT. Bob joins in, sucking on Kevin's head. Bob!"
utter15.139,utter,KEVIN,Stopa!
desc15.140,desc,,"Just then, we hear the foghorn from a nearby STEAMSHIP. Minions stop fighting, as they watch it pass... ...revealing the STATUE OF LIBERTY. NEW YORK CITY. They are heading toward Bob excitedly JUMPS OFF THE CANOE and swims for shore! Bob!"
scene16,slugline,,"New York, 1968"
desc16.141,desc,,"Kevin and Stuart paddle behind him, excited."
scene17,slugline,,EXT: PIER - DAY
desc17.142,desc,,"They pull themselves up onto the pier. NEW YORK CITY is before them. The Minions have never seen anything like this. Everything is new and shiny... ...and big. Very, very big. They pass by a BILLBOARD: NIXON '68: FINALLY A NAME YOU CAN TRUST!"
scene18,slugline,,EXT: STREETS OF NYC - DAY
desc18.143,desc,,The Minions steal some clothes hanging on a laundry line. Stuart puts on a TIE-DYED SHIRT. Kevin and Bob shake their heads in disapproval. MINIONS
desc18.144,desc,,"Stuart puts on a pair of PINK SHORTS, which cover his whole body. Kevin disapproves. Bob GIGGLES. Stuart opens the fly and argues back. But then something catches Kevin's eye: Hanging on a clothesline, flapping in the wind and backlit by the sun like the most regal of flags are DENIM OVERALLS. Now all wearing overalls, the Minions walk through the streets of New York City, in awe of the large buildings and billboards. MONTAGE: A COUPLE in a HORSE-DRAWN CARRIAGE roll by, sightseeing."
utter18.145,utter,SIGHTSEEING WOMAN,"Oh, look at that one! Whoa!"
scene19,slugline,,SIGHTSEEING MAN
desc19.146,desc,,"The Minions sit in the back of a passing GARBAGE TRUCK, pointing at all the passing attractions as well. The Minions encounter a group of HIPPIES protesting. Stuart and Bob join in the chanting, until Kevin leads them away from the protesters. Boo-yah!"
utter19.147,utter,BOB,Boo-yah!
desc19.148,desc,,"The Minions peer in the window of THE MUSIC PAD, where they see a WOMAN in a BANANA-patterned dress. Banana!"
scene20,slugline,,BOB (CONT'D)
desc20.149,desc,,"Bob FOLLOWS her as she exits the store. Stuart looks in. He lights up when he sees an amazing INSTRUMENT DISPLAY. He's particularly taken by all the guitars. So many shiny guitars. Classic, electric, bass... He imagines himself in pictures of a cool surf guitarist and a rock star. As the Woman in the banana dress enters her taxi cab, Bob is accidentally thrown into the trunk with other bags. Stuart looks into the music shop, in a trance. his fingers, trying to get Stuart's attention. Kevin snaps MINIONS"
utter20.150,utter,BL Draft KEVIN,"Stuart...hey, ho!"
desc20.151,desc,,"Finally, he GRABS Stuart by the goggle, bringing him back to reality. But then the Woman's taxi pulls away..."
utter20.152,utter,BOB,(from inside the trunk) Kevin!!!
desc20.153,desc,,Kevin and Stuart watch as the cab drives down the street.
utter20.154,utter,KEVIN,(scared) Bob?!?
desc20.155,desc,,"In the taxi cab, Bob pushes his way through the back seat. He pops out next to the Woman, who SCREAMS when she sees him. He is promptly thrown from the cab."
scene21,slugline,,EXT: STREETS OF NYC - DAY
desc21.156,desc,,"Back to Kevin and Stuart, who are running on the sidewalk, looking for Bob. Bob? Bob?"
desc21.157,desc,,"And then...on the other side of the street, they see Bob walking. Bob!"
scene22,slugline,,KEVIN (CONT'D)
desc22.158,desc,,"Bob is headed past a department store, FANCY'S. Bob stops and looks at the revolving doors. He enters the store. Kevin and Stuart RUN ACROSS THE BUSY STREET."
scene23,slugline,,INT: DEPARTMENT STORE - NIGHT
desc23.159,desc,,Bob enters. He looks around: Bob looks up at the crowds. Big scary world.
utter23.160,utter,DEPARTMENT STORE ANNOUNCER,(LOUDSPEAKER) Our fabulous new range of turtleneck sweaters are now available in the men's fashion department. Women's bell-bottoms and tie-dyed shirts marked down. (MORE)
scene24,slugline,,DEPARTMENT STORE ANNOUNCER
desc24.161,desc,,Check out our wide selection of gogo boots and mini-skirts. Kevin and Stuart run through the revolving doors as well. They see Bob on an escalator. Bob!
utter24.162,utter,KEVIN,C'est le Bob!
desc24.163,desc,,"They run after him, shoving people out of their way, but he is gone by time they get there. They decide to split up and look for him. Kevin and Stuart walk through the department store, calling for Bob."
utter24.164,utter,DEPARTMENT STORE ANNOUNCER,(LOUDSPEAKER) The store is now closing-hey...what are you doing?!
utter24.165,utter,KEVIN,"(on the loudspeaker) Scusa, scusa. Bob! Ou le tu? Bob?"
utter24.166,utter,DEPARTMENT STORE ANNOUNCER,(LOUDSPEAKER) Give me that!
desc24.167,desc,,"Bob, who is wandering near the changing rooms, hears this."
utter24.168,utter,BOB,Kevin?
scene25,slugline,,INT: DEPARTMENT STORE - CHANGING ROOM - NIGHT
desc25.169,desc,,Bob enters a CHANGING ROOM... ...with tons of MIRRORS. Bob sees what looks like 100 MINIONS! He looks at all of them in awe.
utter25.170,utter,BOB,Le buddies? Che la maka! C'est la Bob!
desc25.171,desc,,He RUNS FOR THEM.
utter25.172,utter,WHAM!,Hey!
desc25.173,desc,,"Hits the glass, HARD."
utter25.174,utter,BOB (CONT'D),Le Buddies? No?
desc25.175,desc,,"He puts his hand up, realizes that the Minions are just his reflection. He sighs, depressed. But then, Kevin comes in, holding Bob's stuffed bear TIM. Bob?"
utter25.176,utter,KEVIN,Que paso?
utter25.177,utter,BOB,La triba... Here.
utter25.178,utter,KEVIN,Le Tim.
utter25.179,utter,BOB,"Ah, me Tim! Thank you. Suddenly the lights go dark! Ooh la no."
desc25.180,desc,,"Bob happily runs offscreen, laughing. He JUMPS onto a department store display bed and summons Kevin and Stuart. TIME LAPSE: We see Kevin and Stuart moving other furniture around the bed, including a TV."
scene26,slugline,,INT: DEPARTMENT STORE - FURNITURE DEPARTMENT - NIGHT
desc26.181,desc,,"Kevin, Stuart and Bob are sitting in bed. They are surrounded by lots of furniture, and several mannequins dressed like Minions. They have placed a large television at the foot of the bed. Stuart flips through a couple of channels, including ones playing ""The Saint"" and ""Bewitched"". Kevin, flipping through a TV GUIDE, is uninterested. Finally, they land on ""The Dating Game."""
utter26.182,utter,KEVIN,Oh. Da-ting-Game. tropa.
desc26.183,desc,,"A beautiful bachelorette, JENNIFER, sits next to THE GAME SHOW HOST."
utter26.184,utter,GAME SHOW HOST,And welcome back to THE DATING
desc26.185,desc,,"GAME! Well, Jennifer-- MINIONS"
desc26.186,desc,,"Short, stubby. Looks Jennifer GIGGLES."
desc26.187,desc,,like a human version of MINION BOB.
utter26.188,utter,BOB,Go Bob! GAME SHOW HOST
desc26.189,desc,,"REVEAL: HUMAN KEVIN, Bachelor Number 2. man, a dead ringer for MINION KEVIN. An uptight, lanky"
utter26.190,utter,KEVIN,C'est la me! Kevin! GAME SHOW HOST Or will it be Stuart? REVEAL: HUMAN STUART. eye. Whoa!
desc26.191,desc,,Smallish. Laid-back. Hair over one
utter26.192,utter,STUART,"Yoooo, Stuart!"
utter26.193,utter,BACHELORETTE,"Gosh, this is so hard. They all sounded so cute. Ummm...I think"
desc26.194,desc,,I'm gonna go with--The TV cuts to STATIC.
desc26.195,desc,,"Stuart tries to fix the antennae. He's on top of the television holding an umbrella and a hand mixer, trying to get a better signal. As Stuart moves around, the reception goes in and out... But then... ON TV: A GRAPHIC of a BURGLAR MASK. MINIONS"
utter26.196,utter,BL Draft VNC SINGERS,"(sing-song) Hmmmm, what's this?"
desc26.197,desc,,"ON TV: We PULL OUT, a retro graphic shows a criminal's arm brandishing a knife... ...creating the logo VNC: VILLAIN NETWORK CHANNEL. Kevin can't believe his eyes!"
utter26.198,utter,VNC BROADCASTER,"You're watching the top-secret Villain Network Channel. If you tell anyone, we'll find you."
desc26.199,desc,,A Man brandishing a BAT stands next to the VNC Broadcaster. Minions PERK UP.
utter26.200,utter,KEVIN,No les mova!
utter26.201,utter,VNC BROADCASTER,Sponsored by Villain-Con...
utter26.202,utter,VILLAIN-CON,"VNC BROADCASTER (CONT'D) ...for eighty-nine years straight, the biggest gathering of criminals ANYWHERE! That's right, VillainCon!"
desc26.203,desc,,The Minions LEAN IN. C'est la! Really listen.
utter26.204,utter,KEVIN,C'est la finte la big
desc26.205,desc,,ON TV: SHOTS OF what the Broadcaster is talking about.
utter26.206,utter,VNC BROADCASTER,"Attend guest lectures from esteemed villains! Make contacts in the underworld community! And, for the first time ANYWHERE...SCARLET OVERKILL!"
desc26.207,desc,,"ON TV: We see Scarlet in silhouette, stealing from other criminals. She looks to the camera as she defeats a group of"
utter26.208,utter,MINIONS Evil.,So evil.
desc26.209,desc,,VNC BROADCASTER
utter26.210,utter,BL Draft,(V.O.)
desc26.211,desc,,SCARLET OVERKILL (ON TV)
utter26.212,utter,VNC BROADCASTER (V.O.),Criminal genius.
utter26.213,utter,SCARLET OVERKILL (ON TV),"Hey, a girl's gotta make a living."
desc26.214,desc,,"Scarlet walks along, KNOCKING OUT villains as she goes."
utter26.215,utter,VNC BROADCASTER,"Move aside, men! There's a new bad man in town, and that man...IS A WOMAN!"
desc26.216,desc,,Scarlet stands on top of a pile of defeated villains and LAUGHS.
utter26.217,utter,VNC BROADCASTER (CONT'D),Crime isn't pretty...
scene27,slugline,,SCARLET OVERKILL (ON TV)
desc27.218,desc,,Kevin is completely IN AWE of Scarlet.
utter27.219,utter,VNC BROADCASTER,"Get to Villain-Con THIS WEEKEND! Only at 545 Orange Grove Avenue in Orlando, Florida! So much fun, it's a CRIME! (devious giggle)"
utter27.220,utter,KEVIN,"Villain-Con! Orlando! Woo-hoo! Ah, ha ha!"
utter27.221,utter,BOB,STUART
desc27.222,desc,,Stuart hops off the TV.
