segment-id,segment-type,segment-speaker,segment-text
utter54.456,utter,HERB OVERKILL,Oh that works out because I love mmm...
utter54.457,utter,BL Draft SCARLET OVERKILL,Well I love mmm too...mmm...
desc54.458,desc,,"They're entranced by each other, about to kiss. Stuart giggles and makes fun of them. Kevin and Bob LAUGH, too."
desc54.459,desc,,The Minions snap to attention.
utter54.460,utter,SCARLET OVERKILL (CONT'D),"(to Minions) Meet my husband Herb. Inventor, super genius, fox. Herb, these are the new recruits, Kevin, Stuart and that cute little one is Bob. Bello!"
utter54.461,utter,KEVIN,Paratikota.
utter54.462,utter,HERB OVERKILL,"Right on, you guys are crazy little and way yellow and I DIG THAT."
desc54.463,desc,,He takes Stuart's hand and does an elaborate handshake that Stuart would have no way of doing.
scene55,slugline,,INT: SCARLET'S LAIR - TROPHY ROOM - DAY
desc55.464,desc,,An elevator opens. The Minions follow Scarlet and Herb into
scene56,slugline,,Scarlet's trophy room.
desc56.465,desc,,"The Minions can't believe their eyes, the place is packed with rare and valuable items that Scarlet has stolen the past: Paintings! Statues! Sleek rare cars! MINIONS Whooooooooa, coolos!"
utter56.466,utter,SCARLET OVERKILL,"I know, right? Just a few things I stole to help fill the void."
desc56.467,desc,,Stuart b-lines for a corner dedicated to ROCK MEMORABILIA.
utter56.468,utter,STUART,La mega-ukelele!
desc56.469,desc,,MINIONS
desc56.470,desc,,Stuart reaches for Jimi Hendrix's guitar. Bob is admiring an original Andy Warhol (Campbell's Soup) painting.
utter56.471,utter,HERB OVERKILL,Checking out my can? We stole that because FINALLY someone expressed my love of soup in painting form. Oooohhh...
scene57,slugline,,MINIONS
desc57.472,desc,,"Scarlet's demeanor changes, she's suddenly all business."
utter57.473,utter,SCARLET OVERKILL,"Okay, listen up! It is time to get down to business."
desc57.474,desc,,She approaches a painting of QUEEN ELIZABETH.
utter57.475,utter,SCARLET OVERKILL (CONT'D),Do you know who this is?
utter57.476,utter,KEVIN,La cucaracha?
utter57.477,utter,SCARLET OVERKILL,"This is Queen Elizabeth. Ruler of England. Oh, I love England. The music, the fashion...I'm seriously thinking about overthrowing it someday."
desc57.478,desc,,"Kevin shakes Bob, excited."
utter57.479,utter,SCARLET OVERKILL (CONT'D),"Anyway, this pale drink of water oversees it all. I'm her biggest fan, LOVE her work...and I really really really want her crown."
desc57.480,desc,,The Minions jump up and down happily.
utter57.481,utter,SCARLET OVERKILL (CONT'D),"Steal me the crown, and all your dreams come true! Respect! Power! Banana!"
utter57.482,utter,STUART BL Draft SCARLET OVERKILL,(imitates Stuart) Banana!
scene58,slugline,,EXT. SNOWY WASTELAND - DAY
desc58.483,desc,,"It's cold snowy, and the Minions are homeless. One Minion trips over a rock--except it's not a rock, it's another MINION buried in the snow. He helps him out. Several Minions fight over a MAP. Dave grabs it and points into the distance. Se para!"
utter58.484,utter,DAVE THE MINION,Avanti!
desc58.485,desc,,"They realize that the mound they are standing on is actually a POLAR BEAR. The Minions RUN AWAY, with the Bear chasing after them. They make it to a LAKE, where they JUMP onto a sheet of ICE. They begin to float away, but then realize that there are several other BEARS at the other end of the lake."
scene59,slugline,,INT: SCARLET'S LAIR - HERB'S LAB - LATER
desc59.486,desc,,"The Minions walk into Herb's lab, a very hip swinger's pad. They are drawn to A LARGE CONTRAPTION in the corner. Herb is overhead, watching them."
utter59.487,utter,HERB OVERKILL,"Noooo-hoooo, no! Don't get too close, boys. When it's completed it'll be my ultimate weapon, but right now it's leaking radiation like you would not believe."
desc59.488,desc,,Herb TOSSES away his cup of coffee.
utter59.489,utter,HERB OVERKILL (CONT'D),So... you're here for gear!
desc59.490,desc,,He uses an extend-o arm to lower himself from the platform. Whoa.
desc59.491,desc,,MINIONS Bob.
utter59.492,utter,BL Draft HERB OVERKILL,Robert. Bobby. My boy.
utter59.493,utter,Si? BOB HERB OVERKILL,You GET my FAR-OUT STRETCH-SUIT. Whoooa!
utter59.494,utter,BOB HERB OVERKILL,Kevin. Kev-bo. Seventh Kevin. YOU are the proud owner of my LAVA LAMP GUN! Ah?
desc59.495,desc,,Herb fills a gun with ORANGE LAVA.
utter59.496,utter,HERB OVERKILL,This baby shoots ACTUAL LAVA.
desc59.497,desc,,Kevin's EYES WIDEN. This is cool.
utter59.498,utter,HERB OVERKILL (CONT'D),"Pretty cool, right? And finally, Stu. Stu-art. Stu-perman. Beef Stu. I got you the coolest invention, probably ever."
desc59.499,desc,,Stuart rubs his hands together with excitement.
utter59.500,utter,STUART,"Ah, patel..."
desc59.501,desc,,"Herb hands Stuart the HYPNO-HAT, an orb-shaped helmet."
utter59.502,utter,HERB OVERKILL,...HYPNO-HAT.
desc59.503,desc,,"The helmet expands on Stuart's head and begins to HYPNOTIZE Kevin and Bob. Bob begins to CLUCK like a chicken. He turns toward Herb, who promptly turns off the helmet."
utter59.504,utter,HERB OVERKILL (CONT'D),You can use it to hypnotize anyone. ANYONE!
desc59.505,desc,,Scarlet enters the room. MINIONS
utter59.506,utter,BL Draft SCARLET OVERKILL,"Oh! You look SO great. I feel like a proud mama, with three dashing, evil sons."
desc59.507,desc,,Bob is having trouble with his extend-o arms.
utter59.508,utter,"BOB Uh, Scarlet--SCARLET OVERKILL","No no, don't say anything. I won't understand. (sighs) It's getting late. You've had a BIG day, you must be exhausted!"
scene60,slugline,,INT: CASTLE SCARLET - MINION QUARTERS - NIGHT
desc60.509,desc,,Bob excitedly bounces up and down on the bed. Booooing!
utter60.510,utter,BOB,Booooooing!
utter60.511,utter,HERB OVERKILL,These cats are PUMPED!
utter60.512,utter,SCARLET OVERKILL,"Well, maybe I'll settle them down with a bedtime story."
desc60.513,desc,,"Stuart tries to take a LARGE AXE down from the wall. He FALLS over, barely missing Kevin with the axe. Kevin scratches himself, not noticing the axe behind him."
utter60.514,utter,SCARLET OVERKILL (CONT'D),"How does that sound, Bob? Bob. Bob! BOB!"
desc60.515,desc,,He finally stops bouncing.
utter60.516,utter,BOB,Bedtime porry?
utter60.517,utter,HERB OVERKILL,That is a GROOVY IDEA! I'll go get some cookies and warm milk. This is
desc60.518,desc,,gonna be SOOOO FUNNNNN! She turns. The Minions are already tucked in and ready.
utter60.519,utter,BOB,Et la bedtime porry?
desc60.520,desc,,She sits down at the end of the bed.
utter60.521,utter,SCARLET OVERKILL,"Oh, yes. I've got a really, really good bedtime porry."
desc60.522,desc,,She begins.
utter60.523,utter,SCARLET OVERKILL (CONT'D),Once upon a time...
desc60.524,desc,,"Bob leans in, excited, as we DISSOLVE TO:"
scene61,slugline,,EXT: BIG COLORFUL WORLD - BOB'S HEAD - DAY
desc61.525,desc,,Pretty pink countryside. Rainbow in the sky. THREE PIGS coming our way.
utter61.526,utter,42,We see the
utter61.527,utter,SCARLET OVERKILL (V.O.),...there were THREE LITTLE PIGS!
desc61.528,desc,,"REVEAL: THREE PIGS, who look an awful lot like our three Minions. The Pigs walk up to a SCARLET WOLF. A female wolf that is clearly Scarlet, who LOOMS OVER THEM, THREATENINGLY! SCARLET OVERKILL (V.O.)"
desc61.529,desc,,"Scarlet Wolf suddenly is all smiles, very friendly!"
utter61.530,utter,SCARLET OVERKILL (V.O.),...who had a wonderful surprise for them!
desc61.531,desc,,Scarlet Wolf walks the piggies home. We see Over KevinPiggy's head is a THOUGHT BALLOON of ALL HIS MINION PIGGY TRIBE hanging out in the snow.
utter61.532,utter,SCARLET OVERKILL (V.O.),The wolf offered the three piggies and all their friends a job working for her.
desc61.533,desc,,They head into her castle.
utter61.534,utter,SCARLET OVERKILL (V.O.),Everyone would be so happy!
desc61.535,desc,,Scarlet Wolf shows them crayon-drawn BATTLE PLANS. MINIONS
utter61.536,utter,BL Draft SCARLET OVERKILL (V.O.),"All the three little piggies had to do was just steal ONE LITTLE CROWN that the beautiful wolf had wanted ever since she was a penniless little street cub. Unloved and abandoned. But that crown would mean she was a princess and everybody loves a princess, so the wolf sent the piggies to get that crown."
desc61.537,desc,,The Minion Pigs sneak on their tiptoes into THE TOWER OF
utter61.538,utter,SCARLET OVERKILL (V.O.),But the little pigs weren't up to the challenge! They failed their mission!
desc61.539,desc,,They are KICKED OUT by the Guards.
scene62,slugline,,BACK AT CASTLE SCARLET.
desc62.540,desc,,The Pigs come back empty-handed.
desc62.541,desc,,"So the wolf HUFFED and PUFFED... She pulls a string. ANVILS FALL ON THE PIGS, KILLING THEM. Followed by a bathtub. And then a spaceship. And then a stockpile of bombs. It EXPLODES. SCARLET OVERKILL (V.O.) ...and she BLEW THEM OFF THE FACE OF THE EARTH. Kevin and Stuart hold each other, horrified. Bob is happy. End of story. The end. SCARLET OVERKILL Kevin and Stuart are FREAKED OUT."
utter62.542,utter,SCARLET OVERKILL (CONT'D),"Good luck getting that crown tomorrow, little piggies! I know you won't disappoint me."
desc62.543,desc,,"Herb stands in the doorway, eating a cookie and drinking milk. They walk out of the room together. Kevin and Stuart don't know what to make of that story. They look at each other, terrified. WHAT HAVE THEY GOTTEN THEMSELVES INTO?!?! MINIONS"
desc62.544,desc,,Bob is already fast asleep.
scene63,slugline,,EXT: TOWER OF LONDON - FRONT ENTRANCE - DAY
desc63.545,desc,,CHYRON TEXT:
scene64,slugline,,Tower of London - London
desc64.546,desc,,"A double-decker bus stops in front of the Tower of London. Kevin UNROLLS what looks to be PARCHMENT. It is the ripped from THE PAINTING OF THE QUEEN in Scarlet's throne room. KEVIN La crowna para Scarlet! As they approach the TICKET COUNTER, Kevin turns to them."
utter64.547,utter,KEVIN (CONT'D),Lemme do ay. (to Vender) Tres please.
utter64.548,utter,TICKET VENDOR,"You're not allowed in without an adult. Scram, hooligans!"
desc64.549,desc,,"Kevin leads Stuart and Bob away...but then gets an idea. TIME LAPSE: The Minions, stacked on top of each other and dressed like a woman, stumble up to the ticket counter. Bob FLIRTS with a Frenchman on the way. Kevin looks at the Frenchman through his goggles, which are hidden in the woman's ""chest."" The Frenchman is startled, but yet, still intrigued by the woman."
scene65,slugline,,TICKET VENDOR (CONT'D)
desc65.550,desc,,"Uhh...three please-But then Kevin corrects him, making it sound as though the ""Woman""'s stomach is talking."
utter65.551,utter,KEVIN,"Uno, please. Uno."
desc65.552,desc,,Kevin then sets a GOLD BAR from Scarlet's treasure room on the counter as payment. Bob giggles sheepishly. The Ticket Vendor doesn't bat an eye and hands him a ticket.
utter65.553,utter,TICKET VENDOR,"Enjoy yourself, Love."
desc65.554,desc,,MINIONS
desc65.555,desc,,"The Minions enter the Tower of London and proceed to explore, looking at their map and keeping an eye on the GUARDS. They get to a room marked ""KEEP OUT"" and sneak in."
scene66,slugline,,INT: TOWER OF LONDON - HALLWAYS - CONTINUOUS
desc66.556,desc,,They take off their Woman costume and strap on their overalls and Herb's gear.
utter66.557,utter,KEVIN,"Okay, comme me."
desc66.558,desc,,"The Minions run over to the Crown Jewels room, but a group of BEEFEATERS approaches."
utter66.559,utter,BEEFEATER 1,WHAT are you doing here?
utter66.560,utter,KEVIN,Uuuh...pasteka?
utter66.561,utter,BEEFEATER 2,This is a restricted area! in the air!
scene67,slugline,,Hands
desc67.562,desc,,Stuart pushes Kevin out of the way.
utter67.563,utter,STUART,Lemme do ay.
desc67.564,desc,,"He presses the button on his Hypno-Helmet and walks toward the Beefeaters, singing the opening bars to the song ""HAIR."""
utter67.565,utter,BEEFEATER 1,Stop there!
desc67.566,desc,,He hypnotizes the Beefeaters...they fight it at first...
utter67.567,utter,BEEFEATER 1 (CONT'D),Get back...!
desc67.568,desc,,"...and they begin to SING and DANCE AROUND to the song. They begin to throw off their clothes and remove their hats, which REVEAL LONG, FLOWING heads of HAIR. Kevin finally pulls Stuart and Bob away and they flee up the stairs. The stairway is long and difficult to climb, but after a while, they finally reach the top. MINIONS"
scene68,slugline,,INT: TOWER OF LONDON - TOP FLOOR - CONTINUOUS
desc68.569,desc,,"Before them, a GIANT STEEL DOOR. Kevin takes out the LAVA LAMP-GUN. He aims it at the door, gently SQUEEZES the trigger, and the LAVA LAMP-GUN FIRES, MELTING A HOLE THROUGH THE DOOR."
scene69,slugline,,INT: TOWER OF LONDON - HALL OF TREASURES - CONTINUOUS
desc69.570,desc,,"At the end of the room, kept on a big platform under glass is THE QUEEN'S CROWN!"
utter69.571,utter,KEVIN,Topilano la Crowna!
desc69.572,desc,,"They head for the crown. From out of the shadows hobbles THE KEEPER OF THE CROWN. old, feeble man in a ragged beefeater uniform."
utter69.573,utter,KEEPER OF THE CROWN (OFF-SCREEN),"So... you came for The Queen's crown, did you? Well, you're gonna have to get through ME! The Keeper of the Crown."
desc69.574,desc,,"Reveal, he is actually pointing in the wrong direction. The Minions LAUGH. The Keeper realizes where they are and SMACKS Kevin with his cane."
utter69.575,utter,KEVIN KEEPER OF THE CROWN,"You think it's FUNNY to mock the elderly, do ya? Uhhh...si?"
desc69.576,desc,,"WHAM! He SMACKS Kevin again and again with his cane, pummeling him."
utter69.577,utter,KEEPER OF THE CROWN,"I've been up here for decades, just waitin' for someone to try and steal the Queen's treasure!"
utter69.578,utter,STUART,Okay...me le do ay.
desc69.579,desc,,Stuart then attempts to hypnotize the Keeper of the Crown.
utter69.580,utter,KEEPER OF THE CROWN,"What are you saying? Never mind, don't care."
desc69.581,desc,,He kicks Stuart out of the way. The display case then begins to lower through the floor. Kevin points to it. Oh no!
desc69.582,desc,,Kevin grabs the lava gun from the floor and points it at him. It lights up...
utter69.583,utter,KEEPER OF THE CROWN,"Oh no you don't! Oh, flippin' heck..."
desc69.584,desc,,"He presses his rapier against the barrel of the gun, but the gun jams up, TOSSING him against the wall and SPLATTERING lava all over the room. A FACE MASK from one of the room's suits of armor lands on his head."
utter69.585,utter,KEVIN,Spila la crowna polani!
desc69.586,desc,,"The Minions JUMP through the crown tunnel's opening. They land on the crown, taken down the tunnel..."
utter69.587,utter,KEVIN (CONT'D),"Bob, prakash!"
desc69.588,desc,,"Bob uses Herb's suit to rip open the top of the display case like a can opener. But before he can grab the crown, the platform stops moving!"
scene70,slugline,,EXT: TOWER OF LONDON - QUEEN'S ENTRANCE - CONTINUOUS
desc70.589,desc,,"A pair of CURTAINS move aside, revealing Royal Guards. display case moves forward on a conveyor belt. A guard TAKES the crown and walks outside with it, followed by other guards. The Minions, hiding in the platform, peer out."
utter70.590,utter,KEVIN,(sadly) La crowna...
desc70.591,desc,,MINIONS
desc70.592,desc,,The guard carries the crown over to a waiting GOLDEN CARRIAGE.
scene71,slugline,,EXT: STREETS OF LONDON - DAY
desc71.593,desc,,The Minions run after the carriage. La crowna!
utter71.594,utter,KEVIN,Speeda!
desc71.595,desc,,The Queen politely waves from the carriage as throngs of onlookers CHEER and WAVE. The crown is ON HER HEAD. Hello!
scene72,slugline,,THE QUEEN
desc72.596,desc,,"The Minions RUN THROUGH THE CROWD, trying to keep up. As Bob runs, his STRETCH-SUIT LEGS spring out, telescoping and making his legs longer."
utter72.597,utter,BOB,Looka me!
desc72.598,desc,,He GRABS Kevin with one hand. GRABS Stuart with the other. He begins to chase after the carriage on his long legs. The Queen continues to wave from her carriage. Hello!
scene73,slugline,,THE QUEEN
desc73.599,desc,,"Bobbies, The Royal Guard, and Beefeaters are stunned!"
utter73.600,utter,BOBBIE 1,Stonin' crows!
utter73.601,utter,BOBBIE 2,"Stop him, lads! Go for the legs!"
desc73.602,desc,,"They chase after Bob, grabbing his long legs and tripping him. Kevin and Stuart fling forward. Kevin lands on one of the horses, which sends them BOLTING down the street. The horse KICKS Kevin into the driver's seat, knocking the DRIVER onto the street. The Bobbies continue to pin Bob to the ground by his legs. Kevin!"
desc73.603,desc,,MINIONS
desc73.604,desc,,"He manages to pull away from them. He JUMPS onto a rooftop, using his long legs to propel him."
utter73.605,utter,BOBBIE 2,"(into radio) The Queen's been kidnapped, Sarge!"
scene74,slugline,,INT: POLICE STATION - CONTINUOUS
desc74.606,desc,,"The Sergeant speaks back into his radio. The Sergeant presses a button and alerts the entire police force, who chase the runaway carriage through the streets."
scene75,slugline,,EXT: STREETS - CONTINUOUS
desc75.607,desc,,"The carriage is out of control. Kevin takes the reins. Meanwhile, Bob uses his long legs to run across London rooftops. He falls down to the street, SCREAMING and DODGING cars with his acrobatic, retractable legs. A CAR knocks him into a ball and he begins to ROLL until he falls down an OPEN MANHOLE. BACK TO THE QUEEN. The carriage is still out of control."
scene76,slugline,,INT: QUEEN'S CARRIAGE - CONTINUOUS
utter76.608,utter,THE QUEEN,What's going on??
desc76.609,desc,,Stuart JUMPS INTO THE CARRIAGE. Hello!
desc76.610,desc,,He attempts to GRAB THE CROWN off of the Queen's head.
utter76.611,utter,STUART (CONT'D),Gimme la crowna!
desc76.612,desc,,"He tackles her and a struggle ensues. Stuart manages to grab the crown for a moment, but then the Queen GRABS it and begins to PUMMEL Stuart."
utter76.613,utter,THE QUEEN,Gentlemen--do--not--steal--ladies'-crowns!
desc76.614,desc,,MINIONS
scene77,slugline,,INT: MANHOLE - CONTINUOUS
desc77.615,desc,,"In the manhole, a TRAIN approaches. BOB lifts himself up and the train passes through his legs before it begins to drag him along as well. Bob SCREAMS."
scene78,slugline,,EXT: STREETS OF LONDON - CONTINUOUS
desc78.616,desc,,"Kevin sees that they are headed straight for the RIVER THAMES! Kevin tries to stop the carriage, but accidentally releases the horses instead. The carriage continues to speed toward the water. Bob pulls himself to the surface from the sewer. He grabs the carriage as it passes over the manhole and climbs on top. In an attempt to stop the carriage, Bob grabs it with one arm and one leg and shoots the long arm and leg across the street, grabbing a light post. He holds on tight! He stops the carriage from falling into the river, but it quickly rubber-bands back onto the street, still out of control. The strain makes the LONG ARMS POP AND SMOKE as Bob holds tight, forcing the carriage OFF ITS PATH and down SWORD AND THE STONE SQUARE. TOURISTS RUN OUT OF THE WAY... ...revealing the carriage is headed RIGHT FOR A TREE NEAR EXCALIBUR! Kevin and Bob SCREAM! Queen and Stuart peer out the back window of the carriage, SCREAMING!"
scene79,slugline,,EXT: STREETS OF LONDON - CONTINUOUS
desc79.617,desc,,WHAM! The carriage CRUNCHES against a tree. Stuart FALL OFF. Stuart has the crown on his head!
desc79.618,desc,,He LAUGHS triumphantly. But then the Queen grabs it from behind.
utter79.619,utter,THE QUEEN,You scoundrel! (to the police) After them!
desc79.620,desc,,Two BOBBIES JUMP and capture Kevin and Stuart. to run toward THE SWORD IN THE STONE... Bob continues MINIONS
utter79.621,utter,BL Draft BOBBIES,Tackle him! Stop the blighter! Grab him!
desc79.622,desc,,"...and with NO EFFORT AT ALL, pulls the sword from the stone! EVERYONE GASPS! A LIGHT shines down from the heavens. DOVES circle overhead. A CHOIR OF BOYS (AND A BOBBIE) begins to SING a hymn. EVERYONE DROPS TO ONE KNEE. Kevin and Stuart are confused."
utter79.623,utter,BOBBIE,"Cor, blimey!"
scene80,slugline,,INT: BRITISH NEWSROOM - DAY
desc80.624,desc,,"A BRITISH NEWS REPORTER is in the middle of a news report. He prepares TEA as he reads. We see FOOTAGE of Bob holding the sword, Queen Elizabeth giving him the crown. BRITISH NEWS REPORTER (TO CAMERA)"
desc80.625,desc,,"--as a new king has been crowned. Bob, who appears to be a bald jaundiced child, has pulled the"
scene81,slugline,,INT: CASTLE SCARLET - DAY
desc81.626,desc,,Scarlet is watching the news broadcast at home. TAKES the martini she's drinking. TINY. Scarlet SPIT-
utter81.627,utter,SCARLET OVERKILL,YELLOW. TRAITORS!
desc81.628,desc,,She angrily KICKS over the TV monitor. She gets in the Scarlet Jet. She ANGRILY pulls back the throttle. FORWARD. The jet ROCKETS MINIONS
scene82,slugline,,EXT: OPEN SEAS - DAY
desc82.629,desc,,The Minions have tied a chain of inner tubes to a barge to travel by sea.
scene83,slugline,,EXT: PORT OF SYDNEY - DAY
desc83.630,desc,,The Minions happily climb onto a dock with the Sydney Opera House in the background. England!
utter83.631,utter,MINIONS,England!
desc83.632,desc,,England!
scene84,slugline,,EXT: AUSTRALIAN OUTBACK - DAY
desc84.633,desc,,"We see the Minions traveling in Kangaroos' pouches, becoming nauseated."
scene85,slugline,,EXT: SNOWY WASTELAND - DAY
desc85.634,desc,,"They reach a large GORGE between ""Australia"" on one side and ""India"" on the other. One Minion attempts to jump over it, but FALLS. His jacket catches on a BRANCH. The Minions behind him use their bodies to form a BRIDGE and cross over successfully. The fallen Minion is then seen waving for the other Minions to help him."
scene86,slugline,,INT: INDIAN PALACE - DAY
desc86.635,desc,,The Minions DANCE alongside several Indian dancers.
scene87,slugline,,"EXT: ""MOON"" - DAY"
desc87.636,desc,,"As Astronauts plant the flag on the moon's surface, the Minions walk by. PULL OUT to reveal they are on a soundstage. landing is FAKE, deal with it. Yes, the moon"
scene88,slugline,,EXT: SKY - DAY
desc88.637,desc,,The Minions CLING to an airplane wing as they continue their journey.
scene89,slugline,,INT: LIMO - DAY
desc89.638,desc,,"Bob sits in his limo, dressed in full royal garb and looking out the window, LAUGHING with Kevin and Stuart. The limo pulls up to Buckingham Palace. opens the door. The ROYAL ADVISER"
scene90,slugline,,Buckingham Palace.
desc90.639,desc,,"Bob sees the Royal Guard, lined up, intimidating in their official uniforms. He shuts the door to the limo. Uhh...no."
utter90.640,utter,BOB ROYAL ADVISER,"Oh, what's the matter, your majesty? Whatever's bothering you WE can make it right, just name it!"
desc90.641,desc,,Bob smiles.
scene91,slugline,,EXT: TRAFALGAR SQUARE - LATER
desc91.642,desc,,"All the Guards are clad in MINION COSTUMES. MUCH better for Bob. As he walks the red carpet, he hugs each one around the legs."
utter91.643,utter,BOB,Awwww buddies! Buddies!
scene92,slugline,,Buddies!
desc92.644,desc,,"A podium on the balcony before a massive crowd. Before Bob steps up, Kevin wipes another smudge off his face. Bob approaches and ADDRESSES the crowd completely in gibberish. He begins with: KING BOB! The crowd CHEERS."
desc92.645,desc,,King Bob! CROWD
desc92.646,desc,,"Bob continues his long-winded, impassioned speech. He makes a few jokes, which only Kevin and Stuart LAUGH at. When he concludes, the crowd stares at him blankly. He glances back to the Royal Adviser, who SHRUGS. KING BOB!"
desc92.647,desc,,The crowd applauds again. Bob DROPS the mic.
scene93,slugline,,INT: BUCKINGHAM PALACE - THRONE ROOM - DAY
desc93.648,desc,,"The Minions RUN throughout the palace, LAUGHING and goofing around. The BUTLERS chase them, trying to maintain order as they slide on bannisters, etc. King Bob!! THIN BUTLER Kevin PLAYS POLO while riding a CORGI. A group of other POLO PLAYERS follows behind, stampeding through the room. Stuart finds the STEAM ROOM and SMILES. He takes off his overalls, revealing THONG underwear beneath. Bob continually RINGS a BELL and hides, confusing the BUTLER."
utter93.649,utter,BUTLER,Yes King Bob? Oh. Bob...?
desc93.650,desc,,King Bob?
scene94,slugline,,King
desc94.651,desc,,"Stuart is now in the Steam Room, with two YELLOW FIRE HYDRANTS at his side. He hits on them and KISSES them."
desc94.652,desc,,"Ah, Claire...Tiffany...mi bellas."
desc94.653,desc,,"Bob POSES for a very regal portrait while Stuart lounges around, playing his ukulele. Kevin BATS the polo ball toward the door... ...where SCARLET OVERKILL STOMPS IN WITH A LARGE RAY GUN!"
desc94.654,desc,,HOW DARE YOU! MINIONS
desc94.655,desc,,"The ball HITS her in the face, and then a Corgi TACKLES her as well. She gets up, FUMING. She holds the Corgi, who LICKS her face. The PORTRAIT PAINTER quickly runs out of the room. Scarlet!"
utter94.656,utter,KEVIN SCARLET OVERKILL,"Don't you ""Scarlet"" me, you backstabbing little traitors! Using Herb's invention to steal my crown?"
utter94.657,utter,HERB OVERKILL,I feel used. Not gonna lie.
utter94.658,utter,SCARLET OVERKILL,"You stole my dream! I was going to conquer England some day! There was going to be a coronation, and I was going to be made QUEEN. Every moment was planned, I'd wear a dress so sparkly it glowed, and EVERYONE WHO EVER DOUBTED ME would be watching, and they would be CRYING. I was going to be the picture of elegance and class and you PINHEADS screwed it up!"
desc94.659,desc,,Kevin offers Scarlet the crown and tries to explain that they did it all for her.
utter94.660,utter,KEVIN,"La crowna, para tu."
utter94.661,utter,ROYAL ADVISER,"No, no, no, King Bob! You cannot just abdicate the throne!"
desc94.662,desc,,Scarlet points her gun at the Royal Adviser.
utter94.663,utter,HERB OVERKILL,Who invited the square?
utter94.664,utter,ROYAL ADVISER,And you DEFINITELY cannot just GIVE the job to THIS woman. There are laws! Laws?
utter94.665,utter,BOB,Maka te laws.
scene95,slugline,,INT: PARLIAMENT - LATER
desc95.666,desc,,"Parliament is packed. Everyone has gathered to watch Bob, wearing a Parliament wig, pound the gavel and rant. BOB La keena pota Scarlet po papeil!"
scene96,slugline,,EXT: BUCKINGHAM PALACE - FRONT YARD - DAY
