segment-id,segment-type,segment-speaker,segment-text
utter67.394,utter,KENT,"I think I have, sir, yes. You think."
utter67.395,utter,CHIEF,Do you have proof?
utter67.396,utter,KENT,"Sir, I've got a feeling about this one, a gut feeling..."
utter67.397,utter,CHIEF,"That's lovely, Kent. But let me try to explain how this works. If you called to tell me you'd found, say, a giant footprint, I might send over an expert to make a plaster cast of it. If you saw an CHIEF (CONT'D) (CONT'D) actual giant with your own eyes, I might even send you the team you're asking for. Heck, you go so far as to get me a photograph, I could probably get the U.S. (MORE) CHIEF (CONT'D) (CONT'D) Army over there to Rockwell, Maine. But you tell me you've got a"
utter67.398,utter,feeling-KENT,"(temper rising) Alright then, fine. You want evidence? I'll get your evidence..."
utter67.399,utter,CHIEF,"(TIRED) That sounds swell, Kent."
utter67.400,utter,KENT,"And when I do, I'm going to want a memo distributed! And I'm going to"
desc67.401,desc,,"want that memo carbon copied and -and re-distributed and -The Chief hangs up. As Kent stands with the phone receiver in his hand, a look of dark determination comes over his face. And then we pan up through the ceiling above Kent, into Hogarth's room. Hogarth also holds a phone receiver, with one hand cupped over the mouthpiece. He looks worried."
scene68,slugline,,EXT. HOGARTH'S HOUSE - THE NEXT MORNING
desc68.402,desc,,Annie says goodbye to Hogarth at the front door.
utter68.403,utter,ANNIE,"Bye, Honey! Have a good day at school."
utter68.404,utter,HOGARTH,"(WAVING) Bye, Mom."
desc68.405,desc,,"Hogarth pedals his bike away until he's out of sight of the front house, then zips around the side of the house, ditches his bike and grabs a little red wagon."
scene69,slugline,,MONTAGE:
desc69.406,desc,,"Hogarth pulls the wagon around, collecting metal. He finds some cans, an old car muffler, a fallen street sign, etc."
scene70,slugline,,INT. HOGARTH'S BARN - A LITTLE LATER
desc70.407,desc,,Hogarth enters and finds the Giant sleeping. Ahem...
desc70.408,desc,,The Giant opens his eyes. He sees the wagon full of metal and looks delighted.
utter70.409,utter,GIANT,(HUNGRY SOUND)
utter70.410,utter,HOGARTH,It wasn't easy to fill this wagon.
desc70.411,desc,,"So try to not to eat it all at onceThe Giant picks the wagon up, and dumps its entire contents into his mouth. Hogarth is speechless."
utter70.412,utter,HOGARTH (CONT'D),"Do you have any idea what it took to find that metal??? I scoured the neighborhood! I had to ditch school! I've never done that before, I-The Giant picks up the wagon and eats that too. Hogarth"
desc70.413,desc,,sighs and takes a seat.
utter70.414,utter,HOGARTH (CONT'D),"So... now that we've eaten, how shall we spend the rest of our day?"
desc70.415,desc,,"The Giant looks at him, not understanding."
utter70.416,utter,HOGARTH (CONT'D),I'll teach you more words.
desc70.417,desc,,Hogarth stands up and points at his house.
utter70.418,utter,HOGARTH (CONT'D),"That is my ""home."" That's where I come from . My... (points at himself) home..."
desc70.419,desc,,Hogarth points to his house. The Giant looks at it.
utter70.420,utter,HOGARTH,Right. Now where is... (points at giant) ...your home?
desc70.421,desc,,"The Giant looks at Hogarth's house, then follows Hogarth's pointing hand, and looks at himself. Then a look of deep sadness comes over his face. His shoulders shrug, and his hands turn palm-upward in a puzzled gesture. GIANT"
utter70.422,utter,HOGARTH,You mean... you don't know where you came from?
utter70.423,utter,GIANT,"(ANGUISHED, INARTICULATE GIANT SOUNDS)"
utter70.424,utter,HOGARTH,Wow. You poor guy...
desc70.425,desc,,Now we hear a deep rumbling sound. The Giant looks down at his stomach hungrily.
utter70.426,utter,HOGARTH (CONT'D),"I know, I know. (thinks for a moment) Okay, I know a place where it's all you can eat. But not until after dark."
desc70.427,desc,,"The Giant stares at him, uncomprehending."
utter70.428,utter,HOGARTH (CONT'D),Let me put it this way.
desc70.429,desc,,"He points at through the window at the sun. ""Sun."" ""Suuughn."""
utter70.430,utter,HOGARTH (CONT'D),GIANT
utter70.431,utter,HOGARTH,When the sun goes down...
desc70.432,desc,,Hogarth mimes the sun arcing down the sky to sunset. The he taps on the Giant's iron belly.
utter70.433,utter,HOGARTH (CONT'D),Feeding time. Get it?
desc70.434,desc,,"Hogarth starts to leave, then pauses and turns back to look at the Giant."
utter70.435,utter,HOGARTH (CONT'D),"You're smarter than you look, aren't you?"
utter70.436,utter,GIANT,(puzzled sound)
utter70.437,utter,HOGARTH,(exiting) Never mind.
desc70.438,desc,,"In a time-lapse, we see the sun arc across the sky and set over picturesque Rockwell, Maine."
scene71,slugline,,EXT. HOGARTH'S BARN - NIGHT
desc71.439,desc,,"Two silhouettes creep into the night -- one small, one enormous. OPEN COUNTRY A ways off, Hogarth relaxes."
utter71.440,utter,HOGARTH,Let's go!
desc71.441,desc,,"Hogarth starts walking. The Giant moves past him- BOOM BOOM BOOM! -and with a half dozen strides, is almost out of sight. STOP!"
desc71.442,desc,,"On the horizon, the giant turns, looks puzzled: now what?"
utter71.443,utter,HOGARTH (CONT'D),Not that fast! Sheesh! Come back here!
desc71.444,desc,,"BOOM! BOOM! BOOM! In two seconds, the giant stands at Hogarth's side and looks down at him, confused."
utter71.445,utter,HOGARTH (CONT'D),"Pick me up, OK?"
desc71.446,desc,,"The giant does as he's told, lowers his huge hand to the ground. Hogarth climbs up on it. The giant carefully raises up his hand, with Hogarth on it. Hogarth grabs onto a finger, and points toward the northwest. Okay, now."
utter71.447,utter,HOGARTH (CONT'D),March!
desc71.448,desc,,"Hogarth hangs on for dear life as the giant quickly accelerates. Hogarth looks down, and GASPS: they're really moving!"
scene72,slugline,,EXT. POWER PLANT - NIGHT
desc72.449,desc,,"Kent is hunting around the power plant with a flashlight, muttering to himself."
utter72.450,utter,KENT,"(scornful) ""Evidence"". I'll get your evidence..."
desc72.451,desc,,"He scans the vast expanse of forest with his flashlight, and sags hopelessly."
utter72.452,utter,KENT,...somewhere...
scene73,slugline,,EXT. HILLS OUTSIDE ROCKWELL - LATER
desc73.453,desc,,"Hogarth and the Giant are marching along a back road on the hills outside town. FROM HOGARTH'S POV It's like a magic carpet ride, as the moon-lit countryside below sails past his vantage point, fifty feet above the ground. Hogarth points at a church steeple. Church."
utter73.454,utter,HOGARTH,Churrrch.
utter73.455,utter,GIANT,Churrr-(CRUNCH)
utter73.456,utter,HOGARTH,Yes. People pray there. (points at another building) School. Can you say that? Schooool... Skooo...
utter73.457,utter,HOGARTH,Schooool suuuucks... Skoooo saauuugz...
utter73.458,utter,HOGARTH,Very good. And that's all you need to know about school.
scene74,slugline,,EXT. WOODS
desc74.459,desc,,Kent has wandered some distance from the power plant now. His flashlight beam sweeps across the ground.
utter74.460,utter,KENT,Nothing. Nothing...
desc74.461,desc,,"Just then, he hears a noise behind him. He stops. Wheels around -- and the beam of his flashlight catches---a MOOSE. Huge. Enormous antlers. Looking right at him. The moose SNORTS. Kent backpedals, stumbles backward into a ditchWhooooa!"
scene75,slugline,,KENT (CONT'D)
desc75.462,desc,,"--loudly enough to scare off the moose. He gets up, dusts himself off, shines his flashlight around and discovers what he's standing in is not a ditch at all, but a-GIANT FOOTPRINT, perfectly preserved in a patch of dried mud. Kent GASPS. to laugh... The gasp becomes a sound of delight. He begins And then a single rain drop falls on head. Another drop falls. Kent looks up. The laughter ceases."
desc75.463,desc,,Hogarth is still riding on the Giant's shoulder. Rain has begun to drizzle down now.
utter75.464,utter,HOGARTH,And that building there is the
desc75.465,desc,,coffee shop. Kau-(CLANG) shawww...
utter75.466,utter,HOGARTH,"That's where my mom works. Sometimes she has to stay late, to make extra money 'cause... well, my Dad's away. You know what a ""dad"" is? A ""father?"""
desc75.467,desc,,"""Fa-grrr?"""
utter75.468,utter,HOGARTH,Yeah. It's like me... (points at himself) Only bigger.
desc75.469,desc,,He raises a hand indicating somone taller.
utter75.470,utter,HOGARTH (CONT'D),"He used to take me to baseball games. This one time, we brought binoculars, and we tried to figure out what pitch the catcher was calling! One year we want to go to every home game! I mean-- we wanted to..."
desc75.471,desc,,"The Giant stops walking and swivels his enormous head to face Hogarth. For a moment, they stare at each other in silence, with the rain pouring down around them. Then Hogarth bursts out, almost angrily."
utter75.472,utter,HOGARTH (CONT'D),"Aw, what am I even talking to you for? You can't understand a word I'm saying!"
desc75.473,desc,,The Giant continues staring.
scene76,slugline,,HOGARTH (CONT'D)
desc76.474,desc,,"The Giant speaks --and somewhere within the metal clanging of his voice, there seems to be a note of sympathetic sadness."
desc76.475,desc,,"""Fa-grrrr."" Hogarth sighs, and pats the Giant on the side of the head."
utter76.476,utter,HOGARTH,"Well, I guess it's better than talking to myself."
desc76.477,desc,,The Giant looks pleased by this.
desc76.478,desc,,They continue on their
desc76.479,desc,,"Kent, soaked to the bone, is sitting on the edge of the Giant footprint, which has become a soggy, nondescript mess."
utter76.480,utter,KENT,God hates me...
desc76.481,desc,,"He pulls out his pipe, and tries to light it, but his soggy"
utter76.482,utter,KENT (CONT'D),Damnation! (shouting heavenward) Can't a guy get a break around here?!!
desc76.483,desc,,Suddenly the rain lets up. Kent looks surprised. Then pleased. He lights his pipe. Then turns to heaven again.
utter76.484,utter,KENT (CONT'D),Thank you. Waaagh!
desc76.485,desc,,"He does a huge double take as he looks up to see the Giant's smiling head looming above him. The Giant picks up Kent's metal flashlight, eats it, and in three strides is gone from sight, leaving the terrified and exhilarated Kent behind. UNDER THE GIANT'S CHIN... ...Hogarth PEEKS OUT, breathing hard."
utter76.486,utter,HOGARTH,That can't be good.
scene77,slugline,,EXT. DEAN'S JUNKARD - NIGHT
desc77.487,desc,,"A metal graveyard, sprawling as far as the eye can see."
utter77.488,utter,HOGARTH (O.S.),This is it.
desc77.489,desc,,The Giant's metal hand sets Hogarth down into frame.
utter77.490,utter,HOGARTH (CONT'D),All you can eat.
desc77.491,desc,,"The Giant surveys the metal in all directions: MOANING happily as he spies a huge stack of cars. He selects one, and slowly... carefully... bites into it..."
utter77.492,utter,GIANT,(DELIGHTED SOUND)
desc77.493,desc,,"He selects another car, picks it up and bites into it like a gourmand tasting a fine chocolate."
desc77.494,desc,,He tastes another.
desc77.495,desc,,--causing the CAR HORN TO BLAST!
utter77.496,utter,HOGARTH,"SHHHH!! Turn it off, turn it OFF!!!"
desc77.497,desc,,"The giant looks around nervously, helplessly, beginning to PANIC. He tries shaking it, then sitting on it... but nothing works; the horn is STUCK. Hogarth looks back toward the house-AT THE FAR END OF THE JUNKYARD A light goes on in a little house. Finally, the Giant takes a monster chomp and snaps the car in half. The horn strangles into silence."
scene78,slugline,,EXT. JUNKYARD HOUSE
desc78.498,desc,,"Dean reaches the door, opens it: a GASPING, out-of-breath Hogarth stands on his doorstep. Dean studies Hogarth for a moment. Then breaks into a smile."
utter78.499,utter,DEAN,"Hey, I know you. Hogarth."
desc78.500,desc,,Squirrel boy. HOGARTH
utter78.501,utter,DEAN,"By night known as Hogarth. Got it. Well, come inside kid. Hell, it's raining out there, isn't it?"
scene79,slugline,,INT. DEAN'S HOUSE
desc79.502,desc,,Jazz is playing on the hi-fi of this distinctly bohemian pad. Dean presses an espresso.
utter79.503,utter,HOGARTH,"Listen, you're not going to call my mom are you? She doesn't know I'm out. I could get in trouble."
utter79.504,utter,DEAN,"Don't worry, kid. It's not my style to report a guy to the authorities."
desc79.505,desc,,He brings over two espresso cups and hands one to Hogarth.
utter79.506,utter,DEAN (CONT'D),"Espresso for me, Bosco for you. But I thought you'd dig the little cup."
desc79.507,desc,,Hogarth looks pleased.
utter79.508,utter,HOGARTH DEAN,My name's Dean. I'm a nobody. And you are...?
utter79.509,utter,HOGARTH,"Hogarth. I'm... kind of a nobody, too."
utter79.510,utter,DEAN,"So what brings you all the way up here, Hogarth? You riding some kind of crazy inspiration?"
utter79.511,utter,HOGARTH,I've been riding something alright...
desc79.512,desc,,"The record finishes, and in the silence: LOUD CRUNCHING NOISES from outside. Dean jumps up."
utter79.513,utter,DEAN,Did you hear that???
desc79.514,desc,,"He grabs a crowbar, runs to the door; Hogarth jumps up."
scene80,slugline,,DEAN'S HOME
utter80.515,utter,HOGARTH,Stop!
scene81,slugline,,NIGHT
desc81.516,desc,,"The door flies open, Dean leaps out, YELLS:"
utter81.517,utter,DEAN,Who's out there?!
desc81.518,desc,,"He hears a metallic GASP. He looks up, up, up and sees the gargantuan Giant, tailpipes sticking out of his mouth, frozen, a guilty ""caught!"" look on its face. Dean YELPS... --my god!"
utter81.519,utter,DEAN (CONT'D),"RUN KID, RUN!!!!"
utter81.520,utter,HOGARTH,(rolls his eyes) It's OK...!
desc81.521,desc,,"But the heroic Dean seizes Hogarth and turns to duck inside---which the giant immediately interprets as a threat and---SLAMS his massive hand in front of the door, blocking it as Hogarth tries to break free of Dean, to explain-HOGARTH (CONT'D) The giant isn't--let GO! as the giant GRABS DEAN, hoisting him high in the air."
desc81.522,desc,,"DON'T SQUASH HIM!! DO NOT SQ-The giant STOPS--looks down at Hogarth, puzzled."
utter81.523,utter,HOGARTH (CONT'D),"...squash.... him. Good boy. (beat, heavy sigh, then-) His name is Dean. We like Dean. Dean good. Put him down. Dean."
scene82,slugline,,THE GIANT
desc82.524,desc,,"The giant grins at Dean; he sways, shocked, overwhelmed."
utter82.525,utter,HOGARTH,"Dean, meet a friend of mine. giant. Giant, Dean."
desc82.526,desc,,"The giant grins, and kind of ""waves"". pale, completely overwhelmed."
utter82.527,utter,HOGARTH (CONT'D),More coffee...?
desc82.528,desc,,"Dean stands there,"
scene83,slugline,,EXT. DEANS HOUSE - SOME TIME LATER
desc83.529,desc,,"Dean stares, stunned, at the huge, impassive giant."
utter83.530,utter,DEAN,So... where'd he come from?
utter83.531,utter,HOGARTH,He doesn't remember. little kid...
desc83.532,desc,,He's like a
utter83.533,utter,DEAN,Little. (mirthless laugh) Yeah. Huh.
utter83.534,utter,HOGARTH,He needs food. And shelter.
desc83.535,desc,,"Dean stares at Hogarth in expressionless shock. Then slowly stands, pours out his coffee, goes inside, locking the door behind him."
scene84,slugline,,SAME SHOT - 37 MINUTES LATER
desc84.536,desc,,"The blinds have been pulled. Hogarth stands at the Dean's front door, pleading."
utter84.537,utter,HOGARTH,You got plenty of room here! place is perfect!
desc84.538,desc,,This
utter84.539,utter,DEAN,"(from inside, muffled) Go away."
utter84.540,utter,HOGARTH,I can have him push the door down. You know I can.
desc84.541,desc,,"Pause. The door opens and there's Dean, looking annoyed."
utter84.542,utter,Hogarth!,Him.
utter84.543,utter,DEAN,I can't hide it here!
utter84.544,utter,HOGARTH,Not it. Him.
utter84.545,utter,DEAN,Whatever! You don't even know where he came from! Or what the hell he is!
utter84.546,utter,HOGARTH,(stubbornly) He's ...my friend.
desc84.547,desc,,"Dean stares at immovable Hogarth. Behind him, dawn breaks."
utter84.548,utter,DEAN,"(low mutter) Yeah. What am I, am I your friend? Bring some frankenbot with out of state plates over here and make me change my tune... don't like that jazz... God, I'm tired..."
desc84.549,desc,,"Dean gives up, stands, worn-out, exhausted."
utter84.550,utter,HOGARTH,He can stay?!
utter84.551,utter,DEAN,"Tonight. Tomorrow, I don't know... (wanders inside, muttering) ...figure something out...."
desc84.552,desc,,"Dean stumbles toward his home. the now-tired giant, YAWNING. Hogarth grins, and looks at"
utter84.553,utter,HOGARTH,Let's get you tucked in....
scene85,slugline,,EXT. DEAN'S JUNKYARD - NIGHT
desc85.554,desc,,"Hogarth smiles to himself, as he watches the giant sleep, now covered with a layer of junk, a camouflage-comforter. And then he hears a BEEPING NOISE. Hogarth looks up and sees an ARMY PLANE, flying towards him. The BEEPING gets louder. Hogarth realizes it's coming from the Giant. Suddenly: WHIR, a panel on the giant's arm slides open. A strange device pops out and starts tracking the plane overhead. Hogarth panics: as the plane comes nearer the BEEPING becomes more insistent, the strange device tracks the plane: it looks very retro-advanced and scary. The giant starts MOANING, thrashing in his sleep as if caught in a bad dream. Suddenly he wakes up and ka-CHUK!-the device withdraws. The plane disappears over the trees. Hogarth looks at the giant, stunned. looks at Hogarth, puzzled. The giant, unaware,"
utter85.555,utter,HOGARTH,It's okay. Go back to sleep. It was just a bad dream.
desc85.556,desc,,"The giant nods, comforted, and drops off into sleep. Hogarth walks away, deeply troubled."
scene86,slugline,,INT. HOGARTH'S HOUSE
desc86.557,desc,,"Hogarth creeps upstairs to his room, pulls back the covers, and is just about to dive in... when Annie enters; spies Hogarth up and dressed."
utter86.558,utter,ANNIE,You're up already?
desc86.559,desc,,Hogarth tiredly replaces the bedcovers.
utter86.560,utter,HOGARTH,...just making the bed....
utter86.561,utter,ANNIE,That's nice. Come downstairs. have a surprise for you...
scene87,slugline,,HOGARTH'S HOUSE LIVING ROOM LIVING ROOM
desc87.562,desc,,"An exhausted Hogarth shuffles downstairs, and into the kitchen."
scene88,slugline,,INT. KITCHEN
desc88.563,desc,,"He sits down sleepily at the breakfast table and then GASPS: sitting across from him, reading the paper and looking quite at home in a fatherly way is -Kent...? HOGARTH"
utter88.564,utter,KENT,"Morning, sport. Sleep well?"
desc88.565,desc,,He feels Kent's knowing eyes boring into him.
utter88.566,utter,HOGARTH,Moooooooom!
desc88.567,desc,,"Annie appears, carrying a plate of waffles. She sets a plate down and leans in towards Hogarth, beaming."
utter88.568,utter,ANNIE,"Isn't it wonderful, Hogarth? We finally got a border!"
utter88.569,utter,HOGARTH,(PANICKED) Oh no...
desc88.570,desc,,Kent looks at his watch.
utter88.571,utter,KENT,"You know, I meant to wake up bright and early this morning. But from the look of those waffles, I'm still in bed dreaming!"
utter88.572,utter,ANNIE,"Oh, Mr. Mansley-(Kent wags a finger) -- Kent."
desc88.573,desc,,Kent and Annie share a meaningful look. Hogarth looks ill.
utter88.574,utter,HOGARTH,Uh... I'm not very hungry.
desc88.575,desc,,"He exits. Kent watches him go, then picks up the fork that Hogarth was holding, and surreptitiously drops it in a little plastic evidence bag."
scene89,slugline,,INT. COFFEE SHOP - DAY
desc89.576,desc,,Hogarth strolls in and takes a seat at the counter next to a man reading a newspaper. A bored waitress approaches.
utter89.577,utter,HOGARTH,"Chocolate malted, please. (she exits) I've never been in here. Mom says"
desc89.578,desc,,the coffee's weak and they put meat extender in the hamburger.
utter89.579,utter,MAN BEHIND NEWSPAPER,"It ain't the diner, sparky. But it's more private."
desc89.580,desc,,The man lowers the paper to reveal his face. It's Dean. glances around cautiously to make sure they're not being watched.
utter89.581,utter,DEAN,So. Your friend's got quite an appetite.
utter89.582,utter,HOGARTH,"Yeah. When I found him, he was trying to eat the power station."
utter89.583,utter,He DEAN,So where does he come from?
utter89.584,utter,HOGARTH,(shrugs) He doesn't know.
utter89.585,utter,DEAN,You can talk to him???
utter89.586,utter,HOGARTH,"Kinda. He can't say a lot of words yet, but he understands things pretty good."
utter89.587,utter,DEAN,"I wonder if he had something to do with the meteorite that splashed down here the other day. Then again, maybe he was the meteorite..."
utter89.588,utter,HOGARTH,That's what I was thinking! came from outer space!!
utter89.589,utter,He DEAN,Maybe. Or maybe he was launched into space from earth.
utter89.590,utter,HOGARTH,"Hey, maybe the commies made him! You know, in one of their secret labs."
utter89.591,utter,DEAN,"Or maybe we built him in one of ours. Our government has secrets, too you know."
utter89.592,utter,HOGARTH,"(getting into it) Or maybe he comes from underground, you know? Like, he's this undiscovered species, that evolved from minerals or something, while we were evolving out of monkeys."
utter89.593,utter,DEAN,"Maybe, kid. And then, again, maybe the monkeys evolved from us."
desc89.594,desc,,"Dean laughs and puts his hands behind his head, and strikes a philosophical pose."
utter89.595,utter,HOGARTH,I wish we knew why he was here.
utter89.596,utter,DEAN,"Hey, I wish I knew why I was here."
desc89.597,desc,,"Hogarth puts his hands behind his head and strikes a philosophical pose, too. He seems to be enjoying the adult conversation."
utter89.598,utter,HOGARTH DEAN,"I mean if you think about it, nobody really knows where they came from, why they're here, or where they're going. We believe. We hope. But we don't know."
utter89.599,utter,HOGARTH,"Right, right..."
utter89.600,utter,DEAN,"And some cats, that scares 'em, you know?"
utter89.601,utter,HOGARTH,You're telling me.
utter89.602,utter,DEAN,"They race around, play the game,"
desc89.603,desc,,"chase money, chase power..."
utter89.604,utter,HOGARTH,Just so they won't have to wonder what life's all about.
utter89.605,utter,DEAN,"Exactly. (beat, suddenly impressed) Hey..."
desc89.606,desc,,"Dean lifts his coffee cup, saluting Hogarth. They sit in silence for a moment, happily contemplating the universe."
scene90,slugline,,INT. DARK LABORATORY
desc90.607,desc,,"As Kent looks on, an AGENT in a lab coat studies a spoon -now dusted with white powder -- under a microscope. After a moment, he looks up, and gestures at the BB-gun, also dusted with powder, which lies on the table nearby. The Agent turns to the man in shadow standing over him. LAB-COAT AGENT It's the same fingerprint. A match is struck. We follow it up to the man's pipe, already in his mouth. As the match flares it lights up Kent's face. He smiles diabolically."
scene91,slugline,,INT. COFFEE SHOP - DAY
desc91.608,desc,,"Hogarth contentedly slurps the last of his malted through a plastic straw. Dean works on a slab of apple pie. Hey, Dean?"
utter91.609,utter,HOGARTH DEAN HOGARTH,What is life all about? mean.
desc91.610,desc,,"For you, I"
utter91.611,utter,DEAN,"For me? Well... (shrugs) I guess I'd like to prove there's something pure in me, you know? They say the soul is part angel and part monster. Sometimes I think life is a chance to set the angel free."
desc91.612,desc,,The Giant looks like a monster.
utter91.613,utter,DEAN,"I hope you're right, kid. The world could use an angel that size."
utter91.614,utter,HOGARTH,"You won't tell anybody about him, will you?"
utter91.615,utter,DEAN,Nah. He's an outsider. I've got a soft spot for outsiders.
scene92,slugline,,EXT. HOGARTH'S HOUSE - DAY
desc92.616,desc,,"Hogarth comes riding home on his bike. He parks it at the side of the house, and starts to go inside, then hesitates. He holds out a hand, and feels a drop of rain, looks up at the clouds... then takes his bike and wheels it toward the barn instead."
scene93,slugline,,EXT. BARN - DAY
desc93.617,desc,,"Hogarth opens the barn door, and GASPS. HOGARTH'S POV: Kent and the labcoat AGENT sit at a small, improvised lab table. Nearby are four OTHER AGENTS in suits and ties; studying maps, monitoring listening equipment, generating artist conceptions of the giant. They look up, aghast. Moooom! HOGARTH"
scene94,slugline,,INT. KITCHEN - A LITTLE LATER
desc94.618,desc,,"Kent and the agents sit stoically at the breakfast table. Annie stands facing them with folded arms. Hogarth stands nearby, scowling."
utter94.619,utter,ANNIE,So you work for the government?
utter94.620,utter,KENT,That's right.
desc94.621,desc,,A long PAUSE...
utter94.622,utter,ANNIE,Our government?
utter94.623,utter,KENT,"Of course. Annie, please, let me explain. Every once in a while things happen to people that just can't be rationalized in a conventional way. The Unexplained Phenomena Department was created to respond to the bizarre, the strange, the--well, unexplainable events that happen every day all across this great land. From the"
desc94.624,desc,,"mountains to the prairies, to the"
utter94.625,utter,ANNIE,(interrupts) Do you actually work in Washington?
utter94.626,utter,KENT,Yes indeed. Washington D.C...
desc94.627,desc,,"As Kent begins to wax on about his work, we CUT TO:"
scene95,slugline,,FLASHBACK: WASHINGTON D.C. - MORNING
desc95.628,desc,,"Kent strides briskly through the crisp morning air, making his way through many equally ambitous go-getters on their way to do the nations work. Familiar Washington monuments fill the background."
utter95.629,utter,"KENT (V.O., CONT'D)","...if you're of a mind to be a mover and a shaker, it's the only place to be."
scene96,slugline,,FLASHBACK: GOVERNMENT BUILDING - LOBBY - CONTINUOUS
desc96.630,desc,,"Kent enters an impressive government building. While most of the workforce heads up the massive marble stairs, Kent heads down the narrow stairs off to the side."
utter96.631,utter,"KENT (V.O., CONT'D)",A place where an individual with pluck and ambition can really get ahead...
scene97,slugline,,FLASHBACK: GOVERNMENT BUILDING SUBLEVEL - NARROW HALLWAY
