segment-id,segment-type,segment-speaker,segment-text
desc97.632,desc,,"Kent walks down the endless row of identical doors, stopping in front of one labeled ""UNEXPLAINED PHENOMENA DEPT."" Kent unlocks the door and enters a sparse, windowless office not much larger than the desk in the center of it."
utter97.633,utter,"KENT (V.O., CONT'D)",...safe in the knowledge that the vast resources of the U.S. Government are at ones disposal.
scene98,slugline,,FLASHBACK: KENT'S OFFICE
desc98.634,desc,,"Kent sits idly at his desk, evenly spacing a row of sharpened pencils across the desktop. Clearly there's no action here."
utter98.635,utter,"KENT (V.O., CONT'D)","Although we're simply inundated with calls, we limit ourselves to only the most demanding cases. It's a challenge, I won't deny it."
desc98.636,desc,,"The phone finally RINGS and Kent SEIZES it hungrily... FLASHBACK: APPALACHIAN MOUNTAINS - DAY A couple of slack-jawed yokels gape as Kent pulls a large deflated baloon down from a tree, ""U.S. WEATHER SERVICE"" stenciled on its side. Kent displays it to them, glaring. They grin sheepishly."
utter98.637,utter,"KENT (V.O., CONT'D)","I could tell you many strange stories, but unfortunately, all of them are classified."
scene99,slugline,,RESUME ANNIE'S KITCHEN - KENT & COMPANY
desc99.638,desc,,"Kent leans back in his chair, his story told."
utter99.639,utter,KENT,"I hope that helps to calm some of your worries, Annie. And you, too, Hogarth. Hogarth? The Agents all look around. Hogarth is nowhere to be seen."
utter99.640,utter,KENT (CONT'D),You're supposed to be watching him! The Agents hustle out of the room.
utter99.641,utter,KENT (CONT'D),"(then smiling, to Annie) For his own good, of course."
scene100,slugline,,EXT. ENORMOUS GATES OF IRON - DAY
utter100.642,utter,HOGARTH,Open the blast doors!
desc100.643,desc,,"The massive gates open: Hogarth, wearing a space helmet and carrying a plastic ray gun, walks through. WIDEN TO REVEAL: the gates are actually the giant's two hands."
utter100.644,utter,HOGARTH (CONT'D),Level two. Commander Thruster to base... I have found the escape vehicle.
desc100.645,desc,,"The giant's hand takes him up, up... to a junk car atop a big junk pile. Hogarth climbs in, grabs the wheel."
utter100.646,utter,HOGARTH (CONT'D),"Main engines: 1, 2, and 3! Blast off!"
desc100.647,desc,,"The giant grabs the car and ""flies"" it around."
scene101,slugline,,ANGLE ON - DEAN'S HOUSE
desc101.648,desc,,"Dean sits on his porch, watching. BACK TO - THE Hogarth's face compresses from the G-forces. green. He looks"
utter101.649,utter,HOGARTH,We're landing... we're landing!
desc101.650,desc,,"From his porch Dean watches, grins. The car ""lands"", Hogarth stumbles out, dizzy. The giant CHORTLES."
utter101.651,utter,HOGARTH (CONT'D),"Only one creature could create such destruction. The hideous, maneating killing machine... ROBOTRON!"
desc101.652,desc,,"Hogarth waits. The Giant just stands there, staring at him."
utter101.653,utter,HOGARTH (CONT'D),(impatienly) Robotron...
utter101.654,utter,GIANT,Roarrrr....
utter101.655,utter,HOGARTH,"No, no, no. Bigger...!"
utter101.656,utter,GIANT,ROOAARRRR!!!!!
utter101.657,utter,HOGARTH,"Good! Okay, Robotron... take THIS!!!"
desc101.658,desc,,"He whips his toy gun out, aims it at the Giant and pulls the trigger. It WHINES and sparks. Suddenly the Giant freezes. His eyes lock on the gun, and a reddish glow comes into his eyes."
desc101.659,desc,,"With his eyes still glowing, the Giant reaches out both hands, zombie-like, towards Hogarth."
scene102,slugline,,HOGARTH (CONT'D) (CONT'D)
desc102.660,desc,,"The hands begin closing around Hogarth, who is beginning to panic."
desc102.661,desc,,"He sees that the Giant is staring at his gun, and quickly slips it behind his back."
desc102.662,desc,,The Giant freezes. The red fades from his eyes. Then he looks at his hands which are closed threateningly around
utter102.663,utter,Hogarth. GIANT (GASP OF SHOCK) HOGARTH,"(cont'd) Hey, it's okay. I know you didn't mean it. But, uh, maybe that's enough playing for now."
desc102.664,desc,,"Hogarth gets up and heads for Dean's house. As he turns away from the Giant, we see that he wears a look of deep concern."
scene103,slugline,,EXT. DEAN'S HOUSE
desc103.665,desc,,"Hogarth takes a seat on the porch beside Dean, who is scanning the hills with binoculars."
utter103.666,utter,DEAN,You're sure you weren't followed?
utter103.667,utter,HOGARTH,Yeah. It's not too hard to lose those guys.
utter103.668,utter,DEAN,Don't get cocky. suits can learn.
desc103.669,desc,,Even guys in
utter103.670,utter,HOGARTH,"Why do they want to get him, anyway? Just because he's different?"
utter103.671,utter,DEAN,That's generally all it takes.
utter103.672,utter,HOGARTH,"They don't even know him, and they just assume he's dangerous."
desc103.673,desc,,"They stare out at the Giant, as he opens a car hood, plucks out the engine, eats it, and throws away the ""shell."""
utter103.674,utter,DEAN,Yeah. I just hope they're wrong.
utter103.675,utter,HOGARTH,(suspicious) What do you mean?
utter103.676,utter,DEAN,"Look, I saw what happened out there just now. When you drew a gun on him, he got a look in his eye..."
utter103.677,utter,HOGARTH,It's not his fault! it.
desc103.678,desc,,He can't help
utter103.679,utter,DEAN,"That's what worries me. We don't know what he's capable of. On the surface he may be gentle, but on the inside he could be a killer."
desc103.680,desc,,The Giant looks up curiously. Hogarth shushes Dean.
utter103.681,utter,HOGARTH,(whispering) Don't use that word around him! Why not?
utter103.682,utter,DEAN HOGARTH,"Because he cares. I can't explain it, but... he cares about what he is. He's getting so he can understand all kinds of stuff now. If he hears you use that word around him..."
utter103.683,utter,DEAN,"Okay, okay. I'm just saying, be careful. (pause) So... have we got a plan here? I mean, he can't stay here forever."
utter103.684,utter,HOGARTH,(sadly) I know...
utter103.685,utter,DEAN,"The longer he stays, the better their chance of finding him. We've got to get him out of here, Hogarth."
utter103.686,utter,HOGARTH,How? He's a little too big to smuggle out in a suitcase.
utter103.687,utter,DEAN,We could do it in pieces.
utter103.688,utter,HOGARTH,You mean take him apart?
utter103.689,utter,DEAN,"You think he'd go for that? I've got a junk-truck -- I'm always hauling scrap. In half a dozen trips, we could get him to Canada. There are places in the Yukon, old mining sites, no one around, plenty of metal. He could roam the earth and live off the land... sounds pretty good, actually. Hogarth thinks about it."
utter103.690,utter,HOGARTH DEAN,The sooner the better. Tonight if possible.
utter103.691,utter,HOGARTH,Tonight??? But I only just met him a couple days ago! (pleading) At least wait until tomorrow...
desc103.692,desc,,"Dean looks at the Giant, lounging peacefully in the junkyard."
utter103.693,utter,DEAN,"Alright, I guess one more day won't make a difference."
scene104,slugline,,HOGARTH'S BEDROOM NIGHT
desc104.694,desc,,"R&B; BLARES: Little Richard. Hogarth draws pictures of the giant, they're good. He hides the pictures from view, carefully covering them with a book before EXITING the room."
scene105,slugline,,INT. KITCHEN
desc105.695,desc,,Hogarth sharpens some pencils with the sharpener mounted on the inside of the broom closet.
scene106,slugline,,INT. HOGARTH'S BEDROOM
desc106.696,desc,,"Hogarth returns, goes to his desk, stops stunned: the giant drawings are uncovered. Eyes wide, Hogarth looks around his room: everything looks slightly askew, as if it's been... searched. Hogarth's neck-hair tingles. He stares at the his bedroom door, slowly pulls it toward him... REVEALING: KENT standing behind it... smiling. Surprise."
utter106.697,utter,Kent.,room?
utter106.698,utter,KENT HOGARTH,What are you doing in my
desc106.699,desc,,"He holds up a 45 RPM record, still in its sleeve."
utter106.700,utter,KENT,Just being friendly. And all that that implies. I know how you kids
desc106.701,desc,,"like rocky roll, soHe goes to the phonograph, and puts it on the platter..."
utter106.702,utter,HOGARTH,Pat Boone...?
utter106.703,utter,KENT,"Yeah, baby. It's got that jungle rhythm, but you can understand the words..."
utter106.704,utter,HOGARTH,Uh.... thanks.
desc106.705,desc,,Kent starts to undulate awkwardly to the music...
utter106.706,utter,KENT,"Come on, Hogarth. Let's do the happy monkey. You know the one I mean..."
desc106.707,desc,,"Hogarth edges toward the door, Kent follows, still dancing..."
utter106.708,utter,KENT (CONT'D) (CONT'D),"Friends, Hogarth, that's what we ought to be. But friends don't keep secrets from each other."
utter106.709,utter,HOGARTH,I don't know what you're talking about...
utter106.710,utter,KENT,"You don't. Well, let me tell you a little story. Your mom says you like 'em."
desc106.711,desc,,"Kent steps in front of the doorway, his smile now chilling."
utter106.712,utter,KENT (CONT'D),Once there was a boy who walked into a forest. He wanted to take a
desc106.713,desc,,"picture of a metal-eating giant -but lo and behold, the giant ate his camera alllll up!! Hogarth looks baffled."
utter106.714,utter,HOGARTH,How did you -- ?
utter106.715,utter,KENT,"Because in the process, the Giant snapped a picture of himself. (holds up a roll of film) And the little boy brought the film home."
desc106.716,desc,,Hogarth lunges for the roll of film.
utter106.717,utter,HOGARTH,Give it back!
desc106.718,desc,,"Kent dangles the film over Hogarth's head for a moment, then drops it into Hogarth's hands. Hogarth looks at it. Empty..."
scene107,slugline,,HOGARTH (CONT'D)
desc107.719,desc,,"Kent slips a black-and-white photo from his coat, and hands it to Hogarth. It shows the Giant's face, its mouth wide open."
utter107.720,utter,KENT,"The Army arrives in twenty-four hours, Hogarth. Just thought you'd like to know."
desc107.721,desc,,"Kent dances out of the room. Hogarth stares, helpless."
scene108,slugline,,INT. HOGARTH'S HOUSE - LIVING ROOM - NIGHT
desc108.722,desc,,"Kent puffs on his pipe, as Annie knits. Hogarth sits in a chair studying them. Kent breaks the silence."
utter108.723,utter,KENT,"Well, isn't this a fine way to spend an evening? We're like one big happy family..."
desc108.724,desc,,"Hogarth looks up, staring darkly at Kent."
utter108.725,utter,HOGARTH,"You're not family. And when my Dad finds out you sat in his chair, he'll hunt you down like a dog-Hogarth!"
desc108.726,desc,,Kent turns to Annie. He makes a half-hearted gesture of getting out of his chair.
utter108.727,utter,KENT,"(starting to rise) I'm sorry, should I...?"
utter108.728,utter,ANNIE,"No, no, don't get up. My husband -Hogarth's father -- he's... he was an Air Force Pilot in Korea. A casualty."
utter108.729,utter,HOGARTH,He's coming back.
desc108.730,desc,,"Ignoring Hogarth, Kent puts on a look of deep sympathy, and turns to Annie."
utter108.731,utter,KENT,I'm so sorry.
utter108.732,utter,HOGARTH,No you're not! Hogarth!
utter108.733,utter,ANNIE HOGARTH,"But, Mom, this guy doesn't care about anything -- cats like him race around, play the game, chase"
desc108.734,desc,,"money, chase power...but he keeps"
utter108.735,utter,ANNIE,"Hogarth, that is enough! I think you owe our guest an apology."
utter108.736,utter,KENT,"(chuckling) Oh, now, there's no need for that. Hogarth is right in a way. I'm certainly ambitious. Yes... (looks pointedly at Annie) Ambitious, career-minded, stable -HOGARTH He's doing it again!"
desc108.737,desc,,Kent gives Hogarth a patronizing smile.
utter108.738,utter,KENT,"Hogarth. I would have thought a good American boy like yourself would have more respect for the work I do. The world has become a dangerous place, you know. The balance of power is delicate. I gather information. And the side that has the information is the side that will win."
desc108.739,desc,,Hogarth fixes his eyes on Kent with an intensity that's unnerving.
utter108.740,utter,HOGARTH,They say the soul is part angel and part monster. One look at you and I know the monster is gonna win.
utter108.741,utter,ANNIE,That's it. You either apologize or go right up to bed right now!
desc108.742,desc,,Hogarth throws up his hands and marches out of the room.
utter108.743,utter,ANNIE (CONT'D),"Honestly, I don't know where he's getting these wild ideas. He's starting to talk like that beatnik..."
utter108.744,utter,KENT,Beatnik...?
scene109,slugline,,HOGARTH'S BEDROOM NIGHT
desc109.745,desc,,"Hogarth is in bed, the lights are out. Annie appears in his doorway, silhouetted by the light in the hall. She lingers for a moment, thoughtful..."
utter109.746,utter,ANNIE,"Have you been out at the junkyard,"
utter109.747,utter,Hogarth? HOGARTH,(after a long pause) Which junkyard?
utter109.748,utter,ANNIE,The only junkyard. Dean's junkyard.
utter109.749,utter,HOGARTH,(another pause) If I had ...would you be mad at me?
utter109.750,utter,ANNIE,"No... (more quietly) ...no. (sad smile) Tell him ""hi"" for me."
desc109.751,desc,,She EXITS. Hogarth stares at the ceiling... and sighs.
scene110,slugline,,EXT. TOWN - NEXT DAY
desc110.752,desc,,"A convoy of Army vehicles is pouring into town. Kent watches them enter, euphoric. He glances at his watch, and remembering an appointment, rushes off."
scene111,slugline,,INT. COFFEE SHOP - DAY
desc111.753,desc,,"An Army General sits at a booth, studying a map. across from his, positively glowing with pride. Kent sits"
utter111.754,utter,GENERAL,"Hills, valleys, woods, ravines. Lot of places to hide, around here."
utter111.755,utter,KENT,"Yes, it's remarkable isn't it, sir?"
desc111.756,desc,,"Kent looks around at the various coffee-shop Busybodies, and speaks loudly, for their benefit."
utter111.757,utter,KENT (CONT'D),"That one man, working alone, could have single-handedly found a monster in a place like this? The Busybodies coo and murmum amongst themselves."
utter111.758,utter,GENERAL,"(still studying map) Hard to know where to start, really..."
utter111.759,utter,KENT,"Well, sir, perhaps I can be of some help in that regard. You see, I've had my eye on an odd little boy who seems to be connected to the creature in question. And I have reason to believe he's been spending some time at a local scarpyard."
desc111.760,desc,,"From behind the counter, Annie looks sharply at Kent, finally understanding his attentions."
utter111.761,utter,GENERAL,Can you take me there?
utter111.762,utter,KENT,"But of course, sir. (loudly, for the busybodies) (MORE)"
utter111.763,utter,KENT (CONT'D),"When a five-star general needs my help, I'm only too eager to oblige."
desc111.764,desc,,Annie comes by and refills their coffee.
utter111.765,utter,ANNIE,"I'm the mother of that ""odd"" little boy."
utter111.766,utter,KENT,"(uncomfortable) Oh yes, ahem."
utter111.767,utter,ANNIE,"And if you're going up to the junkyard, I'm coming along."
scene112,slugline,,INT. DEAN'S STUDIO - DAY
desc112.768,desc,,"Dean is welding a sculpture of a hooded executioner. Instead of an axe, the executioner wields a flag -- part Hammer and Sickle, part Stars and Stripes. There's a knock at his door."
desc112.769,desc,,"In walks the General and Kent followed by a few soldiers. Annie comes in last. Dean takes off his welding goggles, and studies all the uniforms."
utter112.770,utter,DEAN (CONT'D),I assume you're here for the Lenny Bruce albums.
utter112.771,utter,KENT,"Watch the wise cracks, Beatnik. We represent America."
utter112.772,utter,DEAN,"We all represent America, man. Sir, my name is General Shannon Rogard. We have reason to believe you are harboring a large... (finding this hard to swallow) ... creature whose interest run counter to those of the United States. Do you deny it?"
utter112.773,utter,DEAN,"(shrugs) Hey, man, if a cat needs to flop, my pad springs eternal."
desc112.774,desc,,The General and the Soldiers exchange puzzled glances. One of them leans towards the General and speaks in hushed tones.
utter112.775,utter,SOLDIER,"As I understand it, sir, a ""cat"" is a member of the counter-culture. What rank? Well... SOLDIER"
desc112.776,desc,,"As the General and the Soldiers continue to confer, Annie steps forward and speaks to Dean."
utter112.777,utter,ANNIE,Is Hogarth here? Is he alright? These people say he may be in some kind of trouble.
utter112.778,utter,DEAN,"He's not here, Annie. But he is alright. (then, gently) Believe me, I would never let anything happen to that little guy."
desc112.779,desc,,Annie and Dean share a look. Kent sees this and loses his
utter112.780,utter,KENT,"Alright, I've had enough!"
desc112.781,desc,,He turns to the soldiers.
utter112.782,utter,KENT (CONT'D),You and you! Start rummaging around! Tip some tables over! Kick open doors! Break stuff! You know the drill!
desc112.783,desc,,Kent claps his hands. The soldiers don't move.
utter112.784,utter,DEAN,"(to Kent) We all hear you yacking, daddy-o, but no one's listening."
utter112.785,utter,Kent seethes. KENT,(under his breath) Not yet. Not yet.
desc112.786,desc,,"Annie looks from one to the other, comparing."
scene113,slugline,,INT. WOODS - DAY
desc113.787,desc,,"The Giant strolls through the forest, with Hogarth on his shoulder."
utter113.788,utter,HOGARTH,"I know this is hard for you to understand, but...well, it might be a real long time before we get to hang out like this again."
desc113.789,desc,,The Giant is oblivious to anything but the beauty of the day. He turns his face up towards the sun as it ours through the trees. Birds are singing. All is peaceful. GIANT
utter113.790,utter,HOGARTH,"Yeah, it is beautiful, isn't it?"
desc113.791,desc,,"Through a patch in the trees, they spot a deer."
utter113.792,utter,GIANT,(CURIOUS SOUND)
utter113.793,utter,HOGARTH,"It's a deer. ""Deeeer."" Deeeer..."
desc113.794,desc,,The Giant takes a step towards it. points.
desc113.795,desc,,It darts away.
desc113.796,desc,,"HOGARTH Full of childlike curiosity, the Giant follows, and a game of hide and seek begins. Hogarth laughs happily, as they dart in and out of the trees. At last he finds the deer grazing in a clearing. The Giant is FASCINATED."
utter113.797,utter,HOGARTH (CONT'D),(whisper) Shhhhh... let's get closer...
desc113.798,desc,,"The Giant tries to sneak nearer, leaning on a pair of tall trees, which begin to teeter. He grabs one, and as he quietly pushes it back into place... the other crashes to the ground. The treetop lands near the deer, who bolts away from it and directly toward the Giant--almost into the Giant's foot. The deer STOPS, puzzled by the strange metal obstacle. He looks up... right to the Giant's face. The Giant SMILES---which SPOOKS the deer, who darts off in the other direction. The Giant reaches out and catches it, in one huge hand, like a kid trapping a butterfly."
utter113.799,utter,HOGARTH (CONT'D),You caught it!
desc113.800,desc,,"The Giant laughs and opens his hand. The deer lies motionless. The Giant and Hogarth look stunned. The Giant tenderly lays the deer down on the ground, kneels, and nudges the deer with a big finger. Nothing. It doesn't move."
utter113.801,utter,HOGARTH (CONT'D),It's... dead. Deh...?
desc113.802,desc,,There is a long silence. The Giant nudges the deer again.
utter113.803,utter,HOGARTH,"(suddenly vehement) Don't do that! It's dead. Okay?? That means it's not going to move! It's gone! And it's not coming back, understand?? (softly, tears flowing) It's not ever going to come back..."
desc113.804,desc,,"It begins to snow, softly. From high above, through the trees, the boy and the giant stare down at the lifeless deer. They bow their heads in sorrow."
scene114,slugline,,EXT. JUNKYARD - LATER
desc114.805,desc,,"The snow falls harder now. The depressed giant sits on a hillside, snow piling up on his motionless bulk, staring out into the forest. Dean and Hogarth watch him, worried."
utter114.806,utter,DEAN,This is bad. This is very bad. The Army's on it's way. We've got to get him out of here!
utter114.807,utter,HOGARTH,He doesn't know how to think about it.
utter114.808,utter,DEAN,You've got talk to him. to get through to him.
desc114.809,desc,,You've got
utter114.810,utter,HOGARTH,Me? I don't know about this stuff...
utter114.811,utter,DEAN,"You know as much as anyone does, kid. And he trusts you. Speak from your heart. It's the only chance we've got."
desc114.812,desc,,Hogarth looks at the Giant.
utter114.813,utter,HOGARTH,I'll try.
desc114.814,desc,,"He walks over to the Giant, climbs up his leg, and sits on his knee. The Giant turns and looks at Hogarth, with weary eyes. Hogarth sighs."
utter114.815,utter,HOGARTH (CONT'D),It wasn't your fault. No response from the Giant.
utter114.816,utter,HOGARTH (CONT'D),Things die. It's part of life.
desc114.817,desc,,Hogarth reaches for the overhanging branch of a nearby tree and picks two leaves -- a brown on and a green one. He holds up the green leaf.
desc114.818,desc,,He holds up the brown leaf.
desc114.819,desc,,He gestures at the forest around him.
desc114.820,desc,,He points at the Giant and shakes his head.
utter114.821,utter,HOGARTH (CONT'D) (CONT'D),You didn't make it that way. Do you understand? It's not your fault.
desc114.822,desc,,"The Giant gazes at Hogarth for a beat, then takes the leaves from the boy's hands and studies them. Hogarth hops down and stands by Dean."
utter114.823,utter,DEAN,What's he doing?
utter114.824,utter,HOGARTH,He's thinking. It's not an easy thing to understand.
desc114.825,desc,,Dean looks at Hogarth with empathy.
scene115,slugline,,THE ARMY'S TEMPORARY COMMAND CENTER - DAY
desc115.826,desc,,"Kent is on the phone with the chief. He's visably PALE. (INTERCUT the following with the CHIEF in Washington, D.C.)"
utter115.827,utter,KENT,"But Sir... you're making a big mistake! We're close... I have a real gut fee-CHIEF (CUTTING HIM OFF) Mansley, if I hear about your gut feelings one more time I'm going to vomit through the phone lines!! The press has got ahold of this thing and now I'm a laughing stock for spending tax dollars on your IDIOTIC plan! I'm pulling those troops out THIS MINUTE! Before MY career is as dead as YOURS!!"
desc115.828,desc,,"The Chief SLAMS the receiver down so hard, it hurts Kent's hand in Maine."
scene116,slugline,,EXT. DEAN'S JUNKYARD - DAY
desc116.829,desc,,"The Giant still ponders. Just then, a pair of Army planes comes into view. We hear a beeping sound."
desc116.830,desc,,HOGARTH
utter116.831,utter,DEAN,What is it?
desc116.832,desc,,"The panels on the Giant's arms slide open, and the strange tracking device pops out again."
utter116.833,utter,HOGARTH,I was going to tell you...
desc116.834,desc,,"The Giant looks confused as another panel opens, and what appears to be a rocket launcher pokes out, tracking the planes. As they pass, the weapons recede and the panels close. The Giant looks distressed."
utter116.835,utter,DEAN,"Good God, Hogarth he's armed??! How could you keep this from me?"
utter116.836,utter,HOGARTH,Would you have let him stay? No!
utter116.837,utter,DEAN HOGARTH,That's why.
utter116.838,utter,DEAN,"Oh, man. Oh man, Hogarth! This is serious! What are we doing?? He's not some lost puppy...he's a weapon!!"
desc116.839,desc,,Dean is pointing at the Giant now. Hogarth sees the Giant watching Dean with eyes wide.
utter116.840,utter,HOGARTH,"Dean, shh-DEAN He's a machine, Hogarth! made, designed--to kill! He was"
desc116.841,desc,,"The Giant stands up. He looks at himself, and then at Dean. And then, with a terrible roar, he runs away. Dean and Hogarth share a look of panic."
utter116.842,utter,DEAN (CONT'D),This is bad.
utter116.843,utter,HOGARTH,We gotta find him! Come on!
desc116.844,desc,,They run for his house.
scene117,slugline,,EXT. ROCKWELL - SAME TIME
desc117.845,desc,,"Kent watches in despair as the ARMY pulls out of Rockwell, taking his credibility, and hopes for the future, with them. EXT."
scene118,slugline,,COUNTRYSIDE - DAY
desc118.846,desc,,"The Giant wanders through the falling snow, deeply disturbed and depressed, not knowing, or caring, where he's going."
scene119,slugline,,INT. DEAN'S GARAGE
desc119.847,desc,,He wheels a motorcycle out. THE DEEP WOODS Hogarth jumps in the sidecar.
scene120,slugline,,DAY
desc120.848,desc,,"The Giant blindly marches on, agitated, grieving. EXT."
scene121,slugline,,DEAN'S MOTORCYCLE - MOVING - DAY
desc121.849,desc,,"Dean and Hogarth speed into the driving snow, following the Giant's quickly filling footprints."
desc121.850,desc,,He's headed right toward town.
scene122,slugline,,THE OUTSKIRTS OF TOWN EVENING
desc122.851,desc,,"FILLING THE SCREEN: a woman SCREAMS. LOUD. REVERSE: the Giant peers down at a tiny woman, her TINY SCREAM barely heard from his viewpoint. He waves meekly. BACK TO: the woman SCREAMS... runs in, SLAMS the door. The Giant wonders... He looks behind him, is something back there...? Nope.... He shrugs. He wanders on, the streets largely deserted, the snow falls heavily. LOOKING IN A SECOND-STORY WINDOW A TODDLER watches a TV monster movie. Bored, he looks out the window... and sees a real monster. He blinks, isn't sure whether to be scared or not. The Giant sees the kid staring at him. and waves. The kid grins, waves back. The Giant smiles, The kid HOLLERS, in silence. TWO OLDER KIDS join him at the window, look out, see a waving giant. They look stunned, and wave back. One YELLS a silent ""MOM!"". MOM appears at the window. The Giant waves. She turns white, SCREAMS silently, YANKS down the window shade. The Giant blinks, disturbed. BOW-WOW-WOW! He looks down: a tiny TERRIER BARKS ferociously at him, then NIPS at his foot... and YELPS in pain. GIANT Rock. The giant reaches down for the terrier: it YIPES and runs away. The giant looks disappointed. He looks up: nearby, several VILLAGERS stand in the falling snow, staring up at him. He waves. The villagers run inside, SLAM their doors. MOANS, depressed."
scene123,slugline,,The giant WITH DEAN AND HOGARTH - MOVING
