segment-id,segment-type,segment-speaker,segment-text
desc0.0,desc,,"""DONNIE DARKO"""
desc0.1,desc,,"We descend upon Carpathian Ridge, a crescent-shaped cliff that extrudes from the dense Virginia evergreens above a deep rock canyon. The cliff marks the end of a dirt road that winds down from above. Donnie Darko (sixteen) is asleep at the edge of the cliff. With his bike collapsed next to him, he is shivering, curled up on the foetal position. He slowly opens his eyes and looks around, disoriented by the morning light. He then stands up, looking down into the expansive rock canyon. After a moment of hesitation, he takes his bike back up the hill."
scene1,slugline,,EXT. MIDDLESEX - MORNING (11 A.M.)
desc1.2,desc,,"Montage is choreographed to 'Never Tear Us Apart' by INXS. Donnie pedals down into the suburban village of Middlesex, Virginia... passing by a large rock 'Middlesex' rock-pattern. Donnie pedals past two neighbourhood women who are speedwalking with handweights. They smile at him. A Pontiac Trans-Am speeds by."
scene2,slugline,,EXT. NEIGHBOURHOOD STREET - DAY (SATURDAY 1 P.M.)
desc2.3,desc,,Donnie turns the corner and heads towards the garage. We pan over to the Darko house... moving through the front yard where Eddie Darko (forty-four) pulls the cord and his gas-powered leaf-blower roars to life. Elizabeth Darko (nineteen) comes out the front door. She approaches her dad from behind. Eddie turns and aims the leaf-blower at her face... blasting her with air.
scene3,slugline,,EXT. DARKO DRIVEWAY - NEXT
desc3.4,desc,,Donnie parks his bike and goes inside.
scene4,slugline,,EXT. DARKO BACKYARD / PATIO - NEXT
desc4.5,desc,,"We pull back from Samantha Darko (ten) as she is jumping on a trampoline and pan over to Rose Darko (forty-two) as she sits at a table reading a paperback copy of Stephen King's ""IT"". She glances over to the kitchen."
scene5,slugline,,INT. KITCHEN - NEXT
desc5.6,desc,,Donnie walks into the kitchen. He then goes to the refrigerator. Printed in magic marker on the refrigerator notepad is the phrase: WHERE IS DONNIE?
scene6,slugline,,INT. FAMILY ROOM - EVENING (5 P.M.)
desc6.7,desc,,"The opening theme of ""Who's the Boss?"" begins as we see Tony Danza's blue van and the title card. We reveal Samantha, sitting on the floor, singing softly to the theme song ""Brand New Life"" performed by Larry Weiss. We pan over to Donnie, sitting in the La-Z Boy."
scene7,slugline,,INT. KITCHEN - EVENING (6 P.M.)
desc7.8,desc,,The Darko family has convened for dinner. They eat silently for several moments.
utter7.9,utter,ELIZABETH,I'm voting for Dukakis.
utter7.10,utter,EDDIE,"Perhaps when you have children of your own that need braces, and you can't afford them because half of your husband's paycheck goes to the federal government, you'll regret that decision."
utter7.11,utter,ELIZABETH,(amused bitterness) I'm not gonna squeeze one out until I'm thirty.
utter7.12,utter,DONNIE,Will you still be working at Yarn Barn? 'Cause that's a great place to raise children.
utter7.13,utter,ROSE,"No, a year of partying is enough. She'll be going to Harvard this fall."
utter7.14,utter,ELIZABETH,"I haven't been accepted yet, mother."
utter7.15,utter,ROSE,"(smiles) If you think Michael Dukakis will provide for this country prior to the point when you decide to squeeze one out, then I think you're misinformed."
utter7.16,utter,SAMANTHA,When can I squeeze one out?
utter7.17,utter,DONNIE,(to his sister) Not until like... eighth grade.
utter7.18,utter,ROSE,(to Donnie) Excuse me?
utter7.19,utter,ELIZABETH,Donnie? You're a dick.
utter7.20,utter,DONNIE,"Whoa, Elizabeth. A little hostile, there. Maybe you should be the one in therapy. Then Mom and Dad can pay someone two hundred dollars an hour to listen to all of your thoughts... so we won't have to."
utter7.21,utter,ELIZABETH,Maybe you'd like to tell Mom and Dad why you stopped taking your medication.
desc7.22,desc,,An awkward silence.
utter7.23,utter,ROSE,(surprised) You've stopped taking your medication?
utter7.24,utter,SAMANTHA,"When can I squeeze one out, Mom?"
utter7.25,utter,DONNIE,(glaring at Elizabeth) You're such a fuck-ass.
utter7.26,utter,ROSE,When did you stop taking your medication?
utter7.27,utter,ELIZABETH,(laughing) Did you just call me a fuck-ass?
utter7.28,utter,ROSE,That's enough.
utter7.29,utter,ELIZABETH,(to Donnie) You can suck a fuck.
utter7.30,utter,DONNIE,"Oh, please tell me, Elizabeth, how exactly does one suck a fuck?"
utter7.31,utter,ROSE,(disgusted) We will not have this kind of language at the dinner table.
desc7.32,desc,,They are all silent for a moment.
utter7.33,utter,SAMANTHA,What's a fuck-ass?
desc7.34,desc,,"Despite his brave efforts to hold back laughter, Eddie Darko lets out a slight guffaw."
scene8,slugline,,"INT. ELIZABETH'S ROOM - EVENING (SATURDAY NIGHT, 9 P.M.)"
desc8.35,desc,,"Elizabeth talks on the phone, getting ready for her Saturday night. Rose knocks and then enters."
utter8.36,utter,ELIZABETH,(into the phone) No. I took a year off to be with you. (beat) Of course I care. Don't get angry. (covering the phone) What?
utter8.37,utter,ROSE,How did you know --
utter8.38,utter,ELIZABETH,(cutting her off) I didn't realise it was such a big deal.
utter8.39,utter,ROSE,It is a big deal.
utter8.40,utter,ELIZABETH,I caught him flushing pills down the toilet. He knows you check the container.
scene9,slugline,,INT. DONNIE'S ROOM - NEXT
desc9.41,desc,,"Donnie lies on his bed, reading ""Collected Short Stories"" by Graham Greene. His room is an organised wreck. Rose enters and begins to pick things up of the floor."
utter9.42,utter,DONNIE,Get out of my room.
desc9.43,desc,,"Rose bitterly turns to leave, but stops at the door."
utter9.44,utter,ROSE,I wish I knew where you went at night. (beat) Did you toilet paper the Johnson's house?
utter9.45,utter,DONNIE,"(still reading) I stopped rolling houses in the sixth grade, Mom. (beat) Get out of my room."
utter9.46,utter,ROSE,You know... it would be nice to look at you some time... and see my son. I don't recognise this person today.
utter9.47,utter,DONNIE,Then why don't you start taking the goddamn pills?
desc9.48,desc,,"Donnie leans over and turns off his lamp. Rose turns and leaves her son alone in the dark, closing the door behind her."
utter9.49,utter,DONNIE,Bitch.
scene10,slugline,,INT. UPSTAIRS HALLWAY - NEXT
desc10.50,desc,,"Rose stops in her tracks, hearing this. She then walks into her bedroom and closes the door."
scene11,slugline,,INT. MASTER BEDROOM - NEXT
desc11.51,desc,,"Rose goes into bed with Eddie, who is reading a hardback copy of Stephen King's ""The Tommyknockers""."
utter11.52,utter,ROSE,Our son just called me a bitch.
utter11.53,utter,EDDIE,(beat) You're not a bitch.
scene12,slugline,,INT. UPSTAIRS BATHROOM - NEXT
desc12.54,desc,,"Donnie removes his pills from the medicine cabinet. We see insert that reads: L. THURMAN M.D. He looks at the bottle for a moment, and then takes three pills and swallows them... staring at his reflection in the mirror."
scene13,slugline,,INT. MASTER BEDROOM - NIGHT (12 A.M.)
desc13.55,desc,,"Eddie sits up in bed, unable to sleep."
scene14,slugline,,INT. FAMILY ROOM - NEXT
desc14.56,desc,,The TV pops on. Eddie drops into the La-Z Boy. They are replaying a Bush/Dukakis debate. Eddie laughs.
scene15,slugline,,INT. FOYER - NEXT
desc15.57,desc,,We pull back and pan over to a grandfather clock... as the hand reaches midnight. TITLE CARD:
scene16,slugline,,"INT. DONNIE'S ROOM - NIGHT (EARLY SUNDAY MORNING, 1 A.M.)"
utter16.58,utter,VOICE,(whisper) Wake... up... Donnie.
desc16.59,desc,,"Donnie jerks upright in his bed, awakened from a bad dream. He looks over at his alarm clock: 12:50 a.m. His expression is distant... confused."
scene17,slugline,,INT. FOYER - NEXT
desc17.60,desc,,Donnie walks downstairs.
scene18,slugline,,INT. FAMILY ROOM - NEXT
desc18.61,desc,,"Donnie stares at Eddie, asleep in the La-Z Boy."
scene19,slugline,,INT. KITCHEN - NEXT
desc19.62,desc,,"Donnie walks into the kitchen, removes the magic marker from the refrigerator message board."
scene20,slugline,,INT. FOYER - NEXT
desc20.63,desc,,Donnie walks to the front and exits the house.
scene21,slugline,,"EXT. DARKO HOUSE, FRONT YARD - NEXT"
desc21.64,desc,,Donnie walks down the front walk to the street.
scene22,slugline,,EXT. NEIGHBOURHOOD STREET - NEXT
desc22.65,desc,,Donnie walks down the street.
scene23,slugline,,EXT. SEVENTH HOLE - NIGHT (1:30 A.M.)
desc23.66,desc,,Donnie arrives next to the pin and stares off into the distance.
utter23.67,utter,VOICE,"Helluva night for a walk... huh, Donnie?"
desc23.68,desc,,Donnie stares off into the distance.
utter23.69,utter,VOICE,"Tonight is very special, Donnie."
utter23.70,utter,DONNIE,What?
utter23.71,utter,VOICE,"I've been watching you. (beat) Do you believe in God, Donnie?"
desc23.72,desc,,"Donnie doesn't answer. He holds his stomach, taking deep breaths."
utter23.73,utter,VOICE,"God loves his children, Donnie. God loves you."
desc23.74,desc,,There... standing on the seventh hole is a six-foot-tall figure dressed in a grotesque bunny suit. Donnie stares at the Bunny nervously as a wave of nausea overcomes him.
utter23.75,utter,BUNNY,My name is Frank. (beat) I want you to follow me.
utter23.76,utter,DONNIE,Why?
utter23.77,utter,FRANK,"I'm here to save you. (beat) The world is coming to an end, Donnie."
desc23.78,desc,,Donnie doesn't answer.
utter23.79,utter,FRANK,"Look up in the sky, Donnie."
desc23.80,desc,,He looks up into the black night.
utter23.81,utter,FRANK,28 days... 6 hours... 42 minutes... 12 seconds. That is when the world will end.
desc23.82,desc,,Donnie looks back at Frank. His expression is a vacant expanse of confusion.
scene24,slugline,,INT. FOYER - NIGHT
desc24.83,desc,,"Elizabeth comes through the front door, leans back against it, closes her eyes."
scene25,slugline,,INT. FAMILY ROOM - NIGHT
desc25.84,desc,,Eddie Darko sleeps reclined in the La-Z Boy. The final notes of the Channel 12 National Anthem fade away to static. From above... a thunderous crash. Plaster rains from the ceiling ...Books fly off the bookshelf as the entire wall- mount collapses to the floor. Eddie jerks awake.
scene26,slugline,,INT. FOYER - NEXT
desc26.85,desc,,Elizabeth falls back in horror as plaster rains down from around the chandelier... debris falling in the dining-room doorway.
scene27,slugline,,"EXT. SEVENTH HOLE - MORNING (SUNDAY MORNING, 10 A.M.)"
desc27.86,desc,,"Donnie is curled up, asleep on the green. A golf ball lands on the green and rolls within inches of his head. A golf cart filled with four older men arrives. Dr. Fisher (forty-five) gets out first."
utter27.87,utter,DR. FISHER,Donnie Darko? (beat) Son? What's going on here?
desc27.88,desc,,"Jim Cunningham (forty), the man riding shotgun, gets out of the cart and walks over."
utter27.89,utter,JIM CUNNINGHAM,"Who is it, Don?"
utter27.90,utter,DR. FISHER,Eddie Darko's kid.
desc27.91,desc,,Donnie gets up and brushes himself off. On his arm he sees something written in black magic marker.
scene28,slugline,,Numbers... 28:06:42:12.
desc28.92,desc,,"Donnie stares at the numbers on his arm, confused."
utter28.93,utter,DR. FISHER,"(to Jim, kissing his ass) Sorry about this, Jim, just a... a kid from the neighbourhood. (back to Donnie) So let's stay off the greens at night, OK?"
desc28.94,desc,,Jim Cunningham stares at Donnie with a friendly grin.
utter28.95,utter,DONNIE,"Sorry, Dr. Fisher. It won't happen again."
scene29,slugline,,EXT. NEIGHBOURHOOD STREET / DARKO HOUSE - MORNING (11 A.M.)
desc29.96,desc,,Donnie walks down the street towards his house. A fire engine. Two police cars. A news van... All parked in front of his house. There are dozens of neighbours in the street surrounding a barricade. Donnie moves through the crowd where a Police Officer is standing.
utter29.97,utter,DONNIE,"Hey, I live here!"
utter29.98,utter,POLICE OFFICER,Are you... Donnie Darko?
utter29.99,utter,DONNIE,Yeah!
desc29.100,desc,,The Officer lets him through. Near the cul-de-sac there is a large caterpillar crane lifting something from inside the house. There are firemen roaming around. Two Police Officers are speaking with Eddie and Rose. Donnie looks over at the house. A crane lifts a gigantic jet engine over from the house towards a large flatbed truck. Firemen kick pieces of wood and shingle from the roof. He turns and sees his entire family standing there. Eddie is holding Samantha.
utter29.101,utter,SAMANTHA,It fell on your room.
scene30,slugline,,EXT. CUL-DE-SAC - LATER ON
desc30.102,desc,,Two men in suits approach from a black sedan. A police officer directs them to Rose. One of the men removes a badge from his pocket and holds it up for Rose to see.
utter30.103,utter,MAN,"Mrs. Darko, my name is Bob Garland and this is David Coleman. We're with the FAA. If you don't mind, we'd like to speak with you and your husband privately."
desc30.104,desc,,Elizabeth looks over at Donnie with a grin.
utter30.105,utter,ELIZABETH,(whispering) They don't know where it came from.
desc30.106,desc,,Donnie looks over in awe as the mammoth engine is now strapped to the flatbed truck. A man in a silver firesuit sprays the engine down with water.
scene31,slugline,,EXT. CUL-DE-SAC - MOMENTS LATER
desc31.107,desc,,Eddie is signing some documents in front of Garland at a table that has been set up. Another FAA guy is there.
utter31.108,utter,FAA MAN,(pointing to the document) And then here as well.
desc31.109,desc,,"Eddie signs off, and Garland takes the documents."
utter31.110,utter,GARLAND,"We've arranged for you to stay at a hotel, get some sleep. We'll take care of things here."
desc31.111,desc,,Eddie picks Samantha up into his arms. He stands with Rose and Elizabeth... turning towards Donnie... who seems lost in a trance.
utter31.112,utter,EDDIE,"Come on, Donnie... we're going to a hotel."
scene32,slugline,,"INT. HOLIDAY INN, ROOM 614 - SUNDOWN (SUNDAY NIGHT, 5:30 P.M.)"
desc32.113,desc,,"Donnie lies in bed, watching television. Elizabeth is spread out on the other bed. Samantha sits on the edge of Elizabeth's bed, holding a stuffed unicorn named Ariel."
utter32.114,utter,SAMANTHA,"If it fell from a plane, then what happened to the plane?"
utter32.115,utter,ELIZABETH,"They don't know, Samantha."
utter32.116,utter,SAMANTHA,Is there any way that we can make money from this? Couldn't we get on television if we sue the airline?
scene33,slugline,,"INT. HOLIDAY INN, ROOM 615 - NEXT"
desc33.117,desc,,Rose and Eddie lie awake in the dark.
utter33.118,utter,ROSE,So let me get this straight. No airline will claim ownership of the engine. So we have to wait for the FAA to decide who fixes my roof. (beat) Fuck that. We're taking the money out of savings.
utter33.119,utter,EDDIE,(quoting Rod Serling) You are entering a new dimension of sight and sound...
desc33.120,desc,,Rose begins to laugh.
scene34,slugline,,"INT. HOLIDAY INN, ROOM 614 - NEXT"
utter34.121,utter,SAMANTHA,Why do I have to sleep with Donnie? He stinks.
utter34.122,utter,DONNIE,"When you fall asleep tonight, I'm gonna fart in your face."
utter34.123,utter,SAMANTHA,(walking to the door) I'm telling Mom.
utter34.124,utter,ELIZABETH,"Samantha, don't go over there."
scene35,slugline,,"INT. HOLIDAY INN, ROOM 615 - LATER THAT NIGHT"
utter35.125,utter,EDDIE,Frankie Feedler.
utter35.126,utter,ROSE,What?
utter35.127,utter,EDDIE,Frankie Feedler. You remember him from high school?
utter35.128,utter,ROSE,(long beat) He was a year ahead of us?
utter35.129,utter,EDDIE,"He died, remember? On the way to the prom. (beat) He was doomed."
desc35.130,desc,,Rose lies there silently.
utter35.131,utter,EDDIE,"Jesus Christ. They could have said the same thing about Donnie. Our Donnie. (beat) But he dodged it. He dodged his bullet, Rose."
desc35.132,desc,,Rose rolls over to embrace him.
utter35.133,utter,EDDIE,That's my boy.
desc35.134,desc,,"Moments later, the door to the adjoining room opens. It is Samantha."
utter35.135,utter,SAMANTHA,"Mom, Donnie said he's gonna fart in my face."
scene36,slugline,,"EXT. BUS STOP - MORNING (MONDAY MORNING, 7 A.M.)"
desc36.136,desc,,Rose drops Donnie and Samantha off at the corner.
utter36.137,utter,ROSE,"Ms. Farmer will pick you up from recital. Bye, now."
desc36.138,desc,,She pulls of in the Taurus. Already waiting at the bus stop is Joanie James (eleven). Also Cherita Chen (fifteen).
utter36.139,utter,SAMANTHA,"Hi, Cherita."
utter36.140,utter,CHERITA,Chut up.
desc36.141,desc,,"Also there are Donnie's two best friends, Sean Smith (sixteen) and Ronald Fisher (fifteen)"
utter36.142,utter,RONALD,"(raising his hands in victory) DARKO CHEATS DEATH! Man... you're famous! I called you, like, a jillion times last night!"
utter36.143,utter,DONNIE,We went to a hotel.
utter36.144,utter,RONALD,My dad said he found you on the golf course. Are you sleepwalking again?
utter36.145,utter,DONNIE,I don't wanna talk about it.
utter36.146,utter,SEAN,"Now that you're famous, you gotta have a smoke."
desc36.147,desc,,"Sean hands Donnie a Marlboro Red and he takes it, looking over at Samantha and Joanie."
utter36.148,utter,DONNIE,"What happens if you tell Mom and Dad about this, Samantha?"
utter36.149,utter,SAMANTHA,You'll put Ariel in the garbage disposal.
utter36.150,utter,JOANIE,So... grody.
desc36.151,desc,,"Sean, Ronald and Donnie light up. Ronald is the most amateur- looking."
utter36.152,utter,SEAN,"Hey, Cherita... want a cigarette?"
utter36.153,utter,CHERITA,Chut up.
utter36.154,utter,RONALD,(mimicking) Chut up!
utter36.155,utter,SEAN,"Go back to China, bitch!"
utter36.156,utter,DONNIE,"Leave her alone, man."
desc36.157,desc,,Cherita looks over at Donnie... her quiet devastation poorly hidden.
scene37,slugline,,EXT. / INT. MIDDLESEX RIDGE SCHOOL - MORNING (8 A.M.)
desc37.158,desc,,The following montage is three long Steadicam shots in the
scene38,slugline,,main school hallway and courtyard.
desc38.159,desc,,"We follow Donnie and his friends as they pour out of the back of the emergency exit of the school bus to 'Head Over Heels' by Tears for Fears. We pick up teachers Karen Pomeroy (twenty-seven) and Dr. Kenneth Monnitoff (thirty) and Kitty Farmer (forty-two), with Jim Cunningham, as they make their way through the"
scene39,slugline,,hallways.
desc39.160,desc,,Swarms of girls surround Donnie as he makes his way to his locker. There is a huge smile on his face. We reveal Gretchen Ross (fifteen)... we see Principal Cole
scene40,slugline,,(thirty-eight) and then Samantha's dance team (Sparkle Motion)
desc40.161,desc,,practising their routine in the courtyard. We follow Ms. Pomeroy into English class... then time-lapse dissolve through the doorway...
scene41,slugline,,INT. ENGLISH CLASS - DAY (8:30 A.M.)
desc41.162,desc,,"Ms. Pomeroy has been reading from ""The Destructors"" by Graham Greene."
utter41.163,utter,MS. POMEROY,"""There would be headlines in the papers. Even the grown-up gangs who ran the betting at the all-in wrestling and the barrow-boys would hear with respect how Old Misery's house had been destroyed. It was as though this plan had been with him all his life, pondered through the seasons, now in his fifteenth year crystallised with the pain of puberty."""
desc41.164,desc,,Donnie sits in the front.
utter41.165,utter,MS. POMEROY,What is Graham Greene trying to communicate in this passage? Why do
desc41.166,desc,,the children break into Old Misery's
desc41.167,desc,,Joanie James raises her hand.
utter41.168,utter,MS. POMEROY,Joanie.
utter41.169,utter,JOANIE,They wanted to rob him.
utter41.170,utter,MS. POMEROY,"Joanie, if you had actually read the short story... which, at a whopping thirteen pages must have kept you up all night, you would know that the children find a great deal of money hidden in a mattress. But they burn it."
desc41.171,desc,,"The class gives an ""Awwww."" Joanie blushes."
utter41.172,utter,MS. POMEROY,"Donnie Darko, perhaps, given your recent brush with mass destruction, you can give us your opinion?"
utter41.173,utter,DONNIE,Well... they say it right when they are ripping the place to shreds. When they flood the house. That like... destruction is a form of creation. So the fact that they burn the money is... ironic. They just want to see what happens when they tear the world apart. (beat) They want to change things.
desc41.174,desc,,Gretchen Ross stands at the doorway to the classroom.
utter41.175,utter,MS. POMEROY,May we help you?
utter41.176,utter,GRETCHEN,"I just registered, and I think they put me in the wrong English class."
desc41.177,desc,,Ms. Pomeroy studies her.
utter41.178,utter,MS. POMEROY,You look like you belong here.
utter41.179,utter,GRETCHEN,"Umm, where do I sit?"
desc41.180,desc,,Ms. Pomeroy thinks for a moment. There are several empty chairs.
utter41.181,utter,MS. POMEROY,"Sit next to the boy you think is the cutest. Girls, get up."
desc41.182,desc,,The whole class begins to freak out. The girls all get out of their seats... eating this up. Ronald fixes his hair.
utter41.183,utter,MS. POMEROY,Quiet! Let her choose.
desc41.184,desc,,"Without hesitation, Gretchen scans the class for every guy. As she gracefully takes her seat next to Donnie, they make eye contact. Donnie grins ear to ear. The class freaks out laughing."
scene42,slugline,,"INT. TAURUS - SUNSET (MONDAY NIGHT, 6 P.M.)"
desc42.185,desc,,"Eddie drives Donnie down Old Gun Road, a windy back-road that goes towards the country."
utter42.186,utter,EDDIE,So how was school today?
utter42.187,utter,DONNIE,"It was great. We had peanut-butter sandwiches and apples and honey at snacktime. And then during show-and- tell, my stuffed walrus was a big hit."
utter42.188,utter,EDDIE,Good Lord. (beat) So the construction guys say it'll take about a week to fix the roof. Damn airline better not fuck us on the shingle match.
utter42.189,utter,DONNIE,Do they know yet?
utter42.190,utter,EDDIE,Know what?
utter42.191,utter,DONNIE,Where it came from?
utter42.192,utter,EDDIE,No... apparently they can't tell us what happened yet. Something about a matching serial number that got burned. (beat) But I had to sign a form saying I wouldn't talk to anyone about it.
utter42.193,utter,DONNIE,So we're not supposed to tell anybody what nobody knows?
utter42.194,utter,EDDIE,You tell Dr. Thurman whatever you want.
desc42.195,desc,,"Suddenly, Eddie slams on the brakes and the station wagon comes to a sudden stop."
utter42.196,utter,EDDIE,"Oh, shit!"
utter42.197,utter,DONNIE,Grandma Death.
desc42.198,desc,,"Standing in the road directly in front of the car is Roberta Sparrow (101 years old, a.k.a. Grandma Death). Grandma Death lives in a modest brick house that sits back in a huge grassy field that overlooks the entire town. Her mailbox sits on the edge of Old Gun Road."
scene43,slugline,,EXT. OLD GUN ROAD - NEXT
desc43.199,desc,,"Donnie gets out of the car and takes Grandma Death's hand, walking her back towards her mailbox. He opens it for her."
utter43.200,utter,DONNIE,No mail today. (smiles) Maybe tomorrow.
desc43.201,desc,,Grandma Death smiles back at him... and begins to walk slowly back to her house. She then turns and takes Donnie's hands into her frail grip.
utter43.202,utter,GRANDMA DEATH,(speaking slowly) Every living creature... on this earth... (beat) ...dies alone.
desc43.203,desc,,"Donnie stands there silently for a moment, and then Grandma Death turns back towards her house."
scene44,slugline,,EXT. DR. THURMAN'S RANCH - SUNSET
desc44.204,desc,,We see a large colonial rancher in the distance.
scene45,slugline,,INT. THERAPIST'S OFFICE - EVENING
desc45.205,desc,,Dr. Lilian Thurman (fifty-eight) is a beautiful older woman.
utter45.206,utter,DR. THURMAN,Your mother said that you've been skipping cycles of your medication.
utter45.207,utter,DONNIE,"I've been taking it. I just like to make her feel guilty for all of this. You know, abuse her. Psychologically."
utter45.208,utter,DR. THURMAN,"All of this... certainly isn't your mother's fault, Donald."
desc45.209,desc,,He is quiet for a moment.
utter45.210,utter,DONNIE,"So, I met a new friend."
utter45.211,utter,DR. THURMAN,Would you like to talk about this friend?
utter45.212,utter,DONNIE,His name is Frank.
utter45.213,utter,DR. THURMAN,Frank.
utter45.214,utter,DONNIE,I think he saved my life.
utter45.215,utter,DR. THURMAN,How so?
utter45.216,utter,DONNIE,Don't you watch the news?
utter45.217,utter,DR. THURMAN,I don't own a television.
utter45.218,utter,DONNIE,A jet engine fell on my house... landed on my bed. While I was talking to Frank on the golf course.
desc45.219,desc,,"Dr. Thurman looks at him for a long beat, analysing whether or not he is telling her the truth."
utter45.220,utter,DONNIE,I'm not kidding.
desc45.221,desc,,"Concerned, Dr. Thurman leans in closer."
utter45.222,utter,DR. THURMAN,Frank... instructed you... to get out of bed... just before this happened.
utter45.223,utter,DONNIE,He said to follow him.
utter45.224,utter,DR. THURMAN,Follow him where?
utter45.225,utter,DONNIE,Into the future. (beat) Then he said that the world was coming to an end.
desc45.226,desc,,"He rubs his arm, where the numbers are still lightly drawn."
utter45.227,utter,DR. THURMAN,Do you believe that the world is coming to an end?
utter45.228,utter,DONNIE,(long beat) No. (beat) That's stupid.
scene46,slugline,,INT. MIDDLESEX RIDGE SCHOOL - HALLWAY
desc46.229,desc,,In the empty school hallway... a gigantic tidal wave forms in the distance and comes crashing towards us between the lockers.
scene47,slugline,,"INT. FAMILY ROOM - NIGHT (EARLY TUESDAY MORNING, 2 A.M.)"
desc47.230,desc,,"Donnie lies on the couch... fast asleep. His eyes slowly open. There, standing in the corner of the room in the shadows is Frank."
utter47.231,utter,FRANK,"Wake up, Donnie."
scene48,slugline,,INT. MIDDLESEX RIDGE SCHOOL - NIGHT
desc48.232,desc,,"In the dark school hallway, Donnie rounds the corner with a flashlight, a can of spray paint, and an axe. Frank stands in the same hallway where the tidal wave crashed."
scene49,slugline,,INT. SCHOOL BASEMENT - NEXT
