segment-id,segment-type,segment-speaker,segment-text
utter71.505,utter,DONNIE,I just don't get this. Everything can't be lumped into two categories. That's too simple.
utter71.506,utter,MS. FARMER,The Lifeline is divided that way.
utter71.507,utter,DONNIE,"Well, life isn't that simple. So what if Ling Ling kept the cash and returned the wallet? That has nothing to do with either fear or love."
utter71.508,utter,MS. FARMER,(impatient) Fear and love are the deepest of human emotions.
utter71.509,utter,DONNIE,"Well, yeah... OK, but you're not listening to me. There are other things that need to be taken into account here. Like the whole spectrum of human emotion. You're just lumping everything into these two categories... and, like, denying everything else."
desc71.510,desc,,Ms. Farmer stares at Donnie vehemently. She can't believe what she's hearing.
utter71.511,utter,DONNIE,People aren't that simple.
utter71.512,utter,MS. FARMER,"(not knowing how to argue with him) If you don't complete the assignment, you'll get a zero for the day."
desc71.513,desc,,Donnie thinks for a moment... and then raises his hand.
scene72,slugline,,INT. PRINCIPAL COLE'S OFFICE - AFTERNOON (2 P.M.)
desc72.514,desc,,Donnie and his parents sit in front of Principal Cole.
utter72.515,utter,PRINCIPAL COLE,Donald... let me preface this by saying that your Iowa scores are... (looking down at the file) ...intimidating. (rubbing his temples) So... let's go over this again. What exactly did you say to Ms. Farmer?
desc72.516,desc,,Donnie does not answer. We reveal Ms. Farmer standing in the corner.
utter72.517,utter,MS. FARMER,(furious) He asked me to... forcibly insert the Lifeline exercise card into my anus.
desc72.518,desc,,"Silence. Rose looks down, furious. Eddie lets out a snort laugh which he tries to conceal with a cough. It doesn't work."
scene73,slugline,,INT. TEACHERS' LOUNGE / OFFICE - MOMENTS LATER (2:15 P.M.)
desc73.519,desc,,"Eddie and Donnie exit Cole's office, moving on while Rose approaches Kitty, who looks visibly shaken."
utter73.520,utter,ROSE,"Kitty, I don't know what to say. They've suspended him for two days. (beat) Ever since this jet fiasco, I honestly don't know what has gotten into him."
utter73.521,utter,MS. FARMER,"Rose, I'll tell you this because our daughters have been on dance team together for two years and I respect you as a WOMAN. But after witnessing your son's behaviour today, I have... significant doubts... (stopping herself) Our paths through life must be righteous. I urge you to go home and look in the mirror and pray that your son does not succumb to the path of fear."
desc73.522,desc,,Kitty Farmer turns and walks away.
scene74,slugline,,"EXT. DARKO BACKYARD / PATIO - SUNSET (MAGIC HOUR, 5:30 P.M.)"
desc74.523,desc,,Samantha jumps up and down on the trampoline.
scene75,slugline,,INT. DONNIE'S ROOM - NIGHT (5:30 P.M.)
desc75.524,desc,,"Donnie walks into his room again for the first time since the accident, looking around at the new furniture, paint and carpet. Everything is perfect. Elizabeth appears in the doorway behind him with a cordless phone in her hand."
utter75.525,utter,ELIZABETH,"(into the phone) Oh my God, remember that gym teacher, Ms. Farmer? (beat) Yeah. Well, I guess my brother called her a fat bitch today in class and got suspended. And my parents just bought him all of this new shit. (beat) Yeah, I know. I wish a jet engine would have fallen on my room."
scene76,slugline,,INT. MARINO'S ITALIAN BISTRO - NIGHT (6 P.M.)
desc76.526,desc,,Eddie and Rose sit across from one another at the bistro patio... having a quiet dinner to themselves.
utter76.527,utter,ROSE,He's too old to be behaving this way.
desc76.528,desc,,Eddie considers this.
utter76.529,utter,EDDIE,"Oh, I say we buy him a moped."
scene77,slugline,,INT. DONNIE'S ROM - NIGHT (7 P.M.)
desc77.530,desc,,Donnie lies in bed... looking up at the ceiling. He then rolls over and looks at the calendar on his wall. The days of the month of October are marked off with an X in each square. Tacked onto the calendar is a drawing of Frank.
utter77.531,utter,DONNIE,"28 days, 6 hours, 42 minutes, 12 seconds."
scene78,slugline,,"INT. PHYSICS CLASS - DAY (FRIDAY, 2:30 P.M.)"
desc78.532,desc,,"As everyone is leaving class, Donnie stays behind."
utter78.533,utter,DONNIE,Dr. Monnitoff?
utter78.534,utter,DR. MONNITOFF,Donnie.
utter78.535,utter,DONNIE,I know that this is gonna sound kinda weird... but do you know anything about time travel?
desc78.536,desc,,"Dr. Monnitoff pauses, turns and looks at Donnie. He seems to know something."
scene79,slugline,,INT. PHYSICS CLASS - LATER ON
desc79.537,desc,,"Dr. Monnitoff has drawn a diagram on the blackboard. In his hand he holds a copy of Stephen Hawking's ""A Brief History of Time""."
utter79.538,utter,DR. MONNITOFF,So... according to Hawking... wormholes might be able to provide a short cut for jumping between two distant regions of space-time.
utter79.539,utter,DONNIE,"So... in order to travel back in time, you'd have to have a big spaceship or something that can travel faster than the speed of light --"
utter79.540,utter,DR. MONNITOFF,Theoretically.
utter79.541,utter,DONNIE,-- and be able to find one of these wormholes.
utter79.542,utter,DR. MONNITOFF,"A wormhole with an Einstein-Rosen bridge, which is, theoretically... a wormhole in space controlled by man."
utter79.543,utter,DONNIE,So... that's it?
utter79.544,utter,DR. MONNITOFF,The basic principles of time travel are there. (beat) So you have the vessel and the portal. And the vessel can be anything. Most likely a spacecraft.
scene80,slugline,,EXT. SCHOOL COURTYARD - NEXT
desc80.545,desc,,Cherita Chen listens to this conversation intently.
scene81,slugline,,INT. PHYSICS CLASS - NEXT
utter81.546,utter,DONNIE,Like a DeLorean.
utter81.547,utter,DR. MONNITOFF,(smiling) A metal craft of any kind.
desc81.548,desc,,Donnie stares at him intently. Dr. Monnitoff walks over to his desk and picks up a book.
utter81.549,utter,DR. MONNITOFF,"Don't tell anybody that I gave you this. (beat) The woman who wrote it... used to teach here a long time ago. She was a nun for many years and then overnight she just became this entirely different person. She up and left the Church, wrote this book, and started teaching science."
desc81.550,desc,,Donnie takes the battered book... we see the cover.
scene82,slugline,,INT. SCHOOL MAIN HALLWAY - MOMENTS LATER
desc82.551,desc,,"Donnie stands before an array of old photographs. We zoom in to a black-and-white photograph of a young Robert Sparrow standing in a class photograph dated 1944. Donnie looks down at the book, and then at the photograph."
utter82.552,utter,DONNIE,Roberta Sparrow... Grandma Death.
scene83,slugline,,"INT. KITCHEN - NIGHT (FRIDAY, 6 P.M.)"
desc83.553,desc,,Donnie sits down for dinner with his family.
utter83.554,utter,DONNIE,"It's called ""The Philosophy of Time Travel""."
utter83.555,utter,ELIZABETH,What does time travel have to do with philosophy?
utter83.556,utter,DONNIE,Guess who wrote it?
desc83.557,desc,,No one seems to know.
utter83.558,utter,DONNIE,Grandma Death.
utter83.559,utter,ROSE,That is a terrible nickname.
utter83.560,utter,EDDIE,Grandma Death.
utter83.561,utter,DONNIE,"(to Eddie) You know, Roberta Sparrow. We almost hit her with the car the other day."
utter83.562,utter,ROSE,I've heard she's loaded.
desc83.563,desc,,The family is taken aback.
utter83.564,utter,EDDIE,"You're right. Roberta Sparrow was famous for her gem collections. Kids used to try and steal stuff from her all the time. Over the years... as she got older, she became more and more of a recluse... now she just likes to stay up there all by herself."
utter83.565,utter,DONNIE,I guess she just lost faith in the world.
scene84,slugline,,"EXT. DARKO BACKYARD - SUNSET (SATURDAY, 5:30 P.M.)"
desc84.566,desc,,"Slow motion. Donnie and Gretchen jump up and down on the trampoline, lost among falling autumn leaves."
scene85,slugline,,"INT. THERAPIST'S OFFICE - DAY (SUNDAY, 12 P.M.)"
desc85.567,desc,,Donnie is back on Dr. Thurman's couch.
utter85.568,utter,DR. THURMAN,How many times have you seen Frank?
utter85.569,utter,DONNIE,Four times... so far.
utter85.570,utter,DR. THURMAN,Can anyone else see him?
utter85.571,utter,DONNIE,I don't think so. It's like a TV station. And they're tuned into mine and no one else's.
utter85.572,utter,DR. THURMAN,Who is they? Is Frank part of some larger group?
utter85.573,utter,DONNIE,I don't know. Gretchen has a theory. That Frank is a sign. I told her I thought it was ridiculous.
utter85.574,utter,DR. THURMAN,A sign from whom?
utter85.575,utter,DONNIE,"(changing the subject) I think that Frank wants me to go to this woman. (holding up the book) She wrote a book about time travel. Frank asked me if I believed in time travel. That can't just be a random coincidence. (beat) My dad almost hit her with the car the other day, and she said the creepiest thing. She said that every living creature on this earth dies alone."
utter85.576,utter,DR. THURMAN,How does that make you feel?
utter85.577,utter,DONNIE,It reminded me of my dog Callie.
utter85.578,utter,DR. THURMAN,Is Callie still around?
utter85.579,utter,DONNIE,No. She died when I was eight. We couldn't find her for days. She went and crawled underneath our back porch...
utter85.580,utter,DR. THURMAN,Do you feel alone right now?
desc85.581,desc,,He looks at her for a moment.
utter85.582,utter,DONNIE,"I'd like to believe that I'm not... but I've just never seen any proof. So I just choose not to bother with it. It's, like, I could spend my whole life thinking about it... debating it in my head. Weighing the pros and cons. And in the end, I still wouldn't have any proof. So... I don't even debate it any more. Because it's absurd. (beat) I don't want to be alone. (beat) So, does that make me, like, an atheist?"
utter85.583,utter,DR. THURMAN,No. That makes you keep searching.
desc85.584,desc,,Donnie takes this in for a moment.
scene86,slugline,,"INT. FAMILY ROOM - EVENING (SUNDAY, 7:15 P.M.)"
desc86.585,desc,,Eddie and Dr. Fisher watch the Redskins game. Ronald and Donnie watch the game in the family room.
utter86.586,utter,EDDIE,Ahh... we need Theisman.
utter86.587,utter,DR. FISHER,We need a miracle.
scene87,slugline,,INT. KITCHEN - NEXT
desc87.588,desc,,Rose and Anne Fisher (forty-five) share a bottle of wine at the kitchen table.
utter87.589,utter,ANNE,"And so, his tapes made me realise that for forty-five years I have been a a prisoner of fear. Rose, you have to meet Jim Cunningham. (taking a sip of wine) I can't believe he's not married."
desc87.590,desc,,"Samantha bounces through the kitchen and into the family room, wearing a Dorothy outfit from ""The Wizard of Oz""."
scene88,slugline,,INT. FAMILY ROOM - NEXT
desc88.591,desc,,"Donnie sits back in the La-Z Boy, dozing off... John Madden's CBS chalkboard unfolds on the TV screen. Madden traces his electronic lines across the screen, tracing the movement of the players... as their images are frozen in time. Donnie's eyes close... and then re-open. Donnie turns his head and sees that the room is momentarily bathed in artificial white light, as if God hit the slow- motion button during a flash of lightning. Donnie turns his head and sees that protruding from his father's stomach... is a thick spear made of silvery plastic gel. As Eddie gets up from the couch to walk over to the refrigerator... his spear precedes him... morphing into an extruded arrow that reaches the refrigerator several seconds before him. The spear traces the exact geography of his movement through time... using his centre of gravity as its axis point. Donnie turns and sees Samantha skipping from the kitchen... as her spear bounces several feet in front of her like a caterpillar. Her spear... smaller than her father's... is proportional to her mass."
utter88.592,utter,SAMANTHA,(her voice echoing through the silence) Follow the yellow brick road...
desc88.593,desc,,Donnie looks down at his stomach and sees his own spear protruding outward. It then begins to extrude forward towards
scene89,slugline,,the foyer.
desc89.594,desc,,He does not follow it. It then retreats back in and beckons him to follow. Like a child transfixed by a firefly... Donnie follows the path of his spear into the foyer.
scene90,slugline,,INT. FOYER / UPSTAIRS HALLWAY - NXT
desc90.595,desc,,Donnie and his spear round the corner and arrive in his parents' bedroom.
scene91,slugline,,INT. MASTER BEDROOM - NIGHT
desc91.596,desc,,"His spear leads him to the closet. He opens the closet door... and the spear leads him down to a box hidden beneath his father's shoe rack. Donnie removes the box from the closet and unlatches it. Inside is a gun. Donnie removes the pistol from the box... staring at it with the same childlike expression. Suddenly... Donnie's universe snaps back to normal. The white light strobes... the spear has vanished. Donnie still holds the gun. His expression changes to nervous shock. His eyes linger over the gun for a moment, he then quickly puts it back in the box... and carefully places the box back under the shoe rack. TITLE CARD:"
scene92,slugline,,INT. ENGLISH CLASS - MORNING (8:30 A.M.)
desc92.597,desc,,We see the students placing the Graham Greene books on Ms. Pomeroy's desk.
utter92.598,utter,MS. POMEROY,"It gives me no pleasure to deny you the right to read one of the great writers of the twentieth century. But... alas, I have not yet been elected Queen of the Universe. And until that day, I will be forced to obey the rules... and so will you. So... if anyone is found carrying this book in school, they will be suspended."
desc92.599,desc,,Donnie slips his book into his backpack.
utter92.600,utter,MS. POMEROY,"But let's not worry. Someone has already pre-ordered several dozen copies at Sarasota Mall Waldenbooks. now, in Mr. Greene's absence, we will be reading another classic."
desc92.601,desc,,"Richard Adams' ""Watership Down"". She begins to hand out copies of the paperback novel. Beth Farmer smiles when she sees the cover."
utter92.602,utter,BETH,Awww. Bunnies.
utter92.603,utter,MS. POMEROY,"(whispering in his ear) Donnie, maybe you and Frank can read this one together."
scene93,slugline,,INT. SCHOOL BATHROOM - MIDDAY (11:30 A.M.)
desc93.604,desc,,"Donnie walks along the edge of the school. Suddenly, a figure approaches, grabbing him from behind, placing a switchblade next to his throat It is Seth Devlin."
utter93.605,utter,SETH,Did you tell them that I flooded the school?
utter93.606,utter,DONNIE,I didn't say shit.
utter93.607,utter,SETH,That's not what I heard. Now they think I did it.
utter93.608,utter,DONNIE,"Well, if you're innocent, then you have nothing to worry about."
utter93.609,utter,SETH,You know what? I think that you did it.
desc93.610,desc,,"Seth takes the knife and pokes the tip softly into the flesh of Donnie's neck, drawing a small amount of blood. He pushes Donnie away. Donnie touches his neck in shock."
scene94,slugline,,INT. PHYSICS CLASS - DAY (2:30 P.M.)
desc94.611,desc,,Donnie walks into the classroom and takes his seat next to Gretchen. He is sweating profusely. Dr. Monnitoff is handing out papers. The bell rings People shuffle out.
utter94.612,utter,DR. MONNITOFF,Don't forget tomorrow we'll be meeting with our partners for the Young Inventors Fair.
desc94.613,desc,,Donnie rubs his finger over his neck wound.
utter94.614,utter,GRETCHEN,What happened to your neck?
utter94.615,utter,DONNIE,I don't want to talk about it. (changing the subject) So what happened to your neck?
scene95,slugline,,EXT. GOLF COURSE FOREST - THAT AFTERNOON (3 P.M.)
desc95.616,desc,,Donnie and Gretchen walk around the trail.
utter95.617,utter,GRETCHEN,Were you ever afraid of the dark?
desc95.618,desc,,They pull over to a stop.
utter95.619,utter,DONNIE,Why?
desc95.620,desc,,She thinks for a moment.
utter95.621,utter,GRETCHEN,"Babies cry because they're afraid of the dark. And because they have no memories... for all they know... every night could be the last forever. Like, perpetual darkness."
utter95.622,utter,DONNIE,Why not just buy your baby a night light?
utter95.623,utter,GRETCHEN,That's not good enough. You've got to go back in time and take all those hours of darkness and pain and replace them... with whatever you wanted.
utter95.624,utter,DONNIE,"With, like, images?"
utter95.625,utter,GRETCHEN,Like... a Hawaiian sunset... the Grand Canyon. Things that remind you how beautiful the world can be.
desc95.626,desc,,Donnie stops and takes Gretchen's hand.
utter95.627,utter,DONNIE,You know... we've been going together for a week and a half...
utter95.628,utter,GRETCHEN,And what?
utter95.629,utter,DONNIE,Well...
utter95.630,utter,GRETCHEN,You want to kiss me...
desc95.631,desc,,"Donnie goes in for an awkward kiss... but Gretchen turns and denies him. Donnie turns away, embarrassed."
utter95.632,utter,DONNIE,That's alright... I understand.
utter95.633,utter,GRETCHEN,"(embarrassed) No... Donnie, wait. I've never..."
utter95.634,utter,DONNIE,I always wanted it to be at a time when... when it reminds you how beautiful the world can be.
utter95.635,utter,GRETCHEN,Yeah. And right now there's some fat guy over there watching us.
desc95.636,desc,,A man in a red jogging suit is standing there in the forest smoking a cigarette. He turns away... disappearing into the woods.
scene96,slugline,,EXT. NEIGHBOURHOOD STREET - LATER THAT AFTERNOON (4 P.M.)
desc96.637,desc,,"Donnie rides along the sidewalk... and skids to a stop, seeing a wallet lying there. Donnie opens the wallet, looking at the ID. It reads: JIM CUNNINGHAM 42 POWDERHAM DRIVE MIDDLESEX, VA 23113"
utter96.638,utter,FRANK (V.O.),(echoing in Donnie's head) Now you know where he lives.
desc96.639,desc,,Donnie looks over and sees that he is in front of Cunningham's Tudor mansion.
scene97,slugline,,INT. KITCHEN - EVENING (7:15 P.M.)
desc97.640,desc,,"Donnie sits at the kitchen island with Elizabeth, carving a pumpkin."
utter97.641,utter,ELIZABETH,So I hear you have a girlfriend.
utter97.642,utter,DONNIE,Yeah.
utter97.643,utter,ELIZABETH,What's her name?
utter97.644,utter,DONNIE,"You're not gonna tell Mom, are you?"
utter97.645,utter,ELIZABETH,(defensive) Why would I tell Mom?
utter97.646,utter,DONNIE,Because you tell Mom everything.
utter97.647,utter,ELIZABETH,No I don't. (long beat) She worries about you.
utter97.648,utter,DONNIE,"Well, don't worry... I'm taking my medication."
utter97.649,utter,ELIZABETH,"It's not that. I mean mouthing off to your teachers. I'll admit... when Dad told me what you said to Ms. Farmer, I laughed my ass off."
utter97.650,utter,DONNIE,I was just being honest.
utter97.651,utter,ELIZABETH,"Yeah... well, that's not the way the world works. If you keep being too honest, the world will eventually find a way to destroy you."
utter97.652,utter,DONNIE,Her name is Gretchen.
utter97.653,utter,ELIZABETH,"That's a nice name. (beat) OK, let me see it."
desc97.654,desc,,Donnie turns the carved jack o' lantern around and we see that it looks remarkably like Frank.
scene98,slugline,,INT. THERAPIST'S OFFICE - NIGHT (8 P.M.)
desc98.655,desc,,Rose and Eddie sit in front of Dr. Thurman.
utter98.656,utter,ROSE,Thank you for seeing us... We... just felt that it was time to discuss...
utter98.657,utter,DR. THURMAN,What I think is going on with your son.
utter98.658,utter,ROSE,"Well, you know about his past. And when you said to look for signs of aggression... He was recently suspended from school for insulting his gym teacher."
utter98.659,utter,EDDIE,She deserved it.
utter98.660,utter,DR. THURMAN,Rose... let me just lay out what I believe is happening here. Donnie's aggressive behaviour seems to stem from his increased detachment from reality. His inability to cope with the forces in the world that he perceives to be threatening.
desc98.661,desc,,Rose smiles nervously.
utter98.662,utter,DR. THURMAN,Has your son ever told you about Frank?
utter98.663,utter,ROSE,Come again?
utter98.664,utter,DR. THURMAN,Frank... the giant bunny rabbit?
utter98.665,utter,ROSE,Frank?
utter98.666,utter,DR. THURMAN,Donnie is experiencing what is commonly called a daylight hallucination.
utter98.667,utter,ROSE,You're telling me my son has an imaginary friend?
utter98.668,utter,DR. THURMAN,He has described lengthy conversations... physical encounters with what I believe to be a manifestation of his subconscious mind.
desc98.669,desc,,Rose looks over at Eddie with an expression of panic.
utter98.670,utter,ROSE,I... What can we do?
utter98.671,utter,DR. THURMAN,I would like to put him through more hypnotherapy... and increase his medication.
desc98.672,desc,,Eddie looks at Rose... who nods in approval.
utter98.673,utter,ROSE,If that's what you think is necessary.
utter98.674,utter,DR. THURMAN,But let me remind you that this treatment is... experimental.
scene99,slugline,,INT. KITCHEN - NIGHT
desc99.675,desc,,Donnie walks into the kitchen and removes a butcher's knife from a drawer.
scene100,slugline,,INT. UPSTAIRS BATHROOM - NIGHT
desc100.676,desc,,"Donnie stands in front of the bathroom mirror... catatonic... looking at his reflection. Frank stands behind him. Suddenly, Donnie turns around with the butcher's knife and lunges at Frank with all of his weight. The knife collides with Frank's invisible force field as if it were liquid steel. Donnie lunges repeatedly at Frank with psychotic rage... but the knife bounces off. TITLE CARD:"
scene101,slugline,,INT. SCHOOL AUDITORIUM - MORNING (10 A.M.)
desc101.677,desc,,The auditorium is packed with Middlesex mongrels. Jim Cunningham takes the stage.
utter101.678,utter,JIM CUNNINGHAM,"(shouting) Good morning, mongrels!"
utter101.679,utter,AUDIENCE,(scattered voices) Good morning...
utter101.680,utter,JIM CUNNINGHAM,"That's all the gusta you can musta? I said, ""Good morning!"""
utter101.681,utter,AUDIENCE,(yelling louder) Good MORNING!
utter101.682,utter,JIM CUNNINGHAM,Now that's better... but I still sense some students out there... who are AFRAID... just to say GOOD MORNING!
utter101.683,utter,AUDIENCE,(screaming) GOOD MORNING!
utter101.684,utter,JIM CUNNINGHAM,Are you AFRAID?
utter101.685,utter,AUDIENCE,(screaming louder) GOOD MORNING!
utter101.686,utter,JIM CUNNINGHAM,"Now that's what I like to hear! (suddenly serious) Because too many young men and women today are paralysed by their fears. They give in to their feelings of self-doubt... they surrender their bodies to the temptations of drugs, alcohol and premarital sex. Empty solutions. These are toxic chemicals... and disease-spreading behaviour."
desc101.687,desc,,A large screen lowers behind him.
utter101.688,utter,JIM CUNNINGHAM,I would like to tell you a story today about a young man whose life was destroyed by the instruments of fear. A young man searching for love... in all the wrong places. (shaking his head tragically) His name was Frank.
desc101.689,desc,,"On the giant screen, an image slide appears of a young cartoon teenager whose eyes are whacked out on drugs. The title appears: HIS NAME WAS FRANK. Upon hearing the name Frank, Donnie falls into a paranoid trance. Gretchen, who looks extremely bored, leans over to Donnie."
utter101.690,utter,GRETCHEN,Let's get out of here.
desc101.691,desc,,"Donnie ignores her. His eyes are locked on Jim Cunningham, who begins his rousing re-enactment of the sad, unfortunate downfall of Frank. Within minutes, Jim Cunningham has the crowd laughing... enamoured of him with his cartoon slide show. Note: during this sequence, the camera speed ramps to 4 bps."
scene102,slugline,,INT. SCHOOL AUDITORIUM - NEXT (10:30 A.M.)
desc102.692,desc,,Donnie is in a trance.
utter102.693,utter,DONNIE,We're moving through time.
utter102.694,utter,GRETCHEN,What?
desc102.695,desc,,The huge screen rises upwards and Jim Cunningham takes questions from the crowd from portable mike stands in the back of the auditorium. Several students get up and go to the mikes.
utter102.696,utter,DORKY GIRL,Hi. Um... my stepsister... like... I sometimes worry that she eats too much.
utter102.697,utter,OVERWEIGHT GIRL,"(mortified; yelling at her sister from the crowd) Shut up, Kim!"
utter102.698,utter,DORKY GIRL,I'm just trying to help you!
utter102.699,utter,JIM CUNNINGHAM,There's no need to be embarrassed. Many times we eat because we are afraid to face the reality of our ego reflections. We shouldn't just look INTO the mirror. We should look
desc102.700,desc,,THROUGH the mirror.
desc102.701,desc,,"Kitty Farmer runs out onto the stage and hands Jim Cunningham a bottle of water and a towel. She gives him the thumbs-up sign, and runs back offstage."
utter102.702,utter,LANKY KID,Um... How can I decide what I want to be when I grow up?
utter102.703,utter,JIM CUNNINGHAM,I think you should look deep within yourself... deep within your heart... and find what it is in the world that makes you feel LOVE. Just pure LOVE. And then go to that. In your studies... in your athletics... go towards love.
utter102.704,utter,LANKY KID,Thank you.
desc102.705,desc,,Donnie gets up from his seat and goes to the mike.
utter102.706,utter,LARRY RIESMAN,What can I do to learn how to fight?
utter102.707,utter,JIM CUNNINGHAM,Violence is a product of fear. Those who love themselves enough should have no need to fight another person. Learn to truly love yourself... and the world will be yours.
utter102.708,utter,LARRY RIESMAN,Okay.
desc102.709,desc,,Donnie steps up to the mike stand.
utter102.710,utter,DONNIE,(furious) How much are they paying you to be here?
utter102.711,utter,JIM CUNNINGHAM,"Excuse me? What's your name, son?"
utter102.712,utter,DONNIE,Gerald.
utter102.713,utter,JIM CUNNINGHAM,"Well, Gerald, I think you're afraid."
utter102.714,utter,DONNIE,"Well, Jim, I think you're full of shit!"
desc102.715,desc,,There are rumblings from the faculty. Some laughter from the student body.
