segment-id,segment-type,segment-speaker,segment-text
desc56.283,desc,,"No response -- she looks away, when finally he tur ns to her -- something significant in his voice as it quiets -Look at me..."
desc56.284,desc,,"Surprised, she does -- they stare into each others eyes - his intensely studying her s, as she gazes back for a long time -- something ver y intimate in the moment -- when"
desc56.285,desc,,"K. Looks good. He of fer s her a TINY EARPIECE; she glares, snatching it"
scene57,slugline,,INT. ICEBERG LOUNGE - CLOSE ON SELINA - MOVING - NIGHT
desc57.286,desc,,"HOLD ON HER FACE as she STRIDES through the PACKED CLUB INTENSITY IN HER EYES as DANCE MUSIC BLASTS HER CONTACT LENS POV - ON BATMAN'S LAPTOP - SIMULTANEOUS PLUNGING thr ough CHAOS the IMAGE and SOUND STUTTERING -- AS BATMAN works to get a lock on her signal -56 CLOSE ON SELINA - MOVING - SIMULTANEOUS As she HEADS into a DARKER SPACE, the MUSIC NOW MUFFLED -HER CONTACT LENS POV - ON BATMAN'S LAPTOP - SIMULTANEOUS The SIGNAL STABILIZES -- we see she is PASSING SHOWGIRLS AT DRESSING MIRRORS -- SOME LOOK RIGHT AT US as we pass -BATMAN Got you. Can you hear me?"
utter57.287,utter,10/25/19 (October Shooting Draft),Yeah
utter57.288,utter,SELINA,"(low, not thrilled)"
desc57.289,desc,,"BATMAN STARES AS SHE MOVES TO PENGUIN'S BACKROOM AREA - PENGUIN LOOKS UP AT US, CONCERNED -- AS SELINA ARRIVES NOTE: THESE THREE PERSPECTIVES INTERCUT THROUGHOUT THE FOLLOWING CLUB SEQUENCE -- CLOSE ON SELINA ACTUALLY IN THE CLUB -- HER POV ON T HE LAPTOP -- AND BATMAN WATCHING:"
desc57.290,desc,,"What's up, doll? You look tense..."
utter57.291,utter,SELINA (ON SELINA),I wanna work downstairs tonight.
utter57.292,utter,PENGUIN (ON LAPTOP),"(quiets, struck) ...downstairs? Naw, naw, you don't wanna do that"
utter57.293,utter,SELINA (ON SELINA),"-- I need the money -PENGUIN (ON LAPTOP) -- baby, it's a bunch of jackals down there they'll be all over"
utter57.294,utter,you -SELINA (0.S .),I'll be fine --
utter57.295,utter,PENGUIN (ON LAPTOP),I'm telling you -- it'd drive me crazy -(taking out wallet) -- look -- whattaya need?
utter57.296,utter,SELINA (ON SELINA) PENGUIN (ON LAPTOP),"-- I don't mind -- I'd do anything for you, honey -- don't you know how I feel about you by now -- ?"
desc57.297,desc,,"He looks at her, silent, a flash of vulnerability"
utter57.298,utter,SELINA (ON SELINA),...I don't want your money.
utter57.299,utter,PENGUIN (ON LAPTOP),"(darkens, nerve hit) ...what? Not good enough for you?"
desc57.300,desc,,"She says nothing. He pulls out A KEYCARD, just holds it out, cold -- as she reaches, he pulls it back -- BATMAN WATCHES P enguin glare into HER POV, simmering; then -PENGUIN (ON LAPTOP) I know you don't see it yet, honey, nobody does... but F alcone ain't gonna be around forever. O ne day this city's gonna be mine... She just looks at him; finally, he hands her the KEY -POV ON THE MOVE AGAIN - BATMAN'S LAPTOP - MOMENTS LATER BATMAN watches the POV APPROACH the MUSTACHED BOUNCER - ominously guarding an EL EVATOR -- his face now bruised from their earlier fight -- SELINA holds up her KEYCARD -Hospitality."
desc57.301,desc,,He suspiciously searches her eyes -- she averts -- he opens the elevator she steps in -- the doors shut -SELINA You sure no one can see these things in my eyes?
utter57.302,utter,BATMAN,Don't worry. I'm watching you.
desc57.303,desc,,"She takes a tense breath -- somehow not reassured by that idea -- and as the doors open -- she steps -57 -- another world down here; a crowded, speak-easy vibe - SELINA SEES A LINE OF MEN all turning to size her up Batman sees HER POV DROP QUICKLY off their faces -BATMAN Don't look away -- I need time to"
utter57.304,utter,make I.D.s,( ugh) Great.
desc57.305,desc,,"As she turns back, Batman sees FACIAL RECOG SCANS BEGIN - when he NOTICES the SEA OF MEN GAZING lewdly at her body."
scene58,slugline,,02/09/20 (White February Shooting Script)
utter58.306,utter,BATMAN,These guys have a little trouble
desc58.307,desc,,"with eye contact, don't they?"
utter58.308,utter,SELINA,"Feels nice, doesn't it? -- I.D.s start coming through on the laptop"
utter58.309,utter,BATMAN,Guy up ahead's a c ity councilman -SELINA
desc58.310,desc,,Guy he's talking to isn't
utter58.311,utter,BATMAN,"No, he's not . (then, another I.D.) There's the chairman of Gotham"
utter58.312,utter,First National -SELINA,What'd I tellya? The best people.
desc58.313,desc,,"She passes a LOUNGE AREA where THREE MEN IN SUITS sit with TWO ""HOSPITALITY GIRLS"" they're all getting high, EYE-DROPPERS over their eyes to administer ""drops"""
utter58.314,utter,SELINA,"Jesus -- I hate drop heads -BATMAN Really? 'Coz when I first saw you, looked like you were dealing for"
utter58.315,utter,Penguin -SELINA,-- you don't know what you're talking about -- can we -- can we not do this now -- ?
desc58.316,desc,,"ONE OF THE MEN turns, mid-drop, THUNDERSTRUCK by Selina - recognizing the look, she quickly turns away from him -BATMAN Wait. Who was that -- ?"
utter58.317,utter,SELINA,I saw him --
utter58.318,utter,SELINA,"If I look back, it's gonna be a whole can a worms --"
desc58.319,desc,,Look back
utter58.320,utter,BATMAN BATMAN,I need to see his face --
desc58.321,desc,,She turns back and he's still staring; he stumbles over -
utter58.322,utter,SELINA,"Oh God, happy? Here he comes. MAN"
utter58.323,utter,BATMAN,That's the DA. Gil Colson. Talk to him.
utter58.324,utter,MAN/GIL COLSON,How you <loin'? I'm Gil.
utter58.325,utter,SELINA,(smiles) Aren't you the D.A. -- ?
utter58.326,utter,GIL COLSON,yeah -- !
utter58.327,utter,SELINA,-- wow -- I seen you on TV!
utter58.328,utter,GIL COLSON,Haven't seen you here before. Helluva time to be the new girl. People are all a little on edge.
utter58.329,utter,SELINA,"Honey, I live on the edge"
utter58.330,utter,GIL COLSON,Oh! I like that! You wanna join us? C'mon --
desc58.331,desc,,"He gestures to his table -- leads her over to the group the vibe here is a little tense -GIL COLSON This is Ritchie, Travis, Glen"
desc58.332,desc,,"That's half the D.A.'s office -Gil points to the other Hospitality Girl, who has a CATATONIC SMILE, and a dropper in hand --"
utter58.333,utter,GIL COLSON,That's Cheri -- don't mind her. She's taking a break. We're just drowning our sorrows. Wanna drop?
utter58.334,utter,SELINA,"No, I'm good -- but honey, you enjoy --"
utter58.335,utter,GIL COLSON,I hope you don't mind -- I got a lotta weight on my shoulders with that psycho running around --
desc58.336,desc,,"Batman sees his RED EYES -- he's VERY HIGH, DISTRAUGHT He's wasted No shit --"
desc58.337,desc,,"Gil looks at her, thinks she was responding to him"
utter58.338,utter,GIL COLSON,Right? I like this girl!
utter58.339,utter,SELINA,(recovering smoothly) I like you too --
desc58.340,desc,,"She touches his hand -- he looks down, disarmed, suddenly"
utter58.341,utter,vulnerable -GIL COLSON,"I mean, you don't understand"
desc58.342,desc,,this Rid dler's going after the most powerful guys in the city -and he knows so much
utter58.343,utter,TRAVIS,"He doesn't know shit, man"
utter58.344,utter,GIL COLSON,He does! What about all that creepy shit in the video about the rat -- ?!
utter58.345,utter,RITCHIE,"Hey, c'mon, Gil -- I think maybe you had a little too much -- slow down -- Wait. The rat, ask about the rat --"
utter58.346,utter,SELINA,What do you mean a rat ...?
utter58.347,utter,GIL COLSON,"(turns to her, intimate, hushed) I mean there was a rat -- we had an informant! We had big time information on Salvatore Maroni! That's how we got that bastard outta the drops business! But if this guy knows, and it ever comes out who the rat is, the whole city'll come APART --"
utter58.348,utter,CARLA,"Hey! I don't wanna hear this, this is the kind of pillow talk that got that Russian girl disappeared!"
utter58.349,utter,SELINA,"(turns, struck) What? What do you know about that?"
utter58.350,utter,CARLA,"(curt, stands up) Anybody want a drink? 10/25/19 (October Shooting Draft) CONTINUED: (5) And she's gone"
desc58.351,desc,,Selina watches her cross to THE BAR --
desc58.352,desc,,Keep him talking -When Selina abruptly stands -- starts off after Carla -BATMAN
utter58.353,utter,SELINA,She knows Anni ka --
utter58.354,utter,BATMAN,No -- stay on the D.A.
desc58.355,desc,,"-- I'm lookin' for my friend -Selina grabs Carla's arm at the bar, speaking HUSHED"
utter58.356,utter,SELINA,Hey -- where's Annika?
utter58.357,utter,CARLA,Outta my face! I don't know you
utter58.358,utter,SELINA,But you know her -- who took her - what have you heard -- is she ok?
utter58.359,utter,CARLA,"Jesus -- keep your voice down - whattaya got a death wish -- ? AN OMINOUS MALE VOICE (O.S.) What's the problem, ladies...?"
desc58.360,desc,,"Carla suddenly falls silent... as SELINA TURNS ... BATMAN SEES a SILHOUETTED FIGURE staring back, PENGUIN beside him -- the FACIAL SCAN struggles to I.D. the DARK FACE -CARLA (0 * S .) Oh, there's no -- no problem. Just... girl talk. We're good."
utter58.361,utter,PENGUIN,"Well let's keep it festive down here, ok?"
desc58.362,desc,,"Batman stares as the MAN moves into the light -- he's in his 60s, STRIKING FACE -- it's clear Batman knows him the Man's face lights up as he approaches Selina -STRIKING MAN"
utter58.363,utter,SELINA,(voice quieting) ...hey.
scene59,slugline,,02/09/20 (White February Shooting Script)
desc59.364,desc,,Batman watches the way the Man looks at her(us) -
utter59.365,utter,STRIKING MAN,"Been a long time since I seen you down here, gorgeous. How ya been?"
utter59.366,utter,SELINA (O.S.),"Yeah, I been ... OK. I was just... on my way back upstairs ..."
desc59.367,desc,,"Batman stares as the Man smiles at us, a bit suggestive -"
utter59.368,utter,STRIKING MAN,Well don't be a stranger ...
scene60,slugline,,EXT. WAREHOUSE ROOF - BATMAN'S LA PTOP - MOMENTS LATER
desc60.369,desc,,"Batman watches as Selina ENTERS A BATHROOM -- stops at a sink, staring down; Batman can't see her, just the sink -BATMAN You know Carmine Falcone"
utter60.370,utter,SELINA (O.S.),it's a mob spot
utter60.371,utter,BATMAN,You didn't tell me you had a relationship with him --
utter60.372,utter,SELINA,"We don't have a relationship, OK?"
desc60.373,desc,,"She glares up at her reflection, removing the contacts"
utter60.374,utter,BATMAN,That's not how it looked -- wait - what're you doing -- ?
utter60.375,utter,SELINA,"Listen, I can't -- I can't do this no more"
desc60.376,desc,,And as the lenses come out -- HIS LAPTOP GOES BLACK HOLD ON BATMAN -- INTENSE -- REELING -- THEN -59
scene61,slugline,,EXT. FRONT OF ICEBERG LOUNGE - UNKNOWN POV - NIGHT
desc61.377,desc,,"WE WATCH THROUGH FOGGED WINDOWS OF A PARKED SUV as SELINA BURSTS OUT THE CLUB into the FLICKERING LIGHT OF THE LONE STREETLAMP, looks for a cab ... when, we hear BREATHING ... AN OLIVE GREEN HOOD EDGES INTO FRAME -- THE BREATHING QUIETS as GIL STUMBLES out of the club too --"
scene62,slugline,,02/09/20 (White February Shooting Script)
desc62.378,desc,,Gil calls after Selina -- still smitten -- still high -
utter62.379,utter,GIL COLSON,Hey! Lost you in there
utter62.380,utter,SELINA,Yeah -- I gotta go -GIL COLSON ... oh -- you -- need a ride... ?
desc62.381,desc,,BACK INSIDE THE SUV
utter62.382,utter,GIL COLSON,(gesturing at us) that's me right there
desc62.383,desc,,HE'S POINTING RIGHT AT WHERE THE KILLER IS HIDING -- THE HOOD SLIPS FROM VIEW AGAIN -- as SELINA GLANCES AT US - distractedly considering for an instant -- then -SELINA No -- I'm -- I'm good A GYPSY CAB thankfully arrives -- she grabs the handle -
utter62.384,utter,GIL COLSON,Well I hope I -- ? See you round?
desc62.385,desc,,"She jumps in -- slamming the door as the CAB SPEEDS OFF - Gil watches her go, depressed... the HOOD edges back into frame, watching... Gil looks to the club, considers going in ... but turns, starting in our direction -- as the HOOD disappears -- Gil looks right at us, taking out his FOB -62 OVERHEAD ON THE STREET - LOOKING STRAIGHT DOWN -- as Gil's lonely figure approaches the waiting SUV -63 THROUGH THE PARTIALLY FOGGED WINDSHIELD -- we SEE Gil get in ... HOLD, as he fumbles for his seatbelt -- unaware of -- THE HOODED FORM SLOWLY RISING BEHIND HIM -- Gil leans forward -- briefly out of its reach -- as he strains to wipe fog from the windshield THE KILLER REMAINS EERILY STILL further than expected... as Gil SETTLES BACK"
scene63,slugline,,02/09/20 (White February Shooting Script)
desc63.386,desc,,"He feels blindly behind to FIND THE HEADREST GONE - confused, he turns -- SUDDENLY FACE TO HOOD WITH THE KILLER -- BEFORE HE CAN REACT -- THE KILLER P UMMEL S GIL WITH HIS METAL TOOL -- GIL SLUMPS onto the wheel -- HORN BLARING -- the KILLER YANKS HIM BACK -- -- totally out of it -- BLOOD FANNING down his face -- we hear the KILLER BREATHING HARD -- then the SOUND OF DUCT TAPE RIPPING -- TAPE COVERS GIL'S MOUTH -- AS GIL STARTS TO COME TO -- MOANING IN PANIC -- THE KILLER LIFTS A CRUDELY MADE CLAMP -- Gil feels it SLIDING AROUND HIS NECK -- HIS MOANING INTENSIFIES -- HE BEGINS TO FLAIL THE KILLER'S HOOD UNDULATES with EACH BREATH THE AVIATOR GLASSES OVER HIS HOOD RHYTHMICALLY FOGGING -RIDDLER Just... hold... still ... We hear the SICKENING CLICKS OF METAL CINCHING TIGHTER - TIGHTER -- GIL'S MOANING TURNS TO UTTER TERROR -- AS WE --"
scene64,slugline,,EXT. ABANDONED SKYSCRAPER CONSTRUCTION SITE - PRE-DAWN
desc64.387,desc,,"A CRUISER pulls past an OLD SIGN: ""A GOTHAM RENEWAL PROJECT -- FOR A BRIGHTER TOMORROW."" GORDON gets out"
scene65,slugline,,ON GORDON - RISING IN A CONSTRUCTION ELEVATOR - PRE-DAWN
desc65.388,desc,,"As it stops, he emerges onto --"
scene66,slugline,,AN UNFINISHED FLOOR - HIGH ABOVE THE CITY
desc66.389,desc,,"walking cautiously through a maze of gi rders to ... THE RUSTED BAT-SIGNAL, BEAM BLAZING into the sky. He shuts it off, thrusting the space further into darkness..."
utter66.390,utter,BATMAN (O.S.),What do you know about a confidential informant in the Maroni case... ?
desc66.391,desc,,"Gordon turns, finally spotting BATMAN'S SILHOUETTE; then:"
utter66.392,utter,GORDON,"Yeah, sure -- there-**"
scene67,slugline,,02/09/20 (White February Shooting Script)
utter67.393,utter,BATMAN,"That's the rat we're looking for. Somehow Riddler knows who he is we find the rat, maybe that'll lead us to him."
utter67.394,utter,GORDON,Where you getting this?
utter67.395,utter,BATMAN,I have a source who spoke to the
desc67.396,desc,,D.A. tonight. Gil's very nervous. He thinks the killer's targeting
desc67.397,desc,,***l worked that case too... !
utter67.398,utter,BATMAN,Riddler's not after you
utter67.399,utter,GORDON,How do you know -- ?
utter67.400,utter,BATMAN,You're not corrup t.
utter67.401,utter,GORDON,...Colson's dirty?
desc67.402,desc,,Batman nods. Gordon shakes his head
utter67.403,utter,GORDON,Well maybe I go after him on him to give up the rat
scene68,slugline,,outrage building -lean
utter68.404,utter,BATMAN,"Too dangerous. Colson said they made a secret deal with this guy whatever it is, it's huge. And who knows how many people it touches - politicians, police, the courts it could tear the city apart. Gordon reels"
utter68.405,utter,GORDON,Jesus -- this is a powder keg.
utter68.406,utter,BATMAN,And Riddler's the match.
scene69,slugline,,"10/25/19 (October Shoo ting Draft) INT. ""THE CAVE"" - UNDERNEATH WAYNE TOWER - EARLY MORNING"
desc69.407,desc,,"VOICES ECHO as we PAN THROUGH THE SPACE -- sweeping past the BLACK MUSCLE KIT CAR, almost complete now ..."
utter69.408,utter,BATMAN (V.O.),You know Carmine Falcone -- ? I told you
utter69.409,utter,SELINA (V.O.),this is a mob spot
utter69.410,utter,BATMAN (V.O.),"You didn't tell me you had a relationship with him -SELINA (V.O.) We don't have a relationship, OK?!"
desc69.411,desc,,"We FIND BRUCE at his work bench in A DARK SUIT, examining FOOTAGE from last night -- FREEZING on SELINA'S FACE -ALFRED (O.S.) Pretty. New friend of yours?"
utter69.412,utter,BRUCE,I'm not so sure...
utter69.413,utter,ALFRED,Looks like you upset her.
desc69.414,desc,,"Bruce turns, annoyed Alfred smiles"
utter69.415,utter,ALFRED,Shall I take this as a good sign? What?
utter69.416,utter,BRUCE ALFRED,Your attire. Is Bruce Wayne making an actual appearance?
utter69.417,utter,BRUCE,There's a public memorial for Mayor Mitchell. Serial killers like to follow reaction to their crimes -- Riddler might not be able to resist.
utter69.418,utter,ALFRED,"Oh, that reminds me -- I took the liberty of doing a little work on this latest cipher ..."
desc69.419,desc,,"Bruce looks Alfred has decoded the SYMBOLS FROM INSIDE THE RAT'S MAZE that was on COM MISSIONER SAVAGE'S head -ALFRED I'm afraid his Spanish is less than perfect, but I'm fairly certain it translates to ""You are el rata alada"" ..."
utter69.420,utter,BRUCE,"""Rata alada"" ... rat with wings?"
utter69.421,utter,ALFRED,It's slang for pigeon sense to you?
desc69.422,desc,,make any
utter69.423,utter,BRUCE,Yeah... a stool pigeon
utter69.424,utter,ALFRED,-- where are your cuff links?
utter69.425,utter,BRUCE,Couldn't find them
utter69.426,utter,ALFRED,You can't go out like that!
desc69.427,desc,,Bruce turns briefly to see Alfred removing his own
utter69.428,utter,BRUCE,"Alfred, I don't want your --"
utter69.429,utter,ALFRED,You have to keep up appearances -- you're still a Wayne --
desc69.430,desc,,"Annoyed, Bruce relents, letting Alfred slip one on -- he sees a MONOGRAMMED W on the link gives Alfred a look -BRUCE"
utter69.431,utter,ALFRED,(doing other sleeve) Your father gave them to me...
desc69.432,desc,,"That catches Bruce off guard -- he looks at him, thrown when Alfred glances up with a smile, making light -ALFRED I'm just loaning them to you -- I want them back... And as Bruce nods, a DIN OF HORNS AND TRAFFIC SWELLS -69"
scene70,slugline,,INT. BRUCE'S VINTAGE SP ORTS CAR - DAY
desc70.433,desc,,CLOSE ON THEW CUFFLINK as Bruce drives approaching
scene71,slugline,,CITY HALL
desc71.434,desc,,"he gazes at the street PACKED WITH MOURNERS, MAKESHIFT MEMORIALS... his blood chills as he SEES -(CONTINUED) AN OLIVE HOODED MAN in the crowd with a sign -- a SCRAWLED QUESTION MARK IN C ROSSHAIRS -- not far behind, ANOTHER HOODED MAN holds one that says: WHO ELSE DIES FOR GOTHAM'S LIES? ANOTHER holds: OUR DAY OF JUDGEMENT Bruce stares at the RIDDLER-INSPIRED PROTESTORS -- when a TRAFFIC COP presses to the window, double-takes, seeing Bruce. Bruce strains a smile -- as the Cop waves him in"
scene72,slugline,,EXT. FRONT OF GOTHAM CITY HALL - DAY
desc72.435,desc,,"Bruce gets out as a VALET opens his door -- when - PAPARAZZO (O.S.) ...is that Bruce Wayne...? Heads turn -- as news spreads -- CAMERAS BEGIN FLASHING - PAPARAZZI ...Mr. Wayne?! Mr. Wayne! Bruce ignores them, reaching for his wallet as he hears -A VOICE (O.S.) -- can I helpya, Mr. Falcone? Bruce spins to see BODYGUARDS helping Carmine Falcone out of a car -- Falcone turns as a WOMAN climbs out in a HIGH SLIT DRESS -- REMINISCENT OF SELINA'S -- her FACE IS CONCEALED under a VEILED HAT -- she takes Falcone's hand as they Join his PHALAN X OF GUARDS -- Bruce's eyes track her: is that Selina? He hands the Valet a wad of cash -Keep it close"
desc72.436,desc,,"Bruce moves after her -- through the thick crowd, bottle necking by the entrance -- eyes on the Woman -- pressing into FALCONE'S SECURITY TEAM, trying to glimpse her veiled face -- when A HAND slaps into his chest"
utter72.437,utter,PENGUIN,"Hey -- hey -- give us a wide berth here -- willya, slick?!"
desc72.438,desc,,"Bodyguards grab Bruce too -- hearing the commotion, the Woman turns -- Bruce SEES -- it's CARLA -FALCONE"
desc72.439,desc,,"They loosen their grip as Falcone steps over, smiles"
scene73,slugline,,02/09/20 (White February Shooting Script)
utter73.440,utter,FALCONE,"Some event, brought out the one guy in the city more reclusive than me."
desc73.441,desc,,"Bruce glares with edge, a sense of history between them -BRUCE"
desc73.442,desc,,Shoreline -- aren't you afraid someone'll take a shot at you?
utter73.443,utter,FALCONE,"Ya mean now that your father ain't around? Oz, you know Bruce Wayne?"
utter73.444,utter,PENGUIN,Whoa -- seriously?!
utter73.445,utter,FALCONE,"His father saved my life. I got shot in the chest, right here. Couldn't go to no hospital, so we showed up on his doorstep. He took me in, operated right on his dining room table -- kid here saw the whole thing. (to Bruce) You don't think that meant something, he did that?"
utter73.446,utter,BRUCE,Means he took the Hippocratic Oath.
utter73.447,utter,FALCONE,"... Hippocratic Oath, right... that's good... -- s'cuse me"
desc73.448,desc,,"And Bruce abruptly moves on, the bottle-neck opening"
scene74,slugline,,INT. GOTHAM CITY HALL - MOVING WITH BRUCE - DAY
desc74.449,desc,,"A SEXTET PL AYS as MOURNERS continue to flood in -- on the prowl, BRUCE SCANS the crowd -- he CLOCKS RIFLED OFFICERS among SPECTATORS above -- studies the CRUSH OF FACES in the STANDING PUBL IC GALLERY -- some back here in tears --"
scene75,slugline,,02/09/20 (White February Shooting Script)
utter75.450,utter,P.A. ANNOUNCER,"Ladies and gentlemen, thank you all for coming to today's memorial for our beloved mayor, Don Mitchell, Jr. Our program will begin shortly. As a reminder, the family asks that those wishing to honor the mayor's memory consider a donation to the cause most dear to his heart, the Gotham Renewal Fund, our city's safety net."
desc75.451,desc,,-- Bruce sees COPS STOPPING a SUSPICIOUS GUY -- when
scene76,slugline,,AN EERIE VOICE BEHIND(O.S.)
desc76.452,desc,,What good's a safety net doesn't
desc76.453,desc,,"Bruce turns -- to see A BITTER NOBODY in a hooded work jacket, angry eyes on the VIPS as they file past -BITTER NOBODY Didn't help !!!Y daughter when she"
desc76.454,desc,,"Finally, his eyes shift to Bruce, a truly chilling look -BITTER NOBODY Yeah, I said it ... Bruce studies his acne-scarred face -- nodding -- when -the man's expression changes trying to place Bruce"
utter76.455,utter,BITTER NOBODY,...hey... don't I know you?
desc76.456,desc,,A WOMAN'S VOICE
desc76.457,desc,,"Startled, Bruce spins to see BELLA REAL coming at him -"
utter76.458,utter,BELLA REAL,Why haven't you called me back?
utter76.459,utter,BRUCE,...I'm sorry -- ?
utter76.460,utter,BELLA REAL,"(no-nonsense) I'm Bella Real -- I'm running for mayor -- I wouldn't be bothering you here, but your people keep telling me you're ""unavailable"". Will you walk with me?"
scene77,slugline,,02/09/20 (White February Shooting Script)
desc77.461,desc,,"On the spot, Bruce glances back at the man -- who now glowers -- Bella tucks her arm under Bruce's -- stealing him -- he sneaks a look at the BITTER NOBODY who glares as they recede -- then turns, disappearing in the crowd -She leads Bruce to THE SEATED AREA, quiets, still blunt:"
utter77.462,utter,BELLA REAL,"You know you really could be doing more for the city -- your family has a history of philanthropy, but as far as I can tell, you're not doing anything -- if I'm elected,"
desc77.463,desc,,"I wanna change that -She smiles d isarmingly as they near the front -- a BOY'S CHOIR on the central steps begins SHUBERT'S ""AVE MARIA"" -BELLA REAL Will you wait for me? I wanna go pay my respects -- my God, what a mess -- his poor wife and son ... And she leaves him; struck by her nerve and charisma, Bruce watches her lean into the row to greet the widow when the Mayor's Ten-Year-Old Son glances awkwardly back ma king brief eye-contact -- a sad moment -- when -HUSHED, FAMILIAR VOICE (O.S.) 'Scuse me, C hief? Can I talk to you ...? Bruce turns to spy GORDON with OFFICERS, a few rows back -- Gordon touches the arm of the seated CHIEF OF POLICE -GORDON Gil Colson is missing ..."
utter77.464,utter,CHIEF BOCK GORDON,"He hasn't been heard from since last night --- when one of the Officers, Martinez, suddenly notices"
desc77.465,desc,,"Bruce gazing in their direction -- a surprised smile -MARTINEZ ...hey, Mr. Wayne ... Gordon falls silent -- a strange moment for Bruce as Batman's closest ally glares warily at the billionaire TIGHT ON BRUCE as he turns away -- still listening -(CONTINUED)"
scene78,slugline,,02/09/20 (White February Shooting Script)
utter78.466,utter,CHIEF BOCK(O.S.),"Christ, not again -- you got people looking for him, Jim?"
