segment-id,segment-type,segment-speaker,segment-text
desc139.769,desc,,"GOOD byyyyyyyye-ON BRUCE, absolutely ROCKED -- as CLUB MUSIC RISES -122 BLACKNESS SWINGS OPEN REVEALING BRUCE -- OUTSIDE THE CLUB - Know who I am?"
desc139.770,desc,,REVEAL ONE OF THE TWIN BOUNCERS -- staring in shock -
utter139.771,utter,BOUNCER,...you're Bruce Wayne.
utter139.772,utter,BRUCE,I wanna see Carmine Falcone.
desc139.773,desc,,"The Bouncer just looks at him -- then SHUTS THE DOOR - BEAT -- the DOOR OPENS: BOTH TWINS standing there now -BOUNCER (looking at his Twin) See... ? The Twin stares in disbelief as Bruce glares; then breaks into an excited smile, like he's seeing a rock star -...c'mon in."
scene140,slugline,,TWIN BOUNCER INT. FALCONE'S SHORELINE LOFT - PRIVATE ELEVATOR - NIGHT
desc140.774,desc,,"The doors open; we FOLLOW BRUCE down a long hallway to A DRAWING ROOM; HOODS and HOSPITALITY WOMEN crowd around a poo l table, drinking, playing -- at the table, CARMINE FALCONE looks over to see Bruce, the Twins behind him - Bruce glowers silently at Falcone, who stares back with a smirk... when the others begin to notice, quieting..."
utter140.775,utter,FALCONE,"Give us a minute, fellas."
desc140.776,desc,,The BODYGUARDS usher everyone out.
utter140.777,utter,FALCONE,Have a seat...
desc140.778,desc,,But Bruce just stands there.
utter140.779,utter,FALCONE,"Thought I might hear from you. This Riddler sonuvabitch is really stirring things up, isn't he-- ? (quiet) Is it true?"
utter140.780,utter,BRUCE FALCONE,What? ... that reporter business?
desc140.781,desc,,A beat. Falcone studies Bruce's rage-filled eyes.
utter140.782,utter,FALCONE,"Whattaya wanna know here, kid? Whattaya lookin' for?"
scene141,slugline,,02/09/20 (White February Shooting Script)
utter141.783,utter,BRUCE,The truth. Did you kill him. For my father.
utter141.784,utter,FALCONE,"Look, your father saved my life. I was loyal to him. I even trieda give money to his campaign, and that whole Renewal thing -- but he wouldn't take it. He didn't wanna associate with a guy like me"
utter141.785,utter,BRUCE,My father hated everything you stand for.
utter141.786,utter,FALCONE,"(smiles) Yeah, I know. Course he did. Guys like you, your father, you don't want anything to do with me... (darkens, bitter) ...til you need me. Right?"
desc141.787,desc,,A beat as they look at each other.
utter141.788,utter,FALCONE,"Your father was in trouble, ok? This reporter had some dirt, some very personal stuff about your mother, her family history... you know, everybody's got their dirty laundry, that's how it is. But he didn't want none of that coming out, not right before the election. Your father trieda pay this guy off, but he wasn't goin' for it. So he came to me. I never seen him like that. He said: I want you to put the fear of God in this guy."
desc141.789,desc,,"Bruce stares, unnerved..."
utter141.790,utter,FALCONE,"And when fear isn't enough, you take it to the next level. Your father wanted me to handle it. (a shark's eyes) So I did. I handled it. Bruce is truly unmoored; Falcone enjoying his pain..."
utter141.791,utter,FALCONE,"I know, you thought your father was a boy scout . But you'd be surprised what even a ""good"" man like him is capable of. In the right situation. (then) Do me a favor, don't lose any sleep over this, ok? This reporter was a lowlife, he was on Maroni's payroll -- he got what was comin' . ...Maroni?"
utter141.792,utter,BRUCE FALCONE,"Oh yeah. Maroni could never stand your father and I had history. And after what happened with this reporter, I think he was worried your father would be in my pocket forever. He woulda done anything to keep him from becoming mayor. (a pointed beat) Ya understand?"
desc141.793,desc,,"Bruce shakes his head, reeling, resisting the notion ..."
utter141.794,utter,FALCONE,...sure ya do ...
utter141.795,utter,BRUCE,Are you saying ...? Salvatore Maroni ... had my father killed?
desc141.796,desc,,Falcone lets that just hang in the air ... then:
utter141.797,utter,FALCONE,"Do I know it for a fact ...? I'm just sayin', it sure looked that way to me."
desc141.798,desc,,As the shock hits Bruce ... Falcone regards him coldly ...
utter141.799,utter,FALCONE,This what you wanted? This little conversation here?
desc141.800,desc,,Bruce can't even respond ...
utter141.801,utter,FALCONE (O.S.),Anhh ... I spose it's been a long time comin'... I mean you ain't a kid no more ...
scene142,slugline,,02/09/20 (White February Shooting Script) INT. WAYNE TOWER - GRAND FOYER - DAWNING LIGHT
desc142.802,desc,,"Bruce arrives at the top of the stairs in a daze, stops, staring at... the CHAINED and PADLOCKED SET OF DOORS..."
scene143,slugline,,INT. BRUCE'S PARENTS' DARKENED BEDROOM - MOMENTS LATER
desc143.803,desc,,"Untouched in twenty years... a frozen moment, covered in dust. Bruce enters, taking in the unbearable stillness... In the early light, he sees a man's suit jacket draped on a chair... a pair of glasses rest on an old newspaper... He turns, seeing a STAINED TEACUP, askew in its saucer on a woman's dressing table... behind it, on the mirror, are yellowed CHILDREN'S CRAYON DRAWINGS: his... One's a stickfigure, smiling family... a mother, father, and child ... A quiet HEART MONITOR BEEPING begins as Bruce stares..."
scene144,slugline,,INT. ALFRED 'S HOSPITAL ROOM - TWILIGHT
desc144.804,desc,,"Alfred opens his eyes to see BRUCE seated at his bedside, rumpled. Bruces smiles sadly, finally speaking, pained:"
utter144.805,utter,BRUCE,"...you lied to me. My whole life. (long, pregnant beat) I... spoke to Carmine F alcone..."
desc144.806,desc,,"Pain and shock fill Alfred's eyes... he blinks away; then back. Finally, he struggles for voice... hoarse..."
desc144.807,desc,,...what'd he... say...?
utter144.808,utter,BRUCE,... he... told me what he did... for my father... and about
desc144.809,desc,,Alfred's eyes burn... trying to understand ...
utter144.810,utter,ALFRED,...he told you ... Salvatore Maroni ... ?
utter144.811,utter,BRUCE,... had my father killed.
desc144.812,desc,,"Alfred just gazes, pained."
utter144.813,utter,BRUCE,"Alfred, why didn't you tell me all this...? (MORE)"
utter144.814,utter,BRUCE (CONT'D),I spent all these years fighting for him... believing he was a good man
utter144.815,utter,ALFRED,-- he was a good man
desc144.816,desc,,Bruce shakes his head -- but Alfred grows more fierce
utter144.817,utter,ALFRED,-- listen to me... your father ... was a good man -- he... made a mistake -BRUCE A mistake? He had a man killed - why -- to protect the family image -- his political aspirations ?
utter144.818,utter,ALFRED,-- it wasn't to protect the family image -- and he DIDN'T have anyone killed...
desc144.819,desc,,"The forcefulness of that makes Bruce stop -- he looks at Alfred... who continues, simply, emotional..."
utter144.820,utter,ALFRED,"He was protecting your mother. He didn't care about his image, the campaign, any of that. He cared about her. And you. These... ... secrets about your mother's family, they haunted her, she'd battled them every single day. We all have our scars, Bruce. And your father knew, if everything came out, it'd be too much for her. It would destroy her. He just... he loved her so much. And in a moment of weakness, he turned to Falcone. But he never thought Falcone would kill that man. Your father should have known that Falcone would do anything to finally have something on him he could 1!.SS.g_ *** to own him. That's who Falcone is. And that was your father's mistake. (then) But when Falcone told him what he'd done, your father was distraught -- he told Falcone he was going to the police, that'd he'd confess everything... (MORE)"
utter144.821,utter,ALFRED (CONT'D),And that night... your father and your mother were killed.
desc144.822,desc,,Bruce is stunned...
utter144.823,utter,BRUCE,...it was... Falcone...?
desc144.824,desc,,"Alfred looks at him sadly, so wanting to give Bruce the answer he needs, the answer he's wanted his whole life ..."
utter144.825,utter,ALFRED,"... I wish I ... knew for-** Yes... maybe... Or maybe it was some random thug on the street who needed money, who got scared and pulled the trigger too fast... If you don't think I've spent every day searching for that answer ... (truly distraught) It was my job to protect them - do you understand? I know you always blamed yourself. You were only a boy, Bruce. I could see the fear in your eyes. But I didn't know how to help. I could teach you to fight -- but I wasn't prepared to take care of you. You needed a father. But all you had... was me. I'm sorry..."
desc144.826,desc,,"Alfred averts his eyes, red with heartbreak and regret. Bruce stares at him, deeply affected..."
utter144.827,utter,BRUCE,"...no, Alfred... don't be sorry... (then, quiet, struck) God, I ... never thought I'd feel fear like that again... I thought I'd mastered all that. I mean, I'm not afraid to die..."
desc144.828,desc,,"His unflinching gaze meets Alfred's, who nods, solemn... then, Bruce's eyes shift away again, processing..."
utter144.829,utter,BRUCE,"But I realize now, there's something I never got past ... The fear of... ever going through any of that again... (looking at Alfred) ...of losing someone I care about."
desc144.830,desc,,"Alfred looks back, moved -- he smiles, tears in his eyes:"
scene145,slugline,,02/09/20 (White February Shooting Script)
utter145.831,utter,ALFRED,Well... I'm afraid you won't be rid of me just yet...
desc145.832,desc,,Bruce smiles sadly back ... then gazes off...
utter145.833,utter,BRUCE,I went into their room last night.
desc145.834,desc,,Alfred is quietly struck.
utter145.835,utter,BRUCE,It all... seemed so much smaller.
desc145.836,desc,,"Alfred watches Bruce, a fleeting glimpse of the man as a boy ... He reaches out a hand. Bruce stares, surprised... then lifts his own... clasping Alfred's tightly ... Then Bruce darkens... noticing something outside the window... Alfred turns... sees the BAT SIGNAL IN THE SKY."
scene146,slugline,,EXT. ABANDONED SKYSCRAPER CONSTRUCTION SITE - NIGHT
desc146.837,desc,,"The B atmobile arrives -- emerging to see Gordon, getting out of his car too -- they trade confused looks"
utter146.838,utter,GORDON BATMAN,...I... saw the signal -- that's not you...?
utter146.839,utter,GORDON,I thought it was you...
desc146.840,desc,,They both lift their eyes to the spotlight in the sky
scene147,slugline,,INT. RISING CONSTRUCTION ELEVATOR - SECONDS LATER
desc147.841,desc,,"We hear SCREAMS as THE UPPER FLOOR COMES INTO VIEW GLIMPSE SELINA IN CAT SUIT, VICIOUSLY KICKING SOMEONE Shocked, Batman and Gordon rush from the lift ONTO THE UNFINSHED FLOOR Where Selina has a PRISONER BOUND BY HER LOCK CHAIN to the GUARDRAIL AT THE BUILDING'S EDGE -- KENZIE -- HIS FACE SWOLLEN -- she's got his GLOCK in both hands - prowling, crazed -- she sees B atman, spins -- FIERCE -I found him"
scene148,slugline,,02/09/20 (White February Shooting Script)
utter148.842,utter,SELINA,-- what're we gonna do -- he had my shit -- my phone! She left a message! The night they took her she called me -- !
utter148.843,utter,KENZIE,"(tota lly freaked) Gordon! Help me OUT, man!"
utter148.844,utter,SELINA,(KICKS him again) SHUT UP!!!
utter148.845,utter,BATMAN Put down the gun -SELINA,"-- I'm telling you, goddammit she CALLED ME! (pulling out PHONE) Here -- LISTEN!!!"
desc148.846,desc,,She hits PLAY ON A VOICEMAIL -- TOSSES THE PHONE to Batman -- Gordon steps closer -- as THE DISTORTED MESSAGE PLAYS: PANICKED BREATHING as an ANGRY VOICE approaches
utter148.847,utter,MAN (OVER PHONE),--back here -- where you goin' ! ?
desc148.848,desc,,-- ANOTHER MAN'S VOICE joins
utter148.849,utter,ANNIKA (OVER PHONE),(terrified) --n-n-nowhere -- I -YELLING over them --
utter148.850,utter,MAN TWO (OVER PHONE),"Hey-hey-HEY, whattaya <loin'? C'mon, Kenzie, you're scarin' her. MAN/KENZIE (OVER PHONE) -- oh, I'm -- I 'm sorry, Mr. Falcone..."
utter148.851,utter,FALCONE (OVER PHONE),(gentler) Hey ... you ok...? C'mere
utter148.852,utter,ANNIKA (OVER PHONE),please don't -- don't hurt me --
utter148.853,utter,FALCONE (OVER PHONE),"don't be scared -- c'mere.. . Now, lemme just ask you again .. . What'd Mitchell tell you ...? ANNIKA (OVER PHONE) n-nothing -- he -(CONTINUED)"
utter148.854,utter,FALCONE (OVER PHONE),"Don liked to talk, I know that - 'specially to pretty girls like you... that's why I made him take your passport -- till we could have a little conversation -- all I wanna do is get out of here, OK? You' ll never hear from me again nobody will -- PLEASE!"
utter148.855,utter,FALCONE (OVER PHONE),"We're gonna get you outta here, I promise... But fir st, I gotta know ... what'd he tell you?"
utter148.856,utter,ANNIKA (OVER PHONE),"...he... he just said they... they all made a... a deal with you -FALCONE (OVER PHONE) -- ohhhh -- he told you bout that, huh? -- a deal -- ?"
utter148.857,utter,ANNIKA (OVER PHONE),"-- yeah, long time ago he said - said you gave some information on some drops thing helped a lot of people -- and that's how he became mayor -- he said you were a ... very important man ..."
utter148.858,utter,FALCONE (OVER PHONE),"Right... uh-huh ... (resigned sigh, then) OK ..."
desc148.859,desc,,"AND SUDD ENLY -- ANNIKA BEGINS SHRIEKING -- IT'S AGONIZING -- BATMAN'S GAZE S HIFTS TO SELINA, WHO STARES OFF, TE ARS BEGINNING -- AS ANNIKA'S CRIES TURN TO DESPERATE GASPS -FALCONE (OVER PHONE) (strains, eerie calm) ... just... take it... easy -- OK? Take it easy..."
utter148.860,utter,GORDON,Jesus ... he's strangling her ...
desc148.861,desc,,"SELINA'S EYES LIFT TO BATMAN'S, ALIVE WITH RAGE -- AS THE RECORDING FINALLY ENDS -- EVERYONE S ILENT. GORDON TURNS TO BATMAN, REELING -- WHEN BATMAN'S EYES LIFT TO HIS:"
scene149,slugline,,02/09/20 (White February Shooting Script)
utter149.862,utter,BATMAN,"...""rata alada"". A falcon has wings too. Falcone's the rat."
desc149.863,desc,,Gordon turns slowly to Kenzie; they move toward him -
utter149.864,utter,GORDON,...he works for you guys? The D.A....? The mayor...?
desc149.865,desc,,"Kenzie looks up at them, terrified... when... he cracks:"
utter149.866,utter,KENZIE,No... we work for him... Everybody does...
utter149.867,utter,BATMAN KENZIE,... through Renewal ... Renewal is everything
utter149.868,utter,GORDON,-- the Renewal Fund ... ?
utter149.869,utter,KENZIE,"(shaking, it spills) Yeah... After Thomas Wayne died, they all went after it like vultures -- the mayor -- Falcone Maroni -- everyone got in on it it was perfect -- for makin' bribes -- laundering money -- a huge charitable fund with no oversight -- everybody got a piece. But Falcone wanted more. So he orchestrated a play to take Maroni down big -- he'd rat out his drops operation, make the careers of everybody that went after him, then install them all as his puppets... He'd run the city. And he's been <loin' it ever since -- you think this goddamn election matters? Falcone's the mayor -- he's been the mayor for the last twenty years..."
desc149.870,desc,,Selina turns to Batman: a truly scary look in her eyes
utter149.871,utter,SELINA,"C'mon, ""Vengeance"" -- let's go kill that sonuvabitch (gun on Kenzie) This creep too, let's finish this!"
scene150,slugline,,02/09/20 (White February Shooting Script)
utter150.872,utter,GORDON,whoa -- whoa -- whoa!!!
utter150.873,utter,KENZIE,"OH , GOD -- !!!"
desc150.874,desc,,when a BLACK GLOVE knocks the gun to the floor!
scene151,slugline,,BATMAN (O.S.)
desc151.875,desc,,"Selina spins, ready to strike, FACE TO FACE WITH BATMAN -"
desc151.876,desc,,"We'll get him, but not this way"
utter151.877,utter,SELINA,There is no other way -- he owns the city!
utter151.878,utter,BATMAN,Cross that line... you'll become just like him.. .
desc151.879,desc,,"Beside herself, she realizes he's not with her --"
utter151.880,utter,BATMAN,Listen to me -- don't throw your life away
desc151.881,desc,,"Finally, she turns back to him -- smiles, fatalistic -"
utter151.882,utter,SELINA,"Don't worry, honey -With dancer's grace -- she lifts a leg -- touching her"
desc151.883,desc,,"heel provocatively to Kenzie's chest -- then, hardening"
desc151.884,desc,,"I got nine of 'em -KENZIE'S EYES WIDEN -- AS SHE KICKS HIM THROUGH THE GUARDRAIL -- KNOCKING HIM OFF THE BUILDING -- ! GORDON LURCHES FORWARD ON INSTINCT -- AS BATMAN TRIGGERS HIS QUICK-DRAW SLIDER -- FIRING A HARPOON INTO KENZIE'S ANKLE -- FIERCELY YANKING THE LINE TAUT TO SAVE HIM -KENZIE JESUS CHRIIIIST -- !!! -- AS BATMAN -- STRUGGLING TO HOLD ON -- SPINS TO SEE - SELINA LEAPING OFF THE EDGE WITH THE GLOCK -- LAUNCHING FOR A CABLE ON A CONSTRUCTION CRANE -- JUST MAKING IT - SLIDING DOWN THE LINE -- SWINGING OFF -- DISAPPEARING! -- Gordon helps Batman pull a whimpering Kenzie back up Gordon turns to Batman -- who's yanking a wired hook from his belt -- securing it on the edge -- no time to lose -GORDON She'll never get outta there alive -- and if she kills Falcone, we may never find the Riddler"
utter151.885,utter,BATMAN,-- I have to stop her
utter151.886,utter,GORDON,Don't you mean -- ?
utter151.887,utter,BATMAN,I gotta do this my way
utter151.888,utter,GORDON,And then what -- ?
desc151.889,desc,,Batman looks up as he finishes
utter151.890,utter,BATMAN,We do what Riddler said (tosses him SELINA'S PHONE) Bring the rat into the light...
desc151.891,desc,,"Gordon stares at the phone it -- as BATMAN JUMP S BACK then n ods, suddenly getting RAPPELLING OFF THE TOWER --"
scene152,slugline,,EXT. GOTHAM STREET S - AT HIGH SPEED - NIGHT HURTLING down a service road under an elev ated highway -
desc152.892,desc,,REVEAL SELINA SCREECHING through the maze of columns on her bike -- PAN as she SCREECHES PAST -- heading toward - THE ICEBERG LOUNGE -- disappearing behind the building
scene153,slugline,,EXT. DESERTED ALLEY BEHIND ICEBERG LOUNGE - SECONDS LATER 131
desc153.893,desc,,Selina whips off her helmet -- ejects the Glock's clip to inspect rounds; SLAMS it back -- UNZIPPING HER B ODYSUIT --
scene154,slugline,,THE BATMOBILE
desc154.894,desc,,"ROARS on the service road -- threading columns -- when it SKIDS TO A STOP -- hidden in shadow -- BATMAN peers at -SELINA OUTSIDE THE CLUB, UNDER THE FLICKERING STREET LAMP -- now in HER SLIT DRESS -- as THE TWINS let her in -SLOW ZOOM, BATMAN staring, intense, deciding what to do"
scene155,slugline,,10/25/19 (October S hooting D raft) INT. ICEBERG LOUNGE NIGHTCLUB - MOVING - NIGHT
desc155.895,desc,,"MUSIC POUNDS AS WE MOVE TOWARD A GUARD beside A PRIVATE ELEVATOR -- his eyes brazenly check us out, head to toe"
utter155.896,utter,SELINA,(uncomfortab le smile) Hey -- could you tell M r. Falcone I'd like to come up -ELEVATOR GUARD -- he ain't seeing nobody tonight!
utter155.897,utter,SELINA,"(leans in, h ushed) Just tell him it's about A nnika..."
desc155.898,desc,,He darkens -- nods -- Selina step s aside as he speaks low into a mic on his sleeve. He opens the ELEVATOR DOOR for her -- watches... AS SHE GETS IN ... AND THE DOORS CLOSE -134
scene156,slugline,,INT. FALCONE'S SHORELINE LOFT - ELEVATOR HALLWAY - NIGHT
desc156.899,desc,,"SELINA STEPS OUT, moving b y an INTIMIDATING PHALANX OF GUARDS -- to the DRAWING ROOM -- where FALCONE APPEARS"
utter156.900,utter,FALCONE,Look who it is -- !
utter156.901,utter,SELINA,-- sorry to bother you --
utter156.902,utter,FALCONE,"N o, it's fine, beautiful!"
utter156.903,utter,SELINA,I was just wondering if I could... talk to you for a minute... alone?
desc156.904,desc,,"-- and as we hear a LOU D POUNDING KNOCK-KNOCK-KNOCK BLACKNESS SWINGS OPEN; we SEE OUTSIDE THE CLUB, BUT NO ONE'S THERE. REVEAL THE TWINS staring out the door -- confused - FOLLOW THEM OUT as they search for whoever was knocking WHEN BAM! -- they SPIN to SEE THE DOOR SHUTTING THEM OUT!"
scene157,slugline,,INT. HEART OF THE CLUB - MOVING - IMMEDIATELY
desc157.905,desc,,"PUSHING THROUGH REVELERS -- A FIGURE ENTERS FRAME STRIDING in ARMY JACKET, CAP, and DUFFEL - BATMAN HAS ENTERED AS THE DRIFTER -- EYES SEARCHING - HE SPIES what ENTERS -he's been looking for -- A DOOR: ""KEEP OUT"""
scene158,slugline,,02/09/20 (White February Shooting Script)
desc158.906,desc,,A S ECURITY GUARD NOTICES -- GIVING CHASE -- MOVE WITH HIM -- to see THE DRIFTER DISAPPEARING R OUND A CORNER -- the GUARD DISAPPEARS AFTER HIM -- HOLD in the empty corridor -- when the GUARD'S BODY CRASHES OUT -- UNCONSCIOUS -- !
scene159,slugline,,INT. FALCONE'S DRAWING R OOM - SA ME TIME
desc159.907,desc,,"Selina sits across from Falcone, who leans against the pool table, sizing her up as she grows emotional"
utter159.908,utter,SELINA,"...I'm just -- I'm so worried -- I don't know where she is ... ! And I know you're a very important man, I was hoping maybe you could help me find her -- I mean she's been gone so long, I'm starting to think she might be ... (stops, tearing) -- I'm so sorry -FALCONE (eyes her carefully) That's OK -- I understand"
desc159.909,desc,,"He offers her some tissues -SELINA No -- thank you, I have some... -- as she reac hes INTO HER CLUTCH ON HER LAP where THE GLOCK HIDES -- HER FINGERS STARTING TO GRASP IT -- WHEN -AN ALARMED VOICE (O.S.) Mr. Falcone -- ! -- they both turn, startled, as a BALD BODYGUARD enters - Selina eases off the gun, taking out a Kleenex instead -FALCONE Vinnie! Didn't I tell you I was--?"
utter159.910,utter,BALD BODYGUARD,"I'm sorry, Mr. Falcone -- I really think you gonna wanna see this ... !"
desc159.911,desc,,"Falcone sees he's serious -- nods -- turns to Selina -FALCONE I'm sorry, beautiful right back... Selina nods, wiping tears as he goes; she hardens as she looks at the Glock, then leans to see..."
scene160,slugline,,02/09/20 (White Februar y Shooting S c ript)
desc160.912,desc,,The Guar d leading Fal cone to a ROOM WHERE A TV PLAYS -138
desc160.913,desc,,A DOOR CRASHES OPEN REVEALING THE CLUB ELECT RICAL ROOM THE DUFFEL HITS THE FLOOR -- THE DRIFTER'S HANDS REACH IN -- SEIZING A PORTABLE ROTARY SAW -139
scene161,slugline,,INT. FALCONE'S LOFT - TV ROOM - SIMULTANEOUS
desc161.914,desc,,TV ligh t flicker s in Fal cone's eyes as he gazes in shock:
utter161.915,utter,FALCONE,"...hol y shit ... ... the recor ding w as provided to GCl by Lieutenant James Gor don of the Goth am PD -- I shoul d w ar n you, the content s are disturbing."
desc161.916,desc,,"ON TV we see THE GCl BREAKING NEWS HEADLINE -- ""RECLUSIVE CRIME BOSS RECORDED COMMITTING MURDER -- ADMITS TO BEING MAFIA INFORMANT"" -- SELINA'S CELL PHONE VOICEMAIL PLAYS -FALCONE (ON TV)"
utter161.917,utter,ANNIKA (ON TV),"yeah, long time ago he said he said you gave some information on some drops thing"
scene162,slugline,,ON SELINA - IN THE DRAWING ROOM
desc162.918,desc,,"WATCHING the two men by the TV, back s to her -- she slips her h and into her c lutch -- gripping THE GLOCK -- she RISES, heading for them -- as ANNIKA SCREAMS on TV -- !"
scene163,slugline,,INT. THE CLUB ELECTRICAL ROOM - SIMULTANEOUS
desc163.919,desc,,THE ROTARY SAW GRINDS INTO METAL AROUND POWER LINES - SPARKS FLY -- illuminating THE BAT COWL IN THE DUFFLE!
scene164,slugline,,INT. FALCONE'S LOFT - TV ROOM - SIMULTANEOUS
desc164.920,desc,,WE SLOWLY MOVE TOWARD THE BACK OF FALCONE'S HEAD the GLOCK lift s into fr ame -- we hear a soft voice:
utter164.921,utter,SELINA (0.S.),"...hey, Dad..."
desc164.922,desc,,"Confused, Falcone turns to look at us, startled to see the gun REVEAL SELINA, Glock in both hands, trained on Falcone -- the Bald Bodyguard turns, alarmed too -...what... ?"
desc164.923,desc,,"CLOSE ON SELINA, emotion under the stillness of her gaze:"
utter164.924,utter,SELINA,I'm Maria Kyle's kid...
desc164.925,desc,,"Falcone looks at her, stunned, unnerved -- then"
utter164.926,utter,FALCONE,"ok, just -- just put down the gun, honey--"
utter164.927,utter,SELINA,(cutting him off) this is for my mother
desc164.928,desc,,Selina about to fire -- WHEN THE LIGHTS GO OUT -- AS BANG -- HER MUZZLE FLASH CATCHES THE BLUR OF FALCONE DUCKING --
scene165,slugline,,INT. THE CLUB B ELOW - IMMEDIATELY
desc165.929,desc,,CROWD reacting to the SUDDEN DARK in panic
scene166,slugline,,INSIDE THE ELEVATOR SHAFT
desc166.930,desc,,"THE DOORS SCREECH OPEN -- A SHADOW SWEEPS IN -- as it passes, we see THE ELEVATOR GUARD outside, UNCONSCIOUS FROM DIRECTLY OVERHEAD IN THE SHAFT RIGHT BELOW US, THE SHADOW RAISES... THE GRAPPLING GUN THE HOOK SOARS TO THE ELEVATOR CAR, five stories above"
scene167,slugline,,INT. FALCONE'S DARKENED TV ROOM UPSTAIRS - SIMULTANEOUS
desc167.931,desc,,"SILHOUETTED AGAINST THE WINDOW, Selina and Bald Bodyguard FIGHT FOR HER GUN -- SELINA SLAMS A HEEL ON HIS KNEE - HOBBLING him with a SICKENING CRACK -- she SPINS -- a BLINDING ROUNDHOUSE -- and he DROPS -- SELINA SPOTS -- A DIM GLIMPSE OF FALCONE DARTING FOR THE DOOR -- SHE FIRES BLINDLY -- BULLETS RIPPING INTO THE WALL -- WHILE --"
scene168,slugline,,OUTSIDE IN THE COMPLETELY DARKEN ED ELEVATOR HALLWAY
desc168.932,desc,,VOICES OF PANICKED GUARDS react to the GUN SHOTS -
scene169,slugline,,10/25/19 (October Shooting Draf t)
utter169.933,utter,YET ANOTHER,here-here-here -- !
desc169.934,desc,,"-- as he turns on a CELL PHONE FLASHLIGHT -- light spills onto THE FIVE ARMED GUARDS -- WHEN AN OMINOUS SCREECHING comes from the end of the hall -- THEY ALL SPIN toward THE EERILY OPEN DOORS OF THE PITCH-DARK ELEVATOR. They exchange looks, spooked; then, drawing guns, nod to the Guard With The Cell to check i t out; he reluctantly moves to the doors, drawing his gun... they watch as he enters:"
scene170,slugline,,THE ELEVATOR
desc170.935,desc,,"SCOURING with the GLOW of his cell; sees nothing ... when, he hears BREATHING ... dawning dread ... he looks up AT -BATMAN, BRACED UNNATURALLY AGAINST THE CEILING -- light from below DISTORTING HIS FEATURES -- an IMAGE FROM CHILDREN'S NIGHTMARES -- FACE TO FACE with the Guard -BATMAN DR OPS -- THE GUARD SHRIEKING IN AGONY -- HIS CELL SMASHING -- THE HALL THRUST AG AIN INTO DARKNESS -- AS BOOTSTEPS POUND -- BATMAN'S PATH THROUGH THE HALL MARKED BY STACCATO MUZZLE FLAS HES -- AS HE PUMMELS GUARD, AFTER GUARD, WEAPONS FIRING INVOLUNTARILY AS THEIR BODIES FLY -149"
