segment-id,segment-type,segment-speaker,segment-text
scene1,slugline,,Rev. 12/17/20 (B lue)
desc1.0,desc,,Matt Reeves & Peter Craig
desc1.1,desc,,Batman created by Bob Kane and Bill Finger This script is the confidential and proprietary
desc1.2,desc,,"it may be performed, distributed, reproduced, used,"
desc1.3,desc,,ARTICULATED PRODUCTIONS LIMITED
desc1.4,desc,,"The quiet hum of CITY TRAFFIC and DISTANT SIRENS. Gradually, we make out something unnerving, right beside us: SOMEONE BREATHING... A MASSIVE RED TITLE FADES UP: ""T HOLD; then SMASH OUT OF THE BLACKNESS TO REVEAL"
scene2,slugline,,AN OUT OF FOCUS BINOCULAR POV - DUSK
desc2.5,desc,,"We FOCUS, SE ARCHING THE FACADE OF AN OPULENT TOWNHOUSE ... The BREATHING SUDDENLY QUIETS as a SHAPE APPE ARS IN A WINDOW -- a LITTLE RED NINJA gazes out, clutching a small sword. The ninja spins, brandishing the sword as TWO SHAPES enter behind him -- a WOMAN, late 30s, dressed as a WITCH -- and a MAN, late 50s, in a WELL-CUT SUIT. The little ninja rushes in, ""stabbing"" the Man, who collapses melodramatically. The Woman smiles -- speaks to the ninja, and he grabs a PUMPKIN CANDY BUCKET as they start to exit. The Man sits up, yells after them; the ninja runs back for a hug. Finally, the ninja and Woman exit, LEAVING THE MAN ALONE. He grows SOBER. As the Man pulls himself up, the BREATHING BESIDE US RESUMES..."
scene3,slugline,,INT. OPULENT TOWNHOUSE - DIMLY-LIGHTED STUDY - NIGHT
desc3.6,desc,,"In the light of the flickering TV, we see now the Man is handsome, distinguished. He stands, sipping scotch, watching THE NEWS; a CHYRON reads, ""GOTHAM MAYORAL RACE"": FEMALE NEWSCASTER (ON TV) Just-released polls have incumbent mayor, Don Mitchell, Jr. and twenty-eight year old grassroots challenger, Bella Real in a dead"
desc3.7,desc,,"last night in their final debate before next Tuesday's election... As the Man anxiously watches the DEBATE CLIP, we realize: he is MAYOR MITCHELL; his female challenger, BELLA REAL, young, intelligent, a force of nature, shares the stage -MAYOR MITCHELL (ON TV) Now my young opponent here wants to gut the Gotham Renewal Program"
scene4,slugline,,02/09/20 (White February Shooting Script)
utter4.8,utter,BELLA REAL (ON TV),"-- the Renewal Program is broken! The city's been ""renewi ng"" for twenty years, look where it's gotten us! Crime has skyrocketed!"
utter4.9,utter,MAYOR MITCHELL (ON TV),Now wait a minute hold .Q!!.
utter4.10,utter,BELLA REAL (ON TV),Murder and drug use are at historic highs! We have a masked vigilante running the streets!
utter4.11,utter,MAYOR MITCHELL (ON TV),-- under my administration the Gotham PD dealt major blows against organized crime and drug trafficking! The Salvatore Maroni case was the biggest drug bust in city history
utter4.12,utter,BELLA REAL (ON TV),but drops and other drugs are still rampant! It's gotten worse!
utter4.13,utter,MAYOR MITCHELL (ON TV),"I'm not saying there isn't work to do -- but listen - I have a beautiful wife and young son, ok? I will not rest until this city is safe for them -- and all our citizens!"
desc4.14,desc,,"Mitchell turns, startled, as a PHONE RINGS. As he EXITS FRAME to answer, we STAY on a DARK HALL BEHIND THE STUDY -- on the wall by the door way, we see a framed headline: ""MARONI DRUG BUST! MAYOR'S STING OPERATION HISTORIC"". As the TV brightens, we SEE for the first time, SOMEONE IS IN THE HALL. Barely visible, the Figure wears a DARK, OLIVE GREEN HOOD -- a homemade executioner's mask, with PRESCRIPTION AVIATOR GLASSES bizarrely outside the hood."
utter4.15,utter,MAYOR MITCHELL (O.S.),"Hey. Yeah, I'm watching GCl ..."
desc4.16,desc,,"As Mitchell PACES IN AND OUT OF FRAME, the Figure's hooded head ominously tracks him..."
utter4.17,utter,MAYOR MITCHELL (O.S.),"Why is she still tied -- I thought we were getting a bump in the new Post poll... ? Ok, you know what? I can't, I can't watch this anymore"
desc4.18,desc,,"-- call me in the morning -We HEAR the phone hang up, and Mitchell RE-ENTERS FRAME, agitated; as he SHUTS OFF THE TV, the HALL BEHIND HIM SUDDENLY GOES DARK, the FIGURE NO LONGER IN SIGHT."
scene5,slugline,,02/09/20 (Wh ite February Shooting Script)
desc5.19,desc,,"Mitchell stand s there, d rink in hand; starts to sip, as - THE FIGURE LURCHES OUT THE DARK -- FRANTICALLY CLUBBING HIM OVER AND OVER -- suddenly, the WEAPON SLIPS LOOSE - it SKITTERS right at us and STOPS. A GLEAMING METAL TOOL. Whatever it is, it's WET with blood. The Figure turns, PANTING, rises off the m otionless victim, trudges over to us... A GLOVED HAND retrieves the strange weapon. The Figure walks back, regarding the victim for a l ong, creepy m oment... then stretches its arms as far as they will g o, LOUDLY UNSPOOLING a LONG PIECE OF SILVER DUCT TAPE... And with a LOW RUMBLE OF THUNDER, we SLAM INTO -4 BLACKNESS AGAIN... We HEAR PATTERING RAIN as a HYPNOTIC VOICE OVER begins: VOICE OVER A GAS ARC BULB BURNS to life... glowing BRIGHTER... BRIGHTER... REVEAL ING: We're INSIDE A SEARCHLIGHT..."
scene6,slugline,,EXT. ROOFTOP - ON THE RUSTED SEARCHLIGHT - NIGHT
desc6.20,desc,,As the LIGHT INTENSIFIES -- RAINDROPS ILLUMINATE BEATING and DANCING CHAOTICALLY on the hot lens -6
scene7,slugline,,EXT. RAINY GOTHAM STREETS - HIGH ANGLE - NIGHT A bacchanalian Times Square vibe. COSTUMED HALLOWEEN
desc7.21,desc,,REVELERS swarm wet sidewalk s in the glow of NEON and LED. VOICE OVER The city streets are crowded for
scene8,slugline,,"the holiday, even with the rain... MOVING POV - ON THE SIDEWALK"
desc8.22,desc,,"We PUSH INTO the sea of COSPLAYERS, CLOBBERS, TOURISTS..."
desc8.23,desc,,Hidden in the chaos... is the element. Waiting to strike like
desc8.24,desc,,A MALE FIGURE suddenly ENTERS FRAME
utter8.25,utter,VOICE OVER,"But I'm there too, watching ..."
desc8.26,desc,,"FOLLOW FROM BEHIND as he WALKS in ARMY JACKET, KNIT CAP, a DUFFEL on his shoulder. He looks like a DRIFTER... SUPER-TIGHT ON THE DRIFTER'S INTENSE EYES AS HE WALKS... VOICE OVER Two years of nights have turned me"
desc8.27,desc,,senses are heightened now... I can almost smell them...
scene9,slugline,,EXT. BODEGA - MOVING POV TOWARD THE WINDOW - NIGHT
desc9.28,desc,,PEER IN at the few COSTUMED SHOPPERS inside; a GUY in a HOODIE and YELLOW SAD EMOJI MASK steps to the counter VOICE OVER I must choose my targets carefully... Sad Emoji NERVOUSLY PULLS A GUN on the CASHIER! C' mon... ! SAD EMOJI
scene10,slugline,,EXT. COLOSSAL GOTHAM BANK - MOVING POV - NIGHT
desc10.29,desc,,"We SPY THREE VANDALS, SPRAY-PAINTING the huge pi llars"
desc10.30,desc,,"It's a big city, I can't be everywhere... THE VANDALS wear GUY FAWKES MASKS -- one LIGHTS A MOLOTOV COCKTAIL -- HURLS IT, SHATTERING THE GLASS FRONT DOOR -10 INT. A SPEEDING ELEVATED TRAIN - LURKING POV - NIGHT WE PEER THROUGH the CONNECTING DOOR INTO THE CAR AHEAD where EIGHT GANG MEMBERS in SKULL FACE PAINT carouse -VOICE OVER But they don't know where I am... THE CAR AHEAD The gang crowds, jockeying to see a CELLPHONE VIDEO."
scene11,slugline,,10/25/19 (October Shooting D raft)
desc11.31,desc,,"TIGHT ON THE VIDEO THE GANG striding through a park -- ONE points at a RANDOM JOGGER -- ANOTHER responds, PUNCHING HIM OUT! THE GANG WATCHING THE CELLPHONE recoils with LAUGHTER -- when THE GANG LEADER notices a LONE PASSENGER rising as the TRAIN SLOWS. He turns to a YOUNGER MEMBER, nodding toward the Passenger with a menacing smile -- as the Y oung Member looks anxiously"
scene12,slugline,,EXT. A SHADOWY SPACE - NIGHT
desc12.32,desc,,"FINGERS QUICKLY SMEAR BLACK CAMO PAINT around fierce eyes, veiled in darkness -- as we spot THE DRIFTER'S ARMY DUFFLE on wet ground -- inside, we GLIMPSE THE BAT COWL!"
scene13,slugline,,EXT. ROOFTOP - ON THE RUSTED SEARCHLIGHT - NIGHT
desc13.33,desc,,A crude but ICONIC BAT SYMBOL BLAZES at its center
utter13.34,utter,VOICE OVER,We have a signal now... for when I'm needed...
desc13.35,desc,,"REVEAL A SILHOUETTED MAN beside the light, waiting VOICE OVER But when that light hits the sky, it's not just a call... He's perched atop an ABANDONED, HALF-BUILT SKYSCRAPER - THE BRIGHT BEAM REACHES UPWARDS, sparkling in the rain -VOICE OVER It's a warning. T o them..."
scene14,slugline,,OUTSIDE THE BODEGA
desc14.36,desc,,"Sad E moji BOLTS OUT toward a DARK ALLEY -- when he spots TWO PEDESTRIANS GAPING UP AT THE SKY IN ALARM -- he slows, peering up to SEE -- THE BAT SIGNAL LOOMING! VOICE OVER Fear is a tool... Sad E moji stops, panic dawning as he turns to the DARK ALLEY -- he backs away, into the street -- a CAR SKIDS, HITTING HIM! He DROPS -- but fear lifts him, and he just keeps running -- the sounds of a HELICOPTER grow as we --"
scene15,slugline,,EXT. COLOSSAL GOTHAM BANK - NIGHT
desc15.37,desc,,"ON A VANDAL -- hearing the copter, he peers up at -- A POLICE CHOPPER SOARING PAST THE BAT SIGNAL IN THE CLOUDS! VOICE OVER They think I'm hiding in the shadows... He drops his spray can, startled as it CLATTERS! It rolls ominously under a DARK ARCHWAY -- he stares, chilled -VOICE OVER But I fill! the shadows. A SIREN APPROACHES -- the VANDAL SPINS -- joining the others as THEY FLEE -- we see the painted letters spell ""BROKE!"" on the pillars; behind, A FIRE RAGES in the building -- FLAMES RISE as a MENACING LOW RUMBLE BUILDS and with a STARTLING BURST of METALLIC SCREECHING, we"
scene16,slugline,,EXT. ELEVATED TRAIN PLATFORM - POURING RAIN - NIGHT
desc16.38,desc,,"The TRAIN SCREECHES TO A STOP -- our Lone Passenger emerges onto the deserted platform -- when he hears FOOTSTEPS and LAUGHTER behind -- he TURNS, startled The EIGHT SKULL FACED G ANG MEMBERS are behind him. The Young Member stands coiled -- a haunted look in his eyes -- the others watch with PHONES raised, filming DO it, man...! ONE OF THE MEMBERS He hesitates, losing nerve -- and the Passenger BOLTS! GET HIM! THE LEADER The GANG PLOUGHS FORWARD KNOCKING the YOUNG MEMBER DOWN as they RACE PAST -- ! THEY POUNCE ON THE PASSENGER! CLOSE ON THE YOUNG GANG MEMBER -- the TRAIN ROARING OFF beside him -- WHEN HE SPOTS THE BAT SIGNAL IN THE SKY! His EYES DART around -- AS SCREAMS APPROACH; he turns -The LEADER YANKS the YOUNG MEMBER to his feet -- while the GROUP holds the PASSENGER -- a DREADFUL SILENCE settling over the station as the train roar recedes..."
utter16.39,utter,THE LEADER,Now knock his ass out...
desc16.40,desc,,"The Young M ember stares, steeling himself SLOW BOOTSTEPS ECHO from somewhere in the station - Everyone turns, looking anxiously around -- THE YOUNG MAN 'S EYES STARE into a DARK VOID beneath an overhang THE OTHERS LOOK TOO -- AS -- CLICK ... CLICK ... CLICK ... A MASKED FIGURE SHROUDED IN BLACK APPEARS LIKE AN APPARITION FROM THE SHADOWS -- STEPPING INTO THE RAIN IT'S THE BATMAN. Everyone stares, unnerved. The Leader smirks, sizing up what he assumes is just another Halloween costume -THE LEADER The hell are you supposed to be? Batman stands there for a long, scary beat, eyes veiled:"
utter16.41,utter,THE BATMAN,I'm vengeance.
desc16.42,desc,,"The unsettling effect of this response has barely an instant to register before BATMAN stalks for THE LEADER ONE OF THE GANG MEMBERS Holy shit -- it's him -- !!! THE LEADER raises his hands ready to fight -- but totally unprepared for this fight -- because -- BATMAN'S MOVEMENTS ARE INCONCEIVABLY BRUTAL AND FAST -The LEADER SWINGS -- BATMAN SEIZES HIS ARM -- a martial artist's savage grace -- using his attacker's momentum to WRENCH HIM OFF BALANCE -- SNAPPING HIS ARM SICKENINGLY - THE LEADER SCREAMS -- as BATMAN SILENCES HIM AGAIN WITH A RAIN OF HEAD-SNAPPING JACKHAMMER PUNCHES IN THE FACE And like that, the Leader is down, bleeding, moaning -Batman looks up at the others, who gaze back, stunned - when a TRIO OF GANG MEMBERS RUSH HIM -- CHAOS -- as BATMAN DISPENSES WITH THEM ALL AT ONCE in a FLUID, BUT TOTALLY STREET-FIGHT REALISTIC ATTACK of KICKS and HARD FIST BLOWS -- BATMAN TAKES HITS TOO -- but his TERRIFYING SKILL keeps impact from landing -- HE'S LIKE A MACHINE Panic rips through the gang -- the YOUNG MEMBER'S eyes widen as he SEES -- SOMEONE PULLING OUT A .38 SPECIAL -YOUNG GANG MEMBER HEY MAN -- NO -- NO -- ! BATMAN SPINS -- SEEING THE GUN -- STARTS RIGHT FOR IT - THE GANG MEMBER OPENS FIRE! BATMAN FLINCHES as the BULLETS DISAPPEAR into his suit's BALLISTIC FIBER -- HE GRABBING THE MEMBER'S STILL-FIRING GUN ARM IN ADVANCES ONE HAND -- AND HIS THROAT IN THE OTHER -(CONTINUED) AS THE GANG SCATTERS FROM THE BULLETS -- A BRIGHT BLUE TASER CURRENT ZAPS FROM BATMAN'S GLOVED FINGERS INTO THE GANG MEMBERS NECK! The Gang Member DROPS, CONVULSING! Batman slowly lifts his head, looking for more comers... The few remaining on their feet gape -- frozen -- Batman watches -- as they BREAK INTO A RUN -- all -- EXCEPT - the Youngest Gang Member -- who hesitates briefly under Batman's stone-faced gaze -- in awe -- then, races off ... Batman looks down to discover the Passenger, knocked to the ground in the chaos; he RAISES HIS HANDS, terrified -PASSENGER ...please don't hurt me... Batman just gazes strangely, cocking his head, taking a step slowly toward him -- the Passenger BRACES HIMSELF - as Batman PEERS DOWN at SOMETHING BESIDE THE PASSENGER'S HEAD -- a REFLECTION on the wet ground -- THE BAT SIGNAL! Batman LOOKS UP -- wondering how long it's been there -17"
scene17,slugline,,INT. MAYOR'S TOWNH OUSE - MOVING DOWN THE HALL - NIGHT
desc17.43,desc,,"FILLED WITH HUSHED COPS now; some turn as they NOTICE US, STARING WITH HARSH EDGE -- like what is he doing here?! REVEAL BATMAN, striding, unfazed, led by LIEUTENANT JAMES GORDON, mid-40s -- the Man we saw by the Bat Signal AT THE ENTRANCE TO THE STUDY A UNIF ORMED OFFICER steps into Batman's path -- ALARMED - YOUNG OFFICER Whoa-whoa-whoa -- police action Batman glares down at the Officer's hand on his chest -"
utter17.44,utter,G ORDON,"He's with me, Officer"
utter17.45,utter,YOUNG OFFICER,"Are ya-- are ya kiddin' me, sir? You gonna let him in here...?"
utter17.46,utter,G ORDON,"Let him pass, Martinez."
desc17.47,desc,,The Officer turns in disbelief; steps aside -
utter17.48,utter,YOUNG OFFICER (MARTINEZ),...goddamn freak...
scene18,slugline,,02/09/20 (White February S hooting Script)
desc18.49,desc,,"MITCHELL lies dead, HEAD MUMMIFIED IN DUCT TAPE -- over his mouth in red it says: ""NO MORE LIES"". INVESTIGATORS TURN IN UTTER S HOCK at BATMAN APPROACHING WITH GORDON -GORDON What do we know? The LEAD is rattled as Batman stares at the body - Detective --"
utter18.50,utter,GORDON LEAD DETECTIVE,"Sorry, Lieutenant... OK, yeah, we got... blunt-force trauma, lacerations on the head. He got hit alotta times, and hard."
utter18.51,utter,GORDON,All this blood's from his head?
desc18.52,desc,,"LEAD DETECTIVE Most of it's from his hand -CLOSE ON BATMAN staring, as the Detective LIFTS THE HAND INTO FRA ME, SOFT FOCUS FOREGROUND -- showing GORDON LEAD DETECTIVE Thumb was severed. Killer may have"
utter18.53,utter,BATMAN,He was alive when it was cut off.
desc18.54,desc,,"Appalled, they turn to Batman, who stares at the hand - Ecchymosis around the wound -He rises to survey the area. Thrown by the interruption, the Detective watches him go -- turns back to Gordon:"
utter18.55,utter,DETECTIVE,Security detail downstairs says the family was out trick-or treating. Mayor was up here alone.
desc18.56,desc,,"Killer came throu g h the skylight. Batman sees a PHOTOGRAPHER flash a shot of BLOOD SPATTER on the FRAMED MARONI DRUG BUST HEAD LINE on the wall - when Batman CLOCKS a FRESH GAS H IN THE WOOD FLOOR (the spot w here the strange metal tool landed in our opening). He goes to examine it -- the PHOTOGRAPHER suddenly noticing -- it's a detail he obviously missed -- as soon as Batman rises -- he hustles over -- SNAPS A SHOT -GORDON You said there was a card -The Detective hands over AN ENVELOPE. Gordon pulls out a HALLMARK-STYLE HALLOWEEN CARD: a CREEPY SKELETON SMILES behind a WIDE-EYED OWL, tapping his shoulder"
desc18.57,desc,,"""From a secret friend ... Who?"""
desc18.58,desc,,"Batman peers, as Gordon reads the KILLER'S SCRAWL -"
utter18.59,utter,GORDON,"""What does a liar do when he's dead?"""
desc18.60,desc,,WEIRD SYMBOLS ARE ETCHED at the bottom -- Gordon pulls a PIECE OF PAPER from the envelope -- MORE WEIRD SYMBOLS
utter18.61,utter,GORDON,There's a cipher too... Any of this... mean anything to you...?
desc18.62,desc,,"Gordon pointedly shows Batman THE ENVELOPE stares, struck -- but before he can speak --"
desc18.63,desc,,"A QUIET, ALARMED VOICE (O.S.) What's goin' on here? Everyone turns to see COMMISSIONER PETE SAVAGE, mid-50s - appalled at the sight of Batman"
utter18.64,utter,GORDON,"I asked him to come, Pete -COMMISSIONER SAVAGE This is a crime scene -- it's Mitchell, for C hrissakes -- I got press downstairs -- ! ( then, darker) You know I cut you a lotta slack, Jim, 'cuz we got history, but this is way over the line... !"
desc18.65,desc,,"Gordon hands him the card; Savage reads in horror - when, he sees THE ENVELOPE -- where he -- and we - DISCOVER it's addressed: ""TO THE BATMAN"" -(CONTINUED)"
scene19,slugline,,02/09/20 (White February Shooting Script)
utter19.66,utter,COMMISSIONER SAVAGE,Wait -- he's involved in this -- ?
utter19.67,utter,GORDON,"No, no -- he's not involv--"
utter19.68,utter,COMMISSIONER SAVAGE,How do you know? He's a he's a goddamn vigilante - he could be a suspect! Whattaya doing to me --  used to be partners
utter19.69,utter,GORDON,Pete -- I'm just looking for the connection -BATMAN (O.S .) He lies still...
desc19.70,desc,,"They turn -- to see Batman, eyes fixed on the body -"
utter19.71,utter,COMMISSIONER SAVAGE,Excuse me -- ?
utter19.72,utter,GORDON,"(getting it, nodding) The riddle. ""What does a liar do"
desc19.73,desc,,"when he's dead"" ...? He lies still. Unnerv ed by all this, Savage looks bitterly at Batman -COMMISSIONER SAVAGE"
desc19.74,desc,,AN OFFICER appears in the doorway -ANOTHER OFFICER
desc19.75,desc,,"Savage sighs, nods -- turns to Gordon, deadly serious"
utter19.76,utter,COMMISSIONER SAVAGE,I want him outta here. Now.
desc19.77,desc,,"And he leaves. As the POLICE ALL GLAR E, Gordon starts to lead Batman out -- but Batman stops, spotting something - a BLOODY FOOTPRINT, child sized -- Gordon sees it, grim:"
utter19.78,utter,GORDON,"Yeah, kid was the one found him."
desc19.79,desc,,"Batman looks up at him disturbed: what kid...? THE LITTLE RED NINJA SITTING ON A BED IN A CHILD'S ROOM Without his mask, we see now it's a TEN-YEAR-OLD BOY. We look through the doorway at him as he stares down, lost, surrounded by COPS. Finally, he LOOKS UP at us -REVEAL BATMAN gazing back through the doorway. As MORE COPS BEGIN TO NOTICE HIM -- Gordon, beside him, WHISPERS:"
utter19.80,utter,GORDON,"We... really gotta go, man ..."
desc19.81,desc,,"Batman nods, but stays a moment longer -- the aching, opening chords of NIRVANA'S ""S OMETHING IN THE WAY"" BEGIN; HOLD as Batman stares from somewhere under that mask.. . an unspoken connection to this newly fatherless boy..."
utter19.82,utter,COMMISSIONER SAVAGE (PRELAP),"Tonight, a son lost a father..."
scene20,slugline,,EXT. MAYOR'S MANSION - FRONT STEPS - PRE-DAWN
desc20.83,desc,,A press conference; MITCHELL'S WIFE cries behind Savage -COMMISSIONER SAVAGE ...a wife lost a husband. And I
desc20.84,desc,,"DISTANT PERSPECTIVE ON THE PRESS CONFERENCE - SAME MOMENT An ENGIRE PURRS; PULL BACK TO REVEAL we're LOOKING PAST A FIGURE -- THE DRIFTER. He watches from the shadows across the street on a n old, unpainted CAFE RACER MOTORCYCLE; he pulls on a HELMET ... CLOSE ON the dark, full face visor -VOICE OVER I wish I could say I'm making a difference... but I don't know..."
scene21,slugline,,EXT. GOTHAM - MOVING THROUGH THE STREETS - PRE-DAWN
desc21.85,desc,,NIRVANA SWELLS as we CHASE the BIKE through LOWER GOTHAM; the PRESS CONFERENCE BLAZES on DECAYING JUMBOTRONS --
utter21.86,utter,VOICE OVER,"Murder, robberies, assault -- two years later, they're all up... And now this..."
desc21.87,desc,,"-- PASSING TENT CITIES, HALTED CONSTRUCTION SITES UNDER SIG NS: ""A GOTHAM RENEWAL PROJECT"" -- PLASTERED OVER SOME ARE BELLA REAL CAMPAIGN BILLS: ""TIME FOR A REAL CHANGE"" -VOICE OVER The city's eating itself ... Maybe it's beyond saving... -- ALONG ONE OF THE B RIDGES SPANNING THE ISLANDS OF GOTHAM -- SK YLINE BEHIND -- A MASSIVE SEA WALL BELOW"
utter21.88,utter,VOICE OVER,But I have to try. Push myself ...
desc21.89,desc,,"-- UNTIL WE SOAR OVER THE BIKE AS IT TEARS THROUGH A ROLLING CITY PARK -- DOWN A NARROW ROAD -- DISAPPEARING INTO A TUNNEL UNDER A BEAUTIFUL, ARCHING B RIDGE -- WE TIP UP TOWARD THE DISTANCE, TO SEE IT'S HEADING TOWARD -A GOTHIC 1920S BUILDING BELOW THE PARK: WAYNE TOWER --"
scene22,slugline,,"INT. NARROW, OLD TUNNEL - PRE-DAWN The bike rips down a secret passage from a bygone era -26"
desc22.90,desc,,"INTO THE UNDERG ROUND FOUNDATION OF WAYNE TOWER The Drifter SKIDS to a stop, HUNDREDS OF CREATURES all along the rock cei ling STIR ANXIOUSLY TO LIFE -- BATS ... VOICE OVER These nights all roll together, in a rush... behind the mask ... ...as he rem oves his helmet -- and we f inally SEE BRUCE"
desc22.91,desc,,"hands ome, 30, black camo still around his eyes. SUPER TIGHT -- FINGERS REMOVING CONTACT LENSES -- ON THE CURVED SURFACE OF THE LENSES ARE TINY SENSOR BANDS -VOICE OVER Sometimes, in the morning, I have to force myself to remember... CLOSE ON GR AINY VIDEO FOOTAGE -- the gang member from last night LOOKS AT US as he gets tased in the neck -VOICE OVER ...everything that happened."
scene23,slugline,,02/09/20 (White February Shooting Script)
desc23.92,desc,,"OCT. 31"" -- ""NOCTURNAL ANIMAL"" -- ""PUSH MYSELF"" -- a PEN FINISHES the entry -- as the journal shuts, we see THE COVER: ""NOTES & OBSERVATIONS {GOTHAM PROJECT) YR. 2"" REVEAL BRUCE - HIGH ANGLE OVER ""THE CAVE"" - EARLY MORNING NIRVANA ECHOES as Bruce REVIEWS FOOTAGE at a work bench in a giant boiler room turned survivalist chop shop - PROJECTS IN VARIOUS STATES, including A HALF-BUILT, BLACK MUSCLE CAR, both retro and like nothing we've ever seen. A TV plays GCl; the headline, ""MAYOR MITCHELL MURDERED"" below it: ""ACTING MAYOR TOMLIN TO RUN IN HIS PLACE"""
desc23.93,desc,,...this certainly isn't the first time Gotham has been rocked by the
desc23.94,desc,,"remains unsolved to this day -Bruce's eyes go to the TV; when from the FREIGHT ELEVATOR steps ALFRED, 50s, muscular, waistcoat and shirtsleeves - he walks on an elegant CANE, SCAR on his face, eyes on the TV -- seeing him, Bruce resumes work -- Alfred turns to Bruce -- an unspoken tension; Bruce avoids his gaze -ALFRED I assume you heard about this ... ? Yeah."
desc23.95,desc,,Alfred suddenly notices the CONTACTS LENS MURDER SCENE FOOTAGE Bruce is hi-speeding through -- moves closer -ALFRED Oh. I see... (off Mitchell's body)
desc23.96,desc,,"As the CIPHER fills the screen, Bruce FREEZES the image, PRINTING it -- Alfred looks chilled -- as Bruce works -ALFRED The killer left this for Batman?"
scene24,slugline,,02/09/20 (White February Shooting Script)
utter24.97,utter,BRUCE ALFRED,You're becoming quite a celebrity . ...why is he writing to you?
utter24.98,utter,BRUCE,I don't know yet.
utter24.99,utter,ALFRED,Have a shower. The accounting boys from Wayne Enterprises are coming for breakfast. Here -- why
utter24.100,utter,BRUCE,?
utter24.101,utter,ALFRED,Because I couldn't get you to go there --
utter24.102,utter,BRUCE,I don't have time for this.
utter24.103,utter,ALFRED,"(a tense beat) It's getting serious, Bruce. If this continues, it won't be long before you've nothing left -BRUCE I don't care about that. Any of that."
utter24.104,utter,ALFRED,... you don't care about your family's legacy?
utter24.105,utter,BRUCE,"What I'm doing is my family's legacy -- and if I can't change things here, if I can't have an effect, then I don't care what happens to me -ALFRED That's what I'm afraid of -BRUCE Stop. You're not my father, Alfred."
utter24.106,utter,ALFRED,(a thin smile) I'm ... well aware.
scene25,slugline,,02/09/20 (White February Shooting Script)
desc25.107,desc,,"Bruce rises -- Alfred watches him go, pained. Then turns to the computer, seeing THUMBNAILS from the lens footage; one is THE BOY IN NINJA COSTUME. He clicks it; the boy looks up, sad. Alfred stares, deeply affected. Alfred's eyes drift to the PRINTED CIPHER. His gaze fixes on words Bruce has written above the eerie symbols in the Halloween card: ""HE LIES STILL"" . . ."
scene26,slugline,,INT. WAYNE TOWER - GRAND FOYER - MOVING - MORNING
desc26.108,desc,,"Atop the staircase, we start on a SET OF DOUBLE DOORS a THICK CHAIN coiled crudely through the handles, a PADLOCK sealing us off from whatever is beyond -- Bruce moves past, down stairs, wet hair, pulling on a t-shirt muscular but underweight like a rock star -- a street fighter's scars and bruises -- MOVE with him, through the apartment's hotel-like scale -- and neglect that has left dirt and disrepair over former grandeur -- he ENTERS -THE DINING ROOM -- to find Alfred at the table, irranersed in what looks like a crossword -- without looking up, Alfred points -ALFRED Some fresh berries there... Bruce squints, unaccustomed to morning; grabbing berries, he pulls out sunglasses -- when he sees Alfred's working on the CIPHER; Alfred's interest breaks the ice -BRUCE ... what're you doing?"
utter26.109,utter,ALFRED,Just reminiscing about my days in the Circus. This is actually quite... elusive.
utter26.110,utter,BRUCE,Where'd you get the O's?
utter26.111,utter,ALFRED,"""He lies still"" is only a partial"
desc26.112,desc,,"key. It only gives us H, E, L, I,"
desc26.113,desc,,"double symbols to start, trying"
scene27,slugline,,10/25/19 (October Shooting D raft)
desc27.114,desc,,An ELDERLY MAID appears in the doorway The gentlemen are here. Alfred discreetly closes his newspaper over the cipher
utter27.115,utter,ALFRED,"See them in please, D ory ..."
scene28,slugline,,THE D INING ROOM - MOMENTS LATER
