segment-id,segment-type,segment-speaker,segment-text
desc52.670,desc,,"A second book opens; another ""Pop-Up"" set appears."
desc52.671,desc,,"""LADY HYACINTH MACAW"" BROUGHT ALL HER TREASURES TO A REEF"
desc52.672,desc,,WHERE SHE ONLY WORE A SMILE
desc52.673,desc,,PLUS TWO FEATHERS AND A LEAF
desc52.674,desc,,SO NO ONE TRIED TO ROB HER CAUSE SHE BARELY WORE A STITCH
desc52.675,desc,,"FOR WHEN YOU'RE IN YOUR BIRTHDAY SUIT MARY POPPINS AND JACK THERE AIN'T MUCH THERE TO SHOW YOU'RE RICH! MARY POPPINS, JACK & ALL OH, A COVER IS NOT THE BOOK SO OPEN IT UP AND TAKE A LOOK CAUSE UNDER THE COVERS ONE DISCOVERS THAT THE KING MAY BE A CROOK TA-RU-RA-LEE TA-RU-RA-LA TA-RU-RA-LEE TA-RA-TA-TA MARY POPPINS & JACK YOU'LL FIND YOUR FIRST IMPRESSION WAS MISTOOK (YA-DA-DA-DA) FOR A COVER IS NICE BUT A COVER IS NOT THE BOOK!"
utter52.676,utter,MARY POPPINS,"Give us the one about the ""Dirty Rascal,"" why don't you?"
utter52.677,utter,JACK,"(Aside, worried:) Isn't that one a bit long?"
utter52.678,utter,MARY POPPINS,"Well the quicker you're into it, the quicker you're out of it."
desc52.679,desc,,"The final ""Pop-Up"" book opens. Mary Poppins turns to the Conductor, tapping her cane on the stage in double time. The tempo gets very fast. Jack, wide-eyed, launches into a ""period rap"" of sorts as he scales the set."
desc52.680,desc,,ONCE UPON A TIME/ IN A NURSERY RHYME/ THERE WAS A CASTLE WITH A KING/ HIDING IN A WING/ CAUSE HE NEVER WENT TO SCHOOL TO LEARN A SINGLE THING HE HAD SCEPTERS AND SWORDS/ AND A PARLIAMENT OF LORDS/ BUT ON THE INSIDE HE WAS SAD/ EGAD!/ BECAUSE HE NEVER HAD A WISDOM FOR NUMBERS/ A WISDOM FOR WORDS/ THOUGH HIS CROWN WAS QUITE IMMENSE/ HIS BRAIN WAS SMALLER THAN A BIRDS
desc52.681,desc,,"PROFESSORS""/ THEN SHE WENT TO THE HAIR DRESSERS AND THEY CAME FROM THE EAST/ AND THEY CAME FROM THE SOUTH/ FROM EACH COLLEGE/ THEY POURED KNOWLEDGE/ FROM THEIR BRAINS INTO HIS MOUTH DATE/ I STATE/ THEIR WIVES ALL GOT A NOTE/ THEIR MATE WAS NOW THE LATE GREAT! BUT THEN SUDDENLY ONE DAY/ A STRANGER STARTED IN TO SING/ HE SAID ""I'M THE DIRTY RASCAL/ AND I'M HERE TO TEACH THE KING!"" AND THE QUEEN CLUTCHED HER JEWELS/ FOR SHE HATED ROYAL FOOLS/ BUT THIS FOOL HAD SOME RULES/ THEY REALLY OUGHT TO TEACH IN SCHOOLS THE KIND OF PERSON THAT YOU'RE NOT FOUND A FRIEND/ AND THEY RAN ONTO A RAINBOW FOR THE STORY'S PERFECT END/ SO THE MORAL IS YOU MUSTN'T LET/ THE OUTSIDE BE THE GUIDE/ FOR IT'S NOT SO CUT AND DRIED/ WELL UNLESS IT'S DR. JEKYLL,/ THEN YOU BETTER HIDE/"
desc52.682,desc,,"NO, THE TRUTH CAN'T BE DENIED/ AS IS THE SPECIAL STUFF INSIDE! Jack reaches the top of the set as the audience cheers."
utter52.683,utter,AUDIENCE,Hooray!... He did it!
desc52.684,desc,,"Mary Poppins bursts through the back of the pop-up set, rejoining Jack and leading the Penguins and a CHORUS LINE OF DANCING ANIMALS down a grand staircase. MARY POPPINS, JACK & ALL OH, A COVER IS NOT THE BOOK SO OPEN IT UP AND TAKE A LOOK CAUSE UNDER THE COVERS ONE DISCOVERS THAT THE KING MAY BE A CROOK"
desc52.685,desc,,SO PLEASE LISTEN TO WHAT WE'VE SAID
utter52.686,utter,JACK,AND OPEN A BOOK TONIGHT IN BED
desc52.687,desc,,MARY POPPINS & JACK SO ONE MORE TIME BEFORE WE GET THE HOOK
utter52.688,utter,JACK,Sing it out strong...!
desc52.689,desc,,AUDIENCE & ANIMALS A COVER IS NICE
utter52.690,utter,MARY POPPINS,PLEASE TAKE OUR ADVICE
desc52.691,desc,,AUDIENCE & ANIMALS A COVER IS NICE
utter52.692,utter,JACK,OR YOU'LL PAY THE PRICE!
desc52.693,desc,,"AUDIENCE & ANIMALS A COVER IS NICE MARY POPPINS, JACK & ANIMALS BUT A COVER IS NOT THE BOOK!!! AUDIENCE & CHILDREN TA-RU-RA-LEE TA-RU-RA LA-LA-LA!!! The crowd cheers. In the audience, Georgie notices that Gillie is gone. He looks around; the Wolf is CASTING A LARGE SHADOW onto the canvas wall of the tent as he swings his pocket watch outside. The shadows of the Badger and the Weasel come into view as they cross back and forth carrying things. Georgie recognizes one of the items as Gillie. Gillie!"
desc52.694,desc,,"As Mary and Jack take their bows, Annabel suddenly realizes that Georgie is gone."
utter52.695,utter,ANNABEL,Where's Georgie?
utter52.696,utter,JOHN,I don't know.
desc52.697,desc,,They look over just as he leaves through a tent flap. They panic and rush after him.
scene53,slugline,,EXT. BEHIND THE MUSIC HALL TENT (ANIMATED) - NIGHT
desc53.698,desc,,"Georgie comes out of the tent. The Wolf, Badger and Weasel stand near a period moving van - a motorized cab with an oldfashioned steam engine that pulls a slatted wagon. They are loading the wagon with all the real belongings from the children's nursery (not animated)."
utter53.699,utter,GEORGIE,What are you doing?
utter53.700,utter,WOLF,"Well, well - if it isn't the boy who cracked the bowl. We've waited a long time for you Banks children to come and visit us - so we could pay a visit to your nursery."
utter53.701,utter,GEORGIE,But those are our things!
utter53.702,utter,WOLF,"Not anymore, they aren't."
utter53.703,utter,GEORGIE,Give Gillie back!
desc53.704,desc,,"Georgie rushes at the wagon, grabbing Gillie out of the back. The Badger tries to grab it back, but Georgie won't let go."
utter53.705,utter,GEORGIE (cont'd),He's mine! My mother made him for me!
desc53.706,desc,,"John and Annabel run out from the tent, shouting."
utter53.707,utter,ANNABEL,Hey! Leave our brother alone!
desc53.708,desc,,The Wolf cranks the engine and climbs into the cab.
utter53.709,utter,WOLF,"Time to go, boys!"
desc53.710,desc,,"The Badger and the Weasel throw boy and giraffe together into the wagon. They slam the slatted door and jump into the cab. The moving van roars off through the back gates, engulfing Annabel and John in exhaust smoke..."
desc53.711,desc,,Annabel! Help! John!
scene54,slugline,,ANNABEL AND JOHN
desc54.712,desc,,John and Annabel chase after Georgie...
scene55,slugline,,EXT. DARKER PATHS THROUGH THE PARK (ANIMATED) - NIGHT
desc55.713,desc,,"... down far darker, more ominous paths than the lovely cobblestone road that led up to the gates."
utter55.714,utter,JOHN,We're coming Georgie!
utter55.715,utter,GEORGIE,(Shouts:) Let me go! I want to go home!
utter55.716,utter,WOLF,(Calling back:) What home? You've lost your home!
desc55.717,desc,,"The twins give chase, but the moving van is getting away - they slow down, exhausted, when suddenly the carriage driven by the Coachman appears out of the shadows behind them. John and Annabel gasp. A hand reaches down and pulls them into the carriage. Seamus turns around to them."
utter55.718,utter,Shamus!,Clyde!
utter55.719,utter,ANNABEL JOHN COACHMAN,That's right - it's us!
utter55.720,utter,HORSE,Let's go get your brother back!
desc55.721,desc,,The chase is on. The two vehicles screech and slide on the china's glazed surface.
utter55.722,utter,COACHMAN,We're gaining on them!
utter55.723,utter,WOLF,Give it more speed!
desc55.724,desc,,"The Badger shovels more coal into the steam engine. As the van banks up the side of the bowl, Georgie is thrown to the side of the tipping wagon. The carriage is closing in."
utter55.725,utter,COACHMAN,"Giddy up, big fella!"
desc55.726,desc,,The carriage tips and drives up the side of the bowl. The Wolf swerves left and right cutting them off. The carriage closes the gap.
utter55.727,utter,COACHMAN (cont'd),(To horse:) Almost there.
desc55.728,desc,,John reaches out to Georgie.
desc55.729,desc,,The carriage manages to pull alongside the moving van. The twins ready themselves.
utter55.730,utter,JOHN (cont'd),"READY, AND - NOW!"
desc55.731,desc,,- and they leap onto the wagon.
utter55.732,utter,COACHMAN,Well done children!
utter55.733,utter,HORSE,Give 'em what for!
desc55.734,desc,,The carriage recedes into the distance.
utter55.735,utter,WOLF,"Get rid of them! But, sir -"
utter55.736,utter,WEASEL WOLF,You heard me!
desc55.737,desc,,The Weasel and the Badger climb out and crawl towards the children. John and Annabel look down at Georgie.
utter55.738,utter,ANNABEL,Oh Georgie! Are you alright?
desc55.739,desc,,John looks up.
utter55.740,utter,JOHN,"Annabel, look."
desc55.741,desc,,"Annabel turns and sees the Badger and Weasel closing in. She reaches down, grabs a cricket bat from the nursery belongings and swings at the Weasel. The bat misses them and goes flying, chipping the bowl. The chip hits the Badger, who slams into the Weasel, knocking both off the wagon."
utter55.742,utter,JOHN (cont'd),(To Annabel:) Stay with Georgie.
desc55.743,desc,,Annabel lowers herself into the wagon. She hugs Georgie. They watch as John crawls forward.
utter55.744,utter,ANNABEL,Be careful!
utter55.745,utter,GEORGIE,What are you doing?
desc55.746,desc,,"John pulls out the pin, detaching the wagon from the cab. He did it!"
scene56,slugline,,ANNABEL
desc56.747,desc,,"John makes his way along the bar back towards the wagon and climbs into the carriage. The Wolf grabs the stoking shovel and swings it hard, hitting the bowl and creating a deep crack in the bowl which travels towards the children's wagon. The wagon wheel hits the crack which splinters off. They fly up the side of the bowl like a runaway roller coaster. The Wolf loses control of the cab and careens off a bridge into the water. The frightened children see an ominous sign ahead: ""Caution: Edge of Bowl!"""
scene57,slugline,,ANNABEL (cont'd)
desc57.748,desc,,"THE CHILDREN THE EDGE OF THE BOWL! The children scream as the wagon flies off the edge. They fall into space, twisting and turning in slow motion..."
scene58,slugline,,INT. THE NURSERY - NIGHT
desc58.749,desc,,END OF ANIMATION
scene59,slugline,,SEQUENCE.
desc59.750,desc,,"Georgie is in his bed, back in his nightclothes again. He tosses and turns in his sleep. Mary Poppins sits next to him."
utter59.751,utter,MARY POPPINS,"It's alright, Georgie, it's alright. You were been having a"
desc59.752,desc,,"nice sort of nightmare, I must say. Mary Poppins turns on his bedside lamp."
utter59.753,utter,GEORGIE,"You were right, Mary Poppins! A cover is not the book! We thought they were nice, but they were mean!"
utter59.754,utter,MARY POPPINS,Whatever are you talking about?
utter59.755,utter,GEORGIE,They tried to take Gillie!
utter59.756,utter,MARY POPPINS,"Gillie is right here, sleeping - as you should be."
desc59.757,desc,,She moves the giraffe next to Georgie.
utter59.758,utter,GEORGIE,"But it was real! They stole all our things, and the wolf said we were never going to see our home again."
utter59.759,utter,MARY POPPINS,That's absurd.
desc59.760,desc,,"Mary Poppins stands goes to shut the window. She sees Jack cycling away outside, he waves up to her as he goes. John and Annabel climb out of their beds, awake as well."
utter59.761,utter,JOHN,"But I had a nightmare like that, too."
utter59.762,utter,ANNABEL,(Turning on light:) So did I. It seemed awfully real.
utter59.763,utter,GEORGIE,I don't want to lose our home.
desc59.764,desc,,"Georgie moves over and sits on Annabel's bed, cuddling Gillie."
utter59.765,utter,JOHN,"You see, Georgie? That's why we wanted mother's bowl; we were going to sell it to save the house."
utter59.766,utter,GEORGIE,(After a beat.) I miss mother.
desc59.767,desc,,"The room falls silent. Something flickers ever so briefly in Mary Poppins' eyes, and then she speaks."
utter59.768,utter,MARY POPPINS,"Listen to the three of you. You're all worrying far too much. After all, you can't lose what you've never lost."
utter59.769,utter,GEORGIE,I don't understand.
desc59.770,desc,,"""THE PLACE WHERE LOST THINGS GO"""
desc59.771,desc,,DO YOU EVER LIE AWAKE AT NIGHT JUST BETWEEN THE DARK AND THE MORNING LIGHT
utter59.772,utter,MARY POPPINS (cont'd),SEARCHING FOR THE THINGS YOU USED TO KNOW
desc59.773,desc,,"LOOKING FOR THE PLACE WHERE THE LOST THINGS GO DO YOU EVER DREAM OR REMINISCE? WONDERING WHERE TO FIND WHAT YOU TRULY MISS WELL MAYBE ALL THOSE THINGS THAT YOU LOVE SO ARE WAITING IN THE PLACE WHERE THE LOST THINGS GO MEMORIES YOU'VE SHARED GONE FOR GOOD YOU FEARED THEY'RE ALL AROUND YOU STILL THOUGH THEY'VE DISAPPEARED NOTHING'S REALLY LEFT OR LOST WITHOUT A TRACE NOTHING'S GONE FOREVER ONLY OUT OF PLACE... Mary Poppins puts John back to bed and tucks him in. She tucks Annabel into her bed. SO MAYBE NOW THE DISH AND MY BEST SPOON ARE PLAYING HIDE AND SEEK JUST BEHIND THE MOON WAITING THERE UNTIL IT'S TIME TO SHOW SPRING IS LIKE THAT NOW, FAR BENEATH THE SNOW HIDING IN THE PLACE WHERE THE LOST THINGS GO Mary Poppins takes Georgie's hand and leads him back to bed. Now, time to get some sleep. And in the morning, bright and early,"
desc59.774,desc,,(She tucks Georgie in.)
desc59.775,desc,,"SO SLEEP CAN COME AROUND FOR WHEN YOU DREAM, YOU'LL FIND ALL THAT'S LOST IS FOUND MAYBE ON THE MOON OR MAYBE SOMEWHERE NEW MAYBE ALL YOU'RE MISSING LIVES INSIDE OF YOU... SO, WHEN YOU NEED HER TOUCH AND LOVING GAZE GONE BUT NOT FORGOTTEN IS THE PERFECT PHRASE Mary Poppins walks over to the window, looking out toward a bright star in the night sky. SMILING FROM A STAR THAT SHE MAKES GLOW TRUST SHE'S ALWAYS THERE, WATCHING AS YOU GROW FIND HER IN THE PLACE WHERE THE LOST THINGS GO Mary Poppins walks out of the nursery, closing the pocket doors that lead to her room. Annabel, gets up, crossing to look out the window at the star. After a moment, she turns to go back to bed, but then she notices the bowl on the mantelpiece. She peers at it, her eyes growing wide."
utter59.776,utter,ANNABEL,(Quiet wonder:) John... look! Mary Poppins' scarf. It wasn't a dream after all...
desc59.777,desc,,John crosses to Annabel's side. She points at the carriage on the bowl; Mary Poppins' scarf is tied around the broken wheel. John is amazed.
utter59.778,utter,JOHN,Shall we tell her?
utter59.779,utter,ANNABEL,We'd better not. I expect she already knows.
scene60,slugline,,INT. MARY POPPINS' BEDROOM - CONTINUOUS
desc60.780,desc,,"Mary Poppins peers into the nursery through the glass in the pocket doors, having quietly listened to this last exchange. Satisfied, she steps away from the doors."
scene61,slugline,,EXT. ADMIRAL BOOM'S ROOFTOP/ HOUSE AT 17 CHERRY TREE LANE DAY
desc61.781,desc,,"Aunt Jane walks up the lane to the family home, carrying rally flyers; Jack is dousing the street-lamp in front of the house. The door opens on the roof of the Admiral's house. Binnacle pushes the Admiral out and blows his whistle. Big Ben begins to toll 8 a.m. The Admiral is enraged."
utter61.782,utter,ADMIRAL BOOM,Blast the devil - too soon! Why
desc61.783,desc,,"can't those pea-brained, Big Ben"
utter61.784,utter,AUNT JANE,(Turning to wave:) Good morning!
desc61.785,desc,,"She turns back around just as Jack slides down the lamp pole. The two collide, Aunt Jane's flyers going everywhere. OH!"
utter61.786,utter,AUNT JANE (cont'd) JACK,"Oh, dear - I am so sorry, miss!"
desc61.787,desc,,He scrambles to help her pick them up.
desc61.788,desc,,"Oh, it's alright - thank you Mary Poppins appears at the nursery window above."
utter61.789,utter,MARY POPPINS,"Good morning, Jane - I see you've"
desc61.790,desc,,bumped into Jack. The children and
utter61.791,utter,AUNT JANE,"Work calls, I'm afraid. We have a rally today."
utter61.792,utter,MARY POPPINS,That's right. You ought to give
desc61.793,desc,,Jack one of those flyers. Mary Poppins disappears from the window. As Jack continues rescuing Aunt Jane's flyers:
utter61.794,utter,JACK,"You're Miss Banks, aren't you? I don't know if you remember me, but I used to wave to you when I'd see you up there in that very window."
desc61.795,desc,,"In the background, Ellen peers through the letter box."
utter61.796,utter,AUNT JANE,"(Smiling:) Why, yes - Jack. I remember. Call me Jane, please."
utter61.797,utter,JACK,"'Course I was much younger then AUNT JANE True - but your smile hasn't changed a bit. (She hands him a flyer.) It's this afternoon, if you can come."
utter61.798,utter,JACK,"SPRUCE, eh? Good for you, Jane Banks - all us lamplighters know what a fine job you're doing for the workers."
utter61.799,utter,AUNT JANE,We do our best.
utter61.800,utter,JACK,"You ever need a ladder raised or a lamp lit, consider it done."
utter61.801,utter,AUNT JANE,"Why thank you, Jack - Thank you."
scene62,slugline,,INT. THE BANKS FRONT ENTRY HALL - CONTINUOUS
desc62.802,desc,,Ellen is still peering out through the letter box at Jack and Aunt Jane when Mary Poppins comes down the stairs carrying the Royal Doulton bowl in a cloth bag. She comes up behind Ellen.
utter62.803,utter,MARY POPPINS,Polishing the keyhole?
utter62.804,utter,ELLEN,"Look at that: Miss Jane's chattin' with that 'andsome lamplighter looks as though he's lit 'er up as well, don't it? Not that anythin'll ever come of it - she says that ship has sailed."
utter62.805,utter,MARY POPPINS,And I say there are always other ships.
desc62.806,desc,,"Michael rushes down the stairs with his briefcase, panicked."
utter62.807,utter,MICHAEL,My alarm clock didn't ring!
utter62.808,utter,MARY POPPINS,"Oh, dear - let me help you."
desc62.809,desc,,"Mary Poppins puts the bowl down on a side table and TAKES MICHAEL'S BRIEFCASE, handing it to Ellen. Michael gets his coat from the rack and puts it on while Mary Poppins retrieves his hat and umbrella."
utter62.810,utter,MICHAEL,I'm going to be late! That's all I need.
desc62.811,desc,,Mary Poppins hands him only his hat and umbrella.
utter62.812,utter,MARY POPPINS,You're not late yet. Off you go!
desc62.813,desc,,Mary Poppins opens the door as Michael runs out.
scene63,slugline,,EXT. THE HOUSE AT 17 CHERRY TREE LANE - CONTINUOUS
desc63.814,desc,,"Michael hurries out the front door of the house, barely noticing Jack and Aunt Jane as he passes them. An ELEGANT WOMAN approaches from the opposite direction, holding a piece of paper with an address on it."
utter63.815,utter,AUNT JANE,"Good morning, Michael."
utter63.816,utter,MICHAEL,"(Glancing back:) Hello - I have to run, forgive me."
utter63.817,utter,AUNT JANE,Watch where you're going!
desc63.818,desc,,Michael nearly runs into the ELEGANT WOMAN on the sidewalk.
desc63.819,desc,,"Sorry, excuse me He dodges the woman and hurries off down the street."
utter63.820,utter,AUNT JANE,(shaking her head) Michael!
utter63.821,utter,ELEGANT WOMAN,No it's fine. I'm looking for
utter63.822,utter,AUNT JANE AND JACK,(together) Just two doors down.
desc63.823,desc,,They share a laugh. ELEGANT WOMAN
scene64,slugline,,Many thanks. Sincerely.
desc64.824,desc,,"As the Elegant Woman continues on her way, Ellen rushes out holding his briefcase, followed by Mary Poppins, carrying the bowl, and the children."
utter64.825,utter,ELLEN,Michael - your briefcase! (Too late. He's gone.) He'd leave his 'ead on the breakfast table if it weren't screwed on.
utter64.826,utter,MARY POPPINS,Here - I'll take the briefcase. The children and I are heading that way on an errand; we can stop by the bank afterwards.
utter64.827,utter,JACK,I'll give you a lift. My rounds are done.
desc64.828,desc,,"He turns his ladder sideways, setting it astride and fastening it to the rear fender of the bike. He buckles it up. MARY POPPINS"
utter64.829,utter,JACK,All aboard - come on.
utter64.830,utter,GEORGIE,On the bicycle?
utter64.831,utter,ANNABEL,But there are five of us. We can't all fit.
utter64.832,utter,JOHN,"The weight on those wheels alone Mary Poppins, how much do you weigh? How..."
utter64.833,utter,MARY POPPINS JACK,(Quickly interceding.) Never you mind about that - it's a question of balance.
desc64.834,desc,,Jack kicks off the bike guard as Mary Poppins puts the briefcase in the front basket then holds the bicycle steady.
utter64.835,utter,JACK (cont'd),"(He lifts Annabel onto the bike.) Annabel here, and then John here. He balances them on one side of the ladder. Careful!"
utter64.836,utter,ELLEN MARY POPPINS,(To the twins.) Sit up straight. You're not flour bags.
utter64.837,utter,JACK,"Georgie, you're up front... (He sets Georgie on top of the briefcase.) And Mary Poppins, you here..."
scene65,slugline,,MARY POPPINS
desc65.838,desc,,Mary Poppins hops up onto the other side as Jack gets on the bike. ON THE ROOFTOP -
utter65.839,utter,ADMIRAL BOOM,"Primed and ready, Mr. Binnacle?"
utter65.840,utter,BINNACLE,"Ready and charged, sir."
desc65.841,desc,,DOWN BELOW -
utter65.842,utter,JACK,Ready everyone?
desc65.843,desc,,THE CHILDREN
utter65.844,utter,AUNT JANE,(To Mary Poppins:) Are you sure this is quite safe?
utter65.845,utter,MARY POPPINS,Not in the slightest. Ready! Steady...
scene66,slugline,,ON THE ROOFTOP -
utter66.846,utter,ADMIRAL BOOM,"Three, two, one... FIRE!"
desc66.847,desc,,DOWN BELOW Go!
desc66.848,desc,,"BOOM! Jack launches forward. The bike teeters, looking certain to crash, then Jack gets it under control and pedals off."
scene67,slugline,,EXT. THE STREET IN FRONT OF COUSIN TOPSY'S SHOP - DAY
desc67.849,desc,,"Jack, Mary Poppins and the children ride the precarious bicycle along a city street."
utter67.850,utter,MARY POPPINS,"Pull over right ahead. Thank you, Jack."
desc67.851,desc,,Jack stops at the entrance to a narrow alley. Mary Poppins takes the bowl as Jack helps the children off the bike.
utter67.852,utter,MARY POPPINS (cont'd),"Off we go, jiggity-jog!"
scene68,slugline,,"EXT. THE ALLEYWAY, COUSIN TOPSY'S SHOP"
desc68.853,desc,,They go down a narrow alleyway past a series of eccentriclooking shops.
utter68.854,utter,JACK,Never noticed this alley before.
utter68.855,utter,MARY POPPINS,Clearly you've never had a Royal Doulton bowl that wanted mending. (Gestures:) Straight ahead.
desc68.856,desc,,They arrive at Topsy's repair shop - a little house at the end with a front door so low that everyone except Georgie would have to duck to go inside.
utter68.857,utter,MARY POPPINS (cont'd),Here we are.
desc68.858,desc,,Annabel reads the sign that hangs above the little door:
utter68.859,utter,ANNABEL,"""TOPOTREPOLOVSKY'S - All Repairs Large and Small Fix-it Shop."""
utter68.860,utter,JACK,Looks as though it's just a Small Fix-it Shop today.
utter68.861,utter,MARY POPPINS,"That's just what we want. The bowl only needs a small fix, after all."
desc68.862,desc,,She raps on the door with the parrot head of her umbrella.
utter68.863,utter,PARROT UMBRELLA,So now my head is a door knocker? I suppose my beak might be useful for
utter68.864,utter,opening cans MARY POPPINS,"""Fuss, fuss, fuss"" - don't be so dramatic."
desc68.865,desc,,"Mary Poppins raps on the door again, hears nothing. She pushes the tip of the umbrella through the letter box."
utter68.866,utter,MARY POPPINS (cont'd),Cousin Topsy?
utter68.867,utter,TOPSY (O.S.),"(A strangely untraceable Eastern European accent:) Mary Poppins - NO! For the love of all that is holy, do not come in!"
utter68.868,utter,MARY POPPINS,Don't be so rude!
utter68.869,utter,TOPSY (O.S.),"Please stay away, - it is Second Wednesday today!"
utter68.870,utter,MARY POPPINS,"Second Wednesday... Oh dear, I'd forgotten. Still, today or never that's my motto."
desc68.871,desc,,Mary Poppins forces the tip of the cane into the keyhole and thwacks the parrot on the top of the head.
scene69,slugline,,PARROT UMBRELLA
desc69.872,desc,,"She twists the umbrella, opening the lock, and goes inside."
utter69.873,utter,MARY POPPINS,(To the others:) There we are.
scene70,slugline,,INT. TOPSY'S WORKSHOP - CONTINUOUS
desc70.874,desc,,"They pass through the tiny door into a narrow entry hall, the workshop just ahead. Follow me."
utter70.875,utter,MARY POPPINS TOPSY (O.S.),(Annoyed:) So in you come. You do not listen to Topsy.
desc70.876,desc,,"Mary reaches the doorway to the workshop. Almost instantly, the entire room begins to rotate, FLIPPING UPSIDE DOWN. Nearly everything stays stuck in place."
scene71,slugline,,"TOPSY (dramatic, Bohemian, a restorations artist of the"
desc71.877,desc,,highest order) is at the top of a spiral staircase on the far side of the room; she grips the railings as the room spins.
utter71.878,utter,TOPSY (cont'd),"Oh, no - it has begun!"
desc71.879,desc,,The room comes to a stop with the floor where the ceiling should be. Topsy now sits on the ceiling. A chandelier juts up like a fountain in the middle of the room.
utter71.880,utter,TOPSY (cont'd),"Now, what do you want?"
utter71.881,utter,MARY POPPINS,"You have guests, cousin. You might at least greet them at the door."
utter71.882,utter,TOPSY,"And how am I to do that, please, when I am down here up on the"
utter71.883,utter,MARY POPPINS,"(With a sigh:) Very well, we will come to you. Excuse me please, Georgie. (To the children:) Now this way please. Be very careful on the way - up."
desc71.884,desc,,"Mary Poppins makes her way gracefully down the piles of broken things, the children and Jack following her."
utter71.885,utter,TOPSY,"Why be careful? Leave it all for Topsy to fix. Climb on my shelves, step on the toys, kick the little"
desc71.886,desc,,"china dolls in their faces MARY POPPINS John, Annabel, Georgie and Jack this is my cousin TOPSY Second cousin - many times removed. MARY POPPINS"
utter71.887,utter,Tatiana Antanasia Cositori,Topotrepolovsky.
utter71.888,utter,TOPSY,But you may call me Topsy.
utter71.889,utter,JACK,(To Topsy:) That's an unusual accent you've got there - where are you from?
utter71.890,utter,TOPSY,"Well, it's an interesting story..."
utter71.891,utter,MARY POPPINS,"(Cuts her off:) We have no idea. (Taking the bowl:) We need you to fix this bowl, dear."
utter71.892,utter,TOPSY,"(Reeling back:) No, no, no no - ! (more)"
utter71.893,utter,TOPSY (cont'd),"It is, as I have told to you, the second Wednesday of the month, when everything is turning turtle."
utter71.894,utter,ANNABEL,Turning turtle? What exactly does that mean?
utter71.895,utter,TOPSY,"It means my whole world goes flippity-flop like a turtle on its back and I don't know my up from my down, my East from my West (Flirting with Jack:) - my Topsy from my bottom-sy MARY POPPINS Yes, I think we've all grasped the concept."
utter71.896,utter,TOPSY,"Oh, good. That's quick for you. Topsy picks up an instrument that has been badly repaired and shows it to the children."
