segment-id,segment-type,segment-speaker,segment-text
utter71.897,utter,TOPSY (cont'd),"You see, my little ones? Anything I fix on Second Wednesday goes kerflooey."
utter71.898,utter,MARY POPPINS,(Rolling her eyes:) Kerflooey...
utter71.899,utter,TOPSY,"(Nods, grim:) Yes. Kerflooey."
desc71.900,desc,,Topsy throws the instrument across the room.
utter71.901,utter,MARY POPPINS,"Please, cousin, you've always said you could fix anything TOPSY (Turning to Annabel:) Sweet girl - you tell Mary Poppins, who doesn't listen, that any other"
utter71.902,utter,"day, Tatiana Antanasia Cositori","Topotrepolovsky can fix anything... ""TURNING TURTLE"""
desc71.903,desc,,"IF YOU RING WITH SOMETHING BROKEN ON A THURSDAY I'LL MAKE NEW WITH MY GLUE, PINS AND THREAD WHAT YOU BRING - WHEN I'VE AWOKEN - ON A FRIDAY I WILL MEND, AND THEN SPEND THE DAY IN BED!"
utter71.904,utter,TOPSY (cont'd),"CHILDREN, ""SATUR"", ""SUN"", AND ""MON""DAYS ARE JUST ""EVERYTHING IS FUN"" DAYS"
desc71.905,desc,,"BUT IN THE SECOND WEEK I WEAR A FROWN FOR I KNOW THAT AFTER TUESDAY COMES THE ""TOPSY GETS BAD NEWS"" DAY IT'S THE DREADED SECOND WEDNESDAY!! MY LIFE TURNS UPSIDE DOWN!!! FAST IS SLOW, LOW IS HIGH STOP IS GO AND THAT IS WHY EVERY SECOND WEDNESDAY IS A HURDLE THEN I ROLLOVER ON MY SHELL AND ALL BECAUSE THE WORLD IS TURNING TURTLE!"
desc71.906,desc,,(Mary Poppins tries to hand Topsy the bowl - she
desc71.907,desc,,"DAY IS NIGHT, DOG IS CAT BLACK IS WHITE, THIN IS FAT (AND THAT IS WHY I'M LOOSENING UP MY GIRDLE!) I CANNOT HELP THIS CHARMING TROUPE DON'T MOCK ME CAUSE I'M IN THE SOUP AND WHY? BECAUSE THE WORLD IS TURNING TURTLE! OH, WOE IS ME I'M AS OPPOSITE AS I CAN BE I LONG FOR THURSDAYS WHEN THE WORLD IS DRAB WHEN WILL IT CEASE? NOW MY LIFE RESEMBLES ""WAR AND PEACE"" (THAT TOLSTOY CERTAINLY HAD THE GIFT OF GAB!) I couldn't get through it! BOTTOM'S TOP, YIN IS YANG PEACE AND QUIET'S STURM UND DRANG TUESDAY NIGHTS MY BLOOD BEGINS TO CURDLE EAST IS WEST, IN IS OUT AND THAT IS WHY I NEED TO SHOUT"
desc71.908,desc,,THE WORLD IS TURNING TURTLE
desc71.909,desc,,YOU WOULDN'T HAVE FOUND ME SO FORLORN SECOND WEDNESDAYS IS ON THE FRITZ I COULDN'T MEND THIS TO SAVE MY SOUL IF THIS KEEPS UP I'LL DIG A HOLE YOU SAY LIFE'S A CHERRY BOWL BUT WEDNESDAYS IS FULL OF PITS
utter71.910,utter,76 JACK,"(Holding up a drum:) TELL US, CAN YOU FIX THIS DRUM?"
utter71.911,utter,TOPSY,"WELL, TODAY IT'S LOOKING GLUM!"
utter71.912,utter,JOHN,(Holding a clarinet:) CAN YOU MEND THIS CRACK?
utter71.913,utter,ANNABEL,(Picking up a cracked bass:) AND BROKEN STRING?
utter71.914,utter,TOPSY,WELL PERHAPS IF YOU ALL LEND A HAND
desc71.915,desc,,JACK AND THE CHILDREN OUR FINGERS ARE AT YOUR COMMAND! MARY POPPINS A BROKEN SONGBIRD STILL CAN SING
desc71.916,desc,,"LET'S DO ""THE TURTLE SWING!"" They all play a hot jazz chorus - with John on bass, Annabel on violin, Georgie on xylophone and Jack going wild on the drums. Mary Poppins conducts; Topsy dances like a whirling dervish. Soon they are all dancing. As the music builds, Topsy floats up in the air and lands on her head, upside down and thoroughly distraught."
utter71.917,utter,TOPSY (cont'd),"OH, WOE IS ME NOW I'M ON MY HEAD HOW CAN THAT BE?"
desc71.918,desc,,"WELL, YOU SAY ""WOE"" BUT I SAY ""LUCKY YOU!"""
utter71.919,utter,TOPSY,Lucky me?!?
utter71.920,utter,MARY POPPINS,YES! HERE ON YOUR HEAD
desc71.921,desc,,"""A"" IS FAR BEHIND AND LED BY ""ZED"" IT'S GOOD TO GET A DIFFERENT POINT OF VIEW!"
utter71.922,utter,TOPSY,I love your shoes.
utter71.923,utter,MARY POPPINS,"You see? When your world turns upside down, the best thing is to turn right along with it."
utter71.924,utter,TOPSY,"Oh, I do see! From down here, things look right side up."
desc71.925,desc,,"She laughs, delighted."
utter71.926,utter,JACK,I wouldn't mind seeing things from that angle.
utter71.927,utter,JOHN,Sounds like fun. Can we?
utter71.928,utter,ANNABEL MARY POPPINS,Very well. Flippity-flop.
desc71.929,desc,,Mary Poppins tosses her umbrella into the air and everyone flips onto their heads.
utter71.930,utter,ANNABEL,NEAR IS...
utter71.931,utter,JOHN,FAR IS...
utter71.932,utter,JACK,HERE IS...
utter71.933,utter,GEORGIE,... THERE!
desc71.934,desc,,TURTLES TURNING EVERYWHERE!
utter71.935,utter,TOPSY,THINGS ARE GETTING CLEAR!
utter71.936,utter,MARY POPPINS,"WELL, KNOCK ON WOOD, MY DEAR."
desc71.937,desc,,Mary's parrot-headed umbrella lands next to Mary Poppins. MARY POPPINS (cont'd) WHEN YOU CHANGE THE VIEW FROM WHERE YOU STOOD THE THINGS YOU VIEW WILL CHANGE FOR GOOD! Topsy flips back onto her feet. The others follow.
utter71.938,utter,TOPSY,(A light bulb moment:)
desc71.939,desc,,I NEVER THOUGHT OF THINGS THAT WAY MARY POPPINS SHE NEVER THOUGHT OF THINGS THAT WAY
utter71.940,utter,TOPSY,NOW WEDNESDAYS ARE MY FAVORITE DAY
desc71.941,desc,,JACK & THE CHILDREN NOW WEDNESDAYS ARE HER FAVORITE DAY
desc71.942,desc,,"CAUSE THAT'S THE DAY I'M QUITE CONTRARY AND NOW THANKS TO COUSIN MARY I HAVE CHANGED, TO BE EXACT I LOVE THE FACT..."
desc71.943,desc,,...THE WORLD IS TURNING TURTLE!!! TURTLE!!! TURTLE!!! Topsy reaches for the bowl. Jack hands it to her.
utter71.944,utter,TOPSY,Come. Give your bowl to me. No more am I afraid with this new point of view. Good!
utter71.945,utter,MARY POPPINS JOHN,"(To Topsy:) Excuse me, but do you have any idea how much our bowl might be worth?"
utter71.946,utter,TOPSY,"In money? (She looks at the bowl, considers for a moment:) Not very much, I'm afraid. But that doesn't make it any less beautiful."
utter71.947,utter,ANNABEL,But our mother said it was priceless.
utter71.948,utter,TOPSY,"Yes, I am sure it was - to her. Disappointment is visible in the eyes of all three children."
utter71.949,utter,TOPSY (cont'd),Mary Poppins is right - for once. It is all in the way you look at things.
utter71.950,utter,MARY POPPINS,"Thank you cousin. Now come along, children. Get your hats."
desc71.951,desc,,The children all collect their hats and head out.
utter71.952,utter,TOPSY,And don't you worry about mother's bowl. I will fix and make perfect for you. So you come back maybe next second Wednesday!
utter71.953,utter,MARY,"Yes, spit-spot!"
utter71.954,utter,JACK,"Nice meeting you, ""Topsy Turvy."""
utter71.955,utter,TOPSY,"""Topsy Turvy"" - I like it! It's catchy."
scene72,slugline,,"EXT. THE ALLEYWAY, COUSIN TOPSY'S SHOP - DAY"
desc72.956,desc,,"Mary Poppins and Jack come out of the alleyway, the children lagging behind, the twins talking quietly to one another."
utter72.957,utter,ANNABEL,Now what do we do?
utter72.958,utter,JOHN,I have no idea.
utter72.959,utter,ANNABEL,"Well, like Topsy said, maybe we should start looking at things"
desc72.960,desc,,differently Everyone looks back as they hear LOUD CREAKS AND CRASHES coming from inside Topsy's shop. Mary Poppins turns back and continues walking.
utter72.961,utter,MARY POPPINS,Marvelous. It looks as though things are starting to turn around
desc72.962,desc,,for my cousin.
scene73,slugline,,EXT. A STREET NEAR THE BANK - DAY
desc73.963,desc,,"Jack, Mary Poppins and the children ride down the street."
utter73.964,utter,JOHN,"Mary Poppins, this is not the quickest way to the bank."
utter73.965,utter,MARY POPPINS,(Curtly:) Well it is today.
utter73.966,utter,GEORGIE,"Look, there's Aunt Jane!"
scene74,slugline,,Aunt Jane! THE CHILDREN
desc74.967,desc,,"Aunt Jane walks just ahead, carrying arm-loads of rally posters and banners. Jack pulls over, the children waving."
desc74.968,desc,,"Off to the rally, are you, Jane?"
utter74.969,utter,AUNT JANE,"Yes - hello, everyone! All still here thank goodness. No one fell"
desc74.970,desc,,off.
utter74.971,utter,JACK,"Say, I could come back and give you a hand with all that once I've dropped the others at the bank."
utter74.972,utter,AUNT JANE,"Oh no, no - please don't worry. I'm perfectly fine. Really."
utter74.973,utter,MARY POPPINS,"Oh, nonsense. The bank is just around the corner, and the children and I have plenty of legs to get us there. Climb off, everyone - ready,"
desc74.974,desc,,"and - jump. They do. Jack takes the banners and posters from Aunt Jane, tying them to the back of the bicycle."
utter74.975,utter,AUNT JANE,"Are you sure you don't mind, Jack?"
utter74.976,utter,JACK,"Of course not. I was hoping to stop by that rally of yours, anyway."
utter74.977,utter,AUNT JANE,"You were? Oh, good!"
utter74.978,utter,GEORGIE,You should ride up in the front basket.
utter74.979,utter,JACK,I think she'll be better here. Up you go now!
utter74.980,utter,AUNT JANE,"Here, is it? Yes."
desc74.981,desc,,Jack helps Aunt Jane sit side-saddle on the bar of the bicycle in front of him.
utter74.982,utter,81 AUNT JANE (cont'd),Where should I hold on?
utter74.983,utter,JACK,(To Aunt Jane:) Ready?
utter74.984,utter,AUNT JANE,"Yes, as ready as I'll ever be. Oh-!"
desc74.985,desc,,"Aunt Jane bursts out laughing, holding on for dear life as Jack pedals off down the street. Mary Poppins and the children watch them cycling away together before Mary Poppins decidesMARY POPPINS Right, that's enough."
scene75,slugline,,EXT. THE BANK - DAY
desc75.986,desc,,"WIDE SHOT - Outside, the bank is thronged with people as Mary Poppins leads the children up the steps."
utter75.987,utter,MARY POPPINS,"Step along, children."
scene76,slugline,,INT. THE BANK - CONTINUOUS
desc76.988,desc,,"Inside, the bank is a beehive of activity. Mary Poppins enters with the children and strides purposefully toward the Information Desk, the children hurrying to catch up."
utter76.989,utter,JOHN,(Walking with Annabel:) There must be someone at this bank who could help us save our house.
utter76.990,utter,ANNABEL,I'm sure father has already asked.
utter76.991,utter,JOHN,"Well, we haven't. Maybe we can get them to see things from a new point of view."
utter76.992,utter,MARY POPPINS,Sit over there children.
desc76.993,desc,,"Mary Poppins guides the children over to a bench, gestures for them to sit, then crosses to the INFORMATION DESK CLERK. MARY POPPINS (cont'd) Good afternoon, I'm looking for Mr.A POSTMAN interrupts, his arms full of parcels."
utter76.994,utter,POSTMAN,"I'll need a signature for these, sir."
utter76.995,utter,INFORMATION DESK CLERK,Of course - excuse me a moment.
desc76.996,desc,,"Mary Poppins purses her lips, nettled. As she waits, she adjusts her hat, gazing into the reflection of a brass lamp. ON THE REFLECTION: The children are visible. Gooding and Frye also appear, having just entered the bank. Frye sees Georgie, smiles and waves. Georgie waves back. Annabel pointedly pushes Georgie's hand down. Frye's smile disappears; his face clouds with guilt as he follows Gooding upstairs."
utter76.997,utter,GEORGIE,(To Annabel:) What did you do that for? You hurt his feelings.
utter76.998,utter,ANNABEL,"You do know who those men are, don't you, Georgie?"
utter76.999,utter,GEORGIE,They're the lawyers. He's the nice
desc76.1000,desc,,A beat. Annabel turns to John.
utter76.1001,utter,ANNABEL,Maybe we could convince him to help us.
utter76.1002,utter,JOHN,Worth a try. (Glancing to the stairs:) Today or never. That's my motto. C'mon.
desc76.1003,desc,,"ON THE REFLECTION: Mary Poppins watches the children as they lean in together, clearly plotting something. The postman leaves, and the clerk turns back to Mary Poppins."
desc76.1004,desc,,"Now, how may I help you?"
desc76.1005,desc,,Finally. I'd like to see Mr. Michael
desc76.1006,desc,,ON THE REFLECTION: the children sneak off.
scene77,slugline,,INT. STAIRCASE/OUTSIDE WILKINS' OFFICE - DAY
desc77.1007,desc,,"The children hurry up the stairs, following Gooding and Frye, who turn at the top of the steps and disappear around the corner. The children sneak around the corner in pursuit, spying on the lawyers as they go into Wilkins' office. Miss Farthing sees them."
utter77.1008,utter,MISS FARTHING,"Is there something I can do for you, children?"
desc77.1009,desc,,"The twins freeze; Georgie, though, sees the new jar of toffees on Miss Farthing's desk."
utter77.1010,utter,GEORGIE,"May I have a sweet, please?"
utter77.1011,utter,MISS FARTHING,"Yes of course, dear. You all can."
desc77.1012,desc,,"She takes the lid off the jar, gesturing for them to come over. As they do so, the muffled voices of Wilkins and the lawyers can be heard emanating from behind the office door..."
desc77.1013,desc,,"Mrs. Clara Corry, 42 Chatsworth Way."
utter77.1014,utter,FRYE GOODING,"Mr. Wallace Trimlet, 96 Digby Crescent."
utter77.1015,utter,FRYE,"In foreclosure. GOODING Mr. Michael Banks, 17 Cherry Tree Lane."
utter77.1016,utter,FRYE,In foreclosure.
scene78,slugline,,Miss Muriel Brighton-Jones INT. WILKINS' OFFICE - CONTINUOUS
utter78.1017,utter,WILKINS,How many repossessions so far this month?
utter78.1018,utter,GOODING,"19, sir - and we have nearly that amount scheduled for next week alone."
utter78.1019,utter,WILKINS,"Who would have thought this Slump would be so good for business, eh?"
utter78.1020,utter,FRYE,"(Gathering his courage:) I wonder, Mr. Wilkins, if, perhaps, as Michael Banks is an employee, you might consider giving him a few more weeks to pay off his loan."
utter78.1021,utter,WILKINS,"And lose our chance to get that house? I don't like to lose, Mr."
utter78.1022,utter,Frye.,"(Hitting the intercom:) Didn't I ask for tea, Miss Farthing?"
desc78.1023,desc,,INT/EXT. WILKINS' OFFICE - CONTINUOUS
utter78.1024,utter,MISS FARTHING,"(On the intercom:) Yes, sir. Right away, Mr. Wilkins. (To the children:) Why don't you all help yourselves?"
desc78.1025,desc,,Miss Farthing goes off to get the tea. The children creep over to Wilkins' door. Annabel points to the sign on it.
utter78.1026,utter,ANNABEL,"(Whispering:) ""Office of the Bank Chairman."" We can't go in there."
desc78.1027,desc,,"The children peer through the crack in the door, listening."
utter78.1028,utter,FRYE,"(Nervously:) It's just that, well, his family has suffered tremendous hardship"
utter78.1029,utter,"this past year, and WILKINS",You're not giving Banks one second longer to pay off that loan - do I make myself clear?
desc78.1030,desc,,"Wilkins swings his pocket watch. From Georgie's POV, he can see Wilkins' shadow on the wall - as the firelight flickers, it changes into THE ANIMATED SHADOW HE SAW ON THE CIRCUS TENT and back again."
utter78.1031,utter,GEORGIE JOHN GEORGIE,It's the wolf!
utter78.1032,utter,WILKINS (O.S.),In two days Banks will be out on that street and the house will be ours.
desc78.1033,desc,,Georgie shoves the door open and charges into the office.
utter78.1034,utter,JOHN,"Georgie, no!"
utter78.1035,utter,GEORGIE,You can't steal our house! I'm telling my father!
utter78.1036,utter,WILKINS,Steal your - ? Who are you?
utter78.1037,utter,FRYE,These are the Banks children.
utter78.1038,utter,WILKINS,"... Are they? (He smiles. To Georgie:) Come here, boy. I think you may have misunderstood JOHN Let's go, Georgie! RUN!"
scene79,slugline,,ANNABEL
desc79.1039,desc,,"Miss Farthing backs in, carrying a large tea tray."
utter79.1040,utter,WILKINS,"Close that door, Miss Farthing."
desc79.1041,desc,,"Georgie and the twins race past Miss Farthing, ducking beneath the tea tray, nearly sending it flying."
utter79.1042,utter,WILKINS (cont'd),Fool! STOP THEM!
desc79.1043,desc,,"Miss Farthing wheels round, trying not to spill the tea, kicking the door closed after Frye. Gooding slams into the closed door."
scene80,slugline,,"INT. THE BANK, MAIN FLOOR - CONTINUOUS"
desc80.1044,desc,,"Michael comes out into the lobby, where Mary Poppins waits for him. She holds out his briefcase."
utter80.1045,utter,MARY POPPINS,"Ah, there you are Michael. The children and I brought you your briefcase."
utter80.1046,utter,MICHAEL,"Oh, thank you. But... where are the children?"
desc80.1047,desc,,"The children come racing down the stairs, with Gooding, Frye and Wilkins close behind."
utter80.1048,utter,GEORGIE,"FATHER, HELP!"
utter80.1049,utter,MICHAEL,What is it? What's happened?
utter80.1050,utter,GEORGIE,(Pointing back:) He's the wolf trying to steal our house!
utter80.1051,utter,MICHAEL,What on Earth are you talking about?
desc80.1052,desc,,Wilkins crosses directly to Michael.
utter80.1053,utter,WILKINS,"I'm afraid your children burst into my office just now, Banks What??"
utter80.1054,utter,MICHAEL WILKINS,"I was just seeing if anything could be done about extending your loan, when they came in claiming I was trying to steal your house."
utter80.1055,utter,ANNABEL,He is - we heard him!
utter80.1056,utter,MICHAEL,Mr. Wilkins is trying to help us!
utter80.1057,utter,JOHN,Then why was he chasing us?
desc80.1058,desc,,"Wilkins digs into a pocket, pulling out a handful of toffees."
utter80.1059,utter,WILKINS,I just thought they might stop running about and making a scene if I offered them some sweets.
utter80.1060,utter,MICHAEL,"I am so sorry, Mr. Wilkins."
utter80.1061,utter,WILKINS,Let's just see it doesn't happen
desc80.1062,desc,,"again He places a toffee in Georgie's hand, one in John's and one"
utter80.1063,utter,WILKINS (cont'd),"(To the children:) After all, you don't want your father losing his position on account of you, now do you? (Stepping close to Michael, kindly:) Now, I know time is running short, Banks, but I want you to have every chance to pay off that loan - I'll stay in my office on Friday evening until the last stroke of midnight, you have my word."
utter80.1064,utter,MICHAEL,"Thank you, sir."
utter80.1065,utter,WILKINS,(Turning to the lawyers:) Gentlemen He gestures for them to follow him upstairs. As they go:
utter80.1066,utter,ANNABEL,"(To her father:) But Father, he really did it MICHAEL Not another word! (to Mary Poppins) Take them home this instant. We'll discuss this when I get back."
utter80.1067,utter,MARY POPPINS,"Come along, children."
desc80.1068,desc,,"Michael watches as Mary Poppins leads them out. He turns away, tense, then goes back to work."
scene81,slugline,,EXT. SIDE STREET NEAR THE BANK - DUSK
desc81.1069,desc,,"Damp, grey fog settles over London as Mary Poppins and the children return home. The children walk ahead of their nanny."
utter81.1070,utter,JOHN,"Now we've done it, haven't we? I don't think I've ever seen father that upset with us before."
utter81.1071,utter,GEORGIE,But we were telling the truth!
utter81.1072,utter,ANNABEL,"That doesn't matter, Georgie. We got him into trouble - and he doesn't even know we broke mother's bowl."
utter81.1073,utter,JOHN,"Everything we've tried to fix, we've only made worse."
scene82,slugline,,EXT. THE STREETS OF LONDON - DUSK
desc82.1074,desc,,"The children walk through the fog, deep in thought. Mary Poppins follows behind. They come to a crossroads. Annabel pauses, looking around. The fog is getting so thick it's difficult to make out the buildings around them."
utter82.1075,utter,ANNABEL,"Which way do we go, Mary Poppins?"
utter82.1076,utter,MARY POPPINS,"Why would you ask me? The three of you are leading the way, after all. Us?"
utter82.1077,utter,ANNABEL JOHN,But we were MARY POPPINS - walking around in a fog.
utter82.1078,utter,ANNABEL,"No, we weren't - I mean, yes, we are in a fog - but JOHN - we were only talking."
utter82.1079,utter,MARY POPPINS,Yes - too focused on where you've been to pay attention to where you're going.
utter82.1080,utter,JOHN,But father told us to go straight home!
utter82.1081,utter,ANNABEL,He'll be furious if we're late.
utter82.1082,utter,MARY POPPINS,"Not much to be done about that now, is there?"
utter82.1083,utter,GEORGIE,"(Worried:) Are we lost, then?"
utter82.1084,utter,JACK (O.S.),That would depend on where you want to go.
desc82.1085,desc,,A light appears through the fog. Jack smiles down at them from a streetlamp that hangs from an archway behind them. Jack! JOHN/ANNABEL/GEORGIE
utter82.1086,utter,JACK,At your service.
desc82.1087,desc,,"Jack climbs halfway down and sits on a ledge just above Mary Poppins and the children, peering down at them."
utter82.1088,utter,JACK (cont'd),"Say, what's with all the glum faces? Lost sixpence and found a penny?"
utter82.1089,utter,ANNABEL,We've made a mess of everything.
utter82.1090,utter,JOHN,Father's furious with us.
utter82.1091,utter,GEORGIE,And we can't find our way home.
utter82.1092,utter,JACK,"(Not believing it:) ""Lost"" - are you, Mary Poppins?"
utter82.1093,utter,MARY POPPINS,Hopelessly.
utter82.1094,utter,JACK,"Well now, I'm no expert, but if ever I lose my way, I just look for a little light to guide me."
desc82.1095,desc,,"""TRIP A LITTLE LIGHT FANTASTIC"" LET'S SAY YOU'RE LOST IN A PARK, SURE... YOU CAN GIVE IN TO THE DARK OR... YOU CAN TRIP A LITTLE LIGHT FANTASTIC WITH ME WHEN YOU'RE ALONE IN YOUR ROOM YOUR CHOICE IS JUST EMBRACE THE GLOOM OR YOU CAN TRIP A LITTLE LIGHT FANTASTIC WITH ME FOR IF YOU HIDE UNDER THE COVERS YOU MIGHT NEVER SEE THE DAY BUT IF A SPARK CAN START"
desc82.1096,desc,,"THEN YOU CAN ALWAYS FIND THE WAY SO WHEN LIFE IS GETTIN' DREARY JUST PRETEND THAT YOU'RE A ""LEERIE"" AS YOU TRIP A LITTLE LIGHT FANTASTIC WITH ME Jack jumps onto a lamppost."
utter82.1097,utter,JOHN,What's a leerie?
utter82.1098,utter,JACK,"Why, it's what we lamplighters call ourselves, of course."
desc82.1099,desc,,He flickers the streetlamp on and off in a rhythmic pattern.
utter82.1100,utter,JACK (cont'd),"Time to send out the call to arms: ""Leeries, trip the lights and lead the way."""
desc82.1101,desc,,"As a Leerie lights his lamp, we DROP DOWN to find Jack leading the group through the foggy streets like the Pied Piper. He steers the children up curbs and around pillar boxes. NOW WHEN YOU'RE STUCK IN THE MIST SURE, YOU CAN STRUGGLE AND RESIST OR YOU CAN TRIP A LITTLE LIGHT FANTASTIC WITH ME NOW, SAY YOU'RE LOST IN THE CROWD WELL, YOU CAN STAMP AND SCREAM OUT LOUD OR YOU CAN TRIP A LITTLE LIGHT FANTASTIC WITH ME Ahead, lights continue to flicker on, lighting their way. One by one, leeries appear out of the fog, gazing down from lampposts, acknowledging the children as they pass."
utter82.1102,utter,JACK (cont'd),AND WHEN THE FOG COMES ROLLIN' IN
desc82.1103,desc,,"JUST KEEP YOUR FEET UPON THE PATH MUSTN'T MOPE AND FROWN OR WORSE LIE DOWN SO WHEN LIFE IS GETTIN' SCARY BE YOUR OWN ILLUMINARY WHO CAN SHINE THEIR LIGHT FOR ALL THE WORLD TO SEE AS YOU TRIP A LITTLE LIGHT FANTASTIC WITH ME! A LEERIE LOVES THE EDGE OF NIGHT THOUGH DIM, TO HIM THE WORLD LOOKS BRIGHT HE'S GOT THE GIFT OF SECOND SIGHT THE LEERIES TO TRIP A LITTLE LIGHT FANTASTIC"
desc82.1104,desc,,A LEERIE'S JOB'S TO LIGHT THE WAY
utter82.1105,utter,THE LEERIES,TO TAKE THE NIGHT
desc82.1106,desc,,AND MAKE IT DAY
desc82.1107,desc,,"WE MIMIC THE MOON, YES, THAT'S OUR AIM JACK AND THE LEERIES FOR WE'RE THE KEEPERS OF THE FLAME!"
desc82.1108,desc,,"AND IF YOU'RE DEEP INSIDE A TUNNEL AND THERE IS NO END IN SIGHT WELL, JUST CARRY ON IT'S DARKEST RIGHT BEFORE THE LIGHT... They come to a dead end. A lamppost with an ornate base stands before them."
utter82.1109,utter,JOHN,Now what do we do?
utter82.1110,utter,MARY POPPINS,Just as Jack said - we follow the light.
desc82.1111,desc,,"She steps onto the base of the lamp, which magically disappears into the ground, creating an unusually LONG LAMPPOST. One by one, they all follow her, sliding down the post like it's a FIREMAN'S POLE. They arrive at the entrance to a drainpipe and duck into it. The leeries voices echo inside the tunnel."
utter82.1112,utter,JACK,AS YOU...
utter82.1113,utter,JACK (cont'd),TRIP A LITTLE LIGHT FANTASTIC WON'T YOU...
desc82.1114,desc,,COME ON...
scene83,slugline,,TRIP A LITTLE LIGHT FANTASTIC WITH ME!
desc83.1115,desc,,"Jack, Mary Poppins and the children arrive at... EXT. AN ABANDONED PARK - CONTINUOUS An abandoned park with an unused fountain at its center, shrouded in darkness. The street lamps and pathways of the park are silhouetted only by moonlight. One by one, gas lamps flick on, revealing leeries on every lamppost - until the entire park is glowing with brilliant light. DANCE SEQUENCE - which includes Jack and all the leeries spinning on lampposts and performing spectacular stunts on their bicycles. The Leeries all dance round their lamp posts, jumping on and off. Jack joins them, tipping his hat to Angus and the other Leeries. Jack and a small group of Leeries dance in front of Mary Poppins and the children. They join the other Leeries on lamp posts as other Leeries on bikes perform amazing stunts and parkour over traveling ladders, followed by a ladder section. Jack, Angus and the crew dance, jumping up and spinning round the lamp posts. At the end of it, ANGUS bounds over to the children."
utter83.1116,utter,ANGUS,Come along - join us in a bit of
desc83.1117,desc,,kick and prance.
utter83.1118,utter,JOHN,What did he say?
utter83.1119,utter,JACK,"Kick and prance - it means ""dance."" It's leerie speak. You don't say the word you mean; you say something that rhymes, only (It's hard to describe:) Here, I'll show you how it works. Angus... GIVE US YOUR WEEP AND WAIL"
utter83.1120,utter,JACK (cont'd),"(To the children, aside:) TO THE REST OF YA, THAT MEANS: ""TALE"""
utter83.1121,utter,ANGUS,I WAS SHORT OF A SHEET
desc83.1122,desc,,HE WAS IN THE STREET
desc83.1123,desc,,JUST TO TUMBLE DOWN THE SINK
desc83.1124,desc,,JUST TO GET HIMSELF A DRINK
desc83.1125,desc,,THEN I PINCHED WHAT'S FATTER
desc83.1126,desc,,HE GRABBED HIS LADDER
desc83.1127,desc,,TO SMILE AND SMIRK
utter83.1128,utter,JACK AND ANGUS,TO WORK! You see? There's nothing to it.
utter83.1129,utter,ANNABEL,"Can you speak leerie, Mary Poppins?"
utter83.1130,utter,MARY POPPINS,(A wide-eyed glance:) Can I speak leerie?
utter83.1131,utter,JACK,Of course she can. She's Mary Poppins!
utter83.1132,utter,GEORGIE,Can we do it with you?
utter83.1133,utter,ANNABEL AND JOHN MARY POPPINS,"Oh, very well then."
utter83.1134,utter,JACK,Children... TELL US YOUR SORRY TALE THE LEERIES GIVE US YOUR WEEP AND WAIL!
desc83.1135,desc,,WE HAD THIS BOWL... MARY POPPINS RABBIT IN THE HOLE
utter83.1136,utter,ANNABEL,THAT FELL AND BROKE...
desc83.1137,desc,,MARY POPPINS
utter83.1138,utter,JOHN,SO WE TOOK IT TO A SHOP...
desc83.1139,desc,,MARY POPPINS LIKE A LOLLIPOP
