segment-id,segment-type,segment-speaker,segment-text
desc0.0,desc,,"DAVID MAGEE & ROB MARSHALL & JOHN D E LUCA BASED UPON THE ""MARY POPPINS"" STORIES BY"
scene1,slugline,,"SONGS ""LOVELY LONDON SKY"" .................................... Jack"
desc1.1,desc,,"""A CONVERSATION"" .................................... Michael ""CAN YOU IMAGINE THAT?"" ................ Mary Poppins, John, Annabel, Georgie"
scene2,slugline,,"""THE ROYAL DOULTON MUSIC HALL"" ................. Mary Poppins"
desc2.2,desc,,"""A COVER IS NOT THE BOOK"" ....... Mary Poppins, Jack, Company ""THE PLACE WHERE LOST THINGS GO"" ............... Mary Poppins ""TURNING TURTLE"" ....................... Topsy, Mary Poppins, Jack, the Children ""TRIP A LITTLE LIGHT FANTASTIC"" ......... Jack, Mary Poppins, the Children, Leeries ""THE PLACE WHERE LOST THINGS GO"" (Reprise) ......... Georgie, Annabel, John ""TRIP A LITTLE LIGHT FANTASTIC"" (Reprise) .... Mr. Dawes, Jr. ""NOWHERE TO GO BUT UP"" ....... Balloon Lady, Michael, Company ""LOVELY LONDON SKY"" (Reprise) .......................... Jack"
scene3,slugline,,"EXT. THE LONDON EMBANKMENT/DOCKS MARCH, 1934 - MORNING The river Thames at daybreak, street-lamps reflected in the"
desc3.3,desc,,"water. TILT UP to reveal the London Embankment, Big Ben in the background. Jack, an eternally optimistic lamplighter, climbs a ladder that leans against a lamppost, silhouetted against the dawn. He dims the light and slides down to the ground. ""LOVELY LONDON SKY"""
utter3.4,utter,JACK,WHEN THE EARLY MORNING HOURS HAVE COME AND GONE
desc3.5,desc,,THROUGH THE MISTY MORNING SHOWERS I GREET THE DAWN FOR WHEN ITS LIGHT HAS HIT THE GROUND THERE'S LOTS OF TREASURES TO BE FOUND UNDERNEATH THE LOVELY LONDON SKY Jack folds his ladder and fastens it to the back of his bicycle. He climbs on and rides off.
scene4,slugline,,EXT. THE DOCKS NEAR THE EMBANKMENT - CONTINUOUS
desc4.6,desc,,"Dropping down from the rooftops of London, we discover workers unloading crates and barrels of fresh produce on the docks. Jack slaloms through it all as he continues on his way."
utter4.7,utter,JACK,THOUGH THE LAMPS I'M TURNING DOWN
desc4.8,desc,,"PLEASE DON'T FEEL BLUE FOR IN THIS PART OF LONDON TOWN THE LIGHT SHINES THROUGH Jack stops at a lamppost and dims the lamp. Ahead, NEEDY LONDONERS stand on a soup kitchen queue that snakes around the corner. VOLUNTEERS hand out food to them. DON'T BELIEVE THE THINGS YOU'VE READ YOU NEVER KNOW WHAT'S UP AHEAD"
scene5,slugline,,UNDERNEATH THE LOVELY LONDON SKY
desc5.9,desc,,Jack grabs an apple as he swerves past a fruit cart and tosses it to a MAN ON THE QUEUE.
scene6,slugline,,EXT. TOWER BRIDGE - MORNING
desc6.10,desc,,"Jack rides along the embankment, the bridge at his back."
scene7,slugline,,EXT. NEIGHBORHOOD PUB - CONTINUOUS
desc7.11,desc,,"As Jack rides down an alley adjacent to a pub, three STREET URCHINS chase behind him. An urchin helps him to shut off a street-lamp."
utter7.12,utter,JACK,HAVE A POT OF TEA MEND YOUR BROKEN CUP
desc7.13,desc,,THERE'S A DIFFERENT POINT OF VIEW
desc7.14,desc,,IF YOU WOULD JUST LOOK UP! I KNOW... A PUB LANDLORD sweeps the footpath.
utter7.15,utter,PUB LANDLORD,"Oi, get out of it!"
desc7.16,desc,,"The urchins run off down the alley, as Jack rides down the street."
utter7.17,utter,JACK,...YESTERDAY YOU HAD TO BORROW FROM YOUR CHUMS
desc7.18,desc,,SEEMS THE PROMISE OF TOMORROW NEVER COMES
scene8,slugline,,EXT. ST. PAUL'S CATHEDRAL - DAY
desc8.19,desc,,Jack passes St. Paul's. A few HOMELESS PEOPLE sleep on the cathedral steps.
utter8.20,utter,JACK,BUT SINCE YOU DREAMED THE NIGHT AWAY
desc8.21,desc,,"TOMORROW'S HERE! IT'S CALLED... TODAY! SO COUNT YOUR BLESSINGS, YOU'RE A LUCKY GUY FOR YOU'RE UNDERNEATH THE LOVELY LONDON SKY He rides through a flock of pigeons, scattering them, and taking us up past the dome."
scene9,slugline,,EXT. THE PARK - DAY
desc9.22,desc,,"CLOSE on Jack's wheels as he winds his way through the park. As he rides along the path, he nods to a gruff PARK KEEPER spearing rubbish into a bag, who gives him a dirty look."
scene10,slugline,,EXT. CHERRY TREE LANE - CONTINUOUS
desc10.23,desc,,"Jack whistles as he rides onto Cherry Tree Lane, a street lined with 19th-Century homes. He passes the neighboring MILKMAN, giving him a wave."
utter10.24,utter,MILKMAN,"Mornin', Jack!"
desc10.25,desc,,"Jack glances up to a rooftop that has been fitted to look like the deck of a ship - at the moment, though, no one is at the helm. He looks up, worried. Finally, the rooftop door creaks open and ADMIRAL BOOM appears, pushed in a wheelchair by his First Mate, BINNACLE."
utter10.26,utter,BINNACLE,(Blows whistle:) Admiral... above decks!
desc10.27,desc,,"Jack smiles, saluting the sailors."
utter10.28,utter,JACK,LISTEN... SOON THIS SLUMP'LL DISAPPEAR
desc10.29,desc,,"SOONER THAN 'YA THINK YOU'LL HEAR SOME BRIGHT NEW SONG He sets up his ladder at the lamppost that stands before 17 Cherry Tree Lane - a modest house which has fallen slightly into disrepair. A BOY AND GIRL appear at the window in the upper floor of the Banks home, waving."
utter10.30,utter,JACK (cont'd),"Y'awright, children?"
desc10.31,desc,,Jack waves to the children. They wave back and exit. Jack climbs the ladder.
utter10.32,utter,JACK (cont'd),SO HOLD ON TIGHT TO THOSE YOU LOVE
desc10.33,desc,,YOU'LL BE BLESSED SO KEEP ON LOOKING HIGH
scene11,slugline,,LONDON SKY LOVELY LONDON SKY...
desc11.34,desc,,"Jack dims the light and glances up into the sky. He slides down the ladder, climbs onto his bicycle and rides off. BIG BEN TOLLS eight o'clock in the distance. A black car pulls up as Jack rides off. Two men in suits get out of the car: GOODING and FRYE. The men set their watches by the toll of the bell, then walk up"
scene12,slugline,,the path to the house.
desc12.35,desc,,"UP ABOVE, the Admiral and Binnacle have just made it across the rooftop. The Admiral is outraged."
utter12.36,utter,ADMIRAL BOOM,Great steaming clams - they've done it again! Those blundering blowfish have rung Big Ben too soon!
utter12.37,utter,BINNACLE,"Storm clouds on the horizon, Sir. Heading straight for Cherry Tree"
utter12.38,utter,Lane. ADMIRAL BOOM,"Batten down the hatches, Mr. Binnacle. Rough seas ahead, I fear."
desc12.39,desc,,Both men react as a SCREAM comes from the Bank's household. AAAHHH!!!
scene13,slugline,,ELLEN (O.S.) INT. THE BANKS FRONT ENTRY HALL - CONTINUOUS
desc13.40,desc,,"Inside the Banks family home, the house shows some signs of wear and inattention."
utter13.41,utter,ELLEN (O.S.),(The scream continues:) AAAHHH!!!
desc13.42,desc,,"The door that leads into the kitchen flies open - water can be seen spraying the room. ELLEN, the housekeeper, runs into the hall in a panic and calls upstairs."
scene14,slugline,,ELLEN (cont'd)
desc14.43,desc,,MICHAEL! JANE! JANE and MICHAEL BANKS rush in from the parlor behind Ellen.
utter14.44,utter,MICHAEL,"What is it, Ellen?"
utter14.45,utter,ELLEN,The bloomin' sink's exploded! Not again! Oh dear.
utter14.46,utter,MICHAEL,AUNT JANE
desc14.47,desc,,"Michael rushes into the kitchen. The boy and girl we saw earlier, ANNABEL and JOHN, run down the steps."
utter14.48,utter,AUNT JANE (cont'd),"Oh - Annabel, John - !"
utter14.49,utter,ANNABEL,"We heard, Aunt Jane - I'll ring the plumbers!"
utter14.50,utter,JOHN,I'll turn off the water at the mains!
desc14.51,desc,,John runs down into the cellar.
utter14.52,utter,AUNT JANE,"(Going into the kitchen:) Thank you, darlings - Ellen, fetch us a mop and towels, will you?"
utter14.53,utter,ELLEN,(Grumbling to herself:) I told 'im to get them pipes fixed. They been there since the Romans ruled.
desc14.54,desc,,"Ellen disappears into the cellar. GEORGIE comes down the stairs, carrying his stuffed giraffe, ""Gillie."""
utter14.55,utter,GEORGIE,What's happening?
utter14.56,utter,ANNABEL,"Don't go in the kitchen, Georgie not without your Wellies (On phone:) Yes, hello. We've had a burst pipe. (There is a TAPPING at the front door. On phone:) Excuse me (Calling:) Ellen, could you please get the"
desc14.57,desc,,door? I've got the plumbers here. Ellen comes out of the cellar with the mop and towels.
utter14.58,utter,ELLEN,"That was quick work, wasn't it?"
desc14.59,desc,,"Hands full, she gives the towels to Georgie."
utter14.60,utter,ELLEN (cont'd),"Here Georgie - take these. (Heading to the door:) Alright, alright - I'm coming."
desc14.61,desc,,"Gooding and Frye stand outside, tacking up a notice."
utter14.62,utter,GOODING,"Ah. Good morning, mum."
utter14.63,utter,ELLEN,They don't look like plumbers.
utter14.64,utter,ANNABEL,(Looks over.) I meant on the phone.
utter14.65,utter,GOODING,We are not plumbers - we're lawyers.
utter14.66,utter,ELLEN,"Lawyers? Here's me, hopin' you'd prove useful."
desc14.67,desc,,She absentmindedly hands the mop to Gooding and shuts the door.
utter14.68,utter,JOHN,Water's off!
utter14.69,utter,ANNABEL,(hanging up) And the plumbers are on their way.
desc14.70,desc,,"Aunt Jane comes out of the kitchen, her hair and the front of her dress drenched with water."
utter14.71,utter,AUNT JANE,"Well done, everyone. Phew! Such"
desc14.72,desc,,excitement!
utter14.73,utter,GEORGIE,"What are you doing here, Aunt Jane?"
utter14.74,utter,AUNT JANE,(She takes a towel from Georgie to dry off:) We're handing out breakfasts at the union hall. I snuck away for morning hugs. Come here.
desc14.75,desc,,"She wraps the towel around Georgie and gives the three children a hug. Aunt Jane takes the towels and heads back into the kitchen, Georgie picks up a towel she has accidentally dropped, following her into the kitchen. There's a knock at the door. Ellen goes over and opens it."
utter14.76,utter,ELLEN,Will you stop that bangin'? It's barely eight o'clock on a Sunday mornin'! (more)
utter14.77,utter,ELLEN (cont'd),"(She sees her mop, grabs it:) Wot'cher doin' with my mop?"
utter14.78,utter,FRYE,"Forgive the intrusion, mum. Our current workload prevents us taking weekends off."
utter14.79,utter,GOODING,"We would like to have a word with Mr. Banks, if he is available."
desc14.80,desc,,Ellen finally sees the notice on the door.
utter14.81,utter,ELLEN,"""Notice of... Repossession?"""
desc14.82,desc,,"Frye, by far the more sympathetic of the two, sighs loudly and nods sadly, looking genuinely pained. Ellen glares."
utter14.83,utter,ELLEN (cont'd),Wait there.
desc14.84,desc,,"She goes back inside. John and Annabel quickly turn away, pretending not to be paying attention. The lawyers peer through the door as Michael re-enters from the kitchen, thoroughly soaked, followed by Georgie. As Michael takes off his jacket:"
utter14.85,utter,MICHAEL,I'll be cleaning up that mess all morning.
utter14.86,utter,ANNABEL,"(Reaching for the jacket:) Here. Let me take that, father."
utter14.87,utter,MICHAEL,"Oh, thank you, darling."
desc14.88,desc,,Annabel runs upstairs with the jacket.
utter14.89,utter,ELLEN,"(Undisguised contempt:) 'Scuse me, sir - the wolves are at the door."
utter14.90,utter,MICHAEL,What do they want?
utter14.91,utter,ELLEN,"A good thrashin', if you ask me. (She looks into the kitchen, sighs.) Looks like the River Thames in there."
desc14.92,desc,,Aunt Jane comes out as Michael takes the mop from Ellen.
utter14.93,utter,MICHAEL,"Don't worry - I'll clean up, Ellen. Why don't you see to breakfast?"
utter14.94,utter,ELLEN,Suppose someone 'as to - 'less we all want to starve.
desc14.95,desc,,She goes into the kitchen.
utter14.96,utter,AUNT JANE,"(Aside, to Michael:) Why don't you let Ellen clean up?"
utter14.97,utter,MICHAEL,(A resigned sigh:) I'm afraid lately that means more work for me. The other day I found
desc14.98,desc,,a butcher's sack hanging on the
desc14.99,desc,,Aunt Jane catches sight of her damp hair in the hall mirror.
utter14.100,utter,AUNT JANE,I need a brush - I look a fright. (As she goes upstairs:) Don't forget you have guests at the
desc14.101,desc,,"door, Michael."
utter14.102,utter,MICHAEL,"Right (He goes to the door, dodging the children) I'm sorry. We're struggling through"
desc14.103,desc,,a bit of chaos this morning They take a step into the hallway. Michael closes the door behind them.
utter14.104,utter,GOODING,"So it seems. Unfortunately, Mr. Banks, our business cannot wait."
desc14.105,desc,,Ellen reappears from the kitchen.
utter14.106,utter,ELLEN,"Excuse me, sir - how exactly am I supposed to make breakfast when there's nothing in the larder but pickled herring and marmalade?"
utter14.107,utter,MICHAEL,(Hand to forehead:) The groceries - I meant to go yesterday.
utter14.108,utter,ELLEN,"(She nods, turns to go.) Very well, then. Pickled herring for breakfast, marmalade for lunch."
utter14.109,utter,JOHN,(Once Ellen has gone:) That little shop across the park will be open. The three of us can go.
utter14.110,utter,MICHAEL,"Oh, thank you, John."
utter14.111,utter,GEORGIE,"(Aside, to Annabel:) But you said we would go to the park today!"
utter14.112,utter,ANNABEL,We'll cut through the park on the way.
utter14.113,utter,GEORGIE ANNABEL,"Enough, Georgie. Come along."
desc14.114,desc,,John takes the mop from Michael.
utter14.115,utter,JOHN,"I'll take that, Father. Thank you."
desc14.116,desc,,"Aunt Jane comes back downstairs as the twins lead Georgie into the kitchen. Michael gestures for the lawyers to join him in the parlor. Aunt Jane follows, putting on her coat."
scene15,slugline,,"Please, come through INT. THE PARLOR - CONTINUOUS"
utter15.117,utter,MICHAEL,"Now, what is it I can do for you?"
utter15.118,utter,GOODING,"I am Hamilton Gooding; this is Mr. Templeton Frye. We are solicitors with the law firm of Gordy, Cordry, Gooding and Frye."
desc15.119,desc,,Aunt Jane suppresses a laugh.
utter15.120,utter,GOODING (cont'd),AUNT JANE
desc15.121,desc,,Gooding notices the poster sticking out of Aunt Jane's notebook.
utter15.122,utter,AUNT JANE,"No, it's the ""Society for the Protection of the Rights of the Underpaid Citizens of England."""
utter15.123,utter,GOODING,"A labour organizer? (Archly polite, to Frye:) She's a labour organizer."
desc15.124,desc,,"Gooding and Frye sit on the sofa. Michael sits in the armchair opposite. Aunt Jane moves round, tying her belt."
utter15.125,utter,AUNT JANE,"Well, yes - we also run soup kitchens - it's a never-ending job these days."
utter15.126,utter,FRYE,"I'm sure it is, Mrs. Banks."
utter15.127,utter,AUNT JANE,"Miss Banks, actually. I'm Michael's sister."
utter15.128,utter,MICHAEL,My wife passed away this last year.
utter15.129,utter,FRYE,That's awful! Those poor children.
utter15.130,utter,GOODING,Our deepest condolences.
utter15.131,utter,MICHAEL,Thank you. Forgive me - what brings the two of you here this morning?
utter15.132,utter,AUNT JANE,I'm going to say my good-byes.
desc15.133,desc,,Aunt Jane kisses Michael on the cheek and heads out.
utter15.134,utter,GOODING,"Mr. Banks, you took out a loan with Fidelity Fiduciary Bank last year against the value of your home."
desc15.135,desc,,Aunt Jane stops and steps back to Michael.
utter15.136,utter,AUNT JANE,You did what? Michael!
utter15.137,utter,MICHAEL,"I had to, Jane. I didn't have much choice, what with Kate and the bills piling up FRYE Hard enough these days, isn't it?"
utter15.138,utter,GOODING,"Yes, well, it seems you've fallen"
utter15.139,utter,three months behind in payments MICHAEL,"I am sorry. Kate, my wife, used to handle all our finances, you see, and I've been a bit off my stride. (Stands, walks to desk:) How much is it I owe you exactly?"
utter15.140,utter,GOODING,"Unfortunately, the bank is now demanding you pay back the entire loan in full."
utter15.141,utter,MICHAEL,The entire loan?
utter15.142,utter,GOODING,Yes - it's all in the contract.
utter15.143,utter,MICHAEL,That's more than I make in a year. I couldn't possibly. Oh dear!
desc15.144,desc,,"Gooding stands to leave, picking up his hat and briefcase."
utter15.145,utter,GOODING,"You have five days. If you are unable to pay in full by Friday at midnight, I'm afraid we will have to repossess your home, and you will have to vacate the premises."
desc15.146,desc,,"Frye sighs, distraught. Gooding glances over, irritated."
utter15.147,utter,MICHAEL,"But I work at Fidelity Fiduciary! Not as an accountant, I presume."
utter15.148,utter,MICHAEL,"No, as a teller - I took a parttime position there this past year. You see, I'm really an artist GOODING Be that as it may MICHAEL But my father, George Banks, was a senior partner there!"
utter15.149,utter,AUNT JANE,(A realization:) Father left us bank shares! You could use them to pay off the loan.
utter15.150,utter,MICHAEL,"I was saving those for the children, but Frye stands."
utter15.151,utter,FRYE,"Shares? In the bank? (Brightly, to Gooding:) That does change things, doesn't it?"
utter15.152,utter,GOODING,Do you have the share certificate?
utter15.153,utter,AUNT JANE,Sorry? The what?
utter15.154,utter,FRYE,The document GOODING The document proving you own shares in the bank.
utter15.155,utter,MICHAEL,... I suppose it must be somewhere among father's old papers.
scene16,slugline,,EXT. THE ADMIRAL'S ROOFTOP - CONTINUOUS
desc16.156,desc,,"On the rooftop next door, the Admiral and Binnacle are finally prepared to fire off the 8 a.m. cannon."
utter16.157,utter,ADMIRAL BOOM,"Primed and ready, Mr. Binnacle?"
utter16.158,utter,BINNACLE,"Ready and charged, sir."
utter16.159,utter,ADMIRAL BOOM,"On my mark. Three, two, one - FIRE!"
scene17,slugline,,INT. THE PARLOR - CONTINUOUS
desc17.160,desc,,"Inside, the cannon fire rattles the walls, knocking everything askew and terrifying the lawyers. A clock and an urn land in Gooding's hands. Ash flies out of the fireplace."
utter17.161,utter,GOODING,Good heavens! Are you housing anarchists?
desc17.162,desc,,Michael and Aunt Jane behave as though this is perfectly normal; they begin pushing all the furniture and belongings back into place as they speak.
utter17.163,utter,AUNT JANE,"No, that's the Admiral. He fires off a cannon to mark the hour."
utter17.164,utter,FRYE,(He checks his watch:) But he's over five minutes late.
utter17.165,utter,MICHAEL,"Yes, I'm afraid he's been running a little behind these last few years."
desc17.166,desc,,Michael and Aunt Jane push the piano back in place.
utter17.167,utter,GOODING,"As are we, this morning. You've been given notice; (Hands Michael the notice) We'll see ourselves out. Come along, Mr. Frye."
utter17.168,utter,FRYE,(putting on his hat) I hope you find that share certificate. I really do.
utter17.169,utter,GOODING,"Good day to you both. (As they leave, to Frye:) You really have chosen the wrong profession, you know..."
desc17.170,desc,,The door shuts.
utter17.171,utter,AUNT JANE,"Why didn't you tell me you had taken out a loan, Michael?"
desc17.172,desc,,Michael moves away from Jane.
utter17.173,utter,MICHAEL,"I didn't want to worry you - or the children. I kept thinking I would catch up. Kate always managed. (He shakes his head:) Of all the thick-headed mistakes... I can't lose our home, Jane. She's everywhere here."
utter17.174,utter,AUNT JANE,"Well then we aren't going to let that happen. But, Michael, you know we neither of us have enough money between us - so we just have to find that share certificate. Do you have any idea where father might have kept it?"
utter17.175,utter,MICHAEL,"Up in the attic, I suppose... (He tucks away his emotions, smiles.) ... I'm sorry, I didn't mean to bring you into all this."
utter17.176,utter,AUNT JANE,"(Exasperated:) Michael! This is our family home, and you're about to lose it - so stop pretending everything's fine."
utter17.177,utter,GEORGIE (O.S.),Are we going to lose our home?
desc17.178,desc,,"Michael and Aunt Jane turn. Georgie and the twins, having entered from the dining room in their coats and wellies, have been listening to them."
utter17.179,utter,MICHAEL,"Oh, no - no, of course not, Georgie."
utter17.180,utter,AUNT JANE,"I was saying you won't have to worry, because your father owns shares in the bank."
utter17.181,utter,GEORGIE,But you said we don't have enough money.
desc17.182,desc,,Michael grabs paper and pen and sketches something.
utter17.183,utter,MICHAEL,"Well, I can make more - I am a banker now, aren't I? That's what bankers do - make money."
utter17.184,utter,GEORGIE,But you're not a banker - you're a painter.
utter17.185,utter,MICHAEL,"Yes, well - painters don't make money. Not these days. Here, you see? The day has hardly begun and I've already made you 10 pounds."
desc17.186,desc,,"Michael hands Georgie what he's drawn - a decent likeness of a 10-pound note. Annabel and John exchange a glance, seeing through Michael's false cheer instantly. Georgie smiles."
utter17.187,utter,JOHN,(Looking at his watch:) We'd best be going.
utter17.188,utter,AUNT JANE,Let's get your hats on then.
desc17.189,desc,,Annabel goes to the front hall coat rack to get their hats.
utter17.190,utter,MICHAEL,"(With a wink, handing a few coins to John:) John, one moment. Georgie shouldn't have to spend his 10 pounds on the shopping - here you are."
utter17.191,utter,JOHN,"Thank you, father."
utter17.192,utter,ELLEN,"(Entering:) Off to the park now, I see."
utter17.193,utter,ANNABEL,"Yes - that's right, Ellen."
desc17.194,desc,,Ellen helps the children with their hats. Aunt Jane takes off her coat as she heads for the stairs.
utter17.195,utter,AUNT JANE,"(To Michael:) Shall we search the attic, then?"
utter17.196,utter,MICHAEL,Don't you have to go to work?
utter17.197,utter,AUNT JANE,(Rolling up her sleeves:) Work can wait.
desc17.198,desc,,Michael follows her up the stairs.
utter17.199,utter,MICHAEL,"Thank you, Jane - yes, I'll look in the attic. Why don't you check father's old wardrobe?"
desc17.200,desc,,Ellen follows the children to the front door.
utter17.201,utter,JOHN,"We'll make lunch when we get home, Ellen."
desc17.202,desc,,"Annabel takes Gillie from Georgie, handing it to Ellen."
utter17.203,utter,ANNABEL,Gillie stays here.
utter17.204,utter,ELLEN,(As the children leave:) Blimey - such little grown-ups you've become.
scene18,slugline,,EXT. THE PARK - DAY
desc18.205,desc,,Annabel reads over the shopping list as the children walk through the park.
utter18.206,utter,ANNABEL,"Father didn't give us enough, did he?"
utter18.207,utter,JOHN,Not nearly.
utter18.208,utter,ANNABEL,We can ask for day-old bread at half off; that's what mother used to do.
desc18.209,desc,,"Georgie smiles, seeing MISS LARK, the children's wealthy neighbor, walking her dog WILLOUGHBY."
utter18.210,utter,GEORGIE,"Hello, Willoughby! Hello, Miss Lark!"
utter18.211,utter,MISS LARK,"Hello, Georgie! Twins."
utter18.212,utter,JOHN,"Come on Georgie, we haven't got time for this."
desc18.213,desc,,Willoughby barks. Georgie notices a woman selling balloons (BALLOON LADY) in the distance. He cuts across the grass toward her:
utter18.214,utter,GEORGIE,The balloon lady! Can we get balloons?
utter18.215,utter,ANNABEL,"No, Georgie - we haven't enough for groceries as it is."
desc18.216,desc,,"The Park Keeper appears, calling to Georgie."
utter18.217,utter,PARK KEEPER,"Oi, Georgie Banks - keep off the grass! I don't spend all day caring for it just to see my work get trampled on! Go on, hop it!"
desc18.218,desc,,Georgie sighs and reluctantly returns to the path.
utter18.219,utter,ANNABEL JOHN,"(Quietly, to Annabel:) What if Father does lose the house?"
utter18.220,utter,ANNABEL,"We'll just have to figure out a way to get it back, I suppose."
utter18.221,utter,JOHN,You're right... That's what mother would do.
scene19,slugline,,INT. THE ATTIC - DAY
desc19.222,desc,,"The attic is a complete mess. Michael's easels, canvases and art supplies are all piled up in a corner. Michael goes over to an old desk. He searches through its drawers, then picks up a wooden storage crate. Inside the crate, Michael finds a jewelry box with an engraved ""K"" on its lid. When he opens it, a gentle melody plays. He takes out a necklace of his wife's, gazing at it a moment. He sets the box aside and continues searching the attic, still holding the necklace - but he can't get the gentle melody out of his head... ""A CONVERSATION"""
utter19.223,utter,MICHAEL,WE HAVEN'T SPOKEN IN SO LONG DEAR
desc19.224,desc,,THIS YEAR HAS GONE BY IN A BLUR TODAY SEEMS EVERYTHING'S GONE WRONG HERE
utter19.225,utter,MICHAEL (cont'd),I'M LOOKING FOR THE WAY THINGS WERE I KNOW YOU'D LAUGH AND CALL ME TRAGIC
desc19.226,desc,,FOR EVERYTHING'S IN DISARRAY THESE ROOMS WERE ALWAYS FULL OF MAGIC THAT'S VANISHED SINCE YOU WENT AWAY THIS HOUSE IS CROWDED NOW WITH QUESTIONS YOUR JOHN'S A WALKING QUESTIONNAIRE AND I COULD SURELY USE A FEW SUGGESTIONS ON HOW TO BRUSH OUR DAUGHTER'S HAIR WHEN GEORGIE NEEDED EXPLANATIONS YOU ALWAYS KNEW JUST WHAT TO SAY AND I MISS OUR FAMILY CONVERSATIONS IT'S SILENT SINCE YOU WENT AWAY Michael looks out of the window. WINTER HAS GONE BUT NOT FROM THIS ROOM SNOW'S LEFT THE LANE BUT THE CHERRY TREES FORGOT TO BLOOM He reminds himself to keep searching. The certificate... The
desc19.227,desc,,"I'LL CARRY ON THE WAY YOU TOLD ME I SAY THAT LIKE I HAVE A CHOICE AND THOUGH YOU ARE NOT HERE TO HOLD ME IN THE ECHOES I CAN HEAR YOUR VOICE BUT STILL ONE QUESTION FILLS MY DAY DEAR THE ANSWER I'VE MOST LONGED TO KNOW EACH MOMENT SINCE YOU WENT AWAY DEAR MY QUESTION, KATE, IS ""WHERE'D YOU GO?"" As Aunt Jane enters, Michael puts away the necklace and closes the lid of the jewelry box, turning away to hide his emotions."
utter19.228,utter,AUNT JANE,Nothing in the wardrobe. (Gazing around the attic:) Oh my goodness.
utter19.229,utter,MICHAEL,"(He turns back, smiling:) Yes, it's quite a mess, isn't it?"
desc19.230,desc,,Aunt Jane notices Michael's art supplies.
utter19.231,utter,AUNT JANE,What are all your art things doing up here?
utter19.232,utter,MICHAEL,I wasn't using them anymore. I should probably get rid of it all.
utter19.233,utter,AUNT JANE,Have you looked in father's old desk?
utter19.234,utter,MICHAEL,(pulling out an old snowglobe) I honestly don't know why we kept most of this stuff to begin with.
