segment-id,segment-type,segment-speaker,segment-text
desc30.448,desc,,"As Georgie struggles to carry the bin, he pauses to look at the final drawing that landed in the pile, which shows a playful depiction of the house in happier times, when mother was still alive. In the drawing, Father stands in front of the house with his arms around John and Annabel and mother cradles Georgie in her arms. Everyone beams with happiness. Georgie takes the drawing out of the bin, folds it and puts it in his pocket."
scene31,slugline,,EXT. THE BANK - DAY
desc31.449,desc,,ESTABLISHING SHOT - The next morning. It is raining; a sea of black umbrellas swirl along the sidewalk outside the bank.
scene32,slugline,,INT. THE BANK VAULT - DAY
desc32.450,desc,,CLOSE on a safety deposit box. Michael flips through a small stack papers as Aunt Jane watches. He finds nothing.
utter32.451,utter,MICHAEL,Well. That's that.
desc32.452,desc,,Michael puts everything back into the box and gestures for a BANK OFFICER to lock it away again.
utter32.453,utter,AUNT JANE,"What about Mr. Dawes, Jr.? Couldn't he give you more time?"
utter32.454,utter,MICHAEL,I'm sure he would if he were still here. Dawes' nephew has been running things lately. I'm not even sure he knows who I am.
utter32.455,utter,AUNT JANE,"(She rises, heading for the door:) Well, it's high time he finds out, don't you think?"
utter32.456,utter,MICHAEL,Jane - ? Jane!
scene33,slugline,,"INT. THE BANK, MAIN FLOOR - CONTINUOUS"
desc33.457,desc,,"By the time Michael leaves the vault, Aunt Jane is halfway across the bank. He tries to get Aunt Jane's attention as she strides up the staircase at the far end of the main floor."
utter33.458,utter,MICHAEL,(Whispered:) Jane... Jane!
scene34,slugline,,INT. OUTSIDE MR. WILKINS' OFFICE - CONTINUOUS
utter34.459,utter,MICHAEL,We can't just charge into his office.
scene35,slugline,,"Aunt Jane arrives at the desk of MISS PENNY FARTHING (30s),"
desc35.460,desc,,Mr. Wilkins' receptionist; Michael is not far behind.
utter35.461,utter,AUNT JANE,"Hello, Miss... (Off her name plaque:) ... Penny Farthing, is it? Heavens, did the old secretary finally retire? (more)"
utter35.462,utter,AUNT JANE (cont'd),She always had that jar of sweets on the desk that we would raid as
desc35.463,desc,,"children MR. WILKINS (50s, patrician, sporting a thin, waxed mustache), sticks his head out of his office, a kindly smile on his face."
utter35.464,utter,WILKINS,"I remember that jar - with those little toffees that stuck your teeth together. We must get you one of those jars, Miss Farthing."
utter35.465,utter,MISS FARTHING,"Of course, sir."
utter35.466,utter,WILKINS,"This wouldn't happen to be your sister, would it, Mr. Banks?"
utter35.467,utter,AUNT JANE,Yes - Jane Banks. How do you do?
desc35.468,desc,,They shake hands.
utter35.469,utter,WILKINS,Great pleasure to meet you -William Weatherall Wilkins. (Waving them in:) Do step this way.
desc35.470,desc,,"Michael blinks, surprised. Aunt Jane smiles."
scene36,slugline,,INT. WILKINS' OFFICE - DAY
desc36.471,desc,,"A SHORT TIME LATER: Wilkins sits at the desk, examining paperwork as Michael and Aunt Jane look on. He has an enormous office with a roaring fireplace and a view of Big Ben out the window behind his desk."
utter36.472,utter,WILKINS,"If I had known George Banks' son had taken a loan with us, I'd have handled the paperwork myself. Unfortunately, regarding the extension, there's very little I can do at this point."
utter36.473,utter,MICHAEL,Our father did leave us shares in the bank.
desc36.474,desc,,"This is news to Wilkins. He looks up, smiling with interest."
utter36.475,utter,WILKINS,"Oh, well, that is good news."
utter36.476,utter,AUNT JANE,"Yes, it is, but the trouble is, we can't seem to find the share certificate."
utter36.477,utter,MICHAEL,"You wouldn't happen to have any record of our father's shares, would you?"
utter36.478,utter,WILKINS,"I would think so. (Tapping his intercom:) Would you bring in the shareholder's ledger, Miss Farthing?"
scene37,slugline,,MISS FARTHING (INTERCOM)
utter37.479,utter,AUNT JANE,"What about your uncle, Mr. Dawes, Jr.? He would know if our father received shares, wouldn't he?"
desc37.480,desc,,"Wilkins sighs, gesturing to a portrait of his uncle."
utter37.481,utter,WILKINS,"I'm afraid dear old Uncle Dawes is getting on in years. (He taps his temple.) ""Non compos mentis"" - which, sadly, is why I had to take over for him. Ah - thank you, Miss Farthing."
desc37.482,desc,,"Miss Farthing has entered. She hands Wilkins the ledger and leaves. Wilkins flips pages, runs a finger along the columns."
utter37.483,utter,WILKINS (cont'd),"Let's see. Babcock, Baker... hmm. There's no listing of George Banks here. But don't despair. (Pointing out the window to Big Ben:) You still have until that big fellow out there chimes his last on Friday night to find that certificate. I'll keep searching here as well."
desc37.484,desc,,Aunt Jane and Michael rise.
utter37.485,utter,MICHAEL,"Thank you so much, Mr. Wilkins."
desc37.486,desc,,They shake hands. As Michael and Aunt Jane head to the door:
utter37.487,utter,AUNT JANE,"Yes, thank you. It was such a pleasure to meet you."
desc37.488,desc,,"Michael and Aunt Jane leave. Wilkins absently takes out his pocket watch, swinging it. He hits his intercom button."
utter37.489,utter,WILKINS,"Bring me all of George Banks' old files, would you?"
scene38,slugline,,MISS FARTHING (INTERCOM)
desc38.490,desc,,"Wilkins walks round to his chair, swinging his pocket-watch, and reopens the ledger. He turns to a page with the name GEORGE BANKS written in bold letters. He tears the page out and tosses it into the flames."
scene39,slugline,,INT. THE NURSERY - EVENING
desc39.491,desc,,"The children are already in bedclothes and robes when Mary Poppins enters, carrying a neatly-folded pile of children's clothing. She sees Georgie jumping on the bed."
utter39.492,utter,MARY POPPINS,"Georgie! This is a nursery, let me"
desc39.493,desc,,"remind you, not a music hall."
utter39.494,utter,GEORGIE,Can we have another bath?
utter39.495,utter,MARY POPPINS,"Oh, pish posh. (Turning:)"
desc39.496,desc,,"John, you'd best go downstairs and CRASH! From downstairs comes the sound of breaking glass. MARY POPPINS (cont'd) - help Ellen put away the dishes."
utter39.497,utter,JOHN,"Yes, Mary Poppins."
desc39.498,desc,,"He goes. Mary Poppins heads for the wardrobe. Annabel intercepts her, reaching for the clothes."
utter39.499,utter,ANNABEL,Here - I can put those away myself. Very well.
scene40,slugline,,MARY POPPINS
desc40.500,desc,,Mary Poppins glances to the broken kite which leans against Georgie's bed. Sternly:
utter40.501,utter,MARY POPPINS (cont'd),"Georgie Banks - if you're hoping I'll let you take this sadlyneglected kite to the park tomorrow, you had better start patching it up this instant."
utter40.502,utter,GEORGIE,"(Smiling:) Yes, Mary Poppins."
scene41,slugline,,INT. DINING ROOM - EVENING
desc41.503,desc,,"Ellen is on a chair, doing her best to put dishes on a high shelf in the china cabinet. John enters just as Ellen is about to drop them."
utter41.504,utter,JOHN,Here - let me help you with those.
utter41.505,utter,ELLEN,Oh - there's a good lad. Such a help you are. (She kicks the broken plates away:) I only wish I could do somethin' to 'elp your father save this old
utter41.506,utter,house.,"(A beat. She considers.) I could sell my broach and necklace, I suppose - matching set, my old mum gave 'em to me."
desc41.507,desc,,Ellen picks up a large platter and holds it out to John.
utter41.508,utter,JOHN,You'd do that for us?
desc41.509,desc,,Ellen pulls the platter away and holds it to her chest.
utter41.510,utter,ELLEN,What?? Sell my prized possessions?
utter41.511,utter,JOHN,"Oh no, I didn't mean it like that."
utter41.512,utter,ELLEN,"Oh, don't worry. (She hands him the platter. Confidentially:) I think they're fakes, anyway. (hands over serving bowl) There's plenty in this house worth more than them old trinkets."
desc41.513,desc,,John stares at the china soup tureen he's holding. He quickly passes it back to Ellen and rushes out of the room.
utter41.514,utter,JOHN,"If you'll excuse me, Ellen ELLEN What's got into 'im?"
scene42,slugline,,INT. THE NURSERY - EVENING
desc42.515,desc,,"Georgie sits on his bed, Gillie at his side. He uses scissors to cut up his father's drawing of the family and patches his kite with the pieces. Annabel is putting toys back in the toy chest when John comes rushing back in."
utter42.516,utter,JOHN,(With quiet urgency:) Annabel - I know how to save the house!
utter42.517,utter,ANNABEL,What do you mean?
desc42.518,desc,,"Mary Poppins enters from her room, crossing to shut the drapes."
utter42.519,utter,MARY POPPINS,"If you two are going to keep up all this whispering, I would like you to practice doing so as loudly as possible. It will still be bad manners, but at least then we'll all be in on the secret."
desc42.520,desc,,"Mary Poppins notices Jack polishing one of the brass lamps on the front portico of the house. She opens the window. MARY POPPINS (cont'd) Hello, Jack! Jack smiles. He swings himself up onto the portico, climbs along the ledge to the nursery window and onto the balcony."
utter42.521,utter,JACK,Mary Poppins! How are you this fine evening?
utter42.522,utter,MARY POPPINS,"Settling in quite nicely, thank you."
utter42.523,utter,JACK,"(Climbing up:) Y'know, when I was a lad, I used to wave up to the boy and girl who lived here."
utter42.524,utter,MARY POPPINS,You mean Michael and Jane.
utter42.525,utter,JACK,"Miss Jane Banks, that's right. I see Mr. Banks about now and again it's been ages since I've seen her."
desc42.526,desc,,"Now that Mary Poppins' back is turned, John taps Annabel on the shoulder and hurries over to the mantelpiece. They talk in whispers."
utter42.527,utter,MARY POPPINS,She lives in a flat on the other side of town now. I'm sure you'll bump into her one of these days.
desc42.528,desc,,"Across the room: John takes the china bowl off the mantelpiece. It has an illustration of an autumn scene in a park, with leaves falling from the trees. A carriage drives along a winding path. A CLYDESDALE HORSE in mid-gallop is hitched to the carriage. We see the COACHMAN from the back; he wears a top hat and high collar, and holds a whip in his hand."
utter42.529,utter,ANNABEL,(Whispering:) What are you doing? We're not supposed to touch that.
utter42.530,utter,JOHN,"(Looking closely at the bowl:) This is authentic Royal Doulton china, Annabel. Mother always said it was priceless, and I bet it'll be enough to pay off father's debt."
desc42.531,desc,,Annabel grabs the bowl off John. He grabs it back from her.
utter42.532,utter,ANNABEL,"That's a terrible idea, John. Mother loved that bowl."
utter42.533,utter,JOHN,But she'd sell it herself to save the house.
desc42.534,desc,,Georgie sees John holding the bowl and hurries over.
utter42.535,utter,GEORGIE,That was mother's - put that back! (Grabbing for the bowl:) Put it back!
utter42.536,utter,ANNABEL,Here - give it to me.
desc42.537,desc,,"Jack now sits on the windowsill, chatting with Mary Poppins. He lowers his voice, leaning in:"
utter42.538,utter,JACK,"It's a good thing you come along when you did, Mary Poppins."
desc42.539,desc,,"As they tussle, the bowl slips and hits the floor, cracking it and breaking a wedge-shaped piece from the rim."
utter42.540,utter,JACK (cont'd),"(Wincing:) That didn't sound good, now did it?"
desc42.541,desc,,John picks up the bowl. Mary Poppins doesn't turn.
utter42.542,utter,MARY POPPINS,What are the three of you up to?
desc42.543,desc,,"The children look at one another in a panic. John looks at the bowl, and sees a piece missing."
utter42.544,utter,JOHN,(An urgent whisper:) Give me the missing piece!
utter42.545,utter,ANNABEL,I haven't got it!
utter42.546,utter,JOHN,Well look for it then!
desc42.547,desc,,John places the bowl back on the mantelpiece.
utter42.548,utter,MARY POPPINS,Which of you broke the bowl?
desc42.549,desc,,"The three turn back around. Mary Poppins stands before them, Jack behind her. She holds the missing piece in her hand."
utter42.550,utter,JOHN,Georgie did.
utter42.551,utter,GEORGIE,I did not! It was Annabel.
utter42.552,utter,ANNABEL,If John hadn't taken it off the mantel! The children all starting arguing at the same time.
desc42.553,desc,,A voice comes from the bowl behind them. 1ST VOICE (HORSE - O.S.)
desc42.554,desc,,"The children turn, bewildered, glancing over to the door and the window, wondering where the voices came from."
utter42.555,utter,JOHN,Who said that?
desc42.556,desc,,Mary Poppins walks up and peers at the bowl.
scene43,slugline,,MARY POPPINS
desc43.557,desc,,"They all peer at the bowl. THE ILLUSTRATION HAS CHANGED - the crack has caused one of the carriage wheels to fall off, and the carriage has tipped onto its axle. The Horse now stares directly out of the bowl at the children, while the Coachman peers down at the broken wheel."
utter43.558,utter,ANNABEL,Look - the picture's changed.
desc43.559,desc,,"We see Mary Poppins and the group peering into the bowl from the horses' ""fish-eye lens"" point of view."
utter43.560,utter,MARY POPPINS,It looks as though they've broken your carriage wheel. 2ND VOICE (COACHMAN - O.S.) (Irish accent:) That they have. It's useless now. HORSE (O.S.) Useless as a chocolate teapot.
utter43.561,utter,JOHN,The bowl is speaking!
utter43.562,utter,COACHMAN (O.S.),And who do we think is going to fix that?
utter43.563,utter,JACK,"Ay, there's the riddle. Them what broke it fixes it. That's what I say. What do you think, Mary Poppins?"
utter43.564,utter,MARY POPPINS,(Irritated:) I suppose we have no choice.
utter43.565,utter,JOHN,(Wide-eyed:) But how are we going to do that?
utter43.566,utter,JACK,I know a bit about fixing carriages.
utter43.567,utter,ANNABEL,We can't fix their carriage wheel. It isn't possible!
utter43.568,utter,MARY POPPINS,Everything is possible - even the impossible.
desc43.569,desc,,"Mary Poppins takes the bowl, sets it on a small table in the center of the nursery and presses the missing piece back in place."
utter43.570,utter,MARY POPPINS (cont'd),"Now, gather 'round everyone - spit, spot! They do so."
utter43.571,utter,MARY POPPINS (cont'd),"Georgie, don't forget Gillie! Are we ready?!"
desc43.572,desc,,"The children watch in astonishment as Mary Poppins SPINS THE BOWL on the table. Colorful leaves fly out of the bowl in all directions, filling the air and swirling around everyone, covering them completely. When the leaves fall away, they find themselves in..."
scene44,slugline,,EXT. A PATH THROUGH THE PARK (ANIMATED) - DAY
desc44.573,desc,,"... the ANIMATED WORLD of the Doulton china bowl. Jack and the children are stunned to discover they're now wearing turnof-the-century dress. Mary Poppins holds an elegant parasol. While they are still very much real, everything around them is animated."
utter44.574,utter,GEORGIE JOHN,What just happened?
utter44.575,utter,ANNABEL,Where are we?
desc44.576,desc,,"Jack lifts a finger, tapping the air behind him - we hear the 'tink, tink' of his finger against the bowl."
utter44.577,utter,JACK,"Looks like we're in China, so to speak."
desc44.578,desc,,Mary Poppins slides down a porcelain slope to the carriage.
utter44.579,utter,MARY POPPINS,"Over here, everyone - this wheel won't fix itself."
desc44.580,desc,,The others manage the slope much less gracefully;
utter44.581,utter,MARY POPPINS (cont'd),"Tread lightly, please - this is fine porcelain, we don't want to chip the glaze."
desc44.582,desc,,Georgie loses his balance completely and tumbles down to the
utter44.583,utter,MARY POPPINS (cont'd),"Oh Georgie - head up and feet beneath you. (Turning to the carriage:) Excuse me, driver, would you help us?"
desc44.584,desc,,The Coachman turns. The children see that he's actually an IRISH SETTER in uniform.
utter44.585,utter,COACHMAN,"Well, Mary Poppins! Is it yourself?"
utter44.586,utter,JOHN,But he's - !
utter44.587,utter,ANNABEL,But you're - !
utter44.588,utter,COACHMAN,That's right: I'm Irish - also part poodle. (barks) Woof!
utter44.589,utter,MARY POPPINS,"How wonderful to see you, Shamus. So sorry about all this. Would you"
desc44.590,desc,,help Jack lift the carriage while the children put the wheel back on?
utter44.591,utter,COACHMAN,With pleasure!
utter44.592,utter,GEORGIE,(Amazed:) She's talking to a dog!
utter44.593,utter,HORSE,"Well, of course she can talk!"
utter44.594,utter,MARY POPPINS,"Take your places, everyone. Ready? ... And LIFT!"
desc44.595,desc,,Jack and the Coachman lift the carriage. The children put the wheel on. Mary Poppins uses her scarf to tie it in place.
utter44.596,utter,MARY POPPINS (cont'd),"(As she ties the scarf:) Let's see now, this should do it. There we are - shipshape."
utter44.597,utter,COACHMAN,Not a bad job at all.
utter44.598,utter,HORSE,S'pose it'll have to do.
desc44.599,desc,,Mary Poppins finishes tying the scarf around the wheel.
utter44.600,utter,MARY POPPINS,Back to the nursery we go.
utter44.601,utter,ANNABEL,Back already?
utter44.602,utter,JOHN,Can't we stay in the bowl for a while?
utter44.603,utter,GEORGIE,I want a carriage ride.
utter44.604,utter,JACK,I wouldn't mind one m'self.
utter44.605,utter,MARY POPPINS,"I suppose it wouldn't do any harm. Shamus, would you mind?"
utter44.606,utter,COACHMAN,"Not in the least. Climb aboard, everyone!"
desc44.607,desc,,"ANNABEL, JOHN AND GEORGIE"
utter44.608,utter,COACHMAN,(As they climb aboard:) Mind the step. Plant yourselves comfy! Where would you all like to go this fine day?
scene45,slugline,,"The Royal Doulton Music Hall,"
utter45.609,utter,JOHN GEORGIE,What's that?
utter45.610,utter,MARY POPPINS,"We're on the brink of an adventure, children - don't spoil it with too many questions."
utter45.611,utter,COACHMAN,"Let's go, Clyde!"
desc45.612,desc,,"The Coachman cracks his whip in the air and the horse trots along the cobblestones, hooves clanking on the china. ""THE ROYAL DOULTON MUSIC HALL"""
utter45.613,utter,MARY POPPINS,"IN THE NURSERY, YOU WERE NEVER"
utter45.614,utter,BY YOURSELF,THERE WAS QUITE ANOTHER WORLD
utter45.615,utter,UPON YOUR SHELF,Hold on!
desc45.616,desc,,The carriage climbs up the side of the bowl and turns upside down as it follows the path up the edge of the bowl and crosses over the lip. MARY POPPINS WHERE EACH DAY CROWDS MAKE THEIR WAY UPON THE SUN'S DESCENT TO A MYTHICAL MYSTICAL NEVER QUITE LOGISTICAL TENT! The carriage turns right side up again. YES IN THIS DEARLY DYNAMICAL SIMPLY CERAMICAL
scene46,slugline,,ROYAL DOULTON BOWL
desc46.617,desc,,"THERE'S A CUDDLY AND CURIOUS FURRY AND FURIOUS ANIMAL WATERING HOLE Two hummingbirds lands on Mary Poppins' finger. She shows them to Jack. WHERE THE MONKEYS AND HUMMINGBIRDS KNOW THE TUNES AND THE WORDS EVERY BEAST LARGE AND SMALL The hummingbirds flies away, leading us to an elegant family, walking along the path beside them; Jack and the children are astounded to see beaks and snouts sticking out from under their parasols and top hats. LOVES THE VERY TOP DRAWER-ABLE ALWAYS ENCORE-ABLE ROYAL DOULTON..."
scene47,slugline,,...MUSIC HALL!
utter47.618,utter,COACHMAN,"Nearly there, Mary Poppins!"
desc47.619,desc,,"Georgie climbs to the front of the carriage and sits next to Shamus. Jack sits across from Mary Poppins. They pass a giraffe riding a Penny Farthing. Georgie is amazed and shows Gillie the giraffe. MARY POPPINS & JACK YES IN THIS MARVELOUS, MYSTICAL RATHER SOPHISTICAL"
desc47.620,desc,,A gang of monkeys swing over the carriage.
utter47.621,utter,JACK,THERE'S A LOTTA BIRDS QUEUING UP
desc47.622,desc,,(A monkey lands on Jack's
desc47.623,desc,,SCENERY THEY SWALLOW WHOLE Georgie swaps hats with Shamus. THERE ARE LOTSA CATS TUNING
desc47.624,desc,,MARY POPPINS NIGHTINGALES IN THE WINGS MARY POPPINS & JACK WAITING FOR THEIR BIG DRUM ROLL Elaborate gates open ahead of them.
desc47.625,desc,,AT THE SIMPLY SENSATIONAL MARY POPPINS
scene48,slugline,,STANDING OVATION-AL
desc48.626,desc,,"They pass through the gates with the words ""ROYAL DOULTON MUSIC HALL"" scrolled into their ironwork. MARY POPPINS & JACK ROYAL DOULTON... MARY POPPINS, JACK & CHILDREN"
scene49,slugline,,...MUSIC HALL
desc49.627,desc,,The carriage comes to a stop in a large open space.
utter49.628,utter,COACHMAN,Here we are!
utter49.629,utter,ANNABEL,But... where's the music hall?
utter49.630,utter,MARY POPPINS,"Oh, yes - that. Silly me."
desc49.631,desc,,Mary Poppins opens her parasol and spins it in the air. PULL BACK TO REVEAL that the parasol has transformed into an enormous...
scene50,slugline,,EXT. MUSIC HALL TENT (ANIMATED) - NIGHT
desc50.632,desc,,"It is now NIGHTTIME. Mary Poppins, Jack and the children find themselves in line at the grand music hall tent, which is festooned with lights. The children are astounded. JOHN/ANNABEL/GEORGIE"
utter50.633,utter,ANNABEL,How on Earth did she do that?
utter50.634,utter,JACK,(Shrugs:) One thing you should know about Mary Poppins - she never explains anything.
utter50.635,utter,WOLF (O.S.),"Hurry, hurry - only a few seats left!"
desc50.636,desc,,"A WOLF with a thin waxed mustache acts as barker, swinging his pocket watch in a manner that makes him look suspiciously like Wilkins. A BADGER and a WEASEL selling tickets behind him look remarkably like Gooding and Frye."
utter50.637,utter,WOLF (cont'd),"Get tickets while you can for the one-night only, one and only - ! (Seeing her:) Mary Poppins! What an honor it is to have you join us this evening. Thank you."
utter50.638,utter,MARY POPPINS WOLF,"And who's this I see? Why, it's John, Annabel and Georgie Banks!"
utter50.639,utter,JOHN,You know us?
utter50.640,utter,WOLF,Of course - everyone knows the Banks children.
utter50.641,utter,BADGER,We've all been watching you in the nursery for years.
utter50.642,utter,WEASEL,It's so good to finally meet you.
utter50.643,utter,WOLF,Hurry along now - get yourselves some peanuts and candy floss and go right on in.
utter50.644,utter,GEORGIE,"May we, Mary Poppins?"
utter50.645,utter,MARY POPPINS,Yes - just keep away from the edge of the bowl.
desc50.646,desc,,They hurry off.
scene51,slugline,,INT. MUSIC HALL TENT (ANIMATED) - CONTINUOUS
desc51.647,desc,,"Inside, DANCING FLAMINGO SHOWGIRLS finish up the pre-show act."
desc51.648,desc,,... AT THE HIGHLY-ACCLAIMABLE NEARLY UNTAMEABLE LAVISHLY PRAISABLE ALWAYS ROOF-RAISE-ABLE
scene52,slugline,,ROYAL DOULTON... ... MUSIC HALL!
desc52.649,desc,,"Enthusiastic animal patrons fill the tiered seating that surrounds the stage. Mary Poppins, Jack and the children hurry to front-row seats. John sits down and immediately jumps up again. He turns to see a hedgehog family on the seat beneath him. Mr. Hedgehog doffs his cap. John smiles back and sits one seat in. Applause. Lights out. Drum roll. Rimshot - a spotlight hits center stage. The children are surprised to see Jack, who was just next to them, now standing in the spotlight."
utter52.650,utter,JACK,"Bucks and mares, cubs and does welcome to our show of shows!"
desc52.651,desc,,Georgie places Gillie in Jack's now-empty seat.
utter52.652,utter,JACK (cont'd),"It is my great honor to introduce this evening's renowned guest... the one, the only MARY POPPINS!"
desc52.653,desc,,"The crowd goes wild. Jack bounds to the front of the stage to offer her his hand. Mary Poppins joins him onstage. AUDIENCE Sing for us, Mary Poppins!"
utter52.654,utter,JACK,C'mon - have a go!
utter52.655,utter,MARY POPPINS,"(Dismissively:) Oh, I haven't sung in years."
desc52.656,desc,,"Four ""familiar"" PENGUINS peak their heads out from the center split of the stage curtains."
utter52.657,utter,PENGUINS,"Please, Mary Poppins? Please..."
utter52.658,utter,MARY POPPINS,"No, I couldn't possibly. (To the orangutan CONDUCTOR:) D Flat Major."
desc52.659,desc,,"As she steps into the spotlight, the curtains part just enough to reveal a large, open book that acts as a dressing screen, with a bowler hat and hooked cane hanging on it. The penguins push the set forward as Mary Poppins steps behind the screen and transforms into character. ""A COVER IS NOT THE BOOK"" MARY POPPINS (cont'd) UNCLE GUTENBERG WAS A BOOKWORM AND HE LIVED ON CHARING CROSS THE MEMORY OF HIS VOLUMES BRINGS A SMILE HE WOULD READ ME LOTS OF STORIES WHEN HE WASN'T ON THE SAUCE"
desc52.660,desc,,OF MY FAVORITE BIBLIOPHILE
desc52.661,desc,,"The dressing screen flies out, revealing Mary Poppins in full costume. The stage curtains open fully, revealing a set composed of piles of enormous books. A COVER IS NOT THE BOOK SO OPEN IT UP AND TAKE A LOOK CAUSE UNDER THE COVERS ONE DISCOVERS THAT THE KING MAY BE A CROOK CHAPTER TITLES ARE LIKE SIGNS AND IF YOU READ BETWEEN THE LINES YOU'LL FIND YOUR FIRST IMPRESSION WAS MISTOOK FOR A COVER IS NICE BUT A COVER IS NOT THE BOOK! TA-RU-RA-LEE TA-RA-TA-TA-TA TA-RU-RA-LEE TA-RA-TA-TA-TA"
desc52.662,desc,,"Mary Poppins, could you give us an example?"
desc52.663,desc,,"An oversized book on stage magically opens, creating a Victorian ""Pop-Up"" set on which she performs. ""NELLIE RUBINA"" WAS MADE OF WOOD BUT WHAT COULD NOT BE SEEN WAS THOUGH HER TRUNK UP TOP WAS BARREN WELL, HER ROOTS WERE LUSH AND GREEN SO IN SPRING WHEN MR. HICK'RY SAW HER BLOSSOMS BLOOMIN' THERE HE TOOK ROOT (DESPITE HER BARK) AND NOW THERE'S SEEDLINGS EVERYWHERE! Jack slides down a book and joins her in the song and dance. MARY POPPINS & JACK WHICH PROVES A COVER IS NOT THE BOOK SO OPEN IT UP AND TAKE A LOOK CAUSE UNDER THE COVERS ONE DISCOVERS THAT THE KING MAY BE A CROOK"
desc52.664,desc,,CHAPTER TITLES ARE LIKE SIGNS
desc52.665,desc,,AND IF YOU READ BETWEEN THE LINES MARY POPPINS & JACK YOU'LL FIND YOUR FIRST IMPRESSION WAS MISTOOK FOR A COVER IS NICE BUT A COVER IS NOT THE BOOK!
utter52.666,utter,JACK,"Shall we do the one about the ""Wealthy Widow?"""
utter52.667,utter,MARY POPPINS,By all means!
utter52.668,utter,JACK,Always loved that one!
utter52.669,utter,MARY POPPINS,Oh go on then.
