segment-id,segment-type,segment-speaker,segment-text
desc77.642,desc,,Sandra lunges to slap Kelly. Baxter stops it in midair.
utter77.643,utter,BAXTER,See what I mean...
utter77.644,utter,SANDRA,You're going to let them get away with this... this shit? On the word of one little white trash bitch...
utter77.645,utter,BAXTER,You like seeing your name in the papers?
desc77.646,desc,,Sandra glares at him.
utter77.647,utter,BAXTER,"Leave town, Sandy. Go to your place in St. Barts. Let things cool down."
desc77.648,desc,,Sandra concentrates on the TV.
utter77.649,utter,BAXTER,"They'll try for twenty million. The cheaper the lawyer, the higher the demand."
utter77.650,utter,SANDRA,You've got to be kidding.
utter77.651,utter,BAXTER,"The man's life has been destroyed. There will always be doubters, no matter what happened in court."
utter77.652,utter,SANDRA,I'm not paying any idiot twenty million dollars.
utter77.653,utter,BAXTER,I said that's what they'd ask for.
desc77.654,desc,,Sandra stares from the window. At last she turns to Kelly.
utter77.655,utter,SANDRA,I hope you're happy.
desc77.656,desc,,"Kelly seems to give this a moment's thought, then, smiling."
utter77.657,utter,KELLY,Ecstatic.
scene78,slugline,,EXT. EVERGLADES - DAY
desc78.658,desc,,"Sam cruises slowly across the water in his junked-out air boat. He kills the engine, allowing the craft to glide to a stop. He's close to where he found the big gator -- the same shabby collection of whitewashed buildings we now RECOGNIZE as the Glades Motel, shimmers in the distance. Sam leans back, enjoying the silence. He reaches into a cooler, takes out a beer, opens it, takes a drink, then pulls something else from the cooler -- -- a bundle of white butcher's paper. Sam opens the paper, takes out raw meat -- something disgusting to look at -- big red turkey necks, maybe, which he tosses into the water. ANGLE ON WATER as the meat drifts down -- then, a sudden boiling, as -- quick as the strike of a snake -- the huge gator EMERGES, jaws wide, to snap up the morsel before slipping beneath the surface once mare."
scene79,slugline,,INT. LAW OFFICE - DAY
desc79.659,desc,,Ken's Secretary opens the inner office door for Baxter. Ken rises from a desk to greet him.
utter79.660,utter,KEN,Tom Baxter. Good to see you again.
utter79.661,utter,BAXTER,Let's cut the crap. What does your client want?
utter79.662,utter,KEN,Besides an apology?
utter79.663,utter,BAXTER,"Unless you're planning on leaving Blue Bay, there's gonna be other cases, other days... You might want to keep that in mind."
utter79.664,utter,KEN,Okay Tom. My client wants your client to saddle up... so we can ride her ass all the way to the bank.
scene80,slugline,,EXT. BLUE BAY SCHOOL - DAY
desc80.665,desc,,"A hot morning in June. Shadows angle across the campus. Students line up at the old wooden pagoda, picking up caps and gowns. A few turn, surprised to see... SAM LOMBARDO cross the parking lot, ENTERS a building."
scene81,slugline,,INT. ART'S OFFICE - ART
desc81.666,desc,,"working at his desk. Sam's terrarium is behind him, his ""Educator of the Year"" Waterford bowl, a storage box of files. Art looks up at a KNOCK on the DOOR. Sam walks into the room. It is a slightly awkward moment."
utter81.667,utter,SAM,Lizards don't seem to miss me.
desc81.668,desc,,"The two men smile, breaking the tension."
utter81.669,utter,SAM,"How you doing, Artie?"
utter81.670,utter,ART,I... You know... I...
desc81.671,desc,,Sam waves him off.
utter81.672,utter,SAM,"Take care of my lizards, Art."
desc81.673,desc,,Art stands up. The two men shake hands.
scene82,slugline,,OUTSIDE GUIDANCE OFFICE
desc82.674,desc,,"Sam comes out, then stops suddenly. Kelly waits for him. Kirk and Nicole are with her. A long moment."
utter82.675,utter,SAM,Kelly...
utter82.676,utter,KELLY,Drop dead... You know where my mom is trying to get the money to pay you off? She's trying to break my trust. How do you like that? I can't touch it until she's dead and she won't give me a dime and now she's trying to break it to pay you...
utter82.677,utter,SAM,"Look, Kelly... I'm sorry... I know what you've been through... I should've seen something like this coning."
desc82.678,desc,,Art APPEARS in the door behind Sam. Kelly comes closer.
utter82.679,utter,KELLY,Why don't you start fucking her again. You can spend it together.
desc82.680,desc,,"Kirk tries to take Kelly's arm. She jerks away, swings at Sam. He ducks, dropping the Waterford BOWL, which SHATTERS upon the floor. Kirk bear-hugs Kelly. She throws a notebook at Sam."
utter82.681,utter,KELLY,I hate you!
desc82.682,desc,,"She starts crying. Kirk and Nicole drag her away as a crowd gathers. Sam, shaken, kneels over the broken crystal. Art bends to help him pick up the pieces."
utter82.683,utter,SAM,"You see. I couldn't stay, even if I wanted to."
scene83,slugline,,EXT. STRIP MALL - NIGHT
desc83.684,desc,,Sam's Jeep is parked next to the T-bird and Jaguar.
scene84,slugline,,INT. KEN'S OFFICE - SAME
desc84.685,desc,,"Baxter, Ken, Sandra, Frankie stand watching, as Sam signs papers. At last Sam looks up, faces Sandra -- not a happy moment. Sandra gives him a long, hard stare, then walks from the room. Frankie prepares to follow her, then stops, looks at Sam."
utter84.686,utter,FRANKIE,I'll be seeing you.
desc84.687,desc,,Sam just looks at him. The big man leaves. Baxter closes his briefcase.
utter84.688,utter,KEN,"So long, Tom. Come by sometime. We'll have lunch at the Beef Bowl."
desc84.689,desc,,"Baxter stops, gives him a cold look, then a surprising smile."
utter84.690,utter,BAXTER,"I don't think you're gonna be eating at the Beef Bowl anymore, kid."
desc84.691,desc,,"He EXITS. Ken goes apeshit -- whoops, dances around the desk, drops into his chair, holds up the documents. Sam watches, smiling, finally."
utter84.692,utter,SAM,"Thanks Ken, you did okay."
desc84.693,desc,,"Both men stand, they shake hands. Ken claps him on the arm."
utter84.694,utter,KEN,"(no clowning now) Look, I know there's a part of you wishes none of this had happened. But it did. Now take the money and get out of here. Find a happy place."
scene85,slugline,,EXT. EVERGLADES - NIGHT Moonlit fog -- the vast swamp. EXT. GLADES MOTEL - NIGHT
desc85.695,desc,,"It's late. A neon palm tree flashes across an empty lot as... Sam's Jeep pulls in out of the night, parks before its"
scene86,slugline,,bungalow.
desc86.696,desc,,"Sam gets out, lifts his storage box of files from the rear."
scene87,slugline,,INT. BUNGALOW - NIGHT
desc87.697,desc,,"The neon's green light slashes across the dark walls through old Venetian blinds. Sam ENTERS, puts the file box on the floor. Arches a sore back. He reaches for a bedside lamp, stops, listens, decides it's nothing, reaches again for the lamp, stops again, listening... BZZZZZ -- the high-pitched WHINE of a MOSQUITO. Then more -- a flurry of BZZZZZZZZS Sam frowns, sees... A cloud of mosquitoes circling him. He checks the front windows -- closed. He goes around the bed. The slightly ajar bathroom door with full-length mirror comes up on his right. Ahead is a rear window -- wide open. Sam stops fast. Thinks. Lets out a breath."
utter87.698,utter,SAM,Damn maid.
desc87.699,desc,,"He steps to the window. He looks down -- Muddy footprints. Sam freezes. He whirls around -- A sudden green FACE APPEARS in the big mirror -- like a nightmare image -- lit by the neon flash, then DISAPPEARS. Sam jumps back."
utter87.700,utter,SAM,Ahhhh!
desc87.701,desc,,"The neon green face flashes again in the mirror -- DISAPPEARS. Now the bathroom door slowly opens all the way. Sam backs up, hits the wall. Kelly Van Ryan steps out of the bathroom, a long object held at her side, wrapped in a towel."
utter87.702,utter,SAM,"Jesus Christ, what are you doing?"
utter87.703,utter,KELLY,So you got my mom's money.
desc87.704,desc,,"Sam tries to breathe, manages a nod."
utter87.705,utter,KELLY,How much?
desc87.706,desc,,Kelly prods him with the concealed object.
utter87.707,utter,KELLY,How much?
utter87.708,utter,SAM,About six and a half million dollars.
desc87.709,desc,,"Kelly raises the abject covered by the towel, aims it at Sam."
utter87.710,utter,KELLY,Your turn to pay.
desc87.711,desc,,A moment -- then she yanks the towel away to REVEAL -- -- a two-foot-long novelty penis with giant balls. Her hand grips the acrylic scrotum like the butt of a gun.
utter87.712,utter,KELLY,"King Dong! That's you, Sam!"
desc87.713,desc,,"She screams with joy, vaults into his arms, wraps those perfect thighs around him. The dildo goes flying. They fall on the bed."
utter87.714,utter,KELLY,It worked! We screwed the bitch!
desc87.715,desc,,She's all over him now -- tongue kisses.
utter87.716,utter,KELLY,It worked just like you said it would.
desc87.717,desc,,"He kisses her, finally gets her to sit, straddling him."
utter87.718,utter,SAM,"God, you scared the shit out of me. You must be crazy coming here."
utter87.719,utter,KELLY,Of course I'm crazy. Ask my mom.
desc87.720,desc,,"She kisses him again, more passionately now. He gets into it, tears her blouse open, putting his tongue to her breasts. A SHADOW moves on the wall, looming above them. Sam sees it, his eyes widen. He tries to sit up, as... BANG! -- an EXPLOSION. Sam jumps, knocks Kelly to his side. A champagne cork hits the ceiling. Suzie Toller stands over the bed with a foaming champagne bottle."
utter87.721,utter,SUZIE,How much is about six and a half million divided by three?
utter87.722,utter,SAM,Jesus. Two million one hundred thirty- three thousand three hundred thirty- three and change.
desc87.723,desc,,Kelly screams in joy again.
utter87.724,utter,SAM,Now calm down. Both of you.
desc87.725,desc,,The girls put on mock serious expressions.
utter87.726,utter,SAM,"From now on, if we're seen together, it's got to be accidental. I thought that was understood..."
utter87.727,utter,KELLY,"Hey, come on... We've got to have at least one victory party."
desc87.728,desc,,"Kelly grabs the champagne, takes a long gulp, pours some on her breasts as she straddles Sam once more, inviting him to lick them clean."
utter87.729,utter,SAM,"Kelly, for christ's sake..."
desc87.730,desc,,"She has begun to move like a lap dancer, inviting him to take her breasts in his mouth, putting a hand to his crotch..."
utter87.731,utter,SAM,"The only way we're gonna blow this now, is if we do it ourselves..."
utter87.732,utter,KELLY,(her hand in his crotch) Do it to ourselves?
utter87.733,utter,SAM,(weakening) We have to stick with the plan.
utter87.734,utter,KELLY,Stick?
desc87.735,desc,,"Sam gives up, lays back as Kelly undoes his pants, then moves to get him inside her. Suzie watches. She takes another drink, then tosses the bottle, pulling off her top, REVEALING her small, white breasts, a couple of tattoos, a pierced nipple. She slips behind Kelly, fondling Kelly's breasts as Sam arches beneath them both -- all of them totally into it now, losing themselves in the sex..."
scene88,slugline,,"INT. DETECTIVES ROOM, BLUE BAY POLICE STATION - NIGHT"
desc88.736,desc,,"The room is dark and empty, with the exception of a single desk lamp, by which halo we find... Ray Duquette, in an aloha shirt, waiting as his computer's printer finishes a job, as suddenly... ...a new light rushes into the room. Ray turns to find Gloria standing in the doorway. He stops as his printer finishes the job. He pulls out the paper, looks at it, smiles. Gloria walks to his desk."
utter88.737,utter,RAY,You saw the news today?
utter88.738,utter,GLORIA,Lombardo's settlement?
desc88.739,desc,,Ray nods.
utter88.740,utter,GLORIA,"Yeah, well, I told you they were gonna make us look stupid."
desc88.741,desc,,"Ray gives her a long look. Gloria waits a moment, shrugs."
utter88.742,utter,RAY,"Hey, don't back away from it, you were right. We did look stupid. (beat) What you were wrong about, is who made us look that way."
desc88.743,desc,,"Gloria just looks at him, puzzled."
utter88.744,utter,RAY,"Think back, before the suit was filed, before the trial. Lombardo had an affair with Sandra, right? (Gloria nods) So why not tell us about the affair? I mean it could be a hell of a motive for Kelly to fabricate her charge in the first place."
utter88.745,utter,GLORIA,Maybe Lombardo's attorney was saving the affair for the trial.
utter88.746,utter,RAY,"I thought of that. Then I said, come on, you're Lombardo. Your reputation is getting trashed. You want to stop the bleeding. You don't want to sit in jail for three months. Unless..."
utter88.747,utter,GLORIA,Unless what?
utter88.748,utter,RAY,Unless you're setting up Sandra Van Ryan for the big payday.
desc88.749,desc,,"It is quiet in the office, save for the soft BUZZ of Ray's COMPUTER."
utter88.750,utter,RAY,"They chumped us, Gloria, right from the start."
utter88.751,utter,GLORIA,"Why? You ask me, Lombardo had it pretty good already, nice job in a beautiful setting, popular, an active social life. (beat) He's gonna put this all on the line for some dicey play like what you're describing..."
utter88.752,utter,RAY,(interrupting) The job looks okay to us. But look at it from his point of view. The man's surrounded by wealth and privilege. But for him... it's just a reminder of what should have been his.
desc88.753,desc,,Gloria gives this a moment's thought.
utter88.754,utter,RAY,"Your old man graduates from Blue Bay School, you're not supposed to wind up there. Board of Directors maybe, but not in the lousy guidance office. Now. Point number two. (he taps at the printout on his desk) I've run a financial on Lombardo. Guy was eyeball-deep in debt before this all happened -- trying to keep up with pricey trim like Barbara Baxter."
desc88.755,desc,,"He passes the printout to Gloria. She looks at it, thinking."
utter88.756,utter,GLORIA,"So what about the girls? Suzie's poor, but why would Kelly have to steal from her own mother? Surely her father..."
utter88.757,utter,RAY,"(interrupting) Her father didn't leave her squat. The kid's got money in trust from her grandfather, but she can't touch that till her mother dies and Sandra seems to have the idea that Kelly ought to learn the value of a buck."
desc88.758,desc,,"Gloria looks over Lombardo's financial once more, tosses it on the desk, then studies Ray -- long beat."
utter88.759,utter,GLORIA,"This one's got you working overtime, hasn't it?"
utter88.760,utter,RAY,"I flat don't like the guy, Glory. He's dirty. And I'll tell you something else. You want to know how old man Lombardo lost his money? (beat) He was fucked out of it by old man Van Ryan, on a little item known as the Salt Creek Land Deal. (beat) It was after the war. Van Ryan set up a corporation to develop swamp land, got investors like Lombardo to put up money, then turned around and got the state to declare the area an ecological preserve, on the sly, of course, but everyone knew it was him. The freeway went to the coast, right where Van Ryan wanted it."
utter88.761,utter,GLORIA,Eliminate the competition.
utter88.762,utter,RAY,You got it. The rich got richer. While the saps like Lombardo went belly-up in the swamp.
desc88.763,desc,,Gloria looks at him a long moment.
utter88.764,utter,GLORIA,"Where'd you come up with this stuff, anyway?"
utter88.765,utter,RAY,(a long beat; then beneath a smile) I met a guy in a bar.
scene89,slugline,,"EXT. A BANK, BLUE BAY - DAY"
desc89.766,desc,,"Sam walks down the steps, gets into his Jeep, and drives away. Across the street -- the white Taurus -- Ray and Gloria watch."
scene90,slugline,,EXT. YACHT BROKERAGE - DAY
desc90.767,desc,,"Sam comes out, rounds a corner and is gone. Ray Duquette steps INTO FRAME, turns into the brokerage. The door swings shut behind him."
scene91,slugline,,"INT. SWIMMING POOL, BLUE BAY SCHOOL - DAY"
desc91.768,desc,,"Girls in tank suits finish laps, towel off. As the girls begin to walk toward the lockers, they encounter... Ray Duquette, threading his way among the girls, his eye on... Kelly, alone on the deck, still dripping -- a Botticelli vision."
utter91.769,utter,RAY (O.S.),Nice stroke.
desc91.770,desc,,"Kelly, startled, turns to find Ray walking toward her across the deck. She snatches a towel from one of the racing platforms and begins to dry herself, wrapping the towel around her."
utter91.771,utter,KELLY,Is there some reason why you're here?
utter91.772,utter,RAY,"Curiosity, I guess."
utter91.773,utter,KELLY,About what? How to improve your breast stroke?
desc91.774,desc,,Ray gives her a cold smile.
utter91.775,utter,RAY,"Actually, I was curious about how you see things working out, for you, Sam and Suzie."
desc91.776,desc,,"This appears to give her pause, a moment of hesitation."
utter91.777,utter,KELLY,Excuse me?
utter91.778,utter,RAY,You all gonna go down to the Caribbean together?
desc91.779,desc,,"Kelly looks around the pool area. A number of girls are watching from a corner of the deck, but no one is close enough to hear."
utter91.780,utter,RAY,"The thing about it is, threesomes so rarely work out."
utter91.781,utter,KELLY,You're out of your mind.
utter91.782,utter,RAY,"I've been a cop for a while, Kelly. (beat) It's hard enough for one person to keep a secret, let alone three. And then there's the love angle. I mean do you and Sam really want that little pill-head around, now that you have the money?"
desc91.783,desc,,Kelly starts to walk away. Ray cuts her off.
utter91.784,utter,RAY,"Am I right, did Sam sell you on the idea right up front, of whacking Suzie? That's murder, Kelly."
utter91.785,utter,KELLY,Police -- God -- get a life.
desc91.786,desc,,She moves around him and walks calmly away.
utter91.787,utter,RAY,"(loud enough to make himself heard) You're good. But you don't think that little ditz Suzie's gonna hold together, do you?"
desc91.788,desc,,"Kelly continues to walk, her face giving nothing away, as Ray's WORDS ECHO over the pool."
scene92,slugline,,EXT. BLUE BAY SCHOOL PARKING LOT - LONG SHOT - LATER
desc92.789,desc,,"Only a few cars left -- one of them Suzie's old VW bug, at the side of which Kelly and Suzie engage in heated conversation. CLOSER - SUZIE paces around Kelly."
utter92.790,utter,SUZIE,"You don't know Duquette. I'm the one he busted... He's a fucker, man... He'll fuck us both over..."
desc92.791,desc,,Kelly tries to take her by the arm. Suzie jerks away.
utter92.792,utter,SUZIE,I'm not going back to that prison. That's what it was... a fucking hell hole...
desc92.793,desc,,"Kelly looks around the lot. She takes Suzie by the arm once more, this time more firmly, pulling Suzie to her."
utter92.794,utter,KELLY,Will you calm down. Duquette's gonna come to you just like he did to me. You're gonna have to be ready for him.
utter92.795,utter,SUZIE,"Yeah, but he can't push you around like he can me. You've got family and they've got clout. With we it's different... with me..."
utter92.796,utter,KELLY,"(circling her with her arm) Yeah, I've got family and they've got clout and now you have me. Right? And Sam. Believe me, Suzie, this dickhead's not going to send you anywhere. He's gonna try and rattle your cage, and that's it. Stay strong and he can't do shit."
utter92.797,utter,SUZIE,"(a long beat) Man, I wanna smoke a joint."
desc92.798,desc,,"PULL BACK to REVEAL -- in the distance -- the white Ford Taurus at the side of the road leading to the school. The car is pulled just far enough off the road to be mostly hidden among pampas grass and oleander, but angled in such a way as to afford a view of the two girls now hugging in the lot."
scene93,slugline,,EXT. SMILIN' JACK'S FISH CAMP - NIGHT
desc93.799,desc,,"Suzie wanders along the canal, smoking a joint. At her back a few faint lights flicker here and there in the windows of trailers. She walks down to the little dock, sits on a rail, takes another hit."
utter93.800,utter,VOICE (O.S.),"'Evening, Suzie. How was school today?"
desc93.801,desc,,"Suzie freezes, holds back her exhale, looking around... A shadow stirs in one of the skiffs tied to the dock. A man stands, walks up the couple of wooden stairs. The light from a trailer across the road glances off steel-rimmed glasses as Ray Duquette steps onto the dock. Suzie gags on the smoke in her lungs, coughs. She squeezes the lit roach into her palm, then tosses it into the canal."
utter93.802,utter,RAY,"You ought to watch it with that shit, Suzie. You get busted again, you go back in a two-tine loser."
utter93.803,utter,SUZIE,You got something against cigarettes?
desc93.804,desc,,Ray just laughs at her.
utter93.805,utter,RAY,"Yeah, they're bad for your health. (beat) I'm tryin' to look out for you..."
utter93.806,utter,SUZIE,That's cop bullshit.
utter93.807,utter,RAY,"Well, you're half right. Best thing you could do for yourself right now would be to talk to me."
utter93.808,utter,SUZIE,About what?
utter93.809,utter,RAY,Every triangle I've ever seen never lasts. Somebody's got to go.
utter93.810,utter,SUZIE,Is this supposed to mean something to me? What triangle?
utter93.811,utter,RAY,"You, Kelly, Sam."
utter93.812,utter,SUZIE,I don't have to listen to this. And you can't shove me around. I have friends now...
desc93.813,desc,,"She catches herself, falters. Ray laughs once more."
utter93.814,utter,RAY,Is that what you think? You have friends? Is that what they told you?
utter93.815,utter,SUZIE,I don't mean who you're thinking. I have other friends...
utter93.816,utter,RAY,"Suzie, Suzie... This is me, Ray, you're talking to. We both know you don't have shit, never have had shit, never will have shit..."
desc93.817,desc,,He takes a sheet of paper from his coat.
utter93.818,utter,RAY,"Here, Suzie. I want you to look this over. Know what it is? (as Suzie takes it) Sam deposited his check, transferred the funds to an offshore bank, a numbered account. Not even the cops can find out whose names are on it. Think one of them's yours?"
desc93.819,desc,,Suzie looks over the paper.
utter93.820,utter,RAY,"He also put a down on some island property, and a lease-to-buy on a forty-foot sailboat. You're into sailing, aren't you, Suzie?"
desc93.821,desc,,Suzie thrusts the paper back at Ray.
utter93.822,utter,SUZIE,Get away from me.
utter93.823,utter,RAY,"Don't you see what this means? You really think Sam and Kelly are gonna give you a third of the money? You, the pill-head with the rap sheet?"
utter93.824,utter,SUZIE,Shut up.
desc93.825,desc,,Ray smiles at her. He moves up close.
utter93.826,utter,RAY,"You know, I don't think I ever told you I was sorry about your little friend... What was his name?"
desc93.827,desc,,"Suzie tries to back away. She bumps against the rail. Ray reaches out, takes her hand in both of his."
utter93.828,utter,RAY,"Come on, Suzie, help me out here. You know his name."
desc93.829,desc,,"Suzie looks scared, in a way she hasn't before. When she speaks her voice is scarcely above a whisper."
utter93.830,utter,SUZIE,Davy.
utter93.831,utter,RAY,"(nodding, a scary smile) That's right. That was his name."
desc93.832,desc,,"The smile fades, as if he's thinking about something, still holding her hand, rubbing it with his fingers."
utter93.833,utter,RAY,Sometimes I wonder if you're really as dumb as you pretend to be.
desc93.834,desc,,"He looks into Suzie's eyes, slowly opening her hand to REVEAL the burn mark on her palm."
utter93.835,utter,RAY,But you know what? I'd be keeping a clear mind right now if I were you. (beat) I'd hate to see you come to a bad end. Like Davy did.
desc93.836,desc,,"He holds her hand a moment longer, then drops it. He goes back down he steps to the little skiff. An outboard MOTOR STARTS in the night."
scene94,slugline,,INT. SUZIE'S ROOM - NIGHT
desc94.837,desc,,"Suzie cones in fast, grabs the phone, punches out a number."
utter94.838,utter,SAM (V.O.),(answering machine) This is Sam. I'm not in right now...
scene95,slugline,,EXT./INT. RAY'S PICKUP - NIGHT
desc95.839,desc,,"parked behind some cottonwoods in a small launch area where the highway crosses both the canal and the road to the fish camp. The skiff has been shoved into the bed. Ray sits at the wheel. He removes his glasses, wipes his face with a handkerchief, then starts at the uneven SOUNDS of a tired ENGINE, looks up to see... HEADLIGHTS Suzie's VW bouncing along the dirt road, turning onto the highway."
scene96,slugline,,RAY'S TRUCK - RAY
desc96.840,desc,,"watching, then starting his truck and pulling out onto the highway, following the tiny red lights of Suzie's bug."
scene97,slugline,,SXT. VAN RYAN ESTATE - MAIN GATE - NIGHT
desc97.841,desc,,"Suzie's VW idles. She leans out the window, talks to the intercom, the gate opens. The VW ENTERS. The gate closes. Ray's pickup drives past. He drives to a big lot where one of the mansions has been torn down. He drives up onto the dirt, keeps going, right down to the water's edge where he pulls his little skiff out of the back once more. He walks back to the truck, pulls off his sport coat, hangs a Hi-8 video camera over his shoulder and wades out into the calm waters of the bay, pushing the skiff, then climbing in."
scene98,slugline,,"EXT. VAN RYAN ESTATE, REAR OF MAIN HOUSE - NIGHT"
desc98.842,desc,,"Suzie follows Kelly past the pool, which is all litup, and on toward the jacuzzi. The whole deck is tiled in black-and- white. Kelly's in a bikini -- the killer body. Suzie, the contrast -- pale, skinny, boyish, in a T-shirt and cutoff jeans. They argue -- we CANNOT HEAR."
scene99,slugline,,EXT. THE BAY - SAME
desc99.843,desc,,"Ray has arrived near the docks. He has killed his engine, maneuvering here with a single oar. He ties the skiff off behind the Jonathan, then climbs to the dock, moving around the guest house and coming close to the pool. He takes a position behind the cabanas, readies his camera."
scene100,slugline,,EXT. POOL AREA - SAME
desc100.844,desc,,Kelly and Suzie continue their argument in front of the jacuzzi.
utter100.845,utter,KELLY,I can't believe you called Sam. What's the matter with you?
utter100.846,utter,SUZIE,"I'm scared, that's what. I'm scared there's no one to trust."
