segment-id,segment-type,segment-speaker,segment-text
utter53.404,utter,KEN,"Good. So what we're going to do is march right to Hunter's doorstep. We're going to insist they take a statement. We're going to tell them to charge your ass or get off your back. (beat) They're walking a fine line here. Defamation of character, malicious prosecution..."
utter53.405,utter,SAM,I just want my life back...
utter53.406,utter,KEN,Fair enough. Let's go make a statement.
scene54,slugline,,INT. POLICE INTERVIEW ROOM - DAY
desc54.407,desc,,"Everyone's looking a little tired, with the possible exception of Ray. At this moment he sits back in his chair, staring at Sam."
utter54.408,utter,RAY,"Why don't you tell us one more time, how Kelly came to be with you, alone in your house."
utter54.409,utter,SAM,"(with growing impatience) Story's the same, Detective..."
desc54.410,desc,,"Ken pats him on the arm. When Sam speaks again, it is in a calmer voice, calm but tired."
utter54.411,utter,SAM,I had to go look for this coupon.
utter54.412,utter,RAY,The one you bought at school.
utter54.413,utter,SAM,"(nodding) Like I said, I hadn't really expected to use it. (beat) Anyway, I'm going through a drawer."
desc54.414,desc,,"I hear a car. I look out the window. I see Nicole driving away. I leave my room, and there's Kelly."
utter54.415,utter,RAY,"In cutoffs, a wet T-shirt."
utter54.416,utter,SAM,Yes.
utter54.417,utter,RAY,And she wanted to talk.
utter54.418,utter,SAM,Yes.
utter54.419,utter,RAY,But you can't tell us what she wanted to talk about.
utter54.420,utter,SAM,"I could, but it's confidential. Look, the point is, we didn't talk. I told her this was not an appropriate time or place."
utter54.421,utter,RAY,And she began to cry. And you put an arm around her.
utter54.422,utter,SAM,"Yes. Mainly to turn her toward the door. I told her we would talk on Monday, in the office."
utter54.423,utter,GLORIA,"And when you turned her toward the door, where did you expect her to go, without a car?"
utter54.424,utter,SAM,Again. I think we covered this. I told her I was going to call a cab.
utter54.425,utter,RAY,But she ran away.
utter54.426,utter,SAM,That's right.
utter54.427,utter,GLORIA,Did you call anyone? Did you call her house to see if she got home? Did you call the Masons?
utter54.428,utter,SAM,No.
utter54.429,utter,GLORIA,Weren't you a little worried about her...?
utter54.430,utter,SAM,"There's a strip mall not half a mile from my house. There's phones there. I cruised the place, but I didn't see her. I figured she was probably there but that she was angry and didn't want to be found. I don't know... Maybe I should have called. But it's not like Kelly can't take care of herself. I figured we'd just take it up on Monday, in the office."
desc54.431,desc,,There is a moment of silence in the room.
utter54.432,utter,RAY,"But you do admit to touching her, to putting your arm around her. Isn't that against the rules?"
utter54.433,utter,SAM,"It is and I don't. Ordinarily... (beat) But, I mean... there's this kid standing in front of you crying..."
utter54.434,utter,RAY,With a thirty-five inch bustline in a wet T-shirt with no bra...
desc54.435,desc,,He is cut short as Sam shoves his chair back from the table.
utter54.436,utter,SAM,Fuck you. This is bullshit. I'm outta here.
utter54.437,utter,RAY,"Sit down, Lombardo."
desc54.438,desc,,Sam and Ray stare at one another. Ken puts a hand on his client's arm.
utter54.439,utter,KEN,"All right, all right... Enough."
desc54.440,desc,,"Ken stands up. He walks to the two-way mirror set in one wall, rapping on the glass with his knuckles."
utter54.441,utter,KEN,"We came down here to make a statement. We've made it. (beat) If you're going to charge my client, do it now."
scene55,slugline,,INT. OPPOSITE SIDE MIRROR ROOM - HUNTER
desc55.442,desc,,"stares at Ken's face, about a foot away. Ken of course can't see him. Hunter gives him the finger."
scene56,slugline,,INT. INTERVIEW ROOM - KEN
desc56.443,desc,,"stares into the mirror, waiting."
utter56.444,utter,KEN,I didn't think so. (to Sam) Let's go.
desc56.445,desc,,Ken opens the door. Sam turns back to Ray and Gloria.
utter56.446,utter,SAM,"I've spent the last ten years of my life working with kids. I love what I do, and I think I'm good at it. (beat) These kids trust me, and there is no way. No way in hell I would ever betray that trust."
desc56.447,desc,,"As Ken and Sam leave, Ray and Gloria are joined by Bryce Hunter."
utter56.448,utter,HUNTER,Nice speech. Either of you buying?
desc56.449,desc,,Ray shrugs.
utter56.450,utter,RAY,"Not that stuff about her running away, him trying to find her. That's bullshit."
utter56.451,utter,HUNTER,What about witnesses?
utter56.452,utter,RAY,"We've got three. Guy mowing his yard, couple of kids playing hoops."
utter56.453,utter,HUNTER,And what do they say?
utter56.454,utter,GLORIA,Same as him. They saw her come. They saw her go. They saw him follow.
utter56.455,utter,RAY,Still doesn't explain why he couldn't catch up with her. I mean how long does it take to put on a shirt?
desc56.456,desc,,"At which point, a COP APPEARS in the doorway."
desc56.457,desc,,"Phone, Bryce. It's Sandra Van Ryan."
utter56.458,utter,HUNTER,Christ Almighty. That woman's calling me six times a day.
desc56.459,desc,,"He starts away, then stops."
utter56.460,utter,HUNTER,"I think you're onto something, Ray. Stay with it."
desc56.461,desc,,"Hunter bangs out of the room. Gloria slumps in a chair, tired, disgusted."
utter56.462,utter,GLORIA,"We failed to mention the mower guy's a drunk, that he was after more beer and never really saw Kelly go into the house, so he can't say how long she was in there. Same with the kids. They saw her running down the street, but that's it. (beat) With no physical evidence, what do we have? Her word against his."
utter56.463,utter,RAY,You're telling me you believe the guy?
utter56.464,utter,GLORIA,"All I'm saying is, we let Sandra Van Ryan push us too hard, we're going to wind up looking stupid."
desc56.465,desc,,"Ray is paged by his BEEPER. He pulls it off his belt, looks at the number."
utter56.466,utter,RAY,I'd better return this.
desc56.467,desc,,"Ray leaves. Gloria pulls a cigarette from her purse and lights up, rests her head back in the chair, blowing smoke at the ceiling."
scene57,slugline,,INT. INTERVIEW ROOM - LATER
desc57.468,desc,,"Gloria is grinding out the butt as Ray walks back in. There is something in the way he carries himself, some sense of urgency."
utter57.469,utter,RAY,(off Gloria's look) Seen any good gator wrestling lately?
scene58,slugline,,EXT./INT. DETECTIVES' CAR - MOVING - DAY
desc58.470,desc,,"Ray and Gloria drive through the Everglades, past marshlands punctuated by thick stands of melaluca trees."
utter58.471,utter,GLORIA,They say it was old man Van Ryan planted the melalucas to dry up the swamp.
desc58.472,desc,,Ray nods.
utter58.473,utter,GLORIA,You can go up to one of those trees and peel the bark. You know what you get? More bark. And more bark. There's no core. Tree's not good for anything but sucking up water. And now they can't get rid of them. They've tried poisons. Nothing works. They don't die.
utter58.474,utter,RAY,"Yeah, well, Van Ryan got his. I don't imagine he gives a shit now."
desc58.475,desc,,"Gloria just looks at him. Ray stares into the dusty light of an approaching sunset. At last he slows, turning off the highway and onto a narrow dirt road. A sign pokes out from the tall grass -- ""SMILIN' JACK'S FISH CAMP."" The Taurus bounces along the washboard road."
utter58.476,utter,GLORIA,You're sure we're not lost?
desc58.477,desc,,They are driving now at the edge of a canal.
utter58.478,utter,RAY,You remember that little girl walked out of our talk at Blue Bay?
utter58.479,utter,GLORIA,The skinny brunette.
utter58.480,utter,RAY,This is where she lives. She wants to talk. (beat) Beats the shit out of me why she would call me at all. I busted her once for possession. She wound up doing about six months at Camp Nine.
utter58.481,utter,GLORIA,You mean Camp Sixty-Nine.
desc58.482,desc,,Ray gives her a look. Gloria shrugs.
utter58.483,utter,GLORIA,That's what they called it when I was in Juvenile. It's a pretty dismal place.
utter58.484,utter,RAY,"It's a shithole. But she was dirty, what was I gonna do?"
desc58.485,desc,,"They pass a sagging chain-link fence, entering a quarter- mile run of shabby trailers and cheap shacks. The squalor of the buildings is seat in contrast to the beauty of the Glades where the waters have gone to the color of polished brass beneath an immense, darkening sky. Ray parks before a ramshackle building covered in vines and peeling paint. A sign reads: ""NIGHT CRAWLERS $1 A BUCKET."" The jawbones of numerous gators hang beneath the eaves. As they get out of the car, something catches Gloria's eye -- along the bank of the canal..."
scene59,slugline,,ANGLE ON BANK
desc59.486,desc,,"where a tall man (WALTER) with long white hair and tattooed arms kneels inside a pen, slapping a huge gator on its snout. The reptile lifts its upper body, hissing, opening its jaws. Walter takes a stick from his hip pocket, passing it through the gator's mouth. The jaws snap shut, incredibly fast, with a hollow snapping sound. Gloria jumps instinctively, then watches, aghast, as Walter slaps the creature once more. This time moving round to the front of the gator, sticking half his arm inside its mouth."
utter59.487,utter,VOICE (O.S.),He's just showin' off for you now.
desc59.488,desc,,"Gloria starts, then turns to find a woman (RUBY) has walked up beside her. The woman is in her sixties. She's dressed in polyester. Her hair is piled on top of her head -- too dark to be anything but a dye job. A cigarette bobs from her lips. Before Gloria can respond, Ray steps up behind than."
utter59.489,utter,RAY,Evening Ruby. (beat) I see you still got Walter. I was sort of hoping something had eaten him by now.
utter59.490,utter,RUBY,(a long beat) Can I help you with something?
desc59.491,desc,,Ray and the old lady look at each other.
utter59.492,utter,RAY,Suzie called. You know where we can find her?
desc59.493,desc,,Ruby looks toward the store.
utter59.494,utter,RUBY,You know the way.
desc59.495,desc,,"She watches as the detectives CROSS the road, then calls to them as they start up the steps."
utter59.496,utter,RUBY,You won't shoot her will you? I don't believe she's armed.
desc59.497,desc,,"Gloria turns, surprised. Ray gives the woman a long, cold stare, then opens the door for Gloria."
scene60,slugline,,INT. CAMP STORE - SAME
desc60.498,desc,,"It's dark inside. The main light source is a tiny, beat-up black-and-white TV. Two elderly women in colored bouffant hairdos sit on a ratty old couch watching reruns of ""Family Feud."" They look up as Ray and Gloria ENTER then EXIT through a door in the back."
scene61,slugline,,INT. SUZIE'S ROOM - SAME
desc61.499,desc,,"Black walls. Cheap bookshelves, filled to overflowing. A wire strung with dismembered doll parts runs the length of the room. Suzie is propped on a ratty futon, an open book on her stomach, her thin, white arms crossed behind her head."
utter61.500,utter,SUZIE,"Jesus. It took you long enough. What if somebody was trying to strangle me? Or fuck me in the ass, even? (beat) I mean, you guys are Sex Crimes."
desc61.501,desc,,Ray manages a thin smile.
utter61.502,utter,RAY,"Meet my partner, Gloria Perez."
utter61.503,utter,SUZIE,I did. At Blue Balls.
utter61.504,utter,GLORIA,"Seems to me you left early, before we could meet. But hi, Suzie."
desc61.505,desc,,"Gloria puts out a hand. Suzie looks at it, puts out a hand of her own. As the women shake, Gloria looks at the book on Suzie's stomach, turning her head as if to read the title."
utter61.506,utter,SUZIE,It's Celine. He's okay. He had a pretty good line on what cheap fucks people are.
utter61.507,utter,RAY,"So Suzie, you called us, remember?"
desc61.508,desc,,"Suzie takes a cigarette from a pack at her side, lights up, blows smoke at the ceiling."
utter61.509,utter,SUZIE,Did they arrest Mr. Lombardo?
desc61.510,desc,,Ray and Gloria exchange looks.
utter61.511,utter,RAY,No.
utter61.512,utter,SUZIE,Will they?
utter61.513,utter,RAY,It doesn't look like it.
utter61.514,utter,SUZIE,Then he'll be back at Blue Balls?
desc61.515,desc,,Ray shrugs.
utter61.516,utter,GLORIA,That bothers you?
utter61.517,utter,SUZIE,"(a long beat) Yeah, maybe, a little."
utter61.518,utter,GLORIA,Why is that?
desc61.519,desc,,Suzie lets out her breath. She rests her head against the wall.
utter61.520,utter,GLORIA,"You can talk to us, Suzie. That's why we're here..."
scene62,slugline,,INT. POLICE INTERVIEW ROOM - DAY
desc62.521,desc,,"Suzie, Gloria and Hunter sit at the conference table. Ray operates the video cam."
utter62.522,utter,GLORIA,"Okay, Suzie. We want you to tell us about the day Mr. Lombardo gave you and Jimmy a ride."
desc62.523,desc,,"Suzie stares at the three cops around her, then at the camera."
utter62.524,utter,SUZIE,You didn't tell me you were gonna put me on the fucking news.
utter62.525,utter,GLORIA,"We need to tape the interview, Suzie. No one will see it but us. (beat) Now when was this, that Mr. Lombardo gave you the ride?"
desc62.526,desc,,"Suzie stares at the camera. She's lost the cockiness she had on her own turf. She looks small, white and frail in the sterile room, surrounded by the detectives."
utter62.527,utter,SUZIE,About a year ago.
utter62.528,utter,GLORIA,He dropped Jimmy off first?
utter62.529,utter,SUZIE,Yeah.
utter62.530,utter,GLORIA,"And when he arrived at your house, was anyone there?"
utter62.531,utter,SUZIE,No.
utter62.532,utter,GLORIA,So you were alone.
utter62.533,utter,SUZIE,Yes.
utter62.534,utter,GLORIA,Did he come in with you?
utter62.535,utter,SUZIE,I guess.
utter62.536,utter,HUNTER,You guess? Did he or didn't he?
utter62.537,utter,SUZIE,Yeah... okay... he did
utter62.538,utter,HUNTER,And then what... he touched you? Did you maybe flirt a little...
utter62.539,utter,SUZIE,I wanna go home now.
desc62.540,desc,,"Gloria glares at Hunter, shakes her head."
utter62.541,utter,GLORIA,"Suzie, look, I know you feel bad. I know it's harder to talk here than in your room, but we need to get it on tape. (beat) Just tell us what you told us before. Tell us the truth."
desc62.542,desc,,"Suzie huddles in her skinny arms, studying the detectives."
utter62.543,utter,SUZIE,"I didn't say a thing to him. He just put his arm around me. Told me I was pretty... I could be really pretty, he said."
desc62.544,desc,,"Another moment -- she looks at Ray, then at Hunter."
utter62.545,utter,HUNTER,What did you do then?
utter62.546,utter,SUZIE,"(a long beat) Shit, what difference does it make... Nobody's gonna believe me anyway..."
utter62.547,utter,HUNTER,Suzie! Did this man rape you?
utter62.548,utter,SUZIE,"Okay! He did. He pushed me to the floor and he did it to me. Now, can I go home?"
desc62.549,desc,,She stands up.
utter62.550,utter,GLORIA,At that point were you able to fight him off?
utter62.551,utter,SUZIE,No. He stopped by himself. Okay? That's all. Let me go.
desc62.552,desc,,Gloria gets to her feet as well; she tries to put an arm around Suzie. The girl jumps back as if she has been shocked.
utter62.553,utter,SUZIE,Don't touch me.
desc62.554,desc,,"Gloria's hands fall to her sides. Suzie heads for the door. The detectives exchange looks. At which point, Suzie stops, turns to face the room."
utter62.555,utter,SUZIE,He did say something.
utter62.556,utter,GLORIA,What was that?
utter62.557,utter,SUZIE,"He said, ""No little bitch can ever make me come."""
scene63,slugline,,THE SLIDING BAR DOOR
desc63.558,desc,,of a jail SLAMS shut on Sam Lombardo. He turns to... TWO menacing PRISONERS.
utter63.559,utter,PRISONER,So you're the new chicken licker.
scene64,slugline,,COURT TV IMAGE
desc64.560,desc,,"The graphic -- ""Prime Time Justice"" -- then the anchor --"
utter64.561,utter,CYNTHIA. CYNTHIA (TV),"Today from Superior Court in Miami, Florida -- Dade County versus Samuel"
desc64.562,desc,,PULL BACK to REVEAL...
scene65,slugline,,"INT. ART'S OFFICE, BLUE BAY HIGH - DAY"
desc65.563,desc,,"Art, students, faculty members huddle around the TV."
utter65.564,utter,"CYNTHIA (TV, CONT'D)",The Lombardo rape case has galvanized the upscale town of Blue Bay...
scene66,slugline,,EXT. COURTHOUSE - DAY
desc66.565,desc,,Video crews surround a limo as Sandra and Kelly EMERGE.
utter66.566,utter,"CYNTHIA (V.0., CONT'D)",...with its tabloid appeal -- Sandra Van Ryan -- jet-set real estate heiress...
desc66.567,desc,,Tom Baxter and Barbara jostle up the steps.
utter66.568,utter,CYNTHIA,The powerful Blue Bay elite...
desc66.569,desc,,"Suzie, in the company of Ruby and Walter, pushes past the video crews."
utter66.570,utter,CYNTHIA,...the girl from the wrong side of the tracks...
scene67,slugline,,INT. COURTROOM - DAY
desc67.571,desc,,"Bryce Hunter confers with his team. Ken in his neck brace, ENTERS with Sam and a bailiff. Sam wears a suit. He's clean-shaven, recovered from the car wreck and beating. Still, there is a weariness about him we have not seen before. He makes eye contact with Sandra -- a cold stare."
utter67.572,utter,CYNTHIA,"In the end, the prosecution's case will come down to..."
scene68,slugline,,INT. COURTROOM - DAY
desc68.573,desc,,Hunter in front of the jury.
utter68.574,utter,HUNTER,...what happened to Kelly Lanier Van Ryan and Susan Marie Toller that will forever change the lives of these two young women? What happened in those fifteen minutes alone with Samuel Lombardo?
desc68.575,desc,,"The dark, seductive eyes."
scene69,slugline,,INT. COURTHOUSE - WITNESS WAITING ROOM - DAY
desc69.576,desc,,"Suzie, nervous, paces the floor, stops, lights a cigarette. The other witnesses sit in chairs along the wail -- the lawn mower man, cul-de-sac kids, Barbara, Nicole, as... IN THE COURTROOM Kelly Van Ryan sits in the witness box, dabbing her eyes with a handkerchief while Bryce Hunter stands before her. The room is silent, the spectators riveted on the scene."
utter69.577,utter,HUNTER,Do you need more time?
desc69.578,desc,,"Kelly shakes her head, no."
utter69.579,utter,HUNTER,"I know this is hard, Kelly, but I have just one more question and even though its something we've been over, I want us all to be very clear about it. (a long beat) When you made the decision to stay at Mr. Lombardo's house, after he had offered you a ride. When you saw that he intended to have sex with you, what were your exact words? What did you say?"
utter69.580,utter,KELLY,"I told him, no. I said stop, Mr. Lombardo, please... I screamed for him to stop..."
utter69.581,utter,HUNTER,And did he?
desc69.582,desc,,Kelly looks defiantly at the courtroom.
utter69.583,utter,KELLY,No. He raped me on the floor of his shitty house.
scene70,slugline,,WITNESS WAITING ROOM - SAME - SUZIE
desc70.584,desc,,"still pacing, as Ray and Gloria ENTER the room. Suzie shoots them a nervous glance, drops her cigarette, bends to pick it up, burns her fingers, drops it again. She curses beneath her breath, wrapping her fingers about her shoulders. Ray and Gloria watch her, exchange glances. Gloria picks up Suzie's cigarette for her, puts it out in an ashtray."
utter70.585,utter,GLORIA,"You've got nothing to be scared of, Suzie, just take a deep breath."
scene71,slugline,,INT. COURTROOM - LATER
desc71.586,desc,,"PANNING the spectators, we SEE Sandra, Baxter, Ray, Gloria. Hunter is on the witness stand. Suzie is in the box. She looks pale, even more nervous."
utter71.587,utter,SUZIE,He pushed into me... I couldn't stop him... it hurt.
utter71.588,utter,HUNTER,I'm sorry... you said it hurt? Why?
utter71.589,utter,SUZIE,Because... it was the biggest I've ever seen. And I've seen a lot on their way through Jack's Fish Camp.
desc71.590,desc,,"Chuckling in the courtroom. The JUDGE glares, silencing it."
utter71.591,utter,HUNTER,"Ms. Toller, did Samuel Lombardo rape you in your family's home on the 23rd of April last year?"
desc71.592,desc,,"Suzie glances at Sam, hesitates."
utter71.593,utter,HUNTER,Ms. Toller?
utter71.594,utter,SUZIE,I said he did.
utter71.595,utter,HUNTER,"Ms. Toller. I'm asking you now, under oath, did Samuel Lombardo rape you?"
desc71.596,desc,,"Suzie looks around, as if for help. The spectators stir. Ray rubs his eyes. Gloria's are closed."
utter71.597,utter,SUZIE,This wasn't my idea.
utter71.598,utter,HUNTER,I'm sorry?
desc71.599,desc,,Suzie looks at Sam once more.
utter71.600,utter,SUZIE,Look. I just don't want to get into any more trouble...
desc71.601,desc,,"Tom Baxter rises to his feet. The Judge raises a hand, motioning him to sit back down."
utter71.602,utter,JUDGE,(to Baxter) The Court would like to hear what Miss Toller has to say. (to Suzie) Miss Toller.
utter71.603,utter,SUZIE,Mr. Lombardo didn't rape me. He didn't rape Kelly either. He didn't do anything.
desc71.604,desc,,Hunter slumps back against the prosecution table. Sandra's hand covers her mouth. Baxter mumbles a curse. Sam hangs his head in relief. Ken grins above his neck brace.
scene72,slugline,,COURTROOM LOBBY
desc72.605,desc,,The press corps scrambles for cameras.
scene73,slugline,,BLUE BAY HIGH
desc73.606,desc,,"Teachers, students, Art, Jimmy -- crammed around the TV."
utter73.607,utter,JIMMY,I don't believe it...
scene74,slugline,,IN THE COURTROOM
desc74.608,desc,,"Bryce Hunter and Tom Baxter are both on their feet, trying to make themselves heard above the din."
utter74.609,utter,HUNTER,Your Honor... I must object...
utter74.610,utter,JUDGE,(hammering for order) I think I made it plain that the Court intends to near Miss Toller's story.
desc74.611,desc,,The Judge turns a cold eye on Suzie.
utter74.612,utter,SUZIE,I'm sorry.
utter74.613,utter,JUDGE,Sorry? Just how far did you intend to let this go?
utter74.614,utter,SUZIE,I don't know. I just wanted to hurt Mr. Lombardo.
desc74.615,desc,,"Sam looks up, confused."
utter74.616,utter,SUZIE,"He was my friend at first. Then I got busted... he didn't even stick up for me. I had to go away to that hellhole. It's like, you're his favorite, then who cares? You wanna know something? When Kelly said we should do this, I thought cool, all these big shots screwing me over, like that cop, Duquette. Now they're gonna get screwed."
utter74.617,utter,HUNTER,Your Honor... Please...
utter74.618,utter,JUDGE,"Any more interruptions Mr. Hunter, and the Court will hold you in contempt. (to Suzie) What you are telling me, Ms. Toller, is that Kelly Van Ryan is responsible for conceiving this entire charade..."
utter74.619,utter,SUZIE,"Kelly's pissed at Mr. Lombardo, too. She's in love with him. I mean her whole fantasy is him since her old man died. Then she found out that"
desc74.620,desc,,Mr. Lombardo was doing her mom. I
desc74.621,desc,,"Gasps in the court as -- Kelly BURSTS from the witness waiting room, trailed by a bailiff."
utter74.622,utter,KELLY,You stupid little bitch...
desc74.623,desc,,She grabs the first thing she can get her hands on -- a glass of water from one of the tables and hurls it toward the witness stand before the bailiff can pin her arms against her sides.
scene75,slugline,,INT. COURTHOUSE LOBBY - LATER
desc75.624,desc,,"A mob scene. Video crews are herded to one side by bailiffs as Sandra and Baxter, with Kelly in tow, move toward a side door. Sam and Ken round a corner, followed by Ray and Gloria who walk on either side of Suzie. Kelly sees them. She makes a run at Suzie. For a moment the girls shove and kick but Ray and Gloria are between them in a hurry, pulling then apart as Baxter arrives to take charge of Kelly, pulling her toward the door. Ruby and Walter arrive now too. Suzie runs to them and they lead her through the crowd, Walter pushing people aside with his long, tattooed arms. Gloria heaves a sigh. Ray pushes a hand through his hair, then turns to find Sam looking at him. Most of the press have run off to follow the girls -- looking for more action. It is a quiet moment. The two men lock eyes."
utter75.625,utter,SAM,"I've found that adolescents make the best liars. They're old enough to be good at it, but you want like hell to believe them, because they're still children."
desc75.626,desc,,Ray just looks at him -- a hard stare.
scene76,slugline,,EXT./INT. KEN'S T-BIRD - DAY
desc76.627,desc,,"top down, speeds on a highway, banana palms on one side, the blue Atlantic on the other. Wind buffets Ken and Sam -- who has a dazed look."
utter76.628,utter,KEN,"(hyped) Come on, let loose!"
utter76.629,utter,SAM,I was just thinking about where I'm gonna stay. I lost the house. It's like waking up from a goddamn nightmare.
utter76.630,utter,KEN,"You'll get over it. We've got a knockdown, airtight, motherfucker of a lawsuit against Sandra Van Ryan."
utter76.631,utter,SAM,Just like that?
utter76.632,utter,KEN,"Just like that? These people ruined your life, bro."
desc76.633,desc,,Ken pauses to thump the wheel with the butt of his hand.
utter76.634,utter,KEN,I told you they were going overboard and they did... They'll settle. Believe me. They'll be begging to settle...
desc76.635,desc,,"At which point Ken spots something up ahead. His smile broadens. He swerves into the other lane, tooting his horn, waving, The T-bird draws even with a sleek black limo."
utter76.636,utter,SAM,You don't think you're overdoing it?
desc76.637,desc,,"He pulls off his neck brace, dangles it in front of Sam's face, then tosses it out the window."
scene77,slugline,,INT. LIMO - MOVING - SAME
desc77.638,desc,,"Tom Baxter watches as the T-bird rockets off into the distance, a white piece of foam rubber bouncing across the road in its wake. A console TV is on -- news of the courthouse chaos. Sandra is next to Baxter. Kelly is on the opposite bench seat."
utter77.639,utter,SANDRA,I hope you're going to nail his scrotum to the nearest wall.
utter77.640,utter,BAXTER,"That might have been a possibility, if little miss not-so-bright here hadn't started throwing things."
utter77.641,utter,KELLY,Fuck off.
