segment-id,segment-type,segment-speaker,segment-text
utter0.0,utter,GREEN BOOK,Written by
desc0.1,desc,,Nick Vallelonga & Brian Currie & Peter Farrelly
scene1,slugline,,"(c) 2018 STORYTELLER DISTRIBUTION CO., LLC ""New York City, 1962"" EXT. COPACABANA - 10 EAST 60TH ST. - NYC - NIGHT"
desc1.2,desc,,"The famous red awning with COPACABANA in white block letters hangs over the entrance of the world-renowned nightclub. A long line of well-dressed customers fills the sidewalk waiting to get in. OVER THIS - WE HEAR the opening horns of Bobby Rydell's version of ""THAT OLD BLACK MAGIC""..."
scene2,slugline,,INT. COPACABANA - MAIN ROOM - CONTINUOUS
desc2.3,desc,,"The vibe is electric. SIX HUNDRED PATRONS pack the tables in the main room. Brazilian in theme, the Copa decor is art deco throughout, filled with palm trees illuminated by blue and pink hues. Pure elegance. Peppering the crowd... gorgeous COPA GIRLS, white-jacketed WAITERS, MAITRE D'S in Black Tuxedo Jackets, CAPTAINS in Blue Tux Jackets, and BOUNCERS in Red Tux Jackets. On stage in front of the Orchestra, tuxedo-clad BOBBY RYDELL. The crowd APPLAUDS."
utter2.4,utter,BOBBY RYDELL,Thank you very much! Welcome to Jules Podell's Copacabana! I'm Bobby Rydell and I'm happy to be here! (singing) That old Black Magic has me in its spell...
desc2.5,desc,,"FRANK ""TONY LIP"" VALLELONGA, 40s, Copa bouncer, moves quickly through the crowd. Lip is imposing with a charismatic presence. You don't mess with this guy. Following Lip, an ATTRACTIVE COUPLE. Lip leads them to a table near the front of the stage. The man slips Lip some cash. The Orchestra kicks in big, the room is jumping... At a back booth, JULES PODELL, 60, Copa owner, a tough-asnails bulldog of a man. He taps his diamond ring on the table to the beat of the song."
scene3,slugline,,INT. COPACABANA - COAT CHECK - CONTINUOUS
desc3.6,desc,,Lip trolls for customers who will tip him for a table. He
desc3.7,desc,,"JOEY LOSCUDO, 50s, a Mob Boss, entering the club followed by his CREW. Loscudo walks over to the COAT-CHECK GIRL, takes off his coat and hat, hands them to her."
utter3.8,utter,LOSCUDO,Guard this hat with your life... My mother gave it to me.
desc3.9,desc,,He winks.
utter3.10,utter,COAT-CHECK GIRL,"Yes, Mr. Loscudo..."
desc3.11,desc,,"He hands the Coat-Check Girl some money. The MAITRE D', CARMINE, walks over. Joey!"
utter3.12,utter,CARMINE LOSCUDO,"Hey, Carmine!"
desc3.13,desc,,Carmine slips Lip some cash.
utter3.14,utter,CARMINE,That's not necessary...
utter3.15,utter,LOSCUDO,Come on. You know I saw this kid Rydell last year in Philly. Nobody knew who he was.
utter3.16,utter,CARMINE,Well they know him now...
desc3.17,desc,,"They hug, then Carmine escorts Loscudo and his ENTOURAGE into the main room. Lip approaches the Coat-Check Girl."
desc3.18,desc,,Gimme Loscudo's hat.
utter3.19,utter,COAT-CHECK GIRL,But he said...
utter3.20,utter,LIP,"I know, just give it to me..."
desc3.21,desc,,"He bangs her a couple bucks, she turns the hat over to him."
scene4,slugline,,INT. COPACABANA - MAIN ROOM - CONTINUOUS
desc4.22,desc,,"RYDELL'S STILL SINGING, THE JOINT'S ROCKING... A FIGHT breaks out... FOUR GOOMBAHS pound each other. Tables flip, glass breaks, patrons scream... ANGLE ON Podell as he jumps up... PODELL TONY LIIIIIIIIIIIIIP!!! Lip is already on the move, running to the fight... It's pandemonium, but Rydell doesn't stop. He and the Orchestra building the speed and intensity of the song... Lip is joined by Carmine, and some BOUNCERS, all of them grappling with the Goombahs. They quickly RUSH THEM OUT OF"
scene5,slugline,,THE ROOM.... EXT. COPACABANA - NIGHT - CONTINUOUS
desc5.23,desc,,Everyone comes CRASHING out the front door. Lip throws the Goombah down the steps to the street. He jumps up.
desc5.24,desc,,"YOU PUT YOUR HANDS ON ME, YOU"
utter5.25,utter,LIP,Do yourself a favor--go home with your friends.
utter5.26,utter,GOOMBAH,Don't you tell me where to go! Do you know who I am?! I'm goin' back in there!
utter5.27,utter,LIP,"Nah, you're not."
desc5.28,desc,,"The Goombah TAKES A SWING at Lip and it's on. Lips KNOCKS HIM ON HIS ASS, then jumps on him and starts to BASH HIS FACE IN. CLOSE ON - Lip, brutally punching, his fists bloody, as WE HEAR O.S. APPLAUSE and"
scene6,slugline,,INT. COPACABANA - STAGE - CONTINUOUS
desc6.29,desc,,The band's swinging as Bobby Rydell delivers the big climax to the song...
utter6.30,utter,BOBBY RYDELL (O.S.),"(singing) ...Whoa, that old Black Magic called loooooooove!"
scene7,slugline,,INT. COPACABANA - COAT CHECK - LATER - NIGHT
desc7.31,desc,,A line of people wait behind mob boss Joey Loscudo as he screams at the Coat-Check Girl. Carmine stands by.
utter7.32,utter,LOSCUDO,I'll burn this place down! Where's my hat!
utter7.33,utter,COAT-CHECK GIRL,"I'm sorry, Mr. Loscudo, I went to the ladies room, I was only gone a minute..."
utter7.34,utter,LOSCUDO,Someone better find it!
utter7.35,utter,CARMINE,"It'll turn up, I swear it'll turn up."
utter7.36,utter,LOSCUDO,"Really? You tell that fat Jew bastard Podell that if it doesn't turn up, I'll burn this place down! You hear me? I'll burn the Copa down!"
scene8,slugline,,EXT. COPACABANA - ENTRANCE - NIGHT - LATER
desc8.37,desc,,"Lip, Carmine, and another bouncer, DANNY, smoke cigarettes, lean against a dinged-up '55 BUICK Sedan. A poster at the Copa entrance reads: BOBBY RYDELL - SOLD OUT! A worker pastes a banner over it: COPA CLOSED FOR RENOVATIONS NOVEMBER/DECEMBER - SEE YOU IN JANUARY WITH SAMMY DAVIS, JR.!"
utter8.38,utter,CARMINE,Jesus Christ. Loscudo is out of his mind.
utter8.39,utter,DANNY,We earned our money tonight.
utter8.40,utter,CARMINE,"Lip, I thought you were gonna kill that guy."
utter8.41,utter,LIP,Better him than me. What are you gonna do while we're closed?
utter8.42,utter,DANNY,I don't know. Maybe work at my Uncle's pizza joint.
utter8.43,utter,LIP,(to Carmine) What about you?
utter8.44,utter,CARMINE,I'm gonna drink for two months.
desc8.45,desc,,The men straighten up as Jules Podell exits the club.
utter8.46,utter,JULES PODELL,"Take me home, Lip."
scene9,slugline,,INT. JILLY'S SALOON - NIGHT
desc9.47,desc,,"LOSCUDO'S HAT GETS PLOPPED IN THE MIDDLE OF A TABLE... PULL BACK... Luscudo sits in the corner booth, holding court with JILLY and friends."
utter9.48,utter,LOSCUDO,"My hat! Jesus Christ, if you had tits, I'd kiss ya! How the hell'd you find it?"
desc9.49,desc,,ANGLE ON LIP standing in front of the table.
utter9.50,utter,LIP,"Heard it was missing, so I looked into it."
utter9.51,utter,LOSCUDO,I wanted to kill that broad.
utter9.52,utter,LIP,Wasn't her fault.
utter9.53,utter,JILLY RIZZO,Who had the balls to clip it?
utter9.54,utter,LIP,"Don't worry about it, I took care of him."
utter9.55,utter,LOSCUDO,I hope you gave him some beating.
desc9.56,desc,,"Loscudo pulls out a wad of cash, peels off a C-note."
utter9.57,utter,LIP,"No, I can't. It was my pleasure, Mr. Loscudo."
desc9.58,desc,,Loscudo SLAMS the MONEY into Lip's hand.
utter9.59,utter,LOSCUDO,"Bullshit. And from now on you don't have to call me Mister Loscudo, ya hear me?"
desc9.60,desc,,Lip smiles.
scene10,slugline,,EXT. LIP'S APARTMENT - BRONX - DAWN
desc10.61,desc,,"A six-story brick building with fire escapes framing the windows. Parked cars fill both sides of the street. Lip's car pulls up and parks in front of a FIRE HYDRANT. He gets out, grabs a garbage can, and PUTS IT OVER THE HYDRANT."
scene11,slugline,,INT. LIP'S APARTMENT - MORNING
desc11.62,desc,,"Lip ENTERS the small one-bedroom apartment. He moves to the kitchen, opens the refrigerator, chugs half a bottle of milk."
scene12,slugline,,INT. LIP'S APARTMENT - BEDROOM - MORNING
desc12.63,desc,,"Lip ENTERS. Sleeping in the bed, Lip's wife DOLORES, late 30s, pretty. Beside her, NICK, 9, and FRANKIE, 7. Lip takes off a ring, his watch, places them on top of the bureau. Empties his pockets of crumpled wads of cash. Lip strips down to a t-shirt and boxer shorts, gets in bed, snuggles up to Dolores. She wakes, kisses him."
utter12.64,utter,DOLORES,'Morning... 'Night...
scene13,slugline,,INT. LIP'S APARTMENT - LIVING ROOM - DAY
desc13.65,desc,,"CLOSE ON - A BLACK AND WHITE TV, THE YANKEES PLAY THE SAN FRANCISCO GIANTS, GAME 6 OF THE WORLD SERIES."
desc13.66,desc,,"""Roger Maris at the plate, Pierce checks the signs..."" PULL BACK -- On the couch watching the game, Lip's Father, NICOLA, 70s, brother RUDY, 30s, Dolores' father, ANTHONY, 70s, and her two brothers JOHNNY, 40s, and LOUIE, 30s."
utter13.67,utter,JOHNNY,"Come on, Roger! Hit one out!"
utter13.68,utter,RUDY,"Be quiet, you're gonna jinx it!"
desc13.69,desc,,Lip ENTERS still wearing his t-shirt and white boxers.
utter13.70,utter,LIP,"(sarcastic) Johnny, think you can yell a little"
desc13.71,desc,,louder?
utter13.72,utter,JOHNNY,Maris is up...
utter13.73,utter,LIP,"Yeah, so am I now. What the hell are you guys doing here?"
desc13.74,desc,,"Johnny discreetly nods toward the kitchen where we see TWO BLACK WORKMEN laying down linoleum. The kids, Nick and Frank, play with plastic Green Army soldiers in the corner."
utter13.75,utter,JOHNNY,Figured we'd come up and keep Dolores company...
desc13.76,desc,,BACK TO SCENE - Lip gets the point.
utter13.77,utter,ANTHONY (in Italian),"You shouldn't be sleeping in the middle of the day, leaving my daughter here alone with these sacks of coal."
utter13.78,utter,NICOLA,(in Italian) And why do you hire them to do an Italian's job? It's a disgrace.
utter13.79,utter,LIP,(in Italian) I don't know who they're gonna send.
desc13.80,desc,,ON Dolores - she pours a couple glasses of lemonade and hands the drinks to the Black Workmen.
utter13.81,utter,BLACK WORKMAN,"Thank you, ma'am."
desc13.82,desc,,"Lip watches as the Workmen drink the lemonade, then Dolores takes the glasses and PUTS THEM IN THE SINK. As she leads the men to the door, we go... ON THE TV - MARIS SWINGS... CRACK! PHIL RIZUTTO (V.O.) ""Deep to center field, holy cow he did it! A home run for Roger Maris!"
desc13.83,desc,,"Johnny jumps up, they all CHEER... Except Lip, whose eyes keep darting toward the GLASSES IN THE SINK. Dolores comes back and Lip joins her in the kitchen. He pours himself a glass of water, dips his finger in the sauce she's cooking. Dolores slaps his hand away."
desc13.84,desc,,"Get dressed, Tony, we're gonna eat. She picks up a big platter of meatballs and sausage and takes it into the dining room. Lip glances into the sink. CLOSE ON - The Black Workmen's two empty lemonade glasses. Lip takes the GLASSES out of the sink, DROPS THEM INTO THE GARBAGE."
scene14,slugline,,INT. LIP'S APARTMENT - DINETTE - LATER
desc14.85,desc,,"Lip's at the table, dressed now. Wine and plates of rigatoni. Joining them for lunch are FRAN, Johnny's wife, and LYNN, Louie's wife. Dolores makes the sign of the cross."
utter14.86,utter,DOLORES,"Bless us our Lord, for these thy gifts, which we are about to receive, from thy bounty through Christ our Lord, Amen."
desc14.87,desc,,They all make the sign of the cross.
desc14.88,desc,,They start stuffing their faces.
utter14.89,utter,DOLORES,"If anyone hears about a job for Tony, let us know."
utter14.90,utter,LIP,(nobody's business) Dolores...
utter14.91,utter,RUDY,"What happened, you get fired?"
utter14.92,utter,DOLORES,"No, Copa's closing for repairs. He needs something for just a couple months."
utter14.93,utter,JOHNNY,I'll ask around.
utter14.94,utter,NICOLA,"(in Italian) Mister big shot. Always spend, spend, spend. No job, he gets himself a new kitchen floor."
utter14.95,utter,LIP,"(in Italian) Come on, Pop. The kids were gettin' splinters in their feet."
utter14.96,utter,FRAN,"All the people he knows, he'll find something."
utter14.97,utter,JOHNNY,He had a great job at the sanitation department. (to Lip) You shouldn't have punched out the foreman.
utter14.98,utter,LIP,He shouldn't have woke me up.
desc14.99,desc,,Everyone LAUGHS.
scene15,slugline,,INT. LIP'S APARTMENT - KITCHEN - DAY - LATER
desc15.100,desc,,"Dolores is cleaning up. She's scraping a plate into the garbage can when she notices something O.S. DOLORES' POV - Two empty glasses in the garbage... She SIGHS, disappointed in her husband, then picks up the glasses from the garbage pail and puts them back into the sink."
scene16,slugline,,INT. GORMAN'S HOT DOGS - DAY
desc16.101,desc,,"Johnny, Lip, and Lip's youngest boy, Frankie, ENTER."
utter16.102,utter,JOHNNY,"I'm tellin' you, this is gonna be the easiest fifty bucks you ever made."
desc16.103,desc,,"They walk over to a table where FAT PAULIE, 40s, is waiting with the owner, GORMAN, and a couple other CUSTOMERS."
utter16.104,utter,FAT PAULIE,Johnny told me you ate forty-eight White Castle burgers in one sitting.
utter16.105,utter,FRANKIE,Cheeseburgers.
utter16.106,utter,FAT PAULIE,I don't believe you.
utter16.107,utter,LIP,"What do I care if you believe me? (beat) Gorman, who's got the record for hotdogs here?"
utter16.108,utter,GORMAN,Fat Paulie. Fifteen.
utter16.109,utter,JOHNNY,Why wasn't Lip in on that contest?
utter16.110,utter,FAT PAULIE,What contest? I was hungry.
desc16.111,desc,,The guys CHUCKLE.
utter16.112,utter,GORMAN,Bet's simple. Half a C-note. Most hotdogs in an hour wins. With toppings.
desc16.113,desc,,Lip sizes him up.
utter16.114,utter,LIP,What the hell you weigh?
scene17,slugline,,FAT PAULIE
utter17.115,utter,JOHNNY,Aaaaay. Your left ass weighs twosixty.
desc17.116,desc,,Fat Paulie raises his right hand.
utter17.117,utter,FAT PAULIE,May my mother-in-law drop dead on the spot if I'm lyin'.
desc17.118,desc,,They all LAUGH.
utter17.119,utter,LIP,"Okay, you're on."
scene18,slugline,,INT. GORMAN'S HOT DOGS - LATER
desc18.120,desc,,"The table filled with an assortment of hot dogs. Everyone CHEERS, CLAPS, as Lip and Fat Paulie STUFF THEIR FACES."
utter18.121,utter,JOHNNY,"Come on, Lip, pick it up! The baby elephant just hit nineteen!"
desc18.122,desc,,"Lip sweats, slows down, looks like he's gonna puke. The crowd cheers as Fat Paulie calmly takes a big bite of another dog."
scene19,slugline,,INT. LIP'S APARTMENT - LIVING ROOM - DAY
desc19.123,desc,,Lip and Frankie ENTER. Frankie runs over to Nick who is doing homework.
utter19.124,utter,LIP,"Nicky, you doin' your homework?"
utter19.125,utter,NICK DOLORES,Where were you?
desc19.126,desc,,"Lip plops down in a chair, exhausted."
utter19.127,utter,LIP,Gorman's. Fat Paulie bet me fifty bucks he could eat more hot dogs
desc19.128,desc,,than me. He knocked off twentyeight. Guy's an animal.
utter19.129,utter,DOLORES,Are you crazy--you lost fifty dollars?!
utter19.130,utter,LIP,"Dolores, please. I ate thirty."
desc19.131,desc,,Lip pulls out the winnings. She plucks the bills from his hand.
utter19.132,utter,DOLORES,Thank God. The gas bill came in today.
desc19.133,desc,,THE PHONE RINGS. Lip answers.
scene20,slugline,,INT. COPACABANA - DAY - SAME
desc20.134,desc,,"Jules Podell sits at his table in the empty Copa. He sips a cup of coffee as WORKERS clear tablecloths, flip chairs onto tables, etc."
utter20.135,utter,JULES PODELL,"(into phone) Hey, Lip, some guy called over here -- a doctor's lookin' for a driver. You interested?"
utter20.136,utter,INTERCUT CONVERSATION:,Yeah.
utter20.137,utter,LIP JULES PODELL,They're interviewing guys tomorrow afternoon. Here's the address.
scene21,slugline,,EXT. CARNEGIE HALL - 881 SEVENTH AVENUE - NYC - DAY
desc21.138,desc,,"Lip, wearing black slacks and a bowling-style shirt, stands at the front of... CARNEGIE HALL... He takes out a piece of paper, looks at it. This can't be the place..."
scene22,slugline,,INT. CARNEGIE HALL - CONCERT HALL - DAY
desc22.139,desc,,"Magnificent. Lip enters, moves down the aisle. He takes in the spectacle."
utter22.140,utter,WOMAN'S VOICE (O.S.),Excuse me. We're not open right now...
desc22.141,desc,,Lip turns to face the BOX OFFICE MANAGER across the room.
desc22.142,desc,,But you're welcome to buy tickets to tonight's performance.
utter22.143,utter,LIP,'There a doctor's office 'round here? I think I got the wrong address.
desc22.144,desc,,Lip holds up the paper.
utter22.145,utter,BOX OFFICE MANAGER,You have the correct address. Dr.
desc22.146,desc,,"Shirley lives upstairs, above the"
scene23,slugline,,hall. INT. DON SHIRLEY'S APARTMENT HALLWAY - DAY
desc23.147,desc,,"Lip walks down the hall. Two ENGLISH BUTLER-TYPES sit in chairs outside a door. The door opens and an ASIAN MAN, black suit and tie, carrying a briefcase, exits. At the door stands an Indian valet, AMIT, white Nehru shirt, white linen pants, clipboard in hand."
utter23.148,utter,LIP,"I'm here for the driver job. Tony Lip. Amit checks the list, flips a page, can't find it."
utter23.149,utter,LIP (CONT'D),I should be on there.
utter23.150,utter,AMIT,No Tony Lip. I do have a Tony Val...Valle...
utter23.151,utter,LIP,Vallelonga. That's me.
utter23.152,utter,AMIT,Fill this out while you wait. What?
utter23.153,utter,LIP AMIT,Fill. It. Out. While you wait.
desc23.154,desc,,"Amit hands him a clipboard and a pen, then Lip takes a seat next to the butlers."
scene24,slugline,,INT. SHIRLEY'S APARTMENT - DAY - LATER
desc24.155,desc,,Amit escorts Lip in. CLASSICAL MUSIC PLAYS.
utter24.156,utter,AMIT,Take a seat.
desc24.157,desc,,"Lip sits in a leather chair and Amit EXITS. Lip looks around. Never seen anything like it. Thirty-foot ceilings, giant skylight, enormous French windows overlooking Manhattan. It's filled to the rafters with paintings, African art, sculptures, Chinese lanterns, a giant gold Buddha, and two six-foot elephant tusks. A crystal chandelier hangs above a black Steinway Concert Grand Piano. A THRONE... an actual King's throne... sits on a riser, back against the glass window."
utter24.158,utter,VOICE (O.S.),"Mr. Vallelonga, sorry to keep you waiting..."
desc24.159,desc,,"Lip turns...Standing before him is DR. DONALD SHIRLEY, late 30s, black, resplendent in a traditional African robe. He's bedecked in assorted chain necklaces, bracelets, watch, and rings. Dr. Shirley speaks in a clipped, refined manner."
utter24.160,utter,DR. SHIRLEY,I'm Dr. Donald Shirley.
desc24.161,desc,,Lip's taken aback. Not what he expected. He stands.
desc24.162,desc,,Shirley extends his hand. They shake.
utter24.163,utter,DR. SHIRLEY,"Please, have a seat."
desc24.164,desc,,"Lip sits. Shirley sits on his ""throne,"" looking down at Lip."
utter24.165,utter,LIP,This is some place you got here.
desc24.166,desc,,Motioning to the Elephant Tusks.
utter24.167,utter,LIP (CONT'D),Them horns real?
utter24.168,utter,DR. SHIRLEY,Elephant tusks. Yes.
desc24.169,desc,,"Lip nods, points to the chain around Shirley's neck."
utter24.170,utter,LIP,What about that? That a molar? A what? A molar.
desc24.171,desc,,Lip points to his side teeth.
utter24.172,utter,LIP (CONT'D),Like a shark tooth? Or a tiger's?
utter24.173,utter,DR. SHIRLEY,"Um, no. It was a gift. Oh."
utter24.174,utter,LIP,(looks around) I thought I was going to an office. They said a doctor needed a driver.
utter24.175,utter,DR. SHIRLEY,That's all they told you?
desc24.176,desc,,Lip shrugs.
utter24.177,utter,DR. SHIRLEY (CONT'D),"Actually, it's a bit more complicated than that. Have you ever driven professionally before?"
utter24.178,utter,LIP,Sanitation. (beat) Garbage trucks. Off Shirley's unimpressed look.
utter24.179,utter,LIP (CONT'D),Plus I drive my boss home at night. I can drive anything.
utter24.180,utter,DR. SHIRLEY,I see. What other experience do you have?
utter24.181,utter,LIP,"I worked a lot of joints. The Wagon Wheel, Peppermint Lounge, Copa... DR. SHIRLEY In what capacity?"
utter24.182,utter,LIP,What do you mean?
utter24.183,utter,DR. SHIRLEY,What did you do there? Lip chews on that. You can smell the wood burning...
utter24.184,utter,LIP,Public relations...
desc24.185,desc,,"Shirley nods, understanding."
utter24.186,utter,DR. SHIRLEY,"Well, first of all, Tony, I'm not a medical doctor. I'm a musician."
utter24.187,utter,LIP,You mean like songs?
utter24.188,utter,DR. SHIRLEY,"Yes. I'm about to start a concert tour, the majority of which will be down South."
utter24.189,utter,LIP,Atlantic City?
utter24.190,utter,DR. SHIRLEY,"The deep south. We start in the midwest, but then we're taking a hard left. Kentucky, North Carolina, Tennessee, and on down through the Delta. (beat) Do you foresee any issues working for a black man?"
utter24.191,utter,LIP,"No, no... 'fact just yesterday me and the wife had a couple colored guys over the house. For drinks."
desc24.192,desc,,Shirley takes a BEAT.
utter24.193,utter,DR. SHIRLEY,"Oh, I see. You're married."
utter24.194,utter,LIP,Yup. Two kids.
utter24.195,utter,DR. SHIRLEY,I don't know if this is the proper job for a married man.
utter24.196,utter,LIP,"Why, we bringing broads?"
desc24.197,desc,,Shirley shoots him a look.
utter24.198,utter,DR. SHIRLEY,"My point is, you'll be gone for eight straight weeks--with no breaks--right up until Christmas. You're quite sure you can leave your family for that long?"
utter24.199,utter,LIP,Depends on what you're paying.
utter24.200,utter,DR. SHIRLEY,"Ninety dollars a week, plus room and board. But let me be crystal clear... I'm not simply hiring a chauffeur. I need someone who can handle my itinerary. I need a personal assistant. I need a valet. I need someone who will launder my clothes, shine my shoes..."
utter24.201,utter,LIP,"Good luck, Doc."
desc24.202,desc,,"Lip stands, heads for the door. Shirley steps down off his throne."
scene25,slugline,,DR. SHIRLEY
desc25.203,desc,,"Lip turns back, faces Shirley."
utter25.204,utter,DR. SHIRLEY (CONT'D),I had my record label ask around town to find me the right man. Your name came up more than once. You've impressed a lot of people by the way you handle... trouble. That's why I called and asked about your availability.
desc25.205,desc,,Lip thinks about it.
utter25.206,utter,LIP,"Look, I got no problem being on the road with you. But I ain't no butler, I ain't ironing shirts, and I'm not shining nobody's shoes. You need someone to get you from point A to point B? You need someone to make sure there's no problems along the way -- and you going through the deep South, believe me, there's gonna be problems. So if you want me, it's gotta be a buck and a quarter a week. Or go hire the little Chink that just pranced out of here and see how far you get."
desc25.207,desc,,"Shirley stares, stone-faced."
utter25.208,utter,DR. SHIRLEY,"Well, Mr. Vallelonga...thank you for coming in."
desc25.209,desc,,"As Lip turns and walks out, we -CUT TO:"
scene26,slugline,,EXT. JOE & JOE RESTAURANT - BRONX - LATE AFTERNOON
desc26.210,desc,,A tired Lip comes walking down the sidewalk and ENTERS.
scene27,slugline,,INT. JOE & JOE RESTAURANT - BAR/DINING ROOM - CONTINUOUS
desc27.211,desc,,"Smoky, packed, loud... Lip snakes his way to BOBBY, 40s, CHINESE, who's behind the bar."
utter27.212,utter,LIP,"Bobby, give me a Rheingold. Ice cold."
desc27.213,desc,,"Bobby pours a draft of Rheingold, slides it in front of him."
utter27.214,utter,BOBBY,(concerned) Mister Tony. Augie asking about you.
desc27.215,desc,,Lip isn't happy to hear this. A CUSTOMER pounds on the bar.
utter27.216,utter,CUSTOMER,"Come on, I'm dying of thirst over here!"
utter27.217,utter,BOBBY,"Shut up, I'm talking!"
desc27.218,desc,,He turns back to Lip.
utter27.219,utter,LIP BOBBY,Now. He in his box.
desc27.220,desc,,"Lip drains the beer, leaves the bar area, weaves his way through the crowd to an ENCLOSED, PRIVATE BOOTH with a curtain blocking the people inside. Lip hesitates, then opens the curtain. HIS POV - AUGIE, rough-looking, dead eyes, sits there stuffing his face with linguini and clam sauce. TWO PSYCHOPATHS sit with him. The Psychos look on blankly. A lesser man would shit his pants."
utter27.221,utter,AUGIE,(intense) Tony Lip. What the hell happened at the Copa? I heard you split a guy's face open.
desc27.222,desc,,Lip shrugs.
utter27.223,utter,AUGIE (CONT'D),That guy you hit. He was one of Charlie the Hand's crew.
utter27.224,utter,LIP,Then he shoulda known better.
desc27.225,desc,,"Augie mad-dogs him, never losing eye contact as he stuffs his face. Lip doesn't blink."
utter27.226,utter,AUGIE,"The Hand wanted me to look into it. I spoke to Podell. Whole thing was over a piece of ass, right?"
desc27.227,desc,,Lip shrugs.
utter27.228,utter,AUGIE (CONT'D),A beef like that should never happen in the club. They were out of line. So we squashed it.
desc27.229,desc,,He wipes olive oil off his chin.
utter27.230,utter,LIP,"Thanks, but I already ate."
desc27.231,desc,,"Augie chews away, not sure if he believes him."
utter27.232,utter,AUGIE,You looking to earn some extra scharole? I could keep you busy while the Copa's down.
utter27.233,utter,LIP,What I gotta do? Things...
desc27.234,desc,,Lip thinks about it.
utter27.235,utter,LIP,"Appreciate it, but I'm gonna spend some time with the family."
utter27.236,utter,AUGIE,"Don't be stupid. You can make a few bucks, buy something nice for your wife."
utter27.237,utter,LIP,I'm good. I'm flush right now.
scene28,slugline,,EXT. WHITE PLAINS ROAD - BRONX - EARLY EVENING
desc28.238,desc,,The EL TRAIN thunders above Lip as he enters a PAWN SHOP.
scene29,slugline,,INT. PAWN SHOP - BRONX - EARLY EVENING
desc29.239,desc,,"CLOSE ON Lip's WRISTWATCH on the counter. The pawn guy, CHARLIE, looks up at Lip, concerned. Reluctantly, he hands Lip cash and a ticket."
utter29.240,utter,PAWN GUY,"Here's fifty. Give me sixty before Christmas, you get it back."
desc29.241,desc,,Lip turns to leave.
utter29.242,utter,PAWN GUY (CONT'D),"Hey, Lip... everything okay?"
utter29.243,utter,LIP,"(offended) You got beak trouble, Charlie? Mind your business."
desc29.244,desc,,Lip walks out.
scene30,slugline,,INT. LIP'S APARTMENT - LIVING ROOM - NIGHT
desc30.245,desc,,Lip sits watching TV as Dolores hands him a bowl of spaghetti.
utter30.246,utter,DOLORES,So what happened with the doctor interview?
utter30.247,utter,LIP,"He ain't a real doctor, he's a piano player."
desc30.248,desc,,"Lip digs in, starts stuffing his face."
utter30.249,utter,DOLORES,I don't understand--why'd they say he was a doctor?
