segment-id,segment-type,segment-speaker,segment-text
utter30.250,utter,LIP,I don't know. I think he's like a doctor of piano-playing or something.
utter30.251,utter,DOLORES,You can be that?
utter30.252,utter,LIP,"I guess. He lives on top of Carnegie Hall. You shoulda seen this place, Dee--it was filled with statues and all kinds of fancy crap. And he was sitting on a friggin' throne all dressed up like the king of the jungle bunnies."
utter30.253,utter,DOLORES,He's colored? You wouldn't last a week with him.
utter30.254,utter,LIP,"For the right money, I would."
desc30.255,desc,,"As Lip continues eating, we go..."
scene31,slugline,,INT. LIP'S APARTMENT - BEDROOM - EARLY MORNING
desc31.256,desc,,"Lip and Dolores are asleep in bed, the kids asleep in another bed across the room. THE PHONE RINGS. Lip and Dolores wake up. Lip looks at the clock--8 a.m. He answers the phone."
utter31.257,utter,LIP,"(into phone) Hello... Yeah... Really?... Why?... Okay, hold on."
desc31.258,desc,,Lip puts his hand over the receiver.
utter31.259,utter,DOLORES,Everything okay? It's him. Who?
utter31.260,utter,LIP DOLORES LIP,"Dr. Shirley, the piano guy. He wants to talk to you."
desc31.261,desc,,She sits up.
utter31.262,utter,DOLORES,(whispers) Me? What? Why?
desc31.263,desc,,"Lip shrugs. He holds out the phone, Dolores takes it."
utter31.264,utter,DOLORES (CONT'D),"(into phone) Hello... Good morning, Doctor, nice to talk to you, too..."
desc31.265,desc,,She glances at Lip.
utter31.266,utter,DOLORES (CONT'D),"(into phone) Yes, that is a long time..."
desc31.267,desc,,Dolores looks at Lip as Shirley talks on.
utter31.268,utter,DOLORES (CONT'D),"(beat) It is...Yes, I'm sure...Thank you for calling...Goodbye."
desc31.269,desc,,Dolores hangs up.
utter31.270,utter,LIP,What he say?
desc31.271,desc,,Dolores looks stunned.
utter31.272,utter,DOLORES,He wanted to know if I'd be okay with him taking my husband away from his family for two months. He said he'd pay you what you asked for.
desc31.273,desc,,Lip looks surprised. She rolls away from him.
utter31.274,utter,LIP,"It's good money, Dolores. You know we need it. I can't be eatin' thirty hot dogs every day."
desc31.275,desc,,Dolores wells up.
utter31.276,utter,DOLORES,I know...I said it was okay for you to go.
scene32,slugline,,EXT. LIP'S APARTMENT - MORNING
desc32.277,desc,,"Dion's ""RUNAROUND SUE"" drifts lazily from a transistor radio... Laundry hangs from fire escapes. OLD ITALIAN WOMEN sit in folding chairs CHATTING while Grandpa Nicola, Grandpa Anthony and Rudy watch Nick and Frankie play. A 1963 CHRYSLER NEW YORKER and a 1961 CADILLAC SEDAN are parked in front. Lip, wearing a well-worn black suit, stands next to the Chrysler talking to a RECORD EXEC, 40s, sharply dressed, nononsense, and his nebbishy ASSISTANT. The Record Exec hands Lip a check."
utter32.278,utter,RECORD EXEC,Here's the first half of your pay. You'll get the rest when the tour's
desc32.279,desc,,over.
utter32.280,utter,LIP,"Uh-uh, I gotta get paid every week."
utter32.281,utter,RECORD EXEC,"Sorry, that's not how the record company does it."
desc32.282,desc,,Lip glares at him.
utter32.283,utter,RECORD EXEC (CONT'D),We gotta have some guarantee you'll finish the job.
utter32.284,utter,LIP,"Why the hell wouldn't I finish the job? I took it, didn't I?"
desc32.285,desc,,"The Record Exec glances at his assistant, then back at Lip."
utter32.286,utter,RECORD EXEC,Then you've got nothing to worry about.
desc32.287,desc,,"The Exec holds out the car keys. As Lip reaches for them, the Exec pulls them back."
utter32.288,utter,RECORD EXEC (CONT'D),"Here's the deal, Mr. Vallelonga. It's your job to get Don to all his tour dates on time. If he misses any shows, you're not getting your back-end."
desc32.289,desc,,Lip takes the keys.
utter32.290,utter,LIP,He's not gonna miss any shows.
utter32.291,utter,RECORD EXEC,Good. And you're going to need this.
desc32.292,desc,,He hands Lip a small GREEN BOOK.
utter32.293,utter,RECORD EXEC (CONT'D),"It's the book I told you about. Sometimes you're staying in the same hotels, and sometimes you're not."
desc32.294,desc,,"As Lip glances at the book, we -ANGLE ON Lip's brother-in-law, Johnny, exiting the building. He carries a suitcase over to the Cadillac. As the Record Exec and his assistant drive off in the Chrysler, Lip walks over to Johnny."
utter32.295,utter,JOHNNY,(re: Caddy) Madonne. This the new one?
utter32.296,utter,LIP,The record company rented it.
desc32.297,desc,,"Lip opens the trunk, Johnny puts the suitcase in."
utter32.298,utter,JOHNNY,So what'd my sister say about you being gone for three weeks?
utter32.299,utter,LIP,Eight weeks.
desc32.300,desc,,Johnny smirks.
utter32.301,utter,JOHNNY,"Yeah, right. Ten-to-one you slap the moolie out and come home under a month."
desc32.302,desc,,"Lip smiles, shoves Johnny. Dolores approaches with the kids."
utter32.303,utter,DOLORES,Come here. Say goodbye to your father.
desc32.304,desc,,"Nick and Frankie run to Lip, hug him. They get emotional."
utter32.305,utter,LIP,"Stop that. You gotta be big boys, take care of your mother..."
desc32.306,desc,,"HE give the kids kisses, then they run away."
utter32.307,utter,DOLORES,Did you go to the A-A-A for the maps?
utter32.308,utter,LIP,The record guy gave me maps and directions with the itinerary thing. And this.
desc32.309,desc,,Lip pulls out the small green book that the Record Exec gave him.
utter32.310,utter,DOLORES,(reading) The Negro Motorist Green-Book?
utter32.311,utter,LIP,Lists all the places coloreds can stay down south. Like if you're traveling while black.
utter32.312,utter,DOLORES,Traveling while black?
utter32.313,utter,LIP,Yeah. Like if you're black but you gotta travel for some reason.
utter32.314,utter,DOLORES,They got a special book for that? I guess.
utter32.315,utter,LIP DOLORES,Did you pack an iron?
utter32.316,utter,LIP,"I ain't lugging around no iron, Dee."
utter32.317,utter,DOLORES,How you gonna keep your pants pressed?
utter32.318,utter,LIP,I'll put 'em under my mattress.
desc32.319,desc,,Dolores takes Lip's hand.
utter32.320,utter,DOLORES,I want you to write me a letter every chance you get.
utter32.321,utter,LIP,"Aw, come on, Dee, I can't write letters."
utter32.322,utter,DOLORES,"Take you five minutes. Promise me. I can't write, it's embarrassing-they ain't gonna be no good."
utter32.323,utter,DOLORES,"It's a lot cheaper than callin' long distance, Tony. Promise me you'll write."
desc32.324,desc,,Lip SIGHS.
utter32.325,utter,LIP,Okay. I promise. I'll try.
desc32.326,desc,,She looks at him.
scene33,slugline,,LIP (CONT'D)
desc33.327,desc,,Lip hugs and kisses her. He gives her the check.
utter33.328,utter,LIP (CONT'D),Put this in the bank today.
desc33.329,desc,,She takes it and hands him a brown paper bag.
utter33.330,utter,DOLORES,I made a couple veal-cutlet sandwiches for you and Dr. Shirley. Be careful. I love you.
utter33.331,utter,LIP,"Love you, too."
utter33.332,utter,DOLORES,You better be home at Christmas or don't come home at all!
desc33.333,desc,,"As they kiss, Grandpa Nicola CALLS OUT to Lip:"
utter33.334,utter,NICOLA,(in Italian) He who arrives late has no bed!
desc33.335,desc,,Lip waves goodbye to everyone. WE STAY ON Dolores as he drives away...
scene34,slugline,,EXT. CARNEGIE HALL - 881 SEVENTH AVENUE - NYC - DAY
desc34.336,desc,,"Lip parks Shirley's rented Cadillac in front of an identical Cadillac, gets out, opens the trunk. Smoking next to the other Cadillac is OLEG MALAKHOV, 30s, Russian, wears glasses, and GEORGE DYER, 30s. Lip takes out a cigarette, is about to light it, then notices Oleg smoking. He puts the cigarette back in the pack, then walks over to Oleg and George."
utter34.337,utter,LIP,Bum a smoke?
desc34.338,desc,,"Oleg sizes Lip up, then reluctantly hands him a cigarette."
utter34.339,utter,LIP (CONT'D),I'm Tony. You the band?
utter34.340,utter,OLEG,(Russian accent) Oleg. Cello.
utter34.341,utter,GEORGE,"George. Bass. And we're not a band, we're a trio."
desc34.342,desc,,"Dr. Shirley exits the building, impeccably dressed in a silk suit. He's followed by his valet, Amit, who awkwardly carries three large pieces of Shirley's EXPENSIVE LUGGAGE. Lip opens the back door of the car. Shirley gets in. Amit drops the bags he was carrying on the sidewalk. Shirley sits in the back seat. Amit leans in, places a RED CASHMERE BLANKET over Shirley's legs. DR. SHIRLEY Thank you, Amit."
utter34.343,utter,AMIT,"Have a wonderful trip, Doctor."
desc34.344,desc,,"Amit shuts the car door. The luggage sits on the sidewalk between Lip and Amit. Lip smokes his butt, shoots Amit an ""It ain't my job"" look. Standoff. Amit caves, picks up the three bags, one at a time, puts them into the trunk. Lip SLAMS the trunk shut."
scene35,slugline,,EXT. GEORGE WASHINGTON BRIDGE - DAY
desc35.345,desc,,BIRD'S-EYE VIEW of The Westside Highway in 1960's Manhattan and the glistening Hudson River as the two Cadillacs cross the upper-level of the George Washington Bridge surrounded by
scene36,slugline,,hundreds of period cars. EXT. ROUTE 80 WEST - NEW JERSEY - LATER - DAY
desc36.346,desc,,"Dr. Shirley's Cadillac drives west on Route 80, followed by Oleg and George."
scene37,slugline,,INT. CADILLAC - DAY
desc37.347,desc,,"Lip's driving fast, smoking faster. Shirley chokes on the blue haze filling the car, cracks his window. Lip reaches into the brown paper bag, pulls out a wax-paperwrapped sandwich with ""Tony"" written on it, peels back the foil. Veal cutlet and peppers sandwich on a loaf of Italian bread. Still smoking, Lip starts to eat."
utter37.348,utter,DR. SHIRLEY,"Tony, when we arrive in a city, the first thing I'd like you to do is check the piano where I'm playing. Make sure it's a Steinway as per my contract."
desc37.349,desc,,"Lip pulls out a pen, writes ""STAIN WAY"" on the map."
utter37.350,utter,DR. SHIRLEY (CONT'D),And could you see to it that I have a bottle of Cutty Sark in my room every night.
utter37.351,utter,LIP,Every night?
desc37.352,desc,,Lip smiles.
utter37.353,utter,LIP (CONT'D),Well if you ever need any help with that...
utter37.354,utter,DR. SHIRLEY,"I won't. And ten-and-two on the wheel, please."
desc37.355,desc,,Tony loses the smile. Shirley slides over in his seat so that he's directly behind Lip.
utter37.356,utter,LIP,"Doc, I noticed on the itinerary thing there that the last show's"
utter37.357,utter,DR. SHIRLEY,"Birmingham, yes. It's a Christmas show."
utter37.358,utter,LIP,Any way we could hit the road early the next morning so we could be back home in time for Christmas Eve?
utter37.359,utter,DR. SHIRLEY,We'll see. Could you please put the cigarette out? Why?
utter37.360,utter,LIP DR. SHIRLEY,Because I can't breathe back here.
utter37.361,utter,LIP,What are you talking about? Smoke's going into my lungs. I'm doing all the work here.
scene38,slugline,,DR. SHIRLEY
desc38.362,desc,,"Lip thinks about it, defiantly takes one long last drag off the heater, then another, then finally FLICKS IT OUTSIDE. Lip rolls up his window, shoots a look at the second sandwich, ""Dr. Shirley"" written on it. FUCK THIS GUY. He opens it, stuffs Shirley's sandwich in his mouth, looks straight ahead."
scene39,slugline,,EXT. PENNSYLVANIA TURNPIKE - LATER - DAY CLOSE ON A SIGN - PENNSYLVANIA TURNPIKE. EXT. PENNSYLVANIA TURNPIKE - CONTINUOUS
desc39.363,desc,,"Oleg's car speeds up, pulls next to Shirley's Cadillac. Oleg rolls down his window, motions to Shirley, who rolls down his window."
utter39.364,utter,OLEG,(in Russian) Everything okay?
utter39.365,utter,DR. SHIRLEY,(in Russian) Yes. Everything's fine.
desc39.366,desc,,"Lip looks back over his shoulder, stunned to hear Shirley speaking in another language."
utter39.367,utter,OLEG,(in Russian) Good. We'll meet you at the hotel in Pittsburgh.
utter39.368,utter,DR. SHIRLEY,(in Russian) Make a reservation for dinner. We'll rehearse immediately after. See you there.
desc39.369,desc,,"Oleg gives Lip the hairy eyeball, blows past him."
utter39.370,utter,LIP,(to himself)
desc39.371,desc,,Hell's he looking at? Lip looks in the mirror at Shirley.
utter39.372,utter,LIP (CONT'D),"You speak German, huh?"
utter39.373,utter,DR. SHIRLEY,That was Russian.
utter39.374,utter,LIP,"Yeah, I was stationed in Germany in the army. I can pick up a little of what you're sayin'. Be careful, Krauts are all sneaks. Kennedy shoulda bombed 'em when we had the chance--plus now them Cuban bastards."
desc39.375,desc,,Shirley rolls his eyes.
utter39.376,utter,LIP (CONT'D),Where they going anyway? Ain't they supposed to be following us?
utter39.377,utter,DR. SHIRLEY,"They have the itinerary. As long as they make it to the shows on time, I don't worry and you shouldn't either."
utter39.378,utter,LIP,(offended) I ain't worried about nothin'.
scene40,slugline,,INT. DINER - DAY
desc40.379,desc,,"Lip and Shirley sit in a booth eating lunch. Shirley picks at a tuna salad while Lip chows down on a pot roast. Shirley watches Lip, amazed at the ferocity with which he attacks his meal."
utter40.380,utter,DR. SHIRLEY,How is that?
desc40.381,desc,,Lip thinks about it.
desc40.382,desc,,Lip continues to stuff his face.
utter40.383,utter,DR. SHIRLEY,Have you ever thought of being a food critic?
desc40.384,desc,,"Lip looks up, hopeful."
utter40.385,utter,LIP,"Not really, but...why? Is there money in that?"
utter40.386,utter,DR. SHIRLEY,"I'm just saying, you have a marvelous way with words when describing food. Salty. So vivid. One can almost taste it."
desc40.387,desc,,Lip feels the jab.
utter40.388,utter,LIP,"I'm saying it's salty, and salt's cheatin'. Any cook can make things salty. But to make it taste good without the salt, with just the other flavors, that's the trick. See, when you-(CONTINUED)"
utter40.389,utter,DR. SHIRLEY,We should be going soon if we expect to get to Pittsburgh by dinner.
utter40.390,utter,LIP,"You know, when I was in the army I knew a guy from Pittsburgh, but he called it Titsburgh because he said all the girls there have big tits."
utter40.391,utter,DR. SHIRLEY,"That's absurd. Why would women in Pittsburgh have larger breasts than, say, women in New York?"
desc40.392,desc,,Lip shrugs.
utter40.393,utter,LIP,"'The hell I know? Guess we'll find out, huh?"
desc40.394,desc,,Lip goes back to his plate.
utter40.395,utter,LIP (CONT'D),"By the way, when you hired me, my wife went out bought one of your records--'one about the orphans. Orphans?"
scene41,slugline,,DR. SHIRLEY
utter41.396,utter,LIP,Yeah. Cover had a bunch of kids sitting around a campfire?
desc41.397,desc,,Shirley has to think a moment.
utter41.398,utter,Orpheus.,What?
scene42,slugline,,DR. SHIRLEY
utter42.399,utter,DR. SHIRLEY,Orpheus in the Underworld. It's based on a French Opera. And those kids on the cover? They were demons in hell.
utter42.400,utter,LIP,No shit? Must of been naughty kids.
scene43,slugline,,INT. CADILLAC - DAY - LATER
desc43.401,desc,,They've been driving awhile now. Lip starts to pull the car over to the side of the road.
utter43.402,utter,DR. SHIRLEY,What are you doing?
utter43.403,utter,LIP,I gotta take a leak. Here? Now?
scene44,slugline,,DR. SHIRLEY
utter44.404,utter,LIP,"What, you want me to piss my pants?"
scene45,slugline,,EXT. HIGHWAY - DAY - CONTINUOUS
desc45.405,desc,,"The Cadillac stops on the shoulder of the road next to some trees. Lip gets out, takes a few steps... then realizes he forgot something... Lip goes back, opens the driver's side door and GRABS HIS WALLET OFF THE DASH. Shirley and Lip's eyes meet for a moment. Then, wallet in hand, Lip heads to the woods to pee."
scene46,slugline,,INT. PENN-SHERATON HOTEL - LIP'S ROOM - NIGHT
desc46.406,desc,,"Lip wears a guinea T-shirt. He steps out of the bathroom, dries his hands with a towel, opens a sliding glass door that leads to..."
scene47,slugline,,EXT. LIP'S ROOM - 2ND FLOOR BALCONY - CONTINUOUS - NIGHT
desc47.407,desc,,"From this perch, the courtyard is illuminated by the reflection of the pool light. Lip steps out, fires up a smoke, takes in the cool breeze. LIP'S POV - Oleg and George are at a table poolside, playing grab-ass with TWO WOMEN, drinking, LAUGHING... Lip peers across the courtyard, finds Dr. Shirley sitting on the patio outside his room, drink in hand, a half-empty bottle of Cutty beside him. Lip observes a moment, goes back into his room."
scene48,slugline,,INT. PENN SHERATON HOTEL - LOBBY - DAY
desc48.408,desc,,"Lip, wearing a black suit, sits reading a paper. Shirley wearing a tuxedo, enters, crosses to Lip. Shirley pulls a roll of cash out of his pocket, peels off some bills, gives them to Lip."
utter48.409,utter,DR. SHIRLEY,"Take this for any incidentals we may need. If you want something for yourself, you don't have to ask me, just make sure you keep the receipts. When it runs low, let me know."
desc48.410,desc,,Lip nods. They walk towards the exit.
utter48.411,utter,DR. SHIRLEY (CONT'D),"One more thing--we will be attending many events before and after the concerts, interacting with some of the wealthiest and most highly-educated people in the country. It is my feeling that your diction, as charming as it may be in the tri-state area, could use a bit of finessing."
utter48.412,utter,LIP,Like you mean diction in what way?
utter48.413,utter,DR. SHIRLEY,"In the only way the word ""diction"" is ever used."
utter48.414,utter,LIP,(unsure) Okay...
utter48.415,utter,DR. SHIRLEY,"Your intonation, inflection, choice"
utter48.416,utter,of words-LIP,"Ayyyy, I got my own problems, I gotta worry what other people think about the way I talk?"
utter48.417,utter,DR. SHIRLEY,There are simple techniques I can teach you that are quite effective. I can help you.
desc48.418,desc,,Lip is frustrated.
utter48.419,utter,LIP,"I don't need no goddamn help. If people don't like the way I talk, they can go take a shit."
utter48.420,utter,DR. SHIRLEY,The profanity is another issue.
utter48.421,utter,LIP,"A fanabla, why you breakin' my balls?"
utter48.422,utter,DR. SHIRLEY,"Because you can do better. And here's another thing--as guest of honor, I will be announced when I enter these intimate events. You will be announced as well. Vallelonga may be difficult to pronounce. I was thinking ""Valle"" would be more appropriate. Tony Valle. It's short and simple."
utter48.423,utter,LIP,"Nuh-uh. If they got a problem with Vallelonga, they can call me Tony Lip."
desc48.424,desc,,Shirley winces.
utter48.425,utter,DR. SHIRLEY,These are genteel people. That might be a little...worldly for them.
utter48.426,utter,LIP,"Then it's Tony Vallelonga. All these high-class people that are so much smarter than me, with all their intelligence and speakin' abilities, you're telling me they can't pronounce my name?"
utter48.427,utter,DR. SHIRLEY,"I'm just telling you, Valle will make things easier."
utter48.428,utter,LIP,"My last name is Vallelonga and I ain't changing it for nobody. They don't like it, they can shove it up their ass--I'll just wait outside. Dr. Shirley considers this."
utter48.429,utter,DR. SHIRLEY,A sound compromise.
scene49,slugline,,ESTABLISHING SHOT - PITTSBURGH MANSION - EVENING EXT. MANSION - BACK PARKING LOT - EVENING - SAME
desc49.430,desc,,"Filled with BLACK CHAUFFEURS killing time next to their cars. Waiters, Busboys, Waitresses, Cooks, ALL BLACK, move in and out of the home. Lip lights a cigarette, looks around... CLOSE ON - LIP'S EXPRESSION as he realizes he's THE ONLY WHITE HELP. Lip NOTICES A CHAUFFEUR trying to watch the show from a WIDEOPEN SIDE-WINDOW. He joins him. From here, he can see inside"
scene50,slugline,,the BALLROOM.
desc50.431,desc,,"HIS POV - a well-dressed WHITE AUDIENCE packs the lavish room. On stage, a Steinway piano, a Cello, and a Stand-up Bass. A distinguished-looking WOMAN, MC, 40s, steps up to the microphone."
desc50.432,desc,,"BACK ON Lip as he leans toward a CHAUFFEUR, 60s, beside him."
utter50.433,utter,LIP,"Virtuoso--that's Italian. Means he's really good. Ladies and gentleman, please welcome The Don Shirley Trio!"
desc50.434,desc,,"As the AUDIENCE APPLAUDS, Dr. Shirley, Oleg, and George take their places at their respective instruments. The Trio opens with the Irving Berlin standard ""BLUE SKIES."" Shirley, using his own prodigious technique, is ELEGANT. The AUDIENCE IS MESMERIZED. ANGLE ON Lip as he steps closer to the window. CLOSE ON DR. SHIRLEY - His hands glide over the Steinway's ivories like a bird in flight. Each finger is center key, each note plucked perfectly. HE'S A VIRTUOSO AT THE PEAK OF HIS CRAFT. PUSH IN ON LIP as he realizes that he's not driving a piano player, he's driving a genius."
scene51,slugline,,EXT. MANSION - DRIVEWAY - NIGHT
desc51.435,desc,,"CLOSE ON - DICE ROLLING... A FOUR AND A SIX! PULL BACK - A CRAPS GAME BEING PLAYED OUT BETWEEN PARKED CARS... DICE, DOLLAR BILLS, and QUARTERS ON THE GROUND. Lip rolls the dice. He's surrounded by the chauffeurs, busboys, waiters, cooks. Everyone SCREAMS as Lip... Rolls FOUR AND FOUR. MORE CHEERING, MONEY LAID DOWN... Lip rolls again... FIVE AND FIVE! WINNER! CHEERS AND MOANS... Lip grabs the pile of money."
utter51.436,utter,BUSBOY,Shit! He won again!
utter51.437,utter,LIP,"Hey, it's your dice, I'm just having a lucky day. Tony!"
scene52,slugline,,DR. SHIRLEY (O.S.)
desc52.438,desc,,Lip turns to see Shirley at the end of the aisle of parked cars.
utter52.439,utter,CHAUFFEUR,Boss man's callin'.
utter52.440,utter,LIP,He ain't my boss. I work for the record company.
desc52.441,desc,,"Lip scoops up his winnings, walks away to the crowd's dismay."
utter52.442,utter,BUSBOY,(calling after him) Come on! Give us a chance to win back our loot!
utter52.443,utter,LIP,"Sorry, fellas, duty calls!"
desc52.444,desc,,Lip joins Shirley at the car.
utter52.445,utter,DR. SHIRLEY,I've been looking for you.
utter52.446,utter,LIP,Sorry. The guys were having a little game.
utter52.447,utter,DR. SHIRLEY,"If you need extra money, next time, ask me."
utter52.448,utter,LIP,It's more fun winning it.
desc52.449,desc,,They reach the Cadillac. Lip opens the back door.
utter52.450,utter,DR. SHIRLEY,What if you lost?
utter52.451,utter,LIP,"(smiles) Craps and cards, I don't lose, Doc. I don't lose."
utter52.452,utter,DR. SHIRLEY,And stooping down in the gravel throwing dice for pocket change makes you a winner?
utter52.453,utter,LIP,What are you giving me shit for? Everybody was doin' it. Shirley eyeballs Lip.
utter52.454,utter,DR. SHIRLEY,They didn't have a choice whether to be inside or out. You did. This hits a nerve with Lip.
utter52.455,utter,DR. SHIRLEY (CONT'D),"Let's go. And wipe your knees, you've got dirt on them."
desc52.456,desc,,"Shirley gets in, pulls the car door shut. Lip, embarrassed, brushes the dirt off his pants."
scene53,slugline,,ESTABLISHING SHOT - MOTEL - OHIO - NIGHT INT. MOTEL ROOM - SAME
desc53.457,desc,,"Modest, dimly lit. Lip sits at a desk, pen poised. He stares down at a blank piece of paper, takes a breath, starts to write."
utter53.458,utter,LIP (V.O.),"(slow, simple) Dear Dolores... How are you? I am fine..."
scene54,slugline,,INT. LIP'S APARTMENT - DAY
desc54.459,desc,,"Nick and Frankie are eating lunch as Dolores sits, READS:"
utter54.460,utter,DOLORES,"(reading) ""I'm eating real good--hamburgers mostly--so don't worry about me not eating good. We are doing lots of driving around, and we talk a lot in the car. I saw Dr. Shirley tonight play piano. He doesn't play like a colored guy. He plays like Liberace but better and I ain't lying. He's like a genius I think. When I look at him in the rear-view mirror, I can tell he's always thinking and working stuff out in his head, I guess that's what geniuses do. But it don't look fun to be that smart. I miss you very very much, Baby. Love, Tony. P.S.-I told you I can't write letters, ha ha! Regards to your father and brother. I'm going to get a haircut tomorrow. P.S.--Kiss Nickie and Frankie both for me."""
scene55,slugline,,EXT. HIGHWAY - OHIO - DAY
desc55.461,desc,,Shirley's Cadillac drives along.
scene56,slugline,,INT. CADILLAC - DAY
desc56.462,desc,,"Lip drives. Next to him, a couple of maps, soda bottles, empty candy wrappers. Shirley sits comfortably in the back, reading glasses on the edge of his nose, reading Allan Drury's A Shade of Difference. Lip fiddles with the radio, changing stations. Stops on the song Lucille. Lip turns it up. Shirley takes notice."
utter56.463,utter,DR. SHIRLEY,Who is this? What?
utter56.464,utter,LIP DR. SHIRLEY,On the radio.
utter56.465,utter,LIP,Lil' Richard.
desc56.466,desc,,"Dr. Shirley listens, surprised."
utter56.467,utter,DR. SHIRLEY,This is Little Richard?
utter56.468,utter,LIP,"Yeah, he's good. Think you could play somethin' like this, Doc?"
utter56.469,utter,DR. SHIRLEY,(of course he could) I don't know. Sounds very complicated.
desc56.470,desc,,Shirley lowers his book.
utter56.471,utter,DR. SHIRLEY (CONT'D),"So where did this ""Tony the Lip"" moniker come from?"
utter56.472,utter,LIP,Not Tony the Lip. Tony Lip--it's one word. I got it when I was a kid. My friends said I was the best bullshit artist in the Bronx.
desc56.473,desc,,Lip smiles into the rear-view mirror.
utter56.474,utter,DR. SHIRLEY,Why are you smiling? Huh?
utter56.475,utter,LIP DR. SHIRLEY,You don't mind that your friends-the people closest to you--consider you a liar?
utter56.476,utter,LIP,"(offended) I never said liar, I said bullshit artist."
utter56.477,utter,DR. SHIRLEY,What's the difference?
utter56.478,utter,LIP,"I don't lie. I'm just good at, you know, talking people into doin' things they don't wanna do. By bullshittin' 'em."
utter56.479,utter,DR. SHIRLEY,And you're proud of that?
desc56.480,desc,,"Lip shrugs, smiles."
utter56.481,utter,LIP,Well it got me this job.
scene57,slugline,,EXT. HIGHWAY - OHIO - DAY - LATER
desc57.482,desc,,The Caddy whips by.
scene58,slugline,,INT. CADILLAC - DAY - SAME
desc58.483,desc,,"Slow Twistin' by Chubby Checker plays on the radio. Lip is looking back at Shirley, annoyed."
utter58.484,utter,LIP,You're full of shit! You never hearda Chubby Checker?
