segment-id,segment-type,segment-speaker,segment-text
utter58.485,utter,DR. SHIRLEY,"Of course I've heard of him, I just never heard his music. (MORE)"
utter58.486,utter,DR. SHIRLEY (CONT'D),But I like this. He's got a silky voice... smooth.
utter58.487,utter,LIP,This is what everyone dances to now -DR. SHIRLEY Eyes on the road please.
desc58.488,desc,,Lip flips the station. Aretha Franklin's Won't Be Long PLAYS.
utter58.489,utter,LIP,How about this? You know this song.
utter58.490,utter,DR. SHIRLEY,I don't think so...
desc58.491,desc,,Lip looks back at Dr. Shirley in disbelief.
utter58.492,utter,LIP,How could you not know this music?
desc58.493,desc,,"Chubby Checker, Lil' Richard, Sam"
desc58.494,desc,,Shirley wears a strained smile.
scene59,slugline,,EXT. GAS STATION/NOVELTY SHOP - DAY
desc59.495,desc,,"Lip and Shirley's car, followed by Oleg and George's car, pull into the gas station and parks. Lip gets out, Shirley waits in the car, window open. Oleg and George also get out of their car, stretch, smoke. Lip walks to the novelty shop, which has an outside porch area with multiple displays, knick-knacks, etc. One of the boxes is filled with an assortment of POLISHED STONES of various shapes, sizes, and colors. Lip goes to the box of stones, picks up a few, checks them out, puts them back. Oleg WATCHES AS Lip spot a large JADE-COLORED STONE on the ground. He picks it up, looks it over... Puts it in his pocket..."
scene60,slugline,,ON DR. SHIRLEY'S CAR - MOMENTS LATER
desc60.496,desc,,"Oleg speaks to Shirley through the back window. Lip exits the store, lights a smoke, heads toward Shirley's Cadillac. Oleg goes back to his car. Lip gets in, starts the car."
utter60.497,utter,DR. SHIRLEY,"Before we pull out, Tony, we need to talk. I just heard something that disturbed me a great deal. I gave you petty cash. Yeah, so?"
utter60.498,utter,LIP DR. SHIRLEY,Oleg told me what you did. What I do?
utter60.499,utter,LIP DR. SHIRLEY,You stole a jade stone from the store.
utter60.500,utter,LIP,No I didn't.
utter60.501,utter,DR. SHIRLEY,He watched you do it.
utter60.502,utter,LIP,I didn't steal no stone.
utter60.503,utter,DR. SHIRLEY,You picked it up and you put it in your pocket.
utter60.504,utter,LIP,"Yeah, I picked a rock up off the ground--I didn't steal one from the box."
utter60.505,utter,DR. SHIRLEY,Why would you pick up a rock off the ground?
utter60.506,utter,LIP,'Cause that ain't stealin'. It's just a regular rock.
utter60.507,utter,DR. SHIRLEY,(frustrated) But why would you want a regular rock?
utter60.508,utter,LIP,"(searching) I don't know, just to have. Like for good luck maybe."
utter60.509,utter,DR. SHIRLEY,A lucky rock? Let me see it.
desc60.510,desc,,"Reluctantly, Lip pulls out the JADE STONE."
utter60.511,utter,DR. SHIRLEY (CONT'D),I want you to go back and pay for it.
desc60.512,desc,,"Lip is embarrassed, angry."
utter60.513,utter,LIP,I told you that Kraut was a sneak. Rats me out for something I didn't even do.
utter60.514,utter,DR. SHIRLEY,"Pay for the stone, Tony, you'll feel better."
utter60.515,utter,LIP,"I feel fine, and I'm not paying for no regular rock I found in the dirt."
desc60.516,desc,,Lip PUTS THE CAR IN DRIVE.
utter60.517,utter,DR. SHIRLEY,"Do not drive, Mr. Vallelonga."
desc60.518,desc,,"Lip stops, puts it in park. They sit in silence. Finally... Lip gets out, SLAMS the door, storms off. Shirley waits. A few moments later, Lip gets back in the car, throws it into drive."
utter60.519,utter,DR. SHIRLEY (CONT'D),Feel better? No.
utter60.520,utter,LIP DR. SHIRLEY,"Tony, if you'd like, I will happily buy you that stone."
utter60.521,utter,LIP,Don't bother. You took all the fun out of it.
desc60.522,desc,,"As Shirley's Cadillac pulls back onto the highway, we go..."
scene61,slugline,,ESTABLISHING SHOT - COLLEGE CAMPUS - INDIANA - DAY
desc61.523,desc,,Shirley's Cadillac pull in front. Lip gets out.
scene62,slugline,,INT. INDIANA COLLEGE CAMPUS - CONCERT HALL - AFTERNOON
desc62.524,desc,,"The place is empty except for Oleg and George setting up their instruments on stage. As Lip ENTERS, OLEG starts to PLAY A SONG on the Cello. Lip goes to a BROKEN DOWN PIANO on the stage. He looks it over. This can't be right. He opens the top, inside... GARBAGE... CRUMBLED PAPERS, A COKE BOTTLE, DIRTY NAPKINS... Lip sees the STAGE MANAGER off to the side of the stage."
utter62.525,utter,LIP,Excuse me... I'm with the band.
utter62.526,utter,STAGE MANAGER,You're all set up.
utter62.527,utter,LIP,"This ain't the piano, right?"
desc62.528,desc,,"The STAGE MANAGER approaches. This guy's big, Duke Wayne with a hammer holster."
desc62.529,desc,,STAGE MANAGER
utter62.530,utter,LIP,This isn't a Steinway...? So what?
scene63,slugline,,STAGE MANAGER
utter63.531,utter,LIP,Dr. Shirley only plays on Steinway-brand pianos. It's in his written contract. STAGE MANAGER Who's Dr. Shirley?
utter63.532,utter,LIP,Dr. Shirley--the Don Shirley Trio? Does it really matter?
utter63.533,utter,LIP,"Yes, it does. It's in his contract."
desc63.534,desc,,The Stage Manager rolls his eyes.
utter63.535,utter,STAGE MANAGER,"Come on, what's the difference -these coons can play on anything."
desc63.536,desc,,CLOSE ON OLEG AND GEORGE as they stop what they're doing and take notice. BACK ON Lip as he looks closely at the filthy piano.
utter63.537,utter,LIP,But there's garbage in this thing.
utter63.538,utter,STAGE MANAGER,"So, take it out."
desc63.539,desc,,Lip stiffens.
utter63.540,utter,LIP,What'd you say?
utter63.541,utter,STAGE MANAGER,You heard me.
utter63.542,utter,LIP,Get a clean Steinway in here. There's no Steinway on campus.
utter63.543,utter,LIP,Not my problem.
utter63.544,utter,STAGE MANAGER,I bet there ain't two Steinways in the whole state of Indiana.
utter63.545,utter,LIP,Then you better move your ass and start lookin'.
desc63.546,desc,,Oleg and George exchange a glance. The Stage Manager puffs up.
utter63.547,utter,STAGE MANAGER,"Who you think you're talking to, greaseball?"
desc63.548,desc,,"Without warning, Lip LASHES OUT with a BRUTAL OPEN-HAND SLAP to the Stage Manager's ear. The Stage Manager STAGGERS BACK AND SIDEWAYS. He stares at Lip, dazed."
scene64,slugline,,INT. INDIANA COLLEGE CAMPUS - CONCERT HALL - NIGHT
desc64.549,desc,,"Dr. Shirley's fingers tinkle the ivories on a Steinway, performing ""HAPPY TALK"" to a sold-out house. CLOSE ON THE WING OF THE STAGE where Lip is listening to the music, satisfied. The Stage Manager stands a few feet back from him, looking sheepish and a little scared. QUICK MONTAGE AS ""HAPPY TALK"" CONTINUES... -- LIP SITS IN A DINER WRITING A LETTER. SHIRLEY IS ACROSS FROM HIM, READING A NEWSPAPER."
utter64.550,utter,LIP (V.O.),"""Dear Dolores... This morning I had steak and eggs. For breakfast."""
desc64.551,desc,,-- DOLORES READING THE LETTER AND SMILING.
utter64.552,utter,LIP (V.O.),"""The band has been playing at very ritzy joints. Dr. Shirley and I are getting along pretty good, but"
desc64.553,desc,,"sometimes I think he gets depressed and drinks too much."" -- CLOSE ON DR. SHIRLEY PLAYING AT A HIGH-SOCIETY PARTY..."
utter64.554,utter,LIP (V.O.),"""I never knew how very beautiful this country was. Now that I'm seeing it I know. You wouldn't believe how beautiful nature is--it is as beautiful as they say. I wish I had a camera and took some pictures, they would be collector's items, I wish I knew how to"
desc64.555,desc,,"describe it to you."" -- DR. SHIRLEY'S CAR DRIVING ON VARIOUS HIGHWAYS, WITH AMAZING VIEWS OF THE COUNTRYSIDE... SIGNS FOR NEENAH, WISCONSIN... MUSCATINE, IOWA... INDIANAPOLIS... ST. LOUIS..."
utter64.556,utter,LIP (V.O.),"""And the traffic out here in the country is nothing, which is fine by me."""
desc64.557,desc,,-- BACK IN THE DINER WHERE LIP IS WRITING THE LETTER.
utter64.558,utter,LIP (V.O.),"""Right now I'm eating spaghetti and meatballs in a diner that tastes like ketchup on Chinese noodles. I miss your cooking..."""
desc64.559,desc,,"-- SHIRLEY LOWERS HIS NEWSPAPER, GLANCES AT LIP'S CHICKENSCRATCH PENMANSHIP, SHAKES HIS HEAD. -- SHIRLEY TRIO PERFORMING FOR SEVERAL HUNDRED PEOPLE..."
utter64.560,utter,LIP,"""We are heading down south now... I will write you another letter when we get down south. I love you... Your husband Tony... P.S.--Kiss the kids for me..."""
desc64.561,desc,,"-- DOLORES SITS ALONE IN BED, FINISHES READING THE LETTER. ""HAPPY TALK"" ends."
scene65,slugline,,EXT. KENTUCKY HIGHWAY - DAY
desc65.562,desc,,"Shirley's car motors past a ""WELCOME TO KENTUCKY"" sign."
scene66,slugline,,INT. CADILLAC - DAY
desc66.563,desc,,"On the radio, ""WHOLE LOTTA SHAKIN' GOING ON,"" Jerry Lee Lewis attacking the piano."
utter66.564,utter,LIP,"Got any family, Doc?"
utter66.565,utter,DR. SHIRLEY,Not really.
utter66.566,utter,LIP,Not really? Either you do or you don't.
utter66.567,utter,DR. SHIRLEY,"It's a long story, Tony."
utter66.568,utter,LIP,"What, we're in a rush now?"
desc66.569,desc,,"Shirley takes a BEAT, reluctantly opens up."
utter66.570,utter,DR. SHIRLEY,"I have a brother somewhere. We used to get together once in a while...but it got more and more difficult to keep in touch. That's the curse of being a musician-you're always on the road, like a carnival worker, or a criminal. (beat) It took a toll on my marriage as well."
desc66.571,desc,,Lip glances in the rear-view mirror.
utter66.572,utter,LIP,You're married? Was.
scene67,slugline,,DR. SHIRLEY
desc67.573,desc,,They drive for a moment.
utter67.574,utter,DR. SHIRLEY (CONT'D),"June was a good person--terrible grammar, but a kind soul. Unfortunately, I didn't have the constitution to do a husband act as well as a concert pianist act. I couldn't balance both worlds."
scene68,slugline,,EXT. ROAD - KENTUCKY FRIED CHICKEN - DAY - LATER
desc68.575,desc,,"ANGLE ON Kentucky Fried Chicken sign, then we...PAN to the Caddy approaching."
scene69,slugline,,INT. CADDY - CONTINUOUS
desc69.576,desc,,"Lip sits up, excited."
utter69.577,utter,LIP,Kentucky Fried Chicken... in Kentucky! When's that ever gonna happen?!
scene70,slugline,,EXT. KENTUCKY FRIED CHICKEN - DAY - CONTINUOUS
desc70.578,desc,,The Cadillac pulls into the parking lot.
scene71,slugline,,INT. CADILLAC - DAY - CONTINUOUS
desc71.579,desc,,Lip looks over the seat-back.
utter71.580,utter,LIP,What do you want?
utter71.581,utter,DR. SHIRLEY,I'm fine. Thank you.
scene72,slugline,,"INT. CADILLAC - DAY They're back on the road, a bucket of Kentucky Fried Chicken"
desc72.582,desc,,in the front seat next to Lip. He wolfs down a chicken leg as he drives.
utter72.583,utter,LIP,"This might be the best Kentucky Fried Chicken I ever had. But I guess it's fresher down here, right?"
desc72.584,desc,,Dr. Shirley shrugs.
utter72.585,utter,DR. SHIRLEY,I don't think I've ever met anyone with your appetite.
utter72.586,utter,LIP,"No, I bought the bucket so you could have some."
utter72.587,utter,DR. SHIRLEY,I've never had fried chicken in my life.
utter72.588,utter,LIP,"Who you bullshittin'? You people love the fried chicken, the grits, the colored greens...I love it, too. The negro cooks used to make it when I was in the army."
utter72.589,utter,DR. SHIRLEY,"You have a very narrow assessment of me, Tony."
utter72.590,utter,LIP,"(pleased) Yeah, I'm good, right?"
utter72.591,utter,DR. SHIRLEY,"What? No. No, you're not good, you're bad. I'm saying, just because other negro people listen to a certain kind of music doesn't mean I have to. Nor do we all have to eat the same food."
desc72.592,desc,,Lip looks at Shirley in the mirror.
utter72.593,utter,LIP (CONT'D,"Whoa, wait a minute. If you said all guineas like pizza and spaghetti and meatballs, I'm not gonna get insulted."
utter72.594,utter,DR. SHIRLEY,"You're missing the point. For you to make the assumption that-LIP Doc, you want some or not?"
desc72.595,desc,,Lip holds up the bucket.
scene73,slugline,,DR. SHIRLEY
desc73.596,desc,,"Lip takes another big, juicy bite."
utter73.597,utter,LIP,Tell me that don't smell good?
utter73.598,utter,DR. SHIRLEY,"It smells okay, but I don't want to get grease on my blanket."
utter73.599,utter,LIP,"Oooh, I'm gonna get grease on my blankie--have a piece. It ain't gonna kill ya."
desc73.600,desc,,"Lip takes a piece of chicken, holds it out to Shirley."
utter73.601,utter,LIP (CONT'D),Just grab it and eat it! No.
desc73.602,desc,,DR. SHIRLEY
utter73.603,utter,LIP,I'm gonna throw it in the back seat.
utter73.604,utter,DR. SHIRLEY,Don't you dare!
utter73.605,utter,LIP,Then you better take it.
utter73.606,utter,DR. SHIRLEY,How? Do you even have utensils? Plates?
utter73.607,utter,LIP,"Bah fongool! Eat it with your hands, that's how you're supposed to."
utter73.608,utter,DR. SHIRLEY,I can't do that.
utter73.609,utter,LIP,I swear I'm gonna throw it!
desc73.610,desc,,Shirley reluctantly takes the chicken.
utter73.611,utter,DR. SHIRLEY,I... I really can't do this.
utter73.612,utter,LIP,Eat the goddamn thing.
desc73.613,desc,,Shirley takes a bite. Lip can see he's enjoying it.
utter73.614,utter,LIP (CONT'D),"What, no good? Very good."
utter73.615,utter,DR. SHIRLEY,I just... this seems so... so unsanitary.
utter73.616,utter,LIP,"'Gives a shit?! Relax and enjoy it. My father always says, whatever you do, do it hundred percent. When you work, work, when you laugh, laugh, when you eat, eat like it's your last meal. Shirley is clearly enjoying the chicken."
utter73.617,utter,LIP (CONT'D),Want another piece? Have a leg!
desc73.618,desc,,Lip hands Shirley a leg.
utter73.619,utter,DR. SHIRLEY,What do we do about the bones?
utter73.620,utter,LIP,We do this.
desc73.621,desc,,"Lip throws his bones out the window. After a BEAT, Shirley rolls down his window and does the same. They smile at one another for the first time. Then Lip finishes his Coke and TOSSES THE CUP OUT THE WINDOW. As Shirley loses his smile, we:"
scene74,slugline,,SAME SCENE - MOMENTS LATER
desc74.622,desc,,"The Caddy is backing up in the breakdown lane. It stops next to the DISCARDED CUP, Lip's door opens, he picks it up, and they drive on."
scene75,slugline,,EXT. DOWNTOWN LOUISVILLE MOTEL - EARLY EVENING
desc75.623,desc,,"The Caddy pulls up in front of a RUN-DOWN MOTEL with a ""FOR COLORED ONLY"" sign. Low-end, one-level on the edge of downtown. Nothing like the upscale hotels they've been staying in. Lip behind the wheel, READING THE GREEN BOOK; Shirley in the backseat."
utter75.624,utter,LIP,This can't be it. Says right here... (points to Green Book) ...cozy as your own home... This place looks like my ass.
utter75.625,utter,DR. SHIRLEY,This is the place.
desc75.626,desc,,The guys get out of the car. Lip takes Shirley's bag out of the trunk.
utter75.627,utter,LIP,"If you need anything, I'll be up the street at the Easton Inn. So...see you tomorrow."
desc75.628,desc,,"Dr. Shirley takes his bag, walks up the rickety front steps."
scene76,slugline,,EXT. DOWNTOWN LOUISVILLE MOTEL - EVENING - LATER
desc76.629,desc,,"MUSIC from a transistor radio. BLACK FAMILIES sit at tables outside the motel. Shirley, smartly dressed in a DINNER JACKET, sits away from everyone on the ramshackle porch nursing a glass of CUTTY"
desc76.630,desc,,"SHIRLEY'S POV - The families are eating, drinking, enjoying the night. CHILDREN run around, playing games, having fun. THREE MEN are setting up a game of HORSESHOES in the yard. One of the MEN calls to Shirley."
utter76.631,utter,MAN #1,"Hey, fancy-pants, you wanna play?"
utter76.632,utter,DR. SHIRLEY,"Um... no, thank you."
utter76.633,utter,MAN #2,"Come on, we short a man!"
desc76.634,desc,,"Shirley shifts in his chair, uncomfortable."
utter76.635,utter,DR. SHIRLEY,I... I'd rather not.
utter76.636,utter,MAN #1,"What, you too high and mighty?"
desc76.637,desc,,He's just afraid of getting that butler uniform all dusty! The men LAUGH.
utter76.638,utter,DR. SHIRLEY,I'm just... I'm on my way out to meet a friend.
desc76.639,desc,,"Shirley drains his scotch, stands, and WALKS INTO THE NIGHT."
scene77,slugline,,INT. LIP'S HOTEL ROOM - NIGHT
desc77.640,desc,,"CLOSE ON BEDSIDE TABLE where we see a wallet, a pack of smokes, and, surprisingly, the JADE ROCK that we thought Lip had returned. PULL BACK to reveal Lip, in boxers, sitting up in bed, flipping through the GREEN BOOK. He puts the book aside a moment, opens a pizza box on the bed beside him. He takes out the ENTIRE UNCUT PIZZA, FOLDS IT IN HALF AND TAKES A BITE. He goes back to the book. CLOSE ON the cover - Up top it says Negro Motorist Green Book. Down below reads: ""For vacation without aggravation."""
utter77.641,utter,LIP,(reading to himself) Vacation without aggravation... vaffangool.
desc77.642,desc,,"He flips through the book. CLOSE ON A PAGE - It reads: ""Assured Protection for the Negro Traveler."" Below it there's an ad for ""Gerald's Restaurant in Buffalo, New York Delightful Dinners for Particular People -- open 24 hours."" Lip turns to another page. CLOSE ON PAGE - A photo of Mrs. Ressie Harris, the owner of Quinn's Hotel - ""The most fabulous hotel for colored."" There's an URGENT KNOCK ON THE DOOR."
utter77.643,utter,GEORGE (O.S.),"Tony, it's George! Wake up! up!"
scene78,slugline,,Hurry
desc78.644,desc,,"Lip gets up, opens the door. It's George, sweating and out of breath."
utter78.645,utter,GEORGE (CONT'D),Dr. Shirley's in trouble.
scene79,slugline,,EXT. STREET - NIGHT
desc79.646,desc,,George and Lip hustle down the street.
utter79.647,utter,GEORGE,"(panicked) I went out for a drink, I walk into this bar, and there's Shirley getting bounced around! I didn't want to leave him, but I didn't know what to do!"
scene80,slugline,,INT. DIVE BAR - NIGHT
desc80.648,desc,,"A shit-hole. Drunken REDNECKS surround an EVEN DRUNKER Shirley. LAUGHING as they shove him, smack him around."
utter80.649,utter,LIP (O.S.),Get your hands off him!
desc80.650,desc,,The Rednecks stop their fun. Bar goes quiet. They turn toward Lip and George.
utter80.651,utter,REDNECK #1,"What the good goddamn we got here, fellas?"
utter80.652,utter,LIP,"Hand him over, we walk out, won't be a problem."
utter80.653,utter,REDNECK #1,"Already is a problem, Mister."
utter80.654,utter,DR. SHIRLEY,"(slurring) I just came in for a drink. REDNECK #1 You come in here for a drink? Then you must be tired of livin', boy."
utter80.655,utter,LIP,"I told you, hand him over, we'll leave."
desc80.656,desc,,Redneck #2 roughly rubs Dr. Shirly's head.
utter80.657,utter,REDNECK #2,"He ain't going nowhere, we need this brillo pad to wash them dishes with..."
utter80.658,utter,LIP,"Hey, do yourself a favor and let him go. Now."
utter80.659,utter,TENSE BEAT. REDNECK #1,Say it nice.
utter80.660,utter,LIP,I just said it nice.
desc80.661,desc,,"The Bumpkins spread out, advance a step. REDNECK #1 pulls out"
utter80.662,utter,a BUCK KNIFE. REDNECK #1,"This boy's gonna get what's coming to him, and you ain't got no say!"
desc80.663,desc,,"Lip calmly reaches behind his back, under his suit jacket."
utter80.664,utter,LIP,"Maybe. But, whatever happens, I'm gonna put a bullet right in the middle of that thick skull of yours. BEAT."
utter80.665,utter,REDNECK #2,"He ain't got no gun, Ray. Let's get him. He's fulla shit."
utter80.666,utter,REDNECK #3,What if he ain't?
desc80.667,desc,,Redneck #1 tries to read Lip's face... impossible. Lip can stare down an army.
utter80.668,utter,MAN'S VOICE (O.S.),"Well, I sure ain't."
desc80.669,desc,,"ANGLE ON - THE BARKEEP, 60s, holding a shotgun, pointing it directly at Lip and George."
utter80.670,utter,BARKEEP,And I won't be having none of this come to pass in my place. Let the spook go. I want these Yanks off my property.
desc80.671,desc,,"After a BEAT, the Rednecks reluctantly open a path for Shirley. Shirley staggers toward Lip and collapses against him. Lip motions for George to exit, then Lip throws Shirley over his shoulder and backs out the door, his eyes peeled for trouble."
scene81,slugline,,EXT. DOWNTOWN LOUISVILLE MOTEL - NIGHT - LATER
desc81.672,desc,,An irate Lip walks an inebriated Shirley throught the parking lot of the motel.
utter81.673,utter,LIP,What the hell's wrong with you?! You go in there alone?
desc81.674,desc,,An unsteady Shirley leans against a car.
utter81.675,utter,DR. SHIRLEY,"(still slurry) I apologize for putting you in that position, Tony."
utter81.676,utter,LIP,"I don't understand you, Doc, honest to God. Why couldn't you just drink here--you got a whole bottle?"
utter81.677,utter,DR. SHIRLEY,I needed some air.
utter81.678,utter,LIP,Air?! Don't you know where you are?
desc81.679,desc,,Shirley looks at him oddly.
utter81.680,utter,DR. SHIRLEY,Does the geography really matter? What?
utter81.681,utter,LIP DR. SHIRLEY,"If I walked into a bar in your neighborhood, would this conversation be any different?"
desc81.682,desc,,Lip dodges the question.
utter81.683,utter,LIP,From now on you don't go nowhere without me. Nowhere!
utter81.684,utter,DR. SHIRLEY,Tony...Do you really have a gun?
utter81.685,utter,LIP,'Course not. Now get some rest. You got a big show tomorrow night. Now
scene82,slugline,,where's your room doc?
desc82.686,desc,,"Shirley points, Lip helps Doc to his room."
scene83,slugline,,INT. LOUISVILLE CONCERT HALL - NIGHT
desc83.687,desc,,"Lip stands off to the side as an ALL-WHITE AUDIENCE watches the Don Shirley Trio give a magnificent performance of their hit, ""LULLABY OF BIRDLAND."" When they finish, the crowd ERUPTS in a STANDING OVATION."
utter83.688,utter,DR. SHIRLEY,"Thank you, Louisville, for your warm hospitality!"
scene84,slugline,,EXT. COUNTRY ROAD - NORTH CAROLINA - DAY
desc84.689,desc,,"Shirley's Cadillac passes a BILLBOARD that reads: ""WELCOME TO RALEIGH - HOME OF THE N.C. STATE UNIVERSITY WOLFPACK""."
scene85,slugline,,INT. CADILLAC - NORTH CAROLINA - DAY
desc85.690,desc,,Lip and Shirley drive along looking through bug-smeared windows. Miles and miles of SWEET POTATO fields.
utter85.691,utter,LIP,"(struggling; slow) ""Betty bought... a bit of buttah... but she found the buttah bittah..."""
utter85.692,utter,DR. SHIRLEY,"Not buttah... butter. Say the ""er."" Er."
utter85.693,utter,LIP DR. SHIRLEY,"""So Betty bought a bit of better butter to make the bitter butter better..."""
utter85.694,utter,LIP,"""So Betty bit a buttah..."""
utter85.695,utter,DR. SHIRLEY,"Don't be lazy--enunciate. ""So Betty bought a bit of better butter..."""
utter85.696,utter,LIP,"""So, Betty bit a better buttah--"" this is bullshit."
utter85.697,utter,DR. SHIRLEY,"No, you need to start somewhere."
desc85.698,desc,,"Athletes stretch to warm up before an event. A singer does vocal exercises. These drills will strengthen your speech muscles. WE HEAR A NASTY ""PING"" FROM THE ENGINE O.S. STEAM rises from under the hood, splashes against the windshield."
scene86,slugline,,EXT. COUNTRY ROAD - NORTH CAROLINA - DAY
desc86.699,desc,,"The Caddy pulls over and Lip steps out into the blazing sun. Heat waves ripple off the scalding asphalt. Lip removes his jacket, tosses it onto the front seat. He rolls up his sleeves, lifts the heavy Cadillac hood. Shirley rolls down the back window, observes dozens of BLACK WORKERS laboring in the sun. Men, women, children, bent to the waist, filling woven baskets with sweet potatoes. Shirley steps out of the Cadillac, walks to the front of the car where Lip is thigh-deep under the hood. While Shirley leans on the fender, Lip walks to the trunk, pulls out a jug of water and a rag. He goes back to the engine, opens the hot radiator cap, pours the water in. Dr. Shirley wipes the sweat beads off his forehead with his suit-pocket handkerchief, looks out onto the fields. One by one the Pickers STAND UP and STARE BACK AT HIM from BOTH sides of the road. They've never seen a black man like him before. Lip crawls out from under the hood, wipes his hands with a cloth. He notices the Pickers staring at Shirley. Lip SLAMS the hood, gets in the car. Shirley takes a reflective BEAT... follows."
scene87,slugline,,ESTABLISHING SHOT - NORTH CAROLINA PLANTATION - LATE DAY
desc87.700,desc,,"CLOSE ON a stuffed-shirt, MORGAN ANDERSON, 50s, standing on the veranda."
utter87.701,utter,MORGAN ANDERSON,"Ladies and gentlemen, our very special guest from the far north... Don Shirley!"
desc87.702,desc,,"APPLAUSE. PULL BACK TO REVEAL an elite Southern crowd surrounding him. CLASSICAL MUSIC drifts from the stereo inside. BLACK WAITERS carry trays filled with champagne and hors d'oeuvres. ANGLE ON a wide-eyed Lip standing with Shirley, Oleg, and George."
utter87.703,utter,MORGAN ANDERSON (CONT'D),"Accompanying Mr. Shirley, the members of his trio... (reading a small program) Oleg Malakhov, George Dyer, and his associate, Tony Vallla... Valleg...Valle..."
desc87.704,desc,,"Shirley, embarrassed, shoots Lip a vague I-told-you-so look. Lip shrugs, he's not helping."
utter87.705,utter,MORGAN ANDERSON (CONT'D),Valley...lohnja.
desc87.706,desc,,"Lip smirks as the PARTYGOERS CLAP. Afterwards, Anderson turns back to Oleg and George."
utter87.707,utter,MORGAN ANDERSON (CONT'D),"Gentlemen, if you don't mind, I'm going to steal Donnie away for some introductions."
desc87.708,desc,,"As Anderson walks Shirley into the house, Oleg and George grab glasses of sugared bourbon and mingle. Lip looks around, takes it all in. A WAITER approaches with a tray."
desc87.709,desc,,What's this?
utter87.710,utter,WAITER,"Pimiento-cheese sandwich, sir."
desc87.711,desc,,"Lip takes one off the tray, tries it."
scene88,slugline,,LIP
desc88.712,desc,,"Lip SPITS INTO A NAPKIN, plops the BALLED-UP NAPKIN ON THE TRAY."
scene89,slugline,,INT. PLANTATION - DINING ROOM - NIGHT - LATER
desc89.713,desc,,"Guests sit around an immense dining table. Lip sits between the Well-Coiffed Woman and an Elderly Woman. Dr. Shirley sits in the seat of honor to the right of Mr. Anderson, at the head of the table. White-gloved BLACK WAITERS place sterling-silver-covered platters down the length of the table."
utter89.714,utter,MORGAN ANDERSON,"Earlier this week, we asked our help what Mr. Shirley might like for supper. So the boys in the kitchen whipped up a special menu in honor of our guest."
