segment-id,segment-type,segment-speaker,segment-text
utter124.957,utter,LIP,He's my boss. The Patrolmen look at one another.
utter124.958,utter,PATROLMAN #1,He can't be out here at night. This is a sundown town.
utter124.959,utter,LIP,What's that mean?
utter124.960,utter,PATROLMAN #1,(to Patrolman #2) Get him out of the car. Check his I.D.
utter124.961,utter,LIP,"Come on, it's pouring."
desc124.962,desc,,The young Patrolman looks to his senior partner.
utter124.963,utter,PATROLMAN #2,I can just get it through the window.
utter124.964,utter,PATROLMAN #1,Get him out the goddamn car!
desc124.965,desc,,Patrolman #2 opens Shirley's door.
scene125,slugline,,PATROLMAN #2
desc125.966,desc,,Shirley gets out in the rain. Patrolman #1 studies Lip's license. What's this last name say?
utter125.967,utter,Vallelonga.,PATROLMAN #1 'Hell kind of name is that? Italian.
utter125.968,utter,LIP PATROLMAN #1,"Oh, now I get it. That's why you driving this boy around... you half a nigger yourself."
desc125.969,desc,,"LIP SLAMS PATROLMAN #1 WITH AN UPPERCUT, DROPPING HIM LIKE A"
desc125.970,desc,,PATROLMAN #2 PULLS HIS REVOLVER ON LIP.
utter125.971,utter,POLICEMAN #2,"(shaking) Hands in the air, now!"
scene126,slugline,,"INT. MAYERSVILLE, MISSISSIPPI POLICE STATION - NIGHT"
desc126.972,desc,,"Lip sits on a concrete slab in a small cell. Shirley peers through the bars out at Patrolmen #1, #2, and the grizzled POLICE CHIEF, 50s."
utter126.973,utter,DR. SHIRLEY,"Excuse me! (no response) Excuse me, sirs. I quite understand why my associate is being held, but what exactly am I being charged with? Not a glance in his direction."
utter126.974,utter,DR. SHIRLEY (CONT'D),You seem like reasonable men--can you let me out so we might discuss the situation please?
utter126.975,utter,PATROLMAN #1,"Put the apple butter away, boy--you ain't goin' nowhere no time soon."
desc126.976,desc,,Dr. Shirley's demeanor hardens.
utter126.977,utter,DR. SHIRLEY,You cannot hold me without cause!
utter126.978,utter,PATROLMAN #1,I got cause. 'Cause you let the sun set on your black ass!
desc126.979,desc,,The Chief LAUGHS.
utter126.980,utter,DR. SHIRLEY,"I want to speak to a lawyer, I want my phone call! This is a flagrant violation of my rights! I demand my phone call immediately!"
desc126.981,desc,,"The younger officer looks to the Chief, uncomfortable."
desc126.982,desc,,"He does have...rights. The Chief glares at him. Finally, the Chief looks at Patrolman #1."
utter126.983,utter,POLICE CHIEF,Give the negra his goddamn call.
desc126.984,desc,,"Reluctantly, Patrolman #1 goes to the cell, unlocks it, walks Shirley to a side office. The cop picks up the phone, holds it out to Shirley."
utter126.985,utter,PATROLMAN #1,You know a lawyer? Call him.
desc126.986,desc,,"As the cop steps away, Shirley pulls a SMALL BLACK BOOK out of his jacket pocket, flips to a page, DIALS..."
scene127,slugline,,INT. JAIL CELL - NIGHT - LATER
desc127.987,desc,,"Lip sits on the floor, stone-faced. Shirley paces the room, increasingly annoyed."
utter127.988,utter,DR. SHIRLEY,"As my mother always said, ""What kind of brand new fool are you?!"" Lip doesn't respond."
utter127.989,utter,DR. SHIRLEY (CONT'D),"Look out there, Tony. Take a good look at the officer you hit. Lip doesn't move."
utter127.990,utter,DR. SHIRLEY (CONT'D),Look at him.
desc127.991,desc,,"Lip raises his eyes. HIS POV - Patrolman #1 is sitting in the bullpen, drinking coffee, horsing around with the other cops."
utter127.992,utter,DR. SHIRLEY (CONT'D),"He's having a grand old time, chatting up his pals, having a nice cup of coffee. And where are you? In here. With me. Who did nothing. Yet I'm the one who's paying the price. I'm the one who's going to miss the Birmingham show."
utter127.993,utter,LIP,"Hey, I'm losin' a lot of money, too, if you don't play Birmingham."
desc127.994,desc,,Shirley steps in front of Lip.
utter127.995,utter,DR. SHIRLEY,"So your little temper tantrum...was it worth it? (beat) You don't win with violence, Tony, you win when you maintain your dignity. Dignity always prevails. And tonight, because of you, we did not."
desc127.996,desc,,The station PHONE RINGS and Patrolman #2 answers.
desc127.997,desc,,"The young cop STRAIGHTENS UP, color draining from his face."
desc127.998,desc,,"The rookie is too stunned to speak. Finally, the Chief grabs the phone."
utter127.999,utter,POLICE CHIEF (CONT'D),Chief Pratt--who's this? (beat) Bull-oney.
desc127.1000,desc,,"Patrolman #2 waves frantically and the Chief starts to sweat. He stands, starts to pace."
utter127.1001,utter,POLICE CHIEF (CONT'D),"Okay, yes, now I hear it, Governor. I'm sorry. Yes, of course I recognize your voice. (shrinking) I-I'm sorry, you sayin' the boy we got locked up called who, sir? (beat) And he called you?"
desc127.1002,desc,,The rattled Chief glances at Shirley and Lip--who the hell are these guys? We HEAR the O.S. Governor SCREAMING AT HIM over the phone.
utter127.1003,utter,POLICE CHIEF (CONT'D),"But an officer was assaulted in the line of... (backing down) No, no, I don't want no National Guard down here, neither, sir. (wilting) Yes, Governor, immediately. And good night to you and the missus."
desc127.1004,desc,,"The Chief hangs up, turns to Patrolman #1."
utter127.1005,utter,POLICE CHIEF (CONT'D),Let 'em go. What?!
utter127.1006,utter,POLICE CHIEF,"Cut 'em loose, goddamnit!"
desc127.1007,desc,,ANGLE ON SHIRLEY and a STUNNED LIP watching all this.
utter127.1008,utter,PATROLMAN #1 (O.S.),But that dago-wop hit me! Now!
scene128,slugline,,POLICE CHIEF (O.S.)
desc128.1009,desc,,"BACK ON COPS - Defeated, Patrolman #1 hurries over to the cell, opens it up. Lip turns to Shirley, amazed."
desc128.1010,desc,,Who the hell'd you call?
scene129,slugline,,EXT. HIGHWAY - RAINY NIGHT
desc129.1011,desc,,"The Cadillac FLIES PAST a sign reading: ""WHITES ONLY WITHIN"
scene130,slugline,,"CITY LIMITS AFTER DARK."" INT. CADILLAC - NIGHT - SAME"
desc130.1012,desc,,"Lip wears a mad, shit-eating grin as he drives through the SLASHING RAIN on the way out of town."
utter130.1013,utter,LIP,Bobby Kennedy just saved our asses! Maddon...How great is that?!
utter130.1014,utter,DR. SHIRLEY,It's not great--it's not great at all--it's humiliating.
desc130.1015,desc,,Lip glances in the rear-view.
utter130.1016,utter,LIP,'The hell you talking about? We were screwed and now we ain't.
utter130.1017,utter,DR. SHIRLEY,And I just put the Attorney General of the United States in an incredibly awkward position.
utter130.1018,utter,LIP,So what? That's what the guy gets paid for. What else he got to do?
desc130.1019,desc,,Shirley glares at Lip.
utter130.1020,utter,DR. SHIRLEY,"That man and his brother are trying to change this country--that's what else he's got to do! Now he thinks I'm garbage. Calling from some backwoods swamp jail, asking if he can help attenuate assault charges... who does that? Garbage, that's who. This stings Lip."
utter130.1021,utter,DR. SHIRLEY (CONT'D),You shouldn't have hit him!
utter130.1022,utter,LIP,"I didn't like the way he was treating you, making you stand out in the rain."
utter130.1023,utter,DR. SHIRLEY,"Please. You hit him because of what he called you. I've had to listen to that kind of talk my entire life, you should be able to take it for one night."
utter130.1024,utter,LIP,"What, I can't get mad when he says that stuff 'cause I'm not black? Christ, I'm blacker than you."
desc130.1025,desc,,Shirley REACTS to this.
utter130.1026,utter,DR. SHIRLEY,You're blacker than me?
utter130.1027,utter,LIP,"You don't know shit about your own people! What they eat, how they talk, how they live--you don't even know who Lil' Richard is!"
utter130.1028,utter,DR. SHIRLEY,"So knowing who Little Richard is makes you blacker than me? I wish you could hear yourself sometimes, Tony--you wouldn't talk as much."
utter130.1029,utter,LIP,"Bullshit! I know exactly who I am. I'm the guy who's lived on the same block in the same Bronx my entire life, with my mother and father and my brother, and now my wife and kids. That's it--that's who I am. I'm the asshole who's gotta hustle every goddamn day to put food on my table. You? Mr. Big Shot? You travel around the world and live on top of a castle and do concerts for rich people! I live on the streets, you sit on a throne--so yeah, my world is way more blacker than yours! Pull over. What?"
utter130.1030,utter,DR. SHIRLEY DR. SHIRLEY,Pull! Over!
utter130.1031,utter,LIP,I ain't pullin' over! DR. SHIRLEY STOP THE CAR!
scene131,slugline,,EXT. COUNTRY ROAD - NIGHT - CONTINUOUS
desc131.1032,desc,,"Lip steers the car to the side of the road. Shirley opens the door, gets out in the rain. Lip looks out the window as Dr. Shirley walks down the drenched, muddy road."
utter131.1033,utter,LIP,What are you doin'?!
desc131.1034,desc,,"When Shirley doesn't stop, Lip gets out, hustles after him."
utter131.1035,utter,LIP (CONT'D),Get back in the car!
desc131.1036,desc,,"Shirley keeps walking. Lip catches up, grabs his arm. Shirley turns, his face drenched..."
utter131.1037,utter,DR. SHIRLEY,"Yes, I live in a castle! Alone. And rich white folks let me play piano for them, because it makes them feel cultured. But when I walk off that stage I go right back to being another nigger to them--because that is their true culture. And I suffer that slight alone, because I'm not accepted by my own people, because I'm not like them either! So if I'm not black enough, and I'm not white enough, and I'm not man enough, what am I?!"
desc131.1038,desc,,"Tony doesn't know what to say. They stand in the rain while Shirley tries to compose himself. Lip awkwardly touches Shirley's shoulder. Shirley turns and walks back to the car, leaving Tony standing alone in the downpour."
scene132,slugline,,INT. CADILLAC - NIGHT - LATER
desc132.1039,desc,,"Back on the road, both of them disheveled and wiped out from the evening. Nobody speaks for a while."
utter132.1040,utter,DR. SHIRLEY,I need sleep.
utter132.1041,utter,LIP,"Okay, I'll pull over at the next place we see and I'll sneak you into my room."
utter132.1042,utter,DR. SHIRLEY,No. No. I refuse to stay at an establishment that doesn't want me.
desc132.1043,desc,,Lip picks up the Negro Moterist Green book from the seat next to him.
scene133,slugline,,EXT. ALABAMA - GREEN BOOK MOTEL - NIGHT
desc133.1044,desc,,CLOSE ON A COLOREDS ONLY sign out front of a ramshackle brick building. PAN TO the Caddy pulling into the DIRT PARKING LOT full of puddles and BEAT-UP CARS.
scene134,slugline,,INT. MOTEL ROOM - NIGHT - LATER
desc134.1045,desc,,"Lip lays in a sunken twin bed in his t-shirt and underwear WRITING A LETTER. Shirley, in silk pajamas, folds his clothes and places them into his suitcase."
utter134.1046,utter,DR. SHIRLEY,You realize you're going to be home before that letter gets there?
utter134.1047,utter,LIP,"Yeah, I was gonna just bring it with me. Save on stamps."
desc134.1048,desc,,Shirley rolls his eyes.
utter134.1049,utter,DR. SHIRLEY,"Give it here, I'll fix it."
desc134.1050,desc,,"Shirley reaches for the letter, but Lip pulls it away."
utter134.1051,utter,LIP,"No offense, Doc, but I think I got the hang of it."
desc134.1052,desc,,"For a moment, Shirley's offended. Then he SNATCHES THE LETTER out of Lip's hand."
utter134.1053,utter,DR. SHIRLEY,"(reading) ""Dear Dolores, sometimes you remind me of a house."""
desc134.1054,desc,,Shirley glances at Lip... what the hell?
utter134.1055,utter,DR. SHIRLEY (CONT'D),"(reading) ""A house with beautiful lights on it where everyone inside is happy."""
desc134.1056,desc,,Shirley hands the letter back to Lip.
utter134.1057,utter,DR. SHIRLEY (CONT'D),"Yeah, you got it."
desc134.1058,desc,,"Shirley gets in bed, tries to sleep. We hear O.S. cars; occasionally a dog barks in the distance."
utter134.1059,utter,Doc...,Yes?
utter134.1060,utter,LIP,DR. SHIRLEY
utter134.1061,utter,LIP,Thanks for helping me with the letters--you're really good at writin' 'em. (beat) Maybe when you get home you should write one to your brother?
utter134.1062,utter,DR. SHIRLEY,He knows where I am if he wants to reconnect.
desc134.1063,desc,,"Lip nods. He puts his letter down, turns out the light."
utter134.1064,utter,LIP,"Don't wait for him, Doc. This I know...the world's full of lonely people afraid to make the first move."
desc134.1065,desc,,"Shirley thinks about this, then rolls over."
utter134.1066,utter,LIP (CONT'D),"You know, something's been eating at me the whole trip. Hmmm?"
utter134.1067,utter,DR. SHIRLEY LIP,That Tittsburgh was a real disappointment. I didn't notice any difference at all.
utter134.1068,utter,DR. SHIRLEY,"Good night, Tony."
scene135,slugline,,EXT. HIGHWAY - DAY
desc135.1069,desc,,The Caddy motors by on its way to Birmingham.
scene136,slugline,,"EXT. BIRMINGHAM, ALABAMA - CITY STREETS - EVENING"
desc136.1070,desc,,Shirley's Cadillac drives through the city.
scene137,slugline,,EXT. BIRMINGHAM HOTEL - EVENING - CONTINUOUS
desc137.1071,desc,,"A BANNER across this large wooden hotel reads: ""CHRISTMAS"
scene138,slugline,,"CONCERT TONIGHT -- DON SHIRLEY TRIO""."
desc138.1072,desc,,"THE CADDY PULLS UP FRONT AND PARKS. Lip and Shirley get out. Waiting for them is GRAHAM KINDELL, 40s, blue blazer, pressed slacks, friendly as hell."
utter138.1073,utter,GRAHAM KINDELL,"(deep southern accent) Welcome, Mr. Shirley! Graham Kindell, I'm the general manager. So nice to meet y'all!"
utter138.1074,utter,DR. SHIRLEY,"Thank you, Mr. Kindell. This is"
utter138.1075,utter,Tony Vallelonga. GRAHAM KINDELL,"Pleasure, Tony. Right this way."
scene139,slugline,,INT. BIRMINGHAM HOTEL - KITCHEN/DRESSING ROOM - EVENING
desc139.1076,desc,,"Lip and Shirley (carrying his tux) follow the affable Kindell through the large working kitchen. COOKS, BUSBOYS, DISHWASHERS, ALL BLACK. They continue down several busy hallways to a backstage dressing room."
utter139.1077,utter,GRAHAM KINDELL,If you need anything--anything t'all--you let me know. Thank you.
scene140,slugline,,DR. SHIRLEY INT. BIRMINGHAM HOTEL - DRESSING ROOM - CONTINUOUS
desc140.1078,desc,,"Kindell leads Shirley and Lip into the modest room. A small table, one chair, a mirror."
utter140.1079,utter,GRAHAM KINDELL,Here you are. We have about an hour before show time. Any questions?
utter140.1080,utter,LIP,Where's the restaurant?
utter140.1081,utter,GRAHAM KINDELL,"Continue down the hall, Tony, to the right, across the lobby."
desc140.1082,desc,,Kindell EXITS.
utter140.1083,utter,LIP,We've got an hour. I'm starving.
utter140.1084,utter,DR. SHIRLEY,Go ahead. I'll meet you there.
scene141,slugline,,INT. BIRMINGHAM HOTEL - DINING ROOM / CONCERT HALL - NIGHT
desc141.1085,desc,,"A cavernous DINING ROOM/HALL. Ornately decorated in red and green ribbons and wreaths. A twenty-foot Christmas Tree towers behind the Trio's instruments onstage. Filling in fast with well-dressed WHITE CUSTOMERS. Lip ENTERS, sits at a table. HIS POV - Across the room, Oleg and George eat dinner, drink wine. George CALLS OUT: Tony!"
desc141.1086,desc,,George waves him over. Lip joins them.
utter141.1087,utter,LIP,Shirley'll be here in a minute.
desc141.1088,desc,,A WAITER approaches.
utter141.1089,utter,BIRMINGHAM WAITER,"Cocktails, gentlemen?"
utter141.1090,utter,OLEG,Three shots vodka.
desc141.1091,desc,,Tony looks at Oleg.
utter141.1092,utter,OLEG (CONT'D),Last show. Cold war over. Time for truce.
desc141.1093,desc,,"Lip nods, smiles. The Waiter leaves to get the drinks."
desc141.1094,desc,,Is Shirley in his dressing room?
utter141.1095,utter,LIP,More like a broom closet. I don't understand why he puts up with this shit.
desc141.1096,desc,,"Oleg takes a sip of wine, glances at George."
utter141.1097,utter,OLEG,"Six years ago, 1956, Nat King Cole was invited to perform at Municipal Auditorium right here in Birmingham. Mr. Cole was very first negro asked to play at a white"
scene142,slugline,,establishment in this city.
utter142.1098,utter,OLEG (CONT'D),"Soon as Mr. Cole started playing, a group of men attacked him for playing white people's music. Pulled him off stage and beat him badly."
desc142.1099,desc,,Lip stops chewing.
utter142.1100,utter,OLEG (CONT'D),You asked once why Dr. Shirley does this? I tell you. Because there is no genius without courage.
desc142.1101,desc,,"The Waiter returns with the drinks. They CLINK glasses, down the shots. Lip NOTICES Shirley (now in his tux) and the MAITRE D' having a conversation at the entrance. Lip walks over."
utter142.1102,utter,LIP,What's the problem?
utter142.1103,utter,DR. SHIRLEY,This gentleman's saying I can't dine here.
utter142.1104,utter,LIP,"(to Maitre D') No, you don't understand, this guy's playing here tonight--he's the main event."
utter142.1105,utter,MAITRE D',I'm sorry. It's the policy of the restaurant.
desc142.1106,desc,,"Graham Kindell, the congenial GM, joins them."
utter142.1107,utter,GRAHAM KINDELL,Everything all right?
utter142.1108,utter,LIP,"No, it's not all right. Dr. Shirley's being told he can't eat here."
utter142.1109,utter,GRAHAM KINDELL,"(to Shirley) I apologize, but these are... longstanding traditions. I'm sure you understand."
utter142.1110,utter,DR. SHIRLEY,"No. I don't. In 45 minutes I'll be entertaining your guests up on that stage, but I can't eat here?"
desc142.1111,desc,,Graham Kindell shifts uncomfortably.
utter142.1112,utter,LIP,"Wait a minute. You're tellin' me the bozos in his band, and the shlubs that came to see him play can eat here, but the star can't? Customers take notice. It's getting embarrassing."
utter142.1113,utter,GRAHAM KINDELL,I'm afraid not.
desc142.1114,desc,,"Lip looks to the stoic Shirley, then back to Kindell, searching for a compromise."
utter142.1115,utter,LIP,Well he's gotta eat. Can you at least bring him food from the
desc142.1116,desc,,restaurant to his dressing room?
utter142.1117,utter,GRAHAM KINDELL,"Of course. We'll be happy to send him anything he would like. (to Maitre D') John, show him a menu."
utter142.1118,utter,DR. SHIRLEY,No. I'm not eating in a dressing room.
desc142.1119,desc,,There's a brief standoff.
utter142.1120,utter,GRAHAM KINDELL,"Okay... if you'd prefer, there's a very popular establishment right down the road--the Orange Bird-they'll be happy to feed you."
desc142.1121,desc,,Lip turns to Shirley.
utter142.1122,utter,LIP,"Food's probably better there anyway --the dinner rolls here are like rocks. Come on, we can be back in"
scene143,slugline,,45 minutes.
desc143.1123,desc,,"When Shirley doesn't respond, Lip pulls him aside."
utter143.1124,utter,LIP (CONT'D),"Doc, it's the last show. Let's just get through this and we can go home and get away from all these assholes."
desc143.1125,desc,,Dr. Shirley thinks about it.
utter143.1126,utter,DR. SHIRLEY,No. Not this time. I'm eating in this room or I'm not playing.
desc143.1127,desc,,Kindell's frustration grows.
utter143.1128,utter,GRAHAM KINDELL,(to Lip) May I have a word with you?
desc143.1129,desc,,"Lip follows Kindell through a door, into a side parlor."
scene144,slugline,,INT. BIRMINGHAM HOTEL - RESTAURANT - PARLOR - CONTINUOUS
desc144.1130,desc,,Kindell tries to pour on the Southern charm.
utter144.1131,utter,GRAHAM KINDELL,"Mr. Villanueva, you have to talk sense to Mr. Shirley. Please explain that we're not insulting him personally, this is just the way things are done down here."
utter144.1132,utter,LIP,"Yeah, well he ain't from down here."
utter144.1133,utter,GRAHAM KINDELL,Just ask him to be reasonable. I have 400 guests out there who expect to be entertained tonight.
utter144.1134,utter,LIP,And Dr. Shirley expects to eat tonight. Why can't you just make an exception this one time?
desc144.1135,desc,,Kindell SIGHS.
utter144.1136,utter,GRAHAM KINDELL,"Lemme tell you a story. You ever hear of the Boston Celtics basketball club? Those boys came through here a couple years ago on a barnstorming tour. Now, seeing as they were World Champions of the league and all, we was tickled to have 'em eat here and we rolled out the welcome wagon. So you know what table their big coon ate at that night? No."
utter144.1137,utter,LIP GRAHAM KINDELL,I don't either. But it wasn't one of ours.
desc144.1138,desc,,Kindell drops the genteel demeanor.
utter144.1139,utter,GRAHAM KINDELL (CONT'D),Now let's cut the bullshit. Tell me what it's gonn' take.
desc144.1140,desc,,Kindell takes out his wallet.
utter144.1141,utter,GRAHAM KINDELL (CONT'D),Say one hundred dollars and you get your boy to play?
desc144.1142,desc,,The veins on Lip's neck rise.
utter144.1143,utter,LIP,You think you can buy me?
utter144.1144,utter,GRAHAM KINDELL,"All do respect, sir, but you wouldn't be doing a job like this if you couldn't be bought."
desc144.1145,desc,,"Lip GRABS Kindell by the collar, raises a fist."
scene145,slugline,,DR. SHIRLEY (O.S.)
desc145.1146,desc,,"They turn to see Shirley in the doorway. Graham Kindell pulls away from Lip, fixes his collar."
utter145.1147,utter,DR. SHIRLEY (CONT'D),"It's all right, Tony. I'll play... if you want me to."
desc145.1148,desc,,"Graham Kindell SIGHS, clearly relieved. Lip is relieved, too. But only for a moment. Something comes over him. He glances at Kindell, then back at Shirley. Lip finally sees the big picture, and realizes that, for him and Shirley, this is the moment of truth. Then..."
utter145.1149,utter,LIP,"Nah, let's get the fuck outta here."
scene146,slugline,,INT. BIRMINGHAM HOTEL - DINING ROOM - MOMENTS LATER
desc146.1150,desc,,Lip escorts Shirley through the crowded ballroom toward the exit with Graham Kindell on their heels in a panic.
utter146.1151,utter,GRAHAM KINDELL,"Don, don't do this!"
desc146.1152,desc,,Shirley and Lip keep moving at a brisk pace through the surprised and bewildered crowd.
utter146.1153,utter,GRAHAM KINDELL (CONT'D),"We have a contract, and I know you're the kind of man that honors a contract!"
desc146.1154,desc,,"ANGLE ON the BLACK SERVERS watching their boss grovel. They maintain deadpan expressions, but we can see the APPROVAL IN THEIR EYES."
utter146.1155,utter,GRAHAM KINDELL (CONT'D),"You got a show to do, mister!"
desc146.1156,desc,,Scattered BOOS and CATCALLS from the diners as the FURIOUS Graham Kindell follows them out the front door...
scene147,slugline,,INT. CADILLAC - NIGHT - CONTINUOUS
desc147.1157,desc,,"They pull onto the street and drive in silence, both in shock about what just happened. Shirley looks at Lip in the rear-view. DR. SHIRLEY You hungry?"
scene148,slugline,,EXT. THE ORANGE BIRD - NIGHT - ESTABLISHING SHOT INT. THE ORANGE BIRD - NIGHT
desc148.1158,desc,,"This is a Blues Bar/Restaurant. Lip and Shirley ENTER. A small BAND in the corner--piano, drums and guitar--plays the BLUES. Lip's the only white guy in here and he doesn't go unnoticed, especially standing next to Shirley in a tuxedo. They make their way to the bar, sit. A female BARTENDER gives Lip the once-over."
utter148.1159,utter,ORANGE BIRD BARTENDER LIP,I look Irish?
desc148.1160,desc,,She smirks.
utter148.1161,utter,ORANGE BIRD BARTENDER,"What you want, baby? DR. SHIRLEY Two Cutty's, neat."
desc148.1162,desc,,Shirley takes out a BIG WAD OF CASH. A couple DRUNKS at the bar take notice. Comin' up.
scene149,slugline,,ORANGE BIRD BARTENDER
desc149.1163,desc,,"She grabs a bottle of Cutty, pours the drinks."
utter149.1164,utter,DR. SHIRLEY,"Whatever your specialty is, we'll take it."
desc149.1165,desc,,She CALLS back toward the kitchen:
desc149.1166,desc,,Two orange birds!
scene150,slugline,,SAME SCENE - LATER
desc150.1167,desc,,"Lip and Shirley are devouring two barbecue chickens, their hands and faces covered in orange sauce."
utter150.1168,utter,LIP,"I like what you did back there, Doc. You stood up for yourself. It's like your friend the President says -- ""Don't ask what your country can do for you, ask what you can do for yourself."""
desc150.1169,desc,,Shirley smiles. The Bartender approaches.
utter150.1170,utter,ORANGE BIRD BARTENDER,"(to Shirley) So, darlin', what you do, all dressed up like that?"
desc150.1171,desc,,He shrugs.
utter150.1172,utter,DR. SHIRLEY,Nothing important.
utter150.1173,utter,LIP,He's only the greatest piano player in the world.
desc150.1174,desc,,She smiles.
utter150.1175,utter,ORANGE BIRD BARTENDER,That right? You good?
utter150.1176,utter,LIP,"Don't be shy, Doc. Tell her who you are."
utter150.1177,utter,ORANGE BIRD BARTENDER,Don't tell me nothin'--show me.
desc150.1178,desc,,"Shirley thinks a moment, glances at the BEAT-UP PIANO. He gets up, walks to the stage, sits at the piano. He notices a drink on the top of the piano. Shirley takes the drink, puts it on the floor. SHIRLEY PLACES HIS HANDS ON THE KEYS, TAKES A MOMENT... And then... Shirley starts to play. This isn't a catchy jazz solo or a Christmas ditty. It is, instead, an explosion of sound, the eye-popping machinations of Chopin's Etude Op. 25 No. 11, one of the most difficult piano solos ever written. The crowd lower their forks and gaze up in disbelief. ANGLE ON Lip watching this in awe. Black kitchen workers stop what they're doing to watch. A COOK steps out of the kitchen, wiping his hands on his apron. BACK ON SHIRLEY as he negotiates the eight-finger chord combinations with the mastery of the maestro that he is. He builds and builds and builds until his fingers become JUST A BLUR ON THE KEYS. Shirley FINISHES, the room is quiet. Then the place ERUPTS IN APPLAUSE! CLOSE ON Lip. He's as blown away as the audience. Shirley looks toward a stunned Lip and winks. The GUITAR PLAYER, DRUMMER, and SAX join Shirley on the stage. They start a cool up tempo rockin' blues number. Shirley effortlessly joins in, taking the music to another level. The entire room begins to PULSATE. The crowd eats it up. Shirley plays as if Little Richard had taken over his body. Obviously this man can play anything. A true musical genius. ANGLE ON Lip as he looks on, really getting into it. BACK ON SHIRLEY, the happiest we've seen him."
scene151,slugline,,EXT. THE ORANGE BIRD - PARKING LOT - NIGHT
