segment-id,segment-type,segment-speaker,segment-text
utter94.797,utter,STOLZ,We found several incriminating documents. These pointed to his involvement with the A.N.C. and activities endangering the security of the state.
desc94.798,desc,,"ON Ben looking at Stolz, and shaking his head, bewildered."
utter94.799,utter,LOUW,Was the deceased ever assaulted to your knowledge?
utter94.800,utter,STOLZ,"Never. He was always treated with courtesy and correctness. But, one time we had cause to use force against him. It was the day before his death. The deceased suddenly showed signs of aggression. He tried to jump through the open window of my office. He was acting like a mad man. It took six of my men to restrain him, and he had to be manacled hand and foot, for his own safety. But once he calmed down, he was ready to make a statement about his activities. The next morning we found him dead in his cell."
utter94.801,utter,MAGISTRATE,Is the statement in evidence?
utter94.802,utter,LOUW,"No, Your Worship. It can't be disclosed in court without damaging our investigation, but I would like to offer into evidence a suicide note written by the deceased."
desc94.803,desc,,"Louw, taking it from his file on the table. Stanley and Margaret listening."
utter94.804,utter,LOUW,'Dear Captain. I prefer to die rather than betray any more of my friends. Amandla! Gordon Ngubene.'
desc94.805,desc,,He hands it to the court clerk. There's uproar at this.
utter94.806,utter,LOUW,"Thank you, Your Worship. MAGISTRATE Advocate De Villiers?"
desc94.807,desc,,"Ben is disgusted. He looks about the court, as if seeking allies. His eyes meet Melanie's -- just for a second there's recognition -- then he returns to De Villiers. Advocate De Villiers cross-examining Captain Stolz."
utter94.808,utter,DE VILLIERS,"Thank you, Your Worship. Captain Stolz, you said you treated the deceased always with courtesy and correctness, then how do you account for the injuries found on the body?"
utter94.809,utter,STOLZ,Sometimes detainees deliberately injure themselves for propaganda purposes.
desc94.810,desc,,The gallery screams its objections. Stanley leans forward and grins across the partition at Ben. The Magistrate warns the crowd. Finally the gallery quiets down.
utter94.811,utter,DE VILLIERS,You say he tried to jump out of the open window... Are there no bars to prevent such an act?
utter94.812,utter,STOLZ,They had been removed for repair.
utter94.813,utter,DE VILLIERS,And why did he wish to jump out? Because you were torturing him?
utter94.814,utter,STOLZ,He wasn't tortured.
utter94.815,utter,DE VILLIERS,Perhaps it was the toothache then.
desc94.816,desc,,No reaction from Stolz.
utter94.817,utter,DE VILLIERS,You said you seized incriminating documents at the deceased's home; can you produce them to see how subversive he was?
utter94.818,utter,LOUW,"(to Magistrate) Those documents cannot be introduced as evidence, Your Worship, in view of the fact that state security is involved."
desc94.819,desc,,The Magistrate makes a note.
utter94.820,utter,DE VILLIERS,"I put it to you, Captain -- that the only subversive activities the deceased had been involved in were his efforts to establish what happened to his son, Jonathan, allegedly shot during a riot, although several witnesses are prepared to testify that he died in detention one month later."
utter94.821,utter,LOUW,(jumping up) I protest...
utter94.822,utter,DE VILLIERS,This would support my case that an innocent man has died in your hands under highly questionable circumstances.
utter94.823,utter,LOUW,"If it please Your Worship... this unwarranted slur on the integrity of the special branch is unacceptable... and based, I may say, on allegations which are in any case irrelevant to the present inquest."
utter94.824,utter,MAGISTRATE,I agree.
utter94.825,utter,DE VILLIERS,"(turning on Louw) If the police are really interested in retaining an unsullied reputation, they should not object to the real facts being presented. Thank you, Captain."
utter94.826,utter,LOUW,The real facts are being presented -- as the following affadivits prove. They are all by detainees -- who testify that they had all seen the deceased intermittently from the time of his detention -- to the time of his death -- and on all occasions he was in good health.
desc94.827,desc,,"As the documents are passed to the Magistrate, they are scorned by De Villiers. Imperviously he requests:"
utter94.828,utter,DE VILLIERS,I trust the signatories of these ... documents... are available to corroborate their evidence in person.
desc94.829,desc,,STRAIGHT ON ARCHIBALD CHIGORIMBO Detainee in the witness box. He swears in Zulu. De Villiers holds his signed affidavit.
utter94.830,utter,DE VILLIERS,"Mr. Archibald, when did you first meet Gordon Ngubene?"
utter94.831,utter,ARCHIBALD,"(looking at black crowd, then to De Villiers) I never saw Gordon Ngubene. A sudden stillness in the court. ON Ben."
utter94.832,utter,ON Stanley.,ON Melanie. ON Louw.
utter94.833,utter,DE VILLIERS,Are you saying that you didn't sign this statement?
utter94.834,utter,ARCHIBALD,"... I never met Mr. Ngubene... they forced me to sign. Captain Stolz, he hit me many times with a rubber hose... he said he would kill me 'less I signed... this... this is what he did to me."
desc94.835,desc,,He pulls up his shirt -- his back is covered in bruises. The crowd cannot restrain itself any longer. Ben is aghast by what he sees.
utter94.836,utter,DE VILLIERS,"Thank you, Mr. Archibald."
utter94.837,utter,MAGISTRATE,Advocate Louw?
utter94.838,utter,LOUW,"(uncomfortable) No thank you, Your Worship."
desc94.839,desc,,"As Archibald leaves the witness stand, held by a special branch officer, he raises his fist in salute and shouts to the crowd: ""AMANDLA."" The crowd responds: ""Ngawethu."" Ben looks at Archibald. He is very impressed by this strength in the prisoner's eyes. An officer of the court shouts at the crowd: ""silte in die koort"" (silence in court) -- bailiffs collar a few of the loudest protesters and pull them with brutality out of the courtroom."
utter94.840,utter,DE VILLIERS,"(to town, wearily) May we put up the second signatory?"
desc94.841,desc,,"Louw confers hurriedly with the prosecution officers, then turns back to the court."
utter94.842,utter,LOUW,Your Worship -- the other three signatories cannot appear for reasons of state security.
desc94.843,desc,,"He sits down, bland, examining his papers."
utter94.844,utter,DE VILLIERS,"Your Worship, I'd like to recall Captain Stolz."
desc94.845,desc,,"As Captain Stolz returns to the stand he crosses Archibald being handcuffed by the S.B. officer. Ben watches him passing by the detainee, straight, im- passive without a look to him."
utter94.846,utter,DE VILLIERS,"Captain, you're still under oath -- you took Archibald's statement. Was it voluntary? I'm sure you'll say it was, then how did he come by the injuries on his back?"
utter94.847,utter,STOLZ,He fell down the stairs a few days ago.
utter94.848,utter,DE VILLIERS,"Fell down the stairs. You should do something about those stairs, Captain, so many people fall on them. Thank you."
desc94.849,desc,,The crowd laughs.
utter94.850,utter,STOLZ,"(to the Magistrate) Your Worship, may I be excused? I have to escort detainee Archibal back to John Vorster Square."
utter94.851,utter,MAGISTRATE,"You may, Captain, and thank you. (to the crowd) I think this's a good moment to adjourn -- we'll reconvene at two"
scene95,slugline,,EXT. COURTROOM - DAY
desc95.852,desc,,"Emily, Margaret, Stanley and a man, are sitting outside the court eating fish and chips."
scene96,slugline,,INT. CAFE NEAR COURT - DAY
desc96.853,desc,,Ben and Dan Lewinson having a light lunch in a nearby cafe.
utter96.854,utter,BEN,(buoyant) De Villiers is making mincemeat of them.
utter96.855,utter,LEWINSON,He's very good. His cross- examination has got them rattled.
utter96.856,utter,BEN,It's obvious to anybody! The evidence is clear! (pause) Did you see Archibal's back? He didn't have to tell the truth.
desc96.857,desc,,Dan Lewinson's dry laugh catches in his throat.
utter96.858,utter,LEWINSON,That's what Stolz is saying to him right now in his torture room.
scene97,slugline,,INT. COURTROOM - AFTERNOON
desc97.859,desc,,Advocate De Villiers and a dignified Emily in the witness stand.
utter97.860,utter,EMILY,"Captain Stolz lied. My husband never fight the police when he was arrested. They were rough with him, pushing him and threatening."
utter97.861,utter,DE VILLIERS,"When your husband's clothes were given to you, in what condition were they?"
utter97.862,utter,EMILY,There was blood on them and in the back pocket I found three broken teeth.
utter97.863,utter,DE VILLIERS,"Now Mrs. Ngubene, you have seen the note that's said to have been written by your husband. Do you recognize the writing?"
utter97.864,utter,EMILY,"(firmly) That's not how my husband writes. (strongly) He never wrote that letter, they lie."
utter97.865,utter,DE VILLIERS,"Thank you, Mrs. Ngubene. MAGISTRATE Advocte Louw?"
desc97.866,desc,,He shakes his head.
utter97.867,utter,EMILY,(facing the Magistrate and in firm voice) They killed my husband and son.
utter97.868,utter,MAGISTRATE,(to a policeman next to Viljoen) Will you take the woman out?
utter97.869,utter,DE VILLIERS,I'd like to call my last witness. Grace Nkosi.
desc97.870,desc,,"Grace's name is called. She is an attractive 20-years- old girl. As she passes by Ben, he watches her with concern; her face looks familiar. Of course he remembers having seen her at John Vorster Square the first time he went there to meet the colonel. GRACE NKOSI is the African girl the two security officers were lifted to the ten flour. He recognizes her. Grace Nkosi in the witness stand. She swears in Xhosa."
utter97.871,utter,DE VILLIERS,Were you ever detained?
utter97.872,utter,GRACE,"Yes sir, at John Vorster Square."
utter97.873,utter,DE VILLIERS,For how long?
utter97.874,utter,GRACE,Six months.
utter97.875,utter,DE VILLIERS,Can you tell us what happened to you during that time?
utter97.876,utter,GRACE,"I was interrogated by many special policemen, but mainly Captain Stolz and the one they call Venter. As they were searching somebody I know, they wanted me to tell them where that person was hidden. As I refuse to cooperate they beat me with a sjambok. After some time I fell and they kicked me in the face and stomach."
desc97.877,desc,,ON Ben obviously shocked.
utter97.878,utter,GRACE,"I spot blood and they try to make me lick it. Then Captain Stolz threw a wet towel and started twisting it around my neck... (she illustrates) ... until I lost consciousness. They did this several time and the last one Captain Stolz said 'come on meid, speak up, or do you want to die like Gordon Ngubene?' A few days later I was"
desc97.879,desc,,ON Melanie taking notes.
utter97.880,utter,DE VILLIERS,"Thank you, Miss Grace. That's all, Your Worship."
utter97.881,utter,LOUW,(rising and looking at Grace for some seconds) You made that up. Say you made it up.
utter97.882,utter,GRACE,It's the truth. I have nothing more to say.
desc97.883,desc,,Louw sits down.
utter97.884,utter,MAGISTRATE,We shall adjourn until tomorrow morning. I'll hear the arguments and give the verdict.
desc97.885,desc,,The crowd stands and starts to leave the courtroom.
scene98,slugline,,INT. COURTROOM - MORNING (SECOND DAY)
desc98.886,desc,,"A silent black crowd; Emily, Margaret, Stanley anxiously awaiting the verdict. Today the public gallery is more crowded than before."
utter98.887,utter,MAGISTRATE,I wish to thank both advocates for conducting this case without rancour and in the best traditions of the South African legal profession.
desc98.888,desc,,ON Ben's face. ON Dan Lewinson's face. ON Viljoen and Stolz's faces.
utter98.889,utter,MAGISTRATE,"I have listened to all the evidence and the arguments. To begin with I have to say that there was no conclusive evidence offered to prove beyond doubt that members of the Security Police had been guilty of assault or any irregular conduct on the deceased. There were indications that Ngubene was aggressive and on more than one occasion had to be restrained with force. There was sufficient evidence to conclude that death had been caused by a trauma following pressure applied to the neck, consistent with hanging. Consequently, I find that Gordon Ngubene committed suicide by hanging himself and that on available evidence his death cannot be attributed to any act or omission or amounting to a criminal offense on the part of any person."
desc98.890,desc,,"Viljoen and Stolz smiling, shaking hands with Advocate"
scene99,slugline,,INT. FOYER OF COURTROOM - DAY
desc99.891,desc,,"The predominantly black crowd obviously dissatisfied with the verdict, discussing it as it moves slowly towards the"
scene100,slugline,,main entrance.
desc100.892,desc,,"In the crowd Stanley, Margaret and Emily controlled, dignified but obviously pained."
utter100.893,utter,BEN,"totally depressed, walking up to Emily."
utter100.894,utter,STANLEY,"(to Ben over noise of the discussion) Don't worry, man. There's another day!"
desc100.895,desc,,Ben leans towards Emily.
utter100.896,utter,BEN,"I'm sorry, Emily."
desc100.897,desc,,"Several press photographers are taking pictures osten- sibly of Emily the widow. Stanley gently guides Emily out of the building. Ben, who is following, is besieged by the insistent reporters, shouting:"
utter100.898,utter,REPORTERS,"'Mister Du Toit, how do you know Mrs. Ngubene?' 'Mister Du Toit, can you answer, is it true, he was a terrorist?'"
desc100.899,desc,,Ben tries to get through.
utter100.900,utter,REPORTERS,"Mister Du Toit, what do you think of the verdict? Do you believe the police?"
desc100.901,desc,,"Melanie appears, grabs Ben and pushes him away through them."
utter100.902,utter,REPORTER,"Hang on, Melanie, I'm coming with you."
utter100.903,utter,MELANIE,(shouts back) Fuck off. The press is still pursuing them.
desc100.904,desc,,As Ben and Melanie reach Melanie's car:
utter100.905,utter,BEN,My car is over there.
utter100.906,utter,MELANIE,(opening the car) Never mind your car. Let's get away from these vultures.
desc100.907,desc,,"They get into the car and as they drive away, Melanie introduces herself."
utter100.908,utter,MELANIE,"By the way, I'm Melanie Bruwer."
utter100.909,utter,BEN,Obviously of the Rand Daily Mail. I read your article about Jonathan.
utter100.910,utter,MELANIE,"Ten out of ten, Mr. Du Toit. I know about you too."
utter100.911,utter,BEN,(uncomfortable) You do?
desc100.912,desc,,Melanie smiles.
utter100.913,utter,MELANIE,We have a mutual friend. One Stanley.
utter100.914,utter,BEN,I remember. The mortuary in Soweto... (pause) ... The ambiguous Stanley.
utter100.915,utter,MELANIE,Stanley? No. Just careful. A big black rough uncut diamond. Don't be fooled by his happy-go- lucky attitude. There's much more to him.
utter100.916,utter,BEN,"He couldn't have given you a glowing report of me. (suddenly aggressive) I'm sorry, but where are we going?"
utter100.917,utter,MELANIE,I thought a cooling drink at my house.
utter100.918,utter,BEN,"(on the defensive) Mrs. Bruwer, I'm not..."
utter100.919,utter,MELANIE,(interrupts) I promise you. I'm not after an interview or anything like that.
desc100.920,desc,,She smiles.
utter100.921,utter,BEN,I really must go home.
utter100.922,utter,MELANIE,"Please, Mr. Du Toit, and you'll meet my darling father."
desc100.923,desc,,She smiles again. A disarming smile.
scene101,slugline,,EXT. MELANIE'S HOME - DAY
desc101.924,desc,,"Melanie drives into the yard. The house is an old Colonial style house amidst flowers, bushes and trees, a controlled wild garden. A figure is bent over a beehive. A large brimmed old hat with a net hides his head and features. Melanie stops the car in the driveway."
utter101.925,utter,MELANIE,"(pointing from the car) There he is by the eucalyptus tree, on the left. That's old Bruwer."
desc101.926,desc,,They get out of the car and walk towards him.
utter101.927,utter,BEN,How long have you lived here?
utter101.928,utter,MELANIE,"Oh, about twenty-one years. I love this house."
utter101.929,utter,BRUWER,"(without looking up) Is that you, Melanie?"
utter101.930,utter,MELANIE,"Of course, Dad. I want you to meet a friend."
utter101.931,utter,BRUWER,Does anyone have a friend nowadays?
desc101.932,desc,,He straightens up and throws the net over his head and studies Ben. MR. BRUWER is seventy years old; an interesting face with a goatee beard.
utter101.933,utter,MELANIE,"Mr. Du toit, Dad."
utter101.934,utter,BRUWER,Do you like bees?
utter101.935,utter,BEN,(smiling) I have nothing against them.
utter101.936,utter,MELANIE,"(to Ben) Be careful, I can see philosophy coming."
utter101.937,utter,BRUWER,"You shut up. (to Ben) Let me tell you about bees, and for that matter ants: a bee has a completely altruistic sense of purpose -- based on the common good. A course from which he cannot be deflected. Greed, ambition, they mean nothing to him. He lives solely to serve his fellow bee."
utter101.938,utter,MELANIE,"What about individuality, Dad?"
utter101.939,utter,BRUWER,"There's the rub, my girl. There's the rub. One of these days I'll ask the bees. I'm sure they have the answer. Now, you two run along!"
desc101.940,desc,,He replaces his net and continues with the hive.
utter101.941,utter,MELANIE,"A drink, Dad?"
utter101.942,utter,BRUWER,I've been peeing too much this morning.
utter101.943,utter,MELANIE,(as they walk toward the house) That's my Daddy.
desc101.944,desc,,Melanie and Ben enter the house.
scene102,slugline,,INT. MELANIE'S LIVING ROOM - DAY
desc102.945,desc,,"The Bruwer living room is a profusion of piles of papers, of books on shelves, on tables, on the floor, paintings -- records, African sculptures. On the floor tangled lengths of flex leading from a record player to two voluminous speakers. A settee, a chess set. The furniture is old and well- used, dominated by a large leather club chair -- two big cats sleeping on it. It's civilized pandemonium."
utter102.946,utter,MELANIE,(gesturing to the room) Now you see in what environment I was spawned.
desc102.947,desc,,Ben looks at the shelves and smiles.
utter102.948,utter,MELANIE,"Please sit down, on that chair. (pointing to club chair) That's Dad's. Drink?"
utter102.949,utter,BEN,Please. A...
utter102.950,utter,MELANIE,"(interrupts, mischievous) A brandy?"
utter102.951,utter,BEN,"(looking at her surprised, then smiling) No thanks, a beer will be fine."
desc102.952,desc,,"Melanie goes into the kitchen leaving Ben. He cannot forget what he heard and what he saw in the court! She returns barefooted, with two beer mugs, and hands one to Ben."
utter102.953,utter,MELANIE,The mugs are the few things that Dad brought from Germany. He studied philosophy in Tubingen and Berlin before the last war.
utter102.954,utter,BEN,I thought they were German?
desc102.955,desc,,"Melanie sits, her legs propped up on the settee, hugging her knees."
utter102.956,utter,MELANIE,"Mr. Du Toit, tell..."
utter102.957,utter,BEN,"(interrupts) Please, call me Ben."
utter102.958,utter,MELANIE,"All right, Ben, tell me, why are you so depressed? You really expect a different verdict?"
utter102.959,utter,BEN,(disgruntled) Why do you ask? Can you understand it?
utter102.960,utter,MELANIE,Of course I understand it. What could they have. I'm not cynical. I'm only trying to be realistic.
utter102.961,utter,BEN,"Tell me, Miss Bruwer..."
utter102.962,utter,MELANIE,"Ben and Melanie, that's fair."
utter102.963,utter,BEN,"Tell me, do you believe in the notion of justice?"
utter102.964,utter,MELANIE,(lighting a cigarette) I'll never stop believing. But in this country I've learned it's pointless to look for it in certain situations.
utter102.965,utter,BEN,What use is a system if justice does not apply to all situations?
utter102.966,utter,MELANIE,Exactly. And you cannot fight for justice unless you know injustice very well. You've got to know your enemy first.
utter102.967,utter,BEN,That's a tall order: 'know injustice... know the enemy.' it seems I have a long haul ahead of me.
utter102.968,utter,MELANIE,"Not at all, Ben. You have already taken the first steps. (pause) Welcome to South Africa!"
desc102.969,desc,,She smiles.
scene103,slugline,,INT. BEN'S BEDROOM - NIGHT
desc103.970,desc,,Susan is sitting at the dressing table. She is applying cleansing cream to her face. She is relaxed. Ben is getting ready for bed.
utter103.971,utter,SUSAN,Did you enjoy the 'bobotie?' When I heard the verdict on the news I knew you'd be upset. (softer) I wanted to make you something special.
utter103.972,utter,BEN,"(thoughtful) Thank you, darling."
desc103.973,desc,,A pause. Susan starts to remove the cream.
utter103.974,utter,SUSAN,I'm glad it's all over. You take things to heart too much.
desc103.975,desc,,Ben comes and stands behind Susan -- looking at her through the mirror.
utter103.976,utter,BEN,"(trying to keep control of himself) They killed Gordon -- first they kill Jonathan, and then him. How can they get away with it?"
utter103.977,utter,SUSAN,"(soothingly) Now come on, Ben. Gordon's death upset me, too. But the Magistrate had all the facts. He must know what he's doing, he's had years of experience. The case has run its course, and nobody can do anything more about it! It's all over and done with."
utter103.978,utter,BEN,"(looking at her) I'm not so sure about that, Susan!"
desc103.979,desc,,Susan swivels around and faces Ben.
utter103.980,utter,SUSAN,"I'm damned well sure! It's over, Ben! You better get that into your head."
desc103.981,desc,,Ben just stares at her with seething anger. She stands up and starts being hysterical.
utter103.982,utter,SUSAN,"A teacher, always a bloody teacher. You never moved yourself for us. But for the blacks, oh yes. Whose side are you on, Ben? And I'm sick and tired of those natives coming here. Why don't you bloody well go and live in Soweto?"
desc103.983,desc,,Ben strides out of the room.
utter103.984,utter,SUSAN,(following and shouting) Now where are you going?
utter103.985,utter,BEN,(without looking) Soweto!
desc103.986,desc,,Then shuts the door behind him. Susan stands stupefied. There's the sound of the SPARE ROOM DOOR.
scene104,slugline,,INT. SPARE ROOM - NIGHT
desc104.987,desc,,"Ben is standing in the middle of the room, in the dark. On the wall behind him is a young Suzette's picture. After a few seconds, Ben moves slowly to the bed and sits on it still in deep thought. CLOSEUP ON BEN"
scene105,slugline,,INT. NEWSPAPER AND CONFECTIONARY SHOP - MORNING
desc105.988,desc,,It's a Saturday morning. A shopping center in a white suburb. Ben goes into a newspaper shop. There are two children buying sweets and a woman leaving. The PROPRIETOR is an Afrikaner in his middle age.
utter105.989,utter,BEN,More meneer Van de Merwe. (Morning Mister Van de Merwe.)
utter105.990,utter,PROPRIETOR,(in offhand manner) More meneer du Toit.
utter105.991,utter,BEN,Our boys gave the Eastern province a thrashing.
utter105.992,utter,PROPRIETOR,Yes.
desc105.993,desc,,Ben realizes that the man is not his usual conversational self.
utter105.994,utter,BEN,Is anything wrong?
utter105.995,utter,PROPRIETOR,No.
desc105.996,desc,,Ben goes to pick up an Afrikaans newspaper and the Rand Daily Mail.
utter105.997,utter,BEN,(walking up to counter) And a packet of tobacco and pipe cleaners.
desc105.998,desc,,The man gets them and takes a note from Ben and gives him his change. By then a man is waiting.
utter105.999,utter,BEN,See you tomorrow.
desc105.1000,desc,,As he walks out the other man turns around to watch him.
scene106,slugline,,EXT. STREET - MORNING
desc106.1001,desc,,"Ben walks out of the shop. The newspaper under his arm. A group of three middle-aged women turn to look at him. Ben didn't see them. A little further on, he meets Mrs. Coetzee. He tries to greet her but she walks straight by. Further on, he notices two men obviously talking about him. Then a couple of boys on bikes snigger as they pass him. He begins to wonder what's it all about, and spontaneously checks his clothes."
scene107,slugline,,EXT. BEN'S HOUSE - VERANDA - MORNING
desc107.1002,desc,,"Susan and Suzette sit there. Suzette's holding a news- paper -- the Ossewa -- Susan's thoughtful, her face is red and discomposed -- obviously she had cried. The PHONE RINGS but they deliberately ignore it. Ben appears with the newspapers under his arm, sees Suzette's sports car and hurries to join them. Suzette doesn't even give him a chance to kiss her."
utter107.1003,utter,SUZETTE,"(jumping up and showing the cover of Ossewa) Now, Papa, this is going too far! How could you?"
utter107.1004,utter,BEN,"(surprised) How's that, Suzette?"
desc107.1005,desc,,"Ben takes the newspaper and looks at the cover. A picture of himself and Emily outside the courtroom. The two faces are close together with the notes: ""EMILY NGUBENE, wife of native who"
desc107.1006,desc,,"friend of family, Mr. BEN DU TOIT."" And in parenthesis ""see page two."" He throws the Ossewa on a chair and checks into the Rand Daily Mail. Inside there is a long article with Emily's picture, titled ""the Face of Grief."" Ben folds up the newspapers, and shakes his head. He suddenly realizes why the people reacted like that outside."
utter107.1007,utter,SUZETTE,"You didn't stop to think of the family. Poor mother, how can she face anyone? And tomorrow is Sunday!"
utter107.1008,utter,BEN,Now listen...
desc107.1009,desc,,Johan steps into the veranda.
utter107.1010,utter,JOHAN,What's everybody yelling about?
utter107.1011,utter,SUZETTE,"You listen, Papa, just tell me, why?"
desc107.1012,desc,,"Recognizing his father in the photo, Johan has picked up the newspaper from the chair."
utter107.1013,utter,BEN,Do you really think I specially arranged for the photographers to take that picture? And what's
desc107.1014,desc,,more it's distorted.
