segment-id,segment-type,segment-speaker,segment-text
desc126.1228,desc,,"They are interrupted by a KNOCK at the door. Emily snatches the notes and stuffs them into her bosom. Everyone is tense as Emily slowly walks up to the door. She opens it and a man with a hat and dressed as a min- ister walks in. Before anyone can say anything, Stanley bursts out in a loud laugh. The man is slightly built, aged 40 years. He is JULIUS NQAKULA."
utter126.1229,utter,STANLEY,"On your knees, everyone, prayers time."
desc126.1230,desc,,Ben is perplexed. Emily closes the door and locks it.
utter126.1231,utter,STANLEY,"Hey man, you should have been a mfundisi holiness oozer..."
utter126.1232,utter,JULIUS,"(removing this hat) Okay, Stanley. It's stupid, but one is forced to do these things."
desc126.1233,desc,,He walks up to Ben and offers him his hand.
utter126.1234,utter,JULIUS,I'm Julius Nqakula... I'm banned and also under house arrest. That's why I have this ridiculous garb on.
utter126.1235,utter,BEN,I understand.
utter126.1236,utter,STANLEY,"He's one of the most solid lawyers we have; they've immobilized him, that's the right word isn't it?"
desc126.1237,desc,,He laughs.
utter126.1238,utter,BEN,Stanley has told me about you. I appreciate the risk you are taking by coming here to meet me. I was reading the notes Gordon smuggled out of John Vorster Square...
utter126.1239,utter,JULIUS,May I have a glance at them?
desc126.1240,desc,,Emily produces the notes. Julius takes them. He starts
utter126.1241,utter,GORDON (V.O.),(speaking with great difficulty) 'My dear wife. I am still in these conditions... worse... and too much pain. They don't want to believe me. You must try to help me. They won't stop. You must care for the children. I don't know anymore if I will come home alive. They're very -- (a word mumbled) -- but God will provide. I love you and I miss you very much. Try to help me because...'
desc126.1242,desc,,The voice breaks off.
utter126.1243,utter,JULIUS,(to Emily) When did you get the letters?
utter126.1244,utter,EMILY,(uncomfortable) The first one two days after they took him away. And the other one came later.
utter126.1245,utter,BEN,"But, Emily, why didn't you tell me long ago?"
utter126.1246,utter,EMILY,I had given my word to the man -- who brought them to me --
utter126.1247,utter,BEN,"Emily, I have to meet the man."
utter126.1248,utter,EMILY,He said he didn't want anybody to know who he is. I cannot make trouble for him in his work.
utter126.1249,utter,BEN,He has to be persuaded. He is very important to us.
utter126.1250,utter,EMILY,(to Julius) You as a lawyer will understand. (MORE)
utter126.1251,utter,EMILY (CONT'D),"We intend starting a civil suit against the police, to do that it is necessary to have as many affidavits as we can from people who have any information about Gordon since he was arrested. And this man is vital and so is the Indian doctor."
utter126.1252,utter,JULIUS,You mean Dr. Hassiem. How are you going to do that? You know of course that he is detained.
utter126.1253,utter,BEN,"I know, with luck they may release him."
utter126.1254,utter,JULIUS,With luck.
utter126.1255,utter,BEN,"But, Emily, this man is important, please try to tell him we will protect his identity. No one will know. Nothing will be done without his approval. I only want to talk to him."
utter126.1256,utter,JULIUS,"Why don't you leave it to Stanley and I? What do you say, Stanley?"
utter126.1257,utter,STANLEY,Sure.
utter126.1258,utter,BEN,"May I call you Julius, I'm not very good with some African names."
utter126.1259,utter,STANLEY,"(laughs) Nqakula, that's a hell of a name."
utter126.1260,utter,JULIUS,Please call me Julius.
utter126.1261,utter,BEN,"This case must be reopened and we must win. We have to dig up everything. We need your cooperation, Julius."
utter126.1262,utter,JULIUS,Where do I start? Don't forget my restrictions.
utter126.1263,utter,STANLEY,They did not ban you so you could sit on your backside and have a Soweto holiday.
utter126.1264,utter,BEN,You could help with the affidavits. Lewinson the lawyer has stressed their importance.
utter126.1265,utter,JULIUS,We know each other. He's a good lawyer for this kind of case. Of course I'll do what I can. My commitment forces me.
utter126.1266,utter,BEN,I'm glad.
utter126.1267,utter,JULIUS,How are you planning to safeguard the documents? Stanley told me you have already had a said by the S.B.
utter126.1268,utter,BEN,I wouldn't worry. I have a secure place.
utter126.1269,utter,STANLEY,Let's hope so.
utter126.1270,utter,EMILY,I'll make some tea.
utter126.1271,utter,STANLEY,"Not for me, Sis -- too strong for me. No whisky?"
utter126.1272,utter,EMILY,"In my house? You know better than that, Stanley."
utter126.1273,utter,STANLEY,Tea then... (turning to Julius) ... and God forgive me --
scene127,slugline,,INT. BEN'S GARAGE - EVENING
desc127.1274,desc,,"Ben is standing by the workbench, the new drawer he and Johan built for the toolbox, open before him. He's rereading Gordon's letters to Emily. Sound of approaching FOOTSTEPS. Ben quickly puts the letters into the drawer and shuts it. Susan appears at the door -- she looks ten years older."
utter127.1275,utter,SUSAN,"Ben, it's Johan. You'd better come."
scene128,slugline,,INT. BEN'S KITCHEN - EVENING
desc128.1276,desc,,"Johan sits, Ben crouched before him. The boy's shirt is torn, his eyes swollen, his lip cut. He looks at the floor. Susan hovers."
utter128.1277,utter,SUSAN,He won't tell me why it happened
desc128.1278,desc,,"Ben holds his son's arms, gently."
utter128.1279,utter,BEN,Johan. Was it because of me?
desc128.1280,desc,,He doesn't answer for a moment. Then he nods.
utter128.1281,utter,SUSAN,"You see! It's gone too far, Ben. You've got to stop it..."
utter128.1282,utter,JOHAN,(shouting at his mother) I don't care! It doesn't hurt me!
desc128.1283,desc,,"Susan stares at him, at Ben, turns abruptly, walks out of the room. Johan looks at his father."
utter128.1284,utter,JOHAN,"It was my friends, Dad. They're so stupid... They won't listen. They don't even want to know what you're trying to do."
desc128.1285,desc,,He's crying.
utter128.1286,utter,BEN,Are you sure you know?
utter128.1287,utter,JOHAN,Yes. I know.
utter128.1288,utter,BEN,Does it worry you?
desc128.1289,desc,,Johan looks at his father through his tears.
utter128.1290,utter,JOHAN,"Don't stop, Dad. You mustn't give up now!"
desc128.1291,desc,,Ben hugs his son. The Gordon Ngubene name-cleaning team on the move.
utter128.1292,utter,A) BEN,in a phone box dialing a number. B) PHONE
desc128.1293,desc,,"RINGING, RINGING, on a desk full of scattered files and papers. By the phone a photograph of a six- year-old Indian girl."
scene129,slugline,,C) CLOSE ON NURSE
desc129.1294,desc,,"Sound of the PHONE, a young nurse's frightened face as she remembers peering in at a young boy, struggling and moaning... Policemen closing the door... D) CLOSE ON her hand signing the affidavit and handing it to a man's hand. Ben in the phone box hanging up the phone with rage. a young black man's face listening to Julius's voice:"
utter129.1295,utter,JULIUS (V.O.),"... And on the morning of the autopsy, as I was cleaning the mortuary, Captain Stolz gave me a bundle of Ngubene's and ordered me to burn them."
desc129.1296,desc,,The young man nods.
utter129.1297,utter,G) BEN,having a look on the two affidavits before hiding
desc129.1298,desc,,"them into the drawer of the stool box. SHOTS. Three! Loud, sharp, terrifying."
scene130,slugline,,INT. BEN'S LIVING ROOM - LATE EVENING
desc130.1299,desc,,"The WINDOW, a LAMP and a MIRROR SHATTER -- Susan screams, standing, her hands -- clamped over her ears -- eyes tight shut -- hysterical -- the TELEVISION CHATTERS on an Afrikaans' play. Ben bursts in, holds her tight, as she screams into his chest."
utter130.1300,utter,SUSAN,"(hysterical) Call the police, Ben, call the police!"
desc130.1301,desc,,Johan's voice comes from his room.
utter130.1302,utter,JOHAN (O.S.),Papa! Papa!
utter130.1303,utter,BEN,"(calling) It's okay, son... we're all right. Everything's okay!"
utter130.1304,utter,JOHAN (O.S.),What's happened?
utter130.1305,utter,BEN,"(shouting) It's okay, stay there, please!!"
desc130.1306,desc,,"Gently, he leads Susan who is sobbing now, out of the room."
scene131,slugline,,INT. KITCHEN - LATE EVENING
utter131.1307,utter,SUSAN,(in disbelief) My God. They were trying to kill us.
desc131.1308,desc,,She's seated at the kitchen table. Ben has poured her a brandy which she cups in her hands.
utter131.1309,utter,BEN,"They were trying to scare us, that's all."
desc131.1310,desc,,Her fear turns into anger.
utter131.1311,utter,SUSAN,"(screaming) Oh, is that all... What the hell more do you want to happen... we're ordinary people for God's sake -- and you've pitched us into this -- this nightmare. I can't take any more, Ben... I can't take any more!!"
desc131.1312,desc,,"She drops her head and sobs. Ben sits beside her, and takes her hands to comfort her. Susan puts her head on his shoulder."
utter131.1313,utter,SUSAN,"(in a quiet pleading voice) Please, Ben, stop. Just stop... please."
desc131.1314,desc,,"Ben is obviously moved. He squeezes her hands, then takes her in his arms."
scene132,slugline,,INT. VILJOEN'S OFFICE - DAY
desc132.1315,desc,,"The colonel, amiable, cool, behind his desk. A dishev- elled Ben, pitched angrily forward in his chair."
utter132.1316,utter,VILJOEN,"Now you must be exaggerating, Mr. Du Toit."
utter132.1317,utter,BEN,My house has been searched. My phone is tapped. My mail is opened. And last night three shots were fired through my window -- close to killing my wife.
desc132.1318,desc,,Viljoen reacts.
utter132.1319,utter,VILJOEN,"Mr. Du Toit, if shots were fired into your premises, we will investigate."
utter132.1320,utter,BEN,"All I want to know, Colonel, is why don't you leave me in peace?"
utter132.1321,utter,VILJOEN,"Now wait, wait a minute, Mr. Du Toit, you're not trying to blame me?"
utter132.1322,utter,BEN,"Tell me, Colonel, why is it so important to you people to stop my enquiries about Gordon Ngubene?"
utter132.1323,utter,VILJOEN,"Is that what you are doing? (he pauses) Well, now. If you possess any information that may be of use to us, I trust you won't hesitate to discuss it with me."
desc132.1324,desc,,"He leans forward towards Ben, his tone darkening."
utter132.1325,utter,VILJOEN,"Because if there are facts you are deliberately hiding from us, Mr. Du Toit -- If you give us reason to believe that you may be involved in activities that may be dangerous to both yourself and us -- then I can foresee some problems."
utter132.1326,utter,BEN,"Is that a threat, Colonel?"
utter132.1327,utter,VILJOEN,"(smiling and sitting back) Let's call it a warning. A friendly warning. For God's sake, open your eyes, Mr. Du Toit! Don't you see you're being used!"
utter132.1328,utter,BEN,"(sarcastically) By the Communists, I suppose."
desc132.1329,desc,,Ben gets up to go. The colonel doesn't rise to see him out.
utter132.1330,utter,BEN,"Goodbye, Colonel. (at the door, turning back) I'm sure."
desc132.1331,desc,,He leaves. The colonel immediately picks up the phone.
scene133,slugline,,EXT. BEN'S KITCHEN - EARLY MORNING
desc133.1332,desc,,A 40-year-old African woman walks up to Ben's kitchen door. She knocks. Ben opens the door in pyjamas and dressing-gown. She hands him a note and leaves. Ben reads the note and goes back into the house.
scene134,slugline,,EXT. STREET IN VREDEDORP - MORNING
desc134.1333,desc,,Vrededorp is a colored section of Johannesburg. It's rundown area vacated by whites. There are children play- ing in the street. Some unemployed men are sitting on old chairs outside a doorway; a vendor is serving two women from his milk churn. Ben drives into the street searching for an address. He stops outside a house. As he gets out of the car the children and everyone stop to look at him with interest. He walks up to a door and knocks. A COLORED WOMAN appears as the door opens. She is young and obviously educated. COLORED WOMAN
desc134.1334,desc,,"Ben nods, hesitatingly. COLORED WOMAN Please, come in. Ben walks into the living/dining room. It's a very tidy room with a three piece sitting room suite, a sideboard with a clock on it. At one end of the room is the dining area. The floor is linoleum and covered with a rug in the middle. Stanley is lounging on a settee, beer in hand. On the chair next to him a black man in a brown striped suit, drinks orange squash. Thirtyish, pleasant face but very tense. He rises as Ben walks in."
utter134.1335,utter,STANLEY,(rising and shaking hands with Ben) How's it? No trouble finding this place? You met Sadie. She's one of us.
desc134.1336,desc,,Ben nods to her.
utter134.1337,utter,STANLEY,And this is Johnson Seroke. The man of the letters.
utter134.1338,utter,BEN,(nodding in greeting) Johnson.
utter134.1339,utter,SADIE (COLORED WOMAN),"Please sit down, Mr. Du Toit. A beer, tea or orange squash?"
utter134.1340,utter,BEN,A beer would be nice.
desc134.1341,desc,,Sadie goes to a cupboard and brings out a bottle of beer and a glass. She opens the beer and hands it to Ben. She disappears into the bedroom with a curtain at the door.
utter134.1342,utter,STANLEY,"You know they call this place Vrededorp, but we baptize it Malay Camp. Your first time in Malay Camp, Lanie?"
utter134.1343,utter,BEN,I've driven through here many times.
utter134.1344,utter,STANLEY,"The main road, eh?"
utter134.1345,utter,BEN,(smiling) Ja.
desc134.1346,desc,,The woman re-enters.
utter134.1347,utter,SADIE,"You'll excuse me. Stanley, you know what to do with the key."
utter134.1348,utter,STANLEY,"Sure, Sadie. And thank you. Can I help myself to another beer?"
utter134.1349,utter,SADIE,"You know it is. Goodbye, Mr. Du Toit, and you, be careful. To the Seroke."
utter134.1350,utter,SEROKE,"(trying to smile) Okay, Sadie."
desc134.1351,desc,,Sadie leaves.
utter134.1352,utter,STANLEY,"That woman can die for you. We mustn't be long, Johnson has to be back on duty."
utter134.1353,utter,BEN,"Alright, let's get on with it. Stanley tells me, you work at John Vorster Square."
utter134.1354,utter,SEROKE,"I had no choice, they transferred me there."
utter134.1355,utter,BEN,Yet you smuggled out letters to Emily?
utter134.1356,utter,SEROKE,"(pulling the fingers of his left hand one by one cracking the joints over and over) What do you do if a man asks you, and he's in trouble?"
utter134.1357,utter,STANLEY,If they find out he'd be in very big trouble.
utter134.1358,utter,BEN,"I know that. Tell me, what do you know about Gordon?"
utter134.1359,utter,SEROKE,Very little.
utter134.1360,utter,BEN,You did talk to him from time to time?
utter134.1361,utter,SEROKE,He gave me the letters.
utter134.1362,utter,BEN,When was the last time you saw him?
utter134.1363,utter,SEROKE,Just before he died.
utter134.1364,utter,BEN,Did you attend any of the interrogations?
utter134.1365,utter,SEROKE,"No. I'm not a member of the Special Branch. But once I had to deliver a letter to Capt. Stolz, Gordon was there."
utter134.1366,utter,BEN,(concerned) How were they interrogating him?
desc134.1367,desc,,Seroke hesitates and looks at Stanley.
utter134.1368,utter,STANLEY,It's okay. Tell him what you told me.
utter134.1369,utter,BEN,(anxious) What?
utter134.1370,utter,SEROKE,They were using the pole.
utter134.1371,utter,BEN,"The pole, what's that?"
utter134.1372,utter,STANLEY,(demonstrating) They handcuff you and manacle your feet then they put a pole between your arms and the back of your knees. Then you're like a chicken ready for the oven. They hang you between two tables. Then they do what they like with you. The S.B. call it the aeroplane.
desc134.1373,desc,,Ben is horrified.
utter134.1374,utter,BEN,I see. Who were in that room? Stolz...
utter134.1375,utter,SEROKE,Lieutenant Venter and a black S.B.
utter134.1376,utter,BEN,You are sure?
utter134.1377,utter,STANLEY,He's sure.
utter134.1378,utter,BEN,(to himself) It's very interesting. When was the last time you saw him?
utter134.1379,utter,SEROKE,(nervous) I saw them take the body away to the cells. He was limp.
utter134.1380,utter,BEN,"You did! Johnson, why do you stay with the police? You don't really belong there."
utter134.1381,utter,SEROKE,It's a job. And how can I go away? I love my family.
desc134.1382,desc,,He jumps up and faces Ben with a look of anger and panic.
utter134.1383,utter,SEROKE,They must never know I told you anything. Right?
utter134.1384,utter,BEN,I understand. I promise.
utter134.1385,utter,STANLEY,"This is strictly between the three of us. Don't worry, man."
desc134.1386,desc,,Seroke shakes hands with them as he's leaving.
utter134.1387,utter,STANLEY,(slapping his back) Take it easy.
desc134.1388,desc,,Stanley goes to the cupboard for another beer.
utter134.1389,utter,STANLEY (O.S.),"A beer, Lanie?"
utter134.1390,utter,BEN,"(shouting) No, thank you. You know, Stanley, after what happened the other night I was about to give this whole thing up."
utter134.1391,utter,STANLEY,"(intrigued) What happened, man?"
utter134.1392,utter,BEN,My wife nearly got killed. Three shots were fired into the house. What right have I to expose my family to harassment and actual physical danger? That's what I asked myself.
utter134.1393,utter,STANLEY,"Three bloody shots and you crawl on your hands and knees to people like Stolz, and say 'I give up.' What is the beginning for you is a version of what we suffer all our bloody life. Shit, I thought you had more guts than this, man!"
utter134.1394,utter,BEN,I didn't say I'm giving up.
utter134.1395,utter,STANLEY,But you thought about it.
utter134.1396,utter,BEN,Johnson has revived my determination.
utter134.1397,utter,STANLEY,"It's a hell of a time, Lanie, but we'll survive. You and me. I tell you!"
utter134.1398,utter,BEN,"You think we may still win in the end, Stanley?"
utter134.1399,utter,STANLEY,"Of course not, Lanie -- but we needn't lose either -- what matters is to stick around."
desc134.1400,desc,,Ben nods.
utter134.1401,utter,STANLEY,"By the way, man, I'm off on a trip -- Botswana -- thought I'd tell you in case you get worried."
utter134.1402,utter,BEN,Why are you going there?
utter134.1403,utter,STANLEY,Business. Tell you next week. Now for the bad news I've been saving to the last.
utter134.1404,utter,BEN,What?
utter134.1405,utter,STANLEY,Julius has been arrested. He broke his banning order and visited his sister. You know what that means? At least a year's imprisonment.
utter134.1406,utter,BEN,A year in jail just for visiting his sister?
utter134.1407,utter,STANLEY,That's the chance he took. And he'll be the last to complain.
utter134.1408,utter,BEN,Don't you think the real reason for this arrest was that they found out he was helping us?
utter134.1409,utter,STANLEY,"So what? Lanie, you're not getting guilt complexes now, are you? That's a luxury only liberals can afford. Julius will be back, man. All refreshed by a spell in the deep-freeze."
utter134.1410,utter,BEN,How can we shrug off a man we've been working with?
utter134.1411,utter,STANLEY,"Who said we're shrugging him off? Best way of remembering a man, Lanie, is to carry on fighting."
scene135,slugline,,INT. BEN'S STUDY - DAY
desc135.1412,desc,,Ben's study is in chaos. The books have been plucked from the shelves and the contents of his drawers emptied on the floor. Ben standing in the middle of the room surveying the vandalism.
scene136,slugline,,INT. BRUWER KITCHEN - AFTERNOON
desc136.1413,desc,,"This is a medium-sized kitchen with two doors leading from it, one to the dining room and the other to the living room. It has not changed since it was furnished twenty years ago, the only modern appliances being the electric stove and a modern mixer on the working table. Ben is leaning against the wall next to the door leading to the living room, drinking coffee. Melanie, bare-feet, her long black hair tied up in a ribbon, is washing up. She looks younger and fragile with this hair-style."
utter136.1414,utter,BEN,(smiling) What about you?
utter136.1415,utter,MELANIE,What?
utter136.1416,utter,BEN,I mean not married...
utter136.1417,utter,MELANIE,And living in this chaos with my eccentric father? I love him and we get on perfectly. We have been together since I was a year old. My mother could not adapt to South Africa. She went back to London and we've never heard from her since.
utter136.1418,utter,BEN,"Being a professor and bringing up a child, how did he manage that?"
utter136.1419,utter,MELANIE,"Dorothy, dear Dorothy, she was a fantastic mother. In fact she had two families, me and her three children in Alexandra township."
utter136.1420,utter,BEN,And this little girl grew up to be a tough journalist. Why a journalist?
utter136.1421,utter,MELANIE,(laughs) Sometimes I ask myself the same question.
desc136.1422,desc,,She leans against the sink and picks up her mug of coffee.
utter136.1423,utter,MELANIE,"Alright. I'll tell you. I was brought up in a sheltered way, not that Dad was possessive, not openly anyway. I think he'd just seen enough of the mess the world was in, to want to protect me as much as he could. Then, I went to university. I don't know what you'll think... being a teacher."
desc136.1424,desc,,Pause.
utter136.1425,utter,BEN,About what?
utter136.1426,utter,MELANIE,Then I married my ex-teacher.
utter136.1427,utter,BEN,Oh. He must have been young.
utter136.1428,utter,MELANIE,"Fifteen years difference. He too protected me like Dad. Then one day I visited Dorothy in Alexandra and saw her home and the appalling conditions in that township. I was shocked, Ben, and ashamed."
utter136.1429,utter,BEN,Go on.
desc136.1430,desc,,Melanie pours him another mug of coffee and starts to wipe up.
utter136.1431,utter,MELANIE,"That made me think that I was a parasite, something white and maggot-like... just a thing... a sweet and ineffectual thing. I felt more and more claustrophobic. Poor Brian, who loved and pampered me. Had no idea what was happening. I left him for a whole year and we divorced."
utter136.1432,utter,BEN,And then you became a journalist?
desc136.1433,desc,,"Melanie goes to the living room, as she passes Ben she touches his arm and continues talking."
utter136.1434,utter,MELANIE (O.S.),"I thought it would force me, or help me, to expose myself. To force me to see and to take notice of what was happening around me."
utter136.1435,utter,BEN,Did it work?
desc136.1436,desc,,She returns to the kitchen with a cigarette.
utter136.1437,utter,MELANIE,I wish I could give you a straight answer. What did help me was my wanderings in Africa.
utter136.1438,utter,BEN,How did you manage that on a South African passport? We South Africans are white devils in Africa.
utter136.1439,utter,MELANIE,"My mother was English, remember? So I get a British passport. It comes in handy even for the paper."
utter136.1440,utter,BEN,You really are your father's daughter!
utter136.1441,utter,MELANIE,"I wonder what he's doing right now. Most likely standing on a rock, looking through his old binoculars at springbok or a lion or whatever."
desc136.1442,desc,,"One of the two large CATS approaches them, tail in the air, and goes to Melanie, drubbing against her legs, PURRING luxuriously. She picks it up into her arms."
utter136.1443,utter,BEN,How often does he go on these trips to the veldt?
utter136.1444,utter,MELANIE,"It depends -- (approaching Ben with cat) -- Bonjour, Ben. I'm Porto and my friend is Bello!"
desc136.1445,desc,,Ben smiles and starts to caress Porto in Melanie's arms.
scene137,slugline,,EXT. SOWETO - EMILY'S HOUSE - MID-MORNING
desc137.1446,desc,,"Parked outside the house is a municipality truck already half-laden with Emily's furniture and possessions. Four Africans in khaki overalls are loading the truck -- super- vising the eviction of Emily are a white Soweto official, Captain Stolz and Lt. Venter. In the b.g., a hundred yards away is a ""hippo"" with black and white armed policemen. Behind the truck are two police Land Rovers. Emily is sitting outside on one of her chairs as neighbors walk up to her to comfort her and say their goodbyes. Her daughter is carrying the youngest child and standing next to Emily -- several children are watching. A woman in the crowd starts singing a freedom song: ""UMZIMA LOMTHWALO"" (""THIS BURDEN IS HEAVY""). The song is taken up by the other women. Venter tries to stop them and disperse them. Stolz signals to him to leave them alone. One of the Africans then walks up to her for the chair. She refuses to get off the chair. The man looks at the white official as though to ask ""what do I do."" The official looks at Stolz. Venter walks up to Emily and, about to pull her off the chair."
utter137.1447,utter,EMILY,Don't you touch me!
desc137.1448,desc,,"Venter pulls back. The women start to ululate. Emily rises majestically, takes the youngest in her arms and walks slowly to the truck followed by her daughter. People cluster around her, singing with rage and shaking her hand. Stolz observes the scene, impassive."
utter137.1449,utter,WOMAN (V.O.),Come back! Buya! CROWD (shouts) Buya! Buya!
desc137.1450,desc,,"Emily and the children are helped onto the back of the truck which drives away preceded by the police ""hippo"" and escorted from the rear by the Land Rovers. The crowd continues singing."
scene138,slugline,,EXT. STREET - MORNING
