segment-id,segment-type,segment-speaker,segment-text
utter0.0,utter,May 1987,Revised First Draft
desc0.1,desc,,"""IN THE WHOLE WORLD THERE IS NOT A SINGLE POOR DEVIL WHO IS LYNCHED, NOT ONE MISERABLE MAN WHO IS TORTURED IN WHOM AND DEGRADED."""
desc0.2,desc,,PRE-TITLE:
scene1,slugline,,EXT. DAN PIENAAR SECONDARY SCHOOL FOR BOYS - DAY
desc1.3,desc,,"Dan Pienaar school is a typical Johannesburg Afrikaan school. The students are mainly from middle-class families. School athletics are in progress. The stu- dents, in their smart school uniforms, are cheering enthusiastically a relay race on the immaculately-kept sports ground. GORDON NGUBENE, a 47-years-old African laborer is work- ing in the school garden. A few feet away is his 15- years-old son JONATHAN leaning against a wall watching the games. BEN DU TOIT, a 50-year-old Afrikaaner history teacher, is enthusiastically cheering his son JOHAN, a 15-years-old, who is leading neck-and-neck with another boy in the last leg of the race. The excitement increases as they approach the tape. Ben is beside himself, egging his son with shouts. The young teacher, VIVIERS, standing next to Ben, is shouting ""come on Johan,"" and slapping the father on the back. Johan breasts the tape just ahead of the other boy. The ground is invaded by boys running to congratulate Johan. Ben hurries towards his happy but exhausted son; the proud father pushing his way through the animated boys. As he reaches Johan he pats him on the back."
utter1.4,utter,BEN,This was your best race.
utter1.5,utter,JOHAN,"(excited) I beat him, Papa."
utter1.6,utter,BEN,"(proudly) You did son. Come on, shower."
desc1.7,desc,,"They walk happily towards the school buildings in conver- sation, Johan being slapped on the back by friends. Ben stops to talk to Gordon who jumps to his feet."
utter1.8,utter,BEN,"I'll be expecting you. There isn't much to do, only weeding the marigolds and watering the lawn and flowers."
utter1.9,utter,GORDON,"We'll be there, Mr. Ben'sir, Jonathan come to help me."
desc1.10,desc,,Ben hadn't seen Jonathan. He turns to him.
utter1.11,utter,BEN,And how's the algebra? Still giving you trouble?
utter1.12,utter,JONATHAN,"(with respect) Just a little, Mr. Ben'sir."
utter1.13,utter,JOHAN,Me too.
utter1.14,utter,GORDON,"(straightening himself) He's working hard, Mr. Ben'sir, and your money will not be wasted. Emily and me will always thank you."
utter1.15,utter,BEN,(as he leaves) See you both later.
desc1.16,desc,,"Gordon returns to his work a little distance further. A group of students are laughing and pushing each other boisterously. As they near Jonathan, two nudge each other and giggle. Then, one of them trips Jonathan. He falls to the ground and jumps up aggressively, about to attack the boy. Gordon shouts ""Jonathan."" The headmaster, MRS. CLOETE, aged 65 years, has observed the incident, but takes no action. Jonathan stands panting with rage. He suddenly strides away towards the gate in a rage."
utter1.17,utter,GORDON,(shouting angrily) U ya phi? (Where are you going?)
desc1.18,desc,,Jonathan turns to look at his father and continues to walk off.
scene2,slugline,,EXT. SOWETO BEER HALL - AFTERNOON
desc2.19,desc,,"The beer hall is a large complex with a drinking area with long rows of low benches. Men sit drinking African beer in one-half and one gallon plastics containers. The place buzzes with noise. Several people are touting wares for sale. Suddenly a group of about twenty youths walks into the drinking area, obviously to cause trouble. The LEADER starts to address the clients."
utter2.20,utter,LEADER,Your children are starving and you are drinking. We demand freedom and our fathers are drunk. We ask you to boycott these beer halls. Revolution and drink don't work together!
desc2.21,desc,,"A large MAN WITH SIDEBURNS, obviously drunk, stands up, a stick in his hand."
utter2.22,utter,MAN WITH SIDEBURNS,Since when do children talk like this to their fathers? They need thrashing.
desc2.23,desc,,"The man and several others advance on the boys. The boys run into the serving area, close the doors and start breaking up the place. Two police Land Rovers SCREECH to a halt outside. The boys run out through a side en- trance. They are chased by the police who are black. Jonathan and his best friend Wellington, also 15 years, are walking towards the beer hall when the boys come running out chased by the police. It is prudent for them to run down the street. The boys and police are bearing down on them. Their escape is cut off by the apperance of another police Land Rover. Two policemen, two blacks and two whites join in the capture. Jonathan, Wellington and about ten of the boys are arrested. As they are hundled into the vehicle, they protest their innocence without success and are driven away."
scene3,slugline,,INT. SOWETO POLICE STATION - CHARGE OFFICE - AFTERNOON
desc3.24,desc,,"The charge office is sparcely furnished with a long bench along a wall. There is a reception counter with Sgt: Van Zyl in charge. The boys are lined up against a wall. The sergeant stands with a tall blond man with a scar on his chin, CAPTAIN STOLZ. The sergeant reads out a name and looks at Stolz; if he nods the boy stands aside. After this ritual, the ones that Stolz has chosen are marched to a waiting police van and driven away. The others are taken to the cells at the police station, these include Jonathan and Wellington."
scene4,slugline,,EXT. DUTCH REFORM CHURCH - DAY
desc4.25,desc,,"The MUSIC STOPS. The doors open. The 40 years-old- minister Bester comes to the door, then stands and greets his parishioners as they file out of the church. Amongst them, Ben Du Toit -- his wife, SUSAN, a clean- cut, immaculate, ""toe-the-line"" beauty and his son, Johan -- the blond, blue-eyed, tanned and torsoed fourteen- year-old every father dreams of. Susan greets friends and acquaintances, pausing to chat... mostly formalities. Johan, his eyes on a girl his age. She is with her father, Mr. Cloete, the headmaster -- she smiles at Johan from a distance; he waves awkwardly as she drives off with her parents. SUZETTE his daughter, sophisticated -- groomed. She takes her baby from the black nanny waiting in the car, carries the child to the group chatting with CHRIS, her husband. She shows it off proudly. Ben is chatting, concerned, to a WOMAN. She looks drawn and worried."
utter4.26,utter,MRS. COETZEE (WOMAN),"He won't come to church. He lies in bed all day, listening to his headphones."
utter4.27,utter,BEN,I wondered why he wasn't at school. Would it help if I came to see him? He's always seemed a good kid to me.
utter4.28,utter,MRS. COETZEE,"Oh, would you?"
utter4.29,utter,BEN,Of course. I'll phone and we can fix a time.
desc4.30,desc,,Mrs. Coetzee smiles her gratitude.
utter4.31,utter,SUSAN,Ben! Ben!
desc4.32,desc,,"She's waving impatiently at him. He crosses back to her. Suzette's BABY is HOWLING. She rocks it back and forth, holding it at arm's length. The BABY SCREAMS. The nanny comes forward -- Suzette hands it over."
desc4.33,desc,,Mrs. Coetzee. She looked worried.
utter4.34,utter,BEN,She's having trouble with her boy. He won't come to school.
utter4.35,utter,SUSAN,So you said you'd have a word with him?
utter4.36,utter,BEN,Yes!
desc4.37,desc,,She smiles and walks him to the car affectionately.
scene5,slugline,,EXT. BEN'S HOUSE - BARBECUE - DAY
desc5.38,desc,,"The Du Toit family. Susan is bringing out the salads. Chris, her son-in-law, is at the barbecue, stinging his eyes. Ben is bouncing his grandson, little Hennie, in a small, portable pool. The black nanny sits in attendance in the shade, a towel at the ready. The good life... ... Suddenly disturbed by... Gordon and Jonathan standing uncertain at the far side of the garden; Gordon's hat pressed flat against his chest, Jonathan defiant. Susan looks up -- as do each in turn -- curious at the intrusion... then the black nanny -- and finally Ben. After a moment, Ben walks up to Gordon."
utter5.39,utter,BEN,Gordon! What are you doing here?
scene6,slugline,,INT. BEN'S KITCHEN - DAY
desc6.40,desc,,"Six cuts, like six knife gashes, revealed on the blood- stained buttocks of Gordon's son, who stands in painful, truculent embarrassment. Ben is shocked by the severity of the canning."
utter6.41,utter,GORDON,"That's not why I'm complaining, Mister Ben, sir. If he did wrong, I'd beat him myself. But he didn't."
utter6.42,utter,GORDON,He did nothing and they wouldn't listen. They wouldn't believe him.
utter6.43,utter,BEN,"I'm sorry, Gordon. But there must be a reason."
utter6.44,utter,GORDON,"He says he wasn't doing anything wrong, Mister Ben, sir. And I believe him, I know my son! It's an injustice!"
utter6.45,utter,BEN,What about the court? Didn't he state his case?
utter6.46,utter,GORDON,"What does he know about court? Before he knew, it was all over."
utter6.47,utter,BEN,I don't think there is anything we can do about it now.
desc6.48,desc,,"Outside, peering through the half-opened door, is Johan, shocked at what he sees. Ben tapes Jonathan on the head, he pulls up his shorts painfully, yet fiercely, anxious to cover himself up again."
utter6.49,utter,GORDON,We can get a lawyer to appeal.
utter6.50,utter,BEN,A lawyer? That won't heal Jonathan's buttocks.
desc6.51,desc,,Susan appears at the door.
utter6.52,utter,SUSAN,Ben!
utter6.53,utter,BEN,I'll be out in a minute.
desc6.54,desc,,"She nods, ushering Johan away from the door back outside."
utter6.55,utter,GORDON,"You don't understand, Mister Ben, sir. I don't want him to have a police record. (MORE)"
utter6.56,utter,GORDON (CONT'D),It will be there for the rest of his life and make it difficult for him to get a job in the future.
utter6.57,utter,BEN,"Don't worry, Gordon. I'm sure there'll be no record, it's such a minor case. Please don't worry."
desc6.58,desc,,Ben calls Johan from the outside.
utter6.59,utter,BEN,"Johan, get some iodine from the cupboard."
desc6.60,desc,,Johan rushes in the house.
utter6.61,utter,GORDON,"I'm not worried about the wounds. They'll heal in time, Mister Ben, sir. It's the wounds here. (slaps his chest) I worry about. Injustice... it festers."
desc6.62,desc,,Johan comes back with a small bottle of medicine.
utter6.63,utter,BEN,(to Gordon) Rub it on the wounds and it will help.
scene7,slugline,,EXT. BEN'S GATE - DAY
desc7.64,desc,,"Ben watches the black man and his son trudge down the long drive, the father's arm on the son's shouldre. At the foot of the drive the nose of an exotic Soweto cab can be seen waiting... a large butterfly painted on the hood."
scene8,slugline,,EXT. BEN'S GARDEN - DAY
desc8.65,desc,,Ben takes his place at the table. Susan brings a piece of boerwors and a mug of beer.
utter8.66,utter,SUSAN,Trouble?
utter8.67,utter,BEN,"Jonathan has been caned, by the police."
desc8.68,desc,,She places the boerwors and the beer before him.
utter8.69,utter,SUSAN,He probably deserved it.
scene9,slugline,,EXT. SOWETO SCHOOL - SOWETO UPRISING - MORNING School grounds of the Orlando Secondary School. Students
desc9.70,desc,,"are milling around in high spirits. One group is putting finishing touches to a banner reading: ""no to aparhteid education."" There are two other banners being carried around the school yard, followed by the younger children. They"
desc9.71,desc,,"""No to the Oppressor's language"""
desc9.72,desc,,"A BOY, one of the eldest, aged about 18 years calls for silence. The STUDENTS immediately obey."
utter9.73,utter,STUDENT LEADER (BOY),You all know why we are going to march.
desc9.74,desc,,The crowd shouts:
utter9.75,utter,STUDENTS,'No to Bantu education' 'No to apartheid' 'Freedom Now'...
utter9.76,utter,STUDENT LEADER,There must be discipline. We start marching from here and we'll join up with the others at the main road. Please take care of the younger ones. Let's go.
desc9.77,desc,,"The Students start marching led by one of the banners, singing a freedom song. Amongst them is Jonathan and Wellington. They are sing- ing. The march turns round one of the streets."
scene10,slugline,,CROSSROAD
desc10.78,desc,,"Several groups of students marchers converge to join the march that has already started, including Jonathan's group. There are several banners condeming Bantu"
desc10.79,desc,,"Examples: ""EQUAL EDUCATION NOW"" ""ONE MAN ONE VOTE"" ""FREE OUT LEADERS"" ""NO TO THE AFRIKAANS LANGUAGE"" There are chants of slogans as they march:"
utter10.80,utter,STUDENTS,'If we learn Afrikaans vorster must learn Zulu.' 'Bantu education! Stinks! Stinks! Stinks!' 'Equal education! Now! Now! Now!'
desc10.81,desc,,They also start singing a freedom song.
scene11,slugline,,FURTHER UP STREET
desc11.82,desc,,Three police Jeeps block the route of the march. A little distance behind are police troops carriers ('hippos'). About six police-dog-handlers in camouflage uniforms stand across the road waiting for the march to approach. As the march gets closer the students' singing increases in volume. The Soweto police COMMANDANT steps forward with a loud- speaker in hand. He confronts the lead of the march. He signals for them to stop. The dogs are straining at their leashes and their handlers taunt the leading group.
utter11.83,utter,COMMANDANT,"Now listen to me, this is an illegal demonstration. I order you to disperse immediately."
desc11.84,desc,,"The Students start singing the African national anthem 'Nkosi Sikelele.' Children of 8, 9, 10 years singing lustily with their fists clenched as everyone else. Jonathan and Wellington singing. Camouflauged police scrambling out of Jeeps with guns and tear gas grenades. They stand with the rifles pointing at the marchers. The singing continues. The Commandant confers with a junior officer who hurries to the group of policemen and gives them instructions. The ones carrying tear gas move towards front. The police start donning gas masks."
utter11.85,utter,COMMANDANT,This is the last warning. Disperse immediately or I will take action.
desc11.86,desc,,"A voice in the crowd shouts ""Banutu education..."" The crowd shouts back ""Stinks, Stinks, Stinks."" The Commandant gives a hand signal. Tear gas canisters are thrown into the crowd, the dog- handlers attack. There is panic with Students running in all directions, several choking. Some of the students start throwing stones at the police, hitting one in the face; he is helped away by a black policeman. Without warning, SHOOTING STARTS. Children drop, wounded; friends trying to help the dying and seriously wounded, others helped away. Some boys appear with dustbin lids as protection and they pelt the police with stones. The police in the 'hippos' are jumping off and pursuing Students, some SHOOTING. Woman grabs two of the running children age about 9/10 and hustles them into house. Jonathan and Wellington are running with a group. In the distance the sound of an AMBULANCE SIREN. A Jeep cuts off their escape, they turn back running as SHOTS are FIRED towards them, a little girl drops, shot in the back. Jonathan shouts to Wellington who is ahead of him."
utter11.87,utter,JONATHAN,Wellington! Wellington!
desc11.88,desc,,"Wellington looks back, sees Jonathan trying to help the little girl. He runs back to help. Another girl, aged about 17 years, is also trying to help. Two policemen suddenly appear from behind a house, they are about 18 years old. The girl straightens up and confronts the two policemen shouting hysterically."
utter11.89,utter,GIRL,"Shoot me! Come on, shoot me! Shoot me!"
desc11.90,desc,,"She slumps to the ground crying. Jonathan, Wellington and the Girl are hustled into a crowded van amid punches and kicks from the police. The van drives off leaving the injured Girl on the road, neighbors run to assist the Girl. As the van is passing, see a burning car, in the distance a building on fire; another AMBULANCE SIREN."
scene12,slugline,,A) EXT. AFRIKAANER SCHOOL
desc12.91,desc,,"B) The screams, the laughter of white kids playing at their school, massed in conviviality, Johan one. C) Behind, aboard a mower, motors Gordon, in the blue overall of a groundsman, intent in his task. OVER this white pacifist content, hear... ... GUNSHOTS, SCREAMS, TERROR."
scene13,slugline,,D) EXT. SOWETO - AFTERNOON
desc13.92,desc,,"The carnage, the dead, the wounded. The stunned bewilderment of blacks and police alike... even the latter unnerved by their own brutality."
scene14,slugline,,EXT. JOHANNESBURG SUBURB - LATE AFTERNOON
desc14.93,desc,,Soweto train rushing through suburb of Johannesburg. REVERSE SHOT FROM train.
scene15,slugline,,INT. SOWETO TRAIN CARRIAGE - LATE AFTERNOON
desc15.94,desc,,"The third-class carriage is crowded with African commuters returning to Soweto. The passengers represent all the social and economic strata of Soweto: laborers, factory workers, domestic servants, clerk secretaries, the unemployed, etc. In the carriage, Gordon, returning from work, standing. A LARGE middle-aged WOMAN is standing in the crowded aisle at one end of the carriage. She suddenly shouts:"
utter15.95,utter,LARGE WOMAN,(to man in front of her) Careful with your bag. Can't you see where it's touching?
utter15.96,utter,MAN #1,(standing half-way down carriage) Can I see where it's touching?
desc15.97,desc,,Men of today only like looking. Laughter in the carriage. Gordon is also enjoying the joke.
utter15.98,utter,MAN #2,(standing by a door) It's the electricity. What has electricity to do with it?
desc15.99,desc,,A few voices also ask same question.
utter15.100,utter,MAN #2,Today with the electricity they say: (in an affected voice) 'Darling let's not switch off the light.'
desc15.101,desc,,"Laughter and voice saying ""that's true."""
utter15.102,utter,WOMAN #1,(standing very near Gordon) I hope you have electricity with those thick glasses of yours. With your eyes you couldn't find anything.
utter15.103,utter,MAN #3,"Tell us, does your wife also wear thick glasses?"
utter15.104,utter,MAN #2,"(quickly) You should know, she's your sister."
desc15.105,desc,,There is more laughter. Suddenly a MAN jumps on his seat waving his arms -- he's about 40 years old -- in BLUE OVERALLS. He cannot take it any more. Quiet! Thulani! Thulani! The noise goes down.
utter15.106,utter,VOICE (O.S.),They say hundreds of children have died and Soweto is burning.
desc15.107,desc,,CLOSEUP - GORDON AND WOMAN talking about the information. SMARTLY-DRESSED MAN
utter15.108,utter,YOUNG WOMAN,"'They will pay, they will pay.' Since when have they been killing us, putting us in jails, starving our children to death, taking our land? Hundreds of years. And what have you men done? Only talk, talk, talk. You are not men. Sis. (Shit.) The conversations in the carriage become muted and serious."
desc15.109,desc,,"The train enters Soweto, there is smoke hanging over sev- eral parts of the township, and official buildings are on fire. Suddenly, the passengers are gripped by the seriousness of the situation. There are snatches of conversation such as: ""That's the superintendent's office on fire."" ""I hope the children are home."" ""We have to dodge bullets tonight."" ""Vorster must hang for this."" ""I hope the world hears about this."""
scene16,slugline,,INT. GORDON'S HOUSE - EVENING
desc16.110,desc,,Silence.
scene17,slugline,,A small three-room Soweto brick house -- The living room
desc17.111,desc,,"is modestly furnished. EMILY, Gordon's 40-year-old wife, is sitting on a narrow iron bedstead against the wall, clutching her youngest 2-year-old son -- Her mind is preoccupied. Sitting next to her is a ten-year-old daughter. Gordon is sitting on a chair at the table with his second eldest son, Robert -- aged 14 years -- standing by the side of the table -- sitting on an old easy chair is a Soweto resident with his 15-year-old DAUGHTER standing beside him."
utter17.112,utter,GORDON,(to girl) Are you sure it was Jonathan they took away?
desc17.113,desc,,The girl glances at her father. He coaxes her to talk.
utter17.114,utter,GIRL (DAUGHTER),"Yes, baba, with Wellington."
scene18,slugline,,INT. SOWETO POLICE STATION - DAY
desc18.115,desc,,"Black parents, waiting. At the counter with Gordon, a large black man, STANLEY, a friend -- his big easy smile is working hard on a white policeman, the station SERGEANT VAN ZYL, about to run out of patience."
utter18.116,utter,STANLEY,"No, no, I understand, Baas, but is that all the names? There's no other list somewhere?"
utter18.117,utter,SERGEANT VAN ZYL,I'm telling you. He's not in custody. Have you tried the hospital? Have you tried the mortuary?
desc18.118,desc,,Gordon sucks in his breath audibly.
utter18.119,utter,SERGEANT VAN ZYL,I'm only suggesting the possibilities.
utter18.120,utter,STANLEY,"But, what about John Voster Square?"
utter18.121,utter,SERGEANT VAN ZYL,"Look, I've tried to help you."
utter18.122,utter,STANLEY,Thank you.
desc18.123,desc,,Stanley walks up to a WOMAN.
utter18.124,utter,STANLEY,"You're here too, sis Paulina, who are you looking for?"
utter18.125,utter,WOMAN,They picked up my girl -- 13-year- old girl!
utter18.126,utter,STANLEY,(comforting her) We are all searching.
desc18.127,desc,,The policeman calls her -- she hurries to the counter.
scene19,slugline,,INT. BARAGWANATH MORTUARY - DAY
desc19.128,desc,,"A white-uniformed assistant leads a line of African parents, reeking of sadness, into a cool room where metal drawers open from the walls. Stanley and JULIUS their black lawyer -- the two men seem to be very well-known, people shake hands with them, salute them -- Gordon and Emily's sadness is tinged with anger -- they have dignity, defiance, bowed with grief as they are. Stanley's large hand is placed gently on Emily's shoulder as they examine the dead faces before them. They belong to children, some in torn, dirty clothes, others naked, some mutilated, others whole and seemingly unharmed, as if asleep, until the small, neat hole in temple or chest and the small crust of blood is brought to our attention. A woman behind them starts to scream. They look around to see her holding onto a drawer, her legs buckling. Another woman pulls her close to grieve with her. The assistant approaches them and after a soft exchange he writes a name on a tag and ties it onto the body. The woman can't, won't leave her dead child. Her friend has to pull her away. The crowd parts to let them through. Other women reach out to touch her. Gordon looks into the last drawer, Jonathan is not there. They make their way out past the other parents and a group of mourning women sitting."
scene20,slugline,,EXT. MORTUARY - DAY
desc20.129,desc,,"Gordon, Emily and their friends cross to Stanley's great white elderly Dodge, this ""etembalami"" with the big butter- fly. For, amongst other things, he is the owner and driver of a pirate taxi. They get in. Stanley pauses -- looks across at a small red VW Beetle parked nearby, waiting. He shakes his head -- the VW flashes its lights and drives off."
scene21,slugline,,INT. STANLEY'S TAXI - DAY
desc21.130,desc,,"Inside they sit in silence... recovering from the ordeal. Only Emily silently whispers ""Thank God, thank God."" After a while..."
utter21.131,utter,STANLEY,What now?
utter21.132,utter,GORDON,He is our son... we must find him.
utter21.133,utter,JULIUS,I'll make more inquiries -- John Vorster Square -- the special branch -- but I don't hold out
desc21.134,desc,,much hope.
utter21.135,utter,GORDON,"You're a lawyer, Julius!"
utter21.136,utter,STANLEY,(laughs) A black lawyer! Those Boers... the bastards'll kick him around till they lose him.
utter21.137,utter,EMILY,"What about the Baas? If he asks, they will give him an answer."
utter21.138,utter,GORDON,(bitterly) When the boy was flogged he didn't help. Why should he help him now?
scene22,slugline,,EXT. BEN'S GARDEN - MORNING
desc22.139,desc,,"Gordon is at work already -- 8 AM -- mowing the lawn. He's intense, unsmiling, burdened as he goes about his task, expertly. Sounds of BEN and JOHAN LAUGHING coming from inside."
scene23,slugline,,INT. BEN'S DEN - MORNING
desc23.140,desc,,"Ben and Johan, in robes, their hair still wet from their showers, having an imaginary boxing match. Johan has Ben on the ropes, backs him out of the house."
scene24,slugline,,EXT. BEN'S GARDEN
desc24.141,desc,,"Ben adjusts the sash of his robe and takes the offensive towards Johan, as he sees Gordon."
utter24.142,utter,JOHAN,"Hi, Gordon."
desc24.143,desc,,No response. Ben does a double-take and stops playing.
utter24.144,utter,BEN,"(to Johan) Hold it, champ."
desc24.145,desc,,"He crosses the yard to Gordon, fluffing his hair dry, Johan follows behind."
utter24.146,utter,BEN,"Gordon, you okay? No response again. Gordon continues to work. Ben and"
desc24.147,desc,,Johan exchange puzzled looks.
utter24.148,utter,JOHAN,Isn't this Jonathan's day to help you?
utter24.149,utter,BEN,"How is he, recovering?"
desc24.150,desc,,"Gordon stops, switches OFF the MACHINE, stands not looking at Ben."
utter24.151,utter,GORDON,"I don't know, Mister Ben, sir -- the police took him."
utter24.152,utter,BEN,Again?
utter24.153,utter,JOHAN,What for?
utter24.154,utter,GORDON,They arrested many. They even deny they've got him. He's disappeared...
utter24.155,utter,BEN,Disappeared? He's a child -- why didn't you tell me?
desc24.156,desc,,"Gordon just looks at him, sadly, patiently."
utter24.157,utter,BEN,Okay! I'll see what I can find out.
desc24.158,desc,,Ben walks off with Johan as Gordon STARTS the MOWER.
scene25,slugline,,INT. BEN'S STUDY - MORNING
desc25.159,desc,,Ben is talking on the phone.
utter25.160,utter,BEN,"Our gardener, yes. Probably"
desc25.161,desc,,"nothing, but he's worried."
scene26,slugline,,INT. LAWYER'S OFFICE - DAY
