segment-id,segment-type,segment-speaker,segment-text
desc122.646,desc,,"During the voice over, we see various scenes from the lives of the loners. Loners watching a dog attacking a seal in the middle of the woods, a loner fighting with another loner, a loner lying dead, loners washing themselves in the river, Loner Leader feeding the pig."
utter122.647,utter,FEMALE V.O.,"We've developed a code so that we can communicate with each other, even in front of the others, without them knowing what we are saying. A handstand means ""I miss you so much"". When we turn our"
desc122.648,desc,,"heads to the left it means ""I love"
scene123,slugline,,INT. LONER LEADER'S PARENTS' HOUSE - MORNING
desc123.649,desc,,"Loner Leader, Loner Swimmer (her supposed husband), her father and her mother, sit on the sofa. They all seem relaxed, they've been drinking and they're enjoying the stories told by the elderly couple. David and Shortsighted Woman sit in a corner."
utter123.650,utter,LONER LEADER'S FATHER,"I met your mother when we were at school. We were both top of the class in music. I was a little better than her on the guitar because my fingers are longer and stronger, which is very important when playing chords. She was better at singing. We began meeting to study together. We became a couple just a month before leaving school. If we'd waited one more month, we'd have been sent to the hotel. Can you imagine?"
utter123.651,utter,LONER SWIMMER,Let's not talk about unpleasant things. I can't wait for you both to play us some music.
desc123.652,desc,,"Loner Leader's father begins to play the guitar. Her mother, sitting beside him, begins to sing. David kisses Shortsighted Woman on the hand. She begins to stroke his hair and then french kisses him for a long time. Loner Leader, annoyed, slaps them."
utter123.653,utter,LONER LEADER,That's enough. Show my parents some
desc123.654,desc,,"respect, they're playing you music. LONER LEADER'S MOTHER"
utter123.655,utter,LONER LEADER,"No mother, it is not okay. Please,"
utter123.656,utter,LONER LEADER'S MOTHER,Do you want us to perform the same
desc123.657,desc,,"song, or something else?"
utter123.658,utter,LONER LEADER,Something else.
scene124,slugline,,EXT. TOWN STREET - MORNING
desc124.659,desc,,"Loner Leader and Loner Swimmer go on ahead. David and Shortsighted Woman follow behind. They regret being so intimate at the gathering. David tries to read Loner Leader, to figure out if she suspects them or not."
utter124.660,utter,DAVID,"We were great today, weren't we? Maybe even better than last time."
desc124.661,desc,,Loner Leader says nothing. They walk quickly.
utter124.662,utter,DAVID (CONT'D),Didn't her parents sing and play beautifully?
utter124.663,utter,SHORTSIGHTED WOMAN,It was wonderful.
desc124.664,desc,,David and Shortsighted Woman smile but seem worried.
scene125,slugline,,EXT. THE WOODS - MORNING
desc125.665,desc,,The loners eat fruit together. Loner Leader hands out bananas. They sit around a tree trunk. David covers his left eye with his hand. Shortsighted Woman does a handstand. All part of their secret code that nobody else understands. A pink flamingo stands in the distance.
scene126,slugline,,EXT. THE WOODS - EVENING
desc126.666,desc,,A LONER WOMAN reads from a notebook. Her voice is that of the female V.O. we've heard throughout the story. Loner Leader listens beside her.
utter126.667,utter,LONER NARRATOR,"""We love each other and we suit each other. That's the reason why we've decided to leave and stay together forever in the town. Tomorrow, during the hunt, we're going to disappear and everyone will think we've been captured and that we're going to be turned into dogs or canaries or something. I think the first thing I'm going to do when I get into town is buy a bathrobe and then we'll go to a"
scene127,slugline,,pool with a high diving board
desc127.668,desc,,the back but I don't think they're
desc127.669,desc,,Loner Leader stands perfectly still. She seems shocked and enraged even though she kind of suspected it.
utter127.670,utter,LONER LEADER,Read me the notes.
utter127.671,utter,LONER NARRATOR,"""Portofino: Italian fishing village and upmarket resort famous for its picturesque harbour. Population: 439. Beaches nearby: Paraggi Beach,"
utter127.672,utter,"Camogli, Chiavari and Lavagna.","Serifos: Greek island located in the western Cyclades. Population: 1,414. The Miners' Strike of 1916. In the 20th century, the mines of Serifos were exploited by the mining company ""Societe miniere Serifos-Spiliazeza"" under the direction of the German mineralogist A. Grohmann, who died in 1905""."
utter127.673,utter,LONER LEADER,That's enough. Where did you find it?
utter127.674,utter,LONER NARRATOR,In the woods. Someone probably dropped it during the hunt. Do you think it belongs to one of us?
utter127.675,utter,LONER LEADER,No. One of the hotel guests must have dropped it. None of us would have written such drivel.
desc127.676,desc,,She takes the notebook and leaves.
scene128,slugline,,EXT. THE WOODS - EVENING
desc128.677,desc,,Loner Leader goes up to Shortsighted Woman. She's reading a book by torchlight. Loner Leader sits next to her and talks to her in a really friendly tone of voice.
utter128.678,utter,LONER LEADER,You're reading? Yes.
desc128.679,desc,,SHORTSIGHTED WOMAN
utter128.680,utter,LONER LEADER,Wouldn't it be amazing if you could read without the help of glasses or contacts? Yes.
desc128.681,desc,,SHORTSIGHTED WOMAN
utter128.682,utter,LONER LEADER,I'd like to ask you a favour. SHORTSIGHTED WOMAN What sort of favour?
utter128.683,utter,LONER LEADER,"Do you have a sheet of white paper, by any chance? I want to make a list of the stuff we need from town and there's no paper left in my notebook. Shortsighted Woman looks in her backpack for her notebook."
desc128.684,desc,,"She starts rummaging, distressed."
utter128.685,utter,LONER LEADER (CONT'D),It's fine if you don't have any. I'll ask someone else.
utter128.686,utter,SHORTSIGHTED WOMAN,"But I do. I'm sure I have a notebook with white pages, it's in here somewhere, I'm sure of it."
utter128.687,utter,LONER LEADER,Don't worry. It doesn't matter. Tomorrow when we go into town I'll make a note to buy you a new one.
desc128.688,desc,,Loner Leader tenderly touches Shortsighted Woman on her shoulder and leaves.
scene129,slugline,,INT. DOCTOR'S SURGERY WAITING ROOM - MORNING
desc129.689,desc,,"Loner Leader, Loner Narrator and Shortsighted Woman are in a waiting room. The three women are seated on a sofa. There is a coffee table with past issues of various magazines in front of them. Loner Narrator reads one of these magazines."
utter129.690,utter,SHORTSIGHTED WOMAN,"It's very dangerous for three women to be alone in town together. It's highly likely the doctor will suspect us. I suggest we leave the first chance we get. Right now, in fact."
utter129.691,utter,LONER LEADER,Don't be afraid. No-one will suspect a thing. I bet you weren't expecting this surprise. Isn't it wonderful?
utter129.692,utter,SHORTSIGHTED WOMAN,"Yes, it is. Still, I'd like to think it over for a few days, and maybe I'll have the surgery done when we're next in town."
utter129.693,utter,LONER LEADER,"What's there to think about? If it's better to see clearly or to be shortsighted, is that it? That's absurd, you know that. Anyway, this doctor is the best there is, it's really very difficult to get an appointment. I called him months ago to get him to see you today."
desc129.694,desc,,A SECRETARY goes up to them and shows them the door to the doctor's office.
scene130,slugline,,INT. DOCTOR'S OFFICE - MORNING
desc130.695,desc,,"The DOCTOR sits behind his desk. Loner Leader and Shortsighted Woman sit in two chairs opposite him. This is a typical doctor's office: big wooden bookcase, a mix of oldfashioned and modern furniture, some framed prints of famous paintings. The doctor's hands are shiny and clean, like the hands of most doctors."
utter130.696,utter,DOCTOR,"This operation is what we call ""routine surgery"". It has a 90% success rate, so there's no need to worry. There are no scalpels involved, the entire procedure is done by laser. There's no reason why you shouldn't see clearly when you're swimming in the sea or when you first wake up in the morning. Contact lens solution, contact lens cases, eyeglasses, all that will be a thing of the past."
utter130.697,utter,LONER LEADER,"Thank you very much, doctor."
desc130.698,desc,,Shortsighted woman doesn't speak. She makes quite an effort to appear happy but doesn't make a very good job of it.
scene131,slugline,,INT. OPERATING THEATRE - MORNING
desc131.699,desc,,"Shortsighted Woman lies frightened on an operating table. She looks around, sweating. The Doctor anaesthetises her by intravenous injection. He then lays out various scalpels on a metal tray."
scene132,slugline,,INT. DOCTOR'S SURGERY WAITING ROOM - DAY
desc132.700,desc,,"Loner Leader sits and waits. The Doctor brings out Shortsighted Woman, whose eyes are bandaged up. Loner Narrator approaches Shortsighted Woman and gives her a hug. She then puts her jacket over Shortsighted Woman's shoulders and fixes her hair with her hands. Loner Leader pays the Doctor. He has a quiet word with Loner Leader but we cannot hear what he says very clearly."
utter132.701,utter,DOCTOR,"(whispers) She is blind, as you wished."
scene133,slugline,,EXT. THE WOODS - DAY
desc133.702,desc,,"Shortsighted Woman, kneeling on the ground, holds a knife. It looks like there's just been a fight. She's flushed red. Unable to see, her eyes still bandaged up, Shortsighted Woman threatens anyone who might be close to her with her knife. Loner Leader and Loner Narrator keep their distance."
utter133.703,utter,LONER LEADER,Throw down your knife and stand up. No.
desc133.704,desc,,SHORTSIGHTED WOMAN
utter133.705,utter,LONER LEADER,"You're being completely irrational. I understand you're upset by the unexpected results but to accuse me is very insulting to say the least. The doctor said there were some unforeseen complications after your surgery. That is all. Who would have guessed such a simple procedure could have such catastrophic results? No one. Anyway, what reason could I possibly have had to do such a hideous thing on purpose?"
utter133.706,utter,SHORTSIGHTED WOMAN,Why did you have to blind me? You could have blinded him.
utter133.707,utter,LONER LEADER,"I have no idea what you're talking about. The drugs are messing with your head. If I were you, I'd try and be a little braver about the whole thing. Now get up and give me the knife, or I'll hit you and take it by force."
desc133.708,desc,,Shortsighted Woman says nothing. She's still holding the knife in a threatening manner.
utter133.709,utter,LONER LEADER (CONT'D),Here I come.
desc133.710,desc,,"Loner Leader signals to Loner Narrator, who goes over to Shortsighted Woman. She grabs the hand holding the knife and they begin to fight. Loner Leader speaks close to Loner Narrator's head, so that the Shortsighted Woman, who is now blind, thinks she's wrestling with Loner Leader."
utter133.711,utter,SHORTSIGHTED WOMAN,I swear I'm going to kill you.
utter133.712,utter,LONER LEADER,"No, don't, please. Let go of my hair, you're hurting me."
desc133.713,desc,,Shortsighted Woman has grabbed Loner Narrator by the hair and now stabs her in the stomach. Loner Leader stays close so that it seems it's really her fighting Shortsighted Woman and groans in pain with each stab.
utter133.714,utter,LONER LEADER (CONT'D),"Have mercy, please, [groans] don't kill me. Just think [groans] that"
desc133.715,desc,,"when someone [groans] goes blind, one of their other senses [groans] is heightened. Touch, hearing,"
desc133.716,desc,,"Silence. Loner Narrator has been dead some time now. Shortsighted Woman raises herself up a little. She feels out the dead woman's body with her hands and takes her pulse. She puts down the bloody knife, wipes her hands and gets up. That is when Loner Leader begins her monologue again. Shortsighted Woman jumps in fear."
utter133.717,utter,LONER LEADER (CONT'D),"You could also catch a dog in the woods and train it to guide you. Dogs can do that, you know. I'll help you catch a dog myself. Now that I think of it, your sense of touch may already be heightened. Let's find out right now. I'll put something in your hand and you tell me what it is. Okay?"
desc133.718,desc,,Loner Leader gives her something and closes her hand around it tight.
utter133.719,utter,LONER LEADER (CONT'D),"Make a fist. Feel what it is, feel its shape. It's not difficult."
desc133.720,desc,,Shortsighted Woman falls down and screams. Loner Leader continues to squeeze her fist.
utter133.721,utter,LONER LEADER (CONT'D),What is it? What is it? I'll give you a little more time to guess but I can't wait much longer. What is it?
desc133.722,desc,,Shortsighted Woman screams. Loner Leader lets go of her hand. She opens her fist and her palm is covered blood.
utter133.723,utter,LONER LEADER (CONT'D),Time's up. It's a small razor
utter133.724,utter,blade.,(MORE)
utter133.725,utter,LONER LEADER (CONT'D),"It seems your sense of touch hasn't improved yet but it'll happen, you'll see. Now get up. If you carry on acting like this I'm going to leave you here and I don't think you'll manage to find meeting point two on your own."
scene134,slugline,,EXT. THE WOODS - DAY
desc134.726,desc,,David meets with Shortsighted Woman. She sits on a rock. She has taken the bandages off and wears sunglasses. She tries to act calm.
utter134.727,utter,DAVID,Did you have a nice time in town? Sure.
desc134.728,desc,,SHORTSIGHTED WOMAN
utter134.729,utter,DAVID,"What happened to your hand? SHORTSIGHTED WOMAN I was cutting a tree branch with a knife, and cut myself by accident. You look handsome today. Did you get your hair cut?"
utter134.730,utter,DAVID,"Thank you. No, I didn't get a haircut, I'm going to have my hair cut today. Look what I brought you."
utter134.731,utter,SHORTSIGHTED WOMAN,"Thank you very much. I'm so hungry, I'll eat it right away."
desc134.732,desc,,David is momentarily puzzled.
utter134.733,utter,DAVID,It's a bigger flashlight.
utter134.734,utter,SHORTSIGHTED WOMAN,"I'm sorry, it's so big I thought it was a rabbit. It's the biggest flashlight I've ever seen."
utter134.735,utter,DAVID,Are you ready for tonight? Shortsighted Woman decides to drop her act.
utter134.736,utter,SHORTSIGHTED WOMAN,Of course I am. I want to tell you something but please don't get angry.
utter134.737,utter,DAVID,What happened?
utter134.738,utter,SHORTSIGHTED WOMAN,I can't see a thing. I'm blind.
utter134.739,utter,DAVID,What do you mean?
utter134.740,utter,SHORTSIGHTED WOMAN,"There's no point lying to you, you'll find out sooner or later. I've lost my sight. Loner Leader blinded me this morning, in town. She must have realised that I love you and you love me and that we were going to leave for the town."
utter134.741,utter,DAVID,How did she find out?
utter134.742,utter,SHORTSIGHTED WOMAN,I don't know. I think she found my notebook.
utter134.743,utter,DAVID,What notebook?
utter134.744,utter,SHORTSIGHTED WOMAN,"My notebook. I had a notebook, where I'd write my thoughts about us, about how suited we are. I'm sorry."
utter134.745,utter,DAVID,You can't see at all?
utter134.746,utter,SHORTSIGHTED WOMAN,"No, not at all."
utter134.747,utter,DAVID,And when you asked if I'd had a haircut?
utter134.748,utter,SHORTSIGHTED WOMAN,I said it so you wouldn't realise I can't see. I'm sorry.
desc134.749,desc,,David kicks some dirt. He seems frustrated and disappointed. He turns towards Shortsighted Woman.
utter134.750,utter,DAVID,Don't cry. Crying will make your eyes hurt even more. We'll find a way.
scene135,slugline,,EXT. THE WOODS - NIGHT
desc135.751,desc,,"Some loners sleep, others listen to music around a batteryoperated lantern. David lies on the ground and seems very sad. Loner Leader goes up to David, holding a pig on a leash."
desc135.752,desc,,I'm going to hunt for truffles. Do
utter135.753,utter,DAVID,I'm a little sleepy.
utter135.754,utter,LONER LEADER,"We won't be long. I've found a spot where there are lots of them. We won't be long, I promise. Come on."
desc135.755,desc,,David gets up.
scene136,slugline,,EXT. THE WOODS - NIGHT
desc136.756,desc,,David and Loner Leader walk through the woods holding flashlights. David looks scared. He doesn't know if he's about to be punished as well.
utter136.757,utter,LONER LEADER,Thanks for coming with me. Something terrible happened today and I needed some company.
utter136.758,utter,DAVID,What happened?
utter136.759,utter,LONER LEADER,Didn't you hear what happened in town? No.
utter136.760,utter,DAVID LONER LEADER,Shortsighted Woman had an operation and went blind. It's so very sad. And then my deputy leader was killed on our way back. She was attacked by a jaguar. I'm really very upset because I was thinking of making Shortsighted Woman deputy leader as she's very capable and loyal. But then I gave it some thought and realised that now it will be difficult for her to command so many people. The next person I thought could take on such a responsibility is you.
utter136.761,utter,DAVID,Thank you very much.
utter136.762,utter,LONER LEADER,"Don't thank me. I trust you completely and I consider you one of the best loners I've seen in years. I know you won't disappoint me in any way. If something happens to me, you will take over. Take a few days to think about it and let me know when you're ready. Here's the place with the truffles. You can't imagine how many there are. I wanted you to come with me and see it for yourself. If you become deputy leader, you'll need to know where in the woods you can find lots of truffles."
scene137,slugline,,EXT. THE WOODS - MORNING
desc137.763,desc,,Shortsighted Woman lies under a tree. David stands beside her holding four carrots and a fish. Apparently he's decided not to give up yet.
utter137.764,utter,DAVID,What blood type are you?
desc137.765,desc,,SHORTSIGHTED WOMAN David thinks some more.
utter137.766,utter,DAVID,"Do you like berries? Blueberries? Blackberries? No, no."
desc137.767,desc,,SHORTSIGHTED WOMAN
utter137.768,utter,DAVID,Can you play the piano? No.
desc137.769,desc,,SHORTSIGHTED WOMAN
utter137.770,utter,DAVID,Do you speak German? No.
desc137.771,desc,,SHORTSIGHTED WOMAN
utter137.772,utter,DAVID,"I could teach you German but it would take at least a year for you to be able to speak the basics, not fluently. So there's no point. You know, German is one of the most difficult languages in the world to learn because its grammar is very complicated."
desc137.773,desc,,"David wakes up, terrified."
scene138,slugline,,"EXT. THE WOODS, MIDDAY"
desc138.774,desc,,"Shortsighted Woman lies under a tree. David goes up to her holding four carrots and a fish. He looks at her, a little lost in thought."
utter138.775,utter,DAVID,What blood type are you?
desc138.776,desc,,SHORTSIGHTED WOMAN David thinks some more.
utter138.777,utter,DAVID,"Do you like berries? Blueberries? Blackberries? No, no."
desc138.778,desc,,SHORTSIGHTED WOMAN
utter138.779,utter,DAVID,Can you play the piano? No.
desc138.780,desc,,SHORTSIGHTED WOMAN
utter138.781,utter,DAVID,Do you speak German? No.
desc138.782,desc,,SHORTSIGHTED WOMAN
utter138.783,utter,DAVID,"I could teach you German but it would take at least a year for you to be able to speak the basics, not fluently. So there's no point. You know, German is one of the most difficult languages in the world to learn because its grammar is very complicated."
scene139,slugline,,EXT. THE WOODS - MORNING
desc139.784,desc,,David hands Shortsighted Woman a plastic cup. She feels it with her fingers. SHORTSIGHTED WOMAN A plastic cup.
utter139.785,utter,DAVID,That's right. Very good.
desc139.786,desc,,He then hands her a tennis ball. A kiwi. SHORTSIGHTED WOMAN
utter139.787,utter,DAVID,"That's right. Ten out of ten, again."
desc139.788,desc,,She smiles.
utter139.789,utter,DAVID (CONT'D),I'm making a fist behind my back. Shortsighted Woman now becomes serious.
utter139.790,utter,SHORTSIGHTED WOMAN,"That can't happen. I can't thank you enough for keeping me company, for the games and activities but you know we can't do that any more. Do you want to play another round of ""touch-think-guess-win""?"
utter139.791,utter,DAVID,"No, that's enough for today. In any case, I've run out of things to test you with. Maybe tomorrow, or one of these days."
utter139.792,utter,SHORTSIGHTED WOMAN,Tomorrow morning? We'll see.
scene140,slugline,,EXT. THE WOODS - DAY
desc140.793,desc,,David sings a duet written for a man and a woman all on his own. He only sings the male part and leaves out the female part. A rabbit comes up close to him. David looks at it but does not kill it. He has no reason to hunt rabbits anymore. The rabbit hops off.
scene141,slugline,,EXT. THE WOODS - DAY
desc141.794,desc,,David walks through the woods with Loner Leader. He stops at some point and looks around.
utter141.795,utter,LONER LEADER,How do you like this place here? It's nice.
utter141.796,utter,DAVID LONER LEADER,"It is nice, and more importantly very quiet because of the rocks you have to climb to get here. Can you imagine why I brought you to such a"
scene142,slugline,,quiet place today?
utter142.797,utter,DAVID LONER LEADER,"Because I think it's the perfect spot for your grave. It was my second choice for my own grave, but in the end I decided on a place a little to the north of here because there are fewer dogs around there, digging all the time for bones."
desc142.798,desc,,She takes a small pickaxe from her pocket and gives it to him. David starts to dig. After a while he gets tired and stops. He's only managed to dig a small hole. He climbs into it but his whole body won't fit. He tries to fit as best he can.
utter142.799,utter,LONER LEADER (CONT'D),"You have to make it bigger so you'll fit better. As I said, there are a lot of dogs around here. Now cover yourself with soil. Use your hands."
desc142.800,desc,,"He scoops some soil onto his body and sits there a little, motionless."
utter142.801,utter,LONER LEADER (CONT'D),"Over your face too. You wouldn't want your face to get eaten, would you?"
desc142.802,desc,,David puts more soil over his face and body. He seems terrified.
utter142.803,utter,LONER LEADER (CONT'D),Can you see how great this spot is?
utter142.804,utter,DAVID,Yes. Thank you very much.
desc142.805,desc,,Loner leader cuts a flower and puts it on David's grave.
utter142.806,utter,LONER LEADER,"If you die before me, I'll visit you as often I can. I promise."
desc142.807,desc,,David stays motionless.
scene143,slugline,,EXT. WOODS - MORNING
desc143.808,desc,,"David walks in the forest and comes across a pony. The animal is probably the woman with the nice hair at the hotel, Nosebleed Woman's Best Friend. David stares at the pony with a mixture of confusion and anger. His face is still full of dirt."
utter143.809,utter,DAVID,"Hi, how are you? It's very nice meeting you again."
desc143.810,desc,,He cuts the pony's mane with a pair of scissors. The animal stands still. He then looks the pony in the eye and hits it across the face.
utter143.811,utter,DAVID (CONT'D),How do you like my hair now?
scene144,slugline,,"EXT. THE WOODS, MORNING"
desc144.812,desc,,Shortsighted Woman and two other loners are down on their knees trying to set a rabbit trap. David approaches them.
utter144.813,utter,DAVID,Good afternoon.
utter144.814,utter,SHORTSIGHTED WOMAN,How are you? Fine.
utter144.815,utter,DAVID SHORTSIGHTED WOMAN,I'm hungry. You haven't brought me a rabbit in days. Or things for me to touch and guess.
utter144.816,utter,DAVID,I've got good news. I've had a great idea. Have you got a minute?
utter144.817,utter,SHORTSIGHTED WOMAN,What sort of idea?
desc144.818,desc,,"David takes Shortsighted Woman aside and describes his idea to her using the physical code they've developed between them, but now describing the movements to her orally."
utter144.819,utter,DAVID,I raise my left foot. I bring my elbow to my knee and tap it twice. I bring my foot to my knee and tap it three times. I lie face down.
desc144.820,desc,,I kneel down. I touch my left cheek and then lie face up. Shortsighted Woman thinks for a minute.
utter144.821,utter,SHORTSIGHTED WOMAN,Are you sure you are prepared to do that?
utter144.822,utter,DAVID,It's the only way. She doesn't speak.
utter144.823,utter,DAVID (CONT'D),"Yes, of course I am. I wouldn't propose it if I wasn't. When?"
desc144.824,desc,,SHORTSIGHTED WOMAN
utter144.825,utter,DAVID,Tomorrow morning? SHORTSIGHTED WOMAN Tomorrow morning.
desc144.826,desc,,David leaves. Shortsighted woman smiles but seems unsure at the same time.
scene145,slugline,,EXT. THE WOODS - NIGHT
desc145.827,desc,,"David attacks a woman in the dark. He hits her. She falls unconscious and we see the face of Loner Leader. He takes a roll of gaffer tape from his pocket, ties her up and gags her mouth. He then drags her away."
scene146,slugline,,EXT. THE WOODS - NIGHT
desc146.828,desc,,"Loner Leader, tied up, lies in David's freshly dug grave. Dogs circle the shallow pit. Loner Leader tries in vain to cut herself loose."
scene147,slugline,,EXT. THE WOODS - MORNING
desc147.829,desc,,"David and Shortsighted Woman walk quickly, as if running with very small steps. David walks a little ahead, and Shortsighted Woman holds his hand and follows behind. They are wearing their civilian clothes but David's suit doesn't fit him very well. It's a little tight. They talk as they walk."
utter147.830,utter,DAVID,Are you thirsty? No.
desc147.831,desc,,SHORTSIGHTED WOMAN
utter147.832,utter,DAVID,It's not much farther. I can already see the buildings.
desc147.833,desc,,There are no buildings in sight yet.
utter147.834,utter,SHORTSIGHTED WOMAN,That's perfect.
desc147.835,desc,,"Shortsighted Woman continues to walk, a little faster now."
utter147.836,utter,SHORTSIGHTED WOMAN (CONT'D),We should speed up a little bit.
