segment-id,segment-type,segment-speaker,segment-text
scene1,slugline,,Yorgos Lanthimos & Efthimis Filippou
scene2,slugline,,EXT. COUNTRY ROAD - DAY
desc2.0,desc,,"A WOMAN drives. She is on a country road, with fields on either side. She reaches a deserted spot where three donkeys stand on the right side of the road. The woman pulls over, puts on a pair of gloves, gets out of the car, checks to see if there is anyone nearby or if she is being watched, runs towards the donkeys, shoots one of them many times over, runs back to the car and drives away. OPENING CREDITS."
scene3,slugline,,I. THE TOWN INT. TOWN HOUSE SITTING ROOM - MORNING
desc3.1,desc,,"A MAN around 45 years old, DAVID, sits on a sofa. His WIFE, around 40 years old, stands and leans against a bookcase. David is shortsighted and wears glasses. His wife also wears glasses. Next to David lies a DOG, an Alsatian. David is crying. The woman is not."
utter3.2,utter,DAVID'S WIFE,I'm really sorry. (Pause)
utter3.3,utter,DAVID,Does he wear glasses or contact lenses?
desc3.4,desc,,Glasses.
utter3.5,utter,DAVID'S WIFE,(Pause)
desc3.6,desc,,"David doesn't look at her. He stares at the floor. He swivels a glass of grapefruit juice on the table with his hand. David's wife seems sad. She looks at her watch a couple of times. She hesitates, but finally talks."
utter3.7,utter,DAVID'S WIFE (CONT'D),You'll have to hurry up. They'll be here quite soon.
desc3.8,desc,,"David leaves the room. As he goes up the stairs to the bedroom, his wife keeps talking to him."
utter3.9,utter,DAVID'S WIFE (CONT'D),"Don't worry. I'm sure you'll find the right woman really soon. A woman of average shortsightedness, just like you."
scene4,slugline,,INT. TOWN HOUSE BEDROOM - MORNING
desc4.10,desc,,"David picks out clothes from the wardrobe and gets dressed. His movements are slow and unhurried, as if he doesn't want these final preparations to end. He stares at his slippers next to the bed. He decides not to take them with him. FEMALE V.O. He decided that his brown leather shoes were the best pair to wear. He went down the stairs into the sitting room. There he saw the other man for the first and last time. He was very handsome."
scene5,slugline,,INT. TOWN HOUSE SITTING ROOM - MORNING
desc5.11,desc,,David goes down the stairs that lead to the sitting room. In the sitting room sits a MAN who is not handsome. He too is shortsighted and wears glasses. He eats a tuna-mayonnaise sandwich.
utter5.12,utter,FEMALE V.O.,He was eating a tuna-mayonnaise sandwich and wearing a pair of black lace-up shoes. She was in the
desc5.13,desc,,kitchen. David sat in the armchair and looked at his watch. His wife entered the room and left a glass of Coca-Cola Light for the man eating the sandwich and then went to the window.
scene6,slugline,,INT. TOWN HOUSE SITTING ROOM - MORNING
desc6.14,desc,,"David sits in the armchair. The two men do not look at or talk to each other. The woman enters holding a glass of CocaCola with ice and a slice of lemon. She leaves the glass in front of the man eating the sandwich and then goes over to David. She looks at her watch and then out the window. Everyone waits in silence. They all avoid making eye contact. David grabs a coffee table book from the coffee table next to him. He flicks through the pages quickly, looking at the pictures without any real interest. He just goes through the motions. The dog sits next to him. FEMALE V.O. David picked up a book called ""The Most Famous Lighthouses in the World"" and pretended to read. He"
desc6.15,desc,,The doorbell rings. The woman gets up and answers the door. Two men dressed as WAITERS enter. 50-YEAR-OLD WAITER Good afternoon.
utter6.16,utter,DAVID'S WIFE,Good afternoon.
desc6.17,desc,,50-YEAR-OLD WAITER Which of these two gentlemen is the
utter6.18,utter,DAVID'S WIFE,Not the man eating the sandwich. The man with the brown shoes.
desc6.19,desc,,David gets up. His wife goes over to him. He closes the book and leaves it on the table.
utter6.20,utter,DAVID'S WIFE (CONT'D),"You can take the book with you, if you like."
utter6.21,utter,DAVID,"No, that's okay."
desc6.22,desc,,He buttons up his jacket and fixes his hair with his hands.
utter6.23,utter,DAVID'S WIFE,Are you ready? Did you pack that pain relief cream for your back? Yes.
utter6.24,utter,DAVID DAVID'S WIFE,"You're healthy, you have many interests, you have good taste. Everything will be fine."
desc6.25,desc,,David looks at the waiters. I'm ready.
scene7,slugline,,EXT. TOWN ROAD - MORNING
desc7.26,desc,,The waiters lead David to a coach. The dog follows them and gets into the vehicle with David.
scene8,slugline,,EXT. HOTEL COACH - MORNING
desc8.27,desc,,"There are another four people sitting on the coach. Two WOMEN, a BALD MAN and a BLOND MAN. They all sit in different parts of the coach. David takes a window seat. The waiters sit together behind the WAITER-DRIVER. One of the two women gets up from her seat and goes over to where David sits. She looks at the dog and smiles at him but does not stroke him. She looks a little afraid of him. She strokes the dog above his hind legs, as far from the animal's mouth as possible."
utter8.28,utter,BISCUIT WOMAN,Your dog is so beautiful. What's his name? Bob.
utter8.29,utter,DAVID BISCUIT WOMAN,"Hello, Bob. I'm Anna. I love dogs"
desc8.30,desc,,so much. I'm sure Bob senses this and knows that we're going to get
desc8.31,desc,,One of the waiters gets up from his seat and goes over to the woman.
utter8.32,utter,30-YEAR-OLD WAITER,I'm afraid you'll have to return to your seat until we reach our
desc8.33,desc,,destination.
utter8.34,utter,BISCUIT WOMAN,"I see. How long will that be,"
scene9,slugline,,50-YEAR-OLD WAITER
desc9.35,desc,,The journey lasts a little over an
scene10,slugline,,hour.
desc10.36,desc,,The woman goes back to her seat. She opens her bag and eats a butter biscuit. She takes a quick look around at the other people in the vehicle.
scene11,slugline,,INT. HOTEL COACH - MORNING
desc11.37,desc,,David looks out the window. They have left the town and there are some woods beside the road. Suddenly a rock hits the window. David is a little shocked. He notices that the waiters do not react. David sees some people wearing ponchos running alongside the coach. They are shouting but we cannot hear what they are saying. More rocks strike the vehicle. The driver speeds up and gets away. He is completely unfazed by the incident.
scene12,slugline,,EXT. HOTEL CARPARK - MORNING
desc12.38,desc,,"The coach goes through the hotel gates and comes to a stop. The gates are opened by TWO WAITER-GUARDS, who wave to the driver. The waiters have automatic rifles slung across their backs. The hotel is a large building surrounded by a tall fence. It looks quite well-maintained and clean. The plants are in excellent condition and it is immediately clear that this is one of those large hotel complexes that can accommodate a large number of guests. At the entrance, the flags of various countries fly on tall poles. A number of people stand and watch from the room balconies. One of them waves. Biscuit Woman, filled with optimism, waves back. The passengers get off the coach. The two waiters lead them to the entrance in a line. Blond Man is slow and falls behind because of his limp. We will call him LIMPING MAN from now on."
scene13,slugline,,II. THE HOTEL NEAR THE TOWN INT. HOTEL LOBBY - DAY
desc13.39,desc,,"The hotel lobby is empty. There is nobody around apart from the RECEPTIONIST. On the walls are various classic-looking paintings, all of which show couples in a characteristic pose: the man seated in an armchair with the woman standing by his side. There are also some paintings, again in a classic style, of animals, such as a horse, a duck or some other bird. The receptionist is a young woman with a friendly face and a calm voice. Biscuit Woman and the other woman, David, Limping Man and the Bald Man stand in front of the reception desk."
utter13.40,utter,RECEPTIONIST,Welcome. Have any of you stayed in the hotel before? I have.
utter13.41,utter,BISCUIT WOMAN RECEPTIONIST,"Excellent. Then you know the rules. If you like, you can wait in the lobby. You'll find today's papers, and we can bring you tea or coffee or a soft drink."
utter13.42,utter,BISCUIT WOMAN,"I'd like to hear the rules again, if you don't mind. I mean, it's been ten years since I was last here and I've forgotten a number of things. Like the bit with the days where you hunt the people in the woods with a bow and arrow, the night of the slaughter and so on."
utter13.43,utter,RECEPTIONIST,Some things have changed. We use tranquilliser guns now instead of bows and arrows and the night of the slaughter has been done away with. I'll go over everything again with you. I don't mind at all.
utter13.44,utter,BISCUIT WOMAN,Does Toby still work here?
utter13.45,utter,RECEPTIONIST,Who's Toby?
utter13.46,utter,BISCUIT WOMAN,Toby. The outdoor bar waiter.
utter13.47,utter,RECEPTIONIST,"I don't know. You'll have to ask one of the outdoor bar staff. I'd like you all to form a line. I suggest the gentlemen allow the ladies to go first, although this isn't compulsory. You can sort this out amongst yourselves."
desc13.48,desc,,The gentlemen allow the ladies to go first.
scene14,slugline,,INT. HOTEL LOBBY - MORNING
desc14.49,desc,,"David is the last to be served. He keeps hold of the Alsatian with one hand and rests his other hand on the reception desk. The dog seems anxious, and barks. David tries to calm it down but doesn't succeed. The dog barks throughout the exchange that follows."
utter14.50,utter,RECEPTIONIST,"Well, sir, you said you've never been on your own before, correct? No, never."
desc14.51,desc,,The receptionist fills in a form.
utter14.52,utter,RECEPTIONIST,Are you allergic to any foods? No.
utter14.53,utter,DAVID RECEPTIONIST,Your last relationship lasted how many years?
utter14.54,utter,DAVID,Around twelve.
utter14.55,utter,RECEPTIONIST,Do you remember how long exactly?
desc14.56,desc,,David tries to calm and quieten the dog but fails.
utter14.57,utter,DAVID,Eleven years and one month.
utter14.58,utter,RECEPTIONIST,Any children? No.
utter14.59,utter,DAVID RECEPTIONIST,And the dog?
utter14.60,utter,DAVID,"My brother. He was here a couple of years ago but he didn't make it. You might remember him. Medium build, 48 years old, bald patch, blond."
utter14.61,utter,RECEPTIONIST,"I'm afraid not, sir. Okay, now I'd like you to write your name clearly on this form."
desc14.62,desc,,She hands him the form to fill in.
utter14.63,utter,RECEPTIONIST (CONT'D),"In capital letters. We see the golf course and squash courts, empty. On a"
desc14.64,desc,,basketball court we see a MAN and a WOMAN playing one on one.
utter14.65,utter,RECEPTIONIST (V.O.) (CONT'D),"You're not allowed to use the basketball or volleyball courts, these are only for the couples. You can use the facilities for individual sports, such as squash and golf."
desc14.66,desc,,"At the hotel bar, the BARMAN mixes a cocktail. Someone is"
scene15,slugline,,leaflet with the hotel rules.
desc15.67,desc,,"out a buffet. One of the waiters has dirtied his shirt. Another sprays his shirt with stain-removal fluid, waits for it to dry and then wipes at the stain with a cloth. Thank you."
utter15.68,utter,DAVID RECEPTIONIST,"You're in Room 101. You should always keep the dog there. You're excused from today's programme, so you can spend the rest of the day however you like."
scene16,slugline,,INT. HOTEL RECEPTION ROOM - DAY
desc16.69,desc,,"A large room, most of which is empty. In one corner of the room are four desks arranged in a row with some chairs. David gets undressed. He leaves his clothes with a WAITER and a MAID, who store them in a box. Sitting on chairs in just their underwear are the rest of the people who arrived with David on the coach. Shoe size?"
utter16.70,utter,MAID DAVID MAID,44 or 45. There are no half sizes.
desc16.71,desc,,"They give him a pair of black shoes, a pair of brown shoes and a pair of flip flops."
utter16.72,utter,MAID,Please pick a CD for the sound system in your room.
desc16.73,desc,,"There are four CDs to choose from, their titles handwritten on their cases: BEST EVER LOVE SONGS VOL. I, BEST EVER LOVE SONGS VOL. II, BEST EVER LOVE SONGS VOL. III, and BEST EVER LOVE SONGS VOL. IV. David pauses to think."
utter16.74,utter,DAVID,"Volume three, please."
utter16.75,utter,MAID,"If you need a haircut, call reception one day ahead. Smoking is not allowed. That way you'll be able to run for longer during the hunt without getting tired and your breath won't smell when you kiss. Enjoy your stay."
utter16.76,utter,DAVID BISCUIT WOMAN,"Excuse me, if we need a haircut we must call reception for an appointment the day before?"
utter16.77,utter,MAID,That's right.
desc16.78,desc,,BISCUIT WOMAN
scene17,slugline,,INT. ROOM 101 - MORNING
desc17.79,desc,,"The room is typical of a nice hotel. It has a single bed, a single chair beside a small table and a teacup upturned on its saucer on the table. The floor is carpeted. FEMALE V.O. His room number was 101. A tranquilliser gun was hanging on the wall above his bed. On the bedside table were 20 tranquilliser darts. We watch David enter the room in just his underwear. He holds the dog by its leash. David looks around the room: a single bed and a wardrobe beside it. Hanging on the wall above the bed is a tranquilliser gun. There are tranquilliser darts on the bedside table. David takes the leash off the dog and looks around."
scene18,slugline,,FEMALE V.O. (CONT'D)
desc18.80,desc,,"Inside the wardrobe were four identical khaki chino trousers, four identical claret polo shirts, a belt, socks, underwear, a blazer, four sky-blue shirts, a striped tie, a black plastic watch, a pair of sunglasses, a white bathrobe and Acqua di Parma cologne for men. He"
utter18.81,utter,FEMALE V.O. (CONT'D),But not if he was courting the same woman he was. Then they'd surely
desc18.82,desc,,"fight, he thought. He'd never reach the point where he'd kill him but they'd fight, that's for sure. David opens the wardrobe. Inside the wardrobe are four identical khaki chino trousers, four identical polo shirts, a belt, socks, underwear, a blazer, four sky-blue shirts, a striped tie, a black plastic watch, a pair of sunglasses, a white bathrobe and Acqua di Parma cologne for men. David sits down on the edge of the bed. He reads the leaflet. The dog looks out the window."
scene19,slugline,,INT. ROOM 101 - MORNING
desc19.83,desc,,"David looks out the window. The coach pulls up outside the hotel entrance. Men and women, residents of the hotel, climb out of the coach carrying unconscious people. They dump the limp bodies next to a WAITER, who counts them, and the Maid takes notes in a folder. The phone rings. David answers it. Yes?"
utter19.84,utter,DAVID BISCUIT WOMAN (O.S.),Good afternoon.
utter19.85,utter,DAVID,Good afternoon.
utter19.86,utter,BISCUIT WOMAN (O.S.),I'm calling from Room 180. I'm 45 years old but I look 40 because I follow a healthy diet and I've worked out ever since I was young. How about you?
desc19.87,desc,,"David answers, but hasn't yet figured out who he's talking to."
utter19.88,utter,DAVID,I'm 45 years old too.
utter19.89,utter,BISCUIT WOMAN (O.S.),How was your day? Fine.
utter19.90,utter,DAVID,The dog barks.
utter19.91,utter,BISCUIT WOMAN (O.S.),You have a dog? Yes.
utter19.92,utter,DAVID BISCUIT WOMAN (O.S.),I love dogs very much and they take to me right away. I think we're going to get along famously. Do you like butter biscuits? Now he gets it. Yes.
utter19.93,utter,DAVID BISCUIT WOMAN (O.S.),"I don't just like them, I like them a lot. Let's have tea or coffee sometime with biscuits. You sound like a very interesting person. Feel free to call me whenever you like, morning or night, until 10 o'clock. If I don't answer, try again. I take these pills for my thyroid gland, they told me they might make me drowsy. My room number is 180, so my phone number is 180. I have to go now because I'm feeling sleepy. We'll talk later. Goodbye."
desc19.94,desc,,He hangs up and stands there staring at the phone for a minute.
scene20,slugline,,INT. ROOM 101 - EVENING
desc20.95,desc,,"David sleeps in his clothes on the bed. The dog sleeps on the floor. There is a knock at the door. David wakes up, fixes his hair a little and answers the door. The HOTEL MANAGER and her HUSBAND enter. The Waiter and the Maid who were handing out shoes to the new guests follow them in. The Hotel Manager is a woman of around 55. She is dressed formally and her hair is carefully styled. Almost like a sculpture."
utter20.96,utter,HOTEL MANAGER,Welcome. I am the Hotel Manager and
desc20.97,desc,,this gentleman is my partner.
desc20.98,desc,,"superior rooms. That means it has a view. The Hotel Manager sits on the only chair and her partner stands beside her. They resemble the paintings on the lobby wall, only in reverse."
utter20.99,utter,HOTEL MANAGER (CONT'D),Did you read the leaflet?
utter20.100,utter,DAVID,"I did, yes."
utter20.101,utter,HOTEL MANAGER,"Very good. The fact that you'll turn into an animal if you don't manage to fall in love with another person during your stay here is not something that should upset you, or get you down. Just think, as an animal you'll have a second chance to find a companion. But even then you must be very careful. You'll need to find a companion who is the same type of animal as you are. A wolf and a penguin could never live together, nor could a camel with a hippopotamus. That would be absurd. Think about it. But there are certain combinations in particular that are worst of all - for example a bear with a fish, or a lion with an antelope, or a fox with a chicken. I realise that this discussion is a little unpleasant for you but I have a duty to prepare you psychologically for every possible outcome. Have you decided what animal you would like to be if you end up alone? A lobster."
utter20.102,utter,DAVID HOTEL MANAGER,Why a lobster? David seems to have thought this through rather well.
utter20.103,utter,DAVID,"Because a lobster lives to be over 100 years old, has blue blood just like an aristocrat and stays fertile all its life. And I like the sea very much. I water-ski and swim quite well, ever since I was a teenager."
utter20.104,utter,HOTEL MANAGER,"I must congratulate you. Usually the first thing people think of is a dog and that's why the world is full of dogs. Very few choose to become unusual animals, which is why they are endangered."
utter20.105,utter,HOTEL MANAGER (CONT'D),"Rarely does someone choose to be a tuna fish, due to the dangers it faces, or a polar bear, due to its adverse living conditions. A lobster is an excellent choice. One more thing, before we leave."
desc20.106,desc,,"The Hotel Manager signals to the Waiter and the Maid. They take David's arm, twist it behind his back and bring out a special leather accessory consisting of a belt and a bracelet"
desc20.107,desc,,"the bracelet around his wrist, so that his hand is held tight behind his back and he cannot move his arm. The belt buckle in front is then locked with a small key, so that he cannot"
utter20.108,utter,HOTEL MANAGER (CONT'D),This is so you see how easy life is when there are two of something instead of just one. We forget this from time to time. The handcuff will be removed at the same time tomorrow. But that's enough for today. I imagine it was a trying day. Good evening and enjoy your stay.
desc20.109,desc,,They leave and close the door behind them. David looks down at the belt and bracelet.
scene21,slugline,,INT. ROOM 101 - NIGHT
desc21.110,desc,,"David has placed his toothbrush on the bathroom sink and tries to squeeze toothpaste onto it. He then tries to screw the plastic cap back onto the toothpaste tube, and fails over and over again. He finally brushes his teeth."
scene22,slugline,,INT. ROOM 101 - NIGHT
desc22.111,desc,,"David stands beside his bed. He tries to pull off his trousers with the belt still on in order to free his hand. He struggles. He lies down, sucks in his belly and pushes his trousers down. After much effort, he manages to free one leg."
scene23,slugline,,INT. ROOM 101 - MORNING
desc23.112,desc,,"David sleeps in his underwear. He has managed to take his trousers off, which are still attached to his wrist by the bracelet. He is woken up by the music of a very well-known love song, ""A Groovy Kind of Love"" by Phil Collins. He looks at his watch. David gets up and sits on the side of the bed. He fixes his hair with both hands, lifting up the trousers on his wrist as he does so. He puts some water in a plate for the dog."
scene24,slugline,,INT. BREAKFAST ROOM - MORNING
desc24.113,desc,,"David enters the breakfast room wearing his trousers as normal. The breakfast room is very tidy and clean. David walks quickly, trying to find an empty table to sit at. Everybody looks at him as he walks by. He looks straight ahead the whole time. All the men wear the same clothes. All the women do too. They all sit alone. There is only one chair at each table in the room. He sees Limping Man, who was with him on the coach. He too has his arm tied behind his back. All the new arrivals wear this same accessory."
desc24.114,desc,,"His first day was one he would never forget so long as he lived. Beside the window opposite his table at breakfast sat a young woman with her head tilted back. Later he would learn that she often got nosebleeds. Next to her sat her best friend. Near the door, the woman who was with him on the coach offered a biscuit to a man drinking"
desc24.115,desc,,He then looked behind him and saw a man and a woman he would meet in
scene25,slugline,,the hotel.
desc25.116,desc,,"We see NOSEBLEED WOMAN, her BEST FRIEND who stares at her, Biscuit Woman (with one hand tied behind her back), CAMPARI MAN, LISPING MAN and HEARTLESS WOMAN, characters we will get to know later. Lisping Man is around 50 years old and Heartless Woman is around 35 and very beautiful. David spreads butter and marmalade on a slice of bread with one hand and eats. Limping Man and Lisping Man come up to his table."
utter25.117,utter,LIMPING MAN,"I've decided to go for a walk outside with my new friend. Let me introduce you. This is Robert, he"
desc25.118,desc,,stays in the room next to mine and has a lisp. David puts down his cup of coffee and offers his hand to Lisping Man. They shake hands.
utter25.119,utter,DAVID,Pleased to meet you. I'm staying in Room 101.
utter25.120,utter,LIMPING MAN,Would you like to join us? Why not.
scene26,slugline,,EXT. BEACH - MORNING
desc26.121,desc,,"Limping Man, David and Lisping Man sit on the beach. Three yachts are moored at the pier in front of them. The pier is guarded by TWO ARMED WAITERS."
utter26.122,utter,LISPING MAN,"She's much older than he is, you know that right? Yes. Yes."
utter26.123,utter,DAVID,LIMPING MAN
utter26.124,utter,LISPING MAN,"When Melanie was with Don, I could understand what brought them together clearly. He was more her age and their hair colour really matched as they were both strawberry blond. But now with Antonio it's really strange, it doesn't really make sense. I mean,"
desc26.125,desc,,"he's much darker than she is and,"
utter26.126,utter,LIMPING MAN,"Maybe there's something we don't know. I've heard he has his own business, he sells this aftershave, you know, named after himself."
utter26.127,utter,DAVID,Maybe she has an aftershave or a cologne named after her too.
utter26.128,utter,LISPING MAN,"Maybe. I don't know. What I do know is that these two are a shining example to us all. Whenever I feel down, I think of these two and tell myself that I'm going to make it, that everything's going to be alright. I keep hold of this thought and I know that my days at this place are numbered. One of these days it's going to be me on one of those three yachts."
scene27,slugline,,INT. LECTURE HALL - MIDDAY
desc27.129,desc,,"The new arrivals at the hotel sit on four chairs on stage. David sits last in line. There is a wireless microphone which they each take to speak. Behind the podium stands the Hotel Manager. Her husband stands beside, and a little behind her. All the residents attending the event are sitting very quietly. The hall is half empty. Waiters and Maids stand randomly around the room, in pairs. HOTEL MANAGER"
scene28,slugline,,"Room 206, Day 2."
utter28.130,utter,LIMPING MAN,"Hello, everyone. LIMPING MAN (V.O.) (CONT'D) My mother was left on her own when my father fell in love with a woman who was better at maths than she was. She had a postgraduate degree I think, whereas my mother was only a graduate."
scene29,slugline,,EXT. ZOO - DAY
desc29.131,desc,,"We see Limping Man walking normally, without a limp, in a zoo and holding a carrier bag. He passes various caged animals and reaches the wolf enclosure. He takes pieces of raw meat out of the bag and throws them into the enclosure at various places. The wolves draw close. LIMPING MAN (V.O.)"
desc29.132,desc,,Limping Man climbs up the enclosure fence. The wolves come over to where the man is. Only two wolves stand motionless and watch from a corner of the enclosure.
utter29.133,utter,LIMPING MAN (V.O.),"One day I decided to enter the enclosure. I really missed her and I wanted a hug. I climbed the fence and jumped in. All the wolves charged at once and attacked me. All but two, who stood motionless. My guess is that one of those two must have been my mother. The zoo guards got to me quite quickly and took me to the hospital. Thankfully I didn't lose my leg, I just have this limp, which is also my defining characteristic. (MORE) LIMPING MAN (V.O.) (CONT'D) My wife died six days ago. She was very beautiful and I loved her very much. She had a limp too."
desc29.134,desc,,We see a zoo guard hosing down the blood in the wolf enclosure. A tiger sleeps in the next cage.
scene30,slugline,,INT. LECTURE HALL - MIDDAY
