segment-id,segment-type,segment-speaker,segment-text
desc30.135,desc,,The audience applauds. Some stand. The waiters also clap. The Hotel Manager waits for the applause to peter out.
desc30.136,desc,,"Reference letters. 1 - ""He is very"
utter30.137,utter,GUEST FROM ROOM 104,"Hello, everyone. This is only my second day here but already I feel like a member of a wonderful group. My defining characteristic is that I have a very beautiful face."
desc30.138,desc,,The guest from Room 104 does not have a very beautiful face.
scene31,slugline,,INT. BALLROOM - EVENING
desc31.139,desc,,"A big room, cheerfully decorated. Instrumental music plays. Some strobe lights hang from the ceiling and there are two tables laden with sandwiches and refreshments. Couples dance. Two women sit at a table: Nosebleed Woman and her Best Friend. A woman sits on her own at the next table. She is the Heartless Woman we saw at breakfast. Biscuit Woman enters and goes over to her table."
utter31.140,utter,BISCUIT WOMAN,May I join you?
utter31.141,utter,HEARTLESS WOMAN,"No, you may not. And don't you dare come near my table again. I'm sorry."
desc31.142,desc,,Biscuit Woman goes to the table where Nosebleed Woman and her Best Friend sit.
utter31.143,utter,BISCUIT WOMAN (CONT'D),Can I sit with you?
utter31.144,utter,NOSEBLEED WOMAN,"Of course. You are third in line. I'm first, then it's my best friend, then you."
utter31.145,utter,BISCUIT WOMAN,Thank you very much.
utter31.146,utter,NOSEBLEED WOMAN,"She has no feelings whatsoever. Feels nothing at all. Just be careful around her, keep your distance. Understood? Okay."
desc31.147,desc,,NOSEBLEED WOMAN'S BEST FRIEND She's the best hunter in the hotel. Silent and very fast. She's the women's record holder. 192
utter31.148,utter,BISCUIT WOMAN,Who's the men's record holder? NOSEBLEED WOMAN An assistant university professor. He's not at the hotel any more. He left in 2009 after a year here. 282 captives.
desc31.149,desc,,David approaches their table.
utter31.150,utter,DAVID,Who's first? I am.
scene32,slugline,,NOSEBLEED WOMAN
desc32.151,desc,,"They go to dance. Romantic instrumental music plays. There are around ten couples on the dance floor. Limping Man dances with a woman next to them and Lisping Man dances towards the back. Next to them, the Hotel Manager dances with her partner. She smiles at him. He smiles back at her, trying to be polite. Nosebleed Woman's nose starts to bleed, staining David's shirt."
utter32.152,utter,NOSEBLEED WOMAN (CONT'D),"I'm sorry, I've got blood on you. But don't worry. There are many ways to remove blood stains from clothes quite easily. One is to wash the item in cold water and then rub it with sea salt. Another is to scrub the stains with cotton wool dipped in ammonia."
scene33,slugline,,NOSEBLEED WOMAN (CONT'D)
desc33.153,desc,,"The third way is to use water and flour mixed into a paste, like"
desc33.154,desc,,clothes are delicate or brightly
desc33.155,desc,,David doesn't seem to mind much. An alarm goes off. They all run from the ballroom.
scene34,slugline,,INT. ROOM 101 - EVENING
desc34.156,desc,,David quickly enters his room. He takes the tranquilliser gun off the wall and loads it. He leaves the room. The dog looks at him but doesn't react.
scene35,slugline,,INT. HOTEL COACH - EVENING
desc35.157,desc,,"David gets into the coach with the others and sits next to Limping Man, who seems very nervous."
utter35.158,utter,LIMPING MAN,I wish I didn't have this limp. I used to be very good at running but not anymore. I'm sure I'll be slower than them.
utter35.159,utter,DAVID,"If I were you, I'd think of some tricks that use the element of surprise instead of speed."
utter35.160,utter,LIMPING MAN,You're right. That's what I'll do.
desc35.161,desc,,A glimmer of hope lights his face.
scene36,slugline,,EXT. THE WOODS - EVENING
desc36.162,desc,,"We see male and female residents of the hotel get off the coach armed with their tranquilliser guns. They run off, holding powerful torches, in different directions to hunt LONERS who live in the woods. Some seem really excited. Others look bored. The waiters get off the coach and stand in front of the vehicle. The driver switches off the coach headlights."
scene37,slugline,,EXT. THE WOODS - EVENING
desc37.163,desc,,Limping Man struggles to run. He tries to climb some rocks but doesn't manage it.
scene38,slugline,,EXT. THE WOODS - EVENING
desc38.164,desc,,"Heartless Woman spots a YOUNG LONER WOMAN picking and eating nuts off a tree. The Young Loner Woman notices her and starts to run. Heartless Woman chases after her. After a hard chase she catches her and beats her into unconsciousness, then gets up and shoots her with the tranquilliser gun as well."
scene39,slugline,,EXT. THE WOODS - EVENING
desc39.165,desc,,TWO HOTEL GUESTS stand over the UNCONSCIOUS BODY of a loner. They both start to drag the body away in different directions. They then stop and hit each other.
scene40,slugline,,EXT. THE WOODS - EVENING
desc40.166,desc,,"David spots a LONER MAN in the distance trying to hide. He takes aim with his gun, shoots and misses. The Loner Man notices him and starts to run. David starts shooting over and over again. He misses and runs after him. After a while David stops, out of breath. He realises he's also out of tranquilliser darts. He sits on a rock. He looks at his watch."
scene41,slugline,,EXT. HOTEL ENTRANCE - EVENING
desc41.167,desc,,The hotel guests are lined up in front of the coach. Some of them have unconscious bodies of loners beside them. The Maid holding a folder goes to each hotel guest in turn and announces to them how many extra days' stay at the hotel they have earned based on the number of loners they have captured. She first shines a light in their faces and then on the bodies beside each guest. She comes first to Lisping Man.
scene42,slugline,,"Room 186, one loner, one extra day."
desc42.168,desc,,"38 days' stay left, plus one, 39. She then goes to Heartless Woman."
scene43,slugline,,"Room 290, four loners, four extra"
desc43.169,desc,,Next is Limping Man.
utter43.170,utter,MAID (CONT'D),Room 206. The days of your stay remain unchanged.
desc43.171,desc,,She then goes to David. He has taken no prisoners.
utter43.172,utter,MAID (CONT'D),Room 101. The days of your stay remain unchanged.
desc43.173,desc,,The Maid moves on.
scene44,slugline,,Room 302? MAID (CONT'D)
desc44.174,desc,,One of the waiters who escorted the hotel guests to the hunt answers her.
utter44.175,utter,WARDEN WAITER,"He never returned. Either he was lost in the woods, was captured or... he escaped."
utter44.176,utter,MAID,"If he doesn't show up by noon tomorrow, arrange for Room 302 to be cleaned and prepared."
scene45,slugline,,EXT. BREAKFAST ROOM - MORNING
desc45.177,desc,,"David sits alone at a table. He drinks milk. Behind him the Hotel Manager, a waiter and the Maid are speaking with Lisping Man. We cannot see him. We can only hear him."
utter45.178,utter,HOTEL MANAGER,"Are you the man in Room 186? I am, yes."
utter45.179,utter,LISPING MAN HOTEL MANAGER,I imagine you know that masturbation is not permitted in the rooms or in any other area of the hotel. Yes.
utter45.180,utter,LISPING MAN HOTEL MANAGER,And yet it has been brought to my attention that you continue to do it. [To the Maid] Had he ejaculated when you found him?
utter45.181,utter,MAID,"We don't know. There was water everywhere in the bathroom because he'd just had a shower, so we couldn't tell."
utter45.182,utter,HOTEL MANAGER,Were you looking at a photograph while you were masturbating? Yes.
desc45.183,desc,,What did the photograph show?
utter45.184,utter,LISPING MAN,A naked woman on a horse in the country.
utter45.185,utter,HOTEL MANAGER,Do you have it with you?
utter45.186,utter,LISPING MAN,No. It's in my room.
utter45.187,utter,HOTEL MANAGER,If I were in your shoes I wouldn't
desc45.188,desc,,be ogling the naked woman but the horse. I'm sure that horse used to
desc45.189,desc,,Lisping Man does not reply. We then hear screams.
utter45.190,utter,LISPING MAN,I'm sorry. I'm sorry.
desc45.191,desc,,"David pours some more milk from the bottle into his glass. His eyes don't move. He doesn't glance back. He looks down at his hand. He stares at it, trying to see if it's trembling. He looks up and then back down at his hand again."
scene46,slugline,,INT. LECTURE HALL - EVENING
desc46.192,desc,,"The Maid and the 50-Year-Old Waiter stand in the middle of the stage. The hotel guests sit and watch. The Hotel Manager talks to the audience with a microphone. Besides her stands her partner, as usual."
desc46.193,desc,,"Good evening, everyone. With the help of this reenactment, we'd like to show you what it's like when someone lives on their own and what it's like when they live with someone else. One. Man eats alone. The 50-Year-Old Waiter opens a folding table on stage and places a plate on it. He pretends to eat and then suddenly chokes, falls off his chair and pretends to die. He then gets up and sits back down on his chair. This time the Maid sits opposite him."
scene47,slugline,,HOTEL MANAGER (CONT'D)
desc47.194,desc,,"Two. Man eats with woman. The 50-Year-Old Waiter again pretends to eat and choke but this time the Maid gets up, performs the Heimlich manoeuver on him and he recovers. They then hug."
scene48,slugline,,HOTEL MANAGER (CONT'D)
desc48.195,desc,,"Three. Woman walks alone. The Maid walks across the stage. A WAITER-EXTRA stands in the middle of the stage, blocks her path, pulls down his trousers and pretends to rape her."
scene49,slugline,,HOTEL MANAGER (CONT'D)
desc49.196,desc,,Four. Woman walks with man. The 50-Year-Old Waiter and the Maid walk together across the stage and pass in front of the rapist waiter. Nothing happens. The audience applauds.
scene50,slugline,,INT. ROOM 101 - MIDDAY
desc50.197,desc,,David throws a ball for his dog to fetch. The dog looks very happy. David doesn't praise the dog when it brings the ball back. The phone rings.
utter50.198,utter,DAVID,"Hello? Yes, send them up. Thank you."
desc50.199,desc,,"David goes to the bathroom and looks at himself in the mirror. He washes his face and brushes his teeth in a rush. Someone knocks on the door. David opens the door. An ELDERLY COUPLE stand outside. They are his parents. He is hugged first by his father, then by his mother. His mother then hugs the dog."
utter50.200,utter,DAVID'S MOTHER,"Easy now, darling. Look at how he"
desc50.201,desc,,wags his tail when he looks at his
desc50.202,desc,,The dog doesn't move. His father goes to him and strokes him.
utter50.203,utter,DAVID'S MOTHER (CONT'D),Look at him. He's wagging his tail. That's what dogs do when they're
desc50.204,desc,,They sit on the edge of the bed.
utter50.205,utter,DAVID'S FATHER,This is a very nice room.
utter50.206,utter,DAVID,It's one of their superior rooms. It has a very nice view. Go to the
desc50.207,desc,,window and take a look.
utter50.208,utter,DAVID'S FATHER,It's really a very nice view.
utter50.209,utter,DAVID,"Mother, go and take a look too."
utter50.210,utter,DAVID'S MOTHER,Really very nice.
utter50.211,utter,DAVID,Would you like something to drink? I can call room service and order anything you like.
utter50.212,utter,DAVID'S MOTHER,I'd like a glass of sparkling water.
utter50.213,utter,DAVID'S FATHER,The same for me. That's a lovely idea.
desc50.214,desc,,They sit back down. David calls room service and orders the water.
utter50.215,utter,DAVID'S FATHER (CONT'D),"It's tragic what's happened to you but I think everything will be alright in the end. We're both very optimistic. You have another 26 days. That's three weeks. What am I talking about, that's more than three weeks. You should get a haircut as soon as you can. You're much more handsome with your hair short. Your sister sends her regards. She said she'd visit you the first chance she gets. She's in Switzerland with Mark. They're having a wonderful time. Skiing all day. Mark didn't know how to ski but he's doing very well. He managed to ski down the whole piste all by himself on Monday. Your mother told them that they have to be careful though. Skiing's no laughing matter. You can easily get hurt."
desc50.216,desc,,"His parents drink the sparkling water they ordered, down in one go. They then get up and put on their coats. They say their goodbyes at the door."
utter50.217,utter,DAVID'S FATHER (CONT'D),We'll come again soon.
utter50.218,utter,DAVID'S MOTHER,We'll come again soon. Give this to your brother. It's sirloin steak. Okay.
desc50.219,desc,,David closes the door and continues to play with the dog and the small ball.
scene51,slugline,,INT. BREAKFAST ROOM - MORNING
desc51.220,desc,,Limping Man and David sit alone but at adjacent tables and eat their breakfast. Limping Man looks a little sad. David tries to cheer him up.
utter51.221,utter,DAVID,New guests arrived yesterday.
utter51.222,utter,LIMPING MAN,"Yes, I saw that."
utter51.223,utter,DAVID,I think I saw a woman with a limp.
utter51.224,utter,LIMPING MAN,It's only a sprained ankle. She'll be walking normally again in a few days. I asked her.
utter51.225,utter,DAVID,That's a shame.
desc51.226,desc,,Limping Man looks back down at his plate and plays with some butter and his knife. David tries to find something to say but can't. They sit silently. The alarm bell goes off. They all get up and leave the room.
scene52,slugline,,INT. HOTEL COACH - MORNING
desc52.227,desc,,"David sits in a seat and looks out the window. One day he sat next to the woman with the biscuits on the coach. He gazed out the window, not looking"
desc52.228,desc,,trying to avoid talking to her. Biscuit Woman sits beside him.
desc52.229,desc,,"David tries to be polite but the pretence is obvious. Although she bores him, he feels sorry for her for some reason."
utter52.230,utter,BISCUIT WOMAN,I'd give anything to go for a walk with you and Bob one afternoon.
utter52.231,utter,DAVID,"The dog's not allowed out of the room, I'm afraid."
utter52.232,utter,FEMALE V.O.,"There are some excuses that no-one can argue with, he thought. Some excuses are without doubt better than others. And that was a really good one."
utter52.233,utter,BISCUIT WOMAN,These biscuits are for Bob. I want you to give them to him whenever you want to reward him for something and tell him they're from me. Thank you.
desc52.234,desc,,He looks out the window again. She doesn't give up though.
utter52.235,utter,BISCUIT WOMAN,"Can I come to your room sometime for a chat? I could give you a blow job or you could fuck me. I always swallow after fellatio and I have absolutely no problem with anal sex, if that's your thing. My exhusband always used to say I had the most beautiful thighs he'd ever seen in his life but let's not talk about him. I'm in Room 180. My telephone extension number is 180. I hope I catch some loners today because I didn't catch any the last few times. I hope you catch lots too."
utter52.236,utter,DAVID,Thank you very much.
utter52.237,utter,BISCUIT WOMAN,"If I don't find a suitable partner soon I'm going to kill myself by jumping from one of the room balconies. I want you to know that. My room is on the first floor. Room numbers that start with a ""1"" are"
desc52.238,desc,,"on the first floor, those starting"
desc52.239,desc,,and so on. So 140 is on the first
scene53,slugline,,floor and 308 is on the third floor
desc53.240,desc,,"and 190 is also on the first floor. So I'll have to jump from some room that's high up. 380, for example, or 420, that would be even better. When she stopped talking, he stared at her blankly, not knowing what to say. He then opened the window, looked out at the woods and thought once more about how good his excuse"
scene54,slugline,,EXT. THE WOODS - MIDDAY
desc54.241,desc,,"Lisping Man walks carefully through the woods. In the background we see a few hotel residents firing their tranquilliser guns and some loners running away. The animals in the woods do not react, as if they are used to the procedure, as if it is something that happens often and is not terribly interesting. On the other hand, something really exciting happens to Lisping Man. He notices a YOUNG LONER WOMAN hiding behind a tree. He stealthily approaches her and the woman, realising there's no escape, starts pleading with him to let her go. The young woman has a lisp. Lisping man notices it as soon as she starts speaking. His eyes sparkle. LISPING YOUNG WOMAN Please don't shoot me. I'll give you this rabbit. It'll make a great supper. Lisping Man shoots her. He smiles and leans over her unconscious body, pushing her hair away from her face so that he can take a better look at her."
scene55,slugline,,INT. COACH - MIDDAY
desc55.242,desc,,David and Lisping Man sit together. We hear the cries of a hotel guest injured during the hunt throughout their conversation.
utter55.243,utter,DAVID,"If you two are so well suited, I'm sure they'll make an exception."
utter55.244,utter,LISPING MAN,"I hope so. It's not just that she can't pronounce her s's, she's also blonde. Her hair is the exact same colour as mine. We'd make a perfect couple."
utter55.245,utter,DAVID,"If you're so well suited, I'm sure they'll make an exception."
scene56,slugline,,INT. INDOOR SHOOTING RANGE - MORNING
desc56.246,desc,,"Hotel guests are shooting at targets, so the room is really noisy. David, Limping Man and Lisping Man sit on a bench waiting their turn to shoot at a training target with a gun. Lisping Man looks excited. Limping Man does not look at Lisping Man, but is listening to what he says. David seems more involved in the conversation."
utter56.247,utter,LISPING MAN,"I spoke with the Hotel Manager and she said that no one should get involved with a loner. She said it's dangerous and suggested that if I really love her that much, the right thing to do is to keep her in my room as a pet. She suggested I turn her into a parrot and I agreed. The only problem is I can't open the windows in my room anymore, or when I open them I can only open them a little. Yesterday"
desc56.248,desc,,"she flew around the room and around the ceiling light and hit against the walls and windows, and when I turned the light off she kept on"
desc56.249,desc,,stopped. I guess she fell asleep.
desc56.250,desc,,A lobster.
desc56.251,desc,,Lisping Man takes a plastic bag out of his jacket pocket. Inside are various coloured feathers he has plucked from the bird. His eyes are full of joy as he opens the bag and shows the feathers to David and Limping Man.
utter56.252,utter,LISPING MAN,It's such a beautiful parrot. It
desc56.253,desc,,"has green, blue, yellow and red feathers. Take a look. Limping Man stands up and doesn't even bother to look at the contents of the bag. He puts his hands into his trouser pockets and his face turns very serious."
utter56.254,utter,LISPING MAN (CONT'D),"If I don't make it, I'm going to become a parrot. We'll live together. That's for sure. Why don't you become parrots too? Then we'll all be together."
utter56.255,utter,LIMPING MAN,"You're a complete idiot, picking one of the few animals that can talk when you have a speech impediment. You'll lisp, even as an animal. [To David] As for you, they'll catch you and throw you into a pot of boiling water until you die and then they'll crack open your claws with a tool like pliers and they'll suck out what little flesh you have with their mouths. You're pathetic, both of you. I'm not going to be turned into some animal. I'll come visit you though with my partner when we're walking together in some park or when we're swimming in the sea or when we're on one of our trips."
desc56.256,desc,,"Lisping Man punches him in the stomach. Limping Man has his hands into his pockets, and so doesn't have time to react. David separates them. The waiters do not interfere, they just watch the fight. As soon as David manages to calm them down, it's his turn to take a shot at the range."
scene57,slugline,,"Room 101, please."
desc57.257,desc,,David goes and stands beside the waiter. The waiter hands him the gun.
utter57.258,utter,TRAINER WAITER (CONT'D),It's no coincidence that the targets are always shaped like a single person and not a couple. Kill the loner. Shoot him through the heart.
scene58,slugline,,INT. ROOM 101 - MORNING
desc58.259,desc,,There's a knock on the door and the Maid enters. She makes the bed. David watches her every move. He seems on edge. He keeps out of her way while she does what she has to do.
utter58.260,utter,MAID,How many darts did you use yesterday?
desc58.261,desc,,The Maid leaves twelve tranquilliser darts on the bedside table. She notes something down in a folder.
utter58.262,utter,MAID,Please take off your trousers and sit on the bed.
utter58.263,utter,DAVID,Can we not do this today? It's awful.
utter58.264,utter,MAID,I know. But I'm afraid we have to do it. And you have no idea how much it helps you psychologically in your search for a partner.
desc58.265,desc,,David takes off his trousers and sits on the edge of the bed. The Maid sits in his lap and jiggles about. She reaches down to grab his cock every so often. David looks like he is enjoying it against his will. He closes his eyes and lays back. Suddenly she gets up.
utter58.266,utter,MAID (CONT'D),Today you became erect quicker than on other days. That's good. Have a nice day.
utter58.267,utter,DAVID,"Please, just a little bit longer."
desc58.268,desc,,The Maid takes her trolley and leaves. David gets up and runs after the maid. He's pathetic and desperate.
utter58.269,utter,DAVID (CONT'D),That's awful. Just awful.
scene59,slugline,,INT. HOTEL POOL - MORNING
desc59.270,desc,,Nosebleed Woman is swimming. Limping Man limps up to the pool's edge and dives into the water. He swims up to her. David lies on a lounger by the pool and watches them chat. Hello. Hello. LIMPING MAN
utter59.271,utter,LIMPING MAN,"Do you like to swim breast stroke, front crawl, butterfly or back stroke?"
utter59.272,utter,NOSEBLEED WOMAN,I like all the strokes equally. I perhaps like back stroke a little
desc59.273,desc,,less because I can't see where I'm going. I'm always afraid I'm going to hit a rock or bump into someone.
utter59.274,utter,LIMPING MAN,"You're absolutely right. You know, I love breast stroke. No, really, my friends often tease me and say,"
desc59.275,desc,,"""Stop swimming breast stroke all the time!"" and then they laugh."
utter59.276,utter,NOSEBLEED WOMAN,Breast stroke is great. Excellent
scene60,slugline,,exercise for the back.
desc60.277,desc,,"Nosebleed Woman turns her head away to the left. When Limping Man is certain she can't see him, he purposely knocks his head on the side of the pool and his nose starts to bleed. He acts as if nothing has happened. LIMPING MAN When swimming breast stroke, men"
desc60.278,desc,,He shows her his breast stroke kick.
desc60.279,desc,,I think your nose is bleeding.
utter60.280,utter,LIMPING MAN,"Really? Oh no, not again. This happens to me all the time. It's"
desc60.281,desc,,"very, very annoying."
utter60.282,utter,NOSEBLEED WOMAN,I know. I have a nosebleed problem too.
scene61,slugline,,INT. ROOM 101 - EVENING
desc61.283,desc,,David is sleeping. The dog is sleeping too. There's a knock at the door. David gets up and answers it. Limping Man stands outside.
utter61.284,utter,DAVID,What's the matter?
utter61.285,utter,LIMPING MAN,I want to talk to you.
utter61.286,utter,DAVID,Have a seat.
utter61.287,utter,LIMPING MAN,I came to say goodbye.
utter61.288,utter,DAVID,I saw what you did. It must have hurt.
desc61.289,desc,,The man bangs his nose against the wall and it bleeds.
utter61.290,utter,LIMPING MAN,"I'm going to ask you a question and I want you to answer me honestly. What's worse, to die of cold and hunger in the woods, to become an animal that will be killed and eaten by some bigger animal, or to have a nosebleed from time to time?"
utter61.291,utter,DAVID,To become an animal that will be killed and eaten by some bigger animal. Exactly.
desc61.292,desc,,LIMPING MAN
utter61.293,utter,DAVID,She doesn't suspect that you're lying? No.
desc61.294,desc,,LIMPING MAN Limping Man hugs David. He stains his shirt with blood.
utter61.295,utter,LIMPING MAN (CONT'D),"Don't worry about your shirt. Rub it with salt or scrub it with ammonia and it'll come out right away but whatever you do, don't use hot water. Goodnight."
scene62,slugline,,INT. HOTEL RECEPTION - NIGHT
desc62.296,desc,,"All the residents are dressed up - black tie and gowns. This is obviously a special occasion. The Hotel Manager is presenting the new couple: Limping Man and Nosebleed Woman. They are now formally together, a confirmed couple. Their life together will begin with everyone's blessing. It's like an instant wedding, a non-ritual ceremony."
desc62.297,desc,,"I'm very happy because we have a new couple. They met just two days ago but they are very much in love and perfectly suited. They both have the same problem with their noses. They bleed quite suddenly. The rest of the hotel guests clap. Nosebleed Woman's Best Friend cries. She realises she is losing her best friend forever and feels abandoned. David hesitates at first, but after a while he claps too. But he doesn't smile, and seems worried. A WAITER holds a velvet cushion with tassels, with a room key on it. The Hotel Manager hands the couple the room key."
scene63,slugline,,HOTEL MANAGER (CONT'D)
desc63.298,desc,,to a double room with a larger wardrobe and a larger bathroom. They will be allowed to use the group sports facilities and to eat together in the restaurant. They
desc63.299,desc,,weeks and then their final test
desc63.300,desc,,"The rest of the guests clap once more. Limping Man takes the microphone. He speaks loudly, with excitement and joy."
utter63.301,utter,LIMPING MAN,I'm very happy. Me too.
desc63.302,desc,,NOSEBLEED WOMAN
utter63.303,utter,HOTEL MANAGER,What are your thoughts on paedophilia?
utter63.304,utter,LIMPING MAN,I'm against it.
utter63.305,utter,NOSEBLEED WOMAN,I'm against it.
