segment-id,segment-type,segment-speaker,segment-text
utter63.306,utter,HOTEL MANAGER,Good. Do either of you have a serious illness that could prove fatal within the next five years? No.
desc63.307,desc,,LIMPING MAN
utter63.308,utter,HOTEL MANAGER,"Very good. The course of your relationship will be monitored closely by our staff and by me personally. If we notice any problems, any fighting or tension between you which you cannot resolve yourselves for whatever reason, you will be assigned children. That usually helps. A lot."
desc63.309,desc,,"The couple leaves the room, waving the audience goodbye."
scene64,slugline,,EXT. HOTEL ENTRANCE - AFTERNOON
desc64.310,desc,,"David, Nosebleed Woman, her Best Friend and Limping Man are looking at some children locked behind some railings in a large enclosure. They all wear identical clothes, tracksuits. Most of them are playing. One of the children comes up to them."
utter64.311,utter,CHILD,"Hello. My parents split up two years ago. They are both animals now. I'm ten years old. I'm very good at algebra and even better at geometry. If you choose me, I'm 100% sure you won't be disappointed. I'm seriously thinking of going to study at the university. Come closer."
desc64.312,desc,,Limping Man goes closer. The child strokes Limping Man's cheek and hair.
utter64.313,utter,CHILD (CONT'D),"I love you so much, daddy. Don't be sad, daddy, everything will be fine, you'll see. I love you so much. You're so strong, stronger than any of my classmates' dads. Here you are, daddy, here's that cold beer you asked for."
desc64.314,desc,,"David, Nosebleed Woman, her Best Friend and Limping Man leave. The child can be heard from afar."
utter64.315,utter,CHILD (CONT'D),"Look, daddy, I can ride my bike with no hands. If you don't pick me I hope you die alone and that they find your body days after you die."
utter64.316,utter,DAVID,I'm sure you won't need a child. You'll get on just fine.
scene65,slugline,,INT. HOTEL CORRIDOR - AFTERNOON
desc65.317,desc,,"Nosebleed Woman's Best Friend and David are walking back to their rooms, side by side. David looks at her, notices her figure, the way she walks, her hands, her necklace, her hair. David's voice grows softer. His tone changes."
utter65.318,utter,DAVID,You have really nice hair. NOSEBLEED WOMAN'S BEST FRIEND I know. Look.
desc65.319,desc,,Nosebleed Woman's Best Friend flicks her head to show David how smoothly her hair moves.
utter65.320,utter,DAVID,"How do you like mine? NOSEBLEED WOMAN'S BEST FRIEND Well, I think you have quite dry"
desc65.321,desc,,hair. It's also quite obvious you'll be bald in a few years.
utter65.322,utter,DAVID,There are ways that you can get your hair back. You can get hair transplants nowadays.
utter65.323,utter,NOSEBLEED WOMAN'S BEST FRIEND,"They are rarely successful. You can always tell when someone has had a hair transplant. Nice hair is not something you can get, it's something you're born with. And something that needs lifelong care. Her strictness on the hair issue ends their conversation and"
desc65.324,desc,,"David can't muster the courage to have another try. Disappointed, he now walks behind her and not next to her."
scene66,slugline,,INT. HOTEL BAR - MORNING
desc66.325,desc,,"The Hotel Manager, Nosebleed Woman and her Best Friend sit at a table. The Best Friend is crying. Nosebleed Woman is not."
utter66.326,utter,HOTEL MANAGER,"Today is your last day. As is customary, you can choose how you would like to spend your last night. (MORE)"
utter66.327,utter,HOTEL MANAGER (CONT'D),"What I always say in these situations is that it would be wise to choose something you cannot do as an animal, like read a work of classic literature or sing a song you really like. It would be silly if you chose, for example, a walk in the grounds or to have sexual intercourse with someone because these are things you can also do as an animal. But first, your best friend would like to read something she wrote for you that is really very touching."
desc66.328,desc,,Nosebleed Woman unfolds a sheet of paper.
utter66.329,utter,NOSEBLEED WOMAN,"We always sat together at school and whenever I had a problem I talked to you about it because you always gave the best advice. When we didn't manage to find dance partners at the school prom, the fact that we were together at that difficult moment gave me strength. I'm sorry things have come to this. I'm sure that if you had a few more days you'd find someone, just like I did, because you're an admirable person and you have very beautiful hair and very nice breasts. I was always jealous of your hair, you know that. You were, are, and always will be my best friend and I'll think of you often and I'll always wear those silver earrings you gave me for my birthday. I'll miss you and however many new girlfriends I make in a few days when I move back into town, I don't think I'll find another as true or as beautiful as you."
desc66.330,desc,,Nosebleed Woman's Best Friend gets up and slaps her. The Hotel Manager separates them. Nosebleed Woman's nose is bleeding from the blows. NOSEBLEED WOMAN'S BEST FRIEND
desc66.331,desc,,"By Me"" with River Phoenix, Kiefer"
scene67,slugline,,INT. ROOM 101 - DAY
desc67.332,desc,,"David looks out of his room window. The Maid holds a pony by its reins. She opens the gate to the hotel grounds and sets the pony free. Nosebleed Woman and Limping Man hug in the hotel entrance and wave goodbye to the pony. The pony doesn't run off. It just stands there, swishing its beautiful tail. The room phone rings. The display reads 180. He doesn't pick up."
scene68,slugline,,Room 101. Please leave a message
desc68.333,desc,,after the tone.
scene69,slugline,,EXT. BASKETBALL COURT - DAY
desc69.334,desc,,"David holds a bag of golf clubs and watches a couple playing basketball one on one in the court from behind the wire fence. They're having fun, they yell and kiss. David is fixated by them."
utter69.335,utter,FEMALE V.O.,"When I was at the hotel, I never much left my room. Hardly ever. I went there around four years ago. From the very first day I knew there was no one there who interested me. I used to listen to a lot of French music back then, and no one else listened to French music there. I stayed for 19 days. I let a waiter fuck me in order to help me escape. After he'd fucked me he said that he wouldn't let me go and that I'd better just go back to my room and quick. I killed him and left. I also killed a resident who tried to stop me leaving because he said he liked me."
scene70,slugline,,EXT. HOTEL GROUNDS - DAY
desc70.336,desc,,"David heads back towards his room carrying golf equipment. He sees a crowd of people. Biscuit Woman lies on the ground, covered in blood. She isn't dead and is screaming in pain. David runs towards the crowd. He sees the injured woman lying on the ground and shuts his eyes. He turns away as he can't stand to see her suffer. He spots Heartless Woman and instantly changes his facial expression. He tries hard to look calm and indifferent."
utter70.337,utter,DAVID,What happened?
desc70.338,desc,,HEARTLESS WOMAN She jumped from the balcony of Room
utter70.339,utter,DAVID,"I hope she dies right away. On second thought, I hope she suffers quite a bit before she dies. I just hope her pathetic screams can't be heard from my room because I'm thinking about having a lie down and I need peace and quiet. I was playing golf and I'm quite tired and the last thing I need is a women dying slowly and loudly."
utter70.340,utter,HEARTLESS WOMAN,I can't hear you with all this screaming. We'll talk some other time when it's quieter. Bye.
desc70.341,desc,,Heartless Woman leaves. David turns and watches her leave. TWO WAITERS arrive with a stretcher.
scene71,slugline,,INT. ROOM 101 - AFTERNOON
desc71.342,desc,,"David plays the message Biscuit Woman left on his answering machine before she committed suicide. The incident has obviously upset him. There's a hint of regret in his face. The dog stands beside him, as if listening to the message too."
utter71.343,utter,BISCUIT WOMAN (MESSAGE ON ANSWERING,"MACHINE) Hello. You're probably in the bathroom, that's why you can't hear the phone ring. There's nothing better than a cold shower in the morning. (pause) I'll call again a little later when you've finished your shower so we can chat."
desc71.344,desc,,He pushes play to hear it again. The dog wanders off.
scene72,slugline,,INT. BALLROOM - EVENING
desc72.345,desc,,Heartless Woman sits alone at a table. David goes up to her. He now seems confident.
utter72.346,utter,DAVID,May I join you?
desc72.347,desc,,Heartless Woman looks at him and doesn't answer right away.
utter72.348,utter,HEARTLESS WOMAN,I don't care. Sit if you like.
desc72.349,desc,,"Heartless Woman looks at him. They don't talk, they just watch the other couples dancing on the dance floor. He takes his jacket off and stirs the ice cubes in his glass with his index finger. She takes a cherry from a bowl and pops it in her mouth. She chokes. Her face turns red. She slumps over the table and her body jolts about in the chair. David does not react. After a while she stops her charade."
utter72.350,utter,HEARTLESS WOMAN (CONT'D),I think we're a match.
utter72.351,utter,DAVID,"Yes, I think so too. Would you like for us to live as a couple from now on?"
utter72.352,utter,HEARTLESS WOMAN,Yes. We'll inform the reception desk in the morning.
scene73,slugline,,INT. DOUBLE ROOM 202 - EVENING
desc73.353,desc,,"David, Heartless Woman and the dog enter the room. This room isn't much bigger than the old one but there is a double bed and two bathrobes in the closet. Heartless Woman gives the dog a plate with water. The dog laps up the water. David looks happy. He checks the bed and the sheets, he takes his clothes off and sits on the chair."
utter73.354,utter,DAVID,Do you normally sleep on the left or the right side of the bed?
utter73.355,utter,HEARTLESS WOMAN,The left. You?
utter73.356,utter,DAVID,The right. Perfect.
desc73.357,desc,,"They sit down on their respective sides of the bed. David takes off his trousers. Heartless Woman sits on his lap and jiggles about, just like the Maid used to do. She reaches down to grab his cock every so often. Eventually they fuck. David is behind her. During intercourse he whispers ""mmm"" and Heartless Woman stops and turns to look at him."
utter73.358,utter,HEARTLESS WOMAN,What was that sound? Did you say something?
utter73.359,utter,DAVID HEARTLESS WOMAN,Do you mind if we fuck in a
desc73.360,desc,,position where I can see your face?
utter73.361,utter,DAVID HEARTLESS WOMAN,"Turn the light on please, so I can see you better."
desc73.362,desc,,"David turns the light on and they carry on having sex, during which he tries desperately not to grimace or show signs of overexcitement. She looks him straight in the eye to see if he makes any facial expressions. During his orgasm, David tries hard to remain cold. This is the most difficult part of the process. His face is sweaty, his eyes wide open. Heartless Woman, on the other hand, is naturally expressionless. As soon as they are done, they get dressed."
utter73.363,utter,DAVID,Should I turn off the light or would you like to read?
desc73.364,desc,,I'd like to read. Does the light bother you?
utter73.365,utter,DAVID,No. I'm not bothered by light or noise. I'm a deep sleeper.
desc73.366,desc,,Heartless Woman reads. David gets under the covers and turns his back to her. He then turns again and he puts his arm around her waist. He closes his eyes and sleeps. Heartless Woman eyes him suspiciously.
scene74,slugline,,EXT. HOTEL GARDENS - MORNING
desc74.367,desc,,"David, Heartless Woman and the dog are out for a walk. The couple walk hand in hand. They meet Limping Man, who is out walking with Nosebleed Woman and a LITTLE GIRL. LIMPING MAN"
utter74.368,utter,DAVID,Good morning.
utter74.369,utter,LIMPING MAN,Congratulations.
utter74.370,utter,DAVID LIMPING MAN,"This is our daughter. Her name is Elizabeth. Elizabeth, give the nice man a kiss. He's a friend of mine."
desc74.371,desc,,The girl goes up to David. He does not bend down to be kissed.
utter74.372,utter,DAVID,The last thing I want right now is a kiss from a silly little girl.
desc74.373,desc,,"They stand there a little, motionless and then David kicks the child on her shin. She bursts into tears and Nosebleed Woman takes her into her arms."
utter74.374,utter,DAVID (CONT'D),"Don't cry, Elizabeth. You should thank me, now you'll have a limp and be more like your father. David and Heartless Woman leave with the dog."
utter74.375,utter,HEARTLESS WOMAN,"You should have punched her in the face too and bloodied her nose and then said, ""Don't cry, Elizabeth. You should thank me, now your nose is bloody and you'll be even more like your father."""
utter74.376,utter,DAVID,You're right. Why didn't I think of that.
scene75,slugline,,INT. DOUBLE ROOM 202 - DAY
desc75.377,desc,,David wakes up. Heartless Woman stands over him in a quite a threatening way.
utter75.378,utter,HEARTLESS WOMAN,Good morning.
utter75.379,utter,DAVID,Good morning.
utter75.380,utter,HEARTLESS WOMAN,"I killed your brother. I left him to die very slowly. He may not be dead yet, even as we speak. I was kicking him for ages."
desc75.381,desc,,She shows him her leg. Her shoe is covered in blood. David tries very hard not to show his true feelings - he's devastated but pretends that he's indifferent to what's happened.
utter75.382,utter,DAVID,It doesn't matter. HEARTLESS WOMAN
desc75.383,desc,,He whined a little. A strange kind of bark. Something like this. Woof
utter75.384,utter,DAVID HEARTLESS WOMAN,You really are a deep sleeper. Would you like some coffee?
utter75.385,utter,DAVID,I'd love some.
desc75.386,desc,,David goes to the bathroom.
utter75.387,utter,HEARTLESS WOMAN,"Right. I can't wait to hear the story you promised to tell me last night, about that student of yours at the university and his awful final project."
utter75.388,utter,DAVID,It's really a very funny story. His
desc75.389,desc,,name was Ryess. R-Y-E-S-S. Ryess. David splashes water on his face and then finally bursts into tears. Heartless Woman enters the bathroom and slaps him.
utter75.390,utter,DAVID (CONT'D),These aren't tears. It's just water.
utter75.391,utter,HEARTLESS WOMAN,I knew you were lying. I can't understand why you did it when you know as well as anyone that a relationship cannot be built on a lie. We're going to the Hotel Manager right now and you'll get the punishment you deserve.
utter75.392,utter,DAVID,What's the punishment for this?
utter75.393,utter,HEARTLESS WOMAN,They turn you into the animal no one wants to be. You know which
utter75.394,utter,DAVID,Yes. I know.
scene76,slugline,,INT. HOTEL CORRIDORS - EVENING
desc76.395,desc,,David and Heartless Woman are walking around to find the Hotel Manager. She holds him by the hair. The pain is visible on his face. David suddenly kicks her in the stomach and gets away. He takes the lift. She runs up the stairs.
scene77,slugline,,INT. HOTEL FIRST-FLOOR CORRIDOR - EVENING
desc77.396,desc,,"Heartless Woman reaches the first-floor corridor and tries each door one by one. She sees a door slightly ajar. She pushes it open and enters. She sees a WOMAN giving a WAITER a blow job. A second waiter, the 30-year-old waiter, is fucking her while a third, the 50-year-old waiter, sits watching in a chair and wanks off."
scene78,slugline,,INT. HOTEL STAIRS - EVENING
desc78.397,desc,,"Heartless Woman exits the room, walks down the corridor and goes up to the second floor. She is absolutely cool, she doesn't look angry or nervous, just determined."
scene79,slugline,,INT. HOTEL SECOND-FLOOR CORRIDOR - EVENING
desc79.398,desc,,Heartless Woman sees the Maid in the middle of the corridor holding a tray with a glass of Campari and soda.
desc79.399,desc,,"I saw a man running back that way. He looked frantic. As soon as Heartless Woman turns back, David emerges from one of the rooms with a tranquilliser gun and shoots her. The Maid leaves the glass of Campari next to Campari Man, who is also unconscious inside the room, and then helps David lift Heartless Woman."
utter79.400,utter,FEMALE V.O.,"At first he wanted to kill her in some horrible and painful way, like the death she had inflicted on his brother. He thought about kicking her in the stomach over and over again and then stabbing her in the same spot, in the stomach. But then he thought that there wouldn't be much point because she was already unconscious and so she wouldn't feel any pain from the kicks or the knife."
scene80,slugline,,David carefully carries Heartless Woman through the hotel
desc80.401,desc,,with the help of the Maid. They meet no one in the corridors. He takes her to the room where they transform people into animals. The Maid unlocks the door.
scene81,slugline,,INT. ANIMAL TRANSFORMATION ROOM - EVENING
desc81.402,desc,,"The Maid asks David to shoot her with the tranquilliser gun too, so that no one will suspect her of helping him. He shoots her and she falls down unconscious. David shuts the door behind him."
utter81.403,utter,FEMALE V.O.,"And so he decided to turn her into an animal. A hotel maid helped him and he never understood why she did it. I asked him many times what sort of animal he turned her into, but he always gave the same answer."
desc81.404,desc,,"""That's none of your concern"". That night he left the hotel, once and"
scene82,slugline,,INT. ROOM 101 - EVENING
desc82.405,desc,,"The Hotel Manager runs to the couple's room with two waiters. She sees the dead dog. She signals to the waiters to set off the alarm. ""You Give Love A Bad Name"" by Bon Jovi plays loudly throughout the building. He began to run without knowing where he was headed but he was"
desc82.406,desc,,start of his new life and back
scene83,slugline,,INT. HOTEL CORRIDOR - EVENING
desc83.407,desc,,David cautiously disappears down the end of the corridor. III. THE WOODS NEAR THE HOTEL
scene84,slugline,,EXT. THE WOODS - MORNING
desc84.408,desc,,"David walks very quickly, almost at a jog, as if he is too tired to run but too scared to walk. He stops beside a river. He washes his face and drinks some water. He steams up his glasses with his breath and rubs them clean with his t-shirt. He continues to walk quickly. He gets tired. The woods are quiet and the only thing you can hear is the birds and the sound of water. Everything is still and there are no animals around that he can actually see. He lies down on the ground but doesn't close his eyes. He just rests but it's obvious that he isn't relaxed at all. He used to visit these woods as a hunter but now he is the prey."
scene85,slugline,,EXT. THE WOODS - MORNING
desc85.409,desc,,"David washes his hair in the river with little bottles of shampoo he stole from the hotel. Suddenly, he hears a noise. A LONER MAN is swimming. David goes towards him. Hello."
utter85.410,utter,DAVID LONER SWIMMER,"Don't shoot. I can tell you where the others are hiding. What would you prefer, one extra day or a whole extra week, maybe even two weeks?"
utter85.411,utter,DAVID,I'm alone. I just escaped from the hotel.
utter85.412,utter,LONER SWIMMER,Did your time run out or did you lie and get caught?
utter85.413,utter,DAVID,My time ran out.
utter85.414,utter,LONER SWIMMER,Okay. I got away about a year ago. Don't worry. There's nothing to be afraid of now. So long as they don't catch you.
scene86,slugline,,EXT. THE WOODS - EVENING
desc86.415,desc,,"Loner Swimmer takes David to the LONER LEADER, a woman of around 30. She and the rest of the LONERS wear the same waterproof capes and carry backpacks with their personal belongings. David seems a little bit lost as he tries to adapt to the current situation which he wasn't prepared for. He looks around amazed at all these loners who form this autonomous community in the forest."
utter86.416,utter,LONER SWIMMER,"I found him out in the woods. He escaped from the hotel. He didn't lie, his time ran out."
utter86.417,utter,LONER LEADER,"Are you a doctor, by any chance?"
utter86.418,utter,DAVID LONER LEADER,"That's a pity, we need a doctor. We had one but they caught him a couple of months ago."
utter86.419,utter,DAVID,I'm an architect.
utter86.420,utter,LONER LEADER,That's okay. Are you on any medication these days we should know of?
utter86.421,utter,DAVID,"Well, not really. I have pain in my upper back and I often put some heat rub cream on it, but that's all. Nothing important, really."
utter86.422,utter,LONER LEADER,"Alright. So, welcome. You can stay with us for as long as you like. You can be a loner until the day you die, there's no time limit."
utter86.423,utter,DAVID,Thank you very much.
desc86.424,desc,,David smiles. Loner Leader gives him an awkward hug.
utter86.425,utter,LONER LEADER,"By the way, any romantic or sexual relations between loners are not permitted and any such acts are punished. Is that clear?"
utter86.426,utter,DAVID,Can I have a conversation with someone?
utter86.427,utter,LONER LEADER,"Of course you can, so long as there is no touching or flirting or anything like that. That applies at dance nights too. We all dance by ourselves, that's why we only play electronic music. We have dance nights every now and then."
utter86.428,utter,DAVID,That's nice.
scene87,slugline,,EXT. THE WOODS - MORNING
desc87.429,desc,,"Loner Swimmer, aided by a BANDAGED LONER with bloodied bandages over his mouth, gives David a waterproof cape, a portable CD player, a pocket-sized game of solitaire, the book ""Of Mice and Men"" by John Steinbeck and a knife. David realizes that he's going to be a proper member of this group. As these changes are taking place David acts in a mechanical way, without really thinking where all this will lead him. He looks at Bandaged Loner. There's fresh blood on his bandages."
utter87.430,utter,DAVID,What's wrong with your mouth?
utter87.431,utter,LONER SWIMMER,He can't talk. He was given the Red Kiss.
utter87.432,utter,DAVID,What's the Red Kiss?
utter87.433,utter,LONER SWIMMER,"We slashed his lips with a razor and the lips of another loner and we forced them to kiss each other. That was a few days ago now but the cuts were deep and they're still in pain. They were flirting, you know."
desc87.434,desc,,Check if the portable CD player
desc87.435,desc,,to find you some new batteries. Davis presses play on the CD player. Music plays. He pushes the stop button.
utter87.436,utter,DAVID,It works just fine.
scene88,slugline,,EXT. THE WOODS - MORNING
desc88.437,desc,,"David takes off his t-shirt and rubs Tiger Balm cream onto his upper back, as far as he can reach. He cannot reach most of his upper back properly."
scene89,slugline,,EXT. THE WOODS - MORNING
desc89.438,desc,,"Loner Leader watches a pig eating some weeds. She creeps up without making a sound and slips a lead around its neck. They start walking in the woods. Wherever the animal stops, the leader digs into the ground with her hands as if looking for something. She then gets up, wipes the soil off her hands and continues walking the pig."
scene90,slugline,,EXT. THE WOODS - MORNING
desc90.439,desc,,"The loners stand in rows and exercise. Loner Leader checks their technique, corrects them whenever necessary, and yells at the lazy ones."
utter90.440,utter,FEMALE V.O.,That was the first time I saw him.
desc90.441,desc,,He was exercising three rows behind
desc90.442,desc,,"WOMAN, exercising and looking at David. David does what the others do, a little confused but determined at the same time."
utter90.443,utter,FEMALE V.O. (CONT'D),"The next day, in town, I found out that he was shortsighted too, just like me and I knew for sure that he liked me. That night, in my sleep, I dreamt that we lived in a big house together in the town with a large, well-lit kitchen and I was"
desc90.444,desc,,wearing dark blue trousers and a
desc90.445,desc,,The loners then form a line and start jogging through the woods. A LONER gets caught in a foothold trap. He screams. The others stop but don't help him. They talk amongst themselves and give him advice on how to free himself. David watches. Shortsighted Woman stands behind him.
utter90.446,utter,LONER LEADER,"Try harder. Pull the trap open with your hands. Positive thinking is everything at times like this. Don't give up. You know, you should've been more careful. Try harder. Or they'll find you and you'll be turned into an animal. A weak one."
desc90.447,desc,,The other loners laugh.
utter90.448,utter,LONER LEADER (CONT'D),We must get a move on now. It's really too dangerous to stay here. The hotel guests could be here any minute.
utter90.449,utter,LONER LEADER (CONT'D),"If you manage to free yourself, run as fast as you can and come find us. If you manage to free yourself but think that you'll die from the bleeding, go straight to your grave. Have you dug your own grave? Yes."
scene91,slugline,,TRAPPED LONER
utter91.450,utter,LONER LEADER,Very good. That's enough for now. Let's split up and spread out. We'll rendezvous tonight at meeting point four.
scene92,slugline,,EXT. THE WOODS - MORNING
desc92.451,desc,,"David hides and hears the sound of people running and guns firing. He tries to cover himself with leaves, moving slowly and quietly, and smears mud on his face. Silly little things out of inexperience and despair. Despite his efforts, he is quickly discovered by Lisping Man, who takes aim at David with his tranquilliser gun. David puts his hands up."
utter92.452,utter,LISPING MAN,What you did to that woman was dreadful. I can't understand why you would turn her into a dog and then kick her to death.
utter92.453,utter,DAVID,She killed my brother. I would have done the same thing if she'd killed you. You're like a brother to me. You're my best friend in the whole world.
utter92.454,utter,LISPING MAN,I don't believe I'm your best friend in the whole world. You used to spend a lot more time with the
desc92.455,desc,,man with the limp.
