segment-id,segment-type,segment-speaker,segment-text
desc90.1054,desc,,Silence. Kendall takes a deep breath.
utter90.1055,utter,KENDALL,Dunbar's telling the truth.
utter90.1056,utter,OSBORNE,Wrong answer --
utter90.1057,utter,KENDALL,"We did get our stories straight, but not because we killed anyone. (pause) It was because I threatened him."
utter90.1058,utter,HARDY,Why?
utter90.1059,utter,KENDALL,Because of what I saw. (pause) Who really killed West.
desc90.1060,desc,,Osborne holds up the microrecorder and starts the tape again.
utter90.1061,utter,OSBORNE,Who killed Sergeant West?
desc90.1062,desc,,Kendall stares at the recorder. A long pause.
utter90.1063,utter,OSBORNE,"Who, Levi --"
utter90.1064,utter,KENDALL,Childs.
utter90.1065,utter,HARDY,How do you know?
utter90.1066,utter,KENDALL,Because I was standing next to him.
desc90.1067,desc,,"He pauses, taking a shaky sip of water."
utter90.1068,utter,KENDALL,"I was in on the PX thing. He and Mueller and me, we were making thousands. West found out. Childs said we were just gonna scare him -- use my Dad's clout. I had this whole speech prepared about how if he ratted us, his career was over. We met him in the creek bed but before I said anything..."
scene91,slugline,,EXT. LOUISIANA BAYOU -- CREEK BED -- LAST NIGHT
desc91.1069,desc,,"West stands in front of Childs and Kendall, facing them. Kendall opens his mouth to speak, but Childs steps forward and raises his rifle, FIRING..."
scene92,slugline,,INT. KENDALL'S HOSPITAL ROOM -- PRESENT DAY
utter92.1070,utter,KENDALL,"I swear, I didn't know he was gonna do it. After, he told me we were gonna pin it on Pike, one of our biggest customers."
scene93,slugline,,INT. CABIN -- LAST NIGHT
desc93.1071,desc,,"As they TIE PIKE to the, chair."
utter93.1072,utter,KENDALL (V.O.),Nobody'd believe the word of a black junkie ex-con against ours.
desc93.1073,desc,,"Childs gives Kendall a look that says ""Stay quiet""."
utter93.1074,utter,KENDALL (V.O.),"He told me I'd better keep quiet, or I'd end up the same as West."
desc93.1075,desc,,"Pan over to Dunbar, who binds his friend, sadly."
utter93.1076,utter,KENDALL (V.O.),"Dunbar didn't know anything about any of it. Everything he told you was true, except after..."
scene94,slugline,,EXT. LOUISIANA BAYOU -- LAST NIGHT
desc94.1077,desc,,"Dunbar pulls Kendall from the cabin's wreckage. As Kendall begins to talk to him, Dunbar's eyes widen in shock..."
utter94.1078,utter,KENDALL (V.O.),"I told him what had really happened to West. Told him to keep quiet about it or I'd destroy him. Because if it came out that I was involved with the whole PX scam, my father would be finished."
scene95,slugline,,INT. KENDALL'S HOSPITAL ROOM -- PRESENT DAY
utter95.1079,utter,KENDALL,"I scared Dunbar into silence. He's been trying to cover for me the whole time. We got here, you came to see me... I didn't know if I could trust him with that kind of secret --"
utter95.1080,utter,OSBORNE,So you framed him. The same way Childs was going to frame Pike.
desc95.1081,desc,,Kendall nods. Crying a little.
utter95.1082,utter,HARDY,"Little advice, Levi, next time you frame a guy, pick someone who can't defend themselves."
desc95.1083,desc,,Kendall says nothing.
utter95.1084,utter,OSBORNE,What happened with Nunez?
utter95.1085,utter,KENDALL,He came after us. And I told Dunbar he had to kill him...
scene96,slugline,,EXT. CLEARING -- EARLIER THAT MORNING
desc96.1086,desc,,"The helicopter, hovering overhead. Dunbar, carrying Kendall, spinning his rifle to face Nunez, sixty yards away. Dunbar hesitates before firing, not wanting to..."
utter96.1087,utter,KENDALL,Do it!
desc96.1088,desc,,Dunbar's rifle ERUPTS...
scene97,slugline,,INT. KENDALL'S HOSPITAL ROOM -- PRESENT DAY
utter97.1089,utter,KENDALL,And he did.
desc97.1090,desc,,"Kendall finishes, wiping his face. Osborne turns to Hardy."
utter97.1091,utter,OSBORNE,That's how you do good cop/bad cop.
desc97.1092,desc,,Hardy smiles and gets up. Walking slowly to Kendall's bed.
utter97.1093,utter,HARDY,"Childs did it, huh?"
desc97.1094,desc,,"Kendall nods, still a little teary."
utter97.1095,utter,HARDY,"First Pike, then Mueller, now Childs?"
desc97.1096,desc,,"When are we getting to the others? When are we gonna hear about Nunez? FLASHCUT TO -- NUNEZ, in the creek bed, SHOOTING WEST."
utter97.1097,utter,HARDY,Or Dunbar?
desc97.1098,desc,,"FLASHCUT TO -- Now DUNBAR, SHOOTING WEST."
utter97.1099,utter,HARDY,"Or you, Levi? When is it finally going to come out that you were the one who killed him?"
desc97.1100,desc,,"FLASHCUT TO -- KENDALL, SHOOTING WEST."
utter97.1101,utter,KENDALL,I didn't --
utter97.1102,utter,HARDY,But you can't prove it! You can't prove anything until we find the bodies!
desc97.1103,desc,,"Kendall, crying harder now, beginning to shake."
utter97.1104,utter,HARDY,"You lied to us, Levi, you're going to the gas chamber unless you tell us where to find them!"
utter97.1105,utter,KENDALL,I don't know --
utter97.1106,utter,HARDY,Where are they!
utter97.1107,utter,KENDALL,Maybe --
utter97.1108,utter,HARDY,MAYBE WHAT --
utter97.1109,utter,KENDALL,Maybe he...
desc97.1110,desc,,"And then, his mouth SLAMS SHUT. Teeth cracking together over and over again like a metronome on speed, and his body JERKS HORRIBLY, going horizontal, SHAKING VIOLENTLY! Osborne, leaping to her feet."
utter97.1111,utter,OSBORNE,Get something between his teeth!
desc97.1112,desc,,"Hardy grabs a fork from the bedside table and tries to shove it into Kendall's chattering mouth. His teeth, CLAMPING DOWN on the metal and Hardy's hand, drawing blood."
utter97.1113,utter,HARDY,Shit!
desc97.1114,desc,,The Nurse bursts into the room.
utter97.1115,utter,NURSE,What is --
utter97.1116,utter,OSBORNE,He's an epileptic!
desc97.1117,desc,,"The Nurse runs to the bed, pushing Hardy aside. As more MEDICAL PERSONNEL runs into the room, they usher Hardy and Osborne to the door."
utter97.1118,utter,DOCTOR,You're going to have to wait outside --
utter97.1119,utter,OSBORNE,He's a witness!
utter97.1120,utter,DOCTOR,"It doesn't matter, outside --"
utter97.1121,utter,KENDALL,F-F-F-F-F-F-Fuh-
desc97.1122,desc,,"Osborne tries to move to him, but the Doctor blocks her path."
utter97.1123,utter,OSBORNE,He's trying to say something --
utter97.1124,utter,DOCTOR,"Out, NOW."
utter97.1125,utter,KENDALL,Fuh-Fuh-Fuh-Fuh-Fuh-
desc97.1126,desc,,Osborne knocks the Doctor down and runs to Kendall's side.
utter97.1127,utter,DOCTOR,SECURITY!
desc97.1128,desc,,"Kendall looks up, focusing on Osborne, a slight moment of clarity in his eyes."
utter97.1129,utter,KENDALL,Fuh-Fucking Pike.
desc97.1130,desc,,And relapses into ANOTHER FIT as SECURITY GUARDS drag Hardy and Osborne from the room.
scene98,slugline,,INT. BASE HOSPITAL -- WAITING ROOM -- DAY
desc98.1131,desc,,"Later. Hardy and Osborne sit in silence, eyes downcast. Waiting. Hardy pulls his last cigarette from the pack, lights it, crumples the pack and tosses it into a garbage can."
utter98.1132,utter,HARDY,I pushed him too hard.
utter98.1133,utter,OSBORNE,You couldn't have known --
utter98.1134,utter,HARDY,"Yeah, I could've. Should've."
utter98.1135,utter,OSBORNE,You wanted to get the truth.
utter98.1136,utter,HARDY,"No, I didn't. I wanted to humiliate him. For what he did to Dunbar. For fucking over the little guy."
utter98.1137,utter,OSBORNE,You mean the falsely accused?
desc98.1138,desc,,Hardy looks up at her and nods.
utter98.1139,utter,OSBORNE,You wanted to break him.
utter98.1140,utter,HARDY,Yeah.
utter98.1141,utter,OSBORNE,So did I.
desc98.1142,desc,,"She looks back to the floor. Hardy takes a drag from the cigarette, and then tosses that away too. The door opens and Styles walks into the room. Somber."
utter98.1143,utter,STYLES,It's over. Time of death was 4:42. JAG's been notified and I called the Senator myself. My report will reflect that his medical condition made this unavoidable... you two had no culpability in the matter.
utter98.1144,utter,HARDY,That's horseshit and you know it.
utter98.1145,utter,STYLES,Maybe. But it's my fault and I'll carry it.
desc98.1146,desc,,He sighs and takes a seat next to them.
utter98.1147,utter,STYLES,"We found the cabin. Demolished, like they said. No bodies. Hurricane like that coulda scooped 'em up, dropped them down two counties over. We'll find them."
desc98.1148,desc,,Hardy says nothing.
utter98.1149,utter,STYLES,You think you could explain all this to me?
utter98.1150,utter,HARDY,"I wouldn't know where to start. (pause) I guess it was about one man framing another. He thought if the other guy got blamed, people would over look his own wrong doings."
desc98.1151,desc,,"Styles nods, understanding."
utter98.1152,utter,OSBORNE,What happens to Dunbar now?
utter98.1153,utter,STYLES,"Gets on his plane in ten minutes, which means you two are done. You'll understand if I don't walk you out."
desc98.1154,desc,,Hardy gets up to go and then stops. Realizing something.
utter98.1155,utter,HARDY,"They're taking your command, aren't they?"
utter98.1156,utter,STYLES,The Senator...
desc98.1157,desc,,He points to Kendall's hospital room.
utter98.1158,utter,HARDY,"I'm sorry, Bill."
utter98.1159,utter,STYLES,Don't be. I'm not cut out to deal with the West's of the world.
utter98.1160,utter,HARDY,"You're a good soldier, Bill."
utter98.1161,utter,STYLES,I thought you said that wasn't a compliment.
desc98.1162,desc,,Hardy smiles.
utter98.1163,utter,HARDY,This time it is.
scene99,slugline,,EXT. FORT MCKINLEY -- PARADE GROUNDS -- EVENING
desc99.1164,desc,,"The sun, beginning to dip in the sky, as Hardy and Osborne exit the hospital."
utter99.1165,utter,OSBORNE,Your car's in the motor pool. I'll walk you over.
desc99.1166,desc,,"They walk in silence, for a bit."
utter99.1167,utter,OSBORNE,So what now?
utter99.1168,utter,HARDY,"Now I go home, get drunk, and try and forget this ever happened."
utter99.1169,utter,OSBORNE,Think it'll work?
utter99.1170,utter,HARDY,Nah.
desc99.1171,desc,,"They pass a GROUP OF CADETS doing drills. Hardy, watching them. Almost looking wistful."
utter99.1172,utter,OSBORNE,"You know, you never told me why you left the army."
utter99.1173,utter,HARDY,"It dawned on me one day that we were supposed to be a nation founded on the principle of questioning authority... and all I did here was follow orders. It didn't add up. Plus, I got kicked out."
utter99.1174,utter,OSBORNE,For what?
utter99.1175,utter,HARDY,That's gonna stay my secret.
scene100,slugline,,INT. MOTOR POOL -- EVENING
desc100.1176,desc,,Hardy and Osborne make their way towards Hardy's car.
utter100.1177,utter,OSBORNE,We were close to something with Kendall.
utter100.1178,utter,HARDY,"Maybe... Maybe we were nowhere near. Sometimes mysteries stay mysteries. (pause) I haven't by any chance grown on you, have I?"
utter100.1179,utter,OSBORNE,No.
utter100.1180,utter,HARDY,"Good, just making sure."
desc100.1181,desc,,Osborne turns to the DUTY SERGEANT.
utter100.1182,utter,OSBORNE,We're going need a vehicle release.
desc100.1183,desc,,"The Sergeant nods, walking up with a clipboard."
utter100.1184,utter,SERGEANT,"Sign here and here. (recognizing them) Hey, ain't you the folks workin' on that whole hulabaloo from last night?"
utter100.1185,utter,OSBORNE,Yeah.
utter100.1186,utter,SERGEANT,Terrible tragedy. One of those Section Eight boys worked in here. Pike. Heard he got out okay.
desc100.1187,desc,,Hardy signs the clipboard and hands it back.
utter100.1188,utter,HARDY,"Hate to be the bearer of bad news, Sergeant, but he didn't make it."
desc100.1189,desc,,The Sergeant scratches his head.
utter100.1190,utter,SERGEANT,Funny. I swear I saw them bring him and the smaller guy in this morning.
utter100.1191,utter,OSBORNE,"No, no that was Cadet Dunbar --"
utter100.1192,utter,SERGEANT,"You mean Ray Dunbar? Well, that ain't right."
utter100.1193,utter,HARDY,Why not?
utter100.1194,utter,SERGEANT,"I saw 'em get off the chopper. White guys, right? Two"
utter100.1195,utter,OSBORNE,So?
utter100.1196,utter,SERGEANT,"Ma'am, Ray Dunbar's black."
desc100.1197,desc,,Hardy and Osborne stare at him. Shocked. A beat.
utter100.1198,utter,SERGEANT,Did I say something wrong --
utter100.1199,utter,HARDY,(to Osborne) What runway's that transport leaving from?
utter100.1200,utter,OSBORNE,Four --
utter100.1201,utter,HARDY,Get in.
scene101,slugline,,EXT. FORT MCKINLEY -- PARADE GROUNDS -- EVENING
desc101.1202,desc,,"CADETS SCATTER as Hardy's car ROARS OUT OF THE MOTOR POOL, PEELING across the grass towards the far side of the base! Hardy, white knuckling the wheel, doing his best to steer around anyone who can't get out of the way in time."
scene102,slugline,,EXT. FORT MCKINLEY RUNWAY FOUR -- EVENING
desc102.1203,desc,,"A Large TRANSPORT PLANE sits on the runway waiting as three M.P.'s and a JAG LAWYER lead Dunbar/Pike (who, for purposes of continuity, we will continue to call DUNBAR) out to it. The SQUEAL OF TIRES as Hardy's car SLIDES around the corner of the nearest building and SCREECHES to a halt by the plane. Hardy and Osborne, leaping out, running towards Dunbar and the M.P.s."
utter102.1204,utter,OSBORNE,We need to talk to him --
utter102.1205,utter,JAG LAWYER,"Sorry, Officer, we have a schedule to keep --"
utter102.1206,utter,OSBORNE,We need to talk to him now.
desc102.1207,desc,,Hardy grabs Dunbar by the arm.
utter102.1208,utter,HARDY,We're not finished yet --
utter102.1209,utter,DUNBAR,You wanna bet?
utter102.1210,utter,JAG LAWYER,"M.P.'s, escort this man off the base!"
utter102.1211,utter,DUNBAR,"(smiling) Sorry, detectives. Time's up."
desc102.1212,desc,,"As the M.P.'s grab Hardy, dragging him away. Osborne, trying to stop them. Dunbar, climbing the stairs onto the plane... Osborne pulls her SIDEARM, levelling it at him as Hardy yells:"
utter102.1213,utter,HARDY,"James Randall Pike, COME ON DOWN!"
desc102.1214,desc,,Dunbar stops at the hatchway. Slowly turning back to them. Seeing the gun. The M.P.'s release Hardy. Nobody moves.
utter102.1215,utter,OSBORNE,Let's go have a talk.
scene103,slugline,,INT. COFFEE ROOM -- EVENING
desc103.1216,desc,,"Hardy and Osborne roughly lead Dunbar into the room, the JAG Lawyer trailing behind, shouting:"
utter103.1217,utter,JAG LAWYER,This is your entire career here --
utter103.1218,utter,OSBORNE,Fuck off.
desc103.1219,desc,,She slams the door and BARRICADES it. Turns to Hardy.
utter103.1220,utter,OSBORNE,We got maybe three minutes till they break it down.
utter103.1221,utter,HARDY,Right back where we started.
utter103.1222,utter,DUNBAR,You want to talk about baseball now?
desc103.1223,desc,,Hardy practically throws Dunbar into a chair.
utter103.1224,utter,HARDY,"No more games, right, Pike? It was you who West singled out..."
desc103.1225,desc,,"FLASHCUT TO -- WEST on the parade grounds, now strangling DUNBAR on the first day..."
utter103.1226,utter,HARDY,You who got hooked by Mueller's morphine...
desc103.1227,desc,,FLASHCUT TO -- Now DUNBAR in the showers as MUELLER hands him a syringe...
utter103.1228,utter,HARDY,You who did it all.
desc103.1229,desc,,"Hardy steps forward and RIPS OPEN Dunbar's right sleeve, revealing the TRACK MARKS."
utter103.1230,utter,HARDY,"You wanted revenge on West, revenge on them all, so you killed them."
scene104,slugline,,INT. CABIN -- LAST NIGHT
desc104.1231,desc,,"Dunbar standing in the Cabin; Mueller, Childs, and Pike, dead at his feet."
utter104.1232,utter,HARDY (V.O.),"But that wasn't enough. You needed a new identity, because no one was going to believe James Randall Pike, convicted felon, had acted so nobly in the face of danger -- you needed a name people could trust, one that hadn't been to jail, one that hadn't publicly been West's bitch boy."
desc104.1233,desc,,"He stares down at the bodies in the cabin, his eyes focusing on the black man's uniform. The name on it reads -- ""DUNBAR"". As he reaches for it..."
scene105,slugline,,INT. COFFEE ROOM -- PRESENT EVENING
utter105.1234,utter,OSBORNE,"You kept Kendall alive to corroborate your story and he did it all they way up to the end. You even gave him his own motive in case we decided to burn him, too."
utter105.1235,utter,DUNBAR,"Can't do that now, though, can you?"
utter105.1236,utter,HARDY,"You walked into the army a convicted felon with a sentence of five years in a uniform and were going walk out eight weeks later with a different name, a clean record, and an honorable discharge -- a guy who did ""everything he could"" to save his friends."
desc105.1237,desc,,Dunbar looks at them. One to the other. Slowly.
utter105.1238,utter,DUNBAR,"Is that what I did, now? And of course, you can prove all of it."
utter105.1239,utter,OSBORNE,We can prove that you're not Ray Dunbar. Impersonating a fellow Cadet is a court-martial in and of itself --
utter105.1240,utter,DUNBAR,"Did I ever claim I was Raymond Dunbar? Was I ever told to state my name rank and serial number for the record? No. You assumed who I was, because I was wearing this uniform. Don't believe me?"
desc105.1241,desc,,He reaches under the table and rips out the HIDDEN MICROPHONE.
utter105.1242,utter,DUNBAR,Check your tapes.
desc105.1243,desc,,Hardy and Osborne exchange an uneasy glance.
utter105.1244,utter,HARDY,We don't need the tapes --
utter105.1245,utter,DUNBAR,"Oh, you don't? What else do you have on me? You haven't found any bodies yet, have you?"
utter105.1246,utter,HARDY,We've found all of them.
desc105.1247,desc,,Dunbar chuckles at the bluff.
utter105.1248,utter,DUNBAR,"Ohhhh, I don't think so..."
utter105.1249,utter,OSBORNE,How do you know that?
utter105.1250,utter,DUNBAR,"Just a guess. Maybe they're not where they're supposed to be. Maybe somebody moved them. Habeas Corpus -- no bodies, no crime, and Nunez still plays as self defense. Face it detectives... you have nothing."
desc105.1251,desc,,"Hardy, knowing he's right. In a flash he reaches down PULLS OSBORNE'S GUN and grabs Dunbar, SLAMMING him up against the wall, pressing the weapon TO HIS TEMPLE!"
utter105.1252,utter,HARDY,"Not true, Cadet, I've got a gun --"
utter105.1253,utter,DUNBAR,(terrified) Jesus!
utter105.1254,utter,OSBORNE,"Hardy, what are you doing --"
utter105.1255,utter,HARDY,Isn't this how your story goes?
desc105.1256,desc,,Pike annoys someone so much he gets shot in the head --
utter105.1257,utter,DUNBAR,"Please, please don't --"
desc105.1258,desc,,A POUNDING on the locked door. Hardy ignores it.
utter105.1259,utter,HARDY,We can tie you to the chair if it'll work better for you --
utter105.1260,utter,OSBORNE,"Hardy, for Chrissakes --"
desc105.1261,desc,,WHERE'S WEST'S BODY?
utter105.1262,utter,DUNBAR,(practically in tears) You'll never find it --
desc105.1263,desc,,Hardy COCKS the pistol as Dunbar screams:
utter105.1264,utter,DUNBAR,You'll never find it cause HE'S NOT DEAD!
desc105.1265,desc,,"A CRASH as the door's lock SNAPS and M.P.'s POUR into the room! Styles and the JAG Lawyer behind, taking in the scene."
utter105.1266,utter,STYLES,What in God's name is going on?
desc105.1267,desc,,"Hardy releases Dunbar, who slides to the floor, gasping."
utter105.1268,utter,DUNBAR,He -- He made me do it --
utter105.1269,utter,HARDY,Do what?
utter105.1270,utter,DUNBAR,Hunting -- we had to hunt him --
utter105.1271,utter,JAG LAWYER,"Sergeant, arrest these men!"
utter105.1272,utter,OSBORNE,You mean the exercise?
utter105.1273,utter,DUNBAR,"There never was an exercise! Never targets, never teams, I don't even know if there's a creek bed out there --"
desc105.1274,desc,,"As the M.P.'s grab Hardy and Osborne, pulling them away..."
utter105.1275,utter,HARDY,What did you do?
utter105.1276,utter,JAG LAWYER,That's enough --
utter105.1277,utter,HARDY,"Goddammit, what did you DO?!"
utter105.1278,utter,DUNBAR,I COULDN'T KILL HIM!
desc105.1279,desc,,He breaks down sobbing. Styles holds up a hand to the M.P.'s.
utter105.1280,utter,STYLES,Hang on.
utter105.1281,utter,JAG LAWYER,Colonel --
utter105.1282,utter,STYLES,No. I want to hear this.
desc105.1283,desc,,The JAG Lawyer glowers as the M.P.'s stand down. Dunbar tries to pull himself together. To Hardy:
utter105.1284,utter,DUNBAR,"You're right. I was the one he singled out. Beat me morning, noon, and night, ran me ragged. When Mueller found me, I was gone. He gave me a little taste..."
scene106,slugline,,INT. CADET SHOWERS -- EIGHT WEEKS AGO
desc106.1285,desc,,Mueller showing the syringe to the naked Dunbar. Dunbar's voice over speaks in unison with Mueller:
utter106.1286,utter,MUELLER AND DUNBAR (V.O.),"I got a friend with an in at the PX, can hook you up..."
scene107,slugline,,INT. COFFEE ROOM -- PRESENT EVENING
utter107.1287,utter,DUNBAR,"What I didn't know, was his friend was West. He ran the whole thing."
utter107.1288,utter,STYLES,"You're lying, son."
utter107.1289,utter,DUNBAR,"You think it's easy to have all that morphine just disappear without a higher up authorizing it? Check the requisition orders, I'll lay money it's his signature on them."
scene108,slugline,,INT. SECTION EIGHT BARRACKS -- EIGHT WEEKS AGO
desc108.1290,desc,,"Dunbar, alone, sleeve rolled up, arm tied off: Sliding the needle into his vein..."
utter108.1291,utter,DUNBAR (V.O.),"That was his game, see? Ride the cadets so hard they'd need something to stay on their feet. Then he'd send Mueller or Kendall to them, waving around their magic needle promising to make it all go away."
desc108.1292,desc,,"He hits the plunger, injecting. His face goes tranquil."
scene109,slugline,,INT. COFFEE ROOM -- PRESENT EVENING
utter109.1293,utter,DUNBAR,"It wasn't a new thing either. He'd been doing this for years. Every nine weeks, a new class of cadets, new potential customers. The amount of money involved over that period of time... this was some high stakes shit."
desc109.1294,desc,,"He takes a deep breath, looking at them."
utter109.1295,utter,DUNBAR,"Dunbar moved his through the kitchen. I worked in the motor pool and hooked all the mechanics. By the time the hurricane hit, we were all in. Some using, some pushing, some both. But then something happened. West heard one of us was about to talk, to blow his whole operation. He figured he'd made enough money, had enough of the army, maybe it was time to disappear. But first he was gonna teach us one last thing."
scene110,slugline,,INT. SECTION EIGHT BARRACKS -- LAST NIGHT
desc110.1296,desc,,"West, entering the barracks, shouting the cadets awake."
utter110.1297,utter,DUNBAR (V.O.),The Tuesday Night drill was the perfect cover. The hurricane made it even better.
scene111,slugline,,EXT. FORT MCKINLEY -- TARMAC -- LAST NIGHT
desc111.1298,desc,,"The cadets, climbing aboard the chopper."
utter111.1299,utter,DUNBAR (V.O.),He put us on the chopper and flew us to his cabin. And then he told us.
scene112,slugline,,INT. CABIN -- LAST NIGHT
desc112.1300,desc,,"The six men stand in rigid formation, eyes on West."
utter112.1301,utter,WEST,Gentlemen! It has come to my attention that there is a traitor in our midst. Someone who was going to break the code of fraternal brotherhood that I have endeavored to create in all of you. Perhaps that failure is mine. But we take care of our own. And this traitor must be made to pay.
desc112.1302,desc,,"He walks down the line of the six men, eyeing each of them. Finally stopping at one. Putting a hand on his shoulder. Nunez."
utter112.1303,utter,WEST,Run.
utter112.1304,utter,NUNEZ,"Sir, I wasn't --"
utter112.1305,utter,WEST,"I know you were. Cadet Mueller found the letter you'd written to the Colonel in your locker. You were going to betray us all. Now, run."
desc112.1306,desc,,"He points to the door. The hurricane, RAGING outside. Nunez looks to the others, then the door, and understands. He takes off running out the door. Gone. West walks over to a table covered with a tarp. Pulls the cloth aside to reveal M-16's, PISTOLS, and GRENADES."
utter112.1307,utter,WEST,"Now we'll see whose training's paid off the most. You are to hunt Cadet Nunez down and bring his body back to me. If you fail and he escapes, we all go down together."
desc112.1308,desc,,"The remaining five cadets, understanding there is no place for friendship or kindness here. This is life and death. They walk to the table and gear up."
scene113,slugline,,EXT. LOUISIANA BAYOU -- LAST NIGHT
desc113.1309,desc,,"Lightning, thunder, and rain as Nunez runs unarmed through the thick brush. SOMEWHERE BEHIND HIM -- The other five fan out, rifles up, following his trail, ready to kill."
utter113.1310,utter,DUNBAR (V.O.),It was insanity. We were hunting a man down to kill him.
scene114,slugline,,ON MUELLER
desc114.1311,desc,,"Making his way down embankment, M-l6 out, ready for anything. From behind him, MOVEMENT..."
utter114.1312,utter,DUNBAR (V.O.),He got Mueller first.
desc114.1313,desc,,"Nunez TACKLES HIM at full speed, feet SLIPPING on the wet hill, and the two TUMBLE head first into a GULLY. Punching, kicking, biting, anything to stop the other man. Nunez, CHOKING Mueller as he strains to reach his gun..."
utter114.1314,utter,MUELLER,Roberto...
desc114.1315,desc,,"With a HEAVE, Nunez SNAPS HIS NECK. Mueller lies still."
utter114.1316,utter,DUNBAR (V.O.),He took his gun. Used it on Childs.
desc114.1317,desc,,"Nunez spins, seeing CHILDS BEHIND HIM. He DIVES as Childs fires! Hits the ground in a roll, comes up with Mueller's rifle, and SHOOTS -- BLOWING CHILDS BACK against the wet rocks."
utter114.1318,utter,DUNBAR (V.O.),I can't imagine what it was like. Having your friends try to kill you...
desc114.1319,desc,,"Nunez slumps against the gully's wall, breathing hard. In agony over what he's just had to do."
utter114.1320,utter,DUNBAR (V.O.),But you do what you have to survive.
desc114.1321,desc,,"Closing his eyes, Nunez steels himself. Wipes the blood from his hands and climbs out of the gully."
scene115,slugline,,ELSEWHERE
