segment-id,segment-type,segment-speaker,segment-text
utter71.792,utter,PIKE,Look in my pack.
utter71.793,utter,DUNBAR,Why?
utter71.794,utter,PIKE,Just look. Little pocket.
desc71.795,desc,,Dunbar walks over to Pike's pack and unzips it. Checks the little pocket. Pulls out a VIAL and a SYRINGE.
utter71.796,utter,PIKE,Combat grade morphine. Mueller sold it to me.
utter71.797,utter,DUNBAR,You're lying --
utter71.798,utter,PIKE,Pull up my sleeve. Right arm.
desc71.799,desc,,Dunbar does to reveal a cluster of TRACK MARKS.
utter71.800,utter,PIKE,That look like a lie to you? I been using solid for the last eight weeks.
desc71.801,desc,,Dunbar sits down. Not knowing what to say.
utter71.802,utter,PIKE,"After that first night on the parade grounds with you, I was bad -- exposure, malnutrition, the works. I needed something to keep me from crashing. Mueller found me."
scene72,slugline,,INT. CADET SHOWERS -- EIGHT WEEKS AGO
desc72.803,desc,,"Empty except for Pike. He sits, nude, curled up on the tile, as the nozzles blast STEAMING WATER down onto his shivering form. FOOTSTEPS approaching. Mueller. He leans down next to Pike, speaking to him. Kindly."
utter72.804,utter,PIKE (V.O.),"He said he knew guy who had an in at the PX, could hook me up. This is before I knew what a dick he was."
desc72.805,desc,,As Mueller produces a SYRINGE from his pocket...
scene73,slugline,,INT. BASE PX -- BACKROOM -- SIX WEEKS AGO
desc73.806,desc,,"A covert meeting among stacks of supplies. Childs stands with Mueller, talking to a gaunt Pike. Behind Pike are a group of other SICKLY LOOKING CADETS, all jonesing."
utter73.807,utter,PIKE,"Later on Childs got assigned there, started running the shit out to every cadet who needed it. But I was our class's first customer..."
desc73.808,desc,,Pike hands the smiling Mueller a WAD OF CASH...
scene74,slugline,,INT. CABIN -- LAST NIGHT
desc74.809,desc,,Dunbar staring open mouthed at Pike. Shocked.
utter74.810,utter,DUNBAR,Why... why didn't you tell me?
utter74.811,utter,PIKE,Becoming a morphine addict during Basic ain't exactly something you want to broadcast. Only Mueller and Childs know.
desc74.812,desc,,A beat. Dunbar gets to his feet.
utter74.813,utter,DUNBAR,That still doesn't mean you didn't kill him.
utter74.814,utter,PIKE,"You saw West, right? How was he killed?"
utter74.815,utter,DUNBAR,Full clip to the body --
utter74.816,utter,PIKE,From up close or far away?
utter74.817,utter,DUNBAR,His chest was hamburger --
utter74.818,utter,PIKE,"That's close range. You go full auto on a guy from close range, you're gonna be swimming in blood. Look at my uniform. Nothing."
desc74.819,desc,,Dunbar looks. Not a speck of blood on it.
utter74.820,utter,PIKE,"And where's Mueller's? When I came in, he was only wearing a t-shirt."
desc74.821,desc,,"Dunbar looks over to fireplace, where ashes are smoldering... FLASHCUT TO -- When Dunbar first entered the Cabin: Mueller, standing there in a T-SHIRT, a FIRE burning in the hearth."
utter74.822,utter,PIKE,"Way I figure it, West must have found out about their little business and was gonna bust them, so they decided to get rid of him first..."
utter74.823,utter,DUNBAR,(softly) They?
utter74.824,utter,PIKE,Mueller and Childs. One of them must've taken the grenade from my pack on the chopper...
scene75,slugline,,INT. TRANSPORT HELICOPTER (FLYING) -- EARLIER LAST NIGHT
desc75.825,desc,,"The Sectioners sit, stonefaced, staring out the window. CLOSE ON -- Mueller's hand as it snakes into Pike's pack and extracts a phosphorous grenade."
scene76,slugline,,EXT. LOUISIANA BAYOU -- EARLIER LAST NIGHT
desc76.826,desc,,"Mueller and Pike, twenty feet apart, scouring the brush for targets. Mueller looks to Pike and then slips away..."
utter76.827,utter,PIKE (V.O.),Then Mueller ditches me during the
desc76.828,desc,,exercise and heads for the creek.
scene77,slugline,,EXT. LOUISIANA BAYOU -- CREEK BED -- EARLIER LAST NIGHT
desc77.829,desc,,"Mueller stands on the hill and pulls the grenades pin, tossing it down the embankment..."
utter77.830,utter,PIKE (V.O.),He blows the grenade to frame me and gets West to come running...
desc77.831,desc,,"The grenade BLOWS, setting the entire area AGLOW..."
scene78,slugline,,EXT. LOUISIANA BAYOU -- EARLIER LAST NIGHT
desc78.832,desc,,"Kendall and Childs, turning towards the sound... Note: Each shot of Kendall and Childs in this sequence should correspond exactly to Kendall's Flashback."
scene79,slugline,,EXT. LOUISIANA BAYOU -- CREEK BED -- NIGHT
desc79.833,desc,,West emerges from the bush at a sprint.
utter79.834,utter,WEST,What the fuck is going on?!
desc79.835,desc,,Mueller runs down the embankment toward him.
utter79.836,utter,MUELLER,"I don't know, sir."
desc79.837,desc,,"Six feet away from West, Mueller suddenly raises his rifle and PULLS THE TRIGGER."
scene80,slugline,,EXT. LOUISIANA BAYOU -- EARLIER LAST NIGHT
desc80.838,desc,,"Kendall and Childs, running in the direction of the grenade..."
utter80.839,utter,PIKE,"Childs' job is easy, he only has to delay Kendall long enough for Mueller to get away."
desc80.840,desc,,Suddenly MACHINE GUNFIRE shatters the night!
utter80.841,utter,CHILDS,GET DOWN!
desc80.842,desc,,He tackles Kendall into the mud.
scene81,slugline,,EXT. LOUISIANA BAYOU -- CREEK BED -- EARLIER LAST NIGHT
desc81.843,desc,,"Mueller, smoking rifle in hand, uniform covered in blood stands over WEST'S DEAD BODY. He turns and runs off INTO THE BRUSH. A moment later, Childs and Kendall come into view at the top of the embankment..."
utter81.844,utter,PIKE (V.O.),Now all Mueller has to do is get rid of the evidence...
scene82,slugline,,INT. CABIN -- EARLIER LAST NIGHT
desc82.845,desc,,"Mueller, still covered in blood, enters the dark cabin. He strips of his shirt and throws it in the fireplace. Striking a match, igniting the bloody rag..."
utter82.846,utter,PIKE (V.O.),And wait for everyone else to arrive.
desc82.847,desc,,"Mueller, watching the evidence burn..."
scene83,slugline,,INT. CABIN -- LAST NIGHT
desc83.848,desc,,"Pike sighs, finished with his story."
utter83.849,utter,DUNBAR,I... I don't know...
utter83.850,utter,PIKE,What don't you know?
utter83.851,utter,DUNBAR,This is a lot of information to be getting... I have to think --
desc83.852,desc,,The hurricane outside GROWING LOUDER as the Cabin ROCKS again. The sound of WOOD SNAPPING. Pike stares up at the roof.
utter83.853,utter,PIKE,"There's no time to think, Ray, we gotta get out of here! You untie me, we grab the guns, get Kendall and Nunez, and make a run for it --"
utter83.854,utter,DUNBAR,"No... no, we can just wait till we get back and then tell the M.P.'s --"
utter83.855,utter,PIKE,"We wait and I'm a dead man. I got a black face, a criminal record, and over a hundred other cadets who'll testify how much I hated West -- my court martial will take six minutes. It's either me or them, Ray, and you gotta decide right now."
desc83.856,desc,,The cabin SHIFTS again. Dunbar stares at him.
utter83.857,utter,PIKE,Untie me.
desc83.858,desc,,Dunbar doesn't move.
utter83.859,utter,PIKE,"Untie me, Ray."
desc83.860,desc,,A long beat. The two men stare at each other. And then Dunbar pulls his knife from his boot and leans down to cut Pike's bonds.
utter83.861,utter,PIKE,Thank God...
utter83.862,utter,MUELLER (O.S.),What the fuck are you doing?
desc83.863,desc,,Dunbar freezes. Caught. He looks to the open kitchen door where Mueller stands.
utter83.864,utter,MUELLER,"Guys, get out here!"
desc83.865,desc,,"The others enter the room. Dunbar, kneeling there, knife inches away from severing Pike's ropes."
utter83.866,utter,PIKE,"This place is going, Mueller. We gotta move --"
utter83.867,utter,MUELLER,Shut the fuck up. (to the others) He was gonna cut him loose.
desc83.868,desc,,The others stare at Dunbar.
utter83.869,utter,NUNEZ,Why?
utter83.870,utter,PIKE,Cause I didn't do it.
desc83.871,desc,,Childs motions to Dunbar.
utter83.872,utter,CHILDS,Get away from there.
desc83.873,desc,,He's serious. Dunbar moves away from Pike.
utter83.874,utter,MUELLER,"We all know what you did, Pike. I don't know what kind of nigger voodoo you been working in here, but --"
utter83.875,utter,PIKE,"Where's your shirt, Mueller?"
utter83.876,utter,MUELLER,I used it to start the fire --
utter83.877,utter,PIKE,"Still got mine on, not a speck of blood on it. Not a bad trick for a murderer -- you said you burned yours?"
desc83.878,desc,,The others begin to look at Mueller with new eyes.
utter83.879,utter,MUELLER,I was freezing from the hurricane --
utter83.880,utter,KENDALL,So you took off your shirt?
utter83.881,utter,MUELLER,"To start a fire, goddammit! (pointing to Pike) What about him, huh? Maybe he offed the Sarge and changed shirts, brought an extra one in his pack. Y'ever think of that? Go ahead, cut him loose! First chance he gets, he'll waste the rest of us, that's how they work --"
desc83.882,desc,,"The hurricane, reaching FEVER PITCH outside as WATER begins leaking in through the roof."
utter83.883,utter,PIKE,"Goddammit, Ray, we gotta get out of here --"
utter83.884,utter,MUELLER,We're not going anywhere.
desc83.885,desc,,Pike turns to Mueller:
utter83.886,utter,PIKE,"Cadet Michael Mueller, I hereby place you under military arrest for the murder of Sergeant Nathan West --"
utter83.887,utter,MUELLER,The fuck are you talking about --
utter83.888,utter,PIKE,You are to be stripped of all weapons and placed under guard --
utter83.889,utter,MUELLER,Bullshit --
utter83.890,utter,PIKE,"Until we return to base, and ballistics can match your weapon to the slugs in Sergeant West's body --"
utter83.891,utter,MUELLER,Shut up!
desc83.892,desc,,Mueller pulls his SIDEARM and POINTS IT AT PIKE.
utter83.893,utter,KENDALL,"Mueller, what the fuck --"
utter83.894,utter,DUNBAR,Don't do this --
desc83.895,desc,,"Pike, EYES LOCKED with Mueller. Continuing:"
utter83.896,utter,PIKE,A test will no doubt link you to the killing --
utter83.897,utter,DUNBAR,Put it down!
utter83.898,utter,MUELLER,Tell him to shut up --
utter83.899,utter,PIKE,-- failure to comply with this arrest is a court martialable offense in and of itself --
utter83.900,utter,KENDALL,"Pike, please --"
utter83.901,utter,PIKE,Although that won't matter much when coupled with the murder charge --
utter83.902,utter,MUELLER,SHUT THE FUCK UP YOU FUCKING NIGGER...
desc83.903,desc,,Pike leans forward.
utter83.904,utter,PIKE,"You stupid white trash motherfucker, I saw you do it --"
desc83.905,desc,,"And Mueller FIRES. Pike's head SNAPS BACK. The gunshot, DEAFENING. Then, for an eternity, SILENCE. Nobody moves. Nobody breathes. As if time has stopped."
utter83.906,utter,KENDALL,Oh... my God...
desc83.907,desc,,"Mueller lowers his arm, the pistol clattering to the floor. His face, as shocked as the others."
utter83.908,utter,MUELLER,He wouldn't... stop talking...
desc83.909,desc,,He takes a step forward towards Pike. A hole in the middle of the black man's forehead.
utter83.910,utter,DUNBAR,(softly) So you killed him?
utter83.911,utter,MUELLER,I...
desc83.912,desc,,"Almost mechanically, Dunbar begins to reach for his own gun... The unmistakable sound of a two rifles' magazines being RACKED simultaneously. Dunbar turns to see Childs and Nunez, their M-16's in hand. Levelled at him."
utter83.913,utter,CHILDS,Get that hand away.
desc83.914,desc,,Dunbar does. Looks to Nunez.
utter83.915,utter,DUNBAR,You too?
utter83.916,utter,CHILDS,"We can still come out of this okay. Pike got free, he got a gun, he came after us. That's the story."
desc83.917,desc,,Mueller collapses on the ground. Head in hands.
utter83.918,utter,MUELLER,"West was one thing, but this --"
utter83.919,utter,CHILDS,"Shut up, Mueller."
utter83.920,utter,KENDALL,You framed-him...
utter83.921,utter,CHILDS,"None of that matters now. We got two dead bodies and a story that explains them. You're either with us, or against us -- which is it?"
desc83.922,desc,,"Dunbar and Kendall, looking at each other. It's clear what the wrong answer will mean. A long beat, until"
utter83.923,utter,KENDALL,Okay --
desc83.924,desc,,"He is cut off as the WIND outside ROARS -- the HURRICANE mounting to it's FULL FORCE -- and the WINDOWS BLOW INWARDS, showering Childs, Mueller, and Nunez with glass! Dunbar's hand flies to his pistol, PULLING IT... Mueller, SCREAMING, trying to claw the glass from his EYES... Childs, seeing Dunbar move, PULLS THE TRIGGER... And the cabin is filled with the THUNDER OF GUNFIRE as Kendall goes down, clutching his ARM... DUNBAR FIRES, hitting Childs directly in the chest... Childs, still shooting, falls back, his random spray of bullets PUNCHING INTO MUELLER who jerks like a marionette... Nunez, drawing a bead on Dunbar, about to shoot, when... A great CRESCENDO of WOOD SPLINTERING and SUPPORTS BUCKLING overtakes them and the CABIN'S ROOF COMES DOWN ON THEIR HEADS. EXT. DEMOLISHED CABIN -- FIRST LIGHT Hours later. The rain has lessened and the Hurricane has begun to lift as Dunbar pulls himself from the debris. Hearing a FAINT CRY from his left. Kendall. Half conscious, his arm, bloody. Dunbar slings the man across his shoulders as the rising sun begins to peak through the clouds overhead."
scene84,slugline,,EXT. LOUISIANA BAYOU -- SUNRISE
desc84.925,desc,,"Dunbar, carrying Kendall towards the clearing when GUNFIRE comes from behind. He turns to look... Nunez. The only other survivor from the Cabin. A hundred yards back, rifle in hand, coming after them with a vengeance. Dunbar, sprinting towards the clearing, bullets at his heels and as he bursts from the tree line he looks up to see a HELICOPTER OVERHEAD"
utter84.926,utter,DUNBAR (V.O.),And then I killed the last of them.
desc84.927,desc,,"FLASHCUT TO -- Nunez, chest blown open, going down..."
scene85,slugline,,INT. COFFEE ROOM -- PRESENT DAY
desc85.928,desc,,"And we're back to the interrogation. Dunbar, stubbing out a cigarette and looking up at Hardy and Osborne."
utter85.929,utter,DUNBAR,Can I have some coffee?
desc85.930,desc,,"Osborne blinks, like a trance has been broken."
utter85.931,utter,OSBORNE,"Yeah... yeah, sure."
desc85.932,desc,,She goes over to the machine and pours a cup.
utter85.933,utter,HARDY,You shot Childs and Nunez.
utter85.934,utter,DUNBAR,"They would have killed us both. You want me to write a confession, I'll write a confession."
utter85.935,utter,HARDY,You saved Kendall's life --
utter85.936,utter,DUNBAR,But not Pike's.
desc85.937,desc,,Osborne hands him the coffee.
utter85.938,utter,OSBORNE,Why didn't you tell us all this in the first place?
utter85.939,utter,DUNBAR,Would you have believed me?
desc85.940,desc,,"Their faces say ""no"". Osborne spreads a MAP out on the table."
utter85.941,utter,OSBORNE,Where's the cabin?
utter85.942,utter,DUNBAR,"Don't know on a map. West told us it was there, we just found it. Maybe the hurricane took it away."
utter85.943,utter,HARDY,"Raymond, for you to have any chance of coming out of this, we need to locate the other bodies and examine them to corroborate your testimony. Otherwise this is just another story --"
utter85.944,utter,DUNBAR,"Mr. Hardy, I joined the army for college money. I didn't ask for any of this -- I tried to do the right thing out there and people got killed. You say finding those bodies'll help me, then go find them. I don't want to die."
scene86,slugline,,EXT. FOR MCKINLEY -- CORRIDORS -- DAY
desc86.945,desc,,"Hardy and Osborne, walking and talking."
utter86.946,utter,OSBORNE,"Talk it through: Childs, Mueller, and Nunez know they're going out on the regular Tuesday Night drill, hurricane or no hurricane, so they plan it: Kill West, pin it on Pike."
utter86.947,utter,HARDY,"And they're smart about it. They know when you commit a crime you know is going to be investigated, you need a fall guy and for that to work, you have to have a witness."
utter86.948,utter,OSBORNE,Dunbar.
utter86.949,utter,HARDY,"Exactly, someone who's not involved, who's word can't be questioned. You only let them see what you want them to see, you make them believe, so when the time comes, they've totally bought into your version of events."
utter86.950,utter,OSBORNE,They believe the innocent are guilty and the guilty are innocent.
utter86.951,utter,HARDY,"And if they're asked, that's what they'll tell the, world."
utter86.952,utter,OSBORNE,So it's a good plan but it goes wrong;
desc86.953,desc,,Mueller flips out and shoots their
utter86.954,utter,HARDY,"Kendall maybe would have agreed, but the hurricane buttfucks the cabin --"
utter86.955,utter,OSBORNE,Buttfucks the cabin?
utter86.956,utter,HARDY,And all hell breaks loose. A lot of
desc86.957,desc,,"Good guys shoot a lot of bad guys and whiz, bang, zoom, happy ending."
utter86.958,utter,OSBORNE,"So why, after Dunbar drags Kendall out from under a house, does the Senator's son try and get us to put his savior in the gas chamber?"
utter86.959,utter,HARDY,That bugs you too?
utter86.960,utter,OSBORNE,Little bit.
utter86.961,utter,HARDY,Let's go talk to Bill...
scene87,slugline,,INT. STYLES' OFFICE -- DAY
desc87.962,desc,,"Hardy and Osborne stand in front of an agitated Styles. He tries to take a hit off his asthma inhaler and gets nothing. Frustrated, he tosses it away."
utter87.963,utter,STYLES,Fucking asthma... This whole thing's driving it nuts.
desc87.964,desc,,A beat.
utter87.965,utter,HARDY,What I said before --
utter87.966,utter,STYLES,Was dead right. You think Dunbar's on the level?
utter87.967,utter,HARDY,Yeah.
utter87.968,utter,STYLES,Does Osborne agree?
utter87.969,utter,OSBORNE,"Yes, sir, I do."
desc87.970,desc,,Hardy lays a piece of paper on Styles' desk.
utter87.971,utter,HARDY,Dunbar's confession. It should be enough to get you out of trouble.
desc87.972,desc,,Styles looks at it and then slowly up to Hardy.
utter87.973,utter,STYLES,"You want Kendall, don't you?"
utter87.974,utter,OSBORNE,He tried to burn Dunbar to us. You don't do that if you're not involved.
desc87.975,desc,,"Hardy nods, agreeing. Styles stares at them."
utter87.976,utter,STYLES,"You both know if you do this, if you go after a Senator's son and you're wrong... it's not just me in the hot seat anymore."
utter87.977,utter,OSBORNE,We know.
utter87.978,utter,STYLES,(to Hardy) I'm giving you a chance to walk away.
utter87.979,utter,HARDY,We know.
desc87.980,desc,,Styles nods and looks to his desk. Almost to himself:
utter87.981,utter,STYLES,"You don't get to be a Colonel without compromising. Without getting out of the way of the bigger dogs. You politic, play it safe, think of the career first. And when things get dirty, you just look the other way..."
desc87.982,desc,,"He looks back up at Hardy. His eyes, steeled."
utter87.983,utter,STYLES,"Four of my men are dead. You think Kendall had something to do with it, then you go get the son of a bitch."
scene88,slugline,,INT. KENDALL'S HOSPITAL ROOM -- DAY
desc88.984,desc,,"Kendall lies in his bed, looking worse than before. Hardy and Osborne enter."
utter88.985,utter,OSBORNE,Pike never confessed.
utter88.986,utter,KENDALL,"We've been making progress, I see."
desc88.987,desc,,Osborne looks to her watch. Kendall notices.
utter88.988,utter,KENDALL,"Running out of time, are we? Tick- tock, tick-tock, how long till your witnesses fly the coop?"
utter88.989,utter,OSBORNE,Fifty minutes.
utter88.990,utter,KENDALL,"Not much time to solve the crime. Tell me, detective, how did it feel taking blood money from Guissepe Torres? Did it weigh on your conscience or did you just not think about it?"
utter88.991,utter,HARDY,You tried to pin three stone murders on Dunbar --
utter88.992,utter,KENDALL,How many murders did you cover up? One? Five? Maybe an even ten.
utter88.993,utter,HARDY,(to Osborne) Can I go to jail for punching a guy who's been shot?
desc88.994,desc,,Kendall begins coughing.
utter88.995,utter,KENDALL,"I think they're giving me the wrong medicine. This isn't a very good hospital, you know --"
desc88.996,desc,,Hardy sighs and goes to the sink to get him some water.
utter88.997,utter,KENDALL,Epileptic attacks are murder on your system. Rattle your internal organs like a paint mixer.
utter88.998,utter,HARDY,My heart weeps.
desc88.999,desc,,He returns with a GLASS OF WATER and hands it to Kendall.
utter88.1000,utter,OSBORNE,Pike never confessed.
utter88.1001,utter,KENDALL,"No, but it got you interested, didn't it? Got you to dig. Inspired Ray to tell you terribly sordid tales about drugs and creek beds and dead little sergeants who stuck their noses where they didn't belong."
utter88.1002,utter,HARDY,Is it the truth?
utter88.1003,utter,KENDALL,"There's that word again. (smiling) As I told you, I wasn't in the room when everyone started shooting."
utter88.1004,utter,OSBORNE,Dunbar says you were.
utter88.1005,utter,KENDALL,"Then he's mistaken. You know, I really don't think my father would approve of this line of questioning --"
utter88.1006,utter,HARDY,"Why did you tell us he shot everybody, Levi? You put him in for three murders, the man saved your life --"
utter88.1007,utter,KENDALL,"So I should stay silent about his misdeeds? The guns went off, I ran in, Childs shot me, Pike and Mueller were dead, and Dunbar was running out the door with the smoking gun --"
utter88.1008,utter,HARDY,"Dunbar was running out the door? Ohhhhhh... See that's where I was confused, because I thought you said"
desc88.1009,desc,,Nunez was running out the door.
utter88.1010,utter,KENDALL,No. I said Dunbar.
utter88.1011,utter,HARDY,"Huh. You know, I really thought you said Nunez. I thought you said ""Dunbar was gone,"" My fault, I gotta check the tape on that. (off Kendall's look) Oh, yeah we taped the last interview. This one too. Cause it'd be a real break for us to catch you in a lie."
desc88.1012,desc,,Silence. They wait for Kendall's reaction. He looks momentarily flustered by this... and then he smiles.
utter88.1013,utter,KENDALL,"I believe your next line is ""What are you trying to hide?"""
utter88.1014,utter,HARDY,Well?
utter88.1015,utter,KENDALL,"Sorry to disappoint. I'm on painkillers for the injury -- they cloud the mind. You're right, it was Nunez. Any more questions?"
desc88.1016,desc,,Hardy doesn't know what to say. That was his ace card.
utter88.1017,utter,KENDALL,"Don't get me wrong, Mueller and Childs were quite the pair, the type of guys you didn't feel comfortable going to sleep around. Completely capable of murder. But as I said, I didn't hear the exchange before the shooting. I wasn't in the room."
desc88.1018,desc,,Osborne furrows her brow at this as Hardy continues.
utter88.1019,utter,HARDY,Dunbar will testify that you were.
utter88.1020,utter,KENDALL,"Then we'll leave it up to the courts -- His word against mine. What does his father do again? Steelworker? (smiling) Doesn't matter, I'm sure justice will be served. In any case, my father will definitely want to talk to you about all these questions, these accusations on his son. He's quite protective."
desc88.1021,desc,,Osborne turns to Hardy.
utter88.1022,utter,OSBORNE,I need to talk to you outside.
scene89,slugline,,EXT. BASE HOSPITAL -- CORRIDOR -- DAY
desc89.1023,desc,,"Osborne and Hardy, exiting the room. Whispering:"
utter89.1024,utter,HARDY,"We're fucked, I know --"
utter89.1025,utter,OSBORNE,They got their stories straight.
utter89.1026,utter,HARDY,What?
utter89.1027,utter,OSBORNE,"What Kendall said -- ""the type of guys you don't feel comfortable going to sleep around."" That's what Dunbar said about Childs to the letter."
utter89.1028,utter,HARDY,Are you sure?
utter89.1029,utter,OSBORNE,"Positive. Hardy, they planned this."
desc89.1030,desc,,She grins. He grins back.
utter89.1031,utter,OSBORNE,"Not bad for hostile and uncooperative, eh?"
scene90,slugline,,INT. KENDALL'S HOSPITAL ROOM -- DAY
desc90.1032,desc,,"Hardy and Osborne reenter, smiling. Kendall chuckles."
utter90.1033,utter,HARDY,"Something funny, Levi?"
utter90.1034,utter,KENDALL,I was just thinking of what's going to happen to your careers when my father gets through with you.
desc90.1035,desc,,Hardy pulls the out MICRORECORDER and hands it to Osborne.
utter90.1036,utter,HARDY,Why don't you talk to Levi off the record for a second?
utter90.1037,utter,OSBORNE,Good idea.
desc90.1038,desc,,"Smiling, she stops the tape. Then turns to Kendall."
utter90.1039,utter,OSBORNE,"You and Dunbar got your stories straight. Little details, little inconsistencies, designed to bounce us back from one of you to the other, asking questions, killing time, until the transport arrives and whisks you away to where Senator Daddy can protect you. You think you're just going to slide out of this? You're an accessory to murder, Levi, you're going to jail --"
utter90.1040,utter,KENDALL,You can't threaten me --
utter90.1041,utter,HARDY,"Jail if he's lucky, the gas chamber if he's not --"
utter90.1042,utter,KENDALL,I didn't do anything --
desc90.1043,desc,,Osborne laughs.
utter90.1044,utter,OSBORNE,"It doesn't matter, Levi. We're going to find those bodies and when we do, I'm going to make sure one of them has a bullet in them that matches your weapon --"
utter90.1045,utter,KENDALL,What?
utter90.1046,utter,HARDY,That's a fantastic idea --
utter90.1047,utter,OSBORNE,"See, I just take your gun to the morgue and fire it into one of their skulls; then I call every newspaper in the country with the story about how Senator Kendall's gay son went nuts on a training mission --"
utter90.1048,utter,KENDALL,(beginning to panic) It won't work --
utter90.1049,utter,OSBORNE,"It will and you know why? Because you're not a person anymore, you're a cadet in the United States Army; you have no identity, no Miranda warning, and no rights. So I'm gonna throw you to the wolves, and unlike you, I'm gonna get away with it, because you're pissing me off!"
desc90.1050,desc,,"She finishes, breathing hard. Kendall, totally cowed. Hardy, trying to suppress a smile. Osborne rises for the door."
utter90.1051,utter,OSBORNE,Enjoy your flight to Washington --
utter90.1052,utter,KENDALL,Wait --
utter90.1053,utter,OSBORNE,What.
