segment-id,segment-type,segment-speaker,segment-text
desc48.500,desc,,"Mueller, finally seeming to understand. Lowering the gun."
utter48.501,utter,MUELLER,"Jesus, Jesus fucking Christ..."
desc48.502,desc,,"Muttering to himself, walking in circles."
utter48.503,utter,CHILDS,Where's Pike?
desc48.504,desc,,No response.
utter48.505,utter,CHILDS,"Mueller, where's Pike?"
desc48.506,desc,,Mueller looks up.
utter48.507,utter,MUELLER,"We got -- I don't know, we got separated"
utter48.508,utter,CHILDS,Before or after the explosion? (no response) Mueller --
utter48.509,utter,MUELLER,I don't know!
utter48.510,utter,KENDALL,How can you not know --
desc48.511,desc,,"Mueller comes at him, screaming:"
utter48.512,utter,MUELLER,"Shut the fuck up, you fucking faggot, You just shut the FUCK UP."
utter48.513,utter,CHILDS,HEY!
desc48.514,desc,,"Mueller stops, eyes crazed. Childs looks to the sky, which is becoming worse by the second."
utter48.515,utter,CHILDS,We have to get out of this. To find the cabin.
desc48.516,desc,,He helps Kendall to his feet.
utter48.517,utter,KENDALL,What about Pike?
utter48.518,utter,CHILDS,"Maybe he'll be there. Either way, we have to go."
desc48.519,desc,,"Kendall nods, slowly. The two start up the hill."
utter48.520,utter,MUELLER,"Shouldn't we -- I mean, we shouldn't just leave him here."
desc48.521,desc,,He points down to West's body. Childs looks at it.
utter48.522,utter,CHILDS,You can carry him if you want.
desc48.523,desc,,"He and Kendall continue on. Mueller lingers a moment longer and then turns, following them up the hill."
scene49,slugline,,EXT. LOUISIANA BAYOU -- LAST NIGHT
desc49.524,desc,,"Kendall, Childs, and Mueller make their way through the bush. The WIND and RAIN have conspired into a FULL BLOWN HURRICANE. The three men are practically stumbling now, leaning in against it to stay on their feet. Kendall spies something through the maelstrom. It looks like WET WOOD. He points:"
utter49.525,utter,KENDALL,There!
desc49.526,desc,,"THE CABIN -- Wooden, one story, and large, it resembles a solidly built shack. It is being thrashed by the storm. The trio stumble towards the front door..."
scene50,slugline,,INT. CABIN -- LAST NIGHT
desc50.527,desc,,Obviously abandoned. Bare of any furniture save for two wooden chairs next to an empty fireplace. DUNBAR and NUNEZ shout in surprise as the three men practically collapse into the cabin. Dunbar runs to bolt the door against the elements as Nunez helps them up.
utter50.528,utter,NUNEZ,What happened to you --
utter50.529,utter,MUELLER,What happened to you?
utter50.530,utter,DUNBAR,"We finished the course and came here, then heard an explosion -- (to Mueller) Where's Pike?"
utter50.531,utter,CHILDS,We don't know. West is dead.
desc50.532,desc,,Silence. Dunbar and Nunez stare at him. Mueller jerks a hand towards Kendall and Childs.
utter50.533,utter,MUELLER,They found him. Poor fucker was practically blown in half --
utter50.534,utter,KENDALL,Poor fucker my ass...
utter50.535,utter,MUELLER,"You better watch it, faggot, I'm not sure you and Childs didn't do him --"
utter50.536,utter,CHILDS,"What about you, wandering around alone? At least we have an alibi --"
utter50.537,utter,DUNBAR,"What do you mean, alone?"
utter50.538,utter,MUELLER,Pike and I got separated --
utter50.539,utter,KENDALL,Yeah and he doesn't know when --
utter50.540,utter,MUELLER,"I remember now, it was before the explosion --"
utter50.541,utter,KENDALL,"Oh, you remember now --"
utter50.542,utter,MUELLER,I'm about two seconds away from seeing if fairies really can fly --
utter50.543,utter,NUNEZ,What about Pike?
desc50.544,desc,,"Mueller stops, as the others turn towards the big man. Silence. They realize what the question means."
utter50.545,utter,DUNBAR,He wouldn't kill anybody...
utter50.546,utter,MUELLER,"Oh, bullshit, he's a fucking convict. You know how much he hated West --"
utter50.547,utter,DUNBAR,"I hated West, Childs hated West, everyone with a goddamn brain hated West but that doesn't mean we killed him!"
utter50.548,utter,NUNEZ,What if it wasn't one of us? What if it was a local --
utter50.549,utter,KENDALL,"He was blown up by a phosphorous grenade, they don't exactly sell those at 7-11."
utter50.550,utter,MUELLER,"Look, here are the facts -- Roberto was with Dunbar, Queen Kendall was with Childs, and Pike's the only one not here. He did it!"
desc50.551,desc,,"The others nod, becoming convinced."
utter50.552,utter,CHILDS,He is the only one unaccounted for.
utter50.553,utter,KENDALL,"Maybe he's dead too. Maybe you killed them both, Mueller --"
utter50.554,utter,DUNBAR,Shut up. (to Mueller) Let me see your grenades.
utter50.555,utter,MUELLER,Why?
utter50.556,utter,DUNBAR,We were each given three so whoever killed West will be missing one.
desc50.557,desc,,Mueller angrily digs into his sack and pulls out his grenades.
utter50.558,utter,MUELLER,See? Three. Now can we please --
desc50.559,desc,,"He stops. Hearing a SOUND outside. Through the wind and rain, FOOTSTEPS on the porch. They all turn to the door. Waiting... The DOOR SWINGS OPEN.. Pike. Covered in BLOOD."
utter50.560,utter,PIKE,"Hey, guys."
desc50.561,desc,,They stare at him as he calmly closes the door and walks over to the empty FIREPLACE. Finally:
utter50.562,utter,DUNBAR,"Whose blood is that, Jay?"
utter50.563,utter,PIKE,West's. Any kindling for afire?
desc50.564,desc,,He looks around for kindling. A beat.
utter50.565,utter,DUNBAR,"What do you mean, West's?"
utter50.566,utter,PIKE,I mean I killed him. (pause) Isn't that what we all wanted?
scene51,slugline,,INT. KENDALL'S HOSPITAL ROOM -- PRESENT DAY
utter51.567,utter,HARDY,He admitted it.
utter51.568,utter,KENDALL,Right in front of us. Mueller went after him but we held him back.
desc51.569,desc,,Pike surrendered and volunteered to be tied up. So we roped him to a chair and tried to ride out the storm.
utter51.570,utter,OSBORNE,Why would he just surrender?
desc51.571,desc,,Kendall turns to her and smiles.
utter51.572,utter,KENDALL,Because he had a plan.
scene52,slugline,,INT. CABIN -- LIVING ROOM -- LAST NIGHT
desc52.573,desc,,"Pike, tied to a chair by the fireplace while the others look for, food in the KITCHEN. Alone, Kendall walks past Pike:"
utter52.574,utter,PIKE,"Hey, Kendall, talk to you for a sec?"
desc52.575,desc,,Kendall looks around -- there seems no harm in it.
utter52.576,utter,PIKE,"You hated West as much as I did. I'm not saying what I did was right, but you can't tell me you're not glad the motherfucker's dead."
desc52.577,desc,,"Kendall says nothing. Pike looks around, makes sure no one is listening and then whispers:"
utter52.578,utter,PIKE,"The thing is, we've got a real opportunity here. You turn me in tomorrow and we're both fucked --"
utter52.579,utter,KENDALL,What are you talking about?
utter52.580,utter,PIKE,A gay Senator's son who let his Sarge get fragged on a training exercise? The press'll crucify you and your father. His career will be over and it'll be your fault. But we do this different and you come out a hero.
desc52.581,desc,,"On Kendall, thinking about it. A beat."
utter52.582,utter,KENDALL,How?
utter52.583,utter,PIKE,"Mueller. He's as bad as West and we both know it. Now I can't do it, cause I'm tied up, but we get the others to go along --"
utter52.584,utter,KENDALL,I don't think I want to hear this --
utter52.585,utter,PIKE,"Someone else can do the deed, it doesn't have to be you. Maybe Nunez too, he's got a tendency to follow Mueller, but the rest of us can come out ahead -- the guys who took out their Sergeant's killers! We'll move the bodies out to the creek and say we came over the hill right as they fragged West, all we gotta do is tell the story right."
desc52.586,desc,,Kendall stares at him. Disgusted.
utter52.587,utter,KENDALL,"You're sick, Pike."
desc52.588,desc,,He turns and walks away. Pike watches him go.
utter52.589,utter,KENDALL (V.O.),Later on I saw him talking to Dunbar.
desc52.590,desc,,They had been close. I was in another room when it happened.
scene53,slugline,,INT. CABIN -- KITCHEN LAST NIGHT
desc53.591,desc,,"Kendall, looking through the empty cabinets for food when A GUNSHOT -- From the living room. As Kendall bolts towards the noise, the air is filled with the sounds of SCREAMING and SHOOTING! He pushes through the door..."
scene54,slugline,,INT. CABIN -- LIVING ROOM -- LAST NIGHT
desc54.592,desc,,"Kendall, coming through the door as we SLO-MO... Mueller, sprawled out on the floor, dead... Pike, tied to the chair, bullet hole in his forehead... Nunez, wounded, stumbling out the front door into the hurricane... And a badly wounded Childs, pistol out, TURNING towards the SOUND OF THE DOOR and FIRING... Kendall's arm, HIT with a SLUG, and he starts to go down... FREEZE-FRAME -- On Kendall's form, falling."
utter54.593,utter,KENDALL (V.O.),I don't think he meant to do it. It was just reflex -- he'd already been gutshot. I must have passed out cause next thing I knew...
scene55,slugline,,EXT. LOUISIANA BAYOU -- DAWN
desc55.594,desc,,"The sounds of RUNNING and HEAVY BREATHING. Kendall's eyes flutter open. He's on Dunbar's back, being carried through the woods. The sound of GUNFIRE and a TREE BRANCH SHATTERS next to them. Someone is chasing them. Trying to kill them. Nunez. Dunbar bobs and weaves as another volley of bullets comes from behind and we can now hear ROTOR BLADES APPROACHING..."
scene56,slugline,,EXT. CLEARING -- DAWN
desc56.595,desc,,"As Dunbar bursts into the sunlight, carrying Kendall. The entire thing dreamlike, what we saw at the opening, but from KENDALL'S VIEWPOINT -- the helicopter overhead, Nunez behind, Dunbar turning and shooting, NUNEZ GOING DOWN..."
scene57,slugline,,INT. KENDALL'S HOSPITAL ROOM -- PRESENT DAY
utter57.596,utter,KENDALL,And that's it.
desc57.597,desc,,Hardy is silent. Staring at him.
utter57.598,utter,OSBORNE,Nunez was chasing Dunbar.
utter57.599,utter,KENDALL,Because he'd shot Mueller.
utter57.600,utter,OSBORNE,"But you didn't see it, right?"
utter57.601,utter,KENDALL,"Like I said, I was in the kitchen. When I came out, Mueller and Pike were dead, Nunez and Childs were hit and Dunbar was gone."
utter57.602,utter,HARDY,Why did he come back for you?
utter57.603,utter,KENDALL,"I honestly don't know. Maybe to have someone to cover for him. And I wish I could, but there's no doubt in my mind he killed those men."
desc57.604,desc,,Silence. Kendall's got nothing more to say.
desc57.605,desc,,Okay. I think that's it. He rises and walks to the door.
utter57.606,utter,KENDALL,Mr. Hardy?
desc57.607,desc,,Hardy turns back.
utter57.608,utter,KENDALL,What did Dunbar tell you?
desc57.609,desc,,Hardy smiles and pushes out the door...
scene58,slugline,,EXT. STYLES' OFFICE -- DAY
desc58.610,desc,,"Hardy and Osborne stand before the Colonel, filling him in."
utter58.611,utter,HARDY,"Pike killed West, Dunbar killed Mueller, Childs, and Nunez."
utter58.612,utter,STYLES,Who killed Pike?
utter58.613,utter,HARDY,Someone must have got a shot off. He wasn't exactly a moving target.
desc58.614,desc,,Styles turns to Osborne.
utter58.615,utter,STYLES,What do you think?
utter58.616,utter,OSBORNE,It's too neat.
utter58.617,utter,HARDY,"""Too neat."" How long have you been an investigator?"
utter58.618,utter,OSBORNE,I don't think that has anything to do with --
utter58.619,utter,HARDY,"That means under a year. Let me explain what ten years of police work has taught me -- murder is basic. There are no conspiracies, no grand mysteries, and no evil puppet masters behind it all, pulling the strings; murder is shitty people doing a shitty thing to other shitty people -- it doesn't always make sense but it's always neat. Dunbar's our guy."
desc58.620,desc,,Osborne struggles to put it into words.
utter58.621,utter,OSBORNE,I just... He came back for Kendall. I don't think he's capable of murder.
utter58.622,utter,HARDY,"Everyone's capable of murder, Osborne."
desc58.623,desc,,"Osborne turns, making her case to Styles."
utter58.624,utter,OSBORNE,"Look, all we've got is what Kendall says, and he didn't actually witness any deaths except Nunez. He found West, he saw Mueller and Pike, but just their bodies -- he didn't see any crime committed."
utter58.625,utter,HARDY,"Well, I'm sure if he'd known this was all going to happen he'd have tried harder to witness it for you --"
utter58.626,utter,STYLES,West's body isn't in the creek bed.
desc58.627,desc,,"They stop arguing, turning to look at him."
utter58.628,utter,STYLES,We've already been over the terrain twice. Nothing.
utter58.629,utter,HARDY,"There was a hurricane, Bill, the wind probably moved it."
utter58.630,utter,STYLES,Habeas Corpus -- you have to have a body to have a crime.
utter58.631,utter,HARDY,"Okay, then let's widen the search to include the endzone in Giants Stadium and the trunk of my car --"
utter58.632,utter,STYLES,Without the body we have no physical proof. We need a confession.
utter58.633,utter,HARDY,"From Dunbar? I hate to break this to you, but I don't think he's gonna be all that psyched to put himself in for the death penalty."
utter58.634,utter,STYLES,Nevertheless --
utter58.635,utter,HARDY,Nevertheless what'? Kendall will testify and that'll be enough.
utter58.636,utter,STYLES,Not for me.
desc58.637,desc,,Beat. Almost accusingly:
utter58.638,utter,HARDY,You mean not enough to save you.
utter58.639,utter,STYLES,JAG gets here in three hours. Try for the confession.
scene59,slugline,,INT. COFFEE ROOM -- DAY
desc59.640,desc,,Dunbar looks up as Hardy and Osborne enter.
utter59.641,utter,HARDY,"(cheerfully) Hey, Ray! Just had a nice talk with your buddy Kendall -- seems you killed three people!"
utter59.642,utter,DUNBAR,That son of a bitch.
utter59.643,utter,HARDY,That'd be my reaction too --
utter59.644,utter,DUNBAR,He's lying.
utter59.645,utter,HARDY,"Well, why didn't you say so? We'll just drop all your charges, then --"
utter59.646,utter,DUNBAR,I'm serious --
desc59.647,desc,,Hardy leans across the table.
utter59.648,utter,HARDY,"Fuck ""you're serious"", Raymond, you got exactly zero truck with us; right now we'd take the word of a crackhead over yours, so if you've got something to say, say it."
utter59.649,utter,DUNBAR,Did Kendall tell you about the PX?
utter59.650,utter,OSBORNE,He said he worked there --
utter59.651,utter,DUNBAR,"No, did he tell you about it? About the business Childs ran?"
utter59.652,utter,OSBORNE,What business?
utter59.653,utter,DUNBAR,"Pills, shots, you name it, Basic's a lot easier when you don't feel pain --"
utter59.654,utter,HARDY,"So Childs made some side money, so what? People are dead, Ray, and the only one we have to blame is you --"
utter59.655,utter,DUNBAR,I didn't shoot West --
utter59.656,utter,HARDY,"Yeah, we know, Pike did."
desc59.657,desc,,Dunbar stares at him.
utter59.658,utter,DUNBAR,"You think you know everything, don't you? You haven't even scratched the surface."
desc59.659,desc,,"Hardy leans across the table, looks Dunbar dead in the eye."
utter59.660,utter,HARDY,"I know enough to know you got two choices -- you can sign a confession, in which case you'll probably spend the rest of your life in a military prison, or you can tell us to fuck off, in which case you'll probably get the gas chamber. (smiling) Am I scratching your surface yet?"
desc59.661,desc,,"Dunbar stares at him for a moment and then LAUNCHES HIMSELF at Hardy, SCREAMING. Tackles him to the floor, CHOKING HIM... Osborne, pulling her sidearm, and PISTOL WHIPPING Dunbar in the head! Dunbar goes sprawling off Hardy as M.P.'s rush into the room, RESTRAINING him. Hardy gets up, gasping, and stumbles to the door."
utter59.662,utter,OSBORNE,Hardy!
desc59.663,desc,,But he's already gone.
scene60,slugline,,INT. FORT MCKINLEY -- CORRIDORS -- DAY
desc60.664,desc,,"Hardy, walking angrily towards the front entrance, wheezing and massaging his neck. Osborne, running to catch up."
utter60.665,utter,HARDY,Why the fuck wasn't he in restraints?
utter60.666,utter,OSBORNE,I don't know.
desc60.667,desc,,Styles appears at the end of the hall.
utter60.668,utter,STYLES,"Tom, where are you going --"
utter60.669,utter,HARDY,"Home, I'm done."
utter60.670,utter,STYLES,What about the confession?
desc60.671,desc,,Hardy stares at him...
utter60.672,utter,HARDY,"You want a confession? Why don't you confess, Bill: people are dead and you don't give a shit about it! Only reason you called me is to protect your fucking job, you know this is your fault --"
utter60.673,utter,STYLES,What the hell are you talking about --
utter60.674,utter,HARDY,"I'm talking about West! We had him, Bill, we were there. You're the fucking Base Commander, you knew what he did to Cadets and you let him go on the way he always he has --"
utter60.675,utter,OSBORNE,"Styles couldn't reassign him, he's a legend --"
utter60.676,utter,HARDY,"You knew what he was capable of and you just stood by. It was just a matter of time till somebody fragged his ass, and you know what? He deserved it. There's your confession."
desc60.677,desc,,He pushes past a shocked Styles and walks out the door.
scene61,slugline,,EXT. FORT MCKINLEY -- PARADE GROUNDS -- DAY
desc61.678,desc,,"Hardy storms across the grass. Osborne, still following."
utter61.679,utter,OSBORNE,"Goddammit, Hardy, you can't just leave --"
utter61.680,utter,HARDY,Watch me.
utter61.681,utter,OSBORNE,You said you owed Styles and now you're gonna turn your back on him?
desc61.682,desc,,Hardy whirls on her.
utter61.683,utter,HARDY,"West was a monster! Fifteen years ago, I was here, I was Section Eight, I was Pike. Fuck being the knife dummy -- that thing he did, stripping Pike down, making him stand outside all night? He did that every year, he did that to me. Fifteen years ago, I wanted him dead, and now I'm supposed to care that somebody offed him? Sorry, no can do. I tried."
utter61.684,utter,OSBORNE,"You did more than try. You cracked Dunbar in less than three minutes, as an investigator you're phenomenal --"
utter61.685,utter,HARDY,"Phenomenal at taking bribes, right?"
desc61.686,desc,,A beat. Osborne shakes her head.
utter61.687,utter,OSBORNE,"I was starting to believe you, you know? That you weren't who everyone said. I guess I was wrong --"
utter61.688,utter,HARDY,"Oh, spare me the reverse psychology bullshit! This isn't my ""great second chance"", Osborne. Everyone thinks I'm a piece of shit cop who took money and nothing is going to change that. Nobody will ever know what happens here --"
utter61.689,utter,OSBORNE,But you will.
desc61.690,desc,,Hardy stares at her.
utter61.691,utter,HARDY,Why do you care?
utter61.692,utter,OSBORNE,"Because it's my job. Because people are dead. Because of the whole honor and duty thing, make a difference in the world, crap like that. (pause) We can do this, Hardy."
desc61.693,desc,,Hardy looks at the ground.
utter61.694,utter,OSBORNE,Two and a half hours. That's all I'm asking. Two and a half hours to maybe get the truth.
desc61.695,desc,,Silence. Hardy looks back up at her. Speaking softly:
utter61.696,utter,HARDY,I didn't shoot West...
utter61.697,utter,OSBORNE,What?
utter61.698,utter,HARDY,"Dunbar... He said he didn't shoot West. West wasn't shot, Kendall said he was blown apart by a phosphorous grenade and Dunbar never saw the body."
desc61.699,desc,,They stare at each other for a moment...
scene62,slugline,,INT. COFFEE ROOM -- DAY
desc62.700,desc,,Hardy and Osborne enter to find Dunbar in SHACKLES.
utter62.701,utter,DUNBAR,I apologize --
utter62.702,utter,HARDY,You saw West's body.
utter62.703,utter,DUNBAR,Of course --
utter62.704,utter,OSBORNE,Where?
utter62.705,utter,DUNBAR,The creek bed --
utter62.706,utter,HARDY,And he'd been shot.
utter62.707,utter,DUNBAR,Yeah --
utter62.708,utter,OSBORNE,What about the phosphorous grenade?
utter62.709,utter,DUNBAR,"One went off, yeah, but it didn't touch him -- I thought you knew this --"
utter62.710,utter,HARDY,Tell it to me.
scene63,slugline,,INT. LOUISIANA BAYOU -- CREEK BED -- LAST NIGHT
desc63.711,desc,,"Dunbar and Nunez RUNNING towards the glow of phosphorous and sound of GUNFIRE. They come over the hill to see Childs and Kendall, standing over WEST'S BODY. Dunbar stops, shocked."
utter63.712,utter,DUNBAR,"Holy fuck... Holy fuck, what the fuck did you guys do?"
utter63.713,utter,CHILDS,We found him like this...
desc63.714,desc,,"Dunbar edges closer, looking at West. With BULLET HOLES. His chest, riddled."
utter63.715,utter,KENDALL,Somebody emptied a full clip into him --
utter63.716,utter,HARDY (V.O.),Stop.
scene64,slugline,,INT. COFFEE ROOM -- PRESENT DAY
desc64.717,desc,,Kendall told us Mueller was the one
utter64.718,utter,DUNBAR,"He's lying, then. We didn't see Mueller till we got to the cabin."
scene65,slugline,,INT. CABIN -- LAST NIGHT
desc65.719,desc,,"Dunbar, Kendall, Childs, and Nunez push through the door to find Mueller in his undershirt, a FIRE burning in the hearth."
utter65.720,utter,MUELLER,"Jesus, what happened?"
utter65.721,utter,DUNBAR,(breathing hard) West... he's dead.
utter65.722,utter,OSBORNE (V.O.),Back up.
scene66,slugline,,INT. COFFEE ROOM -- PRESENT DAY
utter66.723,utter,OSBORNE,Mueller was alone in the cabin?
utter66.724,utter,DUNBAR,Yeah.
scene67,slugline,,INT. CABIN -- LAST NIGHT
utter67.725,utter,MUELLER,Pike and I got separated... then I heard gunfire. Close.
utter67.726,utter,DUNBAR,So did we. Why didn't you come?
desc67.727,desc,,"Mueller looks down, scared."
utter67.728,utter,MUELLER,I was afraid...
desc67.729,desc,,Mueller voice FADES OUT as he continues to talk.
utter67.730,utter,DUNBAR (V.O.),I didn't buy it. But Mueller had all three of his grenades.
desc67.731,desc,,Mueller shows his three grenades to the others.
scene68,slugline,,INT. COFFEE ROOM -- PRESENT DAY
utter68.732,utter,OSBORNE,At least you and Kendall agree on that.
utter68.733,utter,HARDY,What happened next?
desc68.734,desc,,Dunbar shudders.
utter68.735,utter,DUNBAR,Pike came back.
scene69,slugline,,INT. CABIN -- LAST NIGHT
desc69.736,desc,,"Pike, staggering in through the door. The others get up from where they are sitting -- it's been awhile since they arrived. Pike shouts at Mueller:"
utter69.737,utter,PIKE,What the fuck happened to you --
utter69.738,utter,MUELLER,What the fuck happened to you? One minute you're next to me and the next you're gone and the sky lights up like fucking Christmas --
utter69.739,utter,DUNBAR,"Where have you been, Jay?"
utter69.740,utter,PIKE,Wandering through a hurricane trying to find this place. It's gettin' bad out there -- (looking around) Where's West?
utter69.741,utter,CHILDS,"Yeah, right..."
utter69.742,utter,DUNBAR,Shut up. (to Pike) West's dead.
desc69.743,desc,,A beat.
utter69.744,utter,PIKE,What?
desc69.745,desc,,Silence. All of them staring at Pike.
utter69.746,utter,DUNBAR,"Where have you been, Jay?"
desc69.747,desc,,"Pike, suddenly understanding. Fear creeping into his face."
utter69.748,utter,PIKE,"Oh, no... no, fuck that --"
desc69.749,desc,,"He moves to the door, but..."
utter69.750,utter,NUNEZ,Hey!
desc69.751,desc,,"Nunez, with his PISTOL out. Trained on Pike."
utter69.752,utter,PIKE,"Roberto, what the fuck?"
utter69.753,utter,DUNBAR,We just want to check your pack --
utter69.754,utter,PIKE,Why?
utter69.755,utter,MUELLER,Whoever shot the Sarge blew a grenade first --
utter69.756,utter,PIKE,"Blame the nigger, then, huh? Someone turns up dead, you just look for the darkest face in the crowd --"
utter69.757,utter,DUNBAR,You know it's not like that --
utter69.758,utter,PIKE,Do I?
desc69.759,desc,,The CLICK as Nunez pulls back the pistol's hammer.
utter69.760,utter,NUNEZ,Let him check your pack.
desc69.761,desc,,"Pike stares at them and then throws his pack down, angrily. Dunbar goes to it, opens it, and reaches in. Pulls his hand out. Only TWO GRENADES. Looks at Pike. Sadly."
utter69.762,utter,DUNBAR,Tie him up.
scene70,slugline,,INT. CABIN -- LAST NIGHT
desc70.763,desc,,"Later. The fury of the storm has increased. Kendall, Childs, Nunez, and Mueller, in the KITCHEN looking for food."
scene71,slugline,,IN THE LIVING ROOM
desc71.764,desc,,"Pike, tied to the chair. Dunbar sitting in a corner, listening to the hurricane rage outside. Pike watches him."
utter71.765,utter,PIKE,"Just like the first day, huh? You standing guard on me."
desc71.766,desc,,"A CREAKING as the cabin SHIFTS on it's foundation. Dunbar looks up at the roof, scared. It holds."
utter71.767,utter,PIKE,This place ain't gonna hold much longer.
desc71.768,desc,,"Dunbar doesn't reply. Still staring nervously at the roof. Pike looks to make sure the others out of earshot, then:"
utter71.769,utter,PIKE,"You and me are friends, right?"
desc71.770,desc,,No reply.
utter71.771,utter,PIKE,Right?
utter71.772,utter,DUNBAR,Yeah...
desc71.773,desc,,Pike takes a deep breath.
utter71.774,utter,PIKE,"You gotta untie me. (off Dunbar's look) I didn't do this thing, Ray."
utter71.775,utter,DUNBAR,You hated West more than any of us.
utter71.776,utter,PIKE,"Maybe, but that don't make me a killer --"
utter71.777,utter,DUNBAR,You're the only one missing a grenade.
utter71.778,utter,PIKE,Which anyone coulda taken out of my gear on the chopper. Were you watching your pack on the ride in?
desc71.779,desc,,Dunbar starts to get up.
utter71.780,utter,PIKE,"Ray, this is my life here. I ain't gonna pretend I'm not happy West is gone, but you know I couldn't have done this. It's not in me."
utter71.781,utter,DUNBAR,"If not you, then who?"
utter71.782,utter,PIKE,Mueller.
utter71.783,utter,DUNBAR,"Oh, come on --"
utter71.784,utter,PIKE,"We're sweeping our area and suddenly he's gone. Couple minutes later, phosphorous grenade pops off about a"
desc71.785,desc,,third of a click away --
utter71.786,utter,DUNBAR,That's exactly what he says about you.
utter71.787,utter,PIKE,"Who you gonna trust, Ray? Him or your friend?"
desc71.788,desc,,Dunbar stares at him.
utter71.789,utter,DUNBAR,"You hated West, Mueller loved him --"
utter71.790,utter,PIKE,"Enough to go to prison? Childs' PX scam, Mueller was in on it --"
utter71.791,utter,DUNBAR,Bullshit.
