segment-id,segment-type,segment-speaker,segment-text
scene82,slugline,,INT. GRISWOLD'S SUBURBAN HOME - BEDROOM - NIGHT
desc82.910,desc,,Harriet's atop the bed. Her withered legs sprawled limply across Griswold's lap. He's massaging them. She watches him for a beat...
utter82.911,utter,HARRIET GRISWOLD,Erwin. Did you ever take a caregiver deduction on our taxes?
utter82.912,utter,GRISWOLD,I take whatever deductions the law says we're entitled to.
desc82.913,desc,,"He can see in her look, she's not satisfied with his answer."
utter82.914,utter,GRISWOLD (CONT'D) HARRIET GRISWOLD,Are you sure you're doing the right thing in this case?
utter82.915,utter,GRISWOLD,What exactly are you concerned about?
utter82.916,utter,HARRIET GRISWOLD,I don't doubt the law is on your side. But I feel sorry for this Moritz. Can you imagine coping with the burden of my polio if-GRISWOLD You have NEVER been a burden to me. You have been so productive all your life.
utter82.917,utter,HARRIET GRISWOLD,But I've always had help.
desc82.918,desc,,He knows it. Griswold considers her. After a long beat...
utter82.919,utter,GRISWOLD,I can't imagine how Charles Moritz manages. It must take remarkable fortitude. Really. ... But I don't get to indulge in sentiment. I took an oath to protect the constitution because it protects the country. I can't let these Ginsburgs attack it piece-by-piece.
utter82.920,utter,HARRIET GRISWOLD,I don't envy you.
desc82.921,desc,,He smiles. And goes back to rubbing her legs.
utter82.922,utter,GRISWOLD,You should. I'm a very lucky man.
scene83,slugline,,INT. GINSBURG APARTMENT - NIGHT
desc83.923,desc,,"Martin, in his usual golf shirt and French apron, is cooking IN THE KITCHEN. James is drawing dinosaurs on THE COUNTER BETWEEN THE KITCHEN AND DINING ROOM. IN THE DINING ROOM: Ruth paces. Notes in hand. Practicing..."
utter83.924,utter,RUTH,(to herself) Sex and race are both unalterable biological traits...
desc83.925,desc,,She's forgetting something. She checks her notes: Of course. IN THE KITCHEN: Martin lifts a flambe pan warming on the stove. And... WHOOSH! He ignites the Calvados inside.
utter83.926,utter,JAMES,(running into the kitchen) Whoa! Cool!
desc83.927,desc,,"Martin pours the flaming liquor over a pan of chicken livers. THE DOORBELL RINGS. As Ruth goes to answer it, Jane finds her..."
utter83.928,utter,JANE,Mom. Can I be on the jury?
utter83.929,utter,RUTH,"There is no jury in federal appeals court. No witnesses, no evidence. ... It's just you and the judges."
desc83.930,desc,,"She looks to Jane and smiles. Then opens THE FRONT DOOR to GERALD GUNTHER (44). He's genial, with graying hair and a bald crown. He wears a collared shirt and gray sweater. Ruth is delighted to see him."
utter83.931,utter,RUTH (CONT'D),"Gerry. Jane, you remember my old professor, Gerald Gunther."
desc83.932,desc,,He has a vaguely European accent. As Ruth takes his coat:
utter83.933,utter,GUNTHER,"A little specificity, Mrs. Ginsburg. Former professor. (to Jane) Look at you. All grown up."
desc83.934,desc,,Jane smiles. As he follows them into the DINING ROOM:
utter83.935,utter,GUNTHER (CONT'D),"Hello, James."
utter83.936,utter,JAMES,(back to drawing)
utter83.937,utter,JANE,What do you think of our courtroom? The place has been transformed into a rough facsimile of a
desc83.938,desc,,"courtroom. The table serves as a judges' bench. A dictionary lectern, the lawyer's podium."
utter83.939,utter,GUNTHER,"All it's missing is Justice holding her scales. So, who did Mel find to be the third judge?"
utter83.940,utter,RUTH,(intimidated) Pauli Murray.
utter83.941,utter,GUNTHER,He's not making it easy for you.
utter83.942,utter,JANE,Who's Pauli Murray?
utter83.943,utter,GUNTHER,Thurgood Marshall himself called Pauli's writings the Bible of the Civil Rights Movement.
desc83.944,desc,,"Martin enters, wielding a meat tenderizer."
utter83.945,utter,MARTIN,Gerry. I come bearing your gavel.
scene84,slugline,,INT. GINSBURG APARTMENT - DINING ROOM - LATER
desc84.946,desc,,"Beneath a drawing (by James) of Justice, the moot-court judges sit behind the dining room table. Laid out on the table: sliced baguette, apple, vegetables. And a heaping, garnished platter of chicken liver pate. Gerry BANGS his meat tenderizer gavel. Mel is to his left. Biting into a baguette slice topped with pate, he's impressed. To Gerry's right is PAULI MURRAY (61) -- a petite, black woman with short hair in tight curls and round glasses. Her grin extenuated by joyous laugh lines. Martin watches from the couch. With Jane."
utter84.947,utter,GUNTHER,"Counsel for the appellant, you may proceed. Again."
desc84.948,desc,,"Ruth, at the lectern, takes a breath. As the ""judges"" continue to snack."
utter84.949,utter,RUTH,"Your honors and may it please the court. Section 214 of the tax code covers employed single women who care for their dependents. But excludes Charles Moritz, a bachelor providing-PAULI My wife stays home to raise our children. You're saying she's oppressed?"
utter84.950,utter,RUTH,"No Judge. But as a man, you-MEL Stop. Stop. (he finishes chewing) Never make it about the judge."
utter84.951,utter,GUNTHER,You don't think the judge knows he's a man?
utter84.952,utter,MEL,I don't think she needs to put him on the defensive about it.
utter84.953,utter,PAULI,"In Brown, we put it out there without apology: This. Is. Wrong."
utter84.954,utter,MEL,"Well, no offense, but Ruth doesn't exactly have Thurgood Marshall's...... Balls? Gravitas."
utter84.955,utter,PAULI,MEL
desc84.956,desc,,"Nothing resolved, the conversation's over. Ruth shuffles her papers to cover her frustration. Jane gives Martin a worried look. His smile says ""Don't worry."""
utter84.957,utter,RUTH,Should I start again? Ya think?
utter84.958,utter,MEL GUNTHER,Whenever you're ready.
utter84.959,utter,RUTH,"Your honors and may it please the court. Section 214 of the tax code covers employed single women who care for their dependents. But excludes Charles Moritz, a bachelor providing the same care. There is no rational basis for-GUNTHER Why isn't it rational? Men go out. Women stay home. That's been the way of things for thousands of years."
desc84.960,desc,,Ruth takes a breath. Keeps her cool.
utter84.961,utter,RUTH,Historical justification was also used to legitimize the separation of the races. Now classification-PAULI You're saying race and gender are the same?
utter84.962,utter,RUTH,Both are unalterable biological traits of-PAULI This nation struggles to give blacks fair representation throughout society.
utter84.963,utter,MEL,(to Gunther) Would you pass the...
desc84.964,desc,,Ruth watches Gunther pass the pate.
utter84.965,utter,PAULI,"(still going) ...Are you saying that, if we decide in your client's favor, we're committing ourselves to working toward half our, I don't know... firemen being women? Half our nurses being men?"
utter84.966,utter,RUTH,Why shouldn't men be nurses? If women want to fight fires-MEL What about pilots?
utter84.967,utter,RUTH,Again if women-MEL (chewing) Judges? Why not?
utter84.968,utter,RUTH MEL,Generals? CEOs? What about garbage men? You wanna be a garbage man?
utter84.969,utter,RUTH,"And men should be teachers or raise children, if they want. Percentages aren't the point."
utter84.970,utter,MEL,No. Wrong. Wrong. You're screwing it up!
utter84.971,utter,RUTH (CONT'D) (CONT'D),People should be able to pursue their passions and--
desc84.972,desc,,She holds up the Government's APPENDIX E:
utter84.973,utter,RUTH (CONT'D),Have you seen the appendix attached to their brief? Laws written by men who think we're privileged to be excused from men's obligations. It's not a privilege. It's a cage. These laws are the bars.
desc84.974,desc,,As they all fall silent. Ruth realizes she's blown it. Mel eyes her smugly...
utter84.975,utter,MEL,"(smearing pate onto bread) And you're going to take on all of them at once, is that it?"
utter84.976,utter,RUTH,You asked the questions.
utter84.977,utter,MEL,"(harshly) That doesn't mean you answer them, Ruth. You're making the government's case for them."
desc84.978,desc,,"Jane's surprised, and angered, by his tone."
utter84.979,utter,MEL (CONT'D),"Either you make this case about one man, or you lose. Because to the judges, you're not talking about women in the abstract. You're talking about their wives. At home. Baking briskets."
utter84.980,utter,JANE,You braise a brisket. You don't bake it.
desc84.981,desc,,Mel shoots her a look. As Martin chuckles.
utter84.982,utter,GUNTHER,"Perhaps that's enough, Mel."
utter84.983,utter,MEL,"No. I don't think it is, Gerry. (to Ruth) Since you were a girl, you've been pretty and smart as a whip. But you're coming off as some bitter, unlikable shrew I don't recognize. And let me tell you: if that's who shows up in Denver, Ruth, you'll blow it. And would it kill you to smile?"
utter84.984,utter,RUTH,That's your sage advice: ignore the judges and smile?
desc84.985,desc,,Mel bites into the bread. With his mouth full:
utter84.986,utter,MEL,But I will say your pate is the best I've ever tasted.
desc84.987,desc,,"Ruth's look says, Choke on it. Martin rises and approaches Ruth. Gently. Supportive. An excellent teacher, he talks just to her..."
utter84.988,utter,MARTIN,"You could evade. (modelling) ""Do you think women should be firefighters?"" ... I've never considered it. Because my client isn't a firefighter. Jane's watching. Martin's ""teaching"" Ruth, but without"
desc84.989,desc,,condescension. Wanting only her success. Ruth listens. With trust and affection. It's intimate... And Jane is affected.
utter84.990,utter,MARTIN (CONT'D),"Or refocus. With respect, Judge. This case isn't about firemen; it's about taxpayers. And there is nothing inherently masculine about paying taxes."
desc84.991,desc,,Mel looks up. That's not bad. He shares a look with Gunther and Pauli.
utter84.992,utter,MARTIN (CONT'D),"Or crack a joke. Your honor, no one who's raised children could be intimidated by a burning building. Then lead them back to your case."
desc84.993,desc,,Ruth looks to Martin: Thank you.
utter84.994,utter,MEL,Marty. You should do the oral argument.
desc84.995,desc,,It lands like a grenade...
utter84.996,utter,MARTIN,No. No way. I was just... Ruth is the expert in gender law.
utter84.997,utter,GUNTHER,At least half this case is tax.
utter84.998,utter,MEL,The most important thing is that Charles Moritz wins.
utter84.999,utter,MARTIN,"I said no. Drop it, Mel."
desc84.1000,desc,,A beat of silence. As Ruth crumbles...
utter84.1001,utter,PAULI,"They could split the time. Martin goes first, focuses the argument on"
desc84.1002,desc,,tax. Then Ruth steps in to talk
desc84.1003,desc,,so definitive. It's clear they agree.
scene85,slugline,,INT. GINSBURG APARTMENT - FRONT HALL - LATER
desc85.1004,desc,,"The 'Judges' are getting ready to leave. As Ruth chats with Gunther and Pauli, Martin sidles up to Mel. Quietly. Angrily."
utter85.1005,utter,MARTIN,There is no aspect of the law at which Ruth Ginsburg can be bested.
utter85.1006,utter,MEL,"Objection noted, counselor. She's still arguing half."
utter85.1007,utter,MARTIN,"I don't know how things work at the ACLU. But if anyone at my firm couldn't see that, he'd be fired."
utter85.1008,utter,MEL,She's written a revolutionary argument. But brief writing is an academic's job. Oral arguments require a lawyer who commands a judge's respect. A real appellate lawyer.
desc85.1009,desc,,Mel turns away -- suddenly cheerful. Leaving Martin to stew.
utter85.1010,utter,MEL (CONT'D),"Well, I think this was a very productive exercise. I have to get to a fundraiser. Pauli. Gerry. Are you headed downtown? They all leave..."
desc85.1011,desc,,"When the door closes, Martin looks to Ruth. And waits for her to speak first..."
utter85.1012,utter,RUTH,"You have such a light touch. It's effortless for you, isn't it?"
utter85.1013,utter,MARTIN,Mel was goading you. He wanted you to feel overwhelmed.
utter85.1014,utter,RUTH,Of course he was. He's a relentless prick. But that doesn't change the fact that I'm not ready.
utter85.1015,utter,MARTIN,But that's not your fault. You've never even done this before.
utter85.1016,utter,RUTH,Is that what I'm supposed to tell our client when I blow it in court?
desc85.1017,desc,,She's already walking away:
utter85.1018,utter,MARTIN,Where are you going?
utter85.1019,utter,RUTH,To figure out every question those judges can possibly ask me. I'm going to have answers for all of them.
scene86,slugline,,INT. RUTGERS LAW SCHOOL - RUTH'S OFFICE - DAY
desc86.1020,desc,,"Time has passed. Ruth is selectively packing books, journals, notes into a box. Millicent enters -- with another book in hand."
utter86.1021,utter,MILLICENT,"Do you want ""Theories in Public Taxation"" with you in Denver?"
utter86.1022,utter,RUTH,Who needs a tax reference? I have Marty.
desc86.1023,desc,,"IN THE ATTACHED OUTER OFFICE, MILLICENT'S PHONE RINGS. As she heads out and Ruth resumes packing:"
utter86.1024,utter,RUTH (CONT'D),Did you pack the Kirk v Commissioner briefs? Yes.
utter86.1025,utter,MILLICENT,(answering the phone) Rutgers Law.
desc86.1026,desc,,She covers the mouthpiece.
utter86.1027,utter,MILLICENT (CONT'D),It's Mel Wulf for you. Ruth waves her off.
utter86.1028,utter,MILLICENT (CONT'D),"(into the phone) I'm sorry, Mr.-(to Ruth) He says it's urgent. OFF RUTH: Hearing her."
scene87,slugline,,EXT. ACLU'S OFFICE BUILDING - DAY
desc87.1029,desc,,"ESTABLISH: Spring. The city is in bloom. Ruth and James come out of THE SUBWAY, and head for the entrance."
scene88,slugline,,INT. ACLU RECEPTION AREA - DAY
desc88.1030,desc,,"Ruth's kneeling before James. He's seated, swinging his legs."
utter88.1031,utter,RUTH,"Now just wait here. And I need you to be patient, okay? Don't get up. Don't wander off. And don't touch anything. Do you understand?"
desc88.1032,desc,,"Ruth notes the Receptionist, who's watching them skeptically."
utter88.1033,utter,RUTH (CONT'D),That nice lady is going to keep an eye on you. And if you get bored...
desc88.1034,desc,,"She scans the area. Then grabs a ""Prisoners' Rights"" pamphlet off a nearby table."
scene89,slugline,,INT. ACLU CORRIDOR / MEL WULF'S OFFICE - DAY
desc89.1035,desc,,Follow Ruth as she enters -- without knocking:
utter89.1036,utter,RUTH,What was so important?
desc89.1037,desc,,"Mel's on the phone. Before him is another lawyer. 43; in a tweed suit; with a gentle, aw-shucks demeanor: ALLEN DERR. Mel gestures for Ruth to sit beside Allen. Who half-rises, and offers a handshake:"
utter89.1038,utter,ALLEN DERR,I'm excited to work with you.
desc89.1039,desc,,Mel SHUSHES him. As Ruth sits -- unsure what's going on.
utter89.1040,utter,MEL,"(into phone) I understand. ... Yeah, she just walked in. ... And to you. He hangs up."
utter89.1041,utter,MEL (CONT'D),Okay. Ruth Ginsburg. Allen Derr.
utter89.1042,utter,ALLEN DERR,How do you do?
utter89.1043,utter,MEL,The Supreme Court announced this morning that they'll hear Reed v Reed on appeal from the Idaho Supreme Court.
utter89.1044,utter,RUTH,That's fantastic.
utter89.1045,utter,ALLEN DERR,Mrs. Reed is very excited for the opportunity.
utter89.1046,utter,MEL,Allen is Sally Reed's lawyer.
desc89.1047,desc,,Ruth is surprised -- pleasantly.
utter89.1048,utter,RUTH,Is the ACLU going to help?
utter89.1049,utter,MEL,You told me it was the right thing to do.
utter89.1050,utter,ALLEN DERR,Mel says you know this area of the law better than anyone.
utter89.1051,utter,MEL,"You're our secret weapon, Ruth."
desc89.1052,desc,,Ruth is shocked... Honored... Amazed:
utter89.1053,utter,RUTH,You want me...? In the Supreme Court?
desc89.1054,desc,,Mel can see she thinks she's being asked to argue the case:
utter89.1055,utter,MEL,I assured Allen you'd be eager to help him write his brief.
desc89.1056,desc,,She swallows her disappointment.
utter89.1057,utter,MEL (CONT'D),"You can basically just take the Moritz brief and change the pronouns around, isn't that right?"
utter89.1058,utter,RUTH,It's a bit more involved than that.
utter89.1059,utter,MEL,I was kidding. We'll get working right away. (rising) Allen. Enjoy the city. You should catch a show.
utter89.1060,utter,ALLEN DERR,"Oh! Well, thank you."
utter89.1061,utter,MEL,Kiki and I have some other things to discuss.
utter89.1062,utter,ALLEN DERR,"Of course! I'll be out of your way. (gathering his belongings) It was a pleasure, Ruth -- or Kiki! Goodbye, Mel. ...... Bye. Oh! (he remembers his hat) Bye."
desc89.1063,desc,,And he's gone. Mel's smile drops.
utter89.1064,utter,MEL,What a schmuck.
utter89.1065,utter,RUTH,Let me argue Reed in Court.
utter89.1066,utter,MEL,"Give me a break, Ruth."
utter89.1067,utter,RUTH,I am no less experienced in Federal Court than Allen Derr. If you're gonna use MY arguments-MEL He's been Sally Reed's lawyer for three years. She trusts him. She wouldn't even let ME plead the case. Now would you just listen for a second? She does.
utter89.1068,utter,MEL (CONT'D),"Ernie Brown called earlier. In light of Reed going to the Supreme Court, the government is offering to settle Moritz's case for a dollar."
utter89.1069,utter,RUTH,(getting it) Reed ups the profile of our case.
desc89.1070,desc,,They're getting nervous.
utter89.1071,utter,MEL,I told him to expect you in D.C. on Monday to sign the paperwork.
utter89.1072,utter,RUTH,Why would you--? Charlie won't want to settle.
utter89.1073,utter,MEL,Convince him.
utter89.1074,utter,RUTH,I will not. First you took half the argument away from me...
utter89.1075,utter,MEL,"Nobody took anything from you, Ruth. You weren't robbed in the night. I gave you this opportunity for the good of the cause..."
utter89.1076,utter,MEL (CONT'D),...not for your own personal glory.
utter89.1077,utter,RUTH,You think you gave this to me?!
utter89.1078,utter,MEL,"In fact I did. Jesus Ruth, get your emotions in check. You first."
desc89.1079,desc,,They stay that way. Eye to eye. Until...
utter89.1080,utter,MEL,Allen's going to argue in the Supreme Court that times have changed. We can't afford the 10th Circuit ruling that they haven't.
utter89.1081,utter,RUTH,Nothing would strengthen the argument more than the Appeals Court deciding for Charlie.
utter89.1082,utter,MEL,Yes. That would be very nice. But here in the real world-RUTH You think I can't be persuasive.
utter89.1083,utter,MEL,"Ruth, I've never been more certain of anything in my life."
utter89.1084,utter,RUTH,You don't get to tell me when to quit.
utter89.1085,utter,MEL,"You asked for my support. I put my neck out for you. And you couldn't even get through a moot court without embarrassing yourself. You'll lose Ruth! And when you do, it'll set back the women's movement by a decade or more. (MORE)"
utter89.1086,utter,MEL (CONT'D),We're dodging a bullet here. Are you really the only one who can't see that?
desc89.1087,desc,,A strained and silent beat. Before... Mel pulls a stack of documents from his desk drawer.
utter89.1088,utter,MEL (CONT'D),These are Allen's briefs from his previous appeals. Tie them into the framework of the Moritz brief. I'll review it when you're done.
desc89.1089,desc,,"Eyeing him coldly, Ruth doesn't move."
utter89.1090,utter,MEL (CONT'D),"It's a Supreme Court brief. .... I can assign it to someone else, if that's what you'd prefer."
desc89.1091,desc,,She hesitates. Then takes them from the desk. As she leaves:
utter89.1092,utter,MEL (CONT'D),"And Ruth, the sooner you call Charlie the better."
scene90,slugline,,INT. GINSBURG APARTMENT - KITCHEN - NIGHT
desc90.1093,desc,,"As Ruth pours coffee, Martin is watching her."
utter90.1094,utter,RUTH,You know I had this idea...
desc90.1095,desc,,She trails off.
utter90.1096,utter,MARTIN,What was it?
utter90.1097,utter,RUTH,"It doesn't matter. ... Thank you for working so hard on this. I know you had paying clients to worry about, too."
utter90.1098,utter,MARTIN,What were you going to say?
desc90.1099,desc,,She hesitates a beat. Then admits it -- the scope of her
utter90.1100,utter,RUTH,"We could have taken Appendix E from the Government's brief, that entire comprehensive list of laws that differentiate between the sexes, and turn it into our own hit list. (MORE)"
utter90.1101,utter,RUTH (CONT'D),"We could have started a special project at the ACLU to go after those laws one-by-one -- in the legislature, in the courts. Until women and men were genuinely equal under the law."
desc90.1102,desc,,She laughs at her own naivete.
utter90.1103,utter,RUTH (CONT'D),... And I've been running around claiming things have changed.
desc90.1104,desc,,She leaves. OFF MARTIN: Who doesn't know how to help her.
scene91,slugline,,INT. GINSBURG APARTMENT - BEDROOM - LATER
desc91.1105,desc,,"At her desk. OPERA on the radio. Her mother's portrait watching her. Ruth takes a long, slow sip of coffee. Then gets to work taking down the note cards and clippings still tacked to the wall... One by one. Jane approaches. But hesitates in the doorway. Watching..."
utter91.1106,utter,JANE,Daddy told me about the case. Why's Mr. Wulf being such a douchebag?
desc91.1107,desc,,Ruth's displeased with the language. But lets it go.
utter91.1108,utter,RUTH,He thinks I'm going to lose.
utter91.1109,utter,JANE,"Seriously? I can tell you from experience: no way, Jose."
utter91.1110,utter,RUTH,He didn't exactly give me a choice.
desc91.1111,desc,,Jane considers is...
utter91.1112,utter,JANE,"So do you want help taking apart your life's work, or is that something you'd rather do alone?"
desc91.1113,desc,,They share a look -- and really SEE each other.
utter91.1114,utter,RUTH,I know that this case... That I disrupted our lives. I'm sorry.
utter91.1115,utter,JANE,"For what? Doing your job? That's how men WANT us to feel. ... Mom, who was this for, if not me?"
scene92,slugline,,INT. MORITZ'S LIVING ROOM - DAY
desc92.1116,desc,,Moritz cradles the phone to his ear with his shoulder. He's cleaning up His Mother's lunch off the television tray.
utter92.1117,utter,MORITZ,"So you did it? ... We won. Ruth. Congratulations. ... And they'll say it, right? That I'm not a cheater. That the law is unfair."
utter92.1118,utter,RUTH,"No, Charlie. That's the point. They don't want to... They will never say that. A judge has to."
utter92.1119,utter,MORITZ,"But if they don't say it, Ruth... how have I gotten justice?"
utter92.1120,utter,RUTH,You get the money.
desc92.1121,desc,,Moritz considers this. And it doesn't sit right.
utter92.1122,utter,MORITZ,"What about everyone else? When you came to see me, you said-Ruth knows Jane is listening, and is sad to say it, but..."
utter92.1123,utter,RUTH,That's for another day.
utter92.1124,utter,MORITZ,But could we win?
utter92.1125,utter,RUTH,"We could. (looking at Jane) And the impact would last generations. But in the end, you may walk away with nothing. ... Charlie. The ACLU feels it's for the best if you take the offer."
utter92.1126,utter,MORITZ,"... But you're my lawyer, Ruth. What do you think? Off Ruth: with a decision to make."
scene93,slugline,,INT. DOJ - BROWN'S OFFICE - DAY
desc93.1127,desc,,Brown opens the door to Ruth. He takes her hand. Warmly. She's mildly surprised to see Griswold behind him. Ruth. BROWN
utter93.1128,utter,RUTH,"Hello, Professor Brown. Dean Griswold."
utter93.1129,utter,GRISWOLD,(as they shake hands) Mrs. Ginsburg. I'm pleased you found a use for your Harvard Education.
utter93.1130,utter,RUTH,"Oh, no. What I'm doing, I learned at Columbia."
desc93.1131,desc,,He sizes her up for an awkward beat... Until Brown steps in.
utter93.1132,utter,BROWN,Ruth was always my most thoroughly prepared student. So much to prove. These days the girls are as hopeless as the men. (offering her a seat) How's little Jane?
utter93.1133,utter,RUTH,Not so little. And we have another. James.
utter93.1134,utter,BROWN,They must keep you busy.
utter93.1135,utter,RUTH,Yes. Both of us.
utter93.1136,utter,GRISWOLD,Ernie has your paperwork ready.
utter93.1137,utter,RUTH,My client was very excited about your offer.
utter93.1138,utter,GRISWOLD,Good. Good.
utter93.1139,utter,RUTH,"He did, however, have some conditions."
utter93.1140,utter,BROWN,Conditions...? What kind of...?
utter93.1141,utter,RUTH,First of all. He'd like you to forgive a hundred percent of the money. None of this one dollar business.
utter93.1142,utter,BROWN,Ha. Well... I'm sure we can find a way to arrange that.
utter93.1143,utter,RUTH,And he'd like the government to concede that he did nothing wrong. And to enter into the court record that Section 214 of the Tax Code discriminates on the basis of sex. And is therefore unconstitutional.
desc93.1144,desc,,Griswold and Brown's smiles drop.
utter93.1145,utter,GRISWOLD,I can't agree to that. And you know it.
utter93.1146,utter,BROWN,Does Mel Wulf know about this?
desc93.1147,desc,,It's in Ruth's look: she's completely in control. Brown glances to Griswold -- who's eyeing Ruth coldly.
utter93.1148,utter,BROWN (CONT'D),(menacing) We'll see you in court.
scene94,slugline,,EXT. THE BROWN PALACE - DAY
desc94.1149,desc,,"A grand, brownstone hotel -- a wedge between two of Denver's broad boulevards. On a bright, cool autumn day."
scene95,slugline,,INT. HOTEL BATHROOM - DAY
desc95.1150,desc,,"IT'S THE SAME SCENE THAT OPENED THE MOVIE: Concealer, lipstick, mascara on the counter. RUTH BADER GINSBURG (36) is applying blush. When she's finished, she considers her reflection. She puts on A GOLD, SUNBURST PIN. And tries a smile. ... But it looks forced. She drops it. A breath. And she tries again. A different smile. And..."
utter95.1151,utter,RUTH,May it please the court. Not right yet. A smile. And...
utter95.1152,utter,RUTH (CONT'D),Your honors and may it please the court... That's not it either...
utter95.1153,utter,RUTH (CONT'D),May it please the court.
desc95.1154,desc,,She looks herself in the eye one more time. KNOCK-KNOCK-KNOCK... Ruth opens the door. It's Jane.
utter95.1155,utter,JANE,"Dad says, Justice delayed is justice denied."
