segment-id,segment-type,segment-speaker,segment-text
utter38.446,utter,RUTH,Section 214 of the tax code assumes a caregiver has to be a woman. This is sex-based discrimination... AGAINST A MAN. Poor guy.
utter38.447,utter,MARTIN RUTH,"If a federal court ruled that this law is unconstitutional, it would become the precedent others refer to and build on. Men and women both. It could topple the whole damn system of discrimination."
desc38.448,desc,,She notices the delight on his face.
utter38.449,utter,RUTH (CONT'D),What? ... What is it?
utter38.450,utter,MARTIN,No. Nothing. I'm just thrilled by your sudden enthusiasm for tax law.
desc38.451,desc,,She puts her arms around him:
utter38.452,utter,RUTH,Marty. We need to take this case.
scene39,slugline,,INT. ACLU RECEPTION AREA - DAY
desc39.453,desc,,"An open bullpen bustling with the urgency of a Military HQ. There's a culture war, and these are front-line soldiers. A sign over reception: AMERICAN CIVIL LIBERTIES UNION. An elevator slides open, REVEALING RUTH... She heads for THE RECEPTIONIST, crossing paths with ACLU STAFFERS (various ages, races, genders), hearing SNIPPETS OF CONVERSATION:"
utter39.454,utter,ACLU STAFFER 1,"Of course he says he's against bombing Cambodia. I want to know,"
desc39.455,desc,,"where's his bill to de-fund it? Another STAFFER is holding up a T-shirt -- a ""WANTED: DEAD OR ALIVE"" poster with a cop in the middle."
utter39.456,utter,ACLU STAFFER 2,(to a third staffer) It's derogatory. It's taunting. But it's speech. Not conduct.
utter39.457,utter,RUTH,(to receptionist) Mel Wulf is expecting me.
desc39.458,desc,,"Phone to her ear, the Receptionist motions for her to wait. MEL WULF, the ACLU's Legal Director (40, handsome, wildly smart), is escorting A GUEST to the elevator:"
utter39.459,utter,MEL,"I need exact words. Did he say he wants to get his hands on Nixon, or that he hopes the Viet Cong do?"
desc39.460,desc,,He notices Ruth at Reception. And grins mischievously.
utter39.461,utter,ACLU STAFFER 3,Why? What's the difference?
utter39.462,utter,MEL,Five years in prison. Would you excuse me?
desc39.463,desc,,"As Ruth waits, Mel sneaks up behind her..."
utter39.464,utter,MEL (CONT'D),(chanting) I'm a little acorn round / lying on the dusty ground...
desc39.465,desc,,"Ruth spins on him. As Mel jumps into an intricate choreographed routine of stomps, claps and jazz-hands."
utter39.466,utter,MEL (CONT'D),Everybody steps on me. / So I'm a little cracked you see...
desc39.467,desc,,Everyone stops. To watch. The Receptionist lowers the phone. Ruth smiles -- blushing.
utter39.468,utter,MEL (CONT'D),"I'm a nut / but that's no sin. / At Camp Che-na-wah, I'll fit right in."
desc39.469,desc,,Arms spread. Breathing heavy. A broad grin.
utter39.470,utter,MEL (CONT'D),"Ladies and gentlemen. The threetime Camp Che-na-wah All-Around Camper: Ruth ""Kiki"" Bader."
desc39.471,desc,,"A smattering of APPLAUSE. As Mel struts toward Ruth, he jokes to a laughing colleague..."
utter39.472,utter,MEL (CONT'D),Hey. You think this job's hard? I used to judge the fifteen-andunders with a color war trophy on the line. (to Ruth) Hi Kiki. Whaddya say?
scene40,slugline,,INT. ACLU OFFICES - CORRIDOR - LATER
desc40.473,desc,,Ruth follows Mel down a crowded hallway. He's reading the Tax Court Advance Sheets as they walk.
utter40.474,utter,MEL,You said you had a case. This is not A case. It's the opening salvo in a fifty-year war for a new class of civil rights.
utter40.475,utter,RUTH,Yes! Exactly!
utter40.476,utter,MEL,I can't help you. This is beyond my mandate.
utter40.477,utter,RUTH,American CIVIL LIBERTIES Union. Women's right are civil rights.
utter40.478,utter,MEL,I'm still getting flack for defending draft card burners. And a right to protest actually exists.
desc40.479,desc,,"He hands Ruth the Advance Sheets. As they stop before his office: ""Melvin Wulf / Legal Director"". He opens the door. But neither moves. After you."
scene41,slugline,,MEL (CONT'D) INT. MEL'S OFFICE - CONTINUOUS
desc41.480,desc,,"Mel closes the door behind them. Then relaxes into his chair, feet up on the desk. As Ruth sits across from him:"
utter41.481,utter,MEL,How's Marty? Still protecting the rich from the predations of the poor?
desc41.482,desc,,She gives him a look.
utter41.483,utter,RUTH,"If we're going to appeal, the court needs to agree there's a constitutional handle here."
utter41.484,utter,MEL,How did you even convince this guy to let you represent him?
utter41.485,utter,RUTH,"I'll take care of that. Alone, the"
utter41.486,utter,judges-MEL,Are you kidding me?
utter41.487,utter,RUTH,The judges may not give Marty and I the benefit of the doubt. But with your name alongside ours on the brief... He considers her...
utter41.488,utter,RUTH (CONT'D),You must see the opportunity this case represents.
utter41.489,utter,MEL,You think judges will be sympathetic because they all have prostates? Men and women eat at the same lunch counters. We drink at the same fountains. We go to the same schools.
utter41.490,utter,RUTH,Women can't attend Dartmouth.
utter41.491,utter,MEL,Men can't go to Smith.
utter41.492,utter,RUTH,Women police officers can't patrol New York City streets. We have to get credit cards in our husbands' names.
utter41.493,utter,MEL,"You're fifty-one percent of the population. You're not even a minority. Anyway, it's been tried. Muller. Goesaert. What's-her-name with the baseball bat."
utter41.494,utter,RUTH,Gwendolyn Hoyt. Exactly.
utter41.495,utter,MEL RUTH,"And morally, they were right."
utter41.496,utter,MEL,"Yet they lost. Look around you, Ruth. Morality doesn't win the day. Dorothy Kenyon couldn't even get women equality arguing a case with sex, murder, and prison-time on the line. You and Marty really think you're gonna do it with this guy and his taxes?"
scene42,slugline,,EXT. ACLU'S OFFICE BUILDING - DAY
desc42.497,desc,,A tower in Manhattan's financial district. A man holds the door for Ruth -- and she takes the other. She storms past Business Men and Secretaries. Taxis and phone booths. The sound of CAR HORNS AND CONSTRUCTION is oppressive. As she disappears down THE STEPS OF A SUBWAY STATION... A MOMENT LATER: Ruth re-emerges. Eyeing A PHONE BOOTH... She steps inside.
utter42.498,utter,RUTH,"(into the phone) Operator. I need a number. ... Denver, Colorado."
scene43,slugline,,EXT. LEXINGTON AVE. - DAY
desc43.499,desc,,"MARTIN'S ON THE CORNER, waving down a cab. As it pulls over, he's urging Ruth, Jane and James to hurry up..."
utter43.500,utter,MARTIN,C'mon! C'mon!
desc43.501,desc,,DOWN ON THE BLOCK: They're hurrying. Jane pulling Ruth's bag.
utter43.502,utter,RUTH,(to Jane) You're going to have to get James from school while I'm in Denver.
utter43.503,utter,JANE,"Mom. I told you, Denise and I are starting our consciousness-raising group."
utter43.504,utter,RUTH,Then take James with you. (looking them over) Will you be all right?
desc43.505,desc,,Jane puts a hand on James's shoulder.
utter43.506,utter,JANE,We'll survive somehow. Go kick ass.
desc43.507,desc,,Martin's loading her bag:
utter43.508,utter,MARTIN,Meter's running.
desc43.509,desc,,Ruth approaches him...
utter43.510,utter,RUTH,What if I can't convince him?
utter43.511,utter,MARTIN,What if you never try?
desc43.512,desc,,They kiss. And she gets in the taxi... Martin watches it all the way down the street.
utter43.513,utter,JAMES,Daddy. Why's Mommy going to Denver?
utter43.514,utter,MARTIN,She's climbing a mountain.
scene44,slugline,,E/I. MORITZ HOUSE - DENVER - DAY
desc44.515,desc,,"Ruth walks up the path to a modest home in a leafy Denver suburb. She rings the bell. No answer. She knocks, waits patiently. And finally tries looking through a nearby window."
utter44.516,utter,MORITZ (O.S.),Mrs. Ginsburg...
desc44.517,desc,,"She's startled. The front door has opened to reveal CHARLES MORITZ (60's, lived-in face, no shoes)."
utter44.518,utter,MORITZ (CONT'D),You're early.
utter44.519,utter,RUTH,"(checking her watch) I can come back in ten minutes, if you prefer."
utter44.520,utter,MORITZ,You might as well come in now and have your say.
desc44.521,desc,,"Ruth follows him into THE ENTRYWAY, where he indicates for her to removes her shoes. As she slips off her heels, her mountain seems steeper."
scene45,slugline,,INT. MORITZ HOUSE - LIVING ROOM - MOMENTS LATER
desc45.522,desc,,Moritz points out a sofa where Ruth can wait...
utter45.523,utter,MORITZ,I'll be with you in a minute.
desc45.524,desc,,He crosses the room to his MOTHER (85). In a wheelchair by a window. Napkin tucked into her shirt. Tomato Soup on a TV tray beside her.
utter45.525,utter,MORITZ (CONT'D),Mother. This is Ruth Ginsburg. The New York lawyer I told you about.
utter45.526,utter,RUTH,Mrs. Moritz... hello.
desc45.527,desc,,"Moritz's Mother gives Ruth a dismissive look. To her son: MORITZ'S MOTHER I thought she'd be bigger. As Ruth waits, she looks at family photos on the mantle. One in particular catches her eye: a young, proud Charlie as the drum major in a marching band."
utter45.528,utter,RUTH,I see you were a drum major. I was a twirler.
utter45.529,utter,MORITZ,That was a thousand years ago. So much for making a connection. Ruth pulls out a legal pad.
desc45.530,desc,,"Moritz finishes feeding his mom. He hands her a large-print crossword puzzle and tries to put a pencil in her hand, which SHAKES uncontrollably. Eventually, she secures it. Moritz returns to Ruth."
utter45.531,utter,RUTH,Mr. Moritz. About your case...
utter45.532,utter,MORITZ,"I don't have a case. Four lawyers told me so before I went to Court myself and asked for justice. And that judge... Tietjens, he basically said I was a tax cheat. Are you?"
utter45.533,utter,RUTH MORITZ,I've never cheated at anything in my life!
desc45.534,desc,,"Suddenly, from the other side of the room... and LOUD! MORITZ'S MOTHER ""Tasmanian egg-layer."" Eight"
utter45.535,utter,MORITZ,"Not now, Mom."
utter45.536,utter,RUTH,(ready to take notes) Tell me in your own words: why did you hire a nurse?
utter45.537,utter,MORITZ,If you've never cared for an ailing parent...
utter45.538,utter,RUTH,(pained by the memory) I have.
desc45.539,desc,,He's surprised.
utter45.540,utter,MORITZ,"Then you know. Between the dressing, the bathing, the toilet. It's not a task for one person. Especially when you have a day job. If it weren't for Cleeta, I'd have to put mom in a home."
utter45.541,utter,RUTH,And so you deducted Cleeta's salary on your taxes.
desc45.542,desc,,"""Tasmanian egg-layer."" Second"
utter45.543,utter,MORITZ,Mom. I'll help you in a bit.
utter45.544,utter,RUTH,"(loudly, helpfully) How about 'Platypus'?"
desc45.545,desc,,Moritz's Mother writes it down. Ruth smiles to Moritz. He doesn't smile back.
utter45.546,utter,MORITZ,I'm a salesman Mrs. Ginsburg. I know when I'm being sold.
utter45.547,utter,RUTH,"With due respect, you have $296 at issue. I'm not here for the money. We'd represent your appeal probono, if you'll let us."
utter45.548,utter,MORITZ,The judge said that Tax Code is plain. (MORE)
utter45.549,utter,MORITZ (CONT'D),The caregiver deduction is available to all women. But only to men whose wives are incapacitated or dead. Or who are divorced.
utter45.550,utter,RUTH,And you've never been married. ... The men who wrote that law couldn't even fathom that a bachelor choosing to take care of a parent at home might exist.
utter45.551,utter,MORITZ,So... what? The judge was wrong?
utter45.552,utter,RUTH,"Mr. Moritz, the LAW is wrong."
desc45.553,desc,,He takes a beat to respond.
utter45.554,utter,MORITZ,You're a long way from home. You must be hungry after your trip.
desc45.555,desc,,Ruth nods with a smile.
scene46,slugline,,INT. MORITZ RESIDENCE - KITCHEN - LATER
desc46.556,desc,,Moritz is making cold-cut sandwiches -- mixing his own mustard-horseradish spread. Ruth is at a small table.
utter46.557,utter,MORITZ,What's so difficult for my mother
desc46.558,desc,,is that she's KNOWS she's fading.
desc46.559,desc,,Ruth considers it...
utter46.560,utter,RUTH,"The hardest part for MY mom... It must have been-- When she was young, she was expected to tend to her father and brother, instead of going to college. ... The idea that now her daughter... that I was taking care of her..."
utter46.561,utter,MORITZ,How did you manage to do both? You were just a girl.
utter46.562,utter,RUTH,And you're 'just an unmarried man.' (she thinks about it...) We both confounded expectations.
desc46.563,desc,,He finishes the sandwiches and sits. Ruth bites into hers.
utter46.564,utter,RUTH (CONT'D),This is delicious. I was famished.
desc46.565,desc,,"He watches her eat for a moment. Moritz's Mother and her nurse, Cleeta (70), pass by IN THE"
utter46.566,utter,HALL... MORITZ,"If it's not for the money, then why are you here?"
desc46.567,desc,,She puts down the sandwich.
utter46.568,utter,RUTH,"The 14th Amendment to the United States Constitution says all people must be treated equally under the law. And yet, there are... I don't know how many laws -- like the caregiver deduction -- that say, in effect, women stay home, and men go to work, and that it should stay that way forever. ... I want to convince the federal courts that those laws are unconstitutional."
utter46.569,utter,MORITZ,(impressed) How do you do that?
utter46.570,utter,RUTH,"One case at a time. Starting with yours. We'll submit a brief stating our argument. Then the government will submit a response. And both sides will present oral arguments at the 10th Circuit Court of Appeals, here in Denver."
utter46.571,utter,MORITZ,(a knowing smile) So I'm a guinea pig?
utter46.572,utter,RUTH,"No, sir. You're the man marching out ahead of the band, leading the way. Just like the drum major you used to be."
desc46.573,desc,,He smiles.
utter46.574,utter,RUTH (CONT'D),"Can you imagine, Charlie, if our moms had grown up in a world where girls could dream as big as boys?"
desc46.575,desc,,She looks back to him. It's plain in his look: he's in.
scene47,slugline,,"EXT. WEIL, GOTSHAL & MANGES - NIGHT"
desc47.576,desc,,A brisk autumn evening. Martin and Tom Maller come out of the building. As they look and cross the street:
utter47.577,utter,MALLER,For God's sake. I've invested a lot of my own reputation building up your career. Now you're wanna dump it down the toilet for some cockamamie case?
utter47.578,utter,MARTIN,My contract says I need permission to take outside work. So I'm asking. But-MALLER You're on track to be the youngest partner at the firm. Do yourself a favor. Don't blow it.
desc47.579,desc,,He notices Martin's slowing down...
utter47.580,utter,MALLER (CONT'D),I thought you live uptown?
utter47.581,utter,MARTIN,I'm picking up Ruth's dry-cleaning around the corner.
utter47.582,utter,MALLER,Jesus Christ. ... What are you doing this for Marty? You're gonna go blindly traipsing into this case... for what? So the little woman can feel like she's a real lawyer?
utter47.583,utter,MARTIN,(holding in his fury) Tom. I am determined to-MALLER You really want to support her? Tell her the truth. Which is?
utter47.584,utter,MARTIN MALLER,The case is unwinnable. You must know that. Congress can write whatever taxes it wants. That's not open to constitutional attack.
utter47.585,utter,MARTIN,You only say that because no one's ever done it successfully before.
utter47.586,utter,MALLER,Fine. So try it. I won't stop you.
desc47.587,desc,,Martin's relieved.
utter47.588,utter,MALLER (CONT'D),"But when you lose, be ready for your career to come crashing back to Earth."
desc47.589,desc,,"As Maller leaves, checking his watch, Martin weighs the"
scene48,slugline,,INT. GINSBURG APARTMENT - NIGHT
desc48.590,desc,,"ON THE DINING ROOM TABLE: A dog-eared copy of TO KILL A MOCKINGBIRD, and an essay by Jane, crossed out and marked up in red pen -- ""Atticus Finch: Great American Lawyer."""
utter48.591,utter,RUTH,Murder can never be condoned. Least of all by a lawyer.
utter48.592,utter,JANE,"It's called justice, mom."
utter48.593,utter,RUTH,What's just to you may not be just to me or to someone else.
desc48.594,desc,,IN THE FOYER: Martin enters.
utter48.595,utter,JANE,You know what I mean.
utter48.596,utter,MARTIN,Good evening!
desc48.597,desc,,"Ignored, Martin notices THE BOOK on the table."
utter48.598,utter,JANE,Would it kill you to admit that maybe I'm actually right about something? This is an 'A' paper!
utter48.599,utter,RUTH,Of course it is. You're a beautiful writer. That's not the point.
utter48.600,utter,MARTIN,Whoa! Whoa! Whoa! ... Please tell me you're not going ten rounds over To Kill A Mockingbird.
utter48.601,utter,JANE,Daddy. Tell her Atticus Finch can be a role model.
utter48.602,utter,RUTH,He covers up Bob Ewell's murder. He is a terrible lawyer.
utter48.603,utter,JANE,Why? 'Cause you say so?
utter48.604,utter,RUTH,Not me. Canon One of The American Bar Association's
utter48.605,utter,JANE (CONT'D),... What are you talking about?!
utter48.606,utter,RUTH,Legal ethics.
utter48.607,utter,JANE,You'd do exactly the same thing -if you actually had a heart.
utter48.608,utter,MARTIN,All right. That's enough.
desc48.609,desc,,She storms off -- disappearing DOWN THE HALL. HER DOOR SLAMS.
utter48.610,utter,RUTH,I don't know where she gets her stubbornness.
desc48.611,desc,,"Martin lets it lie. As Ruth goes to THE DINING ROOM TABLE, and copies onto a note card a quote from a legal tome:"
utter48.612,utter,MARTIN,... So how are you?
desc48.613,desc,,"She looks at him: How am I? ... Then picks up one of the books open beside her, and hands it to him -- highlighted:"
utter48.614,utter,MARTIN (CONT'D),"(reading aloud) ""History discloses that woman has always been dependent upon man. Like children, she needs special care. This justifies a difference in legislation."""
utter48.615,utter,RUTH,Muller v Oregon. The law of the land.
desc48.616,desc,,She picks up another book...
utter48.617,utter,RUTH (CONT'D),"Or Bradwell v Illinois. (reading aloud) ""The destiny of woman is the benign offices of wife and mother. This is the law of the Creator."" ... And for how long have you been hearing the voice of the Creator, Justice Bradley?"
utter48.618,utter,MARTIN,Maybe The Creator submitted an amicus brief.
utter48.619,utter,RUTH,"On a stone tablet, no doubt. She tosses the book aside."
utter48.620,utter,RUTH (CONT'D),"I'm writing this brief, and citing the same cases, coming up against the exact same precedents as everyone before us. If this is what we go in with..."
desc48.621,desc,,"With a look, he shares her worry. FROM JANE'S BEDROOM comes BLARING MUSIC: ""OHIO"" by Crosby, Stills and Nash. Ruth and Martin share a look. When Ruth moves to get up, Martin waves her back..."
scene49,slugline,,INT. GINSBURG APARTMENT - JANE'S BEDROOM - MOMENTS LATER
desc49.622,desc,,Jane over her math homework is the mirror-image of Ruth with her brief. Martin KNOCKS and enters. I'm busy.
desc49.623,desc,,"He turns down the record. When Jane looks up at him, he's surprised to see her eyes are welled with tears... Come here."
desc49.624,desc,,"She sits beside him on the bed. And for a beat, lets him hug her... Then shrugs him off."
utter49.625,utter,JANE,I'm fine. I can be as tough as she is. ... She's a bully. She needs everybody to know how smart she is.
utter49.626,utter,MARTIN,You want Mommy to stop being smart?
utter49.627,utter,JANE,I want her to stop rubbing it in everyone's face all the time. (off his look) Don't tell me she doesn't.
utter49.628,utter,MARTIN,Rubbing it in people's faces is the only way she's ever gotten anyone to notice.
desc49.629,desc,,Jane hears him.
utter49.630,utter,MARTIN (CONT'D),"Grandma Celia died when Mom was about your age. But right up to her dying breath, they would read together, and debate ideas, and she'd make mom question everything. ... Jane, Mom isn't bullying you. She doesn't want you to feel small. She wants to share what her mother taught her. .... That's how she"
desc49.631,desc,,shows her heart. Jane is touched.
utter49.632,utter,MARTIN (CONT'D),Maybe she overdoes it sometimes.
scene50,slugline,,INT. GINSBURG APARTMENT - DINING ROOM - LATER
desc50.633,desc,,"Ruth is at the typewriter, still working. Martin enters. Takes one of her reference books. And joins her. Ruth looks up and watches him. ... Until he notices."
utter50.634,utter,RUTH,Is she okay?
utter50.635,utter,MARTIN,She'll be fine.
desc50.636,desc,,They resume working. Together. Until Ruth looks up again...
utter50.637,utter,RUTH,I love you.
utter50.638,utter,MARTIN,I love you.
scene51,slugline,,EXT. LOWER WEST SIDE - SIDEWALK - DAY
desc51.639,desc,,"A SHOP OWNER cleans graffiti off his store window. Cast iron facades. Pot-holed streets. Dumpsters overflowing. And against the gray sky, the Twin Towers are being built. In her up-town coat, Ruth is out of place. Searching for an address. Beside her, Jane, in a short skirt and knee-highs, hugs her denim jacket tighter against the blustery, lateautumn cold."
utter51.640,utter,JANE,This is stupid. You're the one who said I'm supposed to be in school.
utter51.641,utter,RUTH,"If you're going to write about Great American Lawyers, you may as well meet one."
desc51.642,desc,,"They come to a derelict building with an empty storefront. Share a wary look. And step over a drunk, passed out on the sidewalk. Entering..."
scene52,slugline,,INT. DOWNTOWN BUILDING - MOMENTS LATER
desc52.643,desc,,"As they come DOWN A LONG HALLWAY, Ruth grabs Jane's wrist, holding her back. Awestruck. DOROTHY KENYON is locking a door marked ""Attorney"" in peeling paint. She's slender, with a white bob beneath a broadrimmed, floppy hat. Her eyes are vivacious; they can flash from humor to fiery passion without blinking. Door locked, she turns. And finds them."
utter52.644,utter,KENYON,You ladies look lost.
desc52.645,desc,,Ruth watches her -- a long beat.
utter52.646,utter,KENYON (CONT'D),"Well, spit it out."
utter52.647,utter,RUTH,Ms. Kenyon. We're here to see you. I tried to make an appointment.
utter52.648,utter,KENYON,Here I am. I don't have all day.
utter52.649,utter,RUTH,... It's about Gwendolyn Hoyt.
utter52.650,utter,KENYON,Ah. In that case I have no interest in talking to either one of you.
desc52.651,desc,,"She shoves the keys into her large bag. As she blows by them, Ruth and Jane follow."
utter52.652,utter,RUTH,I'm arguing a case... Sexdiscrimination violates the equal protection principle.
utter52.653,utter,KENYON,'Equal Protection' was coined to grant equality to the negro -- a task at which it has dismally failed. What makes you think women would fare any better?
utter52.654,utter,RUTH,Please. If we could just talk for-Kenyon turns on them:
utter52.655,utter,KENYON,"You wanna know how I blew it, that it? What I'd do differently? Why? You think you can change the country?"
desc52.656,desc,,"She indicates Jane, who is taken by surprise."
utter52.657,utter,KENYON (CONT'D),You should look to her generation. They're taking to the streets. Demanding change. Like we did when we fought for the vote.
desc52.658,desc,,"Jane gives Ruth an ""I told ya so"" look."
utter52.659,utter,KENYON (CONT'D),Our mistake was thinking we'd won. We started asking please. As if civil rights were sweets to be handed out by judges.
utter52.660,utter,RUTH,"Protests are important. But changing the culture means nothing, if the law doesn't change. As a lawyer, you must believe that."
utter52.661,utter,KENYON,"Let me guess: you're a professor, aren't you? Yeah. A ton of knowledge, and no smarts."
utter52.662,utter,JANE,Mom. We should go.
utter52.663,utter,KENYON,You want advice? Here it is. Tell your client she won't find equality in a courtroom.
desc52.664,desc,,She walks away... Ruth following:
utter52.665,utter,RUTH,My client's name is Charles Moritz.
utter52.666,utter,KENYON,That's cute.
utter52.667,utter,RUTH,He hired a nurse who helps care for his mother. But he was denied a caregiver deduction on his taxes.
desc52.668,desc,,Kenyon does the calculation. It takes her a beat -- but just a beat -- to put it together. Kenyon stops.
utter52.669,utter,KENYON,He's never been married. You found a bachelor taking care of his mother at home? .... The judges will be repulsed by him.
utter52.670,utter,RUTH,Feeling anything is a start.
utter52.671,utter,KENYON,... What did you say your name was?
utter52.672,utter,RUTH,Ruth Bader Ginsburg.
desc52.673,desc,,She and Kenyon watch one another for an extended beat.
utter52.674,utter,KENYON,Well... Sorry Professor Ginsburg. Maybe someday. But the country isn't ready. Change minds first. Then change the law. ... (MORE)
utter52.675,utter,KENYON (CONT'D),"If you'll excuse me, the mayor's decided to rename the neighborhood, so now a developer's kicking thirty"
desc52.676,desc,,families out of a building he
desc52.677,desc,,As she heads to the stairwell...
utter52.678,utter,KENYON (CONT'D),... SoHo. Who's ever heard of such a ridiculous thing?
desc52.679,desc,,Ruth and Jane share a look: Whoa.
scene53,slugline,,EXT. LOWER WEST SIDE - SIDEWALK - LATER
desc53.680,desc,,It's raining hard as Ruth and Jane exit. They open their umbrellas. Ruth looks back the way they came. Then points Jane in the other direction.
utter53.681,utter,RUTH,Let's catch a cab.
desc53.682,desc,,They start walking.
utter53.683,utter,JANE,I know she's your personal hero and all. But she's kind of a bitch.
utter53.684,utter,RUTH,No. She's formidable. ... Dorothy Kenyon has been fighting for Civil Rights and Women's Rights and Labor Rights her entire career. She didn't always win. But she made damn sure she was taken seriously.
desc53.685,desc,,"The rain is pelting down. Ruth and Jane take cover under a scaffolding. A cab passes, but its dome light is off. They lower their umbrellas."
utter53.686,utter,JANE,She didn't help you. ... What are you going to do?
utter53.687,utter,RUTH,It's the right cause. It's the right client. But women have been losing this same argument for over a century.
utter53.688,utter,JANE,Well... just because you lost a hundred years before you started is no reason not to try to win.
