segment-id,segment-type,segment-speaker,segment-text
scene1,slugline,,INT. HOTEL BATHROOM - DAY
desc1.0,desc,,"Concealer, lipstick, mascara on the counter. RUTH BADER GINSBURG (36) is applying blush. When she's finished, she considers her reflection. She puts on A GOLD, SUNBURST PIN. And tries a smile. ..... But it looks forced. She drops it. A breath. And she tries again. A different smile. And..."
utter1.1,utter,RUTH,May it please the court.
desc1.2,desc,,Not right yet. A smile. And...
utter1.3,utter,RUTH (CONT'D),Your honors and may it please the court... That's not it either...
utter1.4,utter,RUTH (CONT'D),May it please the court.
desc1.5,desc,,"She looks herself in the eye one more time. HEAR: Driving, martial music. Horns and drums. It's the Crimson fight song ""Ten Thousand Men of Harvard."" AS A MALE CHORUS joins..."
scene2,slugline,,EXT. AUSTIN HALL - DAY
desc2.6,desc,,Well groomed white MEN (20s) march through a quad. Into an
scene3,slugline,,impressive building with columned arches.
desc3.7,desc,,"""Ten Thousand Men of Harvard want victory today...."" They're the future leaders of America. And in their well-cut dark suits, with their cocky grins, it's clear they know it. ""For they know that o'er old Eli, fair Harvard holds sway..."" But amidst the pants and loafers -- GLIMPSE: a pair of highheeled shoes, a skirt swaying, shoulder-length brown hair. ""So then we'll conquer all old Eli's men..."""
scene4,slugline,,INT. AUSTIN HALL - DAY
desc4.8,desc,,"AS THEY ENTER AN AUDITORIUM: She slows her step. Letting the men pass... IT'S RUTH (23 here). Petite, lean and striking. She takes in the size of the place, its grandeur. And is awed. ""And when the game ends, we'll sing again..."" Proud, she continues down the center aisle. ""Ten thousand men of Harvard gained victory today!"" Ruth finds a seat. And as the crowd quiets, smiles to the man she's settling beside. He stares. Confused by her presence. IN FRONT: A line of seated professors. AMONG THEM: Professor Ernest Brown. ERWIN GRISWOLD (52, formidable) comes to a podium:"
utter4.9,utter,GRISWOLD,"Settle down, please. ... Be seated."
utter4.10,utter,GRISWOLD (CONT'D),My name is Erwin Griswold. I'm the dean of this place. ... Welcome to Harvard Law School. We have no glee club here. The work is hard. The load is heavy. ... Take a moment to look around you...
desc4.11,desc,,Ruth does. There are over five hundred people in this grand room. Most of them are white. Only nine of them are women.
utter4.12,utter,GRISWOLD (CONT'D),In this room are Rhodes and Fulbright scholars. Phi Beta Kappa members. Student body presidents. A Harvard Crimson football captain. Pats on the back for the smiling sports hero.
utter4.13,utter,GRISWOLD (CONT'D),"Together, you will become lawyers. It is a privilege you share. And a responsibility that you accept. ... Consider: what does it mean to be a Harvard man? A Harvard man is intelligent, of course. But he is also tenacious. He is a leader devoted to the rule of law. (MORE)"
utter4.14,utter,GRISWOLD (CONT'D),He is mindful of his country. Loyal to tradition. And he is respectful and protective of our institutions.
desc4.15,desc,,OFF RUTH: Determined.
scene5,slugline,,INT. GINSBURG HARVARD APARTMENT - LATE DAY
desc5.16,desc,,"The garden apartment is small and uncluttered: mismatched furniture, books, baby toys and museum posters. IN THE BEDROOM: THE MARRIAGE OF FIGARO plays on a record. Ruth, in a slip, is considering the contents of her closet. One dress in hand, she pulls out another. She can't decide. She takes them with her... Out of the room. DOWN THE HALL... THE LIVING ROOM empty, she enters THE ADJACENT KITCHEN:"
utter5.17,utter,RUTH,(re: the dresses) Which one makes me look more like a Harvard man?
desc5.18,desc,,"MARTIN GINSBURG (24, classically handsome) is at the kitchen table. Bouncing their daughter JANE (1) on his knee. He looks up from a textbook before him. Adoring."
utter5.19,utter,MARTIN,I'm thrilled you look nothing like a Harvard man.
utter5.20,utter,RUTH,"Seriously, you know how I am at these things. It's the dean's dinner, Marty. I need to make a good impression."
utter5.21,utter,MARTIN,"You will, Kiki (pr: Kick-EE). But it's the other way around. You make the dress look good."
desc5.22,desc,,"She kisses him -- and Jane. Then notices Martin's untouched plate of ""food"" on the table."
utter5.23,utter,RUTH,"You barely touched your tuna casserole. I put onions in. They help, right?"
desc5.24,desc,,They don't. As he forces down a forkful:
utter5.25,utter,MARTIN,Yeah... Definitely.
utter5.26,utter,RUTH,(re: the dresses) I don't like either of these.
desc5.27,desc,,She breezes out of the room.
utter5.28,utter,MARTIN,(to Jane) So. Where were we? ... Ah. (reading aloud to her) The Tax Code disallows some deductions held to be contrary to the public interest. (off Jane's babbling) Just wait. This is the good part.
desc5.29,desc,,He eats a grape off her plate.
scene6,slugline,,INT. HARVARD UNIVERSITY CLUB - FOYER - NIGHT
desc6.30,desc,,"A grand room. Dignified and formal. MALE PROFESSORS in suits chatting collegially. THE EIGHT OTHER WOMEN of the class of 1959 (20s, intelligent, poised) are ingratiating themselves. Ruth enters. A vision in her swing dress and pearls. And takes it all in: The room. The crowd. The chatter... The men are proffering arms to the women. Forming a double-line to enter THE DINING ROOM... Before the doors, Dean Griswold and his wife, HARRIET GRISWOLD (52, on crutches, crippled by polio), are welcoming their guests..."
utter6.31,utter,HARRIET GRISWOLD,"Welcome. ... Hello, Professor."
utter6.32,utter,GRISWOLD,Harry. You're happy with the updated textbooks? ... Good.
desc6.33,desc,,Ruth prepares herself... Then joins in.
scene7,slugline,,INT. HARVARD UNIVERSITY CLUB - DINING ROOM - LATER
desc7.34,desc,,"Ruth eats her stewed chicken and lima beans with slow precision. She scans the room. They're around a formal dining table: men and women in alternating seats. Entrenched in conversation. Being served by Black Waiters. She eyes the women: Confident. Wise. With easy laughs. To her right: a YOUNG PROFESSOR faces away from her, ashing a cigarette in the ashtray between him and Ruth, and talking up one of the women, EMILY:"
utter7.35,utter,YOUNG PROFESSOR,"He said, ""Professor, have you corrected our papers?"" I said, ""Correcting them would take a lifetime. I'm merely grading them."""
desc7.36,desc,,"Emily laughs gregariously. DING-DING-DING. At the head of the table, Griswold TAPS HIS GLASS, rising. Ruth puts down her utensils neatly."
utter7.37,utter,GRISWOLD,Esteemed colleagues. Ladies. This is only the sixth year women have had the privilege to earn a Harvard Law degree. This little soiree is our way of saying welcome. (pointing her out) My wife Harriet and I are glad all nine of you have joined us.
desc7.38,desc,,APPLAUSE. Ruth is grateful. But notes that some professors are more enthusiastic than others.
utter7.39,utter,GRISWOLD (CONT'D),"Let us go around the table. And each of the ladies, report who you are, where you're from... And why you're occupying a place at Harvard that could have gone to a man."
desc7.40,desc,,"As Griswold sits, Ruth is disquieted. She and the other women exchange anxious glances. Harriet singles out the closest:"
utter7.41,utter,HARRIET GRISWOLD,"Why don't you get us started, dear?"
desc7.42,desc,,One of Ruth's CLASSMATES rises. White knuckling her chair:
utter7.43,utter,CLASSMATE,"I'm Hennie Callaghan. Father's a lawyer back in Minneapolis. He used to give me drafts of contracts to use for drawing paper. At some point, I got more interested in reading them than drawing on them. In a few years, it's going to be Callaghan and Callaghan."
utter7.44,utter,GRISWOLD,That was fine. Next?
desc7.45,desc,,EMILY's turn. She rises.
utter7.46,utter,EMILY,"Emily Hicks. Hello. Connecticut. When I finished Mt. Holyoke, my mother wanted me to get married. But I didn't want to do THAT. And I didn't want to be a teacher or a nurse. So when I-GRISWOLD Ha. That's not a very good reason."
desc7.47,desc,,Ruth watches Emily slump into her seat -- mortified. All eyes land on Ruth. Including Griswold's. She stands... And knocks over the Young Professor's ash tray. It lands with a heavy thud. Ruth stares at the ash and butts on the rug... When she looks up -- she eyes them all. The anxious women. The men watching her. Emily controlling her frustration. Griswold is waiting...
utter7.48,utter,RUTH,"I'm Ruth Ginsburg, from Brooklyn."
utter7.49,utter,GRISWOLD,And why are you here Miss Ginsburg?
utter7.50,utter,RUTH,"Mrs. Ginsburg, actually. My husband Marty is in the second-year class. ..... I'm at Harvard to learn about his work. So I can be a more patient and understanding wife."
desc7.51,desc,,Emily laughs. Several others gasp. And on Griswold's face is plain dislike. OFF RUTH: Seeing it.
scene8,slugline,,INT. GINSBURG HARVARD APARTMENT - BEDROOM - NIGHT
desc8.52,desc,,Ruth. Home from dinner. Rubbing her sore feet.
utter8.53,utter,RUTH,Come to dinner. The beans will be boiled. The chicken will be stewed. And you will be grilled. ... We came to Harvard to be lawyers. Why else?
desc8.54,desc,,"Martin, in an undershirt, climbs off the bed."
utter8.55,utter,MARTIN,It was an asinine question.
utter8.56,utter,RUTH,I couldn't just ignore it! But the way he looked at me. Now he'll never take me seriously.
utter8.57,utter,MARTIN,"You're smarter than everyone here. You'll be better prepared. Just stand up and say what you know. In this place, that's all the matters."
desc8.58,desc,,She turns her back: Unzip me.
utter8.59,utter,RUTH,In my experience even small mistakes are glaring when you stick out.
desc8.60,desc,,The dress falls to the floor. And he turns her around...
utter8.61,utter,MARTIN,Then you're lucky. Because you're very short.
desc8.62,desc,,She laughs. Despite herself.
utter8.63,utter,RUTH,"Oh, yeah? Why don't you come down here and say that to my face?"
desc8.64,desc,,"She pulls him into a kiss. Flirty. Fun... He lifts her. She buries her face in his neck, as they fall onto the bed."
scene9,slugline,,INT. LECTURE HALL - DAY
desc9.65,desc,,"The grand room is laid out like a Roman theater. Portraits of alumni stare down: Holmes, Brandeis, Frankfurter... Ruth sits in the first row. Surrounded by men. A textbook on the desk: Introduction to Contracts. At nine-thirty precisely, PROF. ERNEST BROWN (50) enters. And begins lecturing."
utter9.66,utter,BROWN,I'm Professor Brown. This is Introduction to Contracts. Hawkins versus McGee.
desc9.67,desc,,Ruth's hand flies up. Along with several others. Brown eyes one student not raising his hand -- and finds him on a huge
scene10,slugline,,seating chart with passport-size photos...
utter10.68,utter,BROWN (CONT'D),"State the case please, Mr. Pruitt."
desc10.69,desc,,PRUITT adjusts his tie as he rises.
utter10.70,utter,PRUITT,"Uh, good morning. I'm Donald Pruitt. I'm really honored to be here with-BROWN Hawkins v McGee."
desc10.71,desc,,As Pruitt flips through his textbook:
utter10.72,utter,PRUITT,"Hawkins v McGee. It's uh-- a fascinating breach-of-contract case that-(found it) Oh, right! Charles Hawkins hurt his hand. And McGee-BROWN Can someone help him, please?"
desc10.73,desc,,"As Pruitt deflates into his seat, a smug classmate, FITZPATRICK, sees Ruth's hand go up first. He raises his as well. Brown looks at Ruth. Checks his seating chart..."
utter10.74,utter,BROWN (CONT'D),Yes? ... Mr. Fitzpatrick.
desc10.75,desc,,"Fitzpatrick rises, giving Ruth a look..."
utter10.76,utter,FITZPATRICK,It was Charles's son who hurt his hand. ... Electrocution burn.
utter10.77,utter,BROWN,"And on what point does the case turn, Mr. Fitzpatrick?"
utter10.78,utter,FITZPATRICK,McGee promised to fix the hand...
desc10.79,desc,,Ruth frowns. She knows Fitzpatrick's not quite right. But notices that no one else seems bothered by it.
utter10.80,utter,FITZPATRICK (CONT'D),...by performing a skin graft. But McGee wasn't very familiar with the procedure. And the results weren't quite what he'd planned.
desc10.81,desc,,Ruth can't let it lie. She decides to raise her hand.
utter10.82,utter,BROWN,"A question already, Mrs. Ginsburg?"
utter10.83,utter,RUTH,"(rising) A correction, Professor Brown. McGee did not simply promise to fix George Hawkins's hand. He promised, quote: a one hundred-percent good hand."
desc10.84,desc,,"Pruitt flips pages in his textbook, trying to catch up."
utter10.85,utter,FITZPATRICK,That's the same thing.
utter10.86,utter,BROWN,"Is it? What say you, Mrs. Ginsburg?"
utter10.87,utter,RUTH,"It is not. Words matter. McGee grafted skin from Hawkins's chest. Not only did this fail to fix the scarring, he had chest hair growing on his palm."
utter10.88,utter,FITZPATRICK,Proving that a hand with a burn is worth two with a bush.
desc10.89,desc,,LAUGHTER FROM THE CLASS.
utter10.90,utter,RUTH,The Court denied Hawkins damages--
utter10.91,utter,FITZPATRICK,Hawkins did get damages! The court said he could keep up to five hundred dollars-RUTH If I may finish: Hawkins was denied damages for pain and suffering. (as Fitzpatrick sits) The New Hampshire Supreme Court ruled he was entitled to damages only based on the expected result of the contract being fulfilled.
desc10.92,desc,,"Brown, sliding down his reading glasses, measures up Ruth over the frames. Pruitt, still flipping pages, is frantic."
utter10.93,utter,RUTH (CONT'D),"So if Dr. McGee had set realistic expectations, instead of making grand promises, Hawkins's award likely would have been less."
desc10.94,desc,,"A pair of men share a glance: ""Ball-buster."" Pruitt gives up. Ruth has silenced the room."
utter10.95,utter,BROWN,"Was that an answer, Mrs. Ginsburg, or a filibuster?"
desc10.96,desc,,"As the class laughs, Ruth sits. Holding steady."
scene11,slugline,,INT. HARVARD STUDENT UNION - DAY
desc11.97,desc,,"Couches and endless book shelves. Warm light through the windows. Students study, read, and hang out. AND IN ONE NOOK: Emily is on a couch with another female FRIEND (20s). Martin and TWO OTHER GUYS (20s) are on another. Beers all around. Ruth stands before them... THEY'RE PLAYING CHARADES:"
desc11.98,desc,,Movie... Four words... Second word. Ruth takes a swig of her beer. Then holds up seven fingers.
utter11.99,utter,EMILY & FRIEND,Fourth word.
desc11.100,desc,,Ruth thinks a beat... then starts scratching. The Men LAUGH.
utter11.101,utter,EMILY,Ape! Gorilla! Monkey!
utter11.102,utter,EMILY,Monkey Business!
desc11.103,desc,,Ruth waves them off. Builds her courage -- despite the passing gawkers... And does her best Marilyn Monroe. Posing. Back arched. Butt out.
utter11.104,utter,FRIEND,Monkey on my back!
desc11.105,desc,,THE MEN LAUGH MORE. Martin laughs so hard his stomach hurts. As Ruth reminds them: Second word. Seven.
utter11.106,utter,EMILY,Seven Brides for Seven Brothers.
utter11.107,utter,FRIEND,What's that have to do with monkeys?
utter11.108,utter,GUY 1,(eye on his watch) Annnnnd....
utter11.109,utter,EMILY,Oh! Oh! Oh! Time!
utter11.110,utter,GUY 1,Yes!
utter11.111,utter,EMILY (CONT'D),The Seven Year Itch! RUTH
desc11.112,desc,,As Martin gets up and kisses her:
utter11.113,utter,MARTIN,Ruthless Ruthy strikes again!
desc11.114,desc,,She jabs him in the gut playfully with an elbow.
utter11.115,utter,GUY 1,Okay. Next round is riding on you.
desc11.116,desc,,As Martin picks his clue from a hat:
utter11.117,utter,RUTH,Don't worry. He's very good.
utter11.118,utter,MARTIN,And she dumped a guy once for being bad at charades.
utter11.119,utter,FRIEND,You didn't really?
utter11.120,utter,RUTH,It was a manifestation... of his being an idiot.
utter11.121,utter,EMILY,(to Guy 2) Don't worry. I'm comfortable being smarter than you.
utter11.122,utter,GUY 2,"Oh, thank you."
desc11.123,desc,,LAUGHTER ALL AROUND.
utter11.124,utter,FRIEND,Everyone ready? And... Go!
desc11.125,desc,,Martin begins.
scene12,slugline,,GUYS 1 & 2
desc12.126,desc,,"Martin curls his lip, shakes his arms, and gyrates his hips. They enjoy his spot-on impression -- especially Ruth. By Elvis."
utter12.127,utter,GUYS 1 & 2,Three words. ... First word.
desc12.128,desc,,He points to a blue pillow:
utter12.129,utter,GUY 2,Blue! Blueberry Hill!
utter12.130,utter,GUY 1,That's Fats Domino. GUY 2 Third word.
desc12.131,desc,,"Pointing to his feet, Martin does a bit of fancy footwork..."
utter12.132,utter,FRIEND,Nice moves!
desc12.133,desc,,"Martin winces, clutching his belly. And cries out."
utter12.134,utter,EMILY,No sound effects!
scene13,slugline,,Blue Suede Shoes!
desc13.135,desc,,"MARTIN BUCKLES -- AS HE FALLS TO THE FLOOR: GUY 2 Marty, you're a lightweight. Ruth knows something's wrong. She runs to Martin. Going to her knees. Cradling him..."
utter13.136,utter,RUTH,Marty? ... Marty!
desc13.137,desc,,Martin's looking up at her. Pain written on his face.
utter13.138,utter,RUTH (CONT'D),He needs help. Somebody help!
desc13.139,desc,,As Ruth's world slows and the sound fades:
utter13.140,utter,GUY 1,Someone call an ambulance!
utter13.141,utter,RUTH,Marty. I'm right here. I have you.
scene14,slugline,,INT. HOSPITAL WAITING ROOM - NIGHT
desc14.142,desc,,Hard floors and harder chairs. Ruth sits alone...
scene15,slugline,,TIME CUTS:
desc15.143,desc,,It's crowded. Ruth tries not to watch the other worrying families. A man soothes his wife... Fewer people waiting. Ruth still waiting. A mother reprimands her son in harsh whispers... Fewer still. Ruth still waiting. The misbehaving boy is asleep on his mother's lap... The sky is lightening out the window. The few people left are sleeping. Except Ruth. Still up. Still waiting. She gets up...
scene16,slugline,,INT. NURSES' STATION / CORRIDOR - EARLY MORNING
desc16.144,desc,,Ruth approaches and tries to get the attention of TWO NURSES - talking among themselves:
utter16.145,utter,RUTH,Excuse me. Excuse me? I'd like to
desc16.146,desc,,see the doctor who-One gestures for her to wait. She does for a frustrated beat. Then notices AN EMERGENCY ROOM DOCTOR (30) DOWN THE HALL. Ruth pursues him...
utter16.147,utter,RUTH (CONT'D),Doctor? ... Doctor?
desc16.148,desc,,"He turns with a look that says, ""I don't have time for this."""
scene17,slugline,,EMERGENCY ROOM DOCTOR
utter17.149,utter,RUTH,You examined my husband. I'm wondering when you think he'll be able to leave. I need to call the sitter.
scene18,slugline,,EMERGENCY ROOM DOCTOR
utter18.150,utter,RUTH,Ginsburg. Martin.
utter18.151,utter,EMERGENCY ROOM DOCTOR,Right. Ginsburg... He's not going home tonight. Excuse me?
utter18.152,utter,RUTH EMERGENCY ROOM DOCTOR,We have more tests to run.
utter18.153,utter,RUTH,What kind of tests?
desc18.154,desc,,Her voice stops him in his tracks.
utter18.155,utter,EMERGENCY ROOM DOCTOR,Various kinds. He's gonna be with us a while.
utter18.156,utter,RUTH,What tests are you running on my husband?
desc18.157,desc,,There was a shadow on his X-ray
desc18.158,desc,,What kind of shadow?! I need to see him!
utter18.159,utter,EMERGENCY ROOM DOCTOR,Mrs. Ginsburg. You're getting yourself worked up. Go home. Get some rest. We'll know more in a few days. ..... If you'll excuse me.
desc18.160,desc,,He leaves her. In the busy hallway. Uncertain and scared...
scene19,slugline,,INT. GINSBURG HARVARD APARTMENT - MORNING
desc19.161,desc,,"Ruth enters. The sound of the door wakes up Emily, on the couch. Still in the same dress as during charades."
utter19.162,utter,RUTH,Thank you so much.
utter19.163,utter,EMILY,Ruth. Of course. Jane was a doll. She's blissfully asleep. .... How
desc19.164,desc,,is he?
utter19.165,utter,RUTH,Fine. I'm sure he'll be fine.
desc19.166,desc,,Emily hesitates to believe her. Then gives her a long hug.
utter19.167,utter,EMILY,Call any time. Okay?
desc19.168,desc,,"She leaves Ruth. ... Alone. And painfully aware of it. Ruth turns on the record player, lifts the needle. AND STOPS. Her gaze shifts to the collection of FAMILY PHOTOS on the credenza beside the record player. TO HER MOTHER. Posing with young Ruth. Supportive. Uncompromising. Strong. Wearing the same sunburst pin Ruth wore in the opening scene. Ruth lowers the needle at last. Static gives way to SOFT OPERA. A breath. Then Ruth walks DOWN THE EMPTY HALL... TO JANE'S BEDROOM. As the girl sleeps, Ruth watches her. Keeping her fear and doubt at bay. ENTERING HER AND MARTIN'S BEDROOM, she collapses atop the covers. And curls up alone..."
scene20,slugline,,INT. HOSPITAL ROOM - DAY - DAYS LATER
desc20.169,desc,,"Bright. Antiseptic. A TICKING CLOCK. Martin is hooked up to a glass IV. Reading a textbook in bed. In a chair beside him, Ruth has a law book as well. But she's watching him. Waiting. Her gaze shifts -- to an empty hospital food tray..."
utter20.170,utter,RUTH,At least you got a break from my cooking.
desc20.171,desc,,"He looks to her. And they laugh -- nervously. DOCTOR WYLAND LEADBETTER (50) enters. Clean-shaven, in a bowtie, vest and white coat, full of genial self-confidence."
utter20.172,utter,DR. LEADBETTER,Good afternoon.
utter20.173,utter,RUTH,"Dr. Leadbetter. Hey, Doc."
desc20.174,desc,,"As he pulls up a chair, he glances at Martin's textbook:"
utter20.175,utter,DR. LEADBETTER,Fundamental Principles of Corporate Taxation: Addressing the Challenges of Today's Regulatory Environment. I thought medical books were dry.
desc20.176,desc,,He sits. And prepares himself to deliver the news...
utter20.177,utter,DR. LEADBETTER (CONT'D),It's as we feared. Ruth and Martin take the blow.
utter20.178,utter,DR. LEADBETTER (CONT'D),"Marty you're young, and we caught it early. We've pioneered a treatment here. (MORE)"
utter20.179,utter,DR. LEADBETTER (CONT'D),"It entails multiple surgeries, each followed by a course of radiation. It's-- well, it's unpleasant, but-MARTIN What does that mean?"
utter20.180,utter,RUTH,"On top of the pain of surgery, the radiation will leave you exhausted, nauseous. Prone to infection."
utter20.181,utter,MARTIN,(off Leadbetter's look) Her mother died of cervical cancer.
utter20.182,utter,DR. LEADBETTER,"With the new treatment, there's a chance you could go on to live a healthy, normal life -- as if this never happened."
utter20.183,utter,RUTH,"What kind of ""a chance""? (off his hesitation) Dr. Leadbetter, we'd rather know what we're facing."
utter20.184,utter,DR. LEADBETTER,The survival rate for testicular cancer has been about five percent.
desc20.185,desc,,It hangs there for a beat...
utter20.186,utter,MARTIN,Thank you for the honesty. I think.
utter20.187,utter,DR. LEADBETTER,(leaving) I'll let you two talk.
desc20.188,desc,,In the wreckage of his wake: a heavy silence... Martin tries to make sense of it. Ruth stifles her tears. They can't even look at each other... Until Ruth takes Martin's hand. Pulling him back into the present. They watch one another a beat... She rises. And sits on the bed beside him. Their eyes locked. I'm sorry.
desc20.189,desc,,Slowly she lies next to him. They hold each other. Watching one another. The clear path of their future lost in a haze...
utter20.190,utter,RUTH,"We're never giving up. Keep working. Keep studying. Jane will have her father. And you will be a lawyer. I am spending my life with you, Martin Ginsburg."
scene21,slugline,,EXT. HARVARD CAMPUS - DAY
desc21.191,desc,,Bare trees. Snow flurries. ... Ruth rushes through. She's running late.
utter21.192,utter,FREUND (V.O.),Judicial consistency...
scene22,slugline,,INT. LECTURE HALL TWO - DAY
desc22.193,desc,,"PROFESSOR FREUND (48), black hair, broad, lectures before a full class. His voice resonant:"
utter22.194,utter,FREUND,The doctrine of stare decisis comes from English Common Law...
desc22.195,desc,,"The door CREAKS. And Ruth enters. As Freund continues lecturing, he watches her find a seat in back."
utter22.196,utter,FREUND (CONT'D),Which also provides the first examples of circumstances where precedents may be overturned. Judges are bound... Excuse me. May I help you?
desc22.197,desc,,She rises tentatively.
utter22.198,utter,RUTH,I'm Martin Ginsburg's wife. I'll be attending his classes for him.
desc22.199,desc,,Freund seems surprised by it. His students are impressed.
utter22.200,utter,FREUND,In addition to your own?
desc22.201,desc,,The look in her eye leaves no room for negotiation. Freund is moved. He resumes his lecture without further objection...
utter22.202,utter,FREUND (CONT'D),Judges are bound by precedent. But cannot ignore cultural change.
desc22.203,desc,,Ruth sits and begins taking notes.
utter22.204,utter,FREUND (CONT'D),"A Court ought not be affected by the weather of the day, but will be by the climate of the era."
utter22.205,utter,MARTIN (V.O.),(weakly) Wait. Wait. Say that again...
scene23,slugline,,INT. GINSBURG HARVARD APARTMENT - NIGHT
desc23.206,desc,,"AT THE KITCHEN TABLE: Ruth sits before a typewriter. From her vantage point, through the opening between rooms, she can only see half of Martin -- LYING ON THE LIVING ROOM COUCH."
utter23.207,utter,RUTH,"(reading her notes aloud) A Court ought not be affected by the weather of the day, but will be by the climate of the era."
utter23.208,utter,MARTIN,You're sure that's what he said?
desc23.209,desc,,"She leans to the side to give him a look that says ""Are you kidding?"" His chalky skin is blotched in sweat."
utter23.210,utter,MARTIN (CONT'D),(off her look) Of course.
desc23.211,desc,,He closes his eyes and catches his breath.
utter23.212,utter,MARTIN (CONT'D),"The law is never finished. It is a work in progress. And ever will be. As he dictates, Ruth types..."
utter23.213,utter,MARTIN (CONT'D),"Brown v Board of Education, parenthesis 1954, was the most revolutionary Supreme Court case of the last century..."
desc23.214,desc,,"WAAAAH! Somewhere in the apartment, JANE CRIES. Ruth types the last few letters as she rises... Martin continues, AS SHE PASSES HIM:"
utter23.215,utter,MARTIN (CONT'D),"Representing Oliver Brown, et. al."
utter23.216,utter,RUTH,I'm not listening.
desc23.217,desc,,"SHE HEADS FOR JANE'S ROOM, but Martin's on a roll:"
