segment-id,segment-type,segment-speaker,segment-text
desc53.689,desc,,Ruth considers it... And realizes:
utter53.690,utter,RUTH,Jane. That was incredibly wise.
utter53.691,utter,JANE,"Do you know who said it first? (Ruth doesn't) Atticus Finch. In Ruth's look: ""Touche."""
desc53.692,desc,,"Across the street, two CON ED WORKERS SHOUT and WHISTLE at them lasciviously."
utter53.693,utter,CONSTRUCTION WORKER,"Lookin' good, ladies. We'll warm you up... if you're getting wet."
utter53.694,utter,RUTH,(checking for another cab) It's okay. Just ignore them.
utter53.695,utter,CONSTRUCTION WORKER,"Too good for us, huh? Bitches!"
desc53.696,desc,,Jane SHOUTS back at them.
utter53.697,utter,JANE,Real nice. You kiss your mother with that mouth? Asshole.
desc53.698,desc,,That shuts the Workers up. Jane sees Ruth's surprise.
utter53.699,utter,JANE (CONT'D),Mom. You can't just let boys talk to you like that.
desc53.700,desc,,"At that moment, Jane sees a vacant cab approaching. She dashes out fearlessly and YELLS:"
scene54,slugline,,TAXI! JANE (CONT'D)
desc54.701,desc,,"The cab BRAKES sharply. Ruth starts out after her, but stops"
scene55,slugline,,mid-street. Jane's at the cab door.
desc55.702,desc,,"Ruth looks around at the constructions workers tearing down buildings, wild posting for a Joni Mitchell concert; a couple making out; sexy women on a billboard..."
utter55.703,utter,JANE (CONT'D),"Mom, c'mon. (to the TAXI DRIVER) Yeah, yeah. Hold on a second."
desc55.704,desc,,She returns to her mother. She's not sure what's going on...
utter55.705,utter,JANE (CONT'D),He's not gonna wait forever. You're getting soaked.
utter55.706,utter,RUTH,Twenty years. (a beat) Look at you. It may as well be two
utter55.707,utter,JANE,You lost me.
utter55.708,utter,RUTH,"It's only twenty years since I was your age. Back then girls were told: ""Be a lady."" ""Speak when spoken to."" ""Respect your elders."" Jane's getting where her mom is headed..."
utter55.709,utter,JANE,Now it's 'Don't trust anyone over thirty!'
utter55.710,utter,RUTH,They taught me how to curtsy in school. (laughs) I couldn't go out wearing pants.
utter55.711,utter,JANE,I'm not even wearing a bra.
desc55.712,desc,,The cabbie HONKS impatiently.
utter55.713,utter,RUTH,"You are a liberated, fearless young woman. Twenty years ago, you couldn't have been who you are today. (a beat) Dorothy Kenyon's wrong. The times have already changed."
scene56,slugline,,INT. RUTGERS LAW SCHOOL - CLASSROOM - EVENING
desc56.714,desc,,Ruth. Alone. Consulting a book. Hunched over a legal pad. Writing. Crossing out. And starting again. OUTSIDE THE DOOR: a Janitor buffs the hallway floors.
utter56.715,utter,RUTH (V.O.),It's what Professor Freund said at Harvard...
scene57,slugline,,INT. GINSBURG APARTMENT - KITCHEN - NIGHT
desc57.716,desc,,Ruth's standing at the counter. Eating leftovers. Martin is reading the typed notes. Concerned...
utter57.717,utter,RUTH,"""A court ought not be affected by the weather of the day. But will be by the climate of the era."""
utter57.718,utter,MARTIN,Okay... So we're not re-fighting the old cases.
utter57.719,utter,RUTH,We're arguing the precedents should no longer apply.
utter57.720,utter,MARTIN,"But Ruth, Freund was talking about Brown v. Board of Ed. That was a once-in-a-generation case."
utter57.721,utter,RUTH,And we're the next generation.
desc57.722,desc,,OFF MARTIN: impressed.
scene58,slugline,,INT. RUTGERS LAW SCHOOL - FACULTY OFFICES - DAY
desc58.723,desc,,"Ruth is dictating her notes to a department secretary, MILLICENT (28, sultry), who is typing them up."
scene59,slugline,,INT. GINSBURG APARTMENT - LIVING ROOM - NIGHT
desc59.724,desc,,"Martin is on the couch, writing notes on Ruth's typed work. IN THE BACKGROUND: Jane is laying out dinner on the table. Ruth is on the floor, playing checkers with James."
scene60,slugline,,INT. GINSBURG APARTMENT - BEDROOM - NIGHT
desc60.725,desc,,"On the wall over her desk, Ruth tacks up the same note card. SEE: OTHERS. AND NEWSPAPER CLIPPINGS. It's the outline of her argument. Martin's on the bed, surrounded by books, writing his tax section of the brief."
scene61,slugline,,INT. RUTGERS LAW SCHOOL - FACULTY OFFICES - DAY
desc61.726,desc,,"CLOSE ON TYPEWRITER KEYS STRIKING THE PAPER: ""Changes in societal attitudes."" ... ""Unalterable biological traits."""
scene62,slugline,,INT. RUTGERS LAW SCHOOL - CLASSROOM - EVENING
desc62.727,desc,,"Ruth's added a coffee pot to the room. Some of her class is with her. They're passing books, newspapers, journals -- and Chinese food cartons -- between them. Animated. Discussing. OVER THIS, START TO HEAR: MILLICENT'S TYPING..."
scene63,slugline,,EXT. NEW YORK STREET - NIGHT
desc63.728,desc,,"AS THE TYPING CONTINUES, GETTING LOUDER... Ruth and Martin walking -- dressed in overcoats:"
utter63.729,utter,MARTIN,"Our client is a man. We can't lose sight of that. Men are also harmed by these stereotypes. Boys who are told they're not supposed to be nurses, or teachers, or-RUTH Cook dinner for their families."
utter63.730,utter,MARTIN,"We're counting on you, too."
scene64,slugline,,INT. GINSBURG APARTMENT - LIVING ROOM - NIGHT
desc64.731,desc,,"Ruth and Martin are cuddled on the couch. Writing notes on their work... Noticing one another, they stop. Kiss... And resume working. THE TYPING CONTINUES. LOUDER STILL..."
scene65,slugline,,INT. RUTGERS LAW SCHOOL - FACULTY OFFICE - DAY
desc65.732,desc,,Millicent is typing up their hand-written pages... She pulls out the final page.
scene66,slugline,,INT. RUTGERS LAW SCHOOL - RUTH'S OFFICE - LATER
desc66.733,desc,,Millicent enters -- the typed Moritz Brief in hand:
utter66.734,utter,MILLICENT,Professor Ginsburg? I finished typing the brief.
utter66.735,utter,RUTH,"(accepting it) You're a saint, Millicent."
utter66.736,utter,MILLICENT,"May I make an observation? ... It's just... I'm typing your brief. And jumping out all over it is, well... sex-sex-sex-sex-sex-sex. It reeks of hormones and backseats and-- You know how men are. Maybe you should try a less distracting word."
desc66.737,desc,,She and Ruth exchange a look...
utter66.738,utter,MILLICENT (CONT'D),Maybe... gender?
utter66.739,utter,RUTH,You realize that means...
utter66.740,utter,MILLICENT,That's no problem. I'm happy to type it again.
scene67,slugline,,Off Ruth: END SEQUENCE. INT. ACLU OFFICES - CORRIDOR - DAY
desc67.741,desc,,"Mel hurries down the hallway, chatting with a LAWYER."
utter67.742,utter,MEL,Guessing does me no good. I need to know how many people were actually turned away from the polls.
utter67.743,utter,ACLU STAFFER 4,The Affiliate still hasn't sent the
utter67.744,utter,MEL,"Call Brian Tanner. Remind him, please, that we're on the same team. And tell him if he doesn't start acting like it, I'll come to Wisconsin and rip his God-damn throat out myself!"
desc67.745,desc,,As he opens his OFFICE DOOR:
utter67.746,utter,KENYON (O.S.),Melvin. Didn't your mother ever teach you to clean your room?
scene68,slugline,,INT. MEL'S OFFICE - CONTINUOUS
desc68.747,desc,,"She's sitting behind his desk. Reading a newspaper -- THE IDAHO STATESMAN. Mel, surprised, enters and closes the door."
utter68.748,utter,MEL,Ms. Kenyon. Is it time for your annual dusting-off already?
desc68.749,desc,,Kenyon laughs. As she folds her newspaper...
utter68.750,utter,KENYON,"In 1776, Abigail Adams wrote her husband a letter. ""As you write this new constitution,"" she said, ""Remember the ladies."" Know what the bastard went ahead and did?"
utter68.751,utter,MEL,I can guess.
desc68.752,desc,,"She slams the paper down, the article oriented toward him: ""COURT FINDS FOR CECIL REED."""
utter68.753,utter,MEL (CONT'D),The Idaho Statesman? You need a hobby.
utter68.754,utter,KENYON,"These poor people. Sally and Cecil Reed. Divorced. Their son committed suicide, and both parents want to administer his estate. (MORE)"
utter68.755,utter,KENYON (CONT'D),"In Idaho the law says that in this situation, males must be preferred to females. Why? 'Cause men are better at math."
desc68.756,desc,,She taps the newspaper article with her finger.
utter68.757,utter,KENYON (CONT'D),The Idaho Supreme Court just said that is perfectly legal.
desc68.758,desc,,"With some effort, she gets up. Taking her over-sized bag with her. As she does:"
utter68.759,utter,MEL,"Dorothy. I've got student protestors in jail in California. I've got schools in Mississippi that still refuse to desegrega-KENYON Eh, you're a sissy. The Board threatened to can you 'cause you stood up for draft dodgers, and your tail's been between your legs ever since."
utter68.760,utter,MEL,That's not-- I don't have the resources to take this on.
utter68.761,utter,KENYON,"I've seen you stand up to the might of government with sling and stone for what you know is right. And kid, I loved ya for it. They're not gonna fire you, Mel. The board's a bunch of tired old fools, and they don't have the nerve to do it. I should know; I'm one of 'em."
desc68.762,desc,,She takes his hand.
utter68.763,utter,KENYON (CONT'D),John Adams forgot the ladies. And it's time the ACLU got back in the fight.
desc68.764,desc,,"With a look, he concedes."
utter68.765,utter,KENYON (CONT'D),Good. (digging into her bag) Now here's where you start. (MORE)
utter68.766,utter,KENYON (CONT'D),A case headed for the tenth circuit. Professor out of Rutgers. Smart cookie.
desc68.767,desc,,She presents him with a copy of Ruth's Moritz Brief... He looks at it. Surprised. Then his surprise turns into clarity -- he glances at the newspaper still on his desk:
utter68.768,utter,MEL,"(""of course"") Ruth."
desc68.769,desc,,She pats him on the cheek.
utter68.770,utter,KENYON,You're a good boy.
scene69,slugline,,INT. RUTGERS LAW SCHOOL - CLASSROOM - DAY
desc69.771,desc,,"The Fourteenth Amendment is written on the board. Ruth, before her class, underlines the Equal Protection Clause..."
utter69.772,utter,RUTH,But nowhere does the Constitution say the federal government must treat people equally. What did the Court say about that? Mrs. Parker.
utter69.773,utter,PARKER,That the Due Process Clause implies that Equal Protection applies to the federal government as well.
utter69.774,utter,RUTH,Can you cite the case?
desc69.775,desc,,Parker hesitates. Unsure. ... REVEAL:
utter69.776,utter,MEL,Bolling v Sharpe. 347 U.S. 497.
desc69.777,desc,,He's in the doorway. A briefcase in hand.
utter69.778,utter,MEL (CONT'D),"Decided in conjunction with Brown v Board of Ed in 1954, Bolling desegregated Washington, D.C.'s public schools. Chief Justice Warren, writing for the Court. .... How about it, Teach? Do I get an A? OFF RUTH:"
scene70,slugline,,INT. DINER - DAY
desc70.779,desc,,Ruth and Mel with coffee. Only Mel is eating pie. He reaches into his bag -- and drops Ruth's brief between them. An accusation in his eyes.
utter70.780,utter,MEL,"It was well played Ruth, sending your work to Kenyon."
utter70.781,utter,RUTH,(playing innocent) I thought she might have advice.
utter70.782,utter,MEL,Cut the shit. Just don't play games with me again.
desc70.783,desc,,They stare each other down for a beat...
utter70.784,utter,RUTH,What did you think of the brief?
utter70.785,utter,MEL,(admitting it) It's a compelling argument. Brilliantly reasoned. These days more women than ever are working. And why not? We have pre-schools and washing machines and cheap contraceptives.
utter70.786,utter,RUTH,Times have changed.
utter70.787,utter,MEL,But there's a glaring problem... In the unlikely event that you win this thing -- what's the remedy? The Court takes away the Caregiver Deduction from everyone -including working mothers. And then you've done more harm than good.
utter70.788,utter,RUTH,No. Do you remember Justice Harlan's opinion last June in Welsh v United States?
utter70.789,utter,MEL,"(getting it, impressed) He said laws could be extended, when doing so would be closer to the legislature's intent than overturning would be."
utter70.790,utter,RUTH,"We're adding one more section to the brief, urging The Court to extend the law -- to include Charlie as well as everyone else."
desc70.791,desc,,Mel runs through the argument in his mind. It could work.
utter70.792,utter,MEL,I still say I'd rather be a woman in America than a black man. Or a socialist. Or religious minority... But the ACLU will put its name on your brief.
utter70.793,utter,RUTH,We appreciate your support.
desc70.794,desc,,She gives it a beat...
utter70.795,utter,RUTH (CONT'D),"Now let's talk about you taking on Reed v Reed. (off his look) All men in Idaho are better at math?! It's a perfect example of-MEL Quit while you're ahead, Kiki. One case. That's all you get."
desc70.796,desc,,As he goes for his wallet:
utter70.797,utter,RUTH,"The Moritz argument works just as well for a female client. And Reed's a state supreme court case. Which means the US Supreme Court must hear the appeal. (he's ignoring her) Call Sally Reed's lawyer, Mel."
utter70.798,utter,MEL,"I told you, I'm not starting another fifty-year battle. I'd worry about defending my own case, if I were you."
desc70.799,desc,,He tosses some cash on the table. And rises to go.
utter70.800,utter,MEL (CONT'D),I expect to see your Remedy argument before you submit to the Tenth Circuit. And I want to be there when you practice your oral arguments. (before she can protest) We're holding a moot court. That's not negotiable.
utter70.801,utter,RUTH,(relenting) When?
utter70.802,utter,MEL,As soon as we get the government's response brief.
scene71,slugline,,"EXT. DEPARTMENT OF JUSTICE (DOJ) - DAY Imposing, limestone facade -- gray in the winter-morning"
desc71.803,desc,,"light. Over the entry: ""Justice is founded in the rights"
utter71.804,utter,BOZARTH (V.O.),...A pig 'aint good for nothing but sitting in its own filth.
scene72,slugline,,INT. DOJ - TAX DIVISION - BOZARTH'S CUBICLE - DAY
desc72.805,desc,,"JIM BOZARTH (26), a Government Lawyer, is full of airy, likeable, college-boy confidence. In his uncluttered cubicle: a photo of his wife and a University of Texas coffee mug. He's yukking it up with A COLLEAGUE (25):"
utter72.806,utter,BOZARTH,It's the first rule of barbecue. You start with a cow.
utter72.807,utter,COLLEAGUE,"Well, you could try up in Columbia Heights, if not for... you know, the riots."
utter72.808,utter,BOZARTH,For a slab of beef cooked low and slow? I'll pack my ..45.
desc72.809,desc,,GLADYS (55) approaches before him with a file cart. A reliable cog in the machine of government. She hands him a
utter72.810,utter,GLADYS (V.O.),"Bozarth. You finished a case today. As Bozarth's Colleague takes his leave, she passes Bozarth his new assignment..."
utter72.811,utter,GLADYS,Sign for your next brief.
scene73,slugline,,INSERT: Tenth Circuit Court of Appeals / Charles Moritz v Commissioner of Internal Revenue / Authors - Ruth Bader
desc73.812,desc,,"Ginsburg; Martin Ginsburg; Melvin Wulf, Legal Director, ACLU. Bozarth lets out a long whistle."
utter73.813,utter,BOZARTH,"10th Circuit Court of Appeals. Know who I am, Gladys?"
utter73.814,utter,GLADYS,Sure do. You're the kid who's going to sign my form.
utter73.815,utter,BOZARTH,(as he does -- grinning) I'm a guy moving up in the world.
desc73.816,desc,,"He settles in, feet on the desk -- and opens the brief."
utter73.817,utter,GLADYS,"In the meantime, the chief best not catch you with your feet on that desk."
desc73.818,desc,,He takes them down. And re-opens the brief.
utter73.819,utter,BOZARTH,"Howdy, Mr. Moritz. And what can your Uncle Sam do for you today?"
scene74,slugline,,INT. DOJ - TAX DIVISION OFFICES - LATER
desc74.820,desc,,"Brief in hand, Bozarth heads down a hallway to a closed door marked ""Special Attorney / Tax Division"". Stops. Prepares himself. ... THEN KNOCKS."
utter74.821,utter,BROWN (THROUGH DOOR),... What is it?
scene75,slugline,,INT. DOJ - BROWN'S OFFICE - LATER
desc75.822,desc,,The room is utilitarian. Straight lines and right angles. With an orderly and organized charm that's inviting. (Professor) Brown is 65 now. Dignified. Finished to a high polish. He's at his desk reading the brief. Bozarth watches.
utter75.823,utter,BOZARTH,You can't make a constitutional challenge to the Tax Code. Right?
utter75.824,utter,BROWN,(still reading) It's a stretch.
utter75.825,utter,BOZARTH,And who's ever heard of 'gender discrimination?'
desc75.826,desc,,Brown gives him a look. Then finishes reading.
utter75.827,utter,BOZARTH (CONT'D),These folks are runnin' at Hell with a bucket of water.
utter75.828,utter,BROWN,Case law is filled with challenges that could not be made... Until they were. I'm putting Murphy on writing our response brief.
utter75.829,utter,BOZARTH,"With due respect, Mr. Brown-BROWN It isn't personal, Bozarth. But if we're not careful, this appeal will cast a cloud of unconstitutionality over every federal law that differentiates between men and women. I need someone more seasoned on it."
desc75.830,desc,,"For Bozarth, it's a body blow. Brown picks up his phone..."
utter75.831,utter,BROWN (CONT'D),"Could you get me the Solicitor General, please?"
desc75.832,desc,,Bozarth summons his courage.
utter75.833,utter,BOZARTH,I pulled the file. I deserve the chance. Murphy's a weak sister.
desc75.834,desc,,Brown gives him a dismissive look. Bozarth leans in.
utter75.835,utter,BOZARTH (CONT'D),"I know how to win this case, sir. Better than Murphy. Better than anyone. You need me on this appeal."
desc75.836,desc,,"Brown stares. A bit impressed. A bit dubious... Before he can decide, someone picks up on the other end of the line."
utter75.837,utter,BROWN,(eyes still on Bozarth) This is Brown. I need to see him.
scene76,slugline,,EXT. CAPITOL BUILDING - DAY
desc76.838,desc,,"A cold day. The ground dusted with snow. But (Dean) Erwin Griswold doesn't seem to notice. He's 67 now, and Nixon's Solicitor General. Brown and Bozarth walk with him..."
utter76.839,utter,GRISWOLD,For God's sake! Where does it end? Gender equality as a civil right?!
utter76.840,utter,BROWN,When everyone's aggrieved and a victim. It's what the ACLU does. Divide the country into smaller and smaller subgroups.
utter76.841,utter,GRISWOLD,"Ginsburg... Cancer, right? And the wife. Very demanding. But smart."
utter76.842,utter,BROWN GRISWOLD,"Ten years. Ten years I fought to enroll women at Harvard Law. The faculty, the university -- even my wife warned me it could come back to haunt me. Now this is the thanks I get."
utter76.843,utter,BROWN,"Erwin, we could settle. Martin Ginsburg was one of my best students. A practical young man. I can call him, tell him we'll let the man have his money. And we go our separate ways."
desc76.844,desc,,Griswold thinks about it for a beat...
utter76.845,utter,GRISWOLD,"No. ... No. We settle now, it's open season. Let's put the idea of gender discrimination to bed once and for all. They handed us a winnable case."
utter76.846,utter,BROWN,(on the mission) Then we'll win it.
desc76.847,desc,,Griswold talks of Bozarth as if the young man weren't there:
utter76.848,utter,GRISWOLD,You're sure he's up to it.
utter76.849,utter,BROWN,Mr. Bozarth is a fine litigator. (to Bozarth) Tell him your idea.
utter76.850,utter,BOZARTH,We list the laws. What laws?
utter76.851,utter,GRISWOLD BOZARTH,All of 'em. Every federal law that treats men and women differently. So the Court sees exactly the can
desc76.852,desc,,"of worms these folks are-Griswold's belly-laugh interrupts him. Until, looking between Brown and Bozarth, Griswold realizes it's not a joke."
utter76.853,utter,GRISWOLD,"Last I checked, the U.S. Code was 20,000 pages long. (to Brown) Whose gonna read it? Him?"
utter76.854,utter,BOZARTH,"I can get it done, sir. All I need is an introduction. Griswold's interest is piqued. To whom?"
desc76.855,desc,,Bozarth knows exactly how outrageous it sounds:
utter76.856,utter,BOZARTH,... The Secretary of Defense.
scene77,slugline,,EXT. THE PENTAGON - DAY
desc77.857,desc,,Sprawling. It dwarfs the Washington Monument in the distance.
scene78,slugline,,INT. THE PENTAGON - DAY
desc78.858,desc,,"Reels of magnetic tape spin. Glowing switches CLACK. And the whole room HUMS. A KEYPUNCH OPERATOR (female, 22) hands a box of punch cards to one of a dozen TECHNICIANS (male). Through plate glass, Brown and Bozarth watch from a hallway."
utter78.859,utter,BROWN,And this computer will find what we're looking for?
utter78.860,utter,BOZARTH,In just a few days.
utter78.861,utter,BROWN,Without any human being actually reading the laws. ... What a horrifying age.
scene79,slugline,,INT. RUTGERS LAW SCHOOL - CLASSROOM - EVENING
desc79.862,desc,,"The Students are filing out. Talking among themselves. Murmuring their thanks and goodbye. SEE: Roemer, Burton, Valentin, Parker, Bennett amongst them..."
utter79.863,utter,STUDENTS,"Thank you, Professor. ..... Good night. ... Thanks, Professor Ginsburg."
utter79.864,utter,RUTH,Good night. ... Thank you. .... That was a persuasive analysis of Gruenwald v
desc79.865,desc,,"Gardner, Mr. Bennett."
utter79.866,utter,BENNETT,"Hey thanks, Professor G. COURIER (O.S.) Ruth Bader Ginsburg? Everyone stops to see him standing in the doorway with a thick envelope in hand."
utter79.867,utter,COURIER (CONT'D),Delivery from the Department of Justice.
desc79.868,desc,,She signs for it and accepts. Then opens the envelope -- all eyes on her:
utter79.869,utter,RUTH,It's the government's response
scene80,slugline,,INT. GINSBURG APARTMENT - NIGHT
desc80.870,desc,,"Twenty volumes of THE U.S. CODE stacked around the room. Open and empty cartons from the ACLU... Ruth, Jane and Ruth's students Roemer and Burton are seated AROUND THE DINING ROOM TABLE. In the middle of them, the brief is open to ""Appendix E"". Each has a volume before her, and is looking from the Appendix to her book, searching for the corresponding page."
utter80.871,utter,ROEMER,Get this: there's a law that we're not allowed to fly military cargo planes?
utter80.872,utter,BURTON,Why would you want to?
utter80.873,utter,JANE,That's not the point. We should be allowed.
utter80.874,utter,ROEMER,You really think you can change all these laws?
utter80.875,utter,RUTH,That's the plan.
desc80.876,desc,,"The FRONT DOOR opens, and Martin enters. Dry cleaning over his shoulder."
utter80.877,utter,MARTIN,Ruth are you ready? Curtain's up in forty minutes. It'd be nice to get there on time. (to himself) For a change.
desc80.878,desc,,He enters the DINING ROOM.
utter80.879,utter,MARTIN (CONT'D),What are you doing?
utter80.880,utter,RUTH,The Government's brief came. ... Look who's listed as co-author.
desc80.881,desc,,She passes it to him.
utter80.882,utter,MARTIN,I had heard Griswold was trying to recruit Brown to the DOJ. I guess it worked. ... How does it look?
utter80.883,utter,BURTON,Check out Appendix E.
desc80.884,desc,,Martin gives her a look: Who are you? ... But obliges.
utter80.885,utter,JANE,It's every federal law that discriminates on the basis of sex. We're looking them all up. Martin exhales: The scope of it.
utter80.886,utter,MARTIN,Pass me one of those volumes.
desc80.887,desc,,Ruth smiles as Martin joins the unorthodox team at the table.
utter80.888,utter,MARTIN (CONT'D),How in the world did they manage all this?
scene81,slugline,,INT. GRISWOLD'S SUBURBAN HOME - LIBRARY - MAGIC HOUR
desc81.889,desc,,"A formal room. Out the window, the first hints of spring. James Bozarth stands before A PULL-DOWN SCREEN in a formal, wood-panelled ""library."" Amidst a team of young DOJ LAWYERS. PROJECTED ON SCREEN: JUDGE DAUGHERTY (57, close-cropped hair and perfect posture). OFF TO THE SIDE: Harriet Griswold (67 now and in a wheelchair) is supervising a MAID preparing tea service. ON A COUCH before Bozarth are Griswold and Brown."
utter81.890,utter,BROWN,So you're confident Daugherty will see it our way.
utter81.891,utter,BOZARTH,Based on reading all of his opinions. Yes. And so will Holloway.
desc81.892,desc,,"Bozarth uses his clicker. JUDGE HOLLOWAY (48, a kindly smile) appears on the screen."
utter81.893,utter,BOZARTH (CONT'D),"But the final judge, Doyle... Bozarth puts up DOYLE's picture (60, a shock of white hair)."
utter81.894,utter,BOZARTH (CONT'D),He's a tougher nut to crack.
desc81.895,desc,,Griswold shoots Brown a warning look.
utter81.896,utter,GRISWOLD,That's unacceptable.
utter81.897,utter,BROWN,"We need an unanimous verdict out of the Tenth Circuit, James."
utter81.898,utter,GRISWOLD,I don't intend to risk so-called gender discrimination going before the Supreme Court.
utter81.899,utter,BOZARTH,"Yes... Yes, sir. I understand."
desc81.900,desc,,Harriet can see he's nervous. And sympathizes...
utter81.901,utter,HARRIET GRISWOLD,What makes this judge so difficult?
utter81.902,utter,BOZARTH,"He's a civil rights crusader, ma'am. Two years ago he ordered Denver to bus black students to white schools. There was arson, protests, demands for him to quit the bench. But even after someone threw a bomb at his house, Doyle wouldn't budge."
utter81.903,utter,GRISWOLD,In that case he was enforcing the law. The Ginsburgs are asking him to MAKE law. We need to drive home the difference. Brown considerd Griswold's challenge... And offers a path:
utter81.904,utter,BROWN,(to Bozarth) Paint the judges a picture of the America that will exist if they rule the wrong way. Children running home from school to find... No one's there. Mommy's at the office. Or on a factory floor.
utter81.905,utter,GRISWOLD,"That's very good, Ernie. If a man and woman vie for the same job, she can work for less. What is a man without a paycheck to take care of his family?"
utter81.906,utter,BROWN,What woman would want him?
utter81.907,utter,BOZARTH,(going with their flow) Wages go down. Divorce rates soar. Society unravels.
utter81.908,utter,BROWN,Exactly! The other side wants this to be about the Equal Protection Principle. YOU need to show the court that what's really at stake is the American family.
utter81.909,utter,GRISWOLD,"What the judges are deciding is what kind of country, what kind of society, they want their children and grandchildren to grow up in."
