segment-id,segment-type,segment-speaker,segment-text
utter56.1086,utter,FELL,Take mine. (HE HANDS HIS PROGRAM TO
desc56.1087,desc,,"PAZZI, AND THEY START UP THE"
utter56.1088,utter,AISLE),Ah. And is that your wife...
utter56.1089,utter,PAZZI.) Signora.,"(HE BENDS TO KISS HER HAND) Can it be that you are lovelier, even, than at our last encounter...?"
utter56.1090,utter,MRS. PAZZI,My mother told me to ignore the blandishments of charming men.
utter56.1091,utter,FELL,"Then, she, herself, possessed some knowledge of the Greater World...How pleased am I to see you looking so well..."
desc56.1092,desc,,"PAZZI IS CALLED AWAY, BY AN EXITING OPERAGOER, AND HE LEAVES RELUCTANTLY, LOOKING BACK, WITH APPREHENSION, AT FELL AND HIS WIFE. THE TWO, CHATTING, JOIN HIM."
utter56.1093,utter,FELL (cont'd),"Commendatore, your wife tells me you are taking her away on Vacation."
utter56.1094,utter,PAZZI,...long overdue.
desc56.1095,desc,,"(AS THEY EXIT, ONTO THE STREET IN FRONT OF THE OPERA, AND MANY CARS AND LIMOS, PULLING"
utter56.1096,utter,CETERA.),Back to America...? (PAUSE) (WHILE PAZZI LOOKS ON WITH
utter56.1097,utter,CONSTERNATION),When first we met you'd just returned from America.
utter56.1098,utter,MRS. PAZZI,"How wonderful of you, to hold that information in your busy mind..."
utter56.1099,utter,FELL,...how so?
utter56.1100,utter,MRS. PAZZI,...you told me you were studying for your examination by the Studiolo...
utter56.1101,utter,FELL,"And how good of you to remember it. Then, this trip, then, is not a return to America..."
utter56.1102,utter,MRS. PAZZI,"No, this is pleasure..."
utter56.1103,utter,FELL,And what was the trip before...?
utter56.1104,utter,MRS. PAZZI,"That, that was business..."
desc56.1105,desc,,"PAZZI TRIES TO MANEUVER HIS WIFE AWAY FROM FELL. CAMERA TAKES THEM AROUND A CORNER, TO A ""NO PARKING, LOADING ZONE,"" SIGN, IN WHICH WE SEE A POLICE SEDAN, AND ONE OF PAZZI'S MEN. HE IS WEARING THE GIMME HAT PAZZI BROUGHT BACK FROM THE STATES. ANGLE ON FELL, AS HE LOOKS OVER AT THE DRIVER. ANGLE HIS POV. THE HAT, ""FBI INTERNATIONAL POLICE ACADEMY, QUANTICO VIRGINIA."" THE DRIER TAKES OFF THE HAT, AND OPENS THE DOOR TO THE ANGLE, ON FELL, AS HE TAKES HIS LEAVE."
utter56.1106,utter,FELL,"Business. Yes. How much better. To travel for the Pure Enjoyment of the thing, of the variety of the world....yes... (PAUSE) Just to Get Away. (PAUSE) I'm surprised they can spare you, in the midst of your investigation. (PAUSE, PAZZI LOOKS BACK) of the disappearance of my predecessor..."
desc56.1107,desc,,"ANGLE, AS MRS. PAZZI PULLS PAZZI INTO THE CAR."
utter56.1108,utter,MRS. PAZZI,(WHISPERING TO HIM) Take me home and make love to me...
desc56.1109,desc,,"ANGLE, ON FELL, AS PAZZI WAVES TO HIM, THROUGH THE CAR WINDOW GLASS, AND THE CAR PULLS AWAY, LEAVING FELL STANDING IN THE ALLEYWAY. BEAT. HE NODS, AS IF CONFIRMING SOMETHING TO HIMSELF. HE STARTS BACK OUT OF THE ALLEYWAY, INTO THE PRESS OF HUMANITY."
utter56.1110,utter,MAN'S VOICE,(VO) Time to get something to eat...
desc56.1111,desc,,"ON FELL, AS HE LOOKS AFTER THE DEPARTING CAR."
utter56.1112,utter,FELL,"(TO HIMSELF) Yes, quite..."
desc56.1113,desc,,"ANGLE, THE MAN SPEAKING TURNS, AND IS STARTLED TO SEE FELL."
utter56.1114,utter,MAN,I beg your pardon.
utter56.1115,utter,FELL,You suggested it was time to get something good to eat.
utter56.1116,utter,MAN,I thought that you were... (HE SEES ANOTHER MAN APPROACHING HIM) Ah! Where shall we eat...? (THE TWO WALK OFF)
utter56.1117,utter,FELL,(TO HIMSELF) ...where shall we eat. And what shall we eat.
scene57,slugline,,INT PAZZI'S APARTMENT.
desc57.1118,desc,,"HALF SEEN, THROUGH A PANNING SHOT OF A HALFOPEN DOOR, PAZZI AND HIS WIFE MAKING LOVE. WE HEAR PAZZI CALLING:"
utter57.1119,utter,PAZZI,...Laura...Laura...Laura...
desc57.1120,desc,,"ANGLE ON FELL, IN THE SHADOWS, AS HE CLOSES THE FRONT DOOR SOUNDLESSLY BEHIND HIM. HE STANDS FOR A MOMENT, LOOKING, CAMERA THEN TAKES HIM INTO THE APARTMENT WHERE HE FINDS THE KITCHEN. INT THE KITCHEN, FELL TAKES A KNIFE FROM A MAPLE BLOCK, TRIES ITS EDGE, REPLACES IT, TAKES OUT A CLEAVER, AND NODS. HE LOOKS ABOVE, AND TAKES DOWN A COPPER SAUCEPAN FROM THE POT RACK. HE OPENS THE REFRIGERATOR, GLANCES BRIEFLY INSIDE, AND NODS, IN SATISFACTION, AND CLOSES IT. HE PICKS UP A DISHTOWEL, TRIES IT BETWEEN HIS HANDS, TESTING ITS STRENGTH. HE PUTS IT DOWN, DISSATISFIED. HE BEGINS TO PROWL THROUGH THE APARTMENT, HE PASSES ANOTHER HALF OPEN DOOR, AND WE SEE PAZZI AND HIS WIFE, HALF GLIMPSED, BEYOND, FELL MOVES INTO A SMALL STUDY. ANGLE THE BACK OF THE DESK CHAIR, HOLDS A MAN'S SPORTCOAT, AND A TIE. FELL MOVES TOWARD THE CHAIR, PUTS HIS CLEAVER DOWN ON THE DESK, AND TRIES THE TIE BETWEEN HIS HANDS, TESTING HIS STRENGTH. HE NODS, SATISFIED, AND PICKS UP THE CLEANER. ANGLE INS THE CLEANER, WHICH IS LAYING ON TOP OF THE FILE REGARDING THE DISAPPEARANCE OF DOTTORE FANELLI, BENEATH IT, HALF COVERED, IS THE FBI LOGO. WE SEE FELL'S HAND RAISE THE FIRST FILE, TO LOOK AT THE SECOND, AND WE READ: ""FBI REPORT, THE PSYCHOPATHOLOGY, ETC, OF HANNIBAL LECHTER."" ON FELL, AS HE NODS TO HIMSELF, HE THEN LOOKS DOWN AT SOMETHING ELSE. ANGLE HIS POV. A SCARF, PEEPING OUT OF THE HALF-OPEN DESK DRAWER. ANGLE INS. FELL'S HAND DRAWS OUT THE SCARF. NESTLED IN THE SCARF IS THE PHOTO OF PAZZI IN FRONT OF THE WANTED POSTER. ANGLE ON FELL, AS HE LOOKS AT THE PICTURE. HE THEN BEGINS TO PEER VERY CLOSELY AT IT. HE PICKS UP THE MAGNIFYING GLASS FROM THE DESK, AND WE SEE, IN A HUGE INSERT, THAT HE IS MOVING THE MAGNIFYING GLASS TO ATTEMPT TO MAKE OUT THE FIGURE REFLECTED IN THE GLASS COVERING THE WANTED POSTER, ID, THE FIGURE OF THE PHOTOGRAPHER, IS STARLING. INS THE JUST SEEN OUTLINE OF STARLING, HOLDING THE CAMERA. ANGLE FELL, LOOKING AT THE PHOTO. HE THEN GLANCES AT THE SCARF, PICKS IS UP, AND, QUESTIONINGLY, SNIFFS IT ONCE, AND THEN AGAIN. HE HOLDS THE SCARF TO HIS FACE. HE RUBS IT BETWEEN HIS HANDS, AND SMELLS HIS HANDS. ANGLE PAZZI BEDROOM."
utter57.1121,utter,MRS. PAZZI,"...and then, we're going to Greece..."
utter57.1122,utter,PAZZI,"Yes, but the important thing, as I've said..."
utter57.1123,utter,MRS. PAZZI,...get me a cigarette.
desc57.1124,desc,,"PAZZI GETS UP FROM THE BED, AND WRAPS HIMSELF IN A SHEET, AND PROCEEDS INTO THE STUDY."
utter57.1125,utter,PAZZI,"The essential thing. The essential thing, is that we must be absolutely quiet about..."
desc57.1126,desc,,"HE PULLS OPEN THE DESK DRAWER, AND TAKES OUT A PACK OF CIGARETTES. HE LOOKS WONDERINGLY, AT THE DRAWER, BEAT. HE SHRUGS, HE IS ABOUT TO START BACK INTO THE BEDROOM, HE GLANCES AT THE CURTAINS, BLOWING IN THE OPEN WINDOW, HESITATES."
utter57.1127,utter,MRS. PAZZI,...what is it?
desc57.1128,desc,,"HE LOOKS INTO THE DESK, SHAKES HIS HEAD. BEAT. AND THEN RETURNS INTO THE BEDROOM."
utter57.1129,utter,MRS. PAZZI (cont'd),...you've forgotten the cigarettes.
desc57.1130,desc,,"PAZZI TURNS, AND LOOKS BACK TOWARD THE OPEN WINDOW, AND THE BLOWING SHADES."
scene58,slugline,,EXT FLORENTINE PARK NIGHT.
desc58.1131,desc,,"A YOUNG WOMAN WALKS PAST THE CAMERA. SHE TAKES US TO FELL, WHO IS SITTING ACROSS FROM THE STATUE OF THE LION AND THE BIRD, HE IS PICKING HIS TEETH, AND, VERY DELICATELY, TAKES OUT A SCARF, AND WIPES HIS MOUTH. WE SEE IT IS THE SCARF WHICH HE STOLE FROM PAZZI, HE TAKES OUT THE PHOTOGRAPH OF THE WANTED POSTER, AND LOOKS AT IT, AS HE WALKS THROUGH THE PARK. CAMERA TAKES HIM OUT OF THE PARK, PAST THE YOUNG WOMAN, WHO, WE SEE, HAS RETURNED TO A STROLLER, WHICH IS EMPTY, SHE IS TALKING TO A UNIFORMED POLICEMAN, AND GESTURING, ""ABOUT THIS HIGH..."" SHOWING THE HEIGHT OF HER CHILD. HE AND THE WOMAN START LOOKING IN THE BUSHES. ANGLE ON FELL, LEAVING THE PARK, HE WALKS PAST AN APPLIANCE STORE, IN THE WINDOW OF WHICH WE SEE, TEN SILENT TV SCREENS, AND A TALKING HEAD ANNOUNCER. THE SCENE SHIFTS TO THE HELICOPTER FOOTAGE OF STARLING. WE SEE PHOTOS DISPLAYED OF STARLING, NEXT TO THE PEOPLE SHE SHOT IN THE SHOOTOUT, AND A VISBO PROCLAIMS, ""KILLER OF FIVE, THE DEATH ANGEL: CLARICE STARLING."""
scene59,slugline,,"EXT STARLING'S HOUSE, DAY."
desc59.1132,desc,,"STARLING, MAPP, AND JIM, MAPP'S BOYFRIEND, ARE COMING OUT OF THE HOUSE WITH CRAWFORD, ESCORTED TOWARD SEVERAL CARS OF WHAT IS OBVIOUSLY A FUNERAL CORTEGE. A SEDAN PULLS UP, AND KRENDLER GETS OUT."
utter59.1133,utter,KRENDLER,I came to pay my...
utter59.1134,utter,STARLING,"...get outta my way, you sonofabitch..."
utter59.1135,utter,KRENDLER,"I realize, you're under a lot of...."
utter59.1136,utter,STARLING,"You put my friend in the ground, with your mickeymouse TaskForce... Izsat the kind of Headlines that Preserve and Promote, you, sir?"
desc59.1137,desc,,"SHE STARTS PUSHING HIM, AND CAMERA PANS, TO A GROUP OF NEWSVANS, CORDONED OFF, AROUND THE CORNER, AND HELD IN BAY BY VARIOUS POLICE. STARLING IS BEING SUBDUED BY CRAWFORD ET AL."
utter59.1138,utter,STARLING (cont'd),"(AS SHE PUSHES AT KRENDLER) Izzat the kind of publicity will aid Our Run for Congress? You swine, you..."
utter59.1139,utter,KRENDLER,(SHRIEKING AT HER) You're out she's out...
desc59.1140,desc,,"SHE IS BEING DOCILED, AND LED AWAY."
utter59.1141,utter,KRENDLER (cont'd),"(SHOUTING AFTER HER) You country Cornpone BITCH--hey, you Trailer Trash BITCH, you still looking for your Daddy, Beat you up, to show he Loves you?"
desc59.1142,desc,,"ANGLE. ON STARLING, STANDING BY THE LINE OF CARS. SHE SEES SOMETHING, AND TURNS. ANGLE XCU STARLING AS SHE LOOKS. KRENDLER CONTINUES HIS HARANGUE. ANGLE HER POV. ON THE REAR DECK OF A CAR, A STETSON HAT, WITH A BULLET THROUGH IT, AND AN OLD SQUARE POLICEBADGE, WITH A BULLETHOLE THROUGH IT ."
utter59.1143,utter,KRENDLER (cont'd),"(VO) Looking for your Daddy, fuck you and mark you up, an..."
desc59.1144,desc,,"ON STARLING, AS SHE BLINKS, AND SHAKES HER HEAD TO CLEAR IT. THE SEDAN DRIVES OFF, AS SHE STRAINS TO LOOK AFTER IT."
utter59.1145,utter,KRENDLER (cont'd),"Well, here I am, you..."
desc59.1146,desc,,"STARLING SHAKES HER HEAD AGAIN, FINDS HERSELF FACING KRENDLER, AND PUNCHES HIM IN THE STOMACH. KRENDLER GOES DOWN. STARLING IS SUBDUED BY HER COMFORTERS. SHE STRAINS TO LOOK AFTER THE DEPARTING CAR."
scene60,slugline,,INT VERGER'S ROOM.
desc60.1147,desc,,"ON THE TV STARLING, BEING PULLED OFF OF KRENDLER. ANGLE, OVER VERGER, ONTO CORDELL."
utter60.1148,utter,VERGER,"Quod videt monumentum, circumspice. Need I translate?"
utter60.1149,utter,CORDELL,"If you would see him monument, look around you."
utter60.1150,utter,VERGER,Show me the Pigs.
desc60.1151,desc,,"THE VIDEOSCREEN CHANGES, TO SHOW THE PIGS, ATTACKING THE DUMMY MAN."
utter60.1152,utter,CORDELL,"Telephone call. From Switzerland, sir."
desc60.1153,desc,,"VERGER CONVERSES IN GERMAN, WITH THE SWISS. HE IS TOLD THAT THEY CAN HAVE A DATE, AND THAT A PACKAGE WILL BE COMING HIS WAY SOON. ANGLE. ON VERGER, LOOKING AT THE PIGS."
scene61,slugline,,EXT FLORENTINE PALAZZO. NIGHT.
desc61.1154,desc,,"PAZZI, WALKING DOWN THE STREET. NERVOUSLY ADJUSTS HIS SCARF. ANGLE A BRIGAND, LOUNGING BY A VAN, NODS IMPERCEPTIBLY, AT PAZZI, WHO CONTINUES WALKING. THE BRIGAND GOES INTO THE BACK OF THE VAN."
scene62,slugline,,ANGLE INT THE VAN.
desc62.1155,desc,,"THERE IS ANOTHER BRIGAND INSIDE. THERE ARE SEVERAL FIREARMS IN A RACK, AND A HOSPITAL GURNEY WITH HEAVY RESTRAINTS. THE SECOND BRIGAND IS LOADING AN ODD LOOKING SHOULDER WEAPON."
utter62.1156,utter,SECOND BRIGAND,"I hit him with the beanbag gun, you stand by: he's still flopping..."
desc62.1157,desc,,"THE FIRST BRIGAND NODS, AND TAKES A CAPPED HYPODERMIC SYRINGE FROM THE SECOND MAN."
utter62.1158,utter,SECOND BRIGAND (cont'd),"Just make sure he's alive, because I've already spent the bonus..."
desc62.1159,desc,,"THE FRUIT MAN NODS TO THE SECOND, AND WE SEE PAZZI PROCEEDING UP THE STAIRS INTO THE PALAZZO."
scene63,slugline,,"INT A SALON AT THE PALAZZO, NIGHT."
desc63.1160,desc,,"A WORKER IS MOVING A FLOOR POLISHER ACROSS THE MARBLE FLOOR OF THE SALON, IN AN ANTEROOM BEYOND WE HEAR FELL LECTURING. THE WORKER NODS DIFFERENTIALLY, AT SOMEONE OFF SCREEN. WE SEE HE HAS NODDED AT PAZZI, WHO TAKES US TO THE DOOR OF THE SALON. HE WIPES HIS HANDS NERVOUSLY, HE MOPS HIS BROW, HE LOOKS AT HIS WATCH. HE LOOKS INTO THE SALON. ANGLE HIS POV FELL, IN FRONT OF A LECTERN. A SLIDE MACHINE IS SHOWING A PAINTING OF A HANGED FIGURE ON A HUGE DRIPCLOTH AT THE BACK OF THE SALON. ANGLE, ON PAZZI, AS HE MOVES TO THE SIDE, IE, OUT OF THE DOORWAY TO THE SALON, HE GLANCES OVER HIS SHOULDER, TO MAKE SURE HE IS OUT OF THE SIGHT OF THE WORKMAN WITH THE FLOOR POLISHER. HE SEES THE WORKMAN TURN THE POLISHER OFF AND BEGIN COILING THE LONG ELECTRIC CORD. PAZZI TAKES A SMALL FLAT AUTOMATIC FROM A HIP HOLSTER. CHECKS THE CHAMBER, AND SLIPS IT INTO HIS JACKET POCKET. HE PROCEEDS BACK TO THE DOORWAY, WHERE WE AND HE SEE FELL, BEYOND, LECTURING TO A COMPANY OF SIX MEN, IN THE SALON."
utter63.1161,utter,FELL,(LECTURING) Della vigna was disgraced and blinded for his betrayal of his emperor's trust- -through avarice. Avarice and hanging (HE GESTURES TO THE PAINTING) are linked in the ancient and the madeadeval mind.
desc63.1162,desc,,"ANGLE ON PAZZI, AS HANNIBAL (FELL) SPEAKS, HE MOVES TO A WINDOW, AND WIPES HIS HAND AGAIN, AND WE SEE HIM LOOK DOWN AT THE VAN IN THE STREET, AND WIPE HIS HANDS, MUCH OF THIS SPEECH PLAYS AS VOICE-OVER AS HE DOES SO."
utter63.1163,utter,FELL (cont'd),"Judas and Pier Della Vigna are linked in Dante by the avarice he saw in them, and their subsequent deaths by hanging. Ah Commendatore Pazzi..."
desc63.1164,desc,,"ANGLE ON FELL, AS HE SPEAKS TO PAZZI, HALF-SEEN IN THE DOORWAY."
utter63.1165,utter,FELL (cont'd),"You are welcome. Since you are closest to the door, would you close the door, to improve the quality of the image. (PAZZI DOES SO) You will be interested in this, Commandatore, as there are two Pazzi's already in Dante's inferno..."
desc63.1166,desc,,"ANGLE ON FELL, AS HE WALKS FORWARD, BETWEEN THE CHAIRS OF THE SIX OLD MEN (THE STUDIOLO) WHO SIT LISTENING TO HIS LECTURE. A FEW TAKE NOTES."
utter63.1167,utter,FELL (cont'd),"(TO THE OLD MEN) Camicion de Pazzi, as you know, murdered a kinsman, and rests in hell awaiting the arrival of a Second Pazzi. But it's not you: it's Carlino, who will rest forever in hell for the crime of Treachery."
desc63.1168,desc,,"ANGLE XCU, ON FELL, LOOKING AT PAZZI. ANGLE ON PAZZI, UNDER THE WITHERING STARE. BEAT."
utter63.1169,utter,FELL (cont'd),"(AS HE CONTINUES BACK TO HIS LECTERN) Avarice, and Hanging, then. (HE GESTURES TO THE PHOTOGRAPH OF THE PAINTING) On the next occasion, you might like to discuss the matter of Chewing. Chewing in Dante: Count Ugolino, chewing the back of the archbishop's head--Satan, with his three Faces, chewing Judas, Brutus, and Cassius... all three traitors. Is it not? Thank you all for your kind attention."
desc63.1170,desc,,"THE SCHOLARS APPLAUD HIM, TWO STAND, AND TAKE HIM BY THE HAND. ANGLE ON PAZZI AT THE DOOR. HE OPENS THE DOOR, AND THE OLD MEN OF THE STUDIOLO EXIT, CHATTERING HAPPILY ABOUT THE LECTURE. FELL COMES OUT, THE LAST OF THE SALON."
utter63.1171,utter,FELL (cont'd),"Would you say that I've preserved my job, Commendatore?"
utter63.1172,utter,PAZZI,"I'm not a scholar, Dottore. But it seemed as if they, as if they..."
utter63.1173,utter,FELL,"Yes, I think I amused them. To what do I owe...?"
utter63.1174,utter,PAZZI,I require...
utter63.1175,utter,FELL,"...yes, yes, yes..."
desc63.1176,desc,,"HE FOLLOWS FELL BACK INTO THE ROOM, WHERE FELL BEGINS PUTTING AWAY HIS MATERIAL IN THE D1RTY SALON."
utter63.1177,utter,FELL (cont'd),...the effects of my predecessor.
utter63.1178,utter,PAZZI,"I'd like to walk home with you, and..."
utter63.1179,utter,FELL,"Yes, of course, and we'll collect them. I won't be a minute..."
desc63.1180,desc,,"ANGLE ON PAZZI AS HE WALKS UP TOWARD FELL. HE PUTS HIS HAND IN THE JACKET POCKET. ANGLE INS THE HAND, SEEN THROUGH THE CLOTH, GRIPPING THE AUTOMATIC PISTOL."
desc63.1181,desc,,"ON FELL, AS HE BEGINS TO PACK UP THE SLIDE PROJECTOR, AND THEN HESITATES."
utter63.1182,utter,FELL (cont'd),"Ah, no. I should have shown them this one.. (HE TAKES OUT A SLIDE AND PUTS IT IN THE PROJECTOR) This one will interest you: let me see"
desc63.1183,desc,,if I can improve the focus... WE SEE THE IMAGE OF A HANGED MAN APPEAR ON THE DROPCLOTH. THERE IS A PLAQUE DRAPED AROUND THE NECK OF THE HANGED MAN.
utter63.1184,utter,FELL (CONT'D),"Can you make it out, can you make out the name on the plaque?"
desc63.1185,desc,,"FELL WALKS UP TO THE IMAGE DISPLAYED ON THE DROPCLOTH, PAZZI WALKS BEHIND HIM."
utter63.1186,utter,FELL (cont'd),"(LOOKING AT THE IMAGE) It says Pazzi. Pazzi. And a rude, a very rude poem, this is your ancestor. Francesco, hanging outside the Palazzio Vecchio. Outside These Very Windows."
desc63.1187,desc,,"HE TURNS AND FIXES PAZZI WITH HIS GAZE. ANGLE, FELL, HIS FACE SEEN IN THE DARK, IN THE BEAM OF THE SLIDE PROJECTOR. HOLD."
utter63.1188,utter,FELL (cont'd),"On a related subject Signor Pazzi, I must confess to you: I'm giving serious thought to eating your wife."
desc63.1189,desc,,"FELL JERKS THE DROP CLOTH DOWN OVER THE TWO OF THEM. ANGLE XCU, ON PAZZI'S FACE AS HE SEES THE CLOTH COMING DOWN. ANGLE INS HIS HAND, GOING INTO HIS POCKET, AS HE TRIES TO BRING OUT THE PISTOL. ANGLE ON THE FACE OF FELL, AS HE ADVANCES, UNDER THE CLOTH, ON PAZZI, FELL TAKES A SMALL SPONGE AND A BOTTLE FROM HIS POCKET, AND DUMPS LIQUID FROM THE BOTTLE ONTO THE SPONGE, AND GRABS PAZZI BY THE HAIR, PUTS HIM INTO A CHOKEHOLD, AND HOLDS THE SPONGE TO PAZZI'S FACE. ANGLE EXT, THE DROP CLOTH, AS WE SEE THE EFFECTS OF THE STRUGGLE, AND HEAR THE SMALL PISTOL GOING OFF."
scene64,slugline,,ANGLE EXT THE PALAZZO.
desc64.1190,desc,,"THE LAST MEMBER OF THE STUDIOLO, COMING OUT, A WORKMAN FOLLOWS HIM, AND BEGINS LOCKING THE DOOR. ANGLE ON THE BRIGANDS, AT THEIR VAN, THEY LOOK AT EACH OTHER, ONE CHECKS HIS WATCH."
scene65,slugline,,ANGLE INT THE SALON.
desc65.1191,desc,,"THE FLOOR POLISHER. MOVING, AS IF OF ITS OWN VOLITION, ACROSS THE FLOOR."
desc65.1192,desc,,"ON PAZZI, TIED TO THE PODIUM, HIS MOUTH GAGGED. ANGLE ON LECHTER, AS HE COILS UP THE LONG ORANGE CORD OF THE FLOOR POLISHER, DRAWING IT TOWARD HIM."
utter65.1193,utter,FELL (cont'd),"Yes. Your Wife. Laura. L'Orange, which is the topnote of her skin, wouldn't you say? Or do I grow too personal? but that is what I think of, when I think of her. And how could I but think of her? I haven't had a bit all day. The kidney and the liver would be su1table for a dinner tonight. But the rest of the meat should hang for a week, in these cool conditions. Wouldn't you say? Nod once for yes. (PAUSE) If you tell me what I need to know, then it would be convenient for me to leave without my meal. And Mrs. Pazzi will remain unscathed. I'll out the questions to you, and we'll see: I saw at the theatre you had betrayed me. And, when the police didn't come, it was clear you had sold me out. Was it to Mason Verger? Blink one for yes."
desc65.1194,desc,,ANGLE ON PAZZI. BEAT. THEN HE BLINKS ONCE.
utter65.1195,utter,FELL (cont'd),Thank you. And now: Are his hit men waiting outside? (PAZZI BLINKS ONCE) Was that a single blink? Yes. Thank you.
desc65.1196,desc,,"FELL FINISHES HIS COILING OF THE ROPE, AND WE SEE HE HAS FASHIONED A HANGMAN'S NOOSE. FELL TAKES OUT A STILETTO, AND IT OPENS. HE ADVANCES TOWARD PAZZI, WHO TRIES TO RECOIL."
utter65.1197,utter,FELL (cont'd),"No, no. I'm going to take the tape off. Please do not scream. Do you think you can keep from screaming? (HE TAKES THE TAPE OFF) ...would it help if I were to cut your BOWELS OUT...?"
desc65.1198,desc,,"WE SEE HIM MAKE A SWIPE AND HEAR PAZZI START TO SCREAM. FROM OUTSIDE THE WINDOW OF THE SALON, WE SEE PAZZI, TAPED TO THE PODIUM, BEING IMPELLED, SCREAMING, TOWARD THE WINDOW. ANGLE ON THE LIGHTED PIAZZA OF THE PALAZZO, TOURISTS LOOK UP AT THE SCREAMING. BEAT. ANGLE XCU, ON THE CONTORTED FACE OF PAZZI, LOOKING DOWN, AN ORANGE NOOSE AROUND HIS NECK, AS THE PODIUM TILTS THROUGH THE OPEN WINDOW. ANGLE THE TWO BRIGANDS AT THE VAN. REACTION TO THE SOUND OF THE SCREAMING, RUN AROUND THE CORNER. THEY LOOK UP TO SEE PAZZI, STILL TAPES TO THE PODIUM, HANGING BY THE ORANGE CORD. ANGLE, ON THE VILLAINS, STANDING UNDERNEATH, AS GOUTS OF BLOOD FALL ON THEM."
utter65.1199,utter,BRIGAND ONE,"...cover the backdoor. If he comes out, Kill him."
utter65.1200,utter,BRIGAND TWO,...the bonus was for...
utter65.1201,utter,BRIGAND ONE,"Kill him, and cut him."
desc65.1202,desc,,"HE RUNS TO THE FRONT OF THE PALAZZO, HOLDING HIS SHOULDER ARM DOWN ALONGSIDE HIS SIDE. HE RUNS PAST THE LOCKED FRONT DOOR, AND TOWARD AN ALLEYWAY. WE HEAR THE SIRENS OF POLICE CARS. BRIGAND ONE SLOWS HIS WALK, AND PROCEEDS INTO THE ALLEYWAY. HE SEES A SMALL DOOR, IN THE SIDE OF THE PALAZZO, AND A LIGHT BEYOND."
scene66,slugline,,ANGLE INT THE DOOR.
desc66.1203,desc,,"A SMALL STAIRCASE. THE BRIGAND ENTERS, HE LOOKS UP. WE HEAR THE SOUND OF RAPIDLY DESCENDING FOOTSTEPS. THE BRIGAND MOUNTS THE STEPS, HOLDING HIS RIFLE BEFORE HIM. THE SOUND OF THE FOOTSTEPS CONTINUES. ON THE SECOND FLOOR, THE BRIGAND SHELTERS HIMSELF IN A ROOM, OFF THE LANDING. THE SOUND OF THE DESCENDING FOOTSTEPS CONTINUES. ANGLE ON THE BRIGAND, HIDING BEHIND THE DOOR. THEN HE TURNS HIS HEAD. ANGLE, HIS POV. WE ARE IN A LAUNDRY ROOM. THE SOUND OF THE FOOTSTEPS IS, IN FACT, A CLOTHESDRYER. IN ITS GLASS DOOR IN THE SIDE, WE SEE A MAN'S SHOE GOING AROUND. ANGLE THE BRIGAND, AS HE LOOKS, THEN TO THE SIDE. ANGLE, HIS POV, IN THE SIDE OF THE ROOM, THE LEGS OF A DEAD MAN PROTRUDE FROM A CLOTHES HAMPER, HE WEARS ONLY ONE SHOE. ON THE BRIGAND, AS HE TURNS. ANGLE OVER HIM WE SEE HANNIBAL, SMILING, AS HE ADVANCES. ANGLE ON THE STILETTO, AS IT ENTERS THE BRIGAND'S BELLY."
scene67,slugline,,ANGLE EXT THE PALAZZO.
desc67.1204,desc,,"SEVERAL COP CARS PULLING UP, AN AMBULANCE, A NEWSTRUCK. A BOY ON A MOTO."
utter67.1205,utter,HANNIBAL,Young man...
desc67.1206,desc,,THE BOY TURNS. HANNIBAL IS STANDING NEXT TO HIM.
utter67.1207,utter,HANNIBAL (cont'd),"Young man, I am desperate. If I am not at the Piazza Bellosguardo in ten minutes, it is the end of marriage. (HE HANDS A BUNDLE OF NOTES TOWARD THE BOY) Do you think you could help me....?"
desc67.1208,desc,,"IN THE PIAZZA, THE BODY OF PAZZI IS BEING LOWERED, IN THE BG WE SEE HANNIBAL, RIDING ON THE BACK OF THE MOTO, AND AWAY."
scene68,slugline,,"INT VERGER'S ROOM, NIGHT."
desc68.1209,desc,,"A SMALL CHILD IS EATING POPCORN OUT OF A CROCKERY BOWL. WE SEE HIS FACE, SMILING, IN THE GLOW OF A TELEVISION. ANGLE OVER VERGER AND THE CHILD."
utter68.1210,utter,VERGER,...how do you like it?
utter68.1211,utter,CHILD,It's real funny.
desc68.1212,desc,,CORDELL COMES UP HOLDING A PHONE. BEAT.
utter68.1213,utter,VERGER,Tell me the good news.
utter68.1214,utter,CORDELL,He escaped...
utter68.1215,utter,VERGER,Have the child taken to bed.
utter68.1216,utter,CHILD,I wanna see more...
desc68.1217,desc,,"CORDELL PUSHES A BUTTON ON HIS CONSOLE, AND WE SEE, ON THE VIDEO, MONITORS, A NURSE LEAVING THE HALLWAY AND ENTERING VERGER'S ROOM. AS CORDELL TAKES THE CHILD TO HER WE SEE THAT VERGER AND THE CHILD HAVE BEEN WATCHING THE PIGS ATTACK THE MAN-SIZED DUMMY, WHICH THEY NOW DO WITH ALACRITY."
utter68.1218,utter,CORDELL,What do you want me to do?
utter68.1219,utter,VERGER,"Follow Starling, stake out Starling. Increase the pressure on Starling. He will come to her."
scene69,slugline,,INT STARLING'S HOME DAY.
desc69.1220,desc,,"STARLING IS SITTING, AFFECTLESS, IN FRONT OF A FULL CUP OF COFFEE AT HER KITCHEN TABLE. CRAWFORD SITS OPPOSITE HER."
utter69.1221,utter,CRAWFORD,And I brought this for you...
utter69.1222,utter,STARLING,What is it?
desc69.1223,desc,,"HE PRODUCES A SHOEBOX, SHE OPENS IT, IT CONTAINS VARIOUS MEMORABILIA OF BRIGHAM. A PHOTO OF HIM IN THE ARMY, TWO SERVICE PISTOLS, HIS BADGE."
utter69.1224,utter,CRAWFORD,Out of John Brigharn's Locker...
desc69.1225,desc,,SHE NODS.
utter69.1226,utter,CRAWFORD (cont'd),Waal...
utter69.1227,utter,STARLING,I know you did what you could.
desc69.1228,desc,,HE SHRUGS. SHE STARTS TO WALK HER OUT.
utter69.1229,utter,CRAWFORD,I'm going to work for your reinstatement...
utter69.1230,utter,STARLING,Reinstatement to what? There ain't nobody there...
desc69.1231,desc,,"HE OPENS THE DOOR, AND THEY ARE ASSAULTED BY FLASHBULBS, AND A SCAD OF NEWSPEOPLE, WHO HAVE BROKEN THE BONDS, AND ARE PUSHING HER UP TO THE FRONT DOOR."
utter69.1232,utter,NEWSIE,"Starling, Agent Starling: what do you have to say to the New Accusations...?"
utter69.1233,utter,STARLING,New...?
utter69.1234,utter,NEWSIE,You've been accused of...
desc69.1235,desc,,"ANGLE, TELEVISION SET, TRAVEL OFFICE DAY. IT SHOWS STARLING, BEING HOUNDED BY THE NEWSIES."
utter69.1236,utter,NEWSIE (cont'd),"...leaking information to the Press, which resulted in the botched..."
desc69.1237,desc,,"ANGLE, THE STRICKEN FACE OF STARLING."
utter69.1238,utter,SECOND NEWSIE,Agent Starling: what was your reaction to your indictment...?
utter69.1239,utter,BRIGHAM,...indictment...?
utter69.1240,utter,SECOND NEWSIE,The district attorney today...
desc69.1241,desc,,"STARLING AND CRAWFORD LOOK AT EACH OTHER. HE SHEPHERDS HER BACK INTO THE HOUSE. ANGLE A DISGUISED HANNIBAL LECHTER, GOT UP AS A RETIREE, IS SITTING IN AN ENGLISH TRAVEL AGENT'S OFFICE. POSTERS OF TOURS ON THE WALL, A SIGN READING 'BRITTOURS.' AN OLD TRAVEL AGENT IS FILLING OUT FORMS."
utter69.1242,utter,TRAVEL AGENT,"Majorca, Greece.... oh, Aaand Turkey.... Mr. Bates, you're treating yourself to a Holiday you'll remember for..."
desc69.1243,desc,,"SHE LOOKS UP, TO SEE HANNIBAL, LOOKING AT THE TELEVISION. ANGLE HIS POV THE STRICKEN FACE OF STARLING, AS SHE IS SHEPHEARDED BACK INTO HER HOUSE. A TALKING HEAD COMES ON AND SPEAKS WITH A BRITISH ACCENT. TALKING HEAD"
desc69.1244,desc,,THE FOOTAGE COMES ON OF THE GUN BATTLE.
desc69.1245,desc,,Mr. Bates...? Mr. Bates...?
utter69.1246,utter,TALKING HEAD,"Dismissed from the FBI, she, it seems, is under criminal indictment for..."
desc69.1247,desc,,"ANGLE ON HANNIBAL, AS HE TURNS BACK."
utter69.1248,utter,HANNIBAL,"Could I, do you believe, change my Destination...?"
